entry,last_name,first_name,title,publisher,price,format,original_entry,author_name,creators,is_editor,date,catalogue_year,is_net
"Rameau (Jean)--The Old guide (Le Vieux guide). French Trans. by E. S. Hole. Smo. 6 x 4, pp. 48, swd. 8d. net. (Twinline tales for language learners)..HOLERTH PR., May'22",,,French Trans,HOLERTH PR.,,,"Rameau (Jean)--The Old guide (Le Vieux guide). French Trans. by E. S. Hole. Smo. 6 x 4, pp. 48, swd. 8d. net. (Twinline tales for language learners)..HOLERTH PR., May'22",,['Rameau (Jean)--The Old guide (Le Vieux guide)'],,May'22,1922,
"Raphael's Prophetic almanac; or, The Prophetic messenger and weather guide for 1923. By Raphael.” Cr. 8vo. 77 x 4, pp. 126, swd. gd... .. FOULSHAM, Aug. '22",,,"Raphael's Prophetic almanac; or, The Prophetic messenger and weather guide for",FOULSHAM,,8vo.,"Raphael's Prophetic almanac; or, The Prophetic messenger and weather guide for 1923. By Raphael.” Cr. 8vo. 77 x 4, pp. 126, swd. gd... .. FOULSHAM, Aug. '22",,,,Aug. '22,1922,
"Rays of sunlight. Selected by J. E. & H. S. 18mo. 6 X 31, pp. 143, polished Levante 4s. 6d. net. (Quiet hour ser.).. SIMPKIN, Sept. '22",,,Rays of sunlight,SIMPKIN,,18mo.,"Rays of sunlight. Selected by J. E. & H. S. 18mo. 6 X 31, pp. 143, polished Levante 4s. 6d. net. (Quiet hour ser.).. SIMPKIN, Sept. '22",,,,Sept. '22,1922,
"Record Office--Catalogue of MS. and other objects in the Museum. Illus. 9th ed. s. 6d. net.. .H.M.S.O., May'22",,,Record Office--Catalogue of MS,H.M.S.O.,6d.,,"Record Office--Catalogue of MS. and other objects in the Museum. Illus. 9th ed. IS. 6d. net.. .H.M.S.O., May'22",,,,May'22,1922,net
"Record Office-Lists and indexes. No. 47, Chancery proceedings, James 1. Vol. A-K. 50s. net..... .H.M.S.O., July '22",,,Record Office-Lists and indexes,H.M.S.O.,50s.,,"Record Office-Lists and indexes. No. 47, Chancery proceedings, James 1. Vol. A-K. 50s. net..... .H.M.S.O., July '22",,,,July '22,1922,net
"Record Office-Lists and indexes. No. 48, Early Chancery proceedings, vol. 6;.,.30s. net .H.M.S.O., July '22",,,Record Office-Lists and indexes,H.M.S.O.,30s.,,"Record Office-Lists and indexes. No. 48, Early Chancery proceedings, vol. 6;.,.305. net .H.M.S.O., July '22",,,,July '22,1922,net
"Records of the chase, and memoirs of celebrated sportsmen : illustrating some of the usages of olden times and comparing them with pre- vailing customs. Illus. By Cecil. 3rd ed. 8vo, 9 x 51, pp. 302, 12s. 6d. net. P. ALLAN, Oct. '22",,,"Records of the chase, and memoirs of celebrated sportsmen : illustrating some of the usages of olden times and comparing them with pre- vailing customs",P. ALLAN,12s. 6d.,"8vo,","Records of the chase, and memoirs of celebrated sportsmen : illustrating some of the usages of olden times and comparing them with pre- vailing customs. Illus. By Cecil. 3rd ed. 8vo, 9 x 51, pp. 302, 125. 6d. net. P. ALLAN, Oct. '22",,,,Oct. '22,1922,net
"Redcap's annual (The). Roy. 8vo. 101 x 7t, 3s. 6d. net.. EPWORTH PR., Aug. '22",,,Redcap's annual (The),EPWORTH PR.,3s. 6d.,8vo.,"Redcap's annual (The). Roy. 8vo. 101 x 7t, 3s. 6d. net.. EPWORTH PR., Aug. '22",,,,Aug. '22,1922,net
"Reed's Seamanship : for candidates preparing to pass the Marine Board examinations for certi- ficates of competency as Mates and Masters : including answers to shipbuilding questions, Illus. Rev. and enl. by C. M. Swainston. 23rd ed. Cr. 8vo. 7X 5, pp. 511, 6s. 6d. net T. REED, June '22",,,Reed's Seamanship : for candidates preparing to pass the Marine Board examinations for certi- ficates of competency as Mates and Masters : including answers to shipbuilding questions,T. REED,6s. 6d.,8vo.,"Reed's Seamanship : for candidates preparing to pass the Marine Board examinations for certi- ficates of competency as Mates and Masters : including answers to shipbuilding questions, Illus. Rev. and enl. by C. M. Swainston. 23rd ed. Cr. 8vo. 7X 5, pp. 511, 6s. 6d. net T. REED, June '22",,,,June '22,1922,net
"Regimental annual of the Sherwood Foresters, Nottinghamshire and Derbyshire Regiment. Edit. by Col. H. C. Wylly. 81 x 51, pp. 160. 5s. net..... . ALLEN & U., Jan. '22",,,"Regimental annual of the Sherwood Foresters, Nottinghamshire and Derbyshire Regiment",ALLEN & U.,5s.,,"Regimental annual of the Sherwood Foresters, Nottinghamshire and Derbyshire Regiment. Edit. by Col. H. C. Wylly. 81 x 51, pp. 160. 5s. net..... . ALLEN & U., Jan. '22",,,,Jan. '22,1922,net
"Roign of terror (The). By Shemus. 50 cartoons. 131 X 12. (Dublin.): “ FREEMAN'S JNL, Feb. '22",,,Roign of terror (The),FREEMAN'S JNL,,,"Roign of terror (The). By Shemus. 50 cartoons. 131 X 12. (Dublin.): “ FREEMAN'S JNL, Feb. '22",,,,Feb. '22,1922,
"Reparation-Agreement between the Allies for the settlement of certain questions as to the application of the Treaties of Peace, &c. ; 3d. net. ; Financial agreement between Belgium, France, Great Britain, Italy and Japan, Mar., 1922, 3d. net H.M.S.O., Mar. '22",,,"Reparation-Agreement between the Allies for the settlement of certain questions as to the application of the Treaties of Peace, &c",H.M.S.O.,3d.,,"Reparation-Agreement between the Allies for the settlement of certain questions as to the application of the Treaties of Peace, &c. ; 3d. net. ; Financial agreement between Belgium, France, Great Britain, Italy and Japan, Mar., 1922, 3d. net H.M.S.O., Mar. '22",,,,Mar. '22,1922,net
"Reparations Commission-Decision on the subject of the payments to be made by Germany in 1922. 3d. net..... ..H.M.S.O., Feb. '22",,,Reparations Commission-Decision on the subject of the payments to be made by Germany in,H.M.S.O.,3d.,,"Reparations Commission-Decision on the subject of the payments to be made by Germany in 1922. 3d. net..... ..H.M.S.O., Feb. '22",,,,Feb. '22,1922,net
"Reparations Commission-Papers. No. 1, State- ment of Germany's obligations under the heading of reparations, etc., at Apr. 30, 1922. net.. .H.M.S.O., Nov. '22",,,Reparations Commission-Papers,H.M.S.O.,,,"Reparations Commission-Papers. No. 1, State- ment of Germany's obligations under the heading of reparations, etc., at Apr. 30, 1922. net.. .H.M.S.O., Nov. '22",,,,Nov. '22,1922,
"Roturn of Alfred (The). By the author of “ Patri- cia Brent, Spinster.” år. 8vo. 74 X 5, pp. 320, 78. 6d. net.. .H. JENKINS, Apr. '22",,,Roturn of Alfred (The),H. JENKINS,6d.,8vo.,"Roturn of Alfred (The). By the author of “ Patri- cia Brent, Spinster.” år. 8vo. 74 X 5, pp. 320, 78. 6d. net.. .H. JENKINS, Apr. '22",,,,Apr. '22,1922,net
"Roturn of Christendom (The). By a Group of Churchmen. Intro. by Bishop Gore, and an epilogue by G. J. Chesterton. 8vo. 8xşt, pp. 251, 75, 6d. net....ALLEN & U., Oct. '22",,,Roturn of Christendom (The),ALLEN & U.,6d.,8vo.,"Roturn of Christendom (The). By a Group of Churchmen. Intro. by Bishop Gore, and an epilogue by G. J. Chesterton. 8vo. 8xşt, pp. 251, 75, 6d. net....ALLEN & U., Oct. '22",,,,Oct. '22,1922,net
"Revelation of St. John, Tomlinson (1. C.) 15s. net.. July '23 Religious Tract Society-Round the world with the printed page : the 123rd annual report of the R. T. S., 1922. 87 x 54, pp. 97. R.I.S., Oct. '22",,,Revelation of St,R.I.S.,,,"Revelation of St. John, Tomlinson (1. C.) 155. net.. July '23 Religious Tract Society-Round the world with the printed page : the 123rd annual report of the R. T. S., 1922. 87 x 54, pp. 97. R.I.S., Oct. '22",,,,Oct. '22,1922,
"Revelations of a spirit medium. Facsimile ed., with notes, bibliography, glossary and index, Harry Price and Eric J. Dingivall. 8vo. 8} x 5}, pp. 388, 78. 6d. net ......K. PAUL, Apr. 22",,,Revelations of a spirit medium,K. PAUL,6d.,8vo.,"Revelations of a spirit medium. Facsimile ed., with notes, bibliography, glossary and index, Harry Price and Eric J. Dingivall. 8vo. 8} x 5}, pp. 388, 78. 6d. net ......K. PAUL, Apr. 22",,,,Apr. 22,1922,net
"Revenue and expenditure (England, Scotland and Ireland)-Return, 1920-21. 6d. net H.M.S.O., Feb.' 22",,,Return,H.M.S.O.,6d.,,"Revenue and expenditure (England, Scotland and Ireland)-Return, 1920-21. 6d. net H.M.S.O., Feb.' 22",,"['Revenue', 'expenditure (England, Scotland)', 'Revenue', 'expenditure (Ireland)']",,Feb.' 22,1922,net
"6d. net H.M.S.O., Mar.'22",,,,H.M.S.O.,6d.,,"6d. net H.M.S.O., Mar.'22",,,,Mar.'22,1922,net
"Rhetorloguo (The); or, The Study of the rhetor or orator. By I. Demosthenes. 8vo. 81 X 51, pp. 651, 18s. 6d. net .SIMPKIN, Oct. '22",,,"Rhetorloguo (The); or, The Study of the rhetor or orator",SIMPKIN,18s. 6d.,8vo.,"Rhetorloguo (The); or, The Study of the rhetor or orator. By I. Demosthenes. 8vo. 81 X 51, pp. 651, 18s. 6d. net .SIMPKIN, Oct. '22",,,,Oct. '22,1922,net
"Ride-a-cock-horse. Roy. 8vo., bds. 1s. (Play- time story books) ..DEAN, June '22",,,Ride-a-cock-horse,DEAN,1s.,8vo.,"Ride-a-cock-horse. Roy. 8vo., bds. Is. (Play- time story books) ..DEAN, June '22",,,,June '22,1922,
"Rigveda Brahmanas : the Aitareya and Kausitaki Brahmanas of the Rigveda. Trans. from the original Sanskrit by Arthur Berriedale Keith. 101 x 71, pp. 567, 228. 6d. net. (Harvard Univ. Pr.) MILFORD, Aug. '22",,,Rigveda Brahmanas : the Aitareya and Kausitaki Brahmanas of the Rigveda,MILFORD,,,"Rigveda Brahmanas : the Aitareya and Kausitaki Brahmanas of the Rigveda. Trans. from the original Sanskrit by Arthur Berriedale Keith. 101 x 71, pp. 567, 228. 6d. net. (Harvard Univ. Pr.) MILFORD, Aug. '22",,,,Aug. '22,1922,
"Ripon Diocesan calendar, 1922. Edit. by Rev. H. W. Orgill. Cr. 8vo. 7*X4*, pp. i6o, swd. s. 6d. R. JACKSON ; SIMPKIN, June '22",,,Ripon Diocesan calendar,SIMPKIN,,8vo.,"Ripon Diocesan calendar, 1922. Edit. by Rev. H. W. Orgill. Cr. 8vo. 7*X4*, pp. i6o, swd. IS. 6d. R. JACKSON ; SIMPKIN, June '22",,,,June '22,1922,
" Rita (Mrs. Desmond Humphreys)-Con- jugal rights, and other stories. Cr. 8vo, 78 X 5, pp, 288, 7s. 6d. net. HUTCHINSON, Dec. '22",,,Rita (Mrs,HUTCHINSON,7s. 6d.,"8vo,"," Rita (Mrs. Desmond Humphreys)-Con- jugal rights, and other stories. Cr. 8vo, 78 X 5, pp, 288, 75. 6d. net. HUTCHINSON, Dec. '22",,,,Dec. '22,1922,net
"“ Rita _The Road to anywhere. Cr. 8vo. 7! X 5, pp. 318, 78. 6d. net HUTCHINSON, Mar. '22",,,Rita _The Road to anywhere,HUTCHINSON,6d.,8vo.,"“ Rita _The Road to anywhere. Cr. 8vo. 7! X 5, pp. 318, 78. 6d. net HUTCHINSON, Mar. '22",,,,Mar. '22,1922,net
"Robinson (Theodore H.)—St. Mark's life of Jesus. With foreword by James Moffatt. Cr. 8vo. 78 x 5, pp. 134, 4s. net; swd., 2s. 6d. net. STUDENT CHRISTIAN MOVEMENT, Aug. '22",,,Robinson (Theodore H.)—St,STUDENT CHRISTIAN MOVEMENT,2s. 6d.,8vo.,"Robinson (Theodore H.)—St. Mark's life of Jesus. With foreword by James Moffatt. Cr. 8vo. 78 x 5, pp. 134, 4s. net; swd., 25. 6d. net. STUDENT CHRISTIAN MOVEMENT, Aug. '22",,,,Aug. '22,1922,net
"5s. net Rogers Clement F., Rev.)-Question time in Hyde Park. Series 4, Christianity in history. Cr. 8vo. 63 x 41, pp. 63, swd. 8d. net. S.P.C.K., Aug. '22",,,,S.P.C.K.,8d.,8vo.,"55. net Rogers Clement F., Rev.)-Question time in Hyde Park. Series 4, Christianity in history. Cr. 8vo. 63 x 41, pp. 63, swd. 8d. net. S.P.C.K., Aug. '22",,,,Aug. '22,1922,net
"Romance of Mary Ann (The). Cr. 8vo. 74 x 5, pp. 118, 39. 6d. net HEATH, CRANTON, June '22",,,Romance of Mary Ann (The),"HEATH, CRANTON",6d.,8vo.,"Romance of Mary Ann (The). Cr. 8vo. 74 x 5, pp. 118, 39. 6d. net HEATH, CRANTON, June '22",,,,June '22,1922,net
"K. PAUL, Jan. '22 Rooney (A.B.)—Teddy's ship, 18. net. (Young folks' lib) BLACKIE, July '22",,,"K. PAUL, Jan",BLACKIE,,,"K. PAUL, Jan. '22 Rooney (A.B.)—Teddy's ship, 18. net. (Young folks' lib) BLACKIE, July '22",,,,July '22,1922,
"Roscoe (Theodora)- Romances of old Bucking- hamshire. 74 x 5, PP. 48, swd. is. net. Uxbridge) King & HUTCHINGS, June '22",,,Roscoe (Theodora)- Romances of old Bucking- hamshire,HUTCHINGS,,,"Roscoe (Theodora)- Romances of old Bucking- hamshire. 74 x 5, PP. 48, swd. is. net. Uxbridge) King & HUTCHINGS, June '22",,,,June '22,1922,
"Roscoe's Digest of the law of evidence. 19th ed., by James S. Henderson. (In 2 vols.) Vol. i. 8*X6, pp. 2,014, 63s. net. STEVENS; SWEET & M., June '22",,,Roscoe's Digest of the law of evidence,SWEET & M.,,,"Roscoe's Digest of the law of evidence. 19th ed., by James S. Henderson. (In 2 vols.) Vol. i. 8*X6, pp. 2,014, 635. net. STEVENS; SWEET & M., June '22",,,,June '22,1922,
"new 45s. net Rose (J. Holland)— Lord Hood and the defence of Toulon. 9 X 51, pp. 182, 16s. net CAMB. UNIV. PR., Mar.'22",,,45s,CAMB. UNIV. PR.,16s.,,"new 45s. net Rose (J. Holland)— Lord Hood and the defence of Toulon. 9 X 51, pp. 182, 16s. net CAMB. UNIV. PR., Mar.'22",,,,Mar.'22,1922,net
"Rosebud annual (The). Illus. Roy. 8vo. 98 x 7, pp. 190, 5s. net ...J. CLARKE, Oct. '22",,,Rosebud annual (The),J. CLARKE,5s.,8vo.,"Rosebud annual (The). Illus. Roy. 8vo. 98 x 7, pp. 190, 5s. net ...J. CLARKE, Oct. '22",,,,Oct. '22,1922,net
"Roumania-Economic conditions, April, 1922. 28. net.... ...H.M.S.O., June '22",,,"Roumania-Economic conditions, April",H.M.S.O.,,,"Roumania-Economic conditions, April, 1922. 28. net.... ...H.M.S.O., June '22",,,,June '22,1922,
"Royal Academy Illustrated, 1922. 94x71, pp. 128, 3s. 6d. .W. JUDD, May '22",,,Royal Academy Illustrated,W. JUDD,3s. 6d.,,"Royal Academy Illustrated, 1922. 94x71, pp. 128, 35. 6d. .W. JUDD, May '22",,,,May '22,1922,
"Royal blue book, Court and Parliamentary Guide. May ed., 1922. Cr. 8vo. 7X5, pp. 1,631, ros. 6d. net.. KELLY'S DIRECTORIES, May '22",,,"Royal blue book, Court and Parliamentary Guide",KELLY'S DIRECTORIES,6d.,8vo.,"Royal blue book, Court and Parliamentary Guide. May ed., 1922. Cr. 8vo. 7X5, pp. 1,631, ros. 6d. net.. KELLY'S DIRECTORIES, May '22",,,,May '22,1922,net
"Royal blue book Court and Parliamentary guide, 1923. Cr. 8vo, 7 X 5, pp. 1,446, 78. 6d. net. SIMPKIN, Dec. '22",,,Royal blue book Court and Parliamentary guide,SIMPKIN,6d.,"8vo,","Royal blue book Court and Parliamentary guide, 1923. Cr. 8vo, 7 X 5, pp. 1,446, 78. 6d. net. SIMPKIN, Dec. '22",,,,Dec. '22,1922,net
"Royal chronicle of Abyssinia (The), 1769–1840. With trans. and notes by H. Weld Blundell. 4to, pp. 543, 50s. net. CAMB. UNIV. PR., Dec. '22",,,Royal chronicle of Abyssinia (The),CAMB. UNIV. PR.,50s.,"4to,","Royal chronicle of Abyssinia (The), 1769–1840. With trans. and notes by H. Weld Blundell. 4to, pp. 543, 50s. net. CAMB. UNIV. PR., Dec. '22",,,,Dec. '22,1922,net
"Royal Society of South Africa-Transactions. Vol. 10, pt. 2. Illus. Roy. 8vo. 10 X 7, swd. 6s. 6d. net ..WHELDON & WESLEY, May'22",,,Royal Society of South Africa-Transactions,WHELDON & WESLEY,6s. 6d.,8vo.,"Royal Society of South Africa-Transactions. Vol. 10, pt. 2. Illus. Roy. 8vo. 10 X 7, swd. 6s. 6d. net ..WHELDON & WESLEY, May'22",,,,May'22,1922,net
"Royal Society of South Africa-Transactions. Vol. 10, pt. 4. Plates and engravings. Roy. 8vo, 10x77, pp. 96, 15s. net. WHELDON & WESLEY, Dec. '22",,,Royal Society of South Africa-Transactions,WHELDON & WESLEY,15s.,"8vo,","Royal Society of South Africa-Transactions. Vol. 10, pt. 4. Plates and engravings. Roy. 8vo, 10x77, pp. 96, 155. net. WHELDON & WESLEY, Dec. '22",,,,Dec. '22,1922,net
"4s. net.. 2S..... Royce (Marjory)—The Unwilling schoolgirl. Čr. 8vo. 71x41, pp. 327, 2s. 6d. net. (Girl's new lib.) . MILFORD, Sept. '22",,,,MILFORD,,8vo.,"4s. net.. 2IS..... Royce (Marjory)—The Unwilling schoolgirl. Čr. 8vo. 71x41, pp. 327, 25. 6d. net. (Girl's new lib.) . MILFORD, Sept. '22",,,,Sept. '22,1922,
"Rubber producing companies : with list of directors and secretaries. Compiled by the Mincing Lane Tea and Rubber Share Brokers' Assoc., Ltd. Toth ed. 8vo. 81 x 51, pp. 670, 75 6d..... FINANCIAL TIMES, Oct, '22",,,Rubber producing companies : with list of directors and secretaries,FINANCIAL TIMES,6d.,8vo.,"Rubber producing companies : with list of directors and secretaries. Compiled by the Mincing Lane Tea and Rubber Share Brokers' Assoc., Ltd. Toth ed. 8vo. 81 x 51, pp. 670, 75 6d..... FINANCIAL TIMES, Oct, '22",,,,"Oct, '22",1922,
"Rubber situation in British colonies and pro- tectorates : report of Ctte. 3d. net. H.M.S.O., July '22",,,Rubber situation in British colonies and pro- tectorates : report of Ctte,H.M.S.O.,3d.,,"Rubber situation in British colonies and pro- tectorates : report of Ctte. 3d. net. H.M.S.O., July '22",,,,July '22,1922,net
"Rubber situation in British colonies and pro- tectorates : supplementary report, 3d. net. H.M.S.O., Nov. '22",,,Rubber situation in British colonies and pro- tectorates : supplementary report,H.M.S.O.,3d.,,"Rubber situation in British colonies and pro- tectorates : supplementary report, 3d. net. H.M.S.O., Nov. '22",,,,Nov. '22,1922,net
"Ruff's Guide to the Turf. Winter ed., 1921. 8vo. 81 x 51, pp. 670, 15s. RUFF'S GUIDE, Jan. '22",,,Ruff's Guide to the Turf,RUFF'S GUIDE,15s.,8vo.,"Ruff's Guide to the Turf. Winter ed., 1921. 8vo. 81 x 51, pp. 670, 155. RUFF'S GUIDE, Jan. '22",,,,Jan. '22,1922,
"Ruff's Guide to the Turf. Spring ed., 1922. 8vo. 81 X 54, pp. 736, 15s. net RUFF'S GUIDE, 4 pr.'22",,,Ruff's Guide to the Turf,RUFF'S GUIDE,15s.,8vo.,"Ruff's Guide to the Turf. Spring ed., 1922. 8vo. 81 X 54, pp. 736, 155. net RUFF'S GUIDE, 4 pr.'22",,,,4 pr.'22,1922,net
"Rule Margie Callander)--Poems. Cr. 8vo. 71 X 5, pp. 44, 2s. 6d. net. . MORLAND, Apr. 22",,,Rule Margie Callander)--Poems,MORLAND,2s. 6d.,8vo.,"Rule Margie Callander)--Poems. Cr. 8vo. 71 X 5, pp. 44, 25. 6d. net. . MORLAND, Apr. 22",,,,Apr. 22,1922,net
"Rummy tales. box 2s. net.. WARNE, Nov. '22",,,Rummy tales,WARNE,2s.,,"Rummy tales. box 25. net.. WARNE, Nov. '22",,,,Nov. '22,1922,net
"Russian States (The): a description of the various political units existing on Russian territory. With 2 maps, swd, ed. net. .H.M.S.O., Feb. '22",,,Russian States (The): a description of the various political units existing on Russian territory,H.M.S.O.,,,"Russian States (The): a description of the various political units existing on Russian territory. With 2 maps, swd, ed. net. .H.M.S.O., Feb. '22",,,,Feb. '22,1922,
"Sadhu Sundar Singh-At the Master's feet. Trans. from the Urdu by Rev. Arthur and Mrs. Parker. 73 x 5, pp. 75, swd. is. net. CHRISTIAN LITER. Soc. FOR INDIA, Aug. '22",,,Sadhu Sundar Singh-At the Master's feet,FOR INDIA,,,"Sadhu Sundar Singh-At the Master's feet. Trans. from the Urdu by Rev. Arthur and Mrs. Parker. 73 x 5, pp. 75, swd. is. net. CHRISTIAN LITER. Soc. FOR INDIA, Aug. '22",,,,Aug. '22,1922,
"St. Andrew's Institute for Clinical Research- Reports. Vol. 1. Ryl. 8vo. Ios. 6d. net MILFORD, May'22",,,St,MILFORD,6d.,8vo.,"St. Andrew's Institute for Clinical Research- Reports. Vol. 1. Ryl. 8vo. Ios. 6d. net MILFORD, May'22",,,,May'22,1922,net
"St. Edmundsbury and Ipswich Diocesan calendar and clergy list, 1922. Cr. 8vo. 71 X 4*, pp. 200, swd. 28. net .. SIMPKIN, Jan.' .'22",,,St,SIMPKIN,,8vo.,"St. Edmundsbury and Ipswich Diocesan calendar and clergy list, 1922. Cr. 8vo. 71 X 4*, pp. 200, swd. 28. net .. SIMPKIN, Jan.' .'22",,,,Jan.' .'22,1922,
"St. Helena-Colonial report, 1921. 6d. net. H.M.S.O., Nov. '22",,,St,H.M.S.O.,6d.,,"St. Helena-Colonial report, 1921. 6d. net. H.M.S.O., Nov. '22",,,,Nov. '22,1922,net
"St. Vincent-Colonial report, 1921. 6d. net. H.M.S.O., Nov. '22",,,St,H.M.S.O.,6d.,,"St. Vincent-Colonial report, 1921. 6d. net. H.M.S.O., Nov. '22",,,,Nov. '22,1922,net
"Saint Wilfred's mass book. With supplementary hymns. 5X 38, pp. 56, 1s. Soc. OF SS. PETER AND PAUL, July '22",,,Saint Wilfred's mass book,OF SS. PETER AND PAUL,,,"Saint Wilfred's mass book. With supplementary hymns. 5X 38, pp. 56, Is. Soc. OF SS. PETER AND PAUL, July '22",,,,July '22,1922,
"Sama-Veda Samhita. In Sanskrit, with Com- mentary by S. C. Roy. Part I., Agreya Parva. 8v0., pp. 177, swd. 2s. 6d. . . . . LUZAC, June '22",,,Sama-Veda Samhita,LUZAC,2s. 6d.,,"Sama-Veda Samhita. In Sanskrit, with Com- mentary by S. C. Roy. Part I., Agreya Parva. 8v0., pp. 177, swd. 2s. 6d. . . . . LUZAC, June '22",,,,June '22,1922,
"Sankhayana Aranyaka (The). In Sanskrit. Roy. 8vo., pp. 48, bds. is. 6d. (Anandasrama Sanskrit ser.)... LUZAC, Oct. '22",,,Sankhayana Aranyaka (The),LUZAC,6d.,8vo.,"Sankhayana Aranyaka (The). In Sanskrit. Roy. 8vo., pp. 48, bds. is. 6d. (Anandasrama Sanskrit ser.)... LUZAC, Oct. '22",,,,Oct. '22,1922,
"Santideva—Siksha-Samuccaya : a compendium of Buddhist doctrine. Trans. from the Sanskrit by Cecil Bendall and W. H. D. Rouse. 93x61, Pp. 335, 215, net... . MURRAY, Jan. '22",,,Santideva—Siksha-Samuccaya : a compendium of Buddhist doctrine,MURRAY,,,"Santideva—Siksha-Samuccaya : a compendium of Buddhist doctrine. Trans. from the Sanskrit by Cecil Bendall and W. H. D. Rouse. 93x61, Pp. 335, 215, net... . MURRAY, Jan. '22",,,,Jan. '22,1922,
"Satelites : five short sketches; by K. P. L. 71 x 5, pp. 31, 2s. net..........STOCKWELL, July '22",,,Satelites : five short sketches; by K. P. L,STOCKWELL,2s.,,"Satelites : five short sketches; by K. P. L. 71 x 5, pp. 31, 2s. net..........STOCKWELL, July '22",,,,July '22,1922,net
"Savings banks and friendly societies-Funds (National Debt) account, 1919. 20. net. H.M.S.O., June '22",,,Savings banks and friendly societies-Funds (National Debt) account,H.M.S.O.,,,"Savings banks and friendly societies-Funds (National Debt) account, 1919. 20. net. H.M.S.O., June '22",,,,June '22,1922,
"Savory's Insurance share annual, June, 1922 8vo. 81 X 31, pp. 87, swd. 5s. net SKINNER, June '22",,,"Savory's Insurance share annual, June",SKINNER,5s.,8vo.,"Savory's Insurance share annual, June, 1922 8vo. 81 X 31, pp. 87, swd. 5s. net SKINNER, June '22",,,,June '22,1922,net
"School girl's annua! (The), Edit. by Flora Klickmann. Folio, ritx 84, pp. 128, 3s. 6d. net .R.T.S., Sept. '22",,,"School girl's annua! (The), Edit",R.T.S.,3s. 6d.,,"School girl's annua! (The), Edit. by Flora Klickmann. Folio, ritx 84, pp. 128, 35. 6d. net .R.T.S., Sept. '22",,,,Sept. '22,1922,net
"C. LETTS, Sept. '22",,,,C. LETTS,,,"C. LETTS, Sept. '22",,,,Sept. '22,1922,
"Schoolmasters' yearbook and educational direc- tory, 1922. Cr. 8vo. 71 X 41, pp. 1,228, 40s. net. . . DEANE, Apr. '22",,,Schoolmasters' yearbook and educational direc- tory,DEANE,40s.,8vo.,"Schoolmasters' yearbook and educational direc- tory, 1922. Cr. 8vo. 71 X 41, pp. 1,228, 40s. net. . . DEANE, Apr. '22",,,,Apr. '22,1922,net
"Science and Technology (Imperial College of) -- 14th annual report, 1920-21. s. 6d. net. H.M.S.O., Mar. '22",,,,H.M.S.O.,6d.,,"Science and Technology (Imperial College of) -- 14th annual report, 1920-21. IS. 6d. net. H.M.S.O., Mar. '22",,"['Science', 'Technology (Imperial College of)']",,Mar. '22,1922,net
"Science Museum-Catalogue of the collections in aeronautics with descriptive and historical notes and illus. 1s. 6d. net. H.M.S.O., May '22",,,Science Museum-Catalogue of the collections in aeronautics with descriptive and historical notes and illus,H.M.S.O.,1s. 6d.,,"Science Museum-Catalogue of the collections in aeronautics with descriptive and historical notes and illus. Is. 6d. net. H.M.S.O., May '22",,,,May '22,1922,net
"Science Museum--Meteorology : catalogue of the collections, with descriptive and historical notes and illus. 1s. 6d. net H.M.S.O., Aug. '22",,,"Science Museum--Meteorology : catalogue of the collections, with descriptive and historical notes and illus",H.M.S.O.,1s. 6d.,,"Science Museum--Meteorology : catalogue of the collections, with descriptive and historical notes and illus. Is. 6d. net H.M.S.O., Aug. '22",,,,Aug. '22,1922,net
"Science, Teaching of general, Eikenberry (W. L.) 12s, net .May ' Scientific and Industrial Research (Dept. of)- Adhesives Research Ctte. 1st report. H.M.S.O., May'22",,,"Science, Teaching of general, Eikenberry (W. L.)",H.M.S.O.,,,"Science, Teaching of general, Eikenberry (W. L.) I2s, net .May ' Scientific and Industrial Research (Dept. of)- Adhesives Research Ctte. Ist report. H.M.S.O., May'22",,,,May'22,1922,
"Scientific and Industrial Research (Dept. of)-- Experimental cottages, Amesbury, Wiltshire. 5s. net .H.M.S.O., Mar. '22",,,Scientific and Industrial Research (Dept,H.M.S.O.,5s.,,"Scientific and Industrial Research (Dept. of)-- Experimental cottages, Amesbury, Wiltshire. 55. net .H.M.S.O., Mar. '22",,,,Mar. '22,1922,net
"Scientific and Industrial Research (Dept. of)- Report of the Ctte. of the Privy Council, 1921-22. 3s. net ......H.M.S.O., Sept. '22",,,Scientific and Industrial Research (Dept,H.M.S.O.,3s.,,"Scientific and Industrial Research (Dept. of)- Report of the Ctte. of the Privy Council, 1921-22. 35. net ......H.M.S.O., Sept. '22",,,,Sept. '22,1922,net
"Scientific and Industrial Research (Dept. of)- Tables of the incomplete Gamma-function. 42s. net.... .H.M.S.O., Aug. '22",,,Scientific and Industrial Research (Dept,H.M.S.O.,42s.,,"Scientific and Industrial Research (Dept. of)- Tables of the incomplete Gamma-function. 425. net.... .H.M.S.O., Aug. '22",,,,Aug. '22,1922,net
"Scientific and Industrial Research (Dept. of)- Tin and Tungsten Research Board : Report. 3s. 6d. net........ ..H.M.S.O., Nov. '22",,,Scientific and Industrial Research (Dept,H.M.S.O.,3s. 6d.,,"Scientific and Industrial Research (Dept. of)- Tin and Tungsten Research Board : Report. 35. 6d. net........ ..H.M.S.O., Nov. '22",,,,Nov. '22,1922,net
"Scotland-Report on Fees Exigible in the Courts of Session and Justiciary and in the Sheriff Courts. Part 1, Fees in Sheriff Courts. 1s. 3d. net H.M.S.O., Feb. 22",,,Scotland-Report on Fees Exigible in the Courts of Session and Justiciary and in the Sheriff Courts,H.M.S.O.,1s. 3d.,,"Scotland-Report on Fees Exigible in the Courts of Session and Justiciary and in the Sheriff Courts. Part 1, Fees in Sheriff Courts. Is. 3d. net H.M.S.O., Feb. 22",,,,Feb. 22,1922,net
"Scottish Communion Office, 1764. With intro., &c., by John Dowden. New ed., by H. A. Wilson. 8vo., pp. 273, 14s. net.... ... MILFORD, Feb.'22",,,Scottish Communion Office,MILFORD,14s.,8vo.,"Scottish Communion Office, 1764. With intro., &c., by John Dowden. New ed., by H. A. Wilson. 8vo., pp. 273, 145. net.... ... MILFORD, Feb.'22",,,,Feb.'22,1922,net
