entry,last_name,first_name,title,publisher,price,format,original_entry,author_name,creators,is_editor,date,catalogue_year,is_net
"ABC of Gardening: Book of Practical Hints, by a Practical Gardener. 16mo. 54 × 4, pp. 126, 18. DRANE, Apr. 02",,,"ABC of Gardening: Book of Practical Hints, by a Practical Gardener",DRANE,,16mo.,"ABC of Gardening: Book of Practical Hints, by a Practical Gardener. 16mo. 54 × 4, pp. 126, 18. DRANE, Apr. 02",,,,Apr. 02,1902,
"A B C of Swimming: Royal Road to the Art. By Ex-Club Captain. 12mo. 5 × 4, pp. 84, 1s. DRANE, July 02",,,A B C of Swimming: Royal Road to the Art,DRANE,1s.,12mo.,"A B C of Swimming: Royal Road to the Art. By Ex-Club Captain. 12mo. 5 × 4, pp. 84, 1s. DRANE, July 02",,,,July 02,1902,
"ABC Pocket Atlas Guide to London. Corona- tion Year ed. 12mo. limp, 1s. G. PHILIP, May 02",,,ABC Pocket Atlas Guide to London,G. PHILIP,1s.,12mo.,"ABC Pocket Atlas Guide to London. Corona- tion Year ed. 12mo. limp, 1s. G. PHILIP, May 02",,,,May 02,1902,
"ABC-The Churchman's: a Guide to Church Doctrine and Ritual. Ch. ed. 12mo. 67 × 4, pp. 128, limp, 1s. .......NISBET, Oct. 02",,,ABC-The Churchman's: a Guide to Church Doctrine and Ritual,NISBET,1s.,12mo.,"ABC-The Churchman's: a Guide to Church Doctrine and Ritual. Ch. ed. 12mo. 67 × 4, pp. 128, limp, 1s. .......NISBET, Oct. 02",,,,Oct. 02,1902,
"Academy Notes, 1902. Originated by Henry Blackburn. 8vo. swd. 1s. SKEFFINGTON, May 02",,,Academy Notes,SKEFFINGTON,1s.,8vo.,"Academy Notes, 1902. Originated by Henry Blackburn. 8vo. swd. 1s. SKEFFINGTON, May 02",,,,May 02,1902,
"Academy Pictures and New Gallery, 1902. Roy. 8vo. 28.; swd. 1s. 'ART JOURNAL' OFFICE, May 02",,,Academy Pictures and New Gallery,ART JOURNAL' OFFICE,,8vo.,"Academy Pictures and New Gallery, 1902. Roy. 8vo. 28.; swd. 1s. 'ART JOURNAL' OFFICE, May 02",,,,May 02,1902,
"Acts relating to the Supply of Gas and Water by Companies & Local Authorities. Comp. by Jos. Reeson. 8vo. 218. net ...BUTTERWORTH, Oct. 02",,,Acts relating to the Supply of Gas and Water by Companies & Local Authorities,BUTTERWORTH,,8vo.,"Acts relating to the Supply of Gas and Water by Companies & Local Authorities. Comp. by Jos. Reeson. 8vo. 218. net ...BUTTERWORTH, Oct. 02",,,,Oct. 02,1902,
"Adams (Bertha Jane)-see Adams (Mrs. Leith-) Adams (C. C.)-Text-book of Commercial Geo- graphy. Cr. 8vo. 58. net ...HIRSCHFELD, Feb. 02",,,Adams (C. C.)-Text-book of Commercial Geo- graphy,HIRSCHFELD,,8vo.,"Adams (Bertha Jane)-see Adams (Mrs. Leith-) Adams (C. C.)-Text-book of Commercial Geo- graphy. Cr. 8vo. 58. net ...HIRSCHFELD, Feb. 02",,['Adams (Bertha Jane)-see Adams (Mrs. Leith-)'],,Feb. 02,1902,
"Adderley (J. G.), Marson (C. L.)-Third Orders: a Transl. of an Ancient Rule of the Tertiaries, together with an Account of some modern Third Orders, Two Sermons on St. Francis, and an Article on the Religious Life. 12mo. 68 x 4, pp. 94, 1s. net …………….MOWBRAY, July 02",,,Third Orders: a Transl,MOWBRAY,,12mo.,"Adderley (J. G.), Marson (C. L.)-Third Orders: a Transl. of an Ancient Rule of the Tertiaries, together with an Account of some modern Third Orders, Two Sermons on St. Francis, and an Article on the Religious Life. 12mo. 68 x 4, pp. 94, 1s. net …………….MOWBRAY, July 02",,"['Adderley (J. G.), Marson (C. L.)']",,July 02,1902,
"Adrien Burnaby, Thief. 16mo. swd. 1s. net DANVERS, Dec. 02",,,"Adrien Burnaby, Thief",DANVERS,1s.,16mo.,"Adrien Burnaby, Thief. 16mo. swd. 1s. net DANVERS, Dec. 02",,,,Dec. 02,1902,net
"Eschylus-Prometheus Bound. Rendered into English Verse by E. R. Bevan. 4to. 5s. net NUTT, June 02",,,Eschylus-Prometheus Bound,NUTT,5s.,4to.,"Eschylus-Prometheus Bound. Rendered into English Verse by E. R. Bevan. 4to. 5s. net NUTT, June 02",,,,June 02,1902,net
"Lib.) Literally Esop's Fables - Three Hundred. Trans. from the Greek by G. Fyler Townsend. 4 Plates in Colours, and 114 Illus. by Harrison Weir. Cr. 8vo. 77 × 51, pp. 256, 8s. 6d. ROUTLEDGE, July 02",,,Lib,ROUTLEDGE,8s. 6d.,8vo.,"Lib.) Literally Esop's Fables - Three Hundred. Trans. from the Greek by G. Fyler Townsend. 4 Plates in Colours, and 114 Illus. by Harrison Weir. Cr. 8vo. 77 × 51, pp. 256, 8s. 6d. ROUTLEDGE, July 02",,,,July 02,1902,
"Africa and Asia. Cr. 8vo. ea. 1s. 6d. (Continental Readers) ..BLACKIE, Apr. 02",,,Africa and Asia,BLACKIE,1s. 6d.,8vo.,"Africa and Asia. Cr. 8vo. ea. 1s. 6d. (Continental Readers) ..BLACKIE, Apr. 02",,,,Apr. 02,1902,
"Agnostic Annual and Ethical Review, 1903. 8vo. swd. 6d. WATTS, Nov. 02",,,Agnostic Annual and Ethical Review,WATTS,6d.,8vo.,"Agnostic Annual and Ethical Review, 1903. 8vo. swd. 6d. WATTS, Nov. 02",,,,Nov. 02,1902,
"Agricultural Handbook and Diary, 1908. Roy. 8vo. 2s. VINTON, Nov. 02",,,Agricultural Handbook and Diary,VINTON,2s.,8vo.,"Agricultural Handbook and Diary, 1908. Roy. 8vo. 2s. VINTON, Nov. 02",,,,Nov. 02,1902,
"Aids to Practical Religion. From Writings of Bishop W. Boyd Carpenter. Ed. by J. H. Burn. Cr. 8vo. 7 × 4, pp. 248, 8s. 6d. CASSELL, May 02",,,Aids to Practical Religion,CASSELL,8s. 6d.,8vo.,"Aids to Practical Religion. From Writings of Bishop W. Boyd Carpenter. Ed. by J. H. Burn. Cr. 8vo. 7 × 4, pp. 248, 8s. 6d. CASSELL, May 02",,,,May 02,1902,
"Ainsley's Nautical Almanac and Tide Tables for 1903. Cr. 8vo. 1s.; swd. 6d. ......SIMPKIN, Oct. 02",,,Ainsley's Nautical Almanac and Tide Tables for,SIMPKIN,6d.,8vo.,"Ainsley's Nautical Almanac and Tide Tables for 1903. Cr. 8vo. 1s.; swd. 6d. ......SIMPKIN, Oct. 02",,,,Oct. 02,1902,
"Air-Ship (The Golliwogg's). Pictured by Florence K. Upton. Verses by Bertha Upton. Obl. 4to. .....LONGMANS, Oct. 02",,,Air-Ship (The Golliwogg's),LONGMANS,,4to.,"Air-Ship (The Golliwogg's). Pictured by Florence K. Upton. Verses by Bertha Upton. Obl. 4to. .....LONGMANS, Oct. 02",,,,Oct. 02,1902,
"Alcestis, Euripides, trans. Stock, 1s. Alchemy and Beg. of Chemistry, Muir (M. M. Pat- tison) 18.. Alcock (A.)-Naturalist in Indian Seas; or, Years with Royal Indian Marine Survey Ship, 'Investigator.' Roy. 8vo. 94 × 6, pp. 852, 18s. net MURRAY, Nov. 02",,,"Alcestis, Euripides, trans",MURRAY,18s.,8vo.,"Alcestis, Euripides, trans. Stock, 1s. Alchemy and Beg. of Chemistry, Muir (M. M. Pat- tison) 18.. Alcock (A.)-Naturalist in Indian Seas; or, Years with Royal Indian Marine Survey Ship, 'Investigator.' Roy. 8vo. 94 × 6, pp. 852, 18s. net MURRAY, Nov. 02",,,,Nov. 02,1902,net
"G.) 78. 6d. net Alden (W. L.)-Drewitt's Dream. Cr. 8vo. 74 × 5, ....CHATTO, Oct. 02",,,G.),CHATTO,,8vo.,"G.) 78. 6d. net Alden (W. L.)-Drewitt's Dream. Cr. 8vo. 74 × 5, ....CHATTO, Oct. 02",,,,Oct. 02,1902,
"Alden's Sixpenny Guide to Oxford, 1902. 16mo. swd. 6d... Alderson (B.)-Andrew graph Boy to Millionaire. pp. 224, 2s. 6d. SIMPKIN, July 02",,,Alden's Sixpenny Guide to Oxford,SIMPKIN,2s. 6d.,16mo.,"Alden's Sixpenny Guide to Oxford, 1902. 16mo. swd. 6d... Alderson (B.)-Andrew graph Boy to Millionaire. pp. 224, 2s. 6d. SIMPKIN, July 02",,,,July 02,1902,
"Carnegie: From Tele- Illus. cr. 8vo. 7 x 47, ..PEARSON, Sep. 02",,,Carnegie: From Tele-,PEARSON,,8vo.,"Carnegie: From Tele- Illus. cr. 8vo. 7 x 47, ..PEARSON, Sep. 02",,,,Sep. 02,1902,
"AL Epidemic Register for Claiming Grant under Article 101. 8vo. 8x11, swd. 6d. net (AL .E. J. ARNOLD, Aug. 02",,,AL Epidemic Register for Claiming Grant under Article,AL .E. J. ARNOLD,,8vo.,"AL Epidemic Register for Claiming Grant under Article 101. 8vo. 8x11, swd. 6d. net (AL .E. J. ARNOLD, Aug. 02",,,,Aug. 02,1902,
"Official Series) ………………………….. Alexander (H.)-How to Play Rugby Football, by a Member of the Oxford University XV., 1898-9 &c. Fcp. 8vo. 63 × 41, pp. 52, 1s. net (Uppingham, J. Hawthorn), E. SEALE, Nov. 02",,,Official Series) …………………………,E. SEALE,,8vo.,"Official Series) ………………………….. Alexander (H.)-How to Play Rugby Football, by a Member of the Oxford University XV., 1898-9 &c. Fcp. 8vo. 63 × 41, pp. 52, 1s. net (Uppingham, J. Hawthorn), E. SEALE, Nov. 02",,,,Nov. 02,1902,
"Cr. 8vo. 1s. 6d. Alger (J. G.)-Paris in 1789-94: Farewell Letters of Victims of the Guillotine. With Plan. 8vo. 9 × 5, pp. 564, 10s. 6d.............G. ALLEN, Sep. 02",,,,G. ALLEN,10s. 6d.,8vo.,"Cr. 8vo. 1s. 6d. Alger (J. G.)-Paris in 1789-94: Farewell Letters of Victims of the Guillotine. With Plan. 8vo. 9 × 5, pp. 564, 10s. 6d.............G. ALLEN, Sep. 02",,,,Sep. 02,1902,
"All Round the Farm. 4to. bds. 8s. 6d. NISTER, Sep. 02",,,All Round the Farm,NISTER,8s. 6d.,4to.,"All Round the Farm. 4to. bds. 8s. 6d. NISTER, Sep. 02",,,,Sep. 02,1902,
"All's Well: Optimistic Thoughts from Writings of Robert Browning. Selected by Graham Hope. Cr. 8vo. 74 × 47, pp. 78, 2s. net H. W. BELL, Apr. 02",,,All's Well: Optimistic Thoughts from Writings of Robert Browning,H. W. BELL,2s.,8vo.,"All's Well: Optimistic Thoughts from Writings of Robert Browning. Selected by Graham Hope. Cr. 8vo. 74 × 47, pp. 78, 2s. net H. W. BELL, Apr. 02",,,,Apr. 02,1902,net
"Allcroft (A. H.), Masom (W. F.)-History of Rome, 188 to 81 B.C. Cr. 8vo. pp. 420, 4s. 6d. (Univ. Tut. Series) ..CLIVE, Oct. 02",,,History of Rome,CLIVE,4s. 6d.,8vo.,"Allcroft (A. H.), Masom (W. F.)-History of Rome, 188 to 81 B.C. Cr. 8vo. pp. 420, 4s. 6d. (Univ. Tut. Series) ..CLIVE, Oct. 02",,"['Allcroft (A. H.), Masom (W. F.)']",,Oct. 02,1902,
"Allibone's Dictionary of English Literature and British and American Authors. Supplement by J. F. Kirk. 5 vols. New and cheaper edition, roy. 8vo. -mor. 94s. 6d. .LIPPINCOTT, Aug. 02",,,Allibone's Dictionary of English Literature and British and American Authors,LIPPINCOTT,94s. 6d.,8vo.,"Allibone's Dictionary of English Literature and British and American Authors. Supplement by J. F. Kirk. 5 vols. New and cheaper edition, roy. 8vo. -mor. 94s. 6d. .LIPPINCOTT, Aug. 02",,,,Aug. 02,1902,
"Altar Manual. New ed., much enl. by J. Edward Vaux. 18mo. limp, 18.......SKEFFINGTON, Nov. 02",,,Altar Manual,SKEFFINGTON,,18mo.,"Altar Manual. New ed., much enl. by J. Edward Vaux. 18mo. limp, 18.......SKEFFINGTON, Nov. 02",,,,Nov. 02,1902,
"Everett) 15s. net American Annual of Photography for 1903. 8vo. .....LUND, Dec. 02",,,Everett),LUND,,8vo.,"Everett) 15s. net American Annual of Photography for 1903. 8vo. .....LUND, Dec. 02",,,,Dec. 02,1902,
"Amoretti. Incl. the Prothalamion and the Epi- thalamion, by Edmund Spenser. 16mo. 6 × 4, pp. 186, 2s. 6d. net......R. B. JOHNSON, Dec. 02",,,Amoretti,R. B. JOHNSON,2s. 6d.,16mo.,"Amoretti. Incl. the Prothalamion and the Epi- thalamion, by Edmund Spenser. 16mo. 6 × 4, pp. 186, 2s. 6d. net......R. B. JOHNSON, Dec. 02",,,,Dec. 02,1902,net
"Amos, Greek, Latin, Oesterley (W. O. E.) 48. net Amphlett (E. M.)-How to Bat: Analysis of Principal Strokes for use of Young Cricketers.. Illus., Diagr. Cr. 8vo. sd. 1s. TREHERNE, May 02",,,"Amos, Greek, Latin, Oesterley (W. O. E.)",TREHERNE,1s.,8vo.,"Amos, Greek, Latin, Oesterley (W. O. E.) 48. net Amphlett (E. M.)-How to Bat: Analysis of Principal Strokes for use of Young Cricketers.. Illus., Diagr. Cr. 8vo. sd. 1s. TREHERNE, May 02",,,,May 02,1902,
"Anæsthetics, Pocket Guide, Luke (T.) 5s. nt. Sep. 02: Anales de la Oficina Meteorológica Argentina por su Director G. G. Davis. Tomo 14. Roy. 4to. WESLEY, Oct. 02",,,"Anæsthetics, Pocket Guide, Luke (T.)",WESLEY,,4to.,"Anæsthetics, Pocket Guide, Luke (T.) 5s. nt. Sep. 02: Anales de la Oficina Meteorológica Argentina por su Director G. G. Davis. Tomo 14. Roy. 4to. WESLEY, Oct. 02",,,,Oct. 02,1902,
"Anatomy, Treatise, ed. by Hy. Morris, 80s. net Ancestor (The): an Illustrated Quarterly Review. No. 1, April 1902. Roy. 8vo. 58. net CONSTABLE, Mar. 02",,,"Anatomy, Treatise, ed",CONSTABLE,,8vo.,"Anatomy, Treatise, ed. by Hy. Morris, 80s. net Ancestor (The): an Illustrated Quarterly Review. No. 1, April 1902. Roy. 8vo. 58. net CONSTABLE, Mar. 02",,,,Mar. 02,1902,
"Ancestor (The): a Quarterly Review of County and Family History, Heraldry, and Antiquities. No. 2, July 1902. Imp. 8vo. 5s. net CONSTABLE, July 02",,,"Ancestor (The): a Quarterly Review of County and Family History, Heraldry, and Antiquities",CONSTABLE,5s.,8vo.,"Ancestor (The): a Quarterly Review of County and Family History, Heraldry, and Antiquities. No. 2, July 1902. Imp. 8vo. 5s. net CONSTABLE, July 02",,,,July 02,1902,net
"Ancestor (The). No. 8. Imp. 8vo. 58. net CONSTABLE, Oct. 02",,,Ancestor (The),CONSTABLE,,8vo.,"Ancestor (The). No. 8. Imp. 8vo. 58. net CONSTABLE, Oct. 02",,,,Oct. 02,1902,
"Andersen in German. Ed. by Walter Ripp- mann. Ilius. by Thomas Charles and William Robinson. Cr. 8vo. 7 × 5, pp. 232, 2s. 6d. net DENT, Oct. 02",,,Andersen in German,DENT,2s. 6d.,8vo.,"Andersen in German. Ed. by Walter Ripp- mann. Ilius. by Thomas Charles and William Robinson. Cr. 8vo. 7 × 5, pp. 232, 2s. 6d. net DENT, Oct. 02",,,,Oct. 02,1902,net
"Anderson (J.), Winton (W. E. de)-Zoology of Egypt. Mammalia. Map, 55 Coloured Plates, 8 Collotypes, 8 Radiographs. Roy. 4to. pp. 390, 147s. net .H. REES, Dec. 02",,,Zoology of Egypt,H. REES,147s.,4to.,"Anderson (J.), Winton (W. E. de)-Zoology of Egypt. Mammalia. Map, 55 Coloured Plates, 8 Collotypes, 8 Radiographs. Roy. 4to. pp. 390, 147s. net .H. REES, Dec. 02",,"['Anderson (J.), Winton (W. E. de)']",,Dec. 02,1902,net
"Anderson (W. J.), Spiers (R. P.)-Architecture of Greece and Rome: a Sketch of its Historic Development. 179 Illus. 8vo. 9 × 6, pp. 318, ………..BATSFORD, Dec. 02",,,Architecture of Greece and Rome: a Sketch of its Historic Development,BATSFORD,,8vo.,"Anderson (W. J.), Spiers (R. P.)-Architecture of Greece and Rome: a Sketch of its Historic Development. 179 Illus. 8vo. 9 × 6, pp. 318, ………..BATSFORD, Dec. 02",,"['Anderson (W. J.), Spiers (R. P.)']",,Dec. 02,1902,
"Andrew Glendinning's Apple Tree Cookery-book and Guide to Rational Diet. Ed. and arranged by Albert Broadbent. Cr. 8vo. 7 x 5, pp. 98, 1s. 6d.; swd. 1s. ..E. W. ALLEN, Oct. 02",,,Andrew Glendinning's Apple Tree Cookery-book and Guide to Rational Diet,E. W. ALLEN,1s.,8vo.,"Andrew Glendinning's Apple Tree Cookery-book and Guide to Rational Diet. Ed. and arranged by Albert Broadbent. Cr. 8vo. 7 x 5, pp. 98, 1s. 6d.; swd. 1s. ..E. W. ALLEN, Oct. 02",,,,Oct. 02,1902,
"Animal World. 1902 Vol. Folio, 3s.; bds. 2s. PARTRIDGE, Dec. 02",,,Animal World,PARTRIDGE,2s.,,"Animal World. 1902 Vol. Folio, 3s.; bds. 2s. PARTRIDGE, Dec. 02",,,,Dec. 02,1902,
"Animals' Friend. Vol. 8. Roy. 8vo. 2s. 6d. OFFICE, Oct. 02",,,Animals' Friend,OFFICE,2s. 6d.,8vo.,"Animals' Friend. Vol. 8. Roy. 8vo. 2s. 6d. OFFICE, Oct. 02",,,,Oct. 02,1902,
"Animals' Rebellion. Described by Clifton Bing- ham, and pictured by G. H. Thompson. Obl. 4to. bds. 5s.... .NISTER, Sep. 02",,,Animals' Rebellion,NISTER,5s.,4to.,"Animals' Rebellion. Described by Clifton Bing- ham, and pictured by G. H. Thompson. Obl. 4to. bds. 5s.... .NISTER, Sep. 02",,,,Sep. 02,1902,
"Annals of Astronomical Observatory of Harvard College. Vol. 87. Part 2: Observations of 58 Variable Stars of long period during the years 1890-1901. By O. C. Wendell and E. C. Pickering. Roy. 4to. pp. 282, swd. 158. net...WESLEY, Oct. 02",,,Annals of Astronomical Observatory of Harvard College,WESLEY,,4to.,"Annals of Astronomical Observatory of Harvard College. Vol. 87. Part 2: Observations of 58 Variable Stars of long period during the years 1890-1901. By O. C. Wendell and E. C. Pickering. Roy. 4to. pp. 282, swd. 158. net...WESLEY, Oct. 02",,,,Oct. 02,1902,
"Annals of Astronomical Observatory of Harvard College. Vol. 38: Discussion of Variable Stars in Cluster Centauri, by S. I. Bailey. 18 Plates. Roy. 4to. swd. 25s. net .WESLEY, Aug. 02",,,Annals of Astronomical Observatory of Harvard College,WESLEY,25s.,4to.,"Annals of Astronomical Observatory of Harvard College. Vol. 38: Discussion of Variable Stars in Cluster Centauri, by S. I. Bailey. 18 Plates. Roy. 4to. swd. 25s. net .WESLEY, Aug. 02",,,,Aug. 02,1902,net
"Annals of Astronomical Observatory of Harvard College. Vol. 41, No. 8: On the Magnitudes of 923 Fixed Stars determined from sequences observed by Sir John Herschel during the years 1835 to 1838, by W. Doberck. Roy. 4to. swd. 5s. net WESLEY, Aug. 02",,,Annals of Astronomical Observatory of Harvard College,WESLEY,5s.,4to.,"Annals of Astronomical Observatory of Harvard College. Vol. 41, No. 8: On the Magnitudes of 923 Fixed Stars determined from sequences observed by Sir John Herschel during the years 1835 to 1838, by W. Doberck. Roy. 4to. swd. 5s. net WESLEY, Aug. 02",,,,Aug. 02,1902,net
"Annals of Astronomical Observatory of Harvard College. Vol. 41, No. 9: Absorption of Photo- graphic Wedges, by G. S. King. Roy. 4to. swd. WESLEY, Aug. 02",,,Annals of Astronomical Observatory of Harvard College,WESLEY,,4to.,"Annals of Astronomical Observatory of Harvard College. Vol. 41, No. 9: Absorption of Photo- graphic Wedges, by G. S. King. Roy. 4to. swd. WESLEY, Aug. 02",,,,Aug. 02,1902,
"Annals of Astronomical Observatory of Harvard College. Vol. 43, Part 2: Observations and Investigations made at Blue Hill Meteorological Observatory in years 1899 and 1900, under direc- tion of A. L. Rotch. Roy. 4to. swd. 1s. net ........ 5s. net ..... ... WESLEY, Aug. 02",,,Annals of Astronomical Observatory of Harvard College,WESLEY,5s.,4to.,"Annals of Astronomical Observatory of Harvard College. Vol. 43, Part 2: Observations and Investigations made at Blue Hill Meteorological Observatory in years 1899 and 1900, under direc- tion of A. L. Rotch. Roy. 4to. swd. 1s. net ........ 5s. net ..... ... WESLEY, Aug. 02",,,,Aug. 02,1902,net
"Annals of Astronomical Observatory of Harvard College. Vol. 48, No. 1: Stars near North Pole. Roy. 4to. pp. 38 with Plate, swd. 15s. net .......... WESLEY, Aug. 02",,,Annals of Astronomical Observatory of Harvard College,WESLEY,15s.,4to.,"Annals of Astronomical Observatory of Harvard College. Vol. 48, No. 1: Stars near North Pole. Roy. 4to. pp. 38 with Plate, swd. 15s. net .......... WESLEY, Aug. 02",,,,Aug. 02,1902,net
"Annals of the Carnegie Museum. Vol. 1, No. 1. Ed. W. J. Holland and J. B. Hatcher. Illus. roy. 8vo. pp. 250, swd. 5s. 6d. net; No. 2, pp. 251- 342, 3s. net WESLEY, Apr. 02",,,Annals of the Carnegie Museum,WESLEY,3s.,8vo.,"Annals of the Carnegie Museum. Vol. 1, No. 1. Ed. W. J. Holland and J. B. Hatcher. Illus. roy. 8vo. pp. 250, swd. 5s. 6d. net; No. 2, pp. 251- 342, 3s. net WESLEY, Apr. 02",,,,Apr. 02,1902,net
"Annals of Carnegie Museum. Vol. 1, No. 3, March 1902. Plates 16 to 25 and Engravings. 8vo. swd. 4s. 6d. net....... .WESLEY, Aug. 02",,,Annals of Carnegie Museum,WESLEY,4s. 6d.,8vo.,"Annals of Carnegie Museum. Vol. 1, No. 3, March 1902. Plates 16 to 25 and Engravings. 8vo. swd. 4s. 6d. net....... .WESLEY, Aug. 02",,,,Aug. 02,1902,net
"Annals of Mathematics. Vol. 8, No. 3, April 1902. 4to. 2s. net...............LONGMANS, June 02",,,Annals of Mathematics,LONGMANS,2s.,4to.,"Annals of Mathematics. Vol. 8, No. 3, April 1902. 4to. 2s. net...............LONGMANS, June 02",,,,June 02,1902,net
"Annals of Mathematics. 2nd Series. Vol. 8. 4to. 2s. net ...LONGMANS, Aug. 02",,,Annals of Mathematics,LONGMANS,2s.,4to.,"Annals of Mathematics. 2nd Series. Vol. 8. 4to. 2s. net ...LONGMANS, Aug. 02",,,,Aug. 02,1902,net
"Annals of South African Museum. Vol. 2, Part 9: Rhyncotal Miscellanea. By W. L. Distant. With Plate. 8vo. swd. 1s. ..WESLEY, Aug. 02",,,Annals of South African Museum,WESLEY,1s.,8vo.,"Annals of South African Museum. Vol. 2, Part 9: Rhyncotal Miscellanea. By W. L. Distant. With Plate. 8vo. swd. 1s. ..WESLEY, Aug. 02",,,,Aug. 02,1902,
"Annals of the South African Museum. Vol. 2. Part 10: Moths of South Africa (Part 2). By Sir G. F. Hampson. Roy. 8vo. pp. 255-446, swd. 6s. net WESLEY, Oct. 02",,,Annals of the South African Museum,WESLEY,6s.,8vo.,"Annals of the South African Museum. Vol. 2. Part 10: Moths of South Africa (Part 2). By Sir G. F. Hampson. Roy. 8vo. pp. 255-446, swd. 6s. net WESLEY, Oct. 02",,,,Oct. 02,1902,net
"Anne of Austria and her Court: Memoirs of Madame de Motteville. Intro. by C.-A. Sainte- Beuve. Trans. by Katharine Prescott Wormeley. Portraits from the Original. 8 vols. roy. 8vo. 9 × 53, pp. 1144, 63s. net ...HEINEMANN, Mar. 02",,,Anne of Austria and her Court: Memoirs of Madame de Motteville,HEINEMANN,63s.,8vo.,"Anne of Austria and her Court: Memoirs of Madame de Motteville. Intro. by C.-A. Sainte- Beuve. Trans. by Katharine Prescott Wormeley. Portraits from the Original. 8 vols. roy. 8vo. 9 × 53, pp. 1144, 63s. net ...HEINEMANN, Mar. 02",,,,Mar. 02,1902,net
"Annual of the British School at Athens. No. 7, 1901. 8vo. 10s. 6d. net ......MACMILLAN, May 02",,,Annual of the British School at Athens,MACMILLAN,10s. 6d.,8vo.,"Annual of the British School at Athens. No. 7, 1901. 8vo. 10s. 6d. net ......MACMILLAN, May 02",,,,May 02,1902,net
"Annual Register: a Review of Public Events at Home and Abroad. For 1901. New Series. 8vo. ......LONGMANS, May 02",,,Annual Register: a Review of Public Events at Home and Abroad,LONGMANS,,8vo.,"Annual Register: a Review of Public Events at Home and Abroad. For 1901. New Series. 8vo. ......LONGMANS, May 02",,,,May 02,1902,
"Antwerp Gallery. Part 4, containg. 12 Plates on hand-made paper, 15 x 11, 15s. 6d.; Portfolio for complete work, 10s.; Series of 4 Parts, 60s. KLEINMANN, Dec. 02",,,Antwerp Gallery,KLEINMANN,60s.,,"Antwerp Gallery. Part 4, containg. 12 Plates on hand-made paper, 15 x 11, 15s. 6d.; Portfolio for complete work, 10s.; Series of 4 Parts, 60s. KLEINMANN, Dec. 02",,,,Dec. 02,1902,
"Appleton's Annual Cyclopædia and Register of 8vo. 21s. net Important Events of 1901. HIRSCHFELD, Aug. 02.",,,Appleton's Annual Cyclopædia and Register of,HIRSCHFELD,,8vo.,"Appleton's Annual Cyclopædia and Register of 8vo. 21s. net Important Events of 1901. HIRSCHFELD, Aug. 02.",,,,Aug. 02,1902,
"Arctic Pilot. Vol. 2: Faeroe 1slands, Iceland, Greenland Sea, Spitzbergen, East Coast of Greenland. 48. .POTTER, Mar. 02",,,Arctic Pilot,POTTER,,,"Arctic Pilot. Vol. 2: Faeroe Islands, Iceland, Greenland Sea, Spitzbergen, East Coast of Greenland. 48. .POTTER, Mar. 02",,,,Mar. 02,1902,
"Aristophanes-Ecclesiazuse. Greek Text Re- vised by B. B. Rogers. 4to. 7s. 6d. BELL, Feb. 02",,,Aristophanes-Ecclesiazuse,BELL,7s. 6d.,4to.,"Aristophanes-Ecclesiazuse. Greek Text Re- vised by B. B. Rogers. 4to. 7s. 6d. BELL, Feb. 02",,,,Feb. 02,1902,
"Aristophanes-Frogs. Greek Text revised by B. B. Rogers. 4to. 10s. 6d. ......BELL, Feb. 02",,,Aristophanes-Frogs,BELL,10s. 6d.,4to.,"Aristophanes-Frogs. Greek Text revised by B. B. Rogers. 4to. 10s. 6d. ......BELL, Feb. 02",,,,Feb. 02,1902,
"Aristophanes-Frogs and Ecclesiazuse. Greek Text revised by B. B. Rogers. 1 vol. 4to. 15s. BELL, Feb. 02",,,Aristophanes-Frogs and Ecclesiazuse,BELL,15s.,4to.,"Aristophanes-Frogs and Ecclesiazuse. Greek Text revised by B. B. Rogers. 1 vol. 4to. 15s. BELL, Feb. 02",,,,Feb. 02,1902,
"Aristotle-Politics. Intro. by W. L. Newman. Vols. 8, 4, 8vo. 14s. net; Ditto, Vols. 1, 2, adv. to 14s. net .FROWDE, Feb. 02",,,Aristotle-Politics,FROWDE,14s.,8vo.,"Aristotle-Politics. Intro. by W. L. Newman. Vols. 8, 4, 8vo. 14s. net; Ditto, Vols. 1, 2, adv. to 14s. net .FROWDE, Feb. 02",,,,Feb. 02,1902,net
"Aristotle's Psychology: Treatise on Principle of Life. Trans. with Intro. and Notes by Wm. Alexander Hammond. Roy. 8vo. 9 × 5, pp. 428, 10s. 6d. net ………………………………..SonnENSCHEIN, Nov. 02",,,Aristotle's Psychology: Treatise on Principle of Life,ENSCHEIN,,8vo.,"Aristotle's Psychology: Treatise on Principle of Life. Trans. with Intro. and Notes by Wm. Alexander Hammond. Roy. 8vo. 9 × 5, pp. 428, 10s. 6d. net ………………………………..SonnENSCHEIN, Nov. 02",,,,Nov. 02,1902,
"Aristoxenus-Harmonics. Ed., with Transl. and Notes, by H. S. Macran. Cr. 8vo. 10s. 6d. net FROWDE, Dec. 02",,,Aristoxenus-Harmonics,FROWDE,10s. 6d.,8vo.,"Aristoxenus-Harmonics. Ed., with Transl. and Notes, by H. S. Macran. Cr. 8vo. 10s. 6d. net FROWDE, Dec. 02",,,,Dec. 02,1902,net
"Arnim (Countess von)-see Elizabeth Arnold (E. L.)-Constable of St. Nicholas. New ed. cr. 8vo. 7 × 43, pp. 268, 2s. CHATTO, Mar. 02",,,Constable of St,CHATTO,2s.,8vo.,"Arnim (Countess von)-see Elizabeth Arnold (E. L.)-Constable of St. Nicholas. New ed. cr. 8vo. 7 × 43, pp. 268, 2s. CHATTO, Mar. 02",,['Arnim (Countess von)-see Elizabeth Arnold (E. L.)'],,Mar. 02,1902,
"Arnold's Practical Sabbath-School Commentary on the International Lessons. Roy. 8vo. 94×6, pp. 284, 2s. 6d. net ....REVELL, Nov. 02",,,Arnold's Practical Sabbath-School Commentary on the International Lessons,REVELL,2s. 6d.,8vo.,"Arnold's Practical Sabbath-School Commentary on the International Lessons. Roy. 8vo. 94×6, pp. 284, 2s. 6d. net ....REVELL, Nov. 02",,,,Nov. 02,1902,net
"Art Journal. 1902 Vol. Fol. 218. VIRTUE, Nov. 02",,,Art Journal,VIRTUE,,,"Art Journal. 1902 Vol. Fol. 218. VIRTUE, Nov. 02",,,,Nov. 02,1902,
"Art Lover's Portfolio, 1902. In portfolio, 218. net HEINEMANN, Dec. 02",,,Art Lover's Portfolio,HEINEMANN,,,"Art Lover's Portfolio, 1902. In portfolio, 218. net HEINEMANN, Dec. 02",,,,Dec. 02,1902,
"Art Sales of the Year 1902. Ed. by J. H. Slater. 8vo. 80s. net .VIRTUE, Dec. 02",,,Art Sales of the Year,VIRTUE,80s.,8vo.,"Art Sales of the Year 1902. Ed. by J. H. Slater. 8vo. 80s. net .VIRTUE, Dec. 02",,,,Dec. 02,1902,net
"Folio, 21s. CASSELL, Oct. 02",,,Folio,CASSELL,21s.,,"Folio, 21s. CASSELL, Oct. 02",,,,Oct. 02,1902,
"Art Workers' Quarterly. No. 1. January 1902. Fol. swd. 2s. 6d. net............... CHAPMAN, Jan. 02",,,Art Workers' Quarterly,CHAPMAN,2s. 6d.,,"Art Workers' Quarterly. No. 1. January 1902. Fol. swd. 2s. 6d. net............... CHAPMAN, Jan. 02",,,,Jan. 02,1902,net
"Art Workers' Quarterly. Vol. 1, 1902. 4to. 12s. 6d. net... ....CHAPMAN, Dec. 02",,,Art Workers' Quarterly,CHAPMAN,12s. 6d.,4to.,"Art Workers' Quarterly. Vol. 1, 1902. 4to. 12s. 6d. net... ....CHAPMAN, Dec. 02",,,,Dec. 02,1902,net
