entry,last_name,first_name,title,publisher,price,format,original_entry,author_name,creators,is_editor,date,is_net
"Sudan: a Record of Administration in the Connell (A. and J.)-The Cost of Sport. Swd., 2d. Anglo-Egyptian Sudan. 8vo. 9 X 51, pp. 356, HUMANITARIAN LEAGUE, Sep. 10",,,Sudan: a Record of Administration in the Connell (A. and J.)-The Cost of Sport,HUMANITARIAN LEAGUE,,8vo.,"Sudan: a Record of Administration in the Connell (A. and J.)-The Cost of Sport. Swd., 2d. Anglo-Egyptian Sudan. 8vo. 9 X 51, pp. 356, HUMANITARIAN LEAGUE, Sep. 10",,,,Sep. 10,
"OFFICE, Jan. 10",,,,OFFICE,,,"OFFICE, Jan. 10",,,,Jan. 10,
"Continuous Current Mach. Design, Cramp (W.) Popular edit. Cr. 8vo., pp. 128. is. net HODDER & S., July 10",,,Continuous Current Mach,HODDER & S.,,8vo.,"Continuous Current Mach. Design, Cramp (W.) Popular edit. Cr. 8vo., pp. 128. is. net HODDER & S., July 10",,,,July 10,
"HODDER & S., Vov. 10",,,,HODDER & S.,,,"HODDER & S., Vov. 10",,,,Vov. 10,
"HEINEMANN, Aug. 10",,,,HEINEMANN,,,"HEINEMANN, Aug. 10",,,,Aug. 10,
"Consciousness : Time and Free Will, Bergson (H.) Converse (Florence)-A Masque of Sibyls. Cr. 8vo. IOS, 6d. net ...Aug. 10 74 x 44, pp. 80, 2s. 6d. net......DENT, Mar. 10",,,"Consciousness : Time and Free Will, Bergson (H.) Converse (Florence)-A Masque of Sibyls",DENT,2s. 6d.,8vo.,"Consciousness : Time and Free Will, Bergson (H.) Converse (Florence)-A Masque of Sibyls. Cr. 8vo. IOS, 6d. net ...Aug. 10 74 x 44, pp. 80, 25. 6d. net......DENT, Mar. 10",,,,Mar. 10,net
"Consecration, Steps in, Mountain (J.) is, net Conveyancing Bill, 2d. WYMAN, Apr. 10",,,"Consecration, Steps in, Mountain (J.) is, net Conveyancing Bill",WYMAN,2d.,,"Consecration, Steps in, Mountain (J.) is, net Conveyancing Bill, 2d. WYMAN, Apr. 10",,,,Apr. 10,
"BLACK, May 10",,,,BLACK,,,"BLACK, May 10",,,,May 10,
"MACMILLAN, Nov. 10",,,,MACMILLAN,,,"MACMILLAN, Nov. 10",,,,Nov. 10,
"Criticism. Cr. 8vo., pp. 156, is. net Constable (John)-Masterpieces. 18mo., is. net, WATTS, Oct. 10",,,Criticism,WATTS,,8vo.,"Criticism. Cr. 8vo., pp. 156, is. net Constable (John)-Masterpieces. 18mo., is. net, WATTS, Oct. 10",,,,Oct. 10,
"WATTS, June 10",,,,WATTS,,,"WATTS, June 10",,,,June 10,
"Constantinople. Black's Guide. 4th edit. 12mo. Conyers (Dorothea)—Bloom or Blight. 8vo. swd. 28. 6d. net.. .BLACK, June 10",,,Constantinople,BLACK,6d.,12mo.,"Constantinople. Black's Guide. 4th edit. 12mo. Conyers (Dorothea)—Bloom or Blight. 8vo. swd. 28. 6d. net.. .BLACK, June 10",,,,June 10,net
"Constantinople, Consular Report, 1909, 2}d. Conyers (Dorothea)—The Strayings of Sandy. WYMAN, July 10",,,"Constantinople, Consular Report",WYMAN,,,"Constantinople, Consular Report, 1909, 2}d. Conyers (Dorothea)—The Strayings of Sandy. WYMAN, July 10",,,,July 10,
"Popular edit. Cr. 8vo., pp. 362, swd. is. net Constantinople, Walls of, Baker (B. G.) 16s. net HUTCHINSON, Apr. 10",,,Popular edit,HUTCHINSON,16s.,8vo.,"Popular edit. Cr. 8vo., pp. 362, swd. is. net Constantinople, Walls of, Baker (B. G.) 16s. net HUTCHINSON, Apr. 10",,,,Apr. 10,net
"Constitution, Biographical Story of the, Elliott (E.) Conyers (Dorothea)-Two Impostors and Tinker. ros, 6d. net .Feb. 10 Cř. 8vo. 74 X5, pp. 352, 6s. Constitution, &c., of United States, 6d. net HUTCHINSON, Oct. 10",,,"Constitution, Biographical Story of the, Elliott (E.) Conyers (Dorothea)-Two Impostors and Tinker",HUTCHINSON,6d.,8vo.,"Constitution, Biographical Story of the, Elliott (E.) Conyers (Dorothea)-Two Impostors and Tinker. ros, 6d. net .Feb. 10 Cř. 8vo. 74 X5, pp. 352, 6s. Constitution, &c., of United States, 6d. net HUTCHINSON, Oct. 10",,,,Oct. 10,net
"WYMAN, Sep. 10",,,,WYMAN,,,"WYMAN, Sep. 10",,,,Sep. 10,
"SONNENSCHEIN, Apr. 10",,,,SONNENSCHEIN,,,"SONNENSCHEIN, Apr. 10",,,,Apr. 10,
"Cookery Annual for 1910 (The) and Year Book of the Universal Cookery and Food Association. Edit. by C. Herman Senn. Cr. 8vo. swd. s. net .SIMPKIN, Feb. 10",,,Cookery Annual for,SIMPKIN,,8vo.,"Cookery Annual for 1910 (The) and Year Book of the Universal Cookery and Food Association. Edit. by C. Herman Senn. Cr. 8vo. swd. IS. net .SIMPKIN, Feb. 10",,,,Feb. 10,
"Cooking by Gas. Cr. Svo. 74 X5, pp. 268, 2s, net CASSELL, June 10",,,Cooking by Gas,CASSELL,2s.,,"Cooking by Gas. Cr. Svo. 74 X5, pp. 268, 2s, net CASSELL, June 10",,,,June 10,net
"Cooking, Manual of Military Cooking, 6d. WYMAN, Apr. 10",,,"Cooking, Manual of Military Cooking",WYMAN,6d.,,"Cooking, Manual of Military Cooking, 6d. WYMAN, Apr. 10",,,,Apr. 10,
"Cook's Handbook to London. New edit. Cr. 8vo. pp. 208, bds. is. net .. SIMPKIN, Sep. 10",,,Cook's Handbook to London,SIMPKIN,,8vo.,"Cook's Handbook to London. New edit. Cr. 8vo. pp. 208, bds. is. net .. SIMPKIN, Sep. 10",,,,Sep. 10,
"Cook's Tourist's Handbook for Palestine and Syria. New edit., thoroughly rev. Cr. 8vo. 7s. 6d. net . SIMPKIN, Nov. 10",,,Cook's Tourist's Handbook for Palestine and Syria,SIMPKIN,7s. 6d.,8vo.,"Cook's Tourist's Handbook for Palestine and Syria. New edit., thoroughly rev. Cr. 8vo. 75. 6d. net . SIMPKIN, Nov. 10",,,,Nov. 10,net
"Cook's Tourist's Handbook for Southern Italy (including Rome) and Sicily. With maps and plans, 1910. 12mo. 61 X 4), pp. 420, 4s. SIMPKIN, Apr. 10",,,Cook's Tourist's Handbook for Southern Italy (including Rome) and Sicily,SIMPKIN,4s.,12mo.,"Cook's Tourist's Handbook for Southern Italy (including Rome) and Sicily. With maps and plans, 1910. 12mo. 61 X 4), pp. 420, 4S. SIMPKIN, Apr. 10",,,,Apr. 10,
"Coquimbo, Consular Report, 1909, 2d. WYMAN, July 10",,,"Coquimbo, Consular Report",WYMAN,2d.,,"Coquimbo, Consular Report, 1909, 2d. WYMAN, July 10",,,,July 10,
"Coroners Committee-Evidence the 2nd Report, is. 8d. .. WYMAN, Apr. 10",,,Coroners Committee-Evidence the,WYMAN,8d.,,"Coroners Committee-Evidence the 2nd Report, is. 8d. .. WYMAN, Apr. 10",,,,Apr. 10,
"Corporal Punishment, Return, fd. WYMAN, May 10",,,"Corporal Punishment, Return, fd",WYMAN,,,"Corporal Punishment, Return, fd. WYMAN, May 10",,,,May 10,
"Cost of Producing Coal (The). 18mo., pp. 44, swd. 3d.........COLLIERY GUARDIAN, July 10",,,Cost of Producing Coal (The),COLLIERY GUARDIAN,3d.,18mo.,"Cost of Producing Coal (The). 18mo., pp. 44, swd. 3d.........COLLIERY GUARDIAN, July 10",,,,July 10,
"Cottager and Artisan, 1910. Folio, swd, is. 6d. R. T. S., Sep. 10",,,Cottager and Artisan,R. T. S.,6d.,,"Cottager and Artisan, 1910. Folio, swd, is. 6d. R. T. S., Sep. 10",,,,Sep. 10,
"Cotte (J.)-Sponge Culture (U.S. Bureau of Fisheries). Imp. 8vo. II X7swd. 2s. 6d. net WESLEY, June 10",,,Imp,WESLEY,2s. 6d.,8vo.,"Cotte (J.)-Sponge Culture (U.S. Bureau of Fisheries). Imp. 8vo. II X7swd. 25. 6d. net WESLEY, June 10",,['Cotte (J.)-Sponge Culture (U.S. Bureau of Fisheries)'],,June 10,net
"Coulson Constance J. D.)--Korea. Illus. Cr. 8vo. 8X51, pp. 86, 1s. 6d. net (Peeps at Many Lands) .BLACK, Nov. 10",,,Coulson Constance J. D.)--Korea,BLACK,1s. 6d.,8vo.,"Coulson Constance J. D.)--Korea. Illus. Cr. 8vo. 8X51, pp. 86, Is. 6d. net (Peeps at Many Lands) .BLACK, Nov. 10",,,,Nov. 10,net
"Country Life. Vol. 26. July to Dec., 1909. Folio. 218, net .NEWNES, Jan. 10",,,Country Life,NEWNES,,,"Country Life. Vol. 26. July to Dec., 1909. Folio. 218, net .NEWNES, Jan. 10",,,,Jan. 10,
"Country Life, Vol. 27. Jan.-June. Folio 2 is. net NEWNES, Sep. 10",,,"Country Life, Vol",NEWNES,,,"Country Life, Vol. 27. Jan.-June. Folio 2 is. net NEWNES, Sep. 10",,,,Sep. 10,
"“ Country-Side Monthly” (The) : An Illustrated Journal dealing with all branches of Natural History. Vol. I. No. 1. Illus. 8vo. 91x6}, 4d. net .H. MARSHALL, June 10",,,Country-Side Monthly” (The) : An Illustrated Journal dealing with all branches of Natural History,H. MARSHALL,4d.,8vo.,"“ Country-Side Monthly” (The) : An Illustrated Journal dealing with all branches of Natural History. Vol. I. No. 1. Illus. 8vo. 91x6}, 4d. net .H. MARSHALL, June 10",,,,June 10,net
"County Councils, Municipal Corporations, and Local Authorities' Companion, Magisterial Directory and Local Government Year Book for 1910. 8vo. 1os. 6d. KELLY'S DIRECTORIES, Jan. 10",,,"County Councils, Municipal Corporations, and Local Authorities' Companion, Magisterial Directory and Local Government Year Book for",KELLY'S DIRECTORIES,6d.,8vo.,"County Councils, Municipal Corporations, and Local Authorities' Companion, Magisterial Directory and Local Government Year Book for 1910. 8vo. 1os. 6d. KELLY'S DIRECTORIES, Jan. 10",,,,Jan. 10,
"County Courts Plaints and Sittings, 1909, Return, is. 4d. WYMAN, Sep. 10",,,County Courts Plaints and Sittings,WYMAN,4d.,,"County Courts Plaints and Sittings, 1909, Return, is. 4d. WYMAN, Sep. 10",,,,Sep. 10,
"Crete, Consular Report for 1909, 4d. WYMAX, Dec. 10",,,"Crete, Consular Report for",WYMAX,4d.,,"Crete, Consular Report for 1909, 4d. WYMAX, Dec. 10",,,,Dec. 10,
"Crew's Company Law. 8vo., 5s. net BUTTERWORTH, Nov. 10",,,Crew's Company Law,BUTTERWORTH,5s.,8vo.,"Crew's Company Law. 8vo., 5s. net BUTTERWORTH, Nov. 10",,,,Nov. 10,net
"Criminal Statistics for Ireland, 1909, 1s. 6d. WYMAN, Sep. 10",,,Criminal Statistics for Ireland,WYMAN,1s. 6d.,,"Criminal Statistics for Ireland, 1909, Is. 6d. WYMAN, Sep. 10",,,,Sep. 10,
"Design. 8vo. 8**5), pp. 260, 58. net HARPER, Sep. 10",,,Design,HARPER,,8vo.,"Design. 8vo. 8**5), pp. 260, 58. net HARPER, Sep. 10",,,,Sep. 10,
"Crofters Commission-Report for 1909 (Scotland), s. id. ...WYMAN, June 10",,,Crofters Commission-Report for,WYMAN,,,"Crofters Commission-Report for 1909 (Scotland), IS. id. ...WYMAN, June 10",,,,June 10,
"Crowe and Cavalcaselle-A New History of Painting in Italy from the Second to the Sixteenth Century. Edit. by Edward Hutton. 3 vols. Vol. 3 now ready. 8vo. sets only, 6os. net ....DENT, Jan. 10",,,Crowe and Cavalcaselle-A New History of Painting in Italy from the Second to the Sixteenth Century,DENT,,8vo.,"Crowe and Cavalcaselle-A New History of Painting in Italy from the Second to the Sixteenth Century. Edit. by Edward Hutton. 3 vols. Vol. 3 now ready. 8vo. sets only, 6os. net ....DENT, Jan. 10",,,,Jan. 10,
"Crown-Imperial (The). By Unkichi Kawai. Cr. 8vo. 6s. net K. PAUL, Jan, 10",,,Crown-Imperial (The),K. PAUL,6s.,8vo.,"Crown-Imperial (The). By Unkichi Kawai. Cr. 8vo. 6s. net K. PAUL, Jan, 10",,,,"Jan, 10",net
"Crustacea, Stalk-Eyed, of Peru, Rathbun (M. J.) ..Νου, το Cruttwell (Charles T.)-A History of Roman Literature, from the Earliest Period to the death of Marcus Aurelius. 7th edit. 8vo. 8 X 54, pp. 522, 8s. 6d. C. GRIFFIN, Sep. 10",,,"Crustacea, Stalk-Eyed, of Peru, Rathbun (M. J.) ",C. GRIFFIN,8s. 6d.,8vo.,"Crustacea, Stalk-Eyed, of Peru, Rathbun (M. J.) ..Νου, το Cruttwell (Charles T.)-A History of Roman Literature, from the Earliest Period to the death of Marcus Aurelius. 7th edit. 8vo. 8 X 54, pp. 522, 8s. 6d. C. GRIFFIN, Sep. 10",,,,Sep. 10,
"Cuba, Consular Report on Trade of, 1908, id. WYMAN, Feb. 10",,,"Cuba, Consular Report on Trade of",WYMAN,,,"Cuba, Consular Report on Trade of, 1908, id. WYMAN, Feb. 10",,,,Feb. 10,
"Cuba, Trade of, for 1909, id... W'YMAN, May 10",,,"Cuba, Trade of, for",W'YMAN,,,"Cuba, Trade of, for 1909, id... W'YMAN, May 10",,,,May 10,
"Culture of Vegetables and Flowers from Seeds and Roots, by Sutton & Sons, Reading. 14th edit. 8vo. 83 X5, pp. 460, 5s. net SIMPKIN, Mar. 10",,,"Culture of Vegetables and Flowers from Seeds and Roots, by Sutton & Sons, Reading",SIMPKIN,5s.,8vo.,"Culture of Vegetables and Flowers from Seeds and Roots, by Sutton & Sons, Reading. 14th edit. 8vo. 83 X5, pp. 460, 5s. net SIMPKIN, Mar. 10",,,,Mar. 10,net
"Customs Refunds on Re-Exports, British and Foreign, 3d. WYMAN, Dec. 10",,,"Customs Refunds on Re-Exports, British and Foreign",WYMAN,3d.,,"Customs Refunds on Re-Exports, British and Foreign, 3d. WYMAN, Dec. 10",,,,Dec. 10,
"Daily Mail” Klection Results Chart. s. net canvas and roller, 2s. 6d. net G. PHILIP, Nov. 10",,,Daily Mail” Klection Results Chart,G. PHILIP,2s. 6d.,,"Daily Mail” Klection Results Chart. IS. net canvas and roller, 2s. 6d. net G. PHILIP, Nov. 10",,,,Nov. 10,net
"“Daily Mail” Year Book (The), 1911. Cr. 8vo. swd. 6d. net ..OFFICE, Dec. 10",,,Daily Mail” Year Book (The),OFFICE,6d.,8vo.,"“Daily Mail” Year Book (The), 1911. Cr. 8vo. swd. 6d. net ..OFFICE, Dec. 10",,,,Dec. 10,net
"Daily News ” Year Book (The) 1911. Cr. 8vo. swd, 6d. net. .OFFICE, Nov. 10",,,Daily News ” Year Book (The),OFFICE,6d.,8vo.,"Daily News ” Year Book (The) 1911. Cr. 8vo. swd, 6d. net. .OFFICE, Nov. 10",,,,Nov. 10,net
"Daisyland, by Aunt Ruth. 4to, bds., is. PARTRIDGE, Sep. 10",,,"Daisyland, by Aunt Ruth",PARTRIDGE,,"4to,","Daisyland, by Aunt Ruth. 4to, bds., is. PARTRIDGE, Sep. 10",,,,Sep. 10,
"12mo. ea. 59. net Dale (T. N.)-The Granites of Vermont. Illus. 8vo. 6 X9, pp. 138, swd. 5s. net (U.S. Geol. Survey) . WESLEY, June 10",,,,WESLEY,5s.,8vo.,"I 2mo. ea. 59. net Dale (T. N.)-The Granites of Vermont. Illus. 8vo. 6 X9, pp. 138, swd. 55. net (U.S. Geol. Survey) . WESLEY, June 10",,,,June 10,net
"Dale Readers (The). Book 2. Cr. 8vo., pp. 112, s. 3d. .G. PHILIP, Feb. 10",,,Dale Readers (The),G. PHILIP,3d.,8vo.,"Dale Readers (The). Book 2. Cr. 8vo., pp. 112, IS. 3d. .G. PHILIP, Feb. 10",,,,Feb. 10,
"Dan Grass of Timberwell Hill. By Josmar. Cr. 8vo. 28, 6d. net ..... STOCKWELL, Sep. 10",,,Dan Grass of Timberwell Hill,STOCKWELL,6d.,8vo.,"Dan Grass of Timberwell Hill. By Josmar. Cr. 8vo. 28, 6d. net ..... STOCKWELL, Sep. 10",,,,Sep. 10,net
"Dante--The Purgatorio Rendered into English Verse, by A. L. Money. Cr. 8vo. 71 X5, pp. 208, 2s. net, swd. is. net ......G. ALLEN, Mar. 10",,,"Dante--The Purgatorio Rendered into English Verse, by A. L. Money",G. ALLEN,,8vo.,"Dante--The Purgatorio Rendered into English Verse, by A. L. Money. Cr. 8vo. 71 X5, pp. 208, 25. net, swd. is. net ......G. ALLEN, Mar. 10",,,,Mar. 10,
"Dante Alighieri—The Trilogy ; or, Dante's Three Visions. Trans. into English in the Metre and Triple Rhyme of the Original, with Notes by John Wesley Thomas. 3 vols. 12mo., pp. 256, 256, 256, ea. is. net R. CULLEY, May to Dante—The Trilogy ; or, Dante's Three Visions. Trans. by J. W. Thomas. 3 vols. s. net .R. CULLEY, Jan. 10",,,"Dante Alighieri—The Trilogy ; or, Dante's Three Visions",R. CULLEY,,12mo.,"Dante Alighieri—The Trilogy ; or, Dante's Three Visions. Trans. into English in the Metre and Triple Rhyme of the Original, with Notes by John Wesley Thomas. 3 vols. 12mo., pp. 256, 256, 256, ea. is. net R. CULLEY, May to Dante—The Trilogy ; or, Dante's Three Visions. Trans. by J. W. Thomas. 3 vols. IS. net .R. CULLEY, Jan. 10",,,,Jan. 10,
"Dantzig, Consular Report for, 1909, 1}d. WYMAN, July 10",,,"Dantzig, Consular Report for",WYMAN,,,"Dantzig, Consular Report for, 1909, 1}d. WYMAN, July 10",,,,July 10,
"Darradaljod : Old Orkney and Shetland Lore. Edit. and trans., with intro, and notes, by Eiríkr Magnússon. Rev. edit, 8vo. is, 6d. net (Viking Club) (Coventry) CURTIS & BEAMISH, July 10",,,Darradaljod : Old Orkney and Shetland Lore,CURTIS & BEAMISH,6d.,8vo.,"Darradaljod : Old Orkney and Shetland Lore. Edit. and trans., with intro, and notes, by Eiríkr Magnússon. Rev. edit, 8vo. is, 6d. net (Viking Club) (Coventry) CURTIS & BEAMISH, July 10",,,,July 10,net
"Darton's Leading Strings, 1910. Ryl, 8vo., 2s. 6d., bds. 1s. 6d. .GARDNER, D., Oct. 10",,,Darton's Leading Strings,"GARDNER, D.",1s. 6d.,8vo.,"Darton's Leading Strings, 1910. Ryl, 8vo., 25. 6d., bds. Is. 6d. .GARDNER, D., Oct. 10",,,,Oct. 10,
"Dawn of Day (The) 1910. 4to. is. S.P.C.K., Nov. 10",,,Dawn of Day (The),S.P.C.K.,,4to.,"Dawn of Day (The) 1910. 4to. is. S.P.C.K., Nov. 10",,,,Nov. 10,
"Dawn of Revelation, Bramston (M.) 28. 661. net Νου. Το Dawson (A. J.) The Land of his Fathers. Cr. 8vo. 74 X5, pp. 392, 6s.........CONSTABLE, Sep. 10",,,"Dawn of Revelation, Bramston (M.)",CONSTABLE,6s.,8vo.,"Dawn of Revelation, Bramston (M.) 28. 661. net Νου. Το Dawson (A. J.) The Land of his Fathers. Cr. 8vo. 74 X5, pp. 392, 65.........CONSTABLE, Sep. 10",,,,Sep. 10,
"Day by Day we Worship Thee : Readings and Prayers from Holy Scripture and the Book of Common Prayer. 8vo. 9 X5), pp. 242, 3s. 60. net GARDNER, D., Nov, 10",,,Day by Day we Worship Thee : Readings and Prayers from Holy Scripture and the Book of Common Prayer,"GARDNER, D.",,8vo.,"Day by Day we Worship Thee : Readings and Prayers from Holy Scripture and the Book of Common Prayer. 8vo. 9 X5), pp. 242, 35. 60. net GARDNER, D., Nov, 10",,,,"Nov, 10",
"Day of Days (The). Vol. 39. Ryl. 8vo. 2s. OFFICE, Dec. 10",,,Day of Days (The),OFFICE,2s.,8vo.,"Day of Days (The). Vol. 39. Ryl. 8vo. 25. OFFICE, Dec. 10",,,,Dec. 10,
"Debrett's House of Commons and the Judicial Bench, 1910. 8vo. 7s. 6d. net .. DEAN, Mar. 10",,,Debrett's House of Commons and the Judicial Bench,DEAN,7s. 6d.,8vo.,"Debrett's House of Commons and the Judicial Bench, 1910. 8vo. 75. 6d. net .. DEAN, Mar. 10",,,,Mar. 10,net
"Debrett's Peerage, Baronetage, Knightage and Companionage, 1911. Royal edit. Ryl. 8vo. 315, 6d. net . . DEAN, Dec. 10",,,"Debrett's Peerage, Baronetage, Knightage and Companionage",DEAN,6d.,8vo.,"Debrett's Peerage, Baronetage, Knightage and Companionage, 1911. Royal edit. Ryl. 8vo. 315, 6d. net . . DEAN, Dec. 10",,,,Dec. 10,net
"Debrett's Peerage and Titles of Courtesy, 1911. Ryl. 8vo., 16s. 60. net . . DEAN, Dec. 10",,,Debrett's Peerage and Titles of Courtesy,DEAN,,8vo.,"Debrett's Peerage and Titles of Courtesy, 1911. Ryl. 8vo., 16s. 60. net . . DEAN, Dec. 10",,,,Dec. 10,
"Debtors' Imprisonment: Index, 4}d. WYMAX, Jan. 10",,,Debtors' Imprisonment: Index,WYMAX,,,"Debtors' Imprisonment: Index, 4}d. WYMAX, Jan. 10",,,,Jan. 10,
"Deinhardt-Schlomann Series of Technical Dic- tionaries. Hoisting and Conveying Machinery. Compiled by P. Stulpnagel 12mo. Ios. 6d. net.. .... CONSTABLE, Fe'. 10",,,Deinhardt-Schlomann Series of Technical Dic- tionaries,CONSTABLE,6d.,12mo.,"Deinhardt-Schlomann Series of Technical Dic- tionaries. Hoisting and Conveying Machinery. Compiled by P. Stulpnagel 12mo. Ios. 6d. net.. .... CONSTABLE, Fe'. 10",,,,Fe'. 10,net
"Deinhardt-Schlomann Series of Technical Dic- tionaries. Vol. 8, Reinforced Concrete in Sub- and Superstructure, Compiled by H. Becher. 12mo. 6s. net, Ithr. 8s. 6d. net CONSTABLE, Mar. 10",,,Deinhardt-Schlomann Series of Technical Dic- tionaries,CONSTABLE,8s. 6d.,12mo.,"Deinhardt-Schlomann Series of Technical Dic- tionaries. Vol. 8, Reinforced Concrete in Sub- and Superstructure, Compiled by H. Becher. 12mo. 6s. net, Ithr. 8s. 6d. net CONSTABLE, Mar. 10",,,,Mar. 10,net
"Deinhardt-Schlomann Technical Dictionaries, Vol. 9. Machine Tools, by W. Wagner. 12mo. CONSTABLE, Nov. 10",,,"Deinhardt-Schlomann Technical Dictionaries, Vol",CONSTABLE,,12mo.,"Deinhardt-Schlomann Technical Dictionaries, Vol. 9. Machine Tools, by W. Wagner. 12mo. CONSTABLE, Nov. 10",,,,Nov. 10,
"Deinhardt-Schlomann Series of Technical Dic. tionaries. Vol. 10. Motor Vehicles. Edit. by R. Urtel. 12mo. 12s. 60. net CONSTABLE, Oct. 10",,,Deinhardt-Schlomann Series of Technical Dic,CONSTABLE,,12mo.,"Deinhardt-Schlomann Series of Technical Dic. tionaries. Vol. 10. Motor Vehicles. Edit. by R. Urtel. 12mo. 12s. 60. net CONSTABLE, Oct. 10",,,,Oct. 10,
"Denmark, Consular Report for 1909, 6 d. V'YMAX, Aug. 10",,,"Denmark, Consular Report for",V'YMAX,,,"Denmark, Consular Report for 1909, 6 d. V'YMAX, Aug. 10",,,,Aug. 10,
"Description of Chinese Pottery and Porcelain : Being a Translation of the T'Ao Shuo. Intro., notes and bibliography by Stephen W. Bussell. 8vo. 9 X54, pp. 254, 14s. net (Clarendon Press), FROIDE, Apr. 10",,,Description of Chinese Pottery and Porcelain : Being a Translation of the T'Ao Shuo,FROIDE,,8vo.,"Description of Chinese Pottery and Porcelain : Being a Translation of the T'Ao Shuo. Intro., notes and bibliography by Stephen W. Bussell. 8vo. 9 X54, pp. 254, 145. net (Clarendon Press), FROIDE, Apr. 10",,,,Apr. 10,
"Design for Woodcarvers. Cr. 8vo. swd. 6d. net P. MARSHALL, Mar. 10",,,Design for Woodcarvers,P. MARSHALL,6d.,8vo.,"Design for Woodcarvers. Cr. 8vo. swd. 6d. net P. MARSHALL, Mar. 10",,,,Mar. 10,net
"Destitution and Unemployment (the Abolition of). Report of the London Conference. (Convened by the Independent Labour Party, October 7th, 1910.) swd. id. NATIONAL LABOUR PRESS, Nov. 10",,,Destitution and Unemployment (the Abolition of),NATIONAL LABOUR PRESS,,,"Destitution and Unemployment (the Abolition of). Report of the London Conference. (Convened by the Independent Labour Party, October 7th, 1910.) swd. id. NATIONAL LABOUR PRESS, Nov. 10",,,,Nov. 10,
"Dial Calendar, 1911, 6d. net .. SIMPKIN, Sep. 10",,,Dial Calendar,SIMPKIN,6d.,,"Dial Calendar, 1911, 6d. net .. SIMPKIN, Sep. 10",,,,Sep. 10,net
"Diary of an English Girl (The). Cr. 8vo. 71 x 5, pp. 298, 6s. DUCKWORTH, Feb. 10",,,Diary of an English Girl (The),DUCKWORTH,6s.,8vo.,"Diary of an English Girl (The). Cr. 8vo. 71 x 5, pp. 298, 6s. DUCKWORTH, Feb. 10",,,,Feb. 10,
"Dickens Charles)-Chimes. 16mo. 3] X2 Ithr. is. net (Langham Booklets) SIEGLE, I., June to Dickens (Charles)- A Child's History of England. Centenary Edit. 8vo. 87 X 52, pp. 488, 38. 60. CHAPMAN & H., Nov. 10",,,Dickens Charles)-Chimes,CHAPMAN & H.,,16mo.,"Dickens Charles)-Chimes. 16mo. 3] X2 Ithr. is. net (Langham Booklets) SIEGLE, I., June to Dickens (Charles)- A Child's History of England. Centenary Edit. 8vo. 87 X 52, pp. 488, 38. 60. CHAPMAN & H., Nov. 10",,,,Nov. 10,
"Dickson Manuscripts (The). Being Diaries, Letters, Maps, &c., of the late Major-General Sir Alexander Dickson, Series “C, from 1809 to 1818. (Chapter 6, January ist to June 30th, 1813.) 8vo. 9 x6, pp. 829-946, 23, 6d. (Woolwich) RYL. ARTILLERY INSTITN., Nov. 10",,,Dickson Manuscripts (The),RYL. ARTILLERY INSTITN.,6d.,8vo.,"Dickson Manuscripts (The). Being Diaries, Letters, Maps, &c., of the late Major-General Sir Alexander Dickson, Series “C, from 1809 to 1818. (Chapter 6, January ist to June 30th, 1813.) 8vo. 9 x6, pp. 829-946, 23, 6d. (Woolwich) RYL. ARTILLERY INSTITN., Nov. 10",,,,Nov. 10,
"Dictionary of Philatelic Terms and Phrases (The). Illus. 12mo. 64 x 4, pp. 168, is. 6d. net L. U. GILL, Nov. 10",,,Dictionary of Philatelic Terms and Phrases (The),L. U. GILL,6d.,12mo.,"Dictionary of Philatelic Terms and Phrases (The). Illus. 12mo. 64 x 4, pp. 168, is. 6d. net L. U. GILL, Nov. 10",,,,Nov. 10,net
"Dindorf's Scenici Græci, Notes and Emendations. 7s. 61. net ...Νου. Το Ding wall (G. C.)-Experimental Geography. Cr. 8vo. 7* X5, pp. 176, 2s. 60. ..BELL, Mar. 10",,,"Dindorf's Scenici Græci, Notes and Emendations",BELL,,8vo.,"Dindorf's Scenici Græci, Notes and Emendations. 7s. 61. net ...Νου. Το Ding wall (G. C.)-Experimental Geography. Cr. 8vo. 7* X5, pp. 176, 25. 60. ..BELL, Mar. 10",,,,Mar. 10,
"Dionysius of Halicarnassus on Literary Composi- tion. Being the Greek Text of the De Com- positione Verboruin. Edit. with Intro. Trans., Notes, Glossary, and Appendices, by W. Rhys Roberts. 8vo. 9X58, pp. 372, 1os. net MACMILLAN, Jan. 10",,,Dionysius of Halicarnassus on Literary Composi- tion,MACMILLAN,,8vo.,"Dionysius of Halicarnassus on Literary Composi- tion. Being the Greek Text of the De Com- positione Verboruin. Edit. with Intro. Trans., Notes, Glossary, and Appendices, by W. Rhys Roberts. 8vo. 9X58, pp. 372, 1os. net MACMILLAN, Jan. 10",,,,Jan. 10,
"Directory of Directors (The) 1910. Edit. by Thomas Skinner. Cr. 8vo. 15s. net OFFICE, Feb. 10",,,Directory of Directors (The),OFFICE,15s.,8vo.,"Directory of Directors (The) 1910. Edit. by Thomas Skinner. Cr. 8vo. 155. net OFFICE, Feb. 10",,,,Feb. 10,net
"Directory of Paper Makers, 1910. 4to. 10* *71, pp. 219, s. ....... ...MARCHANT SINGER, Mar. 10",,,Directory of Paper Makers,MARCHANT SINGER,,4to.,"Directory of Paper Makers, 1910. 4to. 10* *71, pp. 219, IS. ....... ...MARCHANT SINGER, Mar. 10",,,,Mar. 10,
"Directory of the Chief Industries of India, Ceylon, &c. 1910. Ryl. 8vo. swd. gs. net THACKER, June 10",,,"Directory of the Chief Industries of India, Ceylon, &c",THACKER,,8vo.,"Directory of the Chief Industries of India, Ceylon, &c. 1910. Ryl. 8vo. swd. gs. net THACKER, June 10",,,,June 10,
"Dīwān of Hassān B. Thābit (The) (O.B., A.H. 54). Edit. by Hartwig Hirschfeld. In Arabic, with an Intro. in English. Ryl. 8vo., pp. 218, 58. net (Grbb Memorial Ser.) ..LUZAC, June 10",,,"Dīwān of Hassān B. Thābit (The) (O.B., A.H",LUZAC,,8vo.,"Dīwān of Hassān B. Thābit (The) (O.B., A.H. 54). Edit. by Hartwig Hirschfeld. In Arabic, with an Intro. in English. Ryl. 8vo., pp. 218, 58. net (Grbb Memorial Ser.) ..LUZAC, June 10",,,,June 10,
"Do Afflictions come from God ? An appeal to Scripture. By W. M. Cr. 8vo. 7* X5, pp. 152, 28. net .E. STOCK, Nov. 10",,,Do Afflictions come from God ? An appeal to Scripture,E. STOCK,,8vo.,"Do Afflictions come from God ? An appeal to Scripture. By W. M. Cr. 8vo. 7* X5, pp. 152, 28. net .E. STOCK, Nov. 10",,,,Nov. 10,
"Dobbs (W. J.-Weighing and 'Measuring. A Short Course of Practical Exercises in Elemen- tary Mathematics and Physics. Cr. 8vo. 73 X 44, pp. 186, 2s......... .METHUEN, Mar. 10",,,Dobbs (W. J.-Weighing and 'Measuring,METHUEN,2s.,8vo.,"Dobbs (W. J.-Weighing and 'Measuring. A Short Course of Practical Exercises in Elemen- tary Mathematics and Physics. Cr. 8vo. 73 X 44, pp. 186, 25......... .METHUEN, Mar. 10",,,,Mar. 10,
"Dod's Parliamentary Companion for 1910. 32mo., limp, 3s. 6d. net .. WHITTAKER, Mar. 10",,,Dod's Parliamentary Companion for,WHITTAKER,3s. 6d.,32mo.,"Dod's Parliamentary Companion for 1910. 32mo., limp, 3s. 6d. net .. WHITTAKER, Mar. 10",,,,Mar. 10,net
"Dod's Peerage, Baronetage, and Knightage of Great Britain and Ireland for 1911, including all the Titled Classes. 12mo. 7 *41, pp. 1386, Ios. 6d. net . . SIMPKIN, Dec. 10",,,"Dod's Peerage, Baronetage, and Knightage of Great Britain and Ireland for",SIMPKIN,6d.,12mo.,"Dod's Peerage, Baronetage, and Knightage of Great Britain and Ireland for 1911, including all the Titled Classes. 12mo. 7 *41, pp. 1386, Ios. 6d. net . . SIMPKIN, Dec. 10",,,,Dec. 10,net
