entry,last_name,first_name,title,publisher,price,format,original_entry,author_name,creators,is_editor,date,catalogue_year,is_net
"Problematic mental arithmetic (The). By an Assistant Inspector of Schools. 6th ed. Cr. 8vo. 7×4, pp. 95, limp 1s. 4d. net T. EVANS, Oct. '21",,,Problematic mental arithmetic (The),T. EVANS,1s. 4d.,8vo.,"Problematic mental arithmetic (The). By an Assistant Inspector of Schools. 6th ed. Cr. 8vo. 7×4, pp. 95, limp Is. 4d. net T. EVANS, Oct. '21",,,,Oct. '21,1921,net
"• Process of man's becoming (The): based on communications by thought-transference from selves in inner states of being. By Quæstor Vitæ. Pref. by David Gow. 8vo. 8×51, pp. 254, 8s. net......DUCKWORTH, Oct. '21",,,Process of man's becoming (The): based on communications by thought-transference from selves in inner states of being,DUCKWORTH,8s.,8vo.,"• Process of man's becoming (The): based on communications by thought-transference from selves in inner states of being. By Quæstor Vitæ. Pref. by David Gow. 8vo. 8×51, pp. 254, 8s. net......DUCKWORTH, Oct. '21",,,,Oct. '21,1921,net
"Prodigal returns (The). By the author of The Golden fountain and The Romance of the soul. Cr. 8vo. 7X 41, pp. 220, 3s. 6d. net J. M. WATKINS, Nov. '21",,,Prodigal returns (The),J. M. WATKINS,3s. 6d.,8vo.,"Prodigal returns (The). By the author of The Golden fountain and The Romance of the soul. Cr. 8vo. 7X 41, pp. 220, 3s. 6d. net J. M. WATKINS, Nov. '21",,,,Nov. '21,1921,net
"Profiteering Acts, 1919-20--Central Committee: Chairman's report, Sept. 30th, 1919, to May 19th, 1921. 1s. net....... H.M.S.O., July '21",,,Profiteering Acts,H.M.S.O.,1s.,,"Profiteering Acts, 1919-20--Central Committee: Chairman's report, Sept. 30th, 1919, to May 19th, 1921. Is. net....... H.M.S.O., July '21",,,,July '21,1921,net
"Profiteering Acts, 1919 and 1920-Reports: Agricultural implements, 2d.; Boot and shoe scheme (Standard) 2nd report, id.; Boots (Repairing), 1d.; Brushes and brooms, 2d.; Building materials (light castings), 2d.; Coal in London, 2d.; Clothing (Standard), 2d.; Cotton (Sewing), id.; Dyeing and cleaning, 2d.; Dyeing, finishing, &c., id.; Dyes and dyestuffs, 4d.; Explosives industry, 2d.; Gas apparatus, 3d.; Glassware, 2d.; Iron and steel products (nails, &c.), 2d.; Meat (final report), 2d.; Milk, 1d.; Motor fuel (2nd report), 2d.; Pipes and castings, 1d.; Pottery, 2d.; Slates, id. Soap, 3d.; Stone, brick and clayware trades (final report), 2d.; Uniform clothing, id.; Vinegar, id.; Wool, tops and yarns, 4d. ; Yeast, 2d... H.M.S.O., Jan., &c., '21",,,Profiteering Acts,H.M.S.O.,2d.,,"Profiteering Acts, 1919 and 1920-Reports: Agricultural implements, 2d.; Boot and shoe scheme (Standard) 2nd report, id.; Boots (Repairing), Id.; Brushes and brooms, 2d.; Building materials (light castings), 2d.; Coal in London, 2d.; Clothing (Standard), 2d.; Cotton (Sewing), id.; Dyeing and cleaning, 2d.; Dyeing, finishing, &c., id.; Dyes and dyestuffs, 4d.; Explosives industry, 2d.; Gas apparatus, 3d.; Glassware, 2d.; Iron and steel products (nails, &c.), 2d.; Meat (final report), 2d.; Milk, Id.; Motor fuel (2nd report), 2d.; Pipes and castings, 1d.; Pottery, 2d.; Slates, id. Soap, 3d.; Stone, brick and clayware trades (final report), 2d.; Uniform clothing, id.; Vinegar, id.; Wool, tops and yarns, 4d. ; Yeast, 2d... H.M.S.O., Jan., &c., '21",,,,"Jan., &c., '21",1921,
"Prohibition : Man's descent from Ludovici (A. M.) 14s. net.. Project method of teaching, Stevenson net Proletcult, Paul (E. and C.) 4s. 6d. net Prolusiones Academicæ. Exercises which having obtained prizes in the University of Cambridge were recited in the Senate House, 4 June, 1921. Demy 8vo. pp. 36, 2s. 6d. net CAMB. UNIV. PR., June '21",,,Prohibition : Man's descent from Ludovici (A. M.),CAMB. UNIV. PR.,2s. 6d.,8vo.,"Prohibition : Man's descent from Ludovici (A. M.) 14s. net.. Project method of teaching, Stevenson net Proletcult, Paul (E. and C.) 4s. 6d. net Prolusiones Academicæ. Exercises which having obtained prizes in the University of Cambridge were recited in the Senate House, 4 June, 1921. Demy 8vo. pp. 36, 2s. 6d. net CAMB. UNIV. PR., June '21",,,,June '21,1921,net
"Proper masses of the Saints (The). Swd. 5s. net (Exeter books) ..Socy. of SS. P. & P., July '21",,,Proper masses of the Saints (The),SS. P. & P.,,,"Proper masses of the Saints (The). Swd. 5s. net (Exeter books) ..Socy. of SS. P. & P., July '21",,,,July '21,1921,
"CAMB. UNIV. PR., Feb. '21",,,,CAMB. UNIV. PR.,,,"CAMB. UNIV. PR., Feb. '21",,,,Feb. '21,1921,
"Public schools year book (The): the official book or reference of the headmasters' Conference, 1921. Edit. by H. F. W. Deane and W. A. Bulkeley Evans. Cr. 8vo. 7×4, pp. 795, IOS. 6d. net.. .DEANE, Apr. '21",,,Public schools year book (The): the official book or reference of the headmasters' Conference,DEANE,6d.,8vo.,"Public schools year book (The): the official book or reference of the headmasters' Conference, 1921. Edit. by H. F. W. Deane and W. A. Bulkeley Evans. Cr. 8vo. 7×4, pp. 795, IOS. 6d. net.. .DEANE, Apr. '21",,,,Apr. '21,1921,net
"6d. net... .H.M.S.O., May '21",,,,H.M.S.O.,6d.,,"6d. net... .H.M.S.O., May '21",,,,May '21,1921,net
"Public Works Ioan Board-46th annual report, 1920-21. 6d. net. H.M.S.O., Aug. '21",,,Public Works Ioan Board,H.M.S.O.,6d.,,"Public Works Ioan Board-46th annual report, 1920-21. 6d. net. H.M.S.O., Aug. '21",,,,Aug. '21,1921,net
"Publicity the official journal of the Publicity Club, London (Quarterly) No. 1, Mar., 1921. 92×6 (51 New Oxford St., W.C.) OFFICE, Apr. '21",,,"Publicity the official journal of the Publicity Club, London (Quarterly)",OFFICE,,,"Publicity the official journal of the Publicity Club, London (Quarterly) No. 1, Mar., 1921. 92×6 (51 New Oxford St., W.C.) OFFICE, Apr. '21",,,,Apr. '21,1921,
"Puck annual, 1922: for boys and girls of all ages. 4to. 9×71, pp. 196, 6s. net AMALGAMATED PR., Aug. '21",,,Puck annual,AMALGAMATED PR.,6s.,4to.,"Puck annual, 1922: for boys and girls of all ages. 4to. 9×71, pp. 196, 6s. net AMALGAMATED PR., Aug. '21",,,,Aug. '21,1921,net
"Punch and Judy. Folio, 14 × 91, swd. is. net (Seaside cut-out ser. Shakespeare ser.) ALLDAY, Aug. '21",,,Punch and Judy,ALLDAY,,,"Punch and Judy. Folio, 14 × 91, swd. is. net (Seaside cut-out ser. Shakespeare ser.) ALLDAY, Aug. '21",,,,Aug. '21,1921,
"Purchaser, Bona fide, Jones (J. W.) 12s. 6d. net Pyle (Katharine)-Wonder tales from many lands. Illus. Cr. 8vo. 7×5, pp. 125, 2s. 6d. net HARRAP, Apr. '21",,,"Purchaser, Bona fide, Jones (J. W.)",HARRAP,2s. 6d.,8vo.,"Purchaser, Bona fide, Jones (J. W.) 12s. 6d. net Pyle (Katharine)-Wonder tales from many lands. Illus. Cr. 8vo. 7×5, pp. 125, 2s. 6d. net HARRAP, Apr. '21",,,,Apr. '21,1921,net
"Q. See Quiller-Couch (A. T., Sir). Qanungo (K.)-Sher Shah: a critical study based on original sources. 8vo. pp. 456, 12s. 6d. LUZAC, Nov. '21",,,Sher Shah: a critical study based on original sources,LUZAC,12s. 6d.,8vo.,"Q. See Quiller-Couch (A. T., Sir). Qanungo (K.)-Sher Shah: a critical study based on original sources. 8vo. pp. 456, 12s. 6d. LUZAC, Nov. '21",,"['Q. See Quiller-Couch (A. T., Sir). Qanungo (K.)']",,Nov. '21,1921,
"Purity a middle English poem. Ed. by R. Menner. 8vo. swd. 8s. 6d. net. (Yale studies in English) (Yale Univ. Pr.) MILFORD, Mar. '21",,,Purity a middle English poem,MILFORD,,8vo.,"Purity a middle English poem. Ed. by R. Menner. 8vo. swd. 8s. 6d. net. (Yale studies in English) (Yale Univ. Pr.) MILFORD, Mar. '21",,,,Mar. '21,1921,
"Puss in Pye corner. By  Exact Thinker. 10×8, pp. 410 (6 Walton Place, S.W. 3) THOUGHT VALUES, Jan. '21",,,Puss in Pye corner,THOUGHT VALUES,,,"Puss in Pye corner. By  Exact Thinker. 10×8, pp. 410 (6 Walton Place, S.W. 3) THOUGHT VALUES, Jan. '21",,,,Jan. '21,1921,
"Queen Anne's Bounty-Annual report and accounts, 1920. 2s. net....H.M.S.O., Apr. '21",,,Queen Anne's Bounty-Annual report and accounts,H.M.S.O.,2s.,,"Queen Anne's Bounty-Annual report and accounts, 1920. 2s. net....H.M.S.O., Apr. '21",,,,Apr. '21,1921,net
"Queen Bee (The), and other folk tales from the German. Illustrated by Murray B. Bladon. Repr. Cr. 8vo. 6×51, pp. 32, swd. 5d. (New guide readers: grade 1) .... DAVIS & MOUGHTON, Sep. '21",,,"Queen Bee (The), and other folk tales from the German",DAVIS & MOUGHTON,5d.,8vo.,"Queen Bee (The), and other folk tales from the German. Illustrated by Murray B. Bladon. Repr. Cr. 8vo. 6×51, pp. 32, swd. 5d. (New guide readers: grade 1) .... DAVIS & MOUGHTON, Sep. '21",,,,Sep. '21,1921,
"Queen Newspaper Book of travel (The) :) a guide to home and foreign resorts. Compiled by the Travel Editor. Illus. Cr. 8vo. 7×4t, pp. 492, 4s. net .FIELD PR., May '21",,,Queen Newspaper Book of travel (The) :) a guide to home and foreign resorts,FIELD PR.,4s.,8vo.,"Queen Newspaper Book of travel (The) :) a guide to home and foreign resorts. Compiled by the Travel Editor. Illus. Cr. 8vo. 7×4t, pp. 492, 4s. net .FIELD PR., May '21",,,,May '21,1921,net
"Queen's Hall meeting on constructive birth con- trol: speeches and impressions. Cr. 8vo. 7×4, pp. 50, swd is. net.. PUTNAM, Aug. '21",,,Queen's Hall meeting on constructive birth con- trol: speeches and impressions,PUTNAM,,8vo.,"Queen's Hall meeting on constructive birth con- trol: speeches and impressions. Cr. 8vo. 7×4, pp. 50, swd is. net.. PUTNAM, Aug. '21",,,,Aug. '21,1921,
"Queen's Own Royal West Kent Regiment- History, 1914-19. 8vo. (Hazell, Watson & V.) PRIVATELY PR., Aug. '21",,,Queen's Own Royal West Kent Regiment- History,PRIVATELY PR.,,8vo.,"Queen's Own Royal West Kent Regiment- History, 1914-19. 8vo. (Hazell, Watson & V.) PRIVATELY PR., Aug. '21",,,,Aug. '21,1921,
" Queer stories from Truth. 22nd ser. Cr. 8vo. 7 × 4, pp. 256, swd. 2s. 6d. net CASSELL, July '21",,,Queer stories from Truth,CASSELL,2s. 6d.,8vo.," Queer stories from Truth. 22nd ser. Cr. 8vo. 7 × 4, pp. 256, swd. 2s. 6d. net CASSELL, July '21",,,,July '21,1921,net
"Quintilian-Institutio oratoria. With an English trans. by H. E. Butler. (In 4 vols.) Vol. 1. 18mo. 6×41, pp. 559, 10s. net (Loeb classical lib.). .HEINEMANN, Feb. '21",,,Quintilian-Institutio oratoria,HEINEMANN,10s.,18mo.,"Quintilian-Institutio oratoria. With an English trans. by H. E. Butler. (In 4 vols.) Vol. 1. 18mo. 6×41, pp. 559, 10s. net (Loeb classical lib.). .HEINEMANN, Feb. '21",,,,Feb. '21,1921,net
"Quintilian-Institutio oratoria. With an English trans. by H. E. Butler. (In 4 vols.) Vol. 2. 18mo. 6×41, pp. 532, 10s. net. (Loeb classical lib.) .HEINEMANN, July '21",,,Quintilian-Institutio oratoria,HEINEMANN,,18mo.,"Quintilian-Institutio oratoria. With an English trans. by H. E. Butler. (In 4 vols.) Vol. 2. 18mo. 6×41, pp. 532, 10s. net. (Loeb classical lib.) .HEINEMANN, July '21",,,,July '21,1921,
"Quiver (The): the magazine for the home. Vol. 56, 1921. Ed. by Herbert D. Williams. 8vo. 91×6, pp. 1147, 12s. 6d. net CASSELL, Nov. '21",,,Quiver (The): the magazine for the home,CASSELL,12s. 6d.,8vo.,"Quiver (The): the magazine for the home. Vol. 56, 1921. Ed. by Herbert D. Williams. 8vo. 91×6, pp. 1147, 12s. 6d. net CASSELL, Nov. '21",,,,Nov. '21,1921,net
"R.I.C., Tales of the. 7s. 6d. net Νου. '21",,,,R.I.C.,,,"R.I.C., Tales of the. 7s. 6d. net Νου. '21",,,,Tales of the. 7s. 6d. net Νου. '21,1921,
"R.P.A. annual, 1922. 9×61, pp. 70, swd. 1s. net WATTS, Oct. '21",,,R.P.A. annual,WATTS,1s.,,"R.P.A. annual, 1922. 9×61, pp. 70, swd. Is. net WATTS, Oct. '21",,,,Oct. '21,1921,net
"Radiant dawn (The). A compilation by H. S. 18mo. 6×31, pp. 46, swd. 7d. net (Rosemary booklets). .SIMPKIN, Sep. '21",,,Radiant dawn (The),SIMPKIN,7d.,18mo.,"Radiant dawn (The). A compilation by H. S. 18mo. 6×31, pp. 46, swd. 7d. net (Rosemary booklets). .SIMPKIN, Sep. '21",,,,Sep. '21,1921,net
"Railway and Canal Commission-32nd annual report, 1920. 1d....... .H.M.S.O., Sep. '21",,,Railway and Canal Commission,H.M.S.O.,1d.,,"Railway and Canal Commission-32nd annual report, 1920. Id....... .H.M.S.O., Sep. '21",,,,Sep. '21,1921,
"Railway book. Folio. 14 X 91, swd. 1s. net (Seaside cut-out ser. Shakespeare ser.) ALLDAY, Aug. '21",,,Railway book,ALLDAY,1s.,,"Railway book. Folio. 14 X 91, swd. Is. net (Seaside cut-out ser. Shakespeare ser.) ALLDAY, Aug. '21",,,,Aug. '21,1921,net
"Railway Companies-Return showing the number of persons employed by the Railway Cos. of the U.K. during the week ended March 19, 1921 2d. net. .H.M.S.O., Aug. '21",,,Railway Companies-Return showing the number of persons employed by the Railway Cos,H.M.S.O.,2d.,,"Railway Companies-Return showing the number of persons employed by the Railway Cos. of the U.K. during the week ended March 19, 1921 2d. net. .H.M.S.O., Aug. '21",,,,Aug. '21,1921,net
"Railway returns. — Returns of the capital traffic, receipts, &c., for 1919, 3s. net H.M.S.O., Feb. '21",,,Railway returns,H.M.S.O.,3s.,,"Railway returns. — Returns of the capital traffic, receipts, &c., for 1919, 35. net H.M.S.O., Feb. '21",,,,Feb. '21,1921,net
"Railway Stockholders' Assoc.-Danger 6d. net. Railway thefts, Hadley (E. S.). net Trewman (H. F.) Railway year-book, 1921. (24th year.) 8×52, pp. 416, 5s. net.. RAILWAY PUBG. CO., May '21",,,Railway Stockholders' Assoc,RAILWAY PUBG. CO.,5s.,,"Railway Stockholders' Assoc.-Danger 6d. net. Railway thefts, Hadley (E. S.). net Trewman (H. F.) Railway year-book, 1921. (24th year.) 8×52, pp. 416, 5s. net.. RAILWAY PUBG. CO., May '21",,,,May '21,1921,net
"Rain-girl (The): a romance of to-day. By the author of Patricia Brent, spinster. Ch. ed. Cr. 8vo. 7 X 5, pp. 316, 2s. 6d. net H. JENKINS, July '21",,,Rain-girl (The): a romance of to-day,H. JENKINS,2s. 6d.,8vo.,"Rain-girl (The): a romance of to-day. By the author of Patricia Brent, spinster. Ch. ed. Cr. 8vo. 7 X 5, pp. 316, 2s. 6d. net H. JENKINS, July '21",,,,July '21,1921,net
"Rambler's guide to Birmingham and environs. 18mo. 4 × 61, pp. 64, swd. 1s. 34. net (Rambler's guide ser.). GEOGRAPHIA, July '21",,,Rambler's guide to Birmingham and environs,GEOGRAPHIA,,18mo.,"Rambler's guide to Birmingham and environs. 18mo. 4 × 61, pp. 64, swd. Is. 34. net (Rambler's guide ser.). GEOGRAPHIA, July '21",,,,July '21,1921,
"Rambler's guide to Bournemouth and environs. 18mo. 4 x 6, pp. 63, swd. 1s. 3d. net (Rambler's guide ser.) ......GEOGRAPHIA, July '21",,,Rambler's guide to Bournemouth and environs,GEOGRAPHIA,1s. 3d.,18mo.,"Rambler's guide to Bournemouth and environs. 18mo. 4 x 6, pp. 63, swd. Is. 3d. net (Rambler's guide ser.) ......GEOGRAPHIA, July '21",,,,July '21,1921,net
"Rambler's guide to Bradford and environs. 18mo. 4 × 6, pp. 64, swd. 1s. 3d. net (Rambler's guide ser.) ..GEOGRAPHIA, July '21",,,Rambler's guide to Bradford and environs,GEOGRAPHIA,1s. 3d.,18mo.,"Rambler's guide to Bradford and environs. 18mo. 4 × 6, pp. 64, swd. Is. 3d. net (Rambler's guide ser.) ..GEOGRAPHIA, July '21",,,,July '21,1921,net
"Rambler's guide to Dorking and the surrounding district a footpath guide with maps. By a Son of Surrey. 18mo. 4 X 61, pp. 61, swd. s. 3d. net (Rambler's guide ser.) GEOGRAPHIA, July '21",,,Rambler's guide to Dorking and the surrounding district a footpath guide with maps,GEOGRAPHIA,3d.,18mo.,"Rambler's guide to Dorking and the surrounding district a footpath guide with maps. By a Son of Surrey. 18mo. 4 X 61, pp. 61, swd. IS. 3d. net (Rambler's guide ser.) GEOGRAPHIA, July '21",,,,July '21,1921,net
"Rambler's guide to Iifracombe and environs. 18mo. 4 × 61, pp. 64, swd. 1s. 3d. net (Rambler's guide ser.)..GEOGRAPHIA, July '21",,,Rambler's guide to Iifracombe and environs,GEOGRAPHIA,1s. 3d.,18mo.,"Rambler's guide to Iifracombe and environs. 18mo. 4 × 61, pp. 64, swd. Is. 3d. net (Rambler's guide ser.)..GEOGRAPHIA, July '21",,,,July '21,1921,net
"Rambler's guide to Worthing and environs. 18mo. 3 × 61, pp. 63, swd. 1s. 3d. net (Rambler's guide ser.)....GEOGRAPHIA, July '21",,,Rambler's guide to Worthing and environs,GEOGRAPHIA,1s. 3d.,18mo.,"Rambler's guide to Worthing and environs. 18mo. 3 × 61, pp. 63, swd. Is. 3d. net (Rambler's guide ser.)....GEOGRAPHIA, July '21",,,,July '21,1921,net
"Rambler's handbook (The): the official year book of the Federation of Rambling Clubs, 1921. Cr. 8vo. 7×41, pp. 64, swd. 9d. net LARBY, Jan. '21",,,Rambler's handbook (The): the official year book of the Federation of Rambling Clubs,LARBY,9d.,8vo.,"Rambler's handbook (The): the official year book of the Federation of Rambling Clubs, 1921. Cr. 8vo. 7×41, pp. 64, swd. 9d. net LARBY, Jan. '21",,,,Jan. '21,1921,net
"Raphael's Prophetic almanac; or, The Prophetic messenger and weather guide for 1922. By Raphael. Cr. 8vo. 71× 4, pp. 124, swd. 1s. 9d., swd. 9d. .FOULSHAM, Sep. '21",,,"Raphael's Prophetic almanac; or, The Prophetic messenger and weather guide for",FOULSHAM,9d.,8vo.,"Raphael's Prophetic almanac; or, The Prophetic messenger and weather guide for 1922. By Raphael. Cr. 8vo. 71× 4, pp. 124, swd. Is. 9d., swd. 9d. .FOULSHAM, Sep. '21",,,,Sep. '21,1921,
"Rat (The) and how to kill him. 8×51, pp. 28, swd. 9d. net.. BALE, May '21",,,Rat (The) and how to kill him,BALE,9d.,,"Rat (The) and how to kill him. 8×51, pp. 28, swd. 9d. net.. BALE, May '21",,,,May '21,1921,net
"Rathbone (R.)-Unit jewellery. (In 6 parts.) Part I. 8vo. 81× 51, pp. 86, swd. 3s. 6d. net CONSTABLE, May '21",,,Part I,CONSTABLE,3s. 6d.,8vo.,"Rathbone (R.)-Unit jewellery. (In 6 parts.) Part I. 8vo. 81× 51, pp. 86, swd. 3s. 6d. net CONSTABLE, May '21",,['Rathbone (R.)-Unit jewellery. (In 6 parts.)'],,May '21,1921,net
"Raverat, Gwendolen. Folio, 10×71, swd. 3s. 9d. net (Modern Woodcutters, I.) 2s. ..... LITTLE ART ROOMS, Mar. '21",,,"Raverat, Gwendolen",LITTLE ART ROOMS,2s.,,"Raverat, Gwendolen. Folio, 10×71, swd. 3s. 9d. net (Modern Woodcutters, I.) 2S. ..... LITTLE ART ROOMS, Mar. '21",,,,Mar. '21,1921,
"Ravinartaka Chanakya Katha. With Bengali trans. by Satish Churn Law. 8vo. pp. 73, swd. .LUZAC, Aug. '21",,,Ravinartaka Chanakya Katha,LUZAC,,8vo.,"Ravinartaka Chanakya Katha. With Bengali trans. by Satish Churn Law. 8vo. pp. 73, swd. .LUZAC, Aug. '21",,,,Aug. '21,1921,
"Rays of reason: a fantasy. By A Converted Calvinist. 7×5, pp. 56, 2s. 6d. net (Andover Ho., Broadway, E. 13) W. S. CAINES, Sep. '21",,,Rays of reason: a fantasy,W. S. CAINES,2s. 6d.,,"Rays of reason: a fantasy. By A Converted Calvinist. 7×5, pp. 56, 2s. 6d. net (Andover Ho., Broadway, E. 13) W. S. CAINES, Sep. '21",,,,Sep. '21,1921,net
"Read, Charles Hercules: a tribute on his retire- ment from the British Museum, and a record of the chief additions to the Dept. of British and Medieval Antiquities during his keeper- ship, 1896-1921. Illus. 11×91, pp. 60 PRIVATELY PRINTED, Oct. '21",,,"Read, Charles Hercules: a tribute on his retire- ment from the British Museum, and a record of the chief additions to the Dept",PRIVATELY PRINTED,,,"Read, Charles Hercules: a tribute on his retire- ment from the British Museum, and a record of the chief additions to the Dept. of British and Medieval Antiquities during his keeper- ship, 1896-1921. Illus. 11×91, pp. 60 PRIVATELY PRINTED, Oct. '21",,,,Oct. '21,1921,
"Rebuilding a lost faith. By an American Agnostic. 8vo. 8 × 5, pp. 230, 10s. net BURNS, OATES, July '21",,,Rebuilding a lost faith,"BURNS, OATES",10s.,8vo.,"Rebuilding a lost faith. By an American Agnostic. 8vo. 8 × 5, pp. 230, 10s. net BURNS, OATES, July '21",,,,July '21,1921,net
"Recollections and reflections. By a Woman of no Importance. 8vo. 8×5, pp. 288, 12s. 6d. net E. NASH, Sep. '21",,,Recollections and reflections,E. NASH,12s. 6d.,8vo.,"Recollections and reflections. By a Woman of no Importance. 8vo. 8×5, pp. 288, 12s. 6d. net E. NASH, Sep. '21",,,,Sep. '21,1921,net
"Redcap's annual (The). Ryl. 8vo. 10 × 7, 4s. net EPWORTH PR., Oct. '21",,,Redcap's annual (The),EPWORTH PR.,4s.,8vo.,"Redcap's annual (The). Ryl. 8vo. 10 × 7, 4s. net EPWORTH PR., Oct. '21",,,,Oct. '21,1921,net
" Rees (J. F.)-A Short fiscal and financial history of England, 1815-1918. Cr. 8vo. 7×5, pp. 257, 6s. net .METHUEN, Sep. '21",,,Rees (J. F.)-A Short fiscal and financial history of England,METHUEN,6s.,8vo.," Rees (J. F.)-A Short fiscal and financial history of England, 1815-1918. Cr. 8vo. 7×5, pp. 257, 6s. net .METHUEN, Sep. '21",,,,Sep. '21,1921,net
"Reformatory and Industrial Schools of Ireland— 58th report, 1919, 3d. net..H.M.S.O., Mar. '21",,,Reformatory and Industrial Schools of Ireland—,H.M.S.O.,3d.,,"Reformatory and Industrial Schools of Ireland— 58th report, 1919, 3d. net..H.M.S.O., Mar. '21",,,,Mar. '21,1921,net
"Regimental annuals, 1920: The Sherwood Foresters, Nottinghamshire and Derbyshire Regiment. Ed. by Col. H. C. Wylly. 8vo. 8×51, pp. 131, 7s. 6d. net, swd. 5s. net ALLEN & U., Feb. '21",,,Regimental annuals,ALLEN & U.,5s.,8vo.,"Regimental annuals, 1920: The Sherwood Foresters, Nottinghamshire and Derbyshire Regiment. Ed. by Col. H. C. Wylly. 8vo. 8×51, pp. 131, 7s. 6d. net, swd. 5s. net ALLEN & U., Feb. '21",,,,Feb. '21,1921,net
"Register of thoroughbred stallions: containing the tabulated pedigrees and racing perform- ances of two hundred and eleven of the prin- cipal sires at the stud in the United Kingdom. With an appendix, giving shorter pedigrees of 504 additional stallions. Vol. 5. Compiled by F. M. Prior. 8×51, PP. 292 Registrar-General. marriages. THE SPORTSMAN, May '21",,,Register of thoroughbred stallions: containing the tabulated pedigrees and racing perform- ances of two hundred and eleven of the prin- cipal sires at the stud in the United Kingdom,THE SPORTSMAN,,,"Register of thoroughbred stallions: containing the tabulated pedigrees and racing perform- ances of two hundred and eleven of the prin- cipal sires at the stud in the United Kingdom. With an appendix, giving shorter pedigrees of 504 additional stallions. Vol. 5. Compiled by F. M. Prior. 8×51, PP. 292 Registrar-General. marriages. THE SPORTSMAN, May '21",,,,May '21,1921,
"Regular clerical experiences. By Clericus. Cr. 8vo. swd. 1s. net..SKEFFINGTON, June '21",,,Regular clerical experiences,SKEFFINGTON,1s.,8vo.,"Regular clerical experiences. By Clericus. Cr. 8vo. swd. Is. net..SKEFFINGTON, June '21",,,,June '21,1921,net
"Reid's Handy colliery guide and directory. 18mo. 6×4, pp. 258, 3s. 6d. net..A. REID, June '21",,,Reid's Handy colliery guide and directory,A. REID,3s. 6d.,18mo.,"Reid's Handy colliery guide and directory. 18mo. 6×4, pp. 258, 3s. 6d. net..A. REID, June '21",,,,June '21,1921,net
"Reincarnation: The true chronicles of rebirth of two affinities recorded by one of them. Ryl. 8vo. 9×51, pp. 217, 10s. 6d. net C. PALMER, Nov. '21",,,Reincarnation: The true chronicles of rebirth of two affinities recorded by one of them,C. PALMER,10s. 6d.,8vo.,"Reincarnation: The true chronicles of rebirth of two affinities recorded by one of them. Ryl. 8vo. 9×51, pp. 217, 10s. 6d. net C. PALMER, Nov. '21",,,,Nov. '21,1921,net
"Religious Tract Soc.-The World's hope: the 122nd annual report of the R.T.C., 1920-21.",,,Religious Tract Soc,R.T.C.,,,"Religious Tract Soc.-The World's hope: the 122nd annual report of the R.T.C., 1920-21.",,,,1920-21,1921,
"8×51, pp. 112 .R.T.S., Oct. '21",,,"8×51, pp",R.T.S.,,,"8×51, pp. 112 .R.T.S., Oct. '21",,,,Oct. '21,1921,
"Research Defence Society-Fight against disease. 8vo. swd. 6d. net MACMILLAN, May '21",,,Research Defence Society-Fight against disease,MACMILLAN,6d.,8vo.,"Research Defence Society-Fight against disease. 8vo. swd. 6d. net MACMILLAN, May '21",,,,May '21,1921,net
"H.M.S.O., Jan. '21",,,,H.M.S.O.,,,"H.M.S.O., Jan. '21",,,,Jan. '21,1921,
"Revised Version (The): opinions of some of the best authorities. 74×4, pp. 20, swd. 1s. net E. STOCK, Jan. '21",,,Revised Version (The): opinions of some of the best authorities,E. STOCK,1s.,,"Revised Version (The): opinions of some of the best authorities. 74×4, pp. 20, swd. Is. net E. STOCK, Jan. '21",,,,Jan. '21,1921,net
"Rhodesia First report of a Ctte. to consider cer- tain questions relating to Rhodesia. 3d. net H.M.S.O., May '21",,,Rhodesia First report of a Ctte,H.M.S.O.,3d.,,"Rhodesia First report of a Ctte. to consider cer- tain questions relating to Rhodesia. 3d. net H.M.S.O., May '21",,,,May '21,1921,net
"Rhymes that spring from the hammer's ring. 7×5, pp. 105, 3s. 6d. net....DRANE, Oct. '21",,,Rhymes that spring from the hammer's ring,DRANE,3s. 6d.,,"Rhymes that spring from the hammer's ring. 7×5, pp. 105, 3s. 6d. net....DRANE, Oct. '21",,,,Oct. '21,1921,net
"a romance of Dart- 6×41, pp. 205, 2s. .ODHAMS, May '21",,,Dart- 6,ODHAMS,2s.,,"a romance of Dart- 6×41, pp. 205, 25. .ODHAMS, May '21",,,,May '21,1921,
" Rita The Iron stair: moor. Ch. ed. 18mo. net Rita -The Jesters. Ch. ed. Cr. 8vo. 7×41, pp. 252, 2s. net .PEARSON, Nov. '21",,,Rita The Iron stair: moor,PEARSON,2s.,18mo.," Rita The Iron stair: moor. Ch. ed. 18mo. net Rita -The Jesters. Ch. ed. Cr. 8vo. 7×41, pp. 252, 2s. net .PEARSON, Nov. '21",,,,Nov. '21,1921,net
"Rita Souls. Cheap ed. 18mo. 6×41, pp. 280, 2s. net ..HUTCHINSON, Apr. '21",,,Rita Souls,HUTCHINSON,2s.,18mo.,"Rita Souls. Cheap ed. 18mo. 6×41, pp. 280, 25. net ..HUTCHINSON, Apr. '21",,,,Apr. '21,1921,net
" Riverside rambles round London. In 2 bks., North; and South. By Pathfinder. 18mo. 4 × 61, pp. 63; 64; swd. ea. 1s. 3d. net (Rambler's guide ser.) GEOGRAPHIA, July '21",,,Riverside rambles round London,GEOGRAPHIA,1s. 3d.,18mo.," Riverside rambles round London. In 2 bks., North; and South. By Pathfinder. 18mo. 4 × 61, pp. 63; 64; swd. ea. Is. 3d. net (Rambler's guide ser.) GEOGRAPHIA, July '21",,,,July '21,1921,net
"Road Fund-Account of receipts and payments, 1920-1921. 3d. net.... H.M.S.O., Nov. '21",,,Road Fund-Account of receipts and payments,H.M.S.O.,3d.,,"Road Fund-Account of receipts and payments, 1920-1921. 3d. net.... H.M.S.O., Nov. '21",,,,Nov. '21,1921,net
