entry,last_name,first_name,title,publisher,price,format,original_entry,author_name,creators,is_editor,date,catalogue_year,is_net
"Historical record of the Imperial visit to India (The), 1911. Compiled from the official records un ler the orders of the Viceroy and Governor- General of India. Illus. 4to. 11}x81, pp. 470, Ios. 6d. net MURRAY, Oct. 14",,,Historical record of the Imperial visit to India (The),MURRAY,6d.,4to.,"Historical record of the Imperial visit to India (The), 1911. Compiled from the official records un ler the orders of the Viceroy and Governor- General of India. Illus. 4to. 11}x81, pp. 470, Ios. 6d. net MURRAY, Oct. 14",,,,Oct. 14,1914,net
"Hobbies. Vol. 38, April 4 to Sept. 26, 1914. 8vo. .OFFICE, Dec. 14",,,Hobbies,OFFICE,,8vo.,"Hobbies. Vol. 38, April 4 to Sept. 26, 1914. 8vo. .OFFICE, Dec. 14",,,,Dec. 14,1914,
"Holbein, Hans, the younger, Huefir (Ford Madox) 3s. 6d. net Holberg, Comedies of, Campbell (0. J.) 10s. 60. net Holden (J. Stuart)— The Holy Gospels opened. Cr. 8vo. 71 X 48, pp. 156, 2s. 6d. net MORGAN & S., Dec. 14",,,"Holbein, Hans, the younger, Huefir (Ford Madox)",MORGAN & S.,2s. 6d.,8vo.,"Holbein, Hans, the younger, Huefir (Ford Madox) 3s. 6d. net Holberg, Comedies of, Campbell (0. J.) 10s. 60. net Holden (J. Stuart)— The Holy Gospels opened. Cr. 8vo. 71 X 48, pp. 156, 2s. 6d. net MORGAN & S., Dec. 14",,,,Dec. 14,1914,net
"Holiday resorts, 1914. 12mo., swd., is, net F. HODGSOY, May 14",,,Holiday resorts,F. HODGSOY,,12mo.,"Holiday resorts, 1914. 12mo., swd., is, net F. HODGSOY, May 14",,,,May 14,1914,
"Holidays (The) : Where to stay and what to see. 8vo., s W. HILI, July 14",,,Holidays (The) : Where to stay and what to see,W. HILI,,8vo.,"Holidays (The) : Where to stay and what to see. 8vo., IS W. HILI, July 14",,,,July 14,1914,
"Holland, War time and peace in, Scott (J. W. R.) 6s. net Holle man (A. F.)-A Laboratory manual of organic chemistry for beginners. 2nd edit. Cr. 8vo., 4s. 6d. net ..CHAPMAN & H., Feb. 14",,,"Holland, War time and peace in, Scott (J. W. R.)",CHAPMAN & H.,4s. 6d.,8vo.,"Holland, War time and peace in, Scott (J. W. R.) 6s. net Holle man (A. F.)-A Laboratory manual of organic chemistry for beginners. 2nd edit. Cr. 8vo., 4s. 6d. net ..CHAPMAN & H., Feb. 14",,,,Feb. 14,1914,net
"Home : a novel. Anon, Cr. 8vo. 7) *4, pp336, 6s. (First novel library).... .UNWIN, May 14",,,Home : a novel,UNWIN,6s.,8vo.,"Home : a novel. Anon, Cr. 8vo. 7) *4, pp336, 6s. (First novel library).... .UNWIN, May 14",,,,May 14,1914,
"Home mechanics—12mo., pp. 302, s. net. (Hobby books) . NELSON, Aug. 14",,,Home mechanics,NELSON,,12mo.,"Home mechanics—12mo., pp. 302, IS. net. (Hobby books) . NELSON, Aug. 14",,,,Aug. 14,1914,
"Home messenger (The), 1914. 4to. 2s. H. MARSHALL, Dec. 14",,,Home messenger (The),H. MARSHALL,2s.,4to.,"Home messenger (The), 1914. 4to. 25. H. MARSHALL, Dec. 14",,,,Dec. 14,1914,
"Home Office-Circulars and statutory rules issued to Justices and Justices' Clerks, 1883- 1913, 6d. . WYMAN, June 14",,,Home Office-Circulars and statutory rules issued to Justices and Justices' Clerks,WYMAN,6d.,,"Home Office-Circulars and statutory rules issued to Justices and Justices' Clerks, 1883- 1913, 6d. . WYMAN, June 14",,,,June 14,1914,
"Home Office-Preliminary tables of cases of industrial poisoning, fatal and non-fatal acci- dents, and dangerous occurrences in factories, workshops, &c., 1913. id. WYMAN, Mar. 14",,,"Home Office-Preliminary tables of cases of industrial poisoning, fatal and non-fatal acci- dents, and dangerous occurrences in factories, workshops, &c",WYMAN,,,"Home Office-Preliminary tables of cases of industrial poisoning, fatal and non-fatal acci- dents, and dangerous occurrences in factories, workshops, &c., 1913. id. WYMAN, Mar. 14",,,,Mar. 14,1914,
"Home Office-Records, 1782-1837. 8vo., 5s. WYMAN, Sep. 14",,,Home Office-Records,WYMAN,5s.,8vo.,"Home Office-Records, 1782-1837. 8vo., 55. WYMAN, Sep. 14",,,,Sep. 14,1914,
"Home Office-Reports on the explosion which occurred at Senghenydd Colliery, Glamorgan- shire, on 14th Oct., 1913 Illus., plans. s. 6d. WYMAY, Apr. 14",,,"Home Office-Reports on the explosion which occurred at Senghenydd Colliery, Glamorgan- shire, on",WYMAY,6d.,,"Home Office-Reports on the explosion which occurred at Senghenydd Colliery, Glamorgan- shire, on 14th Oct., 1913 Illus., plans. IS. 6d. WYMAY, Apr. 14",,,,Apr. 14,1914,
"Home Words for Heart and Hearth, 1914. 4to 28. OFFICE, Nov. 14",,,Home Words for Heart and Hearth,OFFICE,,4to,"Home Words for Heart and Hearth, 1914. 4to 28. OFFICE, Nov. 14",,,,Nov. 14,1914,
"Homeless poor-Report to Dec., 1913. 2}d. WYMAN, Apr. 14",,,Homeless poor-Report to Dec,WYMAN,,,"Homeless poor-Report to Dec., 1913. 2}d. WYMAN, Apr. 14",,,,Apr. 14,1914,
"Homer-Iliad : Done into English prose by Andrew Lang, Walter Leaf and Ernest Myers. Globe ed. Cr. 8vo. 71 X5, pp. 516, 3s. 6d. MACMILLAX, Dec. 14",,,"Homer-Iliad : Done into English prose by Andrew Lang, Walter Leaf and Ernest Myers",MACMILLAX,3s. 6d.,8vo.,"Homer-Iliad : Done into English prose by Andrew Lang, Walter Leaf and Ernest Myers. Globe ed. Cr. 8vo. 71 X5, pp. 516, 3s. 6d. MACMILLAX, Dec. 14",,,,Dec. 14,1914,
"Homer-Ilias. Cum annot. Heyn. 2 vols. advanced to 15s. net .MILFORD, June 14",,,Homer-Ilias,MILFORD,15s.,,"Homer-Ilias. Cum annot. Heyn. 2 vols. advanced to 15s. net .MILFORD, June 14",,,,June 14,1914,net
"Homer-Odyssea. Ex rec. G. Dindorf, advanced to 5s. 6d. net . MILFORD, June 14",,,Homer-Odyssea,MILFORD,5s. 6d.,,"Homer-Odyssea. Ex rec. G. Dindorf, advanced to 5s. 6d. net . MILFORD, June 14",,,,June 14,1914,net
"Homer- Seberi index, advanced to 6s. 60. net MILFORD, June 14",,,"Homer- Seberi index, advanced to",MILFORD,,,"Homer- Seberi index, advanced to 6s. 60. net MILFORD, June 14",,,,June 14,1914,
"Horace-Odes. Trans. into English verse by A. L. Taylor. Cr. 8vo., pp. 182, 4s. 6d. net MACLEHOSE, Feb. 14",,,Horace-Odes,MACLEHOSE,4s. 6d.,8vo.,"Horace-Odes. Trans. into English verse by A. L. Taylor. Cr. 8vo., pp. 182, 4s. 6d. net MACLEHOSE, Feb. 14",,,,Feb. 14,1914,net
"Horace—The Odes and epodes. With an English trans, by C. G. Bennett. 12m0., 63 X 41 pp. 456, 5s. net, Ithr. 6s. 6d. net (Loeb classical library) HEINEMANN, Jan. 14",,,Horace—The Odes and epodes,HEINEMANN,6s. 6d.,,"Horace—The Odes and epodes. With an English trans, by C. G. Bennett. 12m0., 63 X 41 pp. 456, 55. net, Ithr. 6s. 6d. net (Loeb classical library) HEINEMANN, Jan. 14",,,,Jan. 14,1914,net
"Horns of Taurus : poems. Fairfax (J. G.) 3s. 6d. net Hornung (E. W.)-The Crime doctor. Cr. Svo 7* X5, pp. 327, fis. ....NASH, July 14",,,Horns of Taurus : poems,NASH,,,"Horns of Taurus : poems. Fairfax (J. G.) 35. 6d. net Hornung (E. W.)-The Crime doctor. Cr. Svo 7* X5, pp. 327, fis. ....NASH, July 14",,,,July 14,1914,
"Horticultural record (The): consisting of coloured and half-tone reproductions of the most interest- ing and valuable flowers, plants, shrubs, &c., exhibited at the Royal International Horti- cultural Exhibition, 1912. Compiled by Richard Cory. 4to. 12 X94, pp. 516, and plates. 42s. net CHURCHILL, Apr. 14",,,"Horticultural record (The): consisting of coloured and half-tone reproductions of the most interest- ing and valuable flowers, plants, shrubs, &c",CHURCHILL,42s.,4to.,"Horticultural record (The): consisting of coloured and half-tone reproductions of the most interest- ing and valuable flowers, plants, shrubs, &c., exhibited at the Royal International Horti- cultural Exhibition, 1912. Compiled by Richard Cory. 4to. 12 X94, pp. 516, and plates. 425. net CHURCHILL, Apr. 14",,,,Apr. 14,1914,net
"Hossfeld's Technical dictionary, English-German and German-Tinglish. Compiled by C. N. Caspar. 18mo., 4s. net HIRSCHFELD, Jine 14",,,"Hossfeld's Technical dictionary, English-German and German-Tinglish",HIRSCHFELD,4s.,18mo.,"Hossfeld's Technical dictionary, English-German and German-Tinglish. Compiled by C. N. Caspar. 18mo., 4s. net HIRSCHFELD, Jine 14",,,,Jine 14,1914,net
"Housing of Government employees : return of the number of civil employees of each factory or dockyard under Government control whose wages bring them within the scope of the Insur- ance Act, and the number of houses provided for them by H.M. Government. d. WYMAN, June 14",,,"Housing of Government employees : return of the number of civil employees of each factory or dockyard under Government control whose wages bring them within the scope of the Insur- ance Act, and the number of houses provided for them by H.M. Government",WYMAN,,,"Housing of Government employees : return of the number of civil employees of each factory or dockyard under Government control whose wages bring them within the scope of the Insur- ance Act, and the number of houses provided for them by H.M. Government. d. WYMAN, June 14",,,,June 14,1914,
"How and why stories (nature study readers). Junior : Children of the fields and woods, swd. 3d.; Intermediate : The Magic garden, swd. 4d. Illus. ..MACMILLAN, May 14",,,How and why stories (nature study readers),MACMILLAN,,,"How and why stories (nature study readers). Junior : Children of the fields and woods, swd. 3d.; Intermediate : The Magic garden, swd. 4d. Illus. ..MACMILLAN, May 14",,,,May 14,1914,
"How armies fight. By Ubique. Formerly entitled “ Modern Warfare. Maps, diag., and illus. Cr. 8vo., pp. 490, bds. 1s net NELSON, Sep. 14",,,How armies fight,NELSON,1,8vo.,"How armies fight. By Ubique. Formerly entitled “ Modern Warfare. Maps, diag., and illus. Cr. 8vo., pp. 490, bds. Is net NELSON, Sep. 14",,,,Sep. 14,1914,net
"How to capture German trade. 16mo. 7d. net HODDER & S., Sep. 14",,,How to capture German trade,HODDER & S.,7d.,16mo.,"How to capture German trade. 16mo. 7d. net HODDER & S., Sep. 14",,,,Sep. 14,1914,net
"How to keep fit: a series of lectures to young men delivered at the Central Y.M.C.A., London. Cr. 8vo. 7° X4, pp. 132, bds., 1s. net JARROLD, June 14",,,"How to keep fit: a series of lectures to young men delivered at the Central Y.M.C.A., London",JARROLD,1s.,8vo.,"How to keep fit: a series of lectures to young men delivered at the Central Y.M.C.A., London. Cr. 8vo. 7° X4, pp. 132, bds., Is. net JARROLD, June 14",,,,June 14,1914,net
"How to say it in French : with a guide to pro- nunciation. For the use of our soldiers and sailors. 12mo. swd. 6d. net ARROWSMITH, Oct. 14",,,How to say it in French : with a guide to pro- nunciation,ARROWSMITH,6d.,12mo.,"How to say it in French : with a guide to pro- nunciation. For the use of our soldiers and sailors. 12mo. swd. 6d. net ARROWSMITH, Oct. 14",,,,Oct. 14,1914,net
"How to use a rifle or pistol, with a chapter on map-reading. 16mo. swd. 6d. net TEMPLE PPESS, Aug. 14",,,"How to use a rifle or pistol, with a chapter on map-reading",TEMPLE PPESS,6d.,16mo.,"How to use a rifle or pistol, with a chapter on map-reading. 16mo. swd. 6d. net TEMPLE PPESS, Aug. 14",,,,Aug. 14,1914,net
"How to win at auction bridge (“ Royal spades). By “Cut Cavendish. 2nd edit., rev. Cr. 8vo. 71 X41, pp. 210, 2s. 6d. net T. W. LAURIE, Mar. 14",,,How to win at auction bridge (“ Royal spades),T. W. LAURIE,2s. 6d.,8vo.,"How to win at auction bridge (“ Royal spades). By “Cut Cavendish. 2nd edit., rev. Cr. 8vo. 71 X41, pp. 210, 25. 6d. net T. W. LAURIE, Mar. 14",,,,Mar. 14,1914,net
"Howe's Classified directory to the Metropolitan charities, 1914. Cr. 8vo. swd. is. LONGMANS, Jan. 14",,,Howe's Classified directory to the Metropolitan charities,LONGMANS,,8vo.,"Howe's Classified directory to the Metropolitan charities, 1914. Cr. 8vo. swd. is. LONGMANS, Jan. 14",,,,Jan. 14,1914,
"Hugh Wynn, free Quaker, Mitchell (S. W.) 3s. 6d. Hughan (J. W.)--The Facts of socialism. Cr. 8vo. 3s. 6d. net · LANE, Feb. 14",,,"Hugh Wynn, free Quaker, Mitchell (S. W.)",LANE,,8vo.,"Hugh Wynn, free Quaker, Mitchell (S. W.) 35. 6d. Hughan (J. W.)--The Facts of socialism. Cr. 8vo. 35. 6d. net · LANE, Feb. 14",,,,Feb. 14,1914,
"Hull Municipal Museum----46th Quarterly record of additions. Edit. by T. Sheppard. Illus. 8vo., pp. 30, id. (Hull) A. BROUN & SONS, Jan. 14",,,Hull Municipal Museum---,A. BROUN & SONS,,8vo.,"Hull Municipal Museum----46th Quarterly record of additions. Edit. by T. Sheppard. Illus. 8vo., pp. 30, id. (Hull) A. BROUN & SONS, Jan. 14",,,,Jan. 14,1914,
"Hull Municipal Museum- -Quartuly record, 7: Additions, No. 47. By Thomas Sheppard. 8vo. swd. 1d. A. BROWN & SONS, Feb. 14",,,"Hull Municipal Museum- -Quartuly record, 7: Additions",A. BROWN & SONS,1d.,8vo.,"Hull Municipal Museum- -Quartuly record, 7: Additions, No. 47. By Thomas Sheppard. 8vo. swd. Id. A. BROWN & SONS, Feb. 14",,,,Feb. 14,1914,
"Humidity and Ventilation in Flax Mills and Lineni Factories (Departmental Committee on), Minutes of evidence, appendices and index, s, 2d. ... WYMAN, Oct. 14",,,"Humidity and Ventilation in Flax Mills and Lineni Factories (Departmental Committee on), Minutes of evidence, appendices and index, s",WYMAN,2d.,,"Humidity and Ventilation in Flax Mills and Lineni Factories (Departmental Committee on), Minutes of evidence, appendices and index, IS, 2d. ... WYMAN, Oct. 14",,,,Oct. 14,1914,
"Humidity and Ventilation in Flax Mills and Linen Factories (Departmental Committee on)-- Report and appendices. uid. WYMAN, July 14",,,Humidity and Ventilation in Flax Mills and Linen Factories (Departmental Committee on)-- Report and appendices,WYMAN,,,"Humidity and Ventilation in Flax Mills and Linen Factories (Departmental Committee on)-- Report and appendices. uid. WYMAN, July 14",,,,July 14,1914,
"Huntingdonshire, Kelly's Direct. of Bedfordshire, &c. 3os. ..Νου. Ι4 Hunt's Universal yacht list, 1914. Oblong 16mo., 6s. .IMRAY, May 14",,,"Huntingdonshire, Kelly's Direct",IMRAY,6s.,16mo.,"Huntingdonshire, Kelly's Direct. of Bedfordshire, &c. 3os. ..Νου. Ι4 Hunt's Universal yacht list, 1914. Oblong 16mo., 6s. .IMRAY, May 14",,,,May 14,1914,
"Hyder Joseph) --The Case for land nationalisation. People's edit. 8vo., pp. 448, swd., is. net SIMPKIN, July 14",,,Hyder Joseph) --The Case for land nationalisation,SIMPKIN,,8vo.,"Hyder Joseph) --The Case for land nationalisation. People's edit. 8vo., pp. 448, swd., is. net SIMPKIN, July 14",,,,July 14,1914,
"1deals for working days: thoughts from the works of the Most Rev. Randall Thomas Davidson, Archbp. of Canterbury. Selected by E. E. M. 12mo., is. net. (Fleur-de-Lis booklets.) MOWBRAY, May 14",,,,MOWBRAY,,12mo.,"Ideals for working days: thoughts from the works of the Most Rev. Randall Thomas Davidson, Archbp. of Canterbury. Selected by E. E. M. 12mo., is. net. (Fleur-de-Lis booklets.) MOWBRAY, May 14",,,,May 14,1914,
"1dentity of Romanism and Paganism (The). By the author of “ The Worship of the dead  Cr. 8vo., bds., s. net ...R. BANKS, May 14",,,,R. BANKS,,8vo.,"Identity of Romanism and Paganism (The). By the author of “ The Worship of the dead  Cr. 8vo., bds., IS. net ...R. BANKS, May 14",,,,May 14,1914,
"Hymns, Sequences and, Morley (H. W'.) 2s. 60. net Hyne (C. J. Cutcliffe)-Firemen hot. Cr. 8vo. 74 X5, pp. 318, 6s. ........METHUEN, Mar. 14",,,"Hymns, Sequences and, Morley (H. W'",METHUEN,6s.,8vo.,"Hymns, Sequences and, Morley (H. W'.) 25. 60. net Hyne (C. J. Cutcliffe)-Firemen hot. Cr. 8vo. 74 X5, pp. 318, 6s. ........METHUEN, Mar. 14",,,,Mar. 14,1914,
"Ibis (The): a quarterly journal of ornithology. Edit. by William L. Sclater. Vol. for 1913. Illus. 8vo. swd. 9 X54, (sub.) 328. net WESLEY, Jan. 14",,,Ibis (The): a quarterly journal of ornithology,WESLEY,,8vo.,"Ibis (The): a quarterly journal of ornithology. Edit. by William L. Sclater. Vol. for 1913. Illus. 8vo. swd. 9 X54, (sub.) 328. net WESLEY, Jan. 14",,,,Jan. 14,1914,
"Ibls (The): a quarterly journal of ornithology. 10th ser., vol. 2, 1914. Illus. 8vo. 9 X5, pp. 677, swd. 32s. net .......... WESLEY, Oct. 14",,,Ibls (The): a quarterly journal of ornithology,WESLEY,32s.,8vo.,"Ibls (The): a quarterly journal of ornithology. 10th ser., vol. 2, 1914. Illus. 8vo. 9 X5, pp. 677, swd. 325. net .......... WESLEY, Oct. 14",,,,Oct. 14,1914,net
"Ice and cold storage trades' directory and hand- book, 1914. 8vo. 9 X64, pp. 314, 5s. ILIFFE, Feb. 14",,,Ice and cold storage trades' directory and hand- book,ILIFFE,5s.,8vo.,"Ice and cold storage trades' directory and hand- book, 1914. 8vo. 9 X64, pp. 314, 55. ILIFFE, Feb. 14",,,,Feb. 14,1914,
"Image of war (The): a sporting autobiography. Ву Snaffle. 8vo. 9 X 5), pp. 428, 15s. net W. BLACKWOOD, Mar, 14",,,Image of war (The): a sporting autobiography,W. BLACKWOOD,15s.,8vo.,"Image of war (The): a sporting autobiography. Ву Snaffle. 8vo. 9 X 5), pp. 428, 155. net W. BLACKWOOD, Mar, 14",,,,"Mar, 14",1914,net
"Imperial Institute-Report, 1913. 2}d. WYMAN, Oct. 14",,,Imperial Institute-Report,WYMAN,,,"Imperial Institute-Report, 1913. 2}d. WYMAN, Oct. 14",,,,Oct. 14,1914,
"Imperial Institute-Selected reports from the Scientific and Technical Department. No. 5: Oil-seeds, oils, fats, and waxes. 8 d. WYMAN, Feb. 14",,,Imperial Institute-Selected reports from the Scientific and Technical Department,WYMAN,,,"Imperial Institute-Selected reports from the Scientific and Technical Department. No. 5: Oil-seeds, oils, fats, and waxes. 8 d. WYMAN, Feb. 14",,,,Feb. 14,1914,
"Imperialism and patriotism and the European crisis, 1914. Sydney edit. Folio. 14 X81, pp. 82, parchment 5s. net . BLACK, Nov. 14",,,Imperialism and patriotism and the European crisis,BLACK,5s.,,"Imperialism and patriotism and the European crisis, 1914. Sydney edit. Folio. 14 X81, pp. 82, parchment 5s. net . BLACK, Nov. 14",,,,Nov. 14,1914,net
"Imports and exports at prices of 1900— Tables showing for each of the years 1900–1913 the estimated value of imports and exports of the United Kingdom at the prices prevailing in 1900; with an intro. memo. 4d. WYMAN, June 14",,,Imports and exports at prices of,WYMAN,4d.,,"Imports and exports at prices of 1900— Tables showing for each of the years 1900–1913 the estimated value of imports and exports of the United Kingdom at the prices prevailing in 1900; with an intro. memo. 4d. WYMAN, June 14",,,,June 14,1914,
"Inclosure Acts-Return of all Acts passed for the inclosure of commons or waste lands in England and Wales. ed. . WYMAN, Aug. 14",,,Inclosure Acts-Return of all Acts passed for the inclosure of commons or waste lands in England and Wales,WYMAN,,,"Inclosure Acts-Return of all Acts passed for the inclosure of commons or waste lands in England and Wales. ed. . WYMAN, Aug. 14",,,,Aug. 14,1914,
"Income : Economic synthesis, Loria (A.) 10s. 6d. net Income and Expenditure (Public)--Account for 1913-14, d. WYMAN, May 14",,,"Income : Economic synthesis, Loria (A.)",WYMAN,,,"Income : Economic synthesis, Loria (A.) 10s. 6d. net Income and Expenditure (Public)--Account for 1913-14, d. WYMAN, May 14",,,,May 14,1914,
"Income tax and inhabited house duties : Reports of cases in Great Britain. Vol. 6, pt. 6. 6d. WYMAN, Aug. 14",,,Income tax and inhabited house duties : Reports of cases in Great Britain,WYMAN,6d.,,"Income tax and inhabited house duties : Reports of cases in Great Britain. Vol. 6, pt. 6. 6d. WYMAN, Aug. 14",,,,Aug. 14,1914,
"In the trail of the German army. Illus. with special photographs. 4to. swd. is. net “ DAILY CHRONICLE, Nov. 14",,,In the trail of the German army,DAILY CHRONICLE,,4to.,"In the trail of the German army. Illus. with special photographs. 4to. swd. is. net “ DAILY CHRONICLE, Nov. 14",,,,Nov. 14,1914,
"India Office-A Descriptive catalogue of the paintings, statues, &c., in the India office. By W. Foster. Cr. 8vo. 8.1 X 51, pp. 116, s. EYRE & S., Mar. 14",,,"India Office-A Descriptive catalogue of the paintings, statues, &c",EYRE & S.,,8vo.,"India Office-A Descriptive catalogue of the paintings, statues, &c., in the India office. By W. Foster. Cr. 8vo. 8.1 X 51, pp. 116, IS. EYRE & S., Mar. 14",,,,Mar. 14,1914,
"India Office list (The), 1914. 8vo., 1os. 6d. HARRISON & SONS, Apr. 14",,,India Office list (The),HARRISON & SONS,6d.,8vo.,"India Office list (The), 1914. 8vo., 1os. 6d. HARRISON & SONS, Apr. 14",,,,Apr. 14,1914,
"Indian chutneys, pickles and preserves. By L. V. Cr. 8vo., swd., 1s. 61. net THACKER, May 14",,,"Indian chutneys, pickles and preserves",THACKER,,8vo.,"Indian chutneys, pickles and preserves. By L. V. Cr. 8vo., swd., Is. 61. net THACKER, May 14",,,,May 14,1914,
"Indian Finance and Currency (Royal Commission on)--Final report, 9d. ; Minutes of Evidence, Pol. 2, is. 4d. ; Appendices to the final report, s. 20.; Index to minutes of evidence (two vols.) and Appendices (three vols.) od. WYMAN, Mar. 14",,,Indian Finance and Currency (Royal Commission on)--Final report,WYMAN,,,"Indian Finance and Currency (Royal Commission on)--Final report, 9d. ; Minutes of Evidence, Pol. 2, is. 4d. ; Appendices to the final report, IS. 20.; Index to minutes of evidence (two vols.) and Appendices (three vols.) od. WYMAN, Mar. 14",,,,Mar. 14,1914,
"Indian population : return showing the total population and the Indian population separately in various colonies and protectorates. d. WYMAN, Apr. 14",,,Indian population : return showing the total population and the Indian population separately in various colonies and protectorates,WYMAN,,,"Indian population : return showing the total population and the Indian population separately in various colonies and protectorates. d. WYMAN, Apr. 14",,,,Apr. 14,1914,
"Industrial directory of the United Kingdom, for 1914. s. 3d. WYMAX, Aug. 14",,,"Industrial directory of the United Kingdom, for",WYMAX,3d.,,"Industrial directory of the United Kingdom, for 1914. IS. 3d. WYMAX, Aug. 14",,,,Aug. 14,1914,
"Inebriates-10th report of the Inspector for Ireland, 1913. 1 d. ..WYMAN, Sep. 14",,,Inebriates,WYMAN,,,"Inebriates-10th report of the Inspector for Ireland, 1913. 1 d. ..WYMAN, Sep. 14",,,,Sep. 14,1914,
"Inebriates Acts-Report of the Inspector, 1912. 3d. . WYMAN, Feb. 14",,,Inebriates Acts-Report of the Inspector,WYMAN,3d.,,"Inebriates Acts-Report of the Inspector, 1912. 3d. . WYMAN, Feb. 14",,,,Feb. 14,1914,
"Infant's Magazine (The), 1914. 4to. 2s.; gilt 28. 6d ; bds, 1s. 6d. .PARTRIDGE, Oct. 14",,,Infant's Magazine (The),PARTRIDGE,1s. 6d.,4to.,"Infant's Magazine (The), 1914. 4to. 25.; gilt 28. 6d ; bds, Is. 6d. .PARTRIDGE, Oct. 14",,,,Oct. 14,1914,
"Influenza : its cause and cure. By Uncle Bob. Cr. 8vo., pp. 48, swd., 1s. net EWART, SEYMOUR, Mar. 14",,,Influenza : its cause and cure,"EWART, SEYMOUR",1s.,8vo.,"Influenza : its cause and cure. By Uncle Bob. Cr. 8vo., pp. 48, swd., Is. net EWART, SEYMOUR, Mar. 14",,,,Mar. 14,1914,net
"Insuranco blue book and guide (The), 1914. 8vo. limp 3s. .P. MARSHALL, July 14",,,Insuranco blue book and guide (The),P. MARSHALL,3s.,8vo.,"Insuranco blue book and guide (The), 1914. 8vo. limp 3s. .P. MARSHALL, July 14",,,,July 14,1914,
"England), 3!d. ; (Scotland), 3d. ; (Wales), 3d. ..... . WYMAN, Mar. 14",,,"England), 3!d",WYMAN,3d.,,"England), 3!d. ; (Scotland), 3d. ; (Wales), 3d. ..... . WYMAN, Mar. 14",,,,Mar. 14,1914,
"Insurance (National)-National Health Insurance (arrears) provisional amendment regulations 1914, dated 9th June, 1914. s. old. WYMAN, June 14",,,"1914, dated",WYMAN,,,"Insurance (National)-National Health Insurance (arrears) provisional amendment regulations 1914, dated 9th June, 1914. IS. old. WYMAN, June 14",,['Insurance (National)-National Health Insurance (arrears)'],,June 14,1914,
"Insurance (National)-Regulations (Provisional) made by the Joint Committee and the Insurance Commissioners, acting jointly. (Collection of Contributions). 3 d. .WYMAN, Jan. 14",,,"Joint Committee and the Insurance Commissioners, acting jointly",WYMAN,,,"Insurance (National)-Regulations (Provisional) made by the Joint Committee and the Insurance Commissioners, acting jointly. (Collection of Contributions). 3 d. .WYMAN, Jan. 14",,['Insurance (National)-Regulations (Provisional)'],,Jan. 14,1914,
"Invest in the Tropics. Illus. 8vo. 81 X 5), pp. 120 swd., 1s. net TROPICAL AGRIC. DEVELOP. AGENCY, Mar. 14",,,Invest in the Tropics,TROPICAL AGRIC. DEVELOP. AGENCY,1s.,8vo.,"Invest in the Tropics. Illus. 8vo. 81 X 5), pp. 120 swd., Is. net TROPICAL AGRIC. DEVELOP. AGENCY, Mar. 14",,,,Mar. 14,1914,net
"Investment handbook, 1914. Cr. 8vo., 2s. 6d. net JOHNSON & SANDERSON, Mar. 14",,,Investment handbook,JOHNSON & SANDERSON,2s. 6d.,8vo.,"Investment handbook, 1914. Cr. 8vo., 25. 6d. net JOHNSON & SANDERSON, Mar. 14",,,,Mar. 14,1914,net
"Investors' blue book (The), 1914. Edit. by Geo. J. Holmes. 4to. 5s. net INVESTORS' CHRONICLE, Jan. 14",,,Investors' blue book (The),INVESTORS' CHRONICLE,5s.,4to.,"Investors' blue book (The), 1914. Edit. by Geo. J. Holmes. 4to. 5s. net INVESTORS' CHRONICLE, Jan. 14",,,,Jan. 14,1914,net
"Investor's four-shilling year book, 191s. Ryl. 8vo., pp. 528, 4s. net “ FINAVCIAL REVIEW OF REVIEWS, Dec. 14",,,Investor's four-shilling year book,FINAVCIAL REVIEW OF REVIEWS,,8vo.,"Investor's four-shilling year book, 1915. Ryl. 8vo., pp. 528, 4s. net “ FINAVCIAL REVIEW OF REVIEWS, Dec. 14",,,,Dec. 14,1914,
"Ireland, Charitable Donations and Bequests for -- 69th report of the Commissioners, 1913. 2d. WYMAX, Sep. 14",,,"Ireland, Charitable Donations and Bequests for --",WYMAX,2d.,,"Ireland, Charitable Donations and Bequests for -- 69th report of the Commissioners, 1913. 2d. WYMAX, Sep. 14",,,,Sep. 14,1914,
"Ireland-Emigration statistics : report and table 2ld. .WYMAN, Apr. 14",,,Ireland-Emigration statistics : report and table,WYMAN,,,"Ireland-Emigration statistics : report and table 2ld. .WYMAN, Apr. 14",,,,Apr. 14,1914,
"Ireland, National Library of— Bibliography of Irish philology and of printed Irish literature. Ryl. 8vo. 10 X64, pp. 307, 4s. (Dublin) BROWNE & NOLAN ; WYMAN, Jan. 14",,,"Ireland, National Library of— Bibliography of Irish philology and of printed Irish literature",WYMAN,,8vo.,"Ireland, National Library of— Bibliography of Irish philology and of printed Irish literature. Ryl. 8vo. 10 X64, pp. 307, 45. (Dublin) BROWNE & NOLAN ; WYMAN, Jan. 14",,,,Jan. 14,1914,
