entry,last_name,first_name,title,publisher,price,format,original_entry,author_name,creators,is_editor,date,catalogue_year,is_net
"Paterson W. E.) and Taylor (E. 0.)--Elementary geometry : theoretical and practical. Vol. i, Triangles and quadrilaterals. Cr. 8vo., pp. 60, s. 8d. ....(Clarendoi Press) MILFORD, May 14",,,Paterson W. E.) and Taylor (E. 0,MILFORD,,8vo.,"Paterson W. E.) and Taylor (E. 0.)--Elementary geometry : theoretical and practical. Vol. i, Triangles and quadrilaterals. Cr. 8vo., pp. 60, IS. 8d. ....(Clarendoi Press) MILFORD, May 14",,,,May 14,1914,
"Paterson's Licensing. 24th edit. 8vo. 15s. net BUTTERWORTH, Jan. 14",,,Paterson's Licensing,BUTTERWORTH,15s.,8vo.,"Paterson's Licensing. 24th edit. 8vo. 155. net BUTTERWORTH, Jan. 14",,,,Jan. 14,1914,net
"Patrum Apostolicorum, quae supersunt edidit G. Jacobson. 8vo. advanced to 21s. net MILFORD, June 14",,,"Patrum Apostolicorum, quae supersunt edidit G. Jacobson",MILFORD,21s.,8vo.,"Patrum Apostolicorum, quae supersunt edidit G. Jacobson. 8vo. advanced to 215. net MILFORD, June 14",,,,June 14,1914,net
"Paton, John Brown : biog., Paton (J. L.) 12s. net Paton (John Lewis)—John Brown Paton. A biography. 8vo. 91 x 53, pp. 558, 12s. net HODDER & S., Oct. 14",,,"Paton, John Brown : biog",HODDER & S.,12s.,8vo.,"Paton, John Brown : biog., Paton (J. L.) 125. net Paton (John Lewis)—John Brown Paton. A biography. 8vo. 91 x 53, pp. 558, 125. net HODDER & S., Oct. 14",,,,Oct. 14,1914,net
"Pearson's magazine. Vol. 36, July-Decembers 1913. Ryl. 8vo. 6s. net ..PEARSON, Jan. 14",,,Pearson's magazine,PEARSON,6s.,8vo.,"Pearson's magazine. Vol. 36, July-Decembers 1913. Ryl. 8vo. 6s. net ..PEARSON, Jan. 14",,,,Jan. 14,1914,net
"Pearson's nautical almanack and tide tables. 8vo. bds. is. : extended is. 6d. IMRAY, Oct. 14",,,Pearson's nautical almanack and tide tables,IMRAY,6d.,8vo.,"Pearson's nautical almanack and tide tables. 8vo. bds. is. : extended is. 6d. IMRAY, Oct. 14",,,,Oct. 14,1914,
"Peasantry, England's, essays, Jessopp (A.) 7s. 6d. net Pease (Sir A. E.) see Blakeborough (J. F.) and Pease. Peck (Annie S.)-The South American tour. Illus. Svo. 8} *5), pp. 416, 12s. net HODDER & S., Mar, 14",,,"Peasantry, England's, essays, Jessopp (A.)",HODDER & S.,12s.,,"Peasantry, England's, essays, Jessopp (A.) 75. 6d. net Pease (Sir A. E.) see Blakeborough (J. F.) and Pease. Peck (Annie S.)-The South American tour. Illus. Svo. 8} *5), pp. 416, 125. net HODDER & S., Mar, 14",,,,"Mar, 14",1914,net
"Peebles and Selkirk (gcog.), Pringle (G. C.) is. 6d. Peek (Emily)-Practical instruction in cutting out and making up hospital garments for sick and wounded. With diagrams. Cr. 8vo, pp. 120, limp, is. net . BALE, Od. 14",,,6d,BALE,,"8vo,","Peebles and Selkirk (gcog.), Pringle (G. C.) is. 6d. Peek (Emily)-Practical instruction in cutting out and making up hospital garments for sick and wounded. With diagrams. Cr. 8vo, pp. 120, limp, is. net . BALE, Od. 14",,"['Peebles', 'Selkirk (gcog.), Pringle (G. C.)']",,Od. 14,1914,
"Pekingese pets, Some, Daniel (M. N.) 2s, net Pelham (H. S.!—The Training of a working boy. Cr. 8vo. 74 x 41, pp. 182, 3s. 6d. net MACMILLAN, May 14",,,"Pekingese pets, Some, Daniel (M. N.)",MACMILLAN,3s. 6d.,8vo.,"Pekingese pets, Some, Daniel (M. N.) 2s, net Pelham (H. S.!—The Training of a working boy. Cr. 8vo. 74 x 41, pp. 182, 3s. 6d. net MACMILLAN, May 14",,,,May 14,1914,net
"Peloubet's Select notes of the International lessons, 191s. 8vo. 4s. 6d. net........S.S.U., Nov. 14",,,Peloubet's Select notes of the International lessons,S.S.U.,4s. 6d.,8vo.,"Peloubet's Select notes of the International lessons, 1915. 8vo. 45. 6d. net........S.S.U., Nov. 14",,,,Nov. 14,1914,net
"Peninsula war, Hist. of, Oman (C.) Vol. 5. 14s. net Penlee recipe book (The) : a comprehensive cookery book containing 490 approved recipes on food reform lines. Cr. 8vo. 7} X 5, PP. 240, 2s. net . BELL, Dec. 14",,,"Peninsula war, Hist",BELL,2s.,8vo.,"Peninsula war, Hist. of, Oman (C.) Vol. 5. 14S. net Penlee recipe book (The) : a comprehensive cookery book containing 490 approved recipes on food reform lines. Cr. 8vo. 7} X 5, PP. 240, 25. net . BELL, Dec. 14",,,,Dec. 14,1914,net
"Penrose's annual, 191s. Vol. 20 of the Process year bonk. 4to. 10 X7, 58. net P. LUND, Dec, 14",,,Penrose's annual,P. LUND,,4to.,"Penrose's annual, 1915. Vol. 20 of the Process year bonk. 4to. 10 X7, 58. net P. LUND, Dec, 14",,,,"Dec, 14",1914,
"Cr. 8vo., pp. 228, is. ROUTLEDGE, Sep. 14",,,,ROUTLEDGE,,8vo.,"Cr. 8vo., pp. 228, is. ROUTLEDGE, Sep. 14",,,,Sep. 14,1914,
"Illus. by 300 full-page coloured plates with detailed descriptive notes. Intro. by Prof. Peter Pan painting book (The). 4to. bds. is. net Boulger. 4 vols. 4to. 315s. net LAWRENCE & J., Sep. 14",,,,LAWRENCE & J.,315s.,4to.,"Illus. by 300 full-page coloured plates with detailed descriptive notes. Intro. by Prof. Peter Pan painting book (The). 4to. bds. is. net Boulger. 4 vols. 4to. 3155. net LAWRENCE & J., Sep. 14",,,,Sep. 14,1914,net
"Col. plates. Folio 13 X101 (set of 4 gd. vols.) 315s. net ... QUARITCH, May 14",,,Col,QUARITCH,315s.,,"Col. plates. Folio 13 X101 (set of 4 gd. vols.) 3155. net ... QUARITCH, May 14",,,,May 14,1914,net
"CHANCERY LANE PRESS, July 14",,,,CHANCERY LANE PRESS,,,"CHANCERY LANE PRESS, July 14",,,,July 14,1914,
"Persia-Further correspondence respecting the Petrie (W. M. Flinders)—Amulets. Illus. by the affairs of Persia (Feb.-Oct., 1913) is. 6d. WYMAN, Apr. 14",,,Persia-Further correspondence respecting the Petrie (W. M. Flinders)—Amulets,WYMAN,6d.,,"Persia-Further correspondence respecting the Petrie (W. M. Flinders)—Amulets. Illus. by the affairs of Persia (Feb.-Oct., 1913) is. 6d. WYMAN, Apr. 14",,,,Apr. 14,1914,
"Egyptian collection in University College, Persia, Bible illus. from, Clifton (E. J.) 3s. 6d. London. 4to, 12} X91, pp. 68 and plates, 21s. net .... CONSTABLE, May 14",,,"Egyptian collection in University College, Persia, Bible illus",CONSTABLE,21s.,"4to,","Egyptian collection in University College, Persia, Bible illus. from, Clifton (E. J.) 35. 6d. London. 4to, 12} X91, pp. 68 and plates, 21S. net .... CONSTABLE, May 14",,,,May 14,1914,net
"Persian MSS., Cata. of collection in Metropolitan Petrovitch (Woislav M.)--Hero tales and legends of the Serbians. Illus. Ryl. 8vo. 9X61, pp. Mus., Jackson (A. V. W.) and Yohannan (A.) .HARRAP, Aug. 14",,,Persian MSS,HARRAP,,8vo.,"Persian MSS., Cata. of collection in Metropolitan Petrovitch (Woislav M.)--Hero tales and legends of the Serbians. Illus. Ryl. 8vo. 9X61, pp. Mus., Jackson (A. V. W.) and Yohannan (A.) .HARRAP, Aug. 14",,,,Aug. 14,1914,
"Headmaster. Cr. 8vo.71 X5, pp. 148, 2s. 60. 11'»t Phaedrus, Story of, Hillis (N. D.) 5s. 60. net GARDNER, DARTON, Nov. 14",,,Headmaster,"GARDNER, DARTON",,8vo,"Headmaster. Cr. 8vo.71 X5, pp. 148, 25. 60. 11'»t Phaedrus, Story of, Hillis (N. D.) 55. 60. net GARDNER, DARTON, Nov. 14",,,,Nov. 14,1914,
"Philippine Journal of Science (The)—Section A, Chemicai and geological sciences and the industries. Vol. 8. Illus., maps, Imp. 8vo. II X7}, pp. 449, swd., 8s. 6d. net WESLEY, July 14",,,"Philippine Journal of Science (The)—Section A, Chemicai and geological sciences and the industries",WESLEY,8s. 6d.,8vo.,"Philippine Journal of Science (The)—Section A, Chemicai and geological sciences and the industries. Vol. 8. Illus., maps, Imp. 8vo. II X7}, pp. 449, swd., 8s. 6d. net WESLEY, July 14",,,,July 14,1914,net
"Phllippine Journal of Science (The)-Section B, Tropical medicine. Vol. 8. Illus., map, Imp. 8vo. II X7), pp. 559, swd., 12s. 6d. net WESLEY, July 14",,,"Phllippine Journal of Science (The)-Section B, Tropical medicine",WESLEY,12s. 6d.,8vo.,"Phllippine Journal of Science (The)-Section B, Tropical medicine. Vol. 8. Illus., map, Imp. 8vo. II X7), pp. 559, swd., 12s. 6d. net WESLEY, July 14",,,,July 14,1914,net
"Philippine Journal of Science (The).-Section c, Botany, Vol. 8. Illus. Imp. 8vo. II X7!, pp. 525, swd., 8s. 6d. net . WESLEY, July 14",,,Philippine Journal of Science (The),WESLEY,8s. 6d.,8vo.,"Philippine Journal of Science (The).-Section c, Botany, Vol. 8. Illus. Imp. 8vo. II X7!, pp. 525, swd., 8s. 6d. net . WESLEY, July 14",,,,July 14,1914,net
"Philippine Journal of Science (The). - Section D, General biology, ethnology and anthropology. Vol. 8. Illus. Imp. 8vo. II X7, pp. 472, swd., 8s. 6d. net ... WESLEY, July 14",,,Philippine Journal of Science (The),WESLEY,8s. 6d.,8vo.,"Philippine Journal of Science (The). - Section D, General biology, ethnology and anthropology. Vol. 8. Illus. Imp. 8vo. II X7, pp. 472, swd., 8s. 6d. net ... WESLEY, July 14",,,,July 14,1914,net
"Philips' Chamber of Commerce atlas. 2nd erlit. Ryl. 8vo. 6s. net .......... G. PHILIP, Mar 14",,,Philips' Chamber of Commerce atlas,G. PHILIP,6s.,8vo.,"Philips' Chamber of Commerce atlas. 2nd erlit. Ryl. 8vo. 6s. net .......... G. PHILIP, Mar 14",,,,Mar 14,1914,net
"Philips' Photo-relief model war map of Central Europe. s. net .G. PIILIP, Dec. 14",,,Philips' Photo-relief model war map of Central Europe,G. PIILIP,,,"Philips' Photo-relief model war map of Central Europe. IS. net .G. PIILIP, Dec. 14",,,,Dec. 14,1914,
"Phillips' Paper trade directory of the world, 1913–14. 8vo. 8} 5), pp. 930, 15s. 6d. S. C. PHILLIPS, July 14",,,Phillips' Paper trade directory of the world,S. C. PHILLIPS,15s. 6d.,8vo.,"Phillips' Paper trade directory of the world, 1913–14. 8vo. 8} 5), pp. 930, 155. 6d. S. C. PHILLIPS, July 14",,,,July 14,1914,
"Philology (The Journal of). Vol. 33. 8vo., 6d. MACMILLAN, Oct. 14",,,Philology (The Journal of),MACMILLAN,6d.,8vo.,"Philology (The Journal of). Vol. 33. 8vo., 6d. MACMILLAN, Oct. 14",,,,Oct. 14,1914,
"Photograms of the year, 1914. 4to. 3s. 6d. net ; swd. 2s. 6d. net .HAZELL, Dec. 14",,,Photograms of the year,HAZELL,2s. 6d.,4to.,"Photograms of the year, 1914. 4to. 35. 6d. net ; swd. 2s. 6d. net .HAZELL, Dec. 14",,,,Dec. 14,1914,net
"Photography simplified. Cr. 8vo., pp. 160, bds., is. net (“Work” handbooks) CASSELL, June 14",,,Photography simplified,CASSELL,,8vo.,"Photography simplified. Cr. 8vo., pp. 160, bds., is. net (“Work” handbooks) CASSELL, June 14",,,,June 14,1914,
"Pickthall (Rudoln—The Coming kingdom : Napo. leon, the last phase but two. Cr. 8vo. 71 X5, pp. 206, 35, 6d. net ... LANE, Feb. 14",,,Pickthall (Rudoln—The Coming kingdom : Napo,LANE,6d.,8vo.,"Pickthall (Rudoln—The Coming kingdom : Napo. leon, the last phase but two. Cr. 8vo. 71 X5, pp. 206, 35, 6d. net ... LANE, Feb. 14",,,,Feb. 14,1914,net
"Picture books for the little ones : A Holiday by the sea ; Men who work for us ; The Dolly book ; The Toy book. 8vo. 7X5, swd. ea. 3d. MILFORD, May 14",,,Picture books for the little ones : A Holiday by the sea ; Men who work for us ; The Dolly book ; The Toy book,MILFORD,3d.,8vo.,"Picture books for the little ones : A Holiday by the sea ; Men who work for us ; The Dolly book ; The Toy book. 8vo. 7X5, swd. ea. 3d. MILFORD, May 14",,,,May 14,1914,
"Pictureland companions. 4to., bds. 5s. NISTER, Sep. 14",,,Pictureland companions,NISTER,5s.,4to.,"Pictureland companions. 4to., bds. 5s. NISTER, Sep. 14",,,,Sep. 14,1914,
"Pictures, Great, by great painters. Vol. 1. 12s. net.. Pictures of 1914 (“ Pall Mall Gazette extra). Imp. 8vo., swd., s. net OFFICE, May 14",,,"Pictures, Great, by great painters",OFFICE,,8vo.,"Pictures, Great, by great painters. Vol. 1. I 2S. net.. Pictures of 1914 (“ Pall Mall Gazette extra). Imp. 8vo., swd., IS. net OFFICE, May 14",,,,May 14,1914,
"Piers Plowman histories. Junior. Book 7. Cr. 8vo., 2s. .G. PHILIP, Feb. 14",,,Piers Plowman histories,G. PHILIP,2s.,8vo.,"Piers Plowman histories. Junior. Book 7. Cr. 8vo., 25. .G. PHILIP, Feb. 14",,,,Feb. 14,1914,
"Pigments and mediums of old masters, Laurie (A. P.) 8s. 6d, net Pigott (H. M.)—The Christian's bounden service. 12mo., s. net ....HEATH, CRANTON, Nov. 14",,,"Pigments and mediums of old masters, Laurie (A. P.)","HEATH, CRANTON",,12mo.,"Pigments and mediums of old masters, Laurie (A. P.) 8s. 6d, net Pigott (H. M.)—The Christian's bounden service. I2mo., IS. net ....HEATH, CRANTON, Nov. 14",,,,Nov. 14,1914,
"Pilotage-Returns relating to pilotage in the United Kingdom, for 1910, 1911, and 1912, 2s. ed. WYMAN, Mar. 14",,,"Pilotage-Returns relating to pilotage in the United Kingdom, for",WYMAN,,,"Pilotage-Returns relating to pilotage in the United Kingdom, for 1910, 1911, and 1912, 25. ed. WYMAN, Mar. 14",,,,Mar. 14,1914,
"Pipe Roll Society— The Great roll of the Pipe for the 31st year of the reign of Henry II, A.D 1184- 118s. (Publications, Vol 34) (sub.) St. CATHERINE PRESS, A pr. 14",,,Pipe Roll Society— The Great roll of the Pipe for the,CATHERINE PRESS,,,"Pipe Roll Society— The Great roll of the Pipe for the 31st year of the reign of Henry II, A.D 1184- 1185. (Publications, Vol 34) (sub.) St. CATHERINE PRESS, A pr. 14",,,,A pr. 14,1914,
"Pirates three. 4to. bds., 2s. 6d. CASSELL, Oct. 14",,,Pirates three,CASSELL,2s. 6d.,4to.,"Pirates three. 4to. bds., 2s. 6d. CASSELL, Oct. 14",,,,Oct. 14,1914,
"Pitman's Commercial atlas of the world. Contain- ing 58 maps with explanatory text. 4to. 9* *71, 28. net ..PITMAN, June 14",,,Pitman's Commercial atlas of the world,PITMAN,,4to.,"Pitman's Commercial atlas of the world. Contain- ing 58 maps with explanatory text. 4to. 9* *71, 28. net ..PITMAN, June 14",,,,June 14,1914,
"Pitman's Facsimile company forms. Folio, in packet, 1s. net .PITMAN, Nov. 14",,,Pitman's Facsimile company forms,PITMAN,1s.,,"Pitman's Facsimile company forms. Folio, in packet, Is. net .PITMAN, Nov. 14",,,,Nov. 14,1914,net
"Pitman's Graded shorthand readings : elementary. With key. Oblong cr. 8vo. swd. 6d, net PITMAN, Aug. 14",,,Pitman's Graded shorthand readings : elementary,PITMAN,6d.,8vo.,"Pitman's Graded shorthand readings : elementary. With key. Oblong cr. 8vo. swd. 6d, net PITMAN, Aug. 14",,,,Aug. 14,1914,net
"Pitman's Shorthand and typewriting year book and diary, 191s. 12mo., is. PITMAN, Nov. 14",,,Pitman's Shorthand and typewriting year book and diary,PITMAN,,12mo.,"Pitman's Shorthand and typewriting year book and diary, 1915. 12mo., is. PITMAN, Nov. 14",,,,Nov. 14,1914,
"Pitman's Shorthand writers' phrase books and guides : Insurance. 12mo., pp. 86, is. 60. net PITMAN, May 14",,,Pitman's Shorthand writers' phrase books and guides : Insurance,PITMAN,,12mo.,"Pitman's Shorthand writers' phrase books and guides : Insurance. 12mo., pp. 86, is. 60. net PITMAN, May 14",,,,May 14,1914,
"Pitman's Shorthand writers' phrase books and guides : Iron and steel trades. 12mo., pp. 92, s. 6d. net ..PITMAN, Dec. 14",,,Pitman's Shorthand writers' phrase books and guides : Iron and steel trades,PITMAN,6d.,12mo.,"Pitman's Shorthand writers' phrase books and guides : Iron and steel trades. 12mo., pp. 92, IS. 6d. net ..PITMAN, Dec. 14",,,,Dec. 14,1914,net
"Pitman's Shorthand writers' phrase books and guides : Legal, and commercial, 12mo., PP. 88, 94, ea., is. 6d. net ....PITMAN, July 14",,,"Pitman's Shorthand writers' phrase books and guides : Legal, and commercial",PITMAN,6d.,12mo.,"Pitman's Shorthand writers' phrase books and guides : Legal, and commercial, 12mo., PP. 88, 94, ea., is. 6d. net ....PITMAN, July 14",,,,July 14,1914,net
"Pitman's Shorthand writers' phrase books and guides : Municipal. 12mo., pp. 94, 1s. 6d. net PITMAN, Sep. 14",,,Pitman's Shorthand writers' phrase books and guides : Municipal,PITMAN,1s. 6d.,12mo.,"Pitman's Shorthand writers' phrase books and guides : Municipal. 12mo., pp. 94, Is. 6d. net PITMAN, Sep. 14",,,,Sep. 14,1914,net
"Pitman's Shorthand writers' phrase books: Stockbroking and financial. Centenary edit. 12mo., pp. 96, 1s. 6d. net.. PITMAN, May 14",,,Pitman's Shorthand writers' phrase books: Stockbroking and financial,PITMAN,1s. 6d.,12mo.,"Pitman's Shorthand writers' phrase books: Stockbroking and financial. Centenary edit. 12mo., pp. 96, Is. 6d. net.. PITMAN, May 14",,,,May 14,1914,net
"Pitman's Shorthand writing, exercises and exami- nation tests : Key. Centenary edit. Cr. 8vo., pp. 278, 3s. 6d. .PITMAN, Oct. 14",,,"Pitman's Shorthand writing, exercises and exami- nation tests : Key",PITMAN,3s. 6d.,8vo.,"Pitman's Shorthand writing, exercises and exami- nation tests : Key. Centenary edit. Cr. 8vo., pp. 278, 3s. 6d. .PITMAN, Oct. 14",,,,Oct. 14,1914,
"Pitt, William, and the great war, Rose (J. H.) 7s, 6d. net Pitts (Herbert)-The Australian aboriginal and the Christian Church. Cr. 8vo., 2s. net S.P.C.K., Nov. 14",,,"Pitt, William, and the great war, Rose (J. H.)",S.P.C.K.,2s.,8vo.,"Pitt, William, and the great war, Rose (J. H.) 7s, 6d. net Pitts (Herbert)-The Australian aboriginal and the Christian Church. Cr. 8vo., 25. net S.P.C.K., Nov. 14",,,,Nov. 14,1914,net
"Plague investigations in India (Reports on), issued by the Advisory Committee appointed by the Secretary of State for India, the Royal Society and the Lister Institute of Preventive Medicine. Vol. 2, Part 1 (Journal of Hygiene Supplements I (Dec. 1911), II (Dec.1912) and III (Jan. 1914)]; being the sixth, seventh and eighth reports. 34 plates, Ryl. 8vo., pp. 696, 20s. net CAMB. UNIV. PRESS, May 14",,,"Plague investigations in India (Reports on), issued by the Advisory Committee appointed by the Secretary of State for India, the Royal Society and the Lister Institute of Preventive Medicine",CAMB. UNIV. PRESS,20s.,8vo.,"Plague investigations in India (Reports on), issued by the Advisory Committee appointed by the Secretary of State for India, the Royal Society and the Lister Institute of Preventive Medicine. Vol. 2, Part 1 (Journal of Hygiene Supplements I (Dec. 1911), II (Dec.1912) and III (Jan. 1914)]; being the sixth, seventh and eighth reports. 34 plates, Ryl. 8vo., pp. 696, 20s. net CAMB. UNIV. PRESS, May 14",,,,May 14,1914,net
"Plants, Transpiration and ascent of sapin, Dixon (H. H.) 5s. net... Plarr (Victor)--Ernest Dowson, 1888-1897 : reminiscences, unpublished letters and mar- ginalia. With a bibliography. Cr. 8vo. 74 X5, pp. 148, 3s. 61. net ...... .E. MATHEWS, Dec. 14",,,"Plants, Transpiration and ascent of sapin, Dixon (H. H.)",E. MATHEWS,,8vo.,"Plants, Transpiration and ascent of sapin, Dixon (H. H.) 5s. net... Plarr (Victor)--Ernest Dowson, 1888-1897 : reminiscences, unpublished letters and mar- ginalia. With a bibliography. Cr. 8vo. 74 X5, pp. 148, 35. 61. net ...... .E. MATHEWS, Dec. 14",,,,Dec. 14,1914,
"Plato—[Works] Vol. 1: Enthyphro; Apology ; Crito; Phædo; Phædrus. With an English trans. by H. N. Fowler. 12mo. 61 X41, pp. 604, 5s. net ; Ithr. 6s. 6d. net. (Loeb classical library) HEINEMANN, Mar. 14",,,Plato—[Works] Vol,HEINEMANN,,12mo.,"Plato—[Works] Vol. 1: Enthyphro; Apology ; Crito; Phædo; Phædrus. With an English trans. by H. N. Fowler. 12mo. 61 X41, pp. 604, 5s. net ; Ithr. 6s. 6d. net. (Loeb classical library) HEINEMANN, Mar. 14",,,,Mar. 14,1914,
"Plautus.--Five of his plays; trans, into English verse by Sir R. Allison. 8vo., 7s, 6d. net A, L. HUMPHREYS, Nov. 14",,,Plautus,"A, L. HUMPHREYS",7s. 6d.,8vo.,"Plautus.--Five of his plays; trans, into English verse by Sir R. Allison. 8vo., 7s, 6d. net A, L. HUMPHREYS, Nov. 14",,,,Nov. 14,1914,net
"Play Pictorial (The). Vol. 23. Imp. 8vo., 6s. nei OFFICE, May 14",,,Play Pictorial (The),OFFICE,,8vo.,"Play Pictorial (The). Vol. 23. Imp. 8vo., 6s. nei OFFICE, May 14",,,,May 14,1914,
"Playbox annual (The), 191s. 4to., bds. 3s. 6d. OFFICE, Oct. 14",,,Playbox annual (The),OFFICE,3s. 6d.,4to.,"Playbox annual (The), 1915. 4to., bds. 35. 6d. OFFICE, Oct. 14",,,,Oct. 14,1914,
"Playground (The). By the author of “ Masterırg flame, &c. Cr. 8vo. 7} *4*, pp. 350, 6s. MILLS & B., nr. 14",,,Playground (The),MILLS & B.,6s.,8vo.,"Playground (The). By the author of “ Masterırg flame, &c. Cr. 8vo. 7} *4*, pp. 350, 6s. MILLS & B., nr. 14",,,,nr. 14,1914,
"Pleasant surprises. Oblong ito., bds. 5s. NISTER, Sep. 14",,,Pleasant surprises,NISTER,5s.,,"Pleasant surprises. Oblong ito., bds. 5s. NISTER, Sep. 14",,,,Sep. 14,1914,
"Plenty of fun. 4to., bds., is. 60. CASSELL, Oct. 14",,,Plenty of fun,CASSELL,,4to.,"Plenty of fun. 4to., bds., is. 60. CASSELL, Oct. 14",,,,Oct. 14,1914,
"Plotinus - Select works. 12mo., pp. 418, is, net (Bohn's pop. library) .. BELL, Mar. 14",,,Plotinus - Select works,BELL,,12mo.,"Plotinus - Select works. 12mo., pp. 418, is, net (Bohn's pop. library) .. BELL, Mar. 14",,,,Mar. 14,1914,
"Plutarch-Lives. Vols. I and 2. With an English trans. by Bernadotte Perrin. 12mo. 64 X4), pp. 604, 642, ea. 5s, net; ithr, 6s, 6d. net. (Loeb classical library) .HEINEMANN, Dec. 14",,,Plutarch-Lives,HEINEMANN,,12mo.,"Plutarch-Lives. Vols. I and 2. With an English trans. by Bernadotte Perrin. 12mo. 64 X4), pp. 604, 642, ea. 5s, net; ithr, 6s, 6d. net. (Loeb classical library) .HEINEMANN, Dec. 14",,,,Dec. 14,1914,
"Plutarch-Les Vies des hommes illustres. Vol. 1. Traduites du Grec par Amyot. 12mo., pp. 480, rod. net .NELSON, Mar. 14",,,Plutarch-Les Vies des hommes illustres,NELSON,,12mo.,"Plutarch-Les Vies des hommes illustres. Vol. 1. Traduites du Grec par Amyot. 12mo., pp. 480, rod. net .NELSON, Mar. 14",,,,Mar. 14,1914,
"Plutarch-Les Vies des hommes illustres de Plutarque. Tran. par J. Amyot. Tome deuxième. 12mo., pp. 470, rod. net NELSON, Mar. 14",,,Plutarch-Les Vies des hommes illustres de Plutarque,NELSON,,12mo.,"Plutarch-Les Vies des hommes illustres de Plutarque. Tran. par J. Amyot. Tome deuxième. 12mo., pp. 470, rod. net NELSON, Mar. 14",,,,Mar. 14,1914,
"Plutarch's Lives: for boys and girls. Being selected lives freely retold by W. H. Weston. Illus. Cheaper reissue. 8vo. 81X57, pp. 370, 3s, 6d. net .. JACK, Oct. 14",,,Plutarch's Lives: for boys and girls,JACK,3s. 6d.,8vo.,"Plutarch's Lives: for boys and girls. Being selected lives freely retold by W. H. Weston. Illus. Cheaper reissue. 8vo. 81X57, pp. 370, 3s, 6d. net .. JACK, Oct. 14",,,,Oct. 14,1914,net
"Plutarch's Lives Trans. from the Greek by Aubrey Stewart and George Long. Vols. I and 12mo., pp. 496, 496, ea. 1s. net (Bohn's Popular library) .BELL, Oct. 14",,,Plutarch's Lives Trans,BELL,1s.,12mo.,"Plutarch's Lives Trans. from the Greek by Aubrey Stewart and George Long. Vols. I and 12mo., pp. 496, 496, ea. Is. net (Bohn's Popular library) .BELL, Oct. 14",,,,Oct. 14,1914,net
"Plutarch's Lives and writings. Edit. by Arthur Hugh Clough and Wm. Goodwin. 1o vols. 8vo., 63s. net SIMPKIN, Sep. 14",,,Plutarch's Lives and writings,SIMPKIN,63s.,8vo.,"Plutarch's Lives and writings. Edit. by Arthur Hugh Clough and Wm. Goodwin. 1o vols. 8vo., 635. net SIMPKIN, Sep. 14",,,,Sep. 14,1914,net
"Podgy-puppy book (The). 4to. iS. NELSON, Oct. 14",,,Podgy-puppy book (The),S. NELSON,,4to.,"Podgy-puppy book (The). 4to. iS. NELSON, Oct. 14",,,,Oct. 14,1914,
"Poem of Job (The). Trans. in the metre of the original by Edward C. King. 4to. pp. 128, .CAMB. UNIV. PRESS, Feb. 14",,,Poem of Job (The),CAMB. UNIV. PRESS,,4to.,"Poem of Job (The). Trans. in the metre of the original by Edward C. King. 4to. pp. 128, .CAMB. UNIV. PRESS, Feb. 14",,,,Feb. 14,1914,
"Poems of the great war. 4to., pp. 40, swd., 1s. net CHATTO, Sep. 14",,,Poems of the great war,CHATTO,1s.,4to.,"Poems of the great war. 4to., pp. 40, swd., Is. net CHATTO, Sep. 14",,,,Sep. 14,1914,net
"Poets Laureate of England, Gray (W. F.) 7s. 6d. Pollard (Josephine) —Young folks' Bible : in the net Sep. 14 language of childhood. Ryl. 8vo., 7s. 60. S.S.U., Apr, 14",,,"Poets Laureate of England, Gray (W. F.)",S.S.U.,,8vo.,"Poets Laureate of England, Gray (W. F.) 75. 6d. Pollard (Josephine) —Young folks' Bible : in the net Sep. 14 language of childhood. Ryl. 8vo., 75. 60. S.S.U., Apr, 14",,,,"Apr, 14",1914,
"Poincaré, Raymond : a sketch. 8vo. 9 x5, pp. 178, 5s. net ...DUCKWORTH, Sep. 14",,,"Poincaré, Raymond : a sketch",DUCKWORTH,5s.,8vo.,"Poincaré, Raymond : a sketch. 8vo. 9 x5, pp. 178, 55. net ...DUCKWORTH, Sep. 14",,,,Sep. 14,1914,net
"Cr. 8vo., 5s. net .PUTNAM, Nov. 14",,,,PUTNAM,5s.,8vo.,"Cr. 8vo., 5s. net .PUTNAM, Nov. 14",,,,Nov. 14,1914,net
"Cr. 8vo. 71 X 5, pp. 320, 1s. 6d. Port Royal, &c., Morgan (H. T.) 3s. 60, net PARTRIDGE, Sep. 14",,,,PARTRIDGE,,8vo.,"Cr. 8vo. 71 X 5, pp. 320, Is. 6d. Port Royal, &c., Morgan (H. T.) 3s. 60, net PARTRIDGE, Sep. 14",,,,Sep. 14,1914,
"Post Office--Boy labour in the Post Office : Standing Committee on. 4th annual report. 3d. WYMAN, Aug. 14",,,Post Office--Boy labour in the Post Office : Standing Committee on,WYMAN,3d.,,"Post Office--Boy labour in the Post Office : Standing Committee on. 4th annual report. 3d. WYMAN, Aug. 14",,,,Aug. 14,1914,
"Post Office - Post Office (London) Railway Bill : Index and digest of evidence from Select Committee, 2}d. WYMAN, Mar. 14",,,Post Office - Post Office (London) Railway Bill : Index and digest of evidence from Select Committee,WYMAN,,,"Post Office - Post Office (London) Railway Bill : Index and digest of evidence from Select Committee, 2}d. WYMAN, Mar. 14",,,,Mar. 14,1914,
"Post Office-Return showing changes in wages and conditions of service of Post Office servants in connection with the Reports of Select Committees, 1907 and 1913. 70. WYMAN, May 14",,,Post Office-Return showing changes in wages and conditions of service of Post Office servants in connection with the Reports of Select Committees,WYMAN,,,"Post Office-Return showing changes in wages and conditions of service of Post Office servants in connection with the Reports of Select Committees, 1907 and 1913. 70. WYMAN, May 14",,,,May 14,1914,
"Post Office—Telegraphs and telephones : Accounts 1912-13, 4d. WYMAN, Mar. 14",,,Post Office—Telegraphs and telephones : Accounts,WYMAN,4d.,,"Post Office—Telegraphs and telephones : Accounts 1912-13, 4d. WYMAN, Mar. 14",,,,Mar. 14,1914,
