entry,last_name,first_name,title,publisher,price,format,original_entry,author_name,creators,is_editor,date,catalogue_year,is_net
"British Red Cross handbook. 8vo. limp is. net MILFORD, June 14",,,British Red Cross handbook,MILFORD,,8vo.,"British Red Cross handbook. 8vo. limp is. net MILFORD, June 14",,,,June 14,1914,
"British School at Athens.—Annual, No. 19, session 1912-1913. 4to., bds., 258. net MACMILLAN, Nov. 14",,,British School at Athens,MACMILLAN,,4to.,"British School at Athens.—Annual, No. 19, session 1912-1913. 4to., bds., 258. net MACMILLAN, Nov. 14",,,,Nov. 14,1914,
"British standard method of specifying resistance of steel conductor rails. (Engineering Standards Committee.) Folio, swd. Ios. 6d. net C. LOCKWOOD, Aug. 14",,,British standard method of specifying resistance of steel conductor rails,C. LOCKWOOD,6d.,,"British standard method of specifying resistance of steel conductor rails. (Engineering Standards Committee.) Folio, swd. Ios. 6d. net C. LOCKWOOD, Aug. 14",,,,Aug. 14,1914,net
"British standard specification for copper-alloy three-piece unions for low and medium pressure, &c. Folio swd. 58. net. (Engineering Standards Committee) C. LOCKWOOD, Aug. 14",,,"British standard specification for copper-alloy three-piece unions for low and medium pressure, &c",C. LOCKWOOD,,,"British standard specification for copper-alloy three-piece unions for low and medium pressure, &c. Folio swd. 58. net. (Engineering Standards Committee) C. LOCKWOOD, Aug. 14",,,,Aug. 14,1914,
"British standard specification for salt-glazed ware pipes. Folio, swd. 58. net. (Engineering Stan- dards Committee) .....C. LOCKWOOD, Aug. 14",,,British standard specification for salt-glazed ware pipes,C. LOCKWOOD,,,"British standard specification for salt-glazed ware pipes. Folio, swd. 58. net. (Engineering Stan- dards Committee) .....C. LOCKWOOD, Aug. 14",,,,Aug. 14,1914,
"British standard specification for two- and three- plate oiling roses. Folio, swd. 5s. net. (Engineer- ing Standards Committee) C. LOCKWOOD, Aug. 14",,,British standard specification for two- and three- plate oiling roses,C. LOCKWOOD,,,"British standard specification for two- and three- plate oiling roses. Folio, swd. 55. net. (Engineer- ing Standards Committee) C. LOCKWOOD, Aug. 14",,,,Aug. 14,1914,
"British Workman (The), 1914. 4to. 2s. 60., bds. s. 6d. .PARTRIDGE, Oct. 14",,,British Workman (The),PARTRIDGE,6d.,4to.,"British Workman (The), 1914. 4to. 25. 60., bds. IS. 6d. .PARTRIDGE, Oct. 14",,,,Oct. 14,1914,
"British year-book of agriculture (The), and agricul. tural who's who, 1913-14. 8vo., 58. net VINTON, Apr. 14",,,"British year-book of agriculture (The), and agricul",VINTON,,8vo.,"British year-book of agriculture (The), and agricul. tural who's who, 1913-14. 8vo., 58. net VINTON, Apr. 14",,,,Apr. 14,1914,
"Brooke (Margaret L. and Winifred M. A.!-- Winter life in Switzerland : its sports and health resorts. Illus. 2nd edit. Cr. 8vo. 7* X 5, pp. 348, 3s. 6d. net .PITMAN, Jan. 14",,,Brooke (Margaret L. and Winifred M. A.!-- Winter life in Switzerland : its sports and health resorts,PITMAN,3s. 6d.,8vo.,"Brooke (Margaret L. and Winifred M. A.!-- Winter life in Switzerland : its sports and health resorts. Illus. 2nd edit. Cr. 8vo. 7* X 5, pp. 348, 3s. 6d. net .PITMAN, Jan. 14",,,,Jan. 14,1914,net
"Brown's Nautical almanac, 191s. 8vo. bds. s. 6d. net ..J. BROWN, Oct. 14",,,Brown's Nautical almanac,J. BROWN,6d.,8vo.,"Brown's Nautical almanac, 1915. 8vo. bds. IS. 6d. net ..J. BROWN, Oct. 14",,,,Oct. 14,1914,net
"Brown's Nautical almanac, harbour and dock guide and advertiser, and daily time tables for 191s. 8vo., bds., is. net J. BROWN, Sep. 14",,,"Brown's Nautical almanac, harbour and dock guide and advertiser, and daily time tables for",J. BROWN,,8vo.,"Brown's Nautical almanac, harbour and dock guide and advertiser, and daily time tables for 1915. 8vo., bds., is. net J. BROWN, Sep. 14",,,,Sep. 14,1914,
"Bryology of New Zealand, Dixon (H. N.) Pt. 1, 2s. 6d. net... Bryson (Thomas)—The Testing of fans : with special reference to the measurement of pressure. 8vo. swd. is. net INST, OF MINING ENG., Nov. 14",,,"Bryology of New Zealand, Dixon (H. N.) Pt","INST, OF MINING ENG.",,8vo.,"Bryology of New Zealand, Dixon (H. N.) Pt. 1, 25. 6d. net... Bryson (Thomas)—The Testing of fans : with special reference to the measurement of pressure. 8vo. swd. is. net INST, OF MINING ENG., Nov. 14",,,,Nov. 14,1914,
"Buddhapalita : Mulamadhyamakavrtti. Tibetan trans. Edit. by M. Walleser. I. 8vo. 2s. 6d. net (Bibliotheca Buddhica, 16). ...LUZAC, June 14",,,Buddhapalita : Mulamadhyamakavrtti,LUZAC,2s. 6d.,8vo.,"Buddhapalita : Mulamadhyamakavrtti. Tibetan trans. Edit. by M. Walleser. I. 8vo. 25. 6d. net (Bibliotheca Buddhica, 16). ...LUZAC, June 14",,,,June 14,1914,net
"Building societies--18th annual report of proceed. ings of Registrars under the Building Societies Acts; with Abstract of Annual Accounts and Statements of Societies. For 1912. Part I, Report, 3d. ; Part 2, Abstract of accounts, s, 2d. WYMAN, Mar. 14",,,Building societies-,WYMAN,2d.,,"Building societies--18th annual report of proceed. ings of Registrars under the Building Societies Acts; with Abstract of Annual Accounts and Statements of Societies. For 1912. Part I, Report, 3d. ; Part 2, Abstract of accounts, IS, 2d. WYMAN, Mar. 14",,,,Mar. 14,1914,
"Bullets, Measuring pressure produced by impact. Hopkinson (B.) is. 6d. net...... Bulley (Margaret H.)--Ancient and mediæval art : a short history. Illus. Cr. 8vo. 78 X 5, pp. 358, MI THUEX, May 14",,,"Bullets, Measuring pressure produced by impact",MI THUEX,,8vo.,"Bullets, Measuring pressure produced by impact. Hopkinson (B.) is. 6d. net...... Bulley (Margaret H.)--Ancient and mediæval art : a short history. Illus. Cr. 8vo. 78 X 5, pp. 358, MI THUEX, May 14",,,,May 14,1914,
"Bunyon on The Law of life assurance. 5th ed. by J. M. Vesey Fitzgerald and others. 8vo. 9x5, pp. 688, 31$. 6d. net C. & E. LAYTON, Jan. 14",,,Bunyon on The Law of life assurance,C. & E. LAYTON,6d.,8vo.,"Bunyon on The Law of life assurance. 5th ed. by J. M. Vesey Fitzgerald and others. 8vo. 9x5, pp. 688, 31$. 6d. net C. & E. LAYTON, Jan. 14",,,,Jan. 14,1914,net
"Burden of Eve's daughter (The). By Oue of The.n. Cr. 8vo. 28. 6d. net .OLIPHANT, Sep. 14",,,Burden of Eve's daughter (The),OLIPHANT,6d.,8vo.,"Burden of Eve's daughter (The). By Oue of The.n. Cr. 8vo. 28. 6d. net .OLIPHANT, Sep. 14",,,,Sep. 14,1914,net
"Burnett (Frances Hodgson!—The Shuttle. Pop. edit. Cr. 8vo. 71 X5, pp. 450, 2s. net HEINEMANN, July 14",,,Burnett (Frances Hodgson!—The Shuttle,HEINEMANN,2s.,8vo.,"Burnett (Frances Hodgson!—The Shuttle. Pop. edit. Cr. 8vo. 71 X5, pp. 450, 25. net HEINEMANN, July 14",,,,July 14,1914,net
"Business, What you want to know in, Ouseley (J.) is, net. Buster Brown at home, Outcault (R. F.) 3s. 6d. net Buster Brown's funny tricks. Oblong 4to bds. 38. 6d. net ... DEAN, July 14",,,"Business, What you want to know in, Ouseley (J.) is, net",DEAN,6d.,4to,"Business, What you want to know in, Ouseley (J.) is, net. Buster Brown at home, Outcault (R. F.) 35. 6d. net Buster Brown's funny tricks. Oblong 4to bds. 38. 6d. net ... DEAN, July 14",,,,July 14,1914,net
"Busy bunny book (The) 4to. is. NELSON, Oct. 14",,,Busy bunny book (The),NELSON,,4to.,"Busy bunny book (The) 4to. is. NELSON, Oct. 14",,,,Oct. 14,1914,
"Butterflies of Australia, Waterhouse (G. A.) and Lyell (G.) 42s. net Butterworth (Annie)—Manual of household work and management. 3rd edit., rev. and enlarged. Cr. 8vo. 74 X 5, pp. 252, 2s. 6d. net LONGMANS, Jan. 14",,,"Butterflies of Australia, Waterhouse (G. A.) and Lyell (G.)",LONGMANS,2s. 6d.,8vo.,"Butterflies of Australia, Waterhouse (G. A.) and Lyell (G.) 425. net Butterworth (Annie)—Manual of household work and management. 3rd edit., rev. and enlarged. Cr. 8vo. 74 X 5, pp. 252, 25. 6d. net LONGMANS, Jan. 14",,,,Jan. 14,1914,net
"Butter worth's Workmen's compensation cases. Vol. 6. 8vo., Ios. 6d. net BUTTERWORTH, Jan. 14",,,Butter worth's Workmen's compensation cases,BUTTERWORTH,6d.,8vo.,"Butter worth's Workmen's compensation cases. Vol. 6. 8vo., Ios. 6d. net BUTTERWORTH, Jan. 14",,,,Jan. 14,1914,net
"Caesar-Caesaris Commentarii rerum in Gallia Gestarum VII A. Hirti Commentarius VIII. Edit. by T. Rice-Holmes. 8vo., pp. 528, Ss. 60. net (Clarendon Press) MILFORD, Feb. 14",,,Caesar-Caesaris Commentarii rerum in Gallia Gestarum VII A. Hirti Commentarius VIII,MILFORD,,8vo.,"Caesar-Caesaris Commentarii rerum in Gallia Gestarum VII A. Hirti Commentarius VIII. Edit. by T. Rice-Holmes. 8vo., pp. 528, Ss. 60. net (Clarendon Press) MILFORD, Feb. 14",,,,Feb. 14,1914,
"Caesar—The Civil wars. With an English trans. by A. G. Peskett. 12mo. 64 X4, pp. 380, 5s. net ; 1thr., 6s. 6d. net (Loeb classical litrary) HEINEMANN, Dec. 14",,,Caesar—The Civil wars,HEINEMANN,6s. 6d.,12mo.,"Caesar—The Civil wars. With an English trans. by A. G. Peskett. 12mo. 64 X4, pp. 380, 55. net ; 1thr., 6s. 6d. net (Loeb classical litrary) HEINEMANN, Dec. 14",,,,Dec. 14,1914,net
"Cæsar-Gallic war, Book 2. Edit. by L. M. Penn. Cr. 8vo., pp. 119, s. (School Latin classics) ..CLIVE, July 14",,,"Cæsar-Gallic war, Book 2",CLIVE,,8vo.,"Cæsar-Gallic war, Book 2. Edit. by L. M. Penn. Cr. 8vo., pp. 119, IS. (School Latin classics) ..CLIVE, July 14",,,,July 14,1914,
"Caesar Gallic War. Book 3. Introduction, Text, Notes and Lexicon. Ed. by Ll. M. Penn, M.A. Cr. 8vo., pp. 114, and Maps. (School Latin Classics.) CLIVE, Aug. 14",,,Caesar Gallic War,CLIVE,,8vo.,"Caesar Gallic War. Book 3. Introduction, Text, Notes and Lexicon. Ed. by Ll. M. Penn, M.A. Cr. 8vo., pp. 114, and Maps. (School Latin Classics.) CLIVE, Aug. 14",,,,Aug. 14,1914,
"Caesar-Gallic war, Book 3. Edit. by E. S. Shuckburgh. Illus., map, extra f'cap 8vo. pp. 92, 1s. 6d. (Cambridge elementary classics) CAMB. UNIV. PRESS, Dec. 14",,,"Caesar-Gallic war, Book 3",CAMB. UNIV. PRESS,1s. 6d.,8vo.,"Caesar-Gallic war, Book 3. Edit. by E. S. Shuckburgh. Illus., map, extra f'cap 8vo. pp. 92, Is. 6d. (Cambridge elementary classics) CAMB. UNIV. PRESS, Dec. 14",,,,Dec. 14,1914,
"Caesar.—Gallic war. Book 6. Edit. by E. S. Shuckburgh. Illus., map, extra fcap. 8vo., pp. 138, 1s. 6d... CAMB. UNIV. PRESS, May 14",,,Caesar,CAMB. UNIV. PRESS,1s. 6d.,8vo.,"Caesar.—Gallic war. Book 6. Edit. by E. S. Shuckburgh. Illus., map, extra fcap. 8vo., pp. 138, Is. 6d... CAMB. UNIV. PRESS, May 14",,,,May 14,1914,
"Caesar-Gallic war. 7 vols. Edit. by T. Rice Holmes. Cr. 8vo. ea. 2s. (Clarendon Press) MILFORD, June 14",,,Caesar-Gallic war,MILFORD,2s.,8vo.,"Caesar-Gallic war. 7 vols. Edit. by T. Rice Holmes. Cr. 8vo. ea. 2s. (Clarendon Press) MILFORD, June 14",,,,June 14,1914,
"Cairo Scientific Journal (The). Vol. 7, 1913. Illus. Imp. 8vo. 11 X7), pp. 277, swd., 12s. 6d. WESLEY, May 14",,,Cairo Scientific Journal (The),WESLEY,12s. 6d.,8vo.,"Cairo Scientific Journal (The). Vol. 7, 1913. Illus. Imp. 8vo. 11 X7), pp. 277, swd., 125. 6d. WESLEY, May 14",,,,May 14,1914,
"Caledonian Canal—109th report for 1913-14, 2d. WYMAN, July 14",,,Caledonian Canal,WYMAN,2d.,,"Caledonian Canal—109th report for 1913-14, 2d. WYMAN, July 14",,,,July 14,1914,
"Call from the stage (A): a book of autographs. Oblong c. 8vo. swd. 6d. net F. & C. PALMER, Nov. 14",,,Call from the stage (A): a book of autographs,F. & C. PALMER,6d.,8vo.,"Call from the stage (A): a book of autographs. Oblong c. 8vo. swd. 6d. net F. & C. PALMER, Nov. 14",,,,Nov. 14,1914,net
"Calvert's Mechanics' almanack, 191s. Cr. 8vo. swd. 4d. SIMPKIN, Nov. 14",,,Calvert's Mechanics' almanack,SIMPKIN,4d.,8vo.,"Calvert's Mechanics' almanack, 1915. Cr. 8vo. swd. 4d. SIMPKIN, Nov. 14",,,,Nov. 14,1914,
"Cambridge, &c., Sport at, Desborough (Lord) 420s. net. Cambridge: Guide pour nos anis Belges, Clarke 'L.) and Eggericx (J.) is. net Cambridge History of English literature. Vol. 2. The Period of the French revolution. Ryl. 8vo. 9 X64, pp. 538, 9s. net CAMB. UNIV. PRESS, Oct. 14",,,"Cambridge, &c",CAMB. UNIV. PRESS,9s.,8vo.,"Cambridge, &c., Sport at, Desborough (Lord) 420S. net. Cambridge: Guide pour nos anis Belges, Clarke 'L.) and Eggericx (J.) is. net Cambridge History of English literature. Vol. 2. The Period of the French revolution. Ryl. 8vo. 9 X64, pp. 538, 9s. net CAMB. UNIV. PRESS, Oct. 14",,,,Oct. 14,1914,net
"Cambridge, Oxford and, Schools Examination Board Resort, is. net... Cambridge pocket diary (The), 1914-191s. 16mo., pp. 272, ithr. is, net ; 2s. net; 2s.6d. net CAMB. UNIV. PRESS, Oct. 14",,,"Cambridge, Oxford and, Schools Examination Board Resort, is",CAMB. UNIV. PRESS,2s.6d.,16mo.,"Cambridge, Oxford and, Schools Examination Board Resort, is. net... Cambridge pocket diary (The), 1914-1915. 16mo., pp. 272, ithr. is, net ; 25. net; 2s.6d. net CAMB. UNIV. PRESS, Oct. 14",,,,Oct. 14,1914,net
"Cambridge University calendar (The) for the year 1914-191s. Cr. 8vo., pp. 1064, 78. 6d. net CAMB. UNIV. PRESS., Nov. 14",,,Cambridge University calendar (The) for the year,CAMB. UNIV. PRESS.,6d.,8vo.,"Cambridge University calendar (The) for the year 1914-1915. Cr. 8vo., pp. 1064, 78. 6d. net CAMB. UNIV. PRESS., Nov. 14",,,,Nov. 14,1914,net
"Cambridge University-A Compendium of Uni- versity regulations : for the use of persons in statu pupillari. 8vo. swd. 6d. CAMB. UNIV. PRESS, Jan. 14",,,Cambridge University-A Compendium of Uni- versity regulations : for the use of persons in statu pupillari,CAMB. UNIV. PRESS,6d.,8vo.,"Cambridge University-A Compendium of Uni- versity regulations : for the use of persons in statu pupillari. 8vo. swd. 6d. CAMB. UNIV. PRESS, Jan. 14",,,,Jan. 14,1914,
"Cambridge University-Examination papers for scholarships and exhibitions. LXX. Mathe- matics; LXXI. Classics and theology ; LXXII. Modern languages and history; LXXIII. Natural and moral sciences. Ryl, 8vo., ca. 13. 6d. CAMB. UNIV. PRESS, July 14",,,Cambridge University-Examination papers for scholarships and exhibitions,CAMB. UNIV. PRESS,6d.,8vo.,"Cambridge University-Examination papers for scholarships and exhibitions. LXX. Mathe- matics; LXXI. Classics and theology ; LXXII. Modern languages and history; LXXIII. Natural and moral sciences. Ryl, 8vo., ca. 13. 6d. CAMB. UNIV. PRESS, July 14",,,,July 14,1914,
"Cambridge University–Higher local examination : papers, Dec., 1913, with lists of Syndics and exaininers, &c. 8vo, swd. 1s. CAMB. UNIV. PRESS, Feb. 14",,,"Cambridge University–Higher local examination : papers, Dec",CAMB. UNIV. PRESS,1s.,"8vo,","Cambridge University–Higher local examination : papers, Dec., 1913, with lists of Syndics and exaininers, &c. 8vo, swd. Is. CAMB. UNIV. PRESS, Feb. 14",,,,Feb. 14,1914,
"Cambridge University-Higher local examination and certificates of proficiency in modern languages examination : papers, June, 1914, with lists of Syndics and examiners to which are added the regulations for the examinations in Dec., 1914, and June, 191s. Demy 8vo., swd. CAMB. UNIV. PRESS, July 14",,,"Cambridge University-Higher local examination and certificates of proficiency in modern languages examination : papers, June",CAMB. UNIV. PRESS,,8vo.,"Cambridge University-Higher local examination and certificates of proficiency in modern languages examination : papers, June, 1914, with lists of Syndics and examiners to which are added the regulations for the examinations in Dec., 1914, and June, 1915. Demy 8vo., swd. CAMB. UNIV. PRESS, July 14",,,,July 14,1914,
"Cambridge University-Higher local examination and certificates of proficiency in modern languages : examination papers, 1914, with list of Syndics, &c. 8vo. swd. 28. CAMB. UNIV. PRESS, Aug. 14",,,Cambridge University-Higher local examination and certificates of proficiency in modern languages : examination papers,CAMB. UNIV. PRESS,,8vo.,"Cambridge University-Higher local examination and certificates of proficiency in modern languages : examination papers, 1914, with list of Syndics, &c. 8vo. swd. 28. CAMB. UNIV. PRESS, Aug. 14",,,,Aug. 14,1914,
"Cambridge University-Local examination : Class lists (boys and girls) for the Examination held in July, 1914. 8vo. swd. ea. 6d. CAMI. UNIV. PRESS, Sep. 14",,,Cambridge University-Local examination : Class lists (boys and girls) for the Examination held in July,CAMI. UNIV. PRESS,6d.,8vo.,"Cambridge University-Local examination : Class lists (boys and girls) for the Examination held in July, 1914. 8vo. swd. ea. 6d. CAMI. UNIV. PRESS, Sep. 14",,,,Sep. 14,1914,
"Cambridge University-Local examinations. Class lists (girls) for the examinations held in Dec. 1913. Demy 8vo., pp. 64, swd., 6d. CAMB. UNIV. PRESS, Jan. 14",,,Cambridge University-Local examinations,CAMB. UNIV. PRESS,6d.,8vo.,"Cambridge University-Local examinations. Class lists (girls) for the examinations held in Dec. 1913. Demy 8vo., pp. 64, swd., 6d. CAMB. UNIV. PRESS, Jan. 14",,,,Jan. 14,1914,
"Cambridge University-Local examinations. Class lists (boys) for the examinations held in Dec. 1913. Demy 8vo., pp. 76, swd., 6d. CAMB. UNIV. PRESS, Jan, 14",,,Cambridge University-Local examinations,CAMB. UNIV. PRESS,6d.,8vo.,"Cambridge University-Local examinations. Class lists (boys) for the examinations held in Dec. 1913. Demy 8vo., pp. 76, swd., 6d. CAMB. UNIV. PRESS, Jan, 14",,,,"Jan, 14",1914,
"Cambridge University-Local examinations, 1913: the fifty-sixth annual report of the Local Examinations and Lectures Syndicate, with supplementary tables for Dec., 1913, and lists in order of merit of the senior and junior students who obtain the mark of distinction in each subject. Demy 8vo., pp. 338, 2s. CAMB. UNIV. PRESS, Mar. 14",,,Cambridge University-Local examinations,CAMB. UNIV. PRESS,2s.,8vo.,"Cambridge University-Local examinations, 1913: the fifty-sixth annual report of the Local Examinations and Lectures Syndicate, with supplementary tables for Dec., 1913, and lists in order of merit of the senior and junior students who obtain the mark of distinction in each subject. Demy 8vo., pp. 338, 2s. CAMB. UNIV. PRESS, Mar. 14",,,,Mar. 14,1914,
"Cambridge University-Local examinations, July, 1914: Supplementary tables and lists in order of merit of the senior and junior students who obtain the mark of distinction in each subject. Demy 8vo., pp. 190, swd. is. CAMB. UNIV. PRESS, Oct. 14",,,"Cambridge University-Local examinations, July",CAMB. UNIV. PRESS,,8vo.,"Cambridge University-Local examinations, July, 1914: Supplementary tables and lists in order of merit of the senior and junior students who obtain the mark of distinction in each subject. Demy 8vo., pp. 190, swd. is. CAMB. UNIV. PRESS, Oct. 14",,,,Oct. 14,1914,
"Cambridge University-Ordinances, to the end of the Easter Term, 1914. Edit. by the Registrary of the University. 8vo., 7s. 60. CAMB. UNIV. PRESS, Nov. 14",,,"Cambridge University-Ordinances, to the end of the Easter Term",CAMB. UNIV. PRESS,,8vo.,"Cambridge University-Ordinances, to the end of the Easter Term, 1914. Edit. by the Registrary of the University. 8vo., 75. 60. CAMB. UNIV. PRESS, Nov. 14",,,,Nov. 14,1914,
"Cambridge University--Preliminary local exami: nation. Class lists (boys) for the examination held in Dec., 1913. Demy 8vo., pp. 36, swd., 6d. CAMR. UNIV. PRESS, Jan. 14",,,Cambridge University--Preliminary local exami: nation,CAMR. UNIV. PRESS,6d.,8vo.,"Cambridge University--Preliminary local exami: nation. Class lists (boys) for the examination held in Dec., 1913. Demy 8vo., pp. 36, swd., 6d. CAMR. UNIV. PRESS, Jan. 14",,,,Jan. 14,1914,
"Cambridge University-Preliminary local exami- nation. Class list (girls) for the examination held in Dec. 1913. Demy 8vo., pp. 24, swd., 6d. CAMB. UNIV. PRESS, Jan. 14",,,Cambridge University-Preliminary local exami- nation,CAMB. UNIV. PRESS,6d.,8vo.,"Cambridge University-Preliminary local exami- nation. Class list (girls) for the examination held in Dec. 1913. Demy 8vo., pp. 24, swd., 6d. CAMB. UNIV. PRESS, Jan. 14",,,,Jan. 14,1914,
"Cambridge University--Prolusiones Academicæ ; or, Exercises which having obtained a prize in the Univ. of Cambridge were recited in the Senate House on 5th June, 1914. Cr. Svo., PP. 32, swd, is. ......CAMB. UNIV. PRESS, June 14",,,"Cambridge University--Prolusiones Academicæ ; or, Exercises which having obtained a prize in the Univ",CAMB. UNIV. PRESS,,,"Cambridge University--Prolusiones Academicæ ; or, Exercises which having obtained a prize in the Univ. of Cambridge were recited in the Senate House on 5th June, 1914. Cr. Svo., PP. 32, swd, is. ......CAMB. UNIV. PRESS, June 14",,,,June 14,1914,
"Cambridge University-Statutes of the University of Cambridge, with the interpretations of the Chancellor and sonie Acts of Parliament relating to the University. Demy 8vo., pp. 254, CAMB. UNIV. PRESS, Dec. 14",,,"Cambridge University-Statutes of the University of Cambridge, with the interpretations of the Chancellor and sonie Acts of Parliament relating to the University",CAMB. UNIV. PRESS,,8vo.,"Cambridge University-Statutes of the University of Cambridge, with the interpretations of the Chancellor and sonie Acts of Parliament relating to the University. Demy 8vo., pp. 254, CAMB. UNIV. PRESS, Dec. 14",,,,Dec. 14,1914,
"Cambridge University-Student's handbook to the University and Colleges of Cambridge. Rev. to 30th June, 1914. Cr. 8vo., pp. 708, CAMB. UNIV. PRESS, Oct. 14",,,Cambridge University-Student's handbook to the University and Colleges of Cambridge,CAMB. UNIV. PRESS,,8vo.,"Cambridge University-Student's handbook to the University and Colleges of Cambridge. Rev. to 30th June, 1914. Cr. 8vo., pp. 708, CAMB. UNIV. PRESS, Oct. 14",,,,Oct. 14,1914,
"With a complete index. 8vo. swd. is. CAMB. UNIV. PRESS, Jan. 14",,,With a complete index,CAMB. UNIV. PRESS,,8vo.,"With a complete index. 8vo. swd. is. CAMB. UNIV. PRESS, Jan. 14",,,,Jan. 14,1914,
"Cambridge University- Teachers' training Syndi- cate examinations for certificates : regulations for 1915; lists of successful candidates, Dec., 1913, and June, 1914; and the papers set in the examinations held in Dec., 1913, and June, 1914. Demy 8vo., pp. 46, swd, 6d. CAMB. UNIV. PRESS, Oct. 14",,,Cambridge University- Teachers' training Syndi- cate examinations for certificates : regulations for,CAMB. UNIV. PRESS,6d.,8vo.,"Cambridge University- Teachers' training Syndi- cate examinations for certificates : regulations for 1915; lists of successful candidates, Dec., 1913, and June, 1914; and the papers set in the examinations held in Dec., 1913, and June, 1914. Demy 8vo., pp. 46, swd, 6d. CAMB. UNIV. PRESS, Oct. 14",,,,Oct. 14,1914,
"Cambridga University School of Forestry. Bulletin No. 2, Nov., 1913. Ryl. 8vo., pp. 16, 9d. net CAMB. UNIV. PRESS, Jan. 14",,,Cambridga University School of Forestry,CAMB. UNIV. PRESS,9d.,8vo.,"Cambridga University School of Forestry. Bulletin No. 2, Nov., 1913. Ryl. 8vo., pp. 16, 9d. net CAMB. UNIV. PRESS, Jan. 14",,,,Jan. 14,1914,net
"Camp cookery : a book for boy scouts. By Lincoln Green. Cr. 8vo., swd. 6d. net S. PAUL, Apr. 14",,,Camp cookery : a book for boy scouts,S. PAUL,6d.,8vo.,"Camp cookery : a book for boy scouts. By Lincoln Green. Cr. 8vo., swd. 6d. net S. PAUL, Apr. 14",,,,Apr. 14,1914,net
"Can Germany win ? The resources and aspira- tions of its people. By an American. Cr. 8vo., Pp. 160, swd. 1s, net... .PEARSON, Nov. 14",,,Can Germany win ? The resources and aspira- tions of its people,PEARSON,1s.,8vo.,"Can Germany win ? The resources and aspira- tions of its people. By an American. Cr. 8vo., Pp. 160, swd. Is, net... .PEARSON, Nov. 14",,,,Nov. 14,1914,net
"Canada, Schoolboy in, FitzGerald (C.) 78. 6d. net Canada to-day, 1914. Illus. Folio swd. 1s. net CANADA, Sep. 14",,,"Canada, Schoolboy in, FitzGerald (C.)",CANADA,1s.,,"Canada, Schoolboy in, FitzGerald (C.) 78. 6d. net Canada to-day, 1914. Illus. Folio swd. Is. net CANADA, Sep. 14",,,,Sep. 14,1914,net
"Feb. 1914. Conducted by T. Gibson Bowles. Capri, Roman memories in landscape, Jerome Ryl. 8vo., 5s. net. .OFFICE, Feb. 14",,,Feb,OFFICE,5s.,8vo.,"Feb. 1914. Conducted by T. Gibson Bowles. Capri, Roman memories in landscape, Jerome Ryl. 8vo., 55. net. .OFFICE, Feb. 14",,,,Feb. 14,1914,net
"Captain (The). Vol. 30, Oct., 1913, to March, 1914. Cannan (Gilbert)-Old Mole : being the surprising Ryl. 8vo., 6s. .NEWNES, Mar. 14",,,Captain (The),NEWNES,6s.,8vo.,"Captain (The). Vol. 30, Oct., 1913, to March, 1914. Cannan (Gilbert)-Old Mole : being the surprising Ryl. 8vo., 6s. .NEWNES, Mar. 14",,,,Mar. 14,1914,
"Ar. 8vo. 71 x 5, pp. 302, 6s... M. SECKER, Jan. 14",,,Ar,M. SECKER,6s.,8vo.,"Ar. 8vo. 71 x 5, pp. 302, 6s... M. SECKER, Jan. 14",,,,Jan. 14,1914,
"Cr. 8vo., Ithr., 12s. 6d. net CAR ILLUSTRATED, Apr. 14",,,,CAR ILLUSTRATED,12s. 6d.,8vo.,"Cr. 8vo., Ithr., 125. 6d. net CAR ILLUSTRATED, Apr. 14",,,,Apr. 14,1914,net
"Notes by W. Bright. Cr. 8vo. advanced to Caravanning made easy, Hutchings (B.) is. net 78. od. net MILFORD, June 14",,,Notes by W. Bright,MILFORD,,8vo.,"Notes by W. Bright. Cr. 8vo. advanced to Caravanning made easy, Hutchings (B.) is. net 78. od. net MILFORD, June 14",,,,June 14,1914,
"Carcinoma of thyroid in salmonoid fishes, Canton (William)—The Bible and the Anglo- Gaylord (H. R.) and Marsh (M. C.) 1os. net Saxon people. Illus. Cr. 8vo. 7*X54, pp. .DENT, Nov. 14",,,"Carcinoma of thyroid in salmonoid fishes, Canton (William)—The Bible and the Anglo- Gaylord (H. R.) and Marsh (M. C.)",DENT,,8vo.,"Carcinoma of thyroid in salmonoid fishes, Canton (William)—The Bible and the Anglo- Gaylord (H. R.) and Marsh (M. C.) 1os. net Saxon people. Illus. Cr. 8vo. 7*X54, pp. .DENT, Nov. 14",,,,Nov. 14,1914,
"Cape Observatory-Astrographic zones. Vol. I. Carey (Alfred E.)—Time's Hour glass. Čr. 8vo. Zone -41 deg. WYMAN, 15s. .GREENING, Jan 14",,,Cape Observatory-Astrographic zones,GREENING,15s.,8vo.,"Cape Observatory-Astrographic zones. Vol. I. Carey (Alfred E.)—Time's Hour glass. Čr. 8vo. Zone -41 deg. WYMAN, 155. .GREENING, Jan 14",,,,Jan 14,1914,
