entry,last_name,first_name,title,publisher,price,format,original_entry,author_name,creators,is_editor,date,is_net
"Perry's Directory of Great Britain and Ireland, and Continental and Colonial Mercantile Guide, 1910. 4to. II X7, pp. 3,26s. 34th year, 30s. ; Subscribers, 218... W. PERRY, Feb. 10",,,"Perry's Directory of Great Britain and Ireland, and Continental and Colonial Mercantile Guide",W. PERRY,,4to.,"Perry's Directory of Great Britain and Ireland, and Continental and Colonial Mercantile Guide, 1910. 4to. II X7, pp. 3,265. 34th year, 30s. ; Subscribers, 218... W. PERRY, Feb. 10",,,,Feb. 10,
"Persia, Bunder Abbas and Lingah, Consular Report for 1908-9, 4d... .. WYMAN, June ro Persia, Correspondence re Affairs of, is. 5d. WYMAN, Apr. 10",,,"Persia, Bunder Abbas and Lingah, Consular Report for",WYMAN,5d.,,"Persia, Bunder Abbas and Lingah, Consular Report for 1908-9, 4d... .. WYMAN, June ro Persia, Correspondence re Affairs of, is. 5d. WYMAN, Apr. 10",,,,Apr. 10,
"Report on, 6d..... .. WYMAN, June 10",,,Report on,WYMAN,6d.,,"Report on, 6d..... .. WYMAN, June 10",,,,June 10,
"Reciter. New edit. Svo. 81 X5}, pp. 618, Pewter and Amateur Collector, Gale (E. J.) 7s. 6d. .ROUTLEDGE, Feb. 10",,,Reciter,ROUTLEDGE,7s. 6d.,,"Reciter. New edit. Svo. 81 X5}, pp. 618, Pewter and Amateur Collector, Gale (E. J.) 7s. 6d. .ROUTLEDGE, Feb. 10",,,,Feb. 10,
"Pharmaceutical Pocket Book (The), 1910-11. Peter and John, Epistles, Maclaren (A.) 7s. 6d. Edit. by John Humphrey. 12ino. 6X31, Νου. ΙΟ pp. 412, 3s. 661. net. . SIMPKIN, May 10",,,Pharmaceutical Pocket Book (The),SIMPKIN,,,"Pharmaceutical Pocket Book (The), 1910-11. Peter and John, Epistles, Maclaren (A.) 7s. 6d. Edit. by John Humphrey. 12ino. 6X31, Νου. ΙΟ pp. 412, 3s. 661. net. . SIMPKIN, May 10",,,,May 10,
"Northampton, and Rutland, 1910. Cr. 8vo. Phases of Progress, Mordecai (Mrs. R.) is. net swd. 1s, net .SIMPKIN, Jan. 10",,,"Northampton, and Rutland",SIMPKIN,1s.,8vo.,"Northampton, and Rutland, 1910. Cr. 8vo. Phases of Progress, Mordecai (Mrs. R.) is. net swd. Is, net .SIMPKIN, Jan. 10",,,,Jan. 10,net
"Peru. 8vo. 9 X58, pp. 476, 12s. 6d. net Philip (Alex. J.) Libraries, Museums and Art LANE, Feb. 10",,,Peru,LANE,,8vo.,"Peru. 8vo. 9 X58, pp. 476, 12s. 6d. net Philip (Alex. J.) Libraries, Museums and Art LANE, Feb. 10",,,,Feb. 10,
"R. ATKINSON, Sep. 10",,,,R. ATKINSON,,,"R. ATKINSON, Sep. 10",,,,Sep. 10,
"S.P.C.K., Dec. Io Philip (James C.)--Physical Chemistry, its Petrie (W. M. Flinders) --The Growth of the Bearing on Biology and Medicine. Cr. 8vo. Gospels as shown by Structural Criticism. 71 X 48, pp. 320, 7s. 6d. net E. ARNOLD, July 10",,,"S.P.C.K., Dec",E. ARNOLD,7s. 6d.,8vo.,"S.P.C.K., Dec. Io Philip (James C.)--Physical Chemistry, its Petrie (W. M. Flinders) --The Growth of the Bearing on Biology and Medicine. Cr. 8vo. Gospels as shown by Structural Criticism. 71 X 48, pp. 320, 7s. 6d. net E. ARNOLD, July 10",,,,July 10,net
"Cr. 8vo. 7! X41, pp. 109, 28. 60. net Philip Compton's Will, Kelly (Mrs. H.) is. 6d. MURRAY, July 10",,,,MURRAY,6d.,8vo.,"Cr. 8vo. 7! X41, pp. 109, 28. 60. net Philip Compton's Will, Kelly (Mrs. H.) is. 6d. MURRAY, July 10",,,,July 10,
"IS. net 5s. net Philips (F. C.) and Fenilall (PeTCV)--Honer. Philosophy as a Science : a Synopsis of the Writings mo011 and After Cr. 8vo. 73 x5, pp. 256, of Dr. P. Carus. Cr. 8vo. 2s.6d, net 2s. net ..NASH, Apr. 10",,,IS,NASH,2s.,8vo.,"IS. net 55. net Philips (F. C.) and Fenilall (PeTCV)--Honer. Philosophy as a Science : a Synopsis of the Writings mo011 and After Cr. 8vo. 73 x5, pp. 256, of Dr. P. Carus. Cr. 8vo. 2s.6d, net 2s. net ..NASH, Apr. 10",,,,Apr. 10,net
"K. PAUL, Jan. 10",,,,K. PAUL,,,"K. PAUL, Jan. 10",,,,Jan. 10,
"Philosophy, Influence of Darwin, Dewey (J.) Philips' Model of Talley's Comet, Tarth, and 6s, net ... June ro Sun. Designed by E. R. Hicks. folio pkt. Philosophy, Intro. to Study of, Oldham (A.). ..G. PHILIP, Mar. 10",,,"Philosophy, Influence of Darwin, Dewey (J.) Philips' Model of Talley's Comet, Tarth, and",G. PHILIP,,,"Philosophy, Influence of Darwin, Dewey (J.) Philips' Model of Talley's Comet, Tarth, and 6s, net ... June ro Sun. Designed by E. R. Hicks. folio pkt. Philosophy, Intro. to Study of, Oldham (A.). ..G. PHILIP, Mar. 10",,,,Mar. 10,
"British Social and Economic Problems Ex- Phillimore (W. plained from a Non-Party Standpoint. 8vo., W.) - County Pedigrees. pp. 52, swd, 6d, net ....F. PALMER, Apr. 10",,,British Social and Economic Problems Ex- Phillimore (W. plained from a Non-Party Standpoint,F. PALMER,6d.,8vo.,"British Social and Economic Problems Ex- Phillimore (W. plained from a Non-Party Standpoint. 8vo., W.) - County Pedigrees. pp. 52, swd, 6d, net ....F. PALMER, Apr. 10",,,,Apr. 10,net
"Nottinghamshire. Vol. I, pt. 3. 4to. 11} X9, pp. 163-292, 5s, net... PHILLIMORE, July 10 Photograms of the Year, 1910. Ryl. 8vo 10 X61 pp. 160, 35, 6d. net, swd. 2s. 6d. net Phillips (Austin)-Red Tape. Cr. 8vo. 71 x5, ROUTLEDGE, Oct. 10",,,Nottinghamshire,ROUTLEDGE,,4to.,"Nottinghamshire. Vol. I, pt. 3. 4to. 11} X9, pp. 163-292, 5s, net... PHILLIMORE, July 10 Photograms of the Year, 1910. Ryl. 8vo 10 X61 pp. 160, 35, 6d. net, swd. 25. 6d. net Phillips (Austin)-Red Tape. Cr. 8vo. 71 x5, ROUTLEDGE, Oct. 10",,,,Oct. 10,
"Cr. 8vo. 78 X5, pp. 392, 68. APPLETON, Oct. 10",,,,APPLETON,,8vo.,"Cr. 8vo. 78 X5, pp. 392, 68. APPLETON, Oct. 10",,,,Oct. 10,
"E. J. Wall. Cr. 8vo. 2s. net, swd. is. net Phillips (F. C.)---The Matrimonial Country, and ROUTLEDGE, July 10",,,E. J. Wall,ROUTLEDGE,,8vo.,"E. J. Wall. Cr. 8vo. 25. net, swd. is. net Phillips (F. C.)---The Matrimonial Country, and ROUTLEDGE, July 10",,,,July 10,
"Illus. 8vo. 5 X7], pp. 127, 1s. 6d. net Photography. A complete guide to the Art of BALE, Feb. 10 Photography in all its branches. Cr. 8vo., Phillips (Mabel K.)-The Supreme Power. Cr. 8vo. Pp. 144, s. ...WARD, L., July 10",,,,"WARD, L.",,8vo.,"Illus. 8vo. 5 X7], pp. 127, Is. 6d. net Photography. A complete guide to the Art of BALE, Feb. 10 Photography in all its branches. Cr. 8vo., Phillips (Mabel K.)-The Supreme Power. Cr. 8vo. Pp. 144, IS. ...WARD, L., July 10",,,,July 10,
"Photography for Beginners. 8vo. 8} X5], pp. 154, sw. s. net .NEWNES, Aug. 10",,,Photography for Beginners,NEWNES,,8vo.,"Photography for Beginners. 8vo. 8} X5], pp. 154, sw. IS. net .NEWNES, Aug. 10",,,,Aug. 10,
"HODDER & S., Sep. 10",,,,HODDER & S.,,,"HODDER & S., Sep. 10",,,,Sep. 10,
"History of (In the Nakhon Chaisi Circle). Phillpotts (Eden)-Wild Fruit. Poems. Cr. 8vo. Compiled by Chao Phraya Divakaravamsa 77X5, pp. 168, 5s. net ...LANE, Oct. 10 (1812-1870), printed according to the copy Phillpotts (Eden) and Bennett (Arnold)— The preserved in the National Library, Bangkok Statue, Cr. Svo., PP. 344, bels. is, net 128, in Siamese. Cr. 8vo., pp. 64, 1s. 6d. net CASSELL, Vario LUZAC, Jan. 10",,,Wild Fruit,LUZAC,,8vo.,"History of (In the Nakhon Chaisi Circle). Phillpotts (Eden)-Wild Fruit. Poems. Cr. 8vo. Compiled by Chao Phraya Divakaravamsa 77X5, pp. 168, 5s. net ...LANE, Oct. 10 (1812-1870), printed according to the copy Phillpotts (Eden) and Bennett (Arnold)— The preserved in the National Library, Bangkok Statue, Cr. Svo., PP. 344, bels. is, net 128, in Siamese. Cr. 8vo., pp. 64, Is. 6d. net CASSELL, Vario LUZAC, Jan. 10",,['History of (In the Nakhon Chaisi Circle). Phillpotts (Eden)'],,Jan. 10,
"Pickles, by Yotty Osborne. 4to., 1s., bds. 9d. J. F. SHAW, Sep. 10",,,"Pickles, by Yotty Osborne",J. F. SHAW,9d.,4to.,"Pickles, by Yotty Osborne. 4to., Is., bds. 9d. J. F. SHAW, Sep. 10",,,,Sep. 10,
"Pictures and Stories of Bible Teaching. Folio bds. 1s... R. T. S., Aug. 10",,,Pictures and Stories of Bible Teaching,R. T. S.,1s.,,"Pictures and Stories of Bible Teaching. Folio bds. Is... R. T. S., Aug. 10",,,,Aug. 10,
"Pictures of Life in Japan. 18mo. swd. 64. net GOWANS & G., June 10",,,Pictures of Life in Japan,GOWANS & G.,,18mo.,"Pictures of Life in Japan. 18mo. swd. 64. net GOWANS & G., June 10",,,,June 10,
"Pictures of 1910 (The). Imp. 8vo., 2s, net, swd. s, net. “Pall Mall Extra..OFFICE, May 10",,,Pictures of,OFFICE,,8vo.,"Pictures of 1910 (The). Imp. 8vo., 2s, net, swd. IS, net. “Pall Mall Extra..OFFICE, May 10",,,,May 10,
"Pictures que Cambridge. A selection of photo- graphic reproductions with a brief itinerary. 18mo. swd. 6d. net.... ..SIMPKIN, May 10",,,Pictures que Cambridge,SIMPKIN,6d.,18mo.,"Pictures que Cambridge. A selection of photo- graphic reproductions with a brief itinerary. 18mo. swd. 6d. net.... ..SIMPKIN, May 10",,,,May 10,net
"Pied-Piper Painting Bk., Aldin (C.) is... .. Mario Piépape (General de)---A Princess of Strategy : The Life of Anne Louise Bénédicte de Bourbon- Condé, Duchesse du Maine. Trans. by J. Lewis May. Svo. 9 X5], pp. 432, 12s. 60. net LANE, Oct. 10",,,Pied-Piper Painting Bk,LANE,,,"Pied-Piper Painting Bk., Aldin (C.) is... .. Mario Piépape (General de)---A Princess of Strategy : The Life of Anne Louise Bénédicte de Bourbon- Condé, Duchesse du Maine. Trans. by J. Lewis May. Svo. 9 X5], pp. 432, 12s. 60. net LANE, Oct. 10",,,,Oct. 10,
"History by their descendant. Cr 8vo.. pp. 72, Pisa (Alberto) and Mackenzie (W. M.) Pompeii. swd, 2. net SIMPKIN, Oct. 10 Painted by A. P.; described by W. M. M. Pigs, Pigsties, and Pork, Mayall (G.) 3s. 6d. net 8vo. 9 X61, pp. 192, 78. 6d. net BLACK, May 10",,,History by their descendant,BLACK,6d.,8vo.,"History by their descendant. Cr 8vo.. pp. 72, Pisa (Alberto) and Mackenzie (W. M.) Pompeii. swd, 2. net SIMPKIN, Oct. 10 Painted by A. P.; described by W. M. M. Pigs, Pigsties, and Pork, Mayall (G.) 35. 6d. net 8vo. 9 X61, pp. 192, 78. 6d. net BLACK, May 10",,,,May 10,net
"Pilgrims in the Maze, by The Green Lizard. Pitman's Correlated Tests: Arithmetic, Trought (T. W.) is. 3d. net · July to 8vo. 7} X5, pp. 48, is. 6d. net Pitman's Cumulative Speller, Smith (C, E..) is, 3d. (157, King's Rd., Chelsea) AUTHOR, Mar. 10",,,"Pilgrims in the Maze, by The Green Lizard",AUTHOR,3d.,8vo.,"Pilgrims in the Maze, by The Green Lizard. Pitman's Correlated Tests: Arithmetic, Trought (T. W.) is. 3d. net · July to 8vo. 7} X5, pp. 48, is. 6d. net Pitman's Cumulative Speller, Smith (C, E..) is, 3d. (157, King's Rd., Chelsea) AUTHOR, Mar. 10",,,,Mar. 10,
"PITMAX, Jan. 10",,,,PITMAX,,,"PITMAX, Jan. 10",,,,Jan. 10,
"Cr. 8vo. 1s. 3d..... .PITMAN, May 10",,,,PITMAN,1s. 3d.,8vo.,"Cr. 8vo. Is. 3d..... .PITMAN, May 10",,,,May 10,
"Pitman's Shortland and Typewriting Year Book Pink (Alfred)--Gardening for the Million. Popular and Diary, 1911. 12mo. is. ..PITMAN, Nov. 10",,,Pitman's Shortland and Typewriting Year Book Pink (Alfred)--Gardening for the Million,PITMAN,,12mo.,"Pitman's Shortland and Typewriting Year Book Pink (Alfred)--Gardening for the Million. Popular and Diary, 1911. 12mo. is. ..PITMAN, Nov. 10",,,,Nov. 10,
"SPORTING TIMES, Nov. 10 Pitman's Shorthand Weekly. Vol. 36. July- Pink 'un Summer Annual (The), 1910. 4to. swi. December, 1909. 4to. 3s. 6. PITMAN, Jan. 10",,,"SPORTING TIMES, Nov",PITMAN,,4to.,"SPORTING TIMES, Nov. 10 Pitman's Shorthand Weekly. Vol. 36. July- Pink 'un Summer Annual (The), 1910. 4to. swi. December, 1909. 4to. 3s. 6. PITMAN, Jan. 10",,,,Jan. 10,
"IS. net ..OFFICE, June 10",,,IS,OFFICE,,,"IS. net ..OFFICE, June 10",,,,June 10,
"Pitman's Shorthand Weekly, Vol. 37, Jan-June, Pio (Cid) — The Briton in Spain. Llius. Svo 1910. 4to. 38. 661... PITMAN, July 10",,,"Pitman's Shorthand Weekly, Vol",PITMAN,,4to.,"Pitman's Shorthand Weekly, Vol. 37, Jan-June, Pio (Cid) — The Briton in Spain. Llius. Svo 1910. 4to. 38. 661... PITMAN, July 10",,,,July 10,
"PITMAN, Mar. 10",,,,PITMAN,,,"PITMAN, Mar. 10",,,,Mar. 10,
"PITMAN'S Pitman's Tourists' Vade Mecum-Italian. With Vocabularies, Tables, &c., and General Rules on Pronunciation. Fcap. 8vo. 38 x6, pp. 96, s. net . PITMAN, Mar. 10",,,PITMAN'S Pitman's Tourists' Vade Mecum-Italian,PITMAN,,8vo.,"PITMAN'S Pitman's Tourists' Vade Mecum-Italian. With Vocabularies, Tables, &c., and General Rules on Pronunciation. Fcap. 8vo. 38 x6, pp. 96, IS. net . PITMAN, Mar. 10",,,,Mar. 10,
"Pitman's Where to Look : an easy guide to books of reference. 3rd edit. rev. and augmented. Cr. 8vo. 7} X4, pp. 146, 2s. net I. PITMAN, Jan. 10",,,Pitman's Where to Look : an easy guide to books of reference,I. PITMAN,2s.,8vo.,"Pitman's Where to Look : an easy guide to books of reference. 3rd edit. rev. and augmented. Cr. 8vo. 7} X4, pp. 146, 25. net I. PITMAN, Jan. 10",,,,Jan. 10,net
"Plato-Five Dialogues bearing on Poetic Inspira- tion. Immo., pp. 300, 1s. net, Ithr. 2s. net (Everyman's Lib.) .DENT, Sep. 10",,,Plato-Five Dialogues bearing on Poetic Inspira- tion,DENT,2s.,,"Plato-Five Dialogues bearing on Poetic Inspira- tion. Immo., pp. 300, Is. net, Ithr. 25. net (Everyman's Lib.) .DENT, Sep. 10",,,,Sep. 10,net
"Play Pictorial (The) Vol. 1s. Imp. 8vo. 6s. net OFFICE, J 1.ly 10",,,Play Pictorial (The) Vol,OFFICE,6s.,8vo.,"Play Pictorial (The) Vol. 15. Imp. 8vo. 6s. net OFFICE, J 1.ly 10",,,,J 1.ly 10,net
"Playbox Annual (The), 1911. Ryl. 8vo., bds., 3s. OFFICE, Oct. 10",,,Playbox Annual (The),OFFICE,3s.,8vo.,"Playbox Annual (The), 1911. Ryl. 8vo., bds., 3s. OFFICE, Oct. 10",,,,Oct. 10,
"Playtime Pages for the Little ones. Illus. Oblong 4to., bds. 2s. .NISTER, Aug. 10",,,Playtime Pages for the Little ones,NISTER,2s.,4to.,"Playtime Pages for the Little ones. Illus. Oblong 4to., bds. 2s. .NISTER, Aug. 10",,,,Aug. 10,
"Pleasure Grounds, Local Government Board Molel Bye-laws for, 2d.......WYMAN, Apr. 10",,,"Pleasure Grounds, Local Government Board Molel Bye-laws for",WYMAN,2d.,,"Pleasure Grounds, Local Government Board Molel Bye-laws for, 2d.......WYMAN, Apr. 10",,,,Apr. 10,
"Plutarch's Life of Julius Cæsar. Edit. for Schools by H. W. M. Parr. 12mo. swd. 1s. MACMILLAN, Aug. 10",,,Plutarch's Life of Julius Cæsar,MACMILLAN,1s.,12mo.,"Plutarch's Life of Julius Cæsar. Edit. for Schools by H. W. M. Parr. I2mo. swd. Is. MACMILLAN, Aug. 10",,,,Aug. 10,
"Plutarch's Lives. Rev. by Arthur Clough. 3 vols. 12mo. ea. 1s. net, Ithr. 2s. net (Everyman's Lib.) .DENT, Feb. 10",,,Plutarch's Lives,DENT,2s.,12mo.,"Plutarch's Lives. Rev. by Arthur Clough. 3 vols. 12mo. ea. Is. net, Ithr. 25. net (Everyman's Lib.) .DENT, Feb. 10",,,,Feb. 10,net
"Pocket Doctor (The). By “ Medicus. 32mo 6d. net, ithr. is. net ..CASSELL, Oct. 10",,,Pocket Doctor (The),CASSELL,,32mo,"Pocket Doctor (The). By “ Medicus. 32mo 6d. net, ithr. is. net ..CASSELL, Oct. 10",,,,Oct. 10,
"Poetry for Children. Chosen from Original Poems. Illus. Ryl. 16mo., pp. 36, bds. s, 6d. net PRIORY PRESS, Nov. 10",,,Poetry for Children,PRIORY PRESS,6d.,16mo.,"Poetry for Children. Chosen from Original Poems. Illus. Ryl. 16mo., pp. 36, bds. IS, 6d. net PRIORY PRESS, Nov. 10",,,,Nov. 10,net
"Poland and Grodna (Russia), Consular Report for 1909, 4 d. WYMAN, Oct. 10",,,Consular Report for,WYMAN,,,"Poland and Grodna (Russia), Consular Report for 1909, 4 d. WYMAN, Oct. 10",,"['Poland', 'Grodna (Russia)']",,Oct. 10,
"Police Report for 1909: England and Wales, s, 2d. W'YMAN, A pr. 10",,,Police Report for,W'YMAN,2d.,,"Police Report for 1909: England and Wales, IS, 2d. W'YMAN, A pr. 10",,,,A pr. 10,
"Polo Player's Diary (The), 1910. Illus. Edit. by Rallywood. 8vo. bds, 2s. 6d. net S. B. VAUGHAN, Apr. 10",,,Polo Player's Diary (The),S. B. VAUGHAN,2s. 6d.,8vo.,"Polo Player's Diary (The), 1910. Illus. Edit. by Rallywood. 8vo. bds, 25. 6d. net S. B. VAUGHAN, Apr. 10",,,,Apr. 10,net
"Ponce de Leon : the Rise of the Argentine Republic By an Estanciero. Ryl. 8vo. 98 x6, pp. 446, 12s. 6d. net .T. W. LAURIE, May 10",,,Ponce de Leon : the Rise of the Argentine Republic By an Estanciero,T. W. LAURIE,12s. 6d.,8vo.,"Ponce de Leon : the Rise of the Argentine Republic By an Estanciero. Ryl. 8vo. 98 x6, pp. 446, I2s. 6d. net .T. W. LAURIE, May 10",,,,May 10,net
"Poor Law Conference, Districts—Held at the Royal Pavilion, Brighton, on December 9th and roth, 1909. 8vo. 81x5), pp. 611-675, s. net ...P. S. KING, Feb. 10",,,"Poor Law Conference, Districts—Held at the Royal Pavilion, Brighton, on December",P. S. KING,,8vo.,"Poor Law Conference, Districts—Held at the Royal Pavilion, Brighton, on December 9th and roth, 1909. 8vo. 81x5), pp. 611-675, IS. net ...P. S. KING, Feb. 10",,,,Feb. 10,
"Poor Law, Commission. Evidence relating to Scotland, Vol. 6, gs. id. ; Index to same. Vol. 6A, is, gd... . WYMAN, Feb. 10",,,"Poor Law, Commission",WYMAN,,,"Poor Law, Commission. Evidence relating to Scotland, Vol. 6, gs. id. ; Index to same. Vol. 6A, is, gd... . WYMAN, Feb. 10",,,,Feb. 10,
"Poor Law Commission—Vol. 7, Evidence, 4s. 7d. ; Vol. 7A, Index, 1s...... . WYMAN, Mar. 10",,,Poor Law Commission—Vol,WYMAN,1s.,,"Poor Law Commission—Vol. 7, Evidence, 4s. 7d. ; Vol. 7A, Index, Is...... . WYMAN, Mar. 10",,,,Mar. 10,
"Poor Law Commission-Appendix, Vol. Evidence, 5s. 4d. ; Appendix, Vol. 8A : Index. s. Iod. . WYMAN, Apr. 10",,,"Poor Law Commission-Appendix, Vol",WYMAN,,,"Poor Law Commission-Appendix, Vol. Evidence, 5s. 4d. ; Appendix, Vol. 8A : Index. IS. Iod. . WYMAN, Apr. 10",,,,Apr. 10,
"Poor Law Commission-Evidence, Vol. 9, 9s. ; Index, Vol. 9A, s. 7d. ; Appendix, Vol. 24, 6d. WYMAN, June 10",,,"Poor Law Commission-Evidence, Vol",WYMAN,6d.,,"Poor Law Commission-Evidence, Vol. 9, 9s. ; Index, Vol. 9A, IS. 7d. ; Appendix, Vol. 24, 6d. WYMAN, June 10",,,,June 10,
"Poor Law Commission-Appendix, Vol. 2s. 4d. . WYMAN, Mar. 10",,,"Poor Law Commission-Appendix, Vol",WYMAN,2s. 4d.,,"Poor Law Commission-Appendix, Vol. 25. 4d. . WYMAN, Mar. 10",,,,Mar. 10,
"Poor Laws : Royal Commission on -Appendix Vol. 21, 8d. WYMAN, July 10",,,Poor Laws : Royal Commission on -Appendix Vol,WYMAN,8d.,,"Poor Laws : Royal Commission on -Appendix Vol. 21, 8d. WYMAN, July 10",,,,July 10,
"Poor Law Commission-Vol. 23: Report on the Condition of Children, by C. T. Parsons, 28. WYMAN, May 10",,,Poor Law Commission-Vol,WYMAN,,,"Poor Law Commission-Vol. 23: Report on the Condition of Children, by C. T. Parsons, 28. WYMAN, May 10",,,,May 10,
"Poor Law Commission-Appendix, Vol. 26 : Documents re Administration of Charities, 9}d. .WYMAN, Sep. 10",,,"Poor Law Commission-Appendix, Vol",WYMAN,,,"Poor Law Commission-Appendix, Vol. 26 : Documents re Administration of Charities, 9}d. .WYMAN, Sep. 10",,,,Sep. 10,
"Poor Law Commission-Vol. 32, s. ; l'ol, 10, 4s. 8d. ; Vol. 10A, 3d. ; Vol. 29, 1s. WYMAX, July 10",,,Poor Law Commission-Vol,WYMAX,1s.,,"Poor Law Commission-Vol. 32, IS. ; l'ol, 10, 45. 8d. ; Vol. 10A, 3d. ; Vol. 29, 1S. WYMAX, July 10",,,,July 10,
"Poor Law Commission- Appendix, Vol. 36, 11!(). WYMAN, July 10",,,"Poor Law Commission- Appendix, Vol",WYMAN,,,"Poor Law Commission- Appendix, Vol. 36, 11!(). WYMAN, July 10",,,,July 10,
"Poor Law Commission.--Memoranda by Indi- vidual Commissioners on Various Subjects, 58. 7d. WYMAN, Jan. 10",,,Poor Law Commission,WYMAN,7d.,,"Poor Law Commission.--Memoranda by Indi- vidual Commissioners on Various Subjects, 58. 7d. WYMAN, Jan. 10",,,,Jan. 10,
"Poor Law Commission-Report by the Rev. J. C. Pringle relating to the Unemployed, ..WYMAN, Apr. 10",,,Poor Law Commission-Report by the Rev,WYMAN,,,"Poor Law Commission-Report by the Rev. J. C. Pringle relating to the Unemployed, ..WYMAN, Apr. 10",,,,Apr. 10,
"Poor Law Commission-Reports on Visits to Charitable Institutions in the United Kingdom, 4s. 3d. ..WYMAN, Jan. 10",,,Poor Law Commission-Reports on Visits to Charitable Institutions in the United Kingdom,WYMAN,4s. 3d.,,"Poor Law Commission-Reports on Visits to Charitable Institutions in the United Kingdom, 4s. 3d. ..WYMAN, Jan. 10",,,,Jan. 10,
"Poor Law Commission-Statistics relating to Ireland, 5 d. . WYMAN, Aug. 10",,,Poor Law Commission-Statistics relating to Ireland,WYMAN,,,"Poor Law Commission-Statistics relating to Ireland, 5 d. . WYMAN, Aug. 10",,,,Aug. 10,
"Poor Law Minority Report (The)-R port of De- bate between G. Lansbury and H. Quelch, Sep., 1910. Swd. id. TWENTIETH CEx. PRESS, Nov. 10",,,"Poor Law Minority Report (The)-R port of De- bate between G. Lansbury and H. Quelch, Sep",PRESS,,,"Poor Law Minority Report (The)-R port of De- bate between G. Lansbury and H. Quelch, Sep., 1910. Swd. id. TWENTIETH CEx. PRESS, Nov. 10",,,,Nov. 10,
"Poor Relief Returns for the Half-year ended Michaelmas, 1909, 3d....... WYMAN, May 10",,,Poor Relief Returns for the Half-year ended Michaelmas,WYMAN,3d.,,"Poor Relief Returns for the Half-year ended Michaelmas, 1909, 3d....... WYMAN, May 10",,,,May 10,
"Pope's Essay on Criticism. Edit. with intro. and notes by John Sargeaunt. 12mo. 7X41, pp. 80. 2s. (Clarendon Press), FROWDE, Jan. 10",,,Pope's Essay on Criticism,FROWDE,,12mo.,"Pope's Essay on Criticism. Edit. with intro. and notes by John Sargeaunt. 12mo. 7X41, pp. 80. 2s. (Clarendon Press), FROWDE, Jan. 10",,,,Jan. 10,
"Porphyry the Philosopher to His Wife Marcella. New and revised trans. by Alice Zimmern. Cr. 8vo., pp. 52, swd. is. net PRIORY PRESS, Oct. 10",,,Porphyry the Philosopher to His Wife Marcella,PRIORY PRESS,,8vo.,"Porphyry the Philosopher to His Wife Marcella. New and revised trans. by Alice Zimmern. Cr. 8vo., pp. 52, swd. is. net PRIORY PRESS, Oct. 10",,,,Oct. 10,
"Port of London Port Rates on Goods : Provisional Order Bill, 6d. WYMAN, A pr. 10",,,Port of London Port Rates on Goods : Provisional Order Bill,WYMAN,6d.,,"Port of London Port Rates on Goods : Provisional Order Bill, 6d. WYMAN, A pr. 10",,,,A pr. 10,
"Porto Rico, Consular Report for 1909, 3}d. WYMAN, June 10",,,"Porto Rico, Consular Report for",WYMAN,,,"Porto Rico, Consular Report for 1909, 3}d. WYMAN, June 10",,,,June 10,
"Post Office Estimates, 1910-11, 60. WYMAN, Apr. 10",,,Post Office Estimates,WYMAN,,,"Post Office Estimates, 1910-11, 60. WYMAN, Apr. 10",,,,Apr. 10,
"Post Office London Directory, 1911. 4to. 328. KELLY'S DIRECTORIES, Dec. Post Office London Directory, with County Suburbs. 4to., 40$. ; County Suburbs separate 15s. ..KELLY'S DIRECTORIES, Dec. 10",,,Post Office London Directory,KELLY'S DIRECTORIES,15s.,4to.,"Post Office London Directory, 1911. 4to. 328. KELLY'S DIRECTORIES, Dec. Post Office London Directory, with County Suburbs. 4to., 40$. ; County Suburbs separate 155. ..KELLY'S DIRECTORIES, Dec. 10",,,,Dec. 10,
"Post Office Savings Banks Accounts, fd. WYMAN, July 10",,,"Post Office Savings Banks Accounts, fd",WYMAN,,,"Post Office Savings Banks Accounts, fd. WYMAN, July 10",,,,July 10,
"Powell's Principles and Practice of the Law of Evidence. 9th edit. by W. Blake-Odgers. Demy Svo., PP. 927, 20s. BUTTERWORTH, Aug. 10",,,Powell's Principles and Practice of the Law of Evidence,BUTTERWORTH,20s.,,"Powell's Principles and Practice of the Law of Evidence. 9th edit. by W. Blake-Odgers. Demy Svo., PP. 927, 205. BUTTERWORTH, Aug. 10",,,,Aug. 10,
"Practical Electrics, 9th edit. Cr. 8vo. limp s. 6d. net ..SPON, Feb. 10",,,Practical Electrics,SPON,6d.,8vo.,"Practical Electrics, 9th edit. Cr. 8vo. limp IS. 6d. net ..SPON, Feb. 10",,,,Feb. 10,net
"Practical Swiss Guide (The), 1910. Cr. 8vo, swd. 43. net .K. PAUL, Aug. 10",,,Practical Swiss Guide (The),K. PAUL,,"8vo,","Practical Swiss Guide (The), 1910. Cr. 8vo, swd. 43. net .K. PAUL, Aug. 10",,,,Aug. 10,
"Pratt's Income Tax Acts. 8th edit. rev. by J. H. Redman. Cr. 8vo. Es, 6d, net BUTTERWORTH, June 10",,,Pratt's Income Tax Acts,BUTTERWORTH,6d.,8vo.,"Pratt's Income Tax Acts. 8th edit. rev. by J. H. Redman. Cr. 8vo. Es, 6d, net BUTTERWORTH, June 10",,,,June 10,net
"Prayer-Book of Queen Elizabeth, 1559 (The). To which are appended some occasional forms of prayer issued in her reign. With an historical intro. by Edward Benham. Cr. 8vo. 7* X5, Pp. 290, is. 3d. .. ...J. GRANT, Feb. 10",,,Prayer-Book of Queen Elizabeth,J. GRANT,3d.,8vo.,"Prayer-Book of Queen Elizabeth, 1559 (The). To which are appended some occasional forms of prayer issued in her reign. With an historical intro. by Edward Benham. Cr. 8vo. 7* X5, Pp. 290, is. 3d. .. ...J. GRANT, Feb. 10",,,,Feb. 10,
"Prayers for Church and Home. Cr. 8vo. 7} X4, pp. 64, 1s, net ..P. GREEN, Feb. 10",,,Prayers for Church and Home,P. GREEN,1s.,8vo.,"Prayers for Church and Home. Cr. 8vo. 7} X4, pp. 64, Is, net ..P. GREEN, Feb. 10",,,,Feb. 10,net
"Preacher's Treasury (The): a Third Series of Outlines, Illustrations and Children's Ad- dresses. 12mo. 64 X4, pp. 298, 2s. 6d. ALLENSON, Jan. 10",,,"Preacher's Treasury (The): a Third Series of Outlines, Illustrations and Children's Ad- dresses",ALLENSON,2s. 6d.,12mo.,"Preacher's Treasury (The): a Third Series of Outlines, Illustrations and Children's Ad- dresses. 12mo. 64 X4, pp. 298, 2s. 6d. ALLENSON, Jan. 10",,,,Jan. 10,
"Princess Priscilla's Fortnight. By the author of Elizabeth and her German Carden. 8vo. swd. 6d. AMALGAMATED PRESS, Mar. 10",,,Princess Priscilla's Fortnight,AMALGAMATED PRESS,6d.,8vo.,"Princess Priscilla's Fortnight. By the author of Elizabeth and her German Carden. 8vo. swd. 6d. AMALGAMATED PRESS, Mar. 10",,,,Mar. 10,
"Principles and Methods of University Reform : Report of the Hebdomadal Council. With an introduction submitted on behalf of the Council, by Lord Curzon of Kedleston. 8vo., PP. 140, bds. 1s. 6d. net (Clarendon Press) FROWDE, Aug. 10",,,Principles and Methods of University Reform : Report of the Hebdomadal Council,FROWDE,1s. 6d.,8vo.,"Principles and Methods of University Reform : Report of the Hebdomadal Council. With an introduction submitted on behalf of the Council, by Lord Curzon of Kedleston. 8vo., PP. 140, bds. Is. 6d. net (Clarendon Press) FROWDE, Aug. 10",,,,Aug. 10,net
"Printers' Pic. A fesuival souvenir of the Printers' Pension, Alnishouse and Orphan Asyluin Corporation, 1910. 4to. swd, is. net THE SPHERE, June 10",,,Printers' Pic,THE SPHERE,,4to.,"Printers' Pic. A fesuival souvenir of the Printers' Pension, Alnishouse and Orphan Asyluin Corporation, 1910. 4to. swd, is. net THE SPHERE, June 10",,,,June 10,
"Prior (James-Fortuna Cliance. Cr. 8vo. 73 x5, pp. 446, 6s. CONSTABLE, Oct. 10",,,Prior (James-Fortuna Cliance,CONSTABLE,6s.,8vo.,"Prior (James-Fortuna Cliance. Cr. 8vo. 73 x5, pp. 446, 6s. CONSTABLE, Oct. 10",,,,Oct. 10,
