entry,last_name,first_name,title,publisher,price,format,original_entry,author_name,creators,is_editor,date,catalogue_year,is_net
"Churchman's diary (The), 1922: an almanack and directory for the celebration of the services of the Church. 18mo. 6×4, pp. 60, interleaved 1s. net; swd. 9d. net W. WALKER, Dec. '21",,,Churchman's diary (The),W. WALKER,9d.,18mo.,"Churchman's diary (The), 1922: an almanack and directory for the celebration of the services of the Church. 18mo. 6×4, pp. 60, interleaved Is. net; swd. 9d. net W. WALKER, Dec. '21",,,,Dec. '21,1921,net
"Churchwardens, Handbk. for, Macmorran (K. M.) 4s., 2s. net. Ciaran, Latin and Irish (R. A. S.) Ios. net.. Cicero (M. T.)-Cicero Somnium Scipionis. Intro., text and notes. Ed. by J. F. Stout (Prescribed by the Univ. of London for Inter- mediate Arts Exam., 1922). Cr. 8vo. pp. 32, ppr. bds. 2s. 6d... UNIV. TUTORIAL PR., Apr. '21",,,"Churchwardens, Handbk",UNIV. TUTORIAL PR.,2s. 6d.,8vo.,"Churchwardens, Handbk. for, Macmorran (K. M.) 45., 2s. net. Ciaran, Latin and Irish (R. A. S.) Ios. net.. Cicero (M. T.)-Cicero Somnium Scipionis. Intro., text and notes. Ed. by J. F. Stout (Prescribed by the Univ. of London for Inter- mediate Arts Exam., 1922). Cr. 8vo. pp. 32, ppr. bds. 2s. 6d... UNIV. TUTORIAL PR., Apr. '21",,,,Apr. '21,1921,
"Cinematograph Act, 1909-Return of all the licensing authorities administering the Cine- matograph Act, 1909. 4d. net H.M.S.O., Mar. '21",,,Cinematograph Act,H.M.S.O.,4d.,,"Cinematograph Act, 1909-Return of all the licensing authorities administering the Cine- matograph Act, 1909. 4d. net H.M.S.O., Mar. '21",,,,Mar. '21,1921,net
"Civil Contingencies Fund-Accounts, 1919-20. 1d. H.M.S.O., Mar. '21",,,Civil Contingencies Fund-Accounts,H.M.S.O.,1d.,,"Civil Contingencies Fund-Accounts, 1919-20. Id. H.M.S.O., Mar. '21",,,,Mar. '21,1921,
"Civil List Pensions-List, 1920-21. 1d. net ....... H.M.S.O., July '21",,,Civil List Pensions-List,H.M.S.O.,1d.,,"Civil List Pensions-List, 1920-21. Id. net ....... H.M.S.O., July '21",,,,July '21,1921,net
"Civil Service Commission-Examination papers: I.C.S. (Aug.), 6s. net; Shorthand typists (Oct.), 6d.; Army Entrance, &c. (Nov.), 2s. net; Air Force, boy mechanic (Nov.), 6d. net; Dublin Met. Police (Nov.), 1s. 6d. ; Clerical class (men) (Nov. and Dec.), 9d. net; Paymaster cadetships R.N. (Dec.), 1s. net; Foreign Office (Oct.), 1s. 6d. net; Clerical class (women) (Oct.), 9d. net; Foreign languages, Modern (Army) (Jan.), 3s. net; Clerical class: results (men) 7s. net, (women) 4s. net; Typist (Nov. and Feb.), 1s. 6d. net; Writing assistant, 2s. net; Veterinary inspector, Ireland (Apr.), od. net; Apprentice (R.N. dockyards) (Apr.), 6d. net; P.O., sorter, &c. (Mar.), 2s. net; (boy messengers), 9d. net; Met. Police clerk (May), 2s. 6d. net; P.O. female sorter (May), 1s. 6d. net; H.M.S.O., assist. ex- aminer of paper (Mar.), 6d. ; Naval Officers mod. foreign languages (June), 3s. 6d. net; En- gineer and ship engineer, &c (Jan., July), 1s. 6d. net; H.M.O.W. assist. engineer (July), 1s. 6d. net; Patent Office, assist. examiner (July), 3s. .H.M.S.O., Jan., &c., '21",,,Civil Service Commission-Examination papers: I.C.S. (Aug,H.M.S.O.,3s.,,"Civil Service Commission-Examination papers: I.C.S. (Aug.), 6s. net; Shorthand typists (Oct.), 6d.; Army Entrance, &c. (Nov.), 2s. net; Air Force, boy mechanic (Nov.), 6d. net; Dublin Met. Police (Nov.), Is. 6d. ; Clerical class (men) (Nov. and Dec.), 9d. net; Paymaster cadetships R.N. (Dec.), Is. net; Foreign Office (Oct.), Is. 6d. net; Clerical class (women) (Oct.), 9d. net; Foreign languages, Modern (Army) (Jan.), 3s. net; Clerical class: results (men) 7s. net, (women) 45. net; Typist (Nov. and Feb.), Is. 6d. net; Writing assistant, 2s. net; Veterinary inspector, Ireland (Apr.), od. net; Apprentice (R.N. dockyards) (Apr.), 6d. net; P.O., sorter, &c. (Mar.), 2s. net; (boy messengers), 9d. net; Met. Police clerk (May), 2s. 6d. net; P.O. female sorter (May), Is. 6d. net; H.M.S.O., assist. ex- aminer of paper (Mar.), 6d. ; Naval Officers mod. foreign languages (June), 3s. 6d. net; En- gineer and ship engineer, &c (Jan., July), 1s. 6d. net; H.M.O.W. assist. engineer (July), Is. 6d. net; Patent Office, assist. examiner (July), 3s. .H.M.S.O., Jan., &c., '21",,,,"Jan., &c., '21",1921,
"Civil Service Commission-65th report, 1920. s. net... .H.M.S.O., Sep. '21",,,Civil Service Commission,H.M.S.O.,,,"Civil Service Commission-65th report, 1920. IS. net... .H.M.S.O., Sep. '21",,,,Sep. '21,1921,
"Civil Service National Whitley Council-Cost of living report. id.........H.M.S.O., Jan. '21",,,Civil Service National Whitley Council-Cost of living report,H.M.S.O.,,,"Civil Service National Whitley Council-Cost of living report. id.........H.M.S.O., Jan. '21",,,,Jan. '21,1921,
"Civil Service National Whitley Council-Re- organisation Committee. Final report. 3d. net H.M.S.O., Feb. '21",,,Civil Service National Whitley Council-Re- organisation Committee,H.M.S.O.,3d.,,"Civil Service National Whitley Council-Re- organisation Committee. Final report. 3d. net H.M.S.O., Feb. '21",,,,Feb. '21,1921,net
"Civil Service-Salaries of the principal posts: Report. 1d... H.M.S.O., Mar. '21",,,Civil Service-Salaries of the principal posts: Report,H.M.S.O.,1d.,,"Civil Service-Salaries of the principal posts: Report. Id... H.M.S.O., Mar. '21",,,,Mar. '21,1921,
"Civil Services-Estimates, 1920-21: supplemen- tary. 6d. net.. .H.M.S.O., Feb. '21",,,Civil Services-Estimates,H.M.S.O.,6d.,,"Civil Services-Estimates, 1920-21: supplemen- tary. 6d. net.. .H.M.S.O., Feb. '21",,,,Feb. '21,1921,net
"Civilian's South India (The)-Some Places and people in Madras. 8vo. 8×5, pp. 244, 12s. 6d. net.. ..LANE, Oct. '21",,,Civilian's South India (The)-Some Places and people in Madras,LANE,12s. 6d.,8vo.,"Civilian's South India (The)-Some Places and people in Madras. 8vo. 8×5, pp. 244, 12s. 6d. net.. ..LANE, Oct. '21",,,,Oct. '21,1921,net
"Claudius Clear. See Nicoll (W. Robertson). Clay (Albert F.) see Jastrow (M.) and Clay. Clay (Beatrice)-Stories from Le Morte D'Arthur and the Mabinogion: retold. 8vo. 6 X4, pp 192, s. 9d. net. (King's treasuries of literature ser.).. .DENT, Jan. '21",,,Claudius Clear,DENT,,8vo.,"Claudius Clear. See Nicoll (W. Robertson). Clay (Albert F.) see Jastrow (M.) and Clay. Clay (Beatrice)-Stories from Le Morte D'Arthur and the Mabinogion: retold. 8vo. 6 X4, pp 192, IS. 9d. net. (King's treasuries of literature ser.).. .DENT, Jan. '21",,,,Jan. '21,1921,
"Cleanness : an alliterative tripartite poem of the Deluge, &c.; by the poet of Pearl. Edit. by Sir J. Gollancz. Ryl. 8vo. pp. 112, swd. 5s. net. (Selected early Eng. poems)..MILFORD, Dec. '21",,,"Cleanness : an alliterative tripartite poem of the Deluge, &c",MILFORD,,8vo.,"Cleanness : an alliterative tripartite poem of the Deluge, &c.; by the poet of Pearl. Edit. by Sir J. Gollancz. Ryl. 8vo. pp. 112, swd. 5s. net. (Selected early Eng. poems)..MILFORD, Dec. '21",,,,Dec. '21,1921,
"“Clear (Claudius). See Nicoll (W. Robertson). Cleaver (Hylton)-Captains of Harley: a school story. Illus. by H. M. Brock. Cr. 8vo. 7×5, pp. 277, 4s. net (Crown ser: boys) MILFORD, Oct. '21",,,Captains of Harley: a school story,MILFORD,4s.,8vo.,"“Clear (Claudius). See Nicoll (W. Robertson). Cleaver (Hylton)-Captains of Harley: a school story. Illus. by H. M. Brock. Cr. 8vo. 7×5, pp. 277, 4s. net (Crown ser: boys) MILFORD, Oct. '21",,['“Clear (Claudius). See Nicoll (W. Robertson). Cleaver (Hylton)'],,Oct. '21,1921,net
"Clergy directory, 1921 (The). 51st issue. Cr. 8vo. 71× 51, pp. 824, 6s. net J. S. PHILLIPS, May '21",,,Clergy directory,J. S. PHILLIPS,6s.,8vo.,"Clergy directory, 1921 (The). 51st issue. Cr. 8vo. 71× 51, pp. 824, 6s. net J. S. PHILLIPS, May '21",,,,May '21,1921,net
"bondage. 75, pp. STOCKWELL, Nov. '21",,,,STOCKWELL,,,"bondage. 75, pp. STOCKWELL, Nov. '21",,,,Nov. '21,1921,
"ser.) Coleridge (Stephen, Hon.)--Letters to my grand- son on the world about him. Cr. 8vo. 7×5, pp. 124, 4s. net.. MILLS & B., Oct. '21",,,"Coleridge (Stephen, Hon",MILLS & B.,4s.,8vo.,"ser.) Coleridge (Stephen, Hon.)--Letters to my grand- son on the world about him. Cr. 8vo. 7×5, pp. 124, 45. net.. MILLS & B., Oct. '21",,,,Oct. '21,1921,net
"Collected essays and reviews, James (W.) 16s. net Collected papers, Ward (A. W., Sir) 48s. net Collected papers, Ward (A. W., Sir). 63s. net; v. 5, 36s. net. Collecting, A. B. C. of, Yoxall (J., Feb. '21",,,"Collected essays and reviews, James (W.)",J.,,,"Collected essays and reviews, James (W.) 16s. net Collected papers, Ward (A. W., Sir) 48s. net Collected papers, Ward (A. W., Sir). 63s. net; v. 5, 36s. net. Collecting, A. B. C. of, Yoxall (J., Feb. '21",,,,Feb. '21,1921,
"Collins' Adventure annual: stories and articles by Robert Leighton, Charles R. Gibson, and others. Illus. Fol. 10X 71, 7s. 6d. net net Collins' Children's annual : by John Hassall, A. A. Fol. 11x8, pp. 184, bds. COLLINS, Sep. '21",,,"Collins' Adventure annual: stories and articles by Robert Leighton, Charles R. Gibson, and others",COLLINS,,,"Collins' Adventure annual: stories and articles by Robert Leighton, Charles R. Gibson, and others. Illus. Fol. 10X 71, 7s. 6d. net net Collins' Children's annual : by John Hassall, A. A. Fol. 11x8, pp. 184, bds. COLLINS, Sep. '21",,,,Sep. '21,1921,
"pictures and stories Dixon and others. 6s. net COLLINS, Sep. '21",,,Dixon and others,COLLINS,6s.,,"pictures and stories Dixon and others. 6s. net COLLINS, Sep. '21",,,,Sep. '21,1921,net
"... Colonial Office List, 1921. Compiled by Sir Wm. H. Mercer, and others. 8vo. 8×51, pp. 880, 35s. net .WATERLOW, July '21",,,Colonial Office List,WATERLOW,35s.,8vo.,"... Colonial Office List, 1921. Compiled by Sir Wm. H. Mercer, and others. 8vo. 8×51, pp. 880, 35s. net .WATERLOW, July '21",,,,July '21,1921,net
"Colonial reports, 1919-Straits Settlements, 6d. ; Ceylon, 6d.; Gibraltar, id.; Zanzibar, 2d.; Gambia, 2d.; Uganda, 2d.; Ashanti, 3d.; Seychelles, 1d.; St. Vincent, id.; Mauritius, 2d.; Nigeria, 2d.; Sierra Leone, 2d.; British Guiana, 2d.; Trinidad and Tobago, 9d.; Gold Coast, 6d.; do., 1s.; British Honduras, id.; Hong-Kong, 2d.; Kenya Colony, is. net; Falkland 1slands, 6d. ; Cayman 1slands, 3d. net.. .H.M.S.O., Jan., &c., '21",,,Colonial reports,H.M.S.O.,3d.,,"Colonial reports, 1919-Straits Settlements, 6d. ; Ceylon, 6d.; Gibraltar, id.; Zanzibar, 2d.; Gambia, 2d.; Uganda, 2d.; Ashanti, 3d.; Seychelles, Id.; St. Vincent, id.; Mauritius, 2d.; Nigeria, 2d.; Sierra Leone, 2d.; British Guiana, 2d.; Trinidad and Tobago, 9d.; Gold Coast, 6d.; do., Is.; British Honduras, id.; Hong-Kong, 2d.; Kenya Colony, is. net; Falkland Islands, 6d. ; Cayman Islands, 3d. net.. .H.M.S.O., Jan., &c., '21",,,,"Jan., &c., '21",1921,net
"Colonial reports, 1919-20-Somaliland, id.; Malta, 2d.; Swaziland, 1d.; Jamaica, 3d.; Barba- does, 8d.; Leeward 1slands, 9d.; Nyasaland, 6d. ; Uganda, 9d. ; Kenya Colony, 1s.; Gilbert and Ellice 1slands, 3d. net H.M.S.O., Jan., &c., '21",,,Colonial reports,H.M.S.O.,3d.,,"Colonial reports, 1919-20-Somaliland, id.; Malta, 2d.; Swaziland, Id.; Jamaica, 3d.; Barba- does, 8d.; Leeward Islands, 9d.; Nyasaland, 6d. ; Uganda, 9d. ; Kenya Colony, Is.; Gilbert and Ellice Islands, 3d. net H.M.S.O., Jan., &c., '21",,,,"Jan., &c., '21",1921,net
"Colonial reports, 1920-Bermuda, 9d.; Fiji, 9d. ; Grenada, 6d. ; Gibraltar, 6d.; Ceylon, 2s.; St. Helena, 6d. ; Sierra Leone, 1s.; Zanzibar, 6d. net.. ..H.M.S.O., Aug., &c., '21",,,Colonial reports,H.M.S.O.,6d.,,"Colonial reports, 1920-Bermuda, 9d.; Fiji, 9d. ; Grenada, 6d. ; Gibraltar, 6d.; Ceylon, 25.; St. Helena, 6d. ; Sierra Leone, Is.; Zanzibar, 6d. net.. ..H.M.S.O., Aug., &c., '21",,,,"Aug., &c., '21",1921,net
"1920-21-Basutoland, Protectorate, 6d. net Colonial reports, Bechuanaland Colonial Research 6d. ; H.M.S.O., Oct. '21",,,,H.M.S.O.,,,"1920-21-Basutoland, Protectorate, 6d. net Colonial reports, Bechuanaland Colonial Research 6d. ; H.M.S.O., Oct. '21",,,,Oct. '21,1921,
"Dictionary of chemical solubilities, inorganic. 2nd ed., enl. and rev. 8vo. pp. 1,129, 72s. net MACMILLAN, June '21",,,"Dictionary of chemical solubilities, inorganic",MACMILLAN,72s.,8vo.,"Dictionary of chemical solubilities, inorganic. 2nd ed., enl. and rev. 8vo. pp. 1,129, 725. net MACMILLAN, June '21",,,,June '21,1921,net
"Coming events. By a Brevet Lt.-Colonel. Rev. and enl. ed. Cr. 8vo. swd. 1s. 6d. net MORGAN & S., Mar. '21",,,Coming events,MORGAN & S.,1s. 6d.,8vo.,"Coming events. By a Brevet Lt.-Colonel. Rev. and enl. ed. Cr. 8vo. swd. Is. 6d. net MORGAN & S., Mar. '21",,,,Mar. '21,1921,net
"Common examination for entrance to public schools reprint of selected papers, 1912-1920. Cr. 8vo. 7×5, pp. 336, 5s. 6d. net WARREN & SON, Jan. '21",,,Common examination for entrance to public schools reprint of selected papers,WARREN & SON,5s. 6d.,8vo.,"Common examination for entrance to public schools reprint of selected papers, 1912-1920. Cr. 8vo. 7×5, pp. 336, 5s. 6d. net WARREN & SON, Jan. '21",,,,Jan. '21,1921,net
"Common-sense gardening: a practical up-to-date guide to garden and greenhouse. By The Average Man, assist. by various amateur and professional experts. Cr. 8vo. 7×41, pp. 128, swd. 1s. SUNDAY CHRONICLE, Jan. '21",,,Common-sense gardening: a practical up-to-date guide to garden and greenhouse,SUNDAY CHRONICLE,1s.,8vo.,"Common-sense gardening: a practical up-to-date guide to garden and greenhouse. By The Average Man, assist. by various amateur and professional experts. Cr. 8vo. 7×41, pp. 128, swd. Is. SUNDAY CHRONICLE, Jan. '21",,,,Jan. '21,1921,
"6d. net. .H.M.S.O., Nov. '21",,,,H.M.S.O.,6d.,,"6d. net. .H.M.S.O., Nov. '21",,,,Nov. '21,1921,net
"Complete hints and tips for automobilists: from the Autocar. 8th ed., rev. and amplified. Cr. 8vo. 7×5, pp. 279, 5s. net ..ILIFFE, July '21",,,Complete hints and tips for automobilists: from the Autocar,ILIFFE,5s.,8vo.,"Complete hints and tips for automobilists: from the Autocar. 8th ed., rev. and amplified. Cr. 8vo. 7×5, pp. 279, 5s. net ..ILIFFE, July '21",,,,July '21,1921,net
"Complete peerage (The) of England, Scotland, Ireland, Great Britain, and the United King- dom: extant, extinct, or dormant. By G. E. C. New ed., rev. Ed. by Mon. Vicary Gibbs and H. A. Doubleday. Vol. 5. 8x1, pp. 859, 73s. 6d. net....ST. CATHERINE PR., Oct. 21",,,"Complete peerage (The) of England, Scotland, Ireland, Great Britain, and the United King- dom: extant, extinct, or dormant",ST. CATHERINE PR.,73s. 6d.,,"Complete peerage (The) of England, Scotland, Ireland, Great Britain, and the United King- dom: extant, extinct, or dormant. By G. E. C. New ed., rev. Ed. by Mon. Vicary Gibbs and H. A. Doubleday. Vol. 5. 8x1, pp. 859, 73s. 6d. net....ST. CATHERINE PR., Oct. 21",,,,Oct. 21,1921,net
"Conciliation Act, 1896, and Industrial Courts Act, 1919-Report on conciliation and arbitra- tion. 3s. 6d. net.. .H.M.S.O., Mar. '21",,,Conciliation Act,H.M.S.O.,3s. 6d.,,"Conciliation Act, 1896, and Industrial Courts Act, 1919-Report on conciliation and arbitra- tion. 3s. 6d. net.. .H.M.S.O., Mar. '21",,,,Mar. '21,1921,net
"Concrete roads and their construction: a descrip tion of the concrete roads in the United King- dom, together with a summary of experience in Australia, Canada, New Zealand, and the U.S.A. 8×54, pp. 197, 8s. net CONCRETE PUBLICATIONS, Feb '21",,,"Concrete roads and their construction: a descrip tion of the concrete roads in the United King- dom, together with a summary of experience in Australia, Canada, New Zealand, and the U.S.A. 8",CONCRETE PUBLICATIONS,8s.,,"Concrete roads and their construction: a descrip tion of the concrete roads in the United King- dom, together with a summary of experience in Australia, Canada, New Zealand, and the U.S.A. 8×54, pp. 197, 8s. net CONCRETE PUBLICATIONS, Feb '21",,,,Feb '21,1921,net
"Conference of Prime Ministers and representatives of the U.K., the Dominions and India, June-- August, 1921. Summary of proceedings and documents. 9d.net .H.M.S.O., Aug 21",,,"Conference of Prime Ministers and representatives of the U.K., the Dominions and India, June-- August",H.M.S.O.,9d.,,"Conference of Prime Ministers and representatives of the U.K., the Dominions and India, June-- August, 1921. Summary of proceedings and documents. 9d.net .H.M.S.O., Aug 21",,,,Aug 21,1921,net
"Congregational year book, 1921. 8vo. 81×51, pp. 489, 6s. net CONGREGATIONAL UNION, Mar. '21",,,Congregational year book,CONGREGATIONAL UNION,6s.,8vo.,"Congregational year book, 1921. 8vo. 81×51, pp. 489, 6s. net CONGREGATIONAL UNION, Mar. '21",,,,Mar. '21,1921,net
"Conjugation of French verbs, regular and irregular. Cr. 8vo. 7 X 44, pp. 48, swd. 6d. net (Hossfeld's Educ. ser.) HIRSCHFELD, Apr. '21",,,"Conjugation of French verbs, regular and irregular",HIRSCHFELD,6d.,8vo.,"Conjugation of French verbs, regular and irregular. Cr. 8vo. 7 X 44, pp. 48, swd. 6d. net (Hossfeld's Educ. ser.) HIRSCHFELD, Apr. '21",,,,Apr. '21,1921,net
"2d. net .H.M.S.O., Feb. '21",,,,H.M.S.O.,2d.,,"2d. net .H.M.S.O., Feb. '21",,,,Feb. '21,1921,net
"Constitution and canons of the Diocese of British Honduras. 8vo. swd. 2s. 6d. net S.P.C.K., Dec. '21",,,Constitution and canons of the Diocese of British Honduras,S.P.C.K.,2s. 6d.,8vo.,"Constitution and canons of the Diocese of British Honduras. 8vo. swd. 2s. 6d. net S.P.C.K., Dec. '21",,,,Dec. '21,1921,net
"Constructive work of Dail Eireann. No. 1, The National Police and Courts of Justice; No. 2 (1), Dept. of Agriculture and Land Settlement Commission; (2), Commission of Inquiry into the Resources and Industry of Ireland; (3), Dept. of Trade and Commerce. (4 pts.) ea. about 32 pp. 8s. Ea. swd. 6d. net (Dublin) TALBOT PR., Dec. '21",,,Constructive work of Dail Eireann,TALBOT PR.,6d.,,"Constructive work of Dail Eireann. No. 1, The National Police and Courts of Justice; No. 2 (1), Dept. of Agriculture and Land Settlement Commission; (2), Commission of Inquiry into the Resources and Industry of Ireland; (3), Dept. of Trade and Commerce. (4 pts.) ea. about 32 pp. 85. Ea. swd. 6d. net (Dublin) TALBOT PR., Dec. '21",,,,Dec. '21,1921,net
"Conway, Llanfairfechan, Penmaenmawr, Bangor, Carnarvon and Snowdon. Maps and illus, Edit. by Ralph Darlington. 18mo. 61× 41, pp. 142, limp 1s. (Darlington's handbooks) DARLINGTON, Dec. '21",,,"Conway, Llanfairfechan, Penmaenmawr, Bangor, Carnarvon and Snowdon",DARLINGTON,1s.,18mo.,"Conway, Llanfairfechan, Penmaenmawr, Bangor, Carnarvon and Snowdon. Maps and illus, Edit. by Ralph Darlington. 18mo. 61× 41, pp. 142, limp Is. (Darlington's handbooks) DARLINGTON, Dec. '21",,,,Dec. '21,1921,
"320, 7s. 6d. net. Coolidge (Susan)-What Katy did. Cr. 8vo. 7 × 41, pp. 219, 2s. net (Royal ser.) WARD, LOCK, May '21",,,,"WARD, LOCK",2s.,8vo.,"320, 7s. 6d. net. Coolidge (Susan)-What Katy did. Cr. 8vo. 7 × 41, pp. 219, 2s. net (Royal ser.) WARD, LOCK, May '21",,,,May '21,1921,net
"Katy did. Cr. 8vo. (Haversack lib.) Coolidge (Susan)-What 7X4, pp. 223, 2s. net. NISBET, Oct. '21",,,Katy did,NISBET,2s.,8vo.,"Katy did. Cr. 8vo. (Haversack lib.) Coolidge (Susan)-What 7X4, pp. 223, 2s. net. NISBET, Oct. '21",,,,Oct. '21,1921,net
"Co-operative Union, Ltd.-The 52nd Annual Co-operative Congress, Clifton, Bristol, May, 1920. Edit. by A. Whitehead. 8x6, pp. 864 (Manchester) CO-OPERATIVE UNION, Feb. '21",,,"Co-operative Union, Ltd",CO-OPERATIVE UNION,,,"Co-operative Union, Ltd.-The 52nd Annual Co-operative Congress, Clifton, Bristol, May, 1920. Edit. by A. Whitehead. 8x6, pp. 864 (Manchester) CO-OPERATIVE UNION, Feb. '21",,,,Feb. '21,1921,
"Co-operative Union, Ltd.-The 53rd Annual Co- operative Congress, Scarborough, 1921. Edit. by A. Whitehead. 8×5, pp. 820 (Manchester) CO-OPERATIVE UNION, Sep. '21",,,"Co-operative Union, Ltd",CO-OPERATIVE UNION,,,"Co-operative Union, Ltd.-The 53rd Annual Co- operative Congress, Scarborough, 1921. Edit. by A. Whitehead. 8×5, pp. 820 (Manchester) CO-OPERATIVE UNION, Sep. '21",,,,Sep. '21,1921,
"Treasure of Heaven : a Cr. 8vo. 7×5, pp. 564, CONSTABLE, July '21' net Corelli (Marie)-The romance of riches. 4s. 6d. net... Corelli (Marie)-Wormwood: a drama of Paris 23rd ed. Cr. 8vo. 7 × 5, pp. 451, 4s. 6d. net METHUEN, Apr. '21",,,Treasure of Heaven : a,METHUEN,4s. 6d.,8vo.,"Treasure of Heaven : a Cr. 8vo. 7×5, pp. 564, CONSTABLE, July '21' net Corelli (Marie)-The romance of riches. 45. 6d. net... Corelli (Marie)-Wormwood: a drama of Paris 23rd ed. Cr. 8vo. 7 × 5, pp. 451, 4s. 6d. net METHUEN, Apr. '21",,,,Apr. '21,1921,net
"Corrigé des thèmes, Topham (J.) 9d. net Corthis (André)-For me alone (Pour moi seule): a novel. Trans. from the French by F. T. Cooper. Cr. 8vo. 7× 5, pp. 267, 7s. 6d. net ALLEN & U., Oct. '21",,,"Corrigé des thèmes, Topham (J.)",ALLEN & U.,7s. 6d.,8vo.,"Corrigé des thèmes, Topham (J.) 9d. net Corthis (André)-For me alone (Pour moi seule): a novel. Trans. from the French by F. T. Cooper. Cr. 8vo. 7× 5, pp. 267, 7s. 6d. net ALLEN & U., Oct. '21",,,,Oct. '21,1921,net
"Cosmic anatomy, and the structure of the ego. By M.B., Oxon. Cr. 8vo. 7×51, pp. 280, (s. 6d. net.. WATKINS, Dec. '21",,,"Cosmic anatomy, and the structure of the ego",WATKINS,6d.,8vo.,"Cosmic anatomy, and the structure of the ego. By M.B., Oxon. Cr. 8vo. 7×51, pp. 280, (s. 6d. net.. WATKINS, Dec. '21",,,,Dec. '21,1921,net
"Cotton-Fencing and safety precautions for cotton spinning and weaving machinery. Part 3, Cotton weaving and subsidiary processes. s. net .H.M.S.O., July '21",,,Cotton-Fencing and safety precautions for cotton spinning and weaving machinery,H.M.S.O.,,,"Cotton-Fencing and safety precautions for cotton spinning and weaving machinery. Part 3, Cotton weaving and subsidiary processes. IS. net .H.M.S.O., July '21",,,,July '21,1921,
"County cookery book. 8vo. 81×51, pp. 72, swd. 6d. .SIMPKIN, July '21",,,County cookery book,SIMPKIN,6d.,8vo.,"County cookery book. 8vo. 81×51, pp. 72, swd. 6d. .SIMPKIN, July '21",,,,July '21,1921,
"Courtis Standard practice tests for hand-writing. Cr. 8vo. Packet, 5s. net ..HARRAP, May '21",,,Courtis Standard practice tests for hand-writing,HARRAP,5s.,8vo.,"Courtis Standard practice tests for hand-writing. Cr. 8vo. Packet, 5s. net ..HARRAP, May '21",,,,May '21,1921,net
"Cracknell (A. G.)-The School algebra. (Matricu- lation ed.) 2nd ed., 6th impr., cr. 8vo. pp. 464; with answers, cr. 8vo. pp. 532; ea. 6s. 6d. UNIV. TUTORIAL PR., Dec. '21",,,,UNIV. TUTORIAL PR.,6s. 6d.,8vo.,"Cracknell (A. G.)-The School algebra. (Matricu- lation ed.) 2nd ed., 6th impr., cr. 8vo. pp. 464; with answers, cr. 8vo. pp. 532; ea. 6s. 6d. UNIV. TUTORIAL PR., Dec. '21",,['Cracknell (A. G.)-The School algebra. (Matricu- lation ed.)'],,Dec. '21,1921,
"Cranks, 1921: an anthology compiled by Obert, Sebert and Ethelberta Standstill. 8vo. pp. 26, 1s. 6d. net ..STOCKWELL, July '21",,,Cranks,STOCKWELL,1s. 6d.,8vo.,"Cranks, 1921: an anthology compiled by Obert, Sebert and Ethelberta Standstill. 8vo. pp. 26, Is. 6d. net ..STOCKWELL, July '21",,,,July '21,1921,net
"Crash in the Cabinet (A). By  Pagan.' Cr. 8vo. 7×5, pp. 295, 5s. net....PUTNAMS, July '21",,,Crash in the Cabinet (A),PUTNAMS,5s.,8vo.,"Crash in the Cabinet (A). By  Pagan.' Cr. 8vo. 7×5, pp. 295, 5s. net....PUTNAMS, July '21",,,,July '21,1921,net
"Credit-power and democracy, Douglas (C. H.) 7s. 6d. net ..June'zi Cree (A.)-All about oil for engineers. 2nd ed. Cr. 8vo. gs. net .SPON, Feb. '21",,,"Credit-power and democracy, Douglas (C. H.)",SPON,,8vo.,"Credit-power and democracy, Douglas (C. H.) 7s. 6d. net ..June'zi Cree (A.)-All about oil for engineers. 2nd ed. Cr. 8vo. gs. net .SPON, Feb. '21",,,,Feb. '21,1921,
"Crew's Company law. 2nd ed. 8vo. 7s. 6d. net BUTTERWORTH, Feb. '21",,,Crew's Company law,BUTTERWORTH,7s. 6d.,8vo.,"Crew's Company law. 2nd ed. 8vo. 7s. 6d. net BUTTERWORTH, Feb. '21",,,,Feb. '21,1921,net
"Cricketer winter annual, 1921-2. Edit. by P. F. Warner. Fol. 111×82, pp. 132, swd. 2s. 6d. net CRICKETER SYNDICATE, Dec. '21",,,Cricketer winter annual,CRICKETER SYNDICATE,2s. 6d.,,"Cricketer winter annual, 1921-2. Edit. by P. F. Warner. Fol. 111×82, pp. 132, swd. 2s. 6d. net CRICKETER SYNDICATE, Dec. '21",,,,Dec. '21,1921,net
"MILFORD, Mar. '21",,,,MILFORD,,,"MILFORD, Mar. '21",,,,Mar. '21,1921,
"Crockford's Clerical directory, 1921-22. (With which is incorporated the Clergy list.) With supplement. Ryl. 8vo. 10 x64, pp. 2,290, 42s. net. MILFORD, Dec. '21",,,Crockford's Clerical directory,MILFORD,42s.,8vo.,"Crockford's Clerical directory, 1921-22. (With which is incorporated the Clergy list.) With supplement. Ryl. 8vo. 10 x64, pp. 2,290, 42s. net. MILFORD, Dec. '21",,,,Dec. '21,1921,net
"Cronshaw (H. B.)-Silver ores. (Imperial Insti- tute Monographs on mineral resources, with special reference to the British Empire.) 8vo. 8×51, pp. 160, swd. 6s. net MURRAY, Oct. '21",,,,MURRAY,6s.,,"Cronshaw (H. B.)-Silver ores. (Imperial Insti- tute Monographs on mineral resources, with special reference to the British Empire.) 8vo. 8×51, pp. 160, swd. 6s. net MURRAY, Oct. '21",,"['Cronshaw (H. B.)-Silver ores. (Imperial Insti- tute Monographs on mineral resources, with special reference to the British Empire.)']",,Oct. '21,1921,net
"and others. 8vo. 8×5, pp. 95, 5s. net '21 Crystals, Study of, in schools, Barker (T. V.) 1s. net J. BROWN, Dec. '21",,,8vo,J. BROWN,1s.,8vo.,"and others. 8vo. 8×5, pp. 95, 5s. net '21 Crystals, Study of, in schools, Barker (T. V.) 15. net J. BROWN, Dec. '21",,,,Dec. '21,1921,net
"LAURIE, June '21",,,,LAURIE,,,"LAURIE, June '21",,,,June '21,1921,
"HARRAP, Jan. '21",,,,HARRAP,,,"HARRAP, Jan. '21",,,,Jan. '21,1921,
"HODDER & S., June '21",,,,HODDER & S.,,,"HODDER & S., June '21",,,,June '21,1921,
"tain tragedy. Cheap ed. Cr. 8vo. 7×4, pp. 260, 2s. 6d. net ....CHAPMAN & H., Nov. '21",,,Cheap ed,CHAPMAN & H.,2s. 6d.,8vo.,"tain tragedy. Cheap ed. Cr. 8vo. 7×4, pp. 260, 2s. 6d. net ....CHAPMAN & H., Nov. '21",,,,Nov. '21,1921,net
