entry,last_name,first_name,title,publisher,price,format,original_entry,author_name,creators,is_editor,date,catalogue_year,is_net
"John Rylands Library, Manchester: a brief record of 21 years' work, 1900-1921. Illus. 10×6, pp. 72, s. net net MANCHESTER UNIV. PR.; LONGMANS, Oct. '21",,,"John Rylands Library, Manchester: a brief record of",LONGMANS,,,"John Rylands Library, Manchester: a brief record of 21 years' work, 1900-1921. Illus. 10×6, pp. 72, IS. net net MANCHESTER UNIV. PR.; LONGMANS, Oct. '21",,,,Oct. '21,1921,
"John Sagur. By Nedram. Cr. 8vo. 7×5, pp. 272, 7s. 6d. net HEATH, CRANTON, Apr. '21",,,John Sagur,"HEATH, CRANTON",7s. 6d.,8vo.,"John Sagur. By Nedram. Cr. 8vo. 7×5, pp. 272, 7s. 6d. net HEATH, CRANTON, Apr. '21",,,,Apr. '21,1921,net
"pp. 14, 2s. net 8vo. Johnstone (James)-Mechanism of life. pp. 248, 15s. net ......E. ARNOLD, Sep. '21",,,14,E. ARNOLD,15s.,8vo.,"pp. 14, 2s. net 8vo. Johnstone (James)-Mechanism of life. pp. 248, 15s. net ......E. ARNOLD, Sep. '21",,,,Sep. '21,1921,net
"Jolly book (The). Edit. by Edwin Chisholm. Ryl. 8vo. io×74, pp. 287, 5s. net NELSON, Sep. '21",,,Jolly book (The),NELSON,5s.,8vo.,"Jolly book (The). Edit. by Edwin Chisholm. Ryl. 8vo. io×74, pp. 287, 5s. net NELSON, Sep. '21",,,,Sep. '21,1921,net
"SIMPKIN, July '21",,,,SIMPKIN,,,"SIMPKIN, July '21",,,,July '21,1921,
"Jolly old sports. Illus. by Frank Adams. Folio, bds. 6s. net.. .BLACKIE, Sep. '21",,,Jolly old sports,BLACKIE,6s.,,"Jolly old sports. Illus. by Frank Adams. Folio, bds. 6s. net.. .BLACKIE, Sep. '21",,,,Sep. '21,1921,net
"Jumble book of tales and rhymes (The). Nos. 1 & 2. Ryl. 8vo. 10×81, ea. 1s. 3d. net. (Shakespeare ser.) .ALLDAY, Oct. '21",,,Jumble book of tales and rhymes (The),ALLDAY,,8vo.,"Jumble book of tales and rhymes (The). Nos. 1 & 2. Ryl. 8vo. 10×81, ea. Is. 3d. net. (Shakespeare ser.) .ALLDAY, Oct. '21",,,,Oct. '21,1921,
"Junior lessons and international course (The), 1922. By G. Blumer and others. Cr. 8vo. 71×4, pp. 192, swd. 3s. 6d. net PILGRIM PR., Nov. '21",,,Junior lessons and international course (The),PILGRIM PR.,3s. 6d.,8vo.,"Junior lessons and international course (The), 1922. By G. Blumer and others. Cr. 8vo. 71×4, pp. 192, swd. 3s. 6d. net PILGRIM PR., Nov. '21",,,,Nov. '21,1921,net
"Jutsum's Commercial code of signal cards: for self-instruction. 32mo. (box.) 41×2, 3s. 6d. net J. BROWN, May '21",,,Jutsum's Commercial code of signal cards: for self-instruction,J. BROWN,3s. 6d.,32mo.,"Jutsum's Commercial code of signal cards: for self-instruction. 32mo. (box.) 41×2, 3s. 6d. net J. BROWN, May '21",,,,May '21,1921,net
"Kalendar of Hymns ancient and modern and the English hymnal, 1922. 18mo. swd. 6d. MILFORD, Dec. '21",,,Kalendar of Hymns ancient and modern and the English hymnal,MILFORD,6d.,18mo.,"Kalendar of Hymns ancient and modern and the English hymnal, 1922. 18mo. swd. 6d. MILFORD, Dec. '21",,,,Dec. '21,1921,
"Karen-Ha-Yesod book: colonisation problems of the Eretz-1srael (Palestine) Foundation Fund. Cr. 8vo. swd. 2s. net........PARSONS, May '21",,,Karen-Ha-Yesod book: colonisation problems of the Eretz,PARSONS,2s.,8vo.,"Karen-Ha-Yesod book: colonisation problems of the Eretz-Israel (Palestine) Foundation Fund. Cr. 8vo. swd. 2s. net........PARSONS, May '21",,,,May '21,1921,net
"Keats House Committee, Hampstead-The John Keats memorial volume. Illus. Folio, 10×71, pp. 296, 25s. net .LANE, Feb. '21",,,"Keats House Committee, Hampstead-The John Keats memorial volume",LANE,25s.,,"Keats House Committee, Hampstead-The John Keats memorial volume. Illus. Folio, 10×71, pp. 296, 25s. net .LANE, Feb. '21",,,,Feb. '21,1921,net
"Kelly's Draftsman: a collection of concise forms and precedents in conveyancing, with practical notes. 6th ed., by S. B. Scott. 8 x 51, pp. 759, 25s.net...... BUTTERWORTH, Nov. '21",,,"Kelly's Draftsman: a collection of concise forms and precedents in conveyancing, with practical notes",BUTTERWORTH,25s.,,"Kelly's Draftsman: a collection of concise forms and precedents in conveyancing, with practical notes. 6th ed., by S. B. Scott. 8 x 51, pp. 759, 25s.net...... BUTTERWORTH, Nov. '21",,,,Nov. '21,1921,net
"Kelly's Handbook to the titled, landed and official classes, 1921. Cr. 8vo. 74 × 54, pp. 1,834, 30s. net KELLY'S DIRECTORIES, Feb. '21",,,"Kelly's Handbook to the titled, landed and official classes",KELLY'S DIRECTORIES,30s.,8vo.,"Kelly's Handbook to the titled, landed and official classes, 1921. Cr. 8vo. 74 × 54, pp. 1,834, 30s. net KELLY'S DIRECTORIES, Feb. '21",,,,Feb. '21,1921,net
"Kelly's Handbook to the titled, landed, and official classes, 1922. Cr. 8vo. 7×6, pp. 1,860, 30s. net .... KELLY'S DIRECTORIES, Dec. '21",,,"Kelly's Handbook to the titled, landed, and official classes",KELLY'S DIRECTORIES,30s.,8vo.,"Kelly's Handbook to the titled, landed, and official classes, 1922. Cr. 8vo. 7×6, pp. 1,860, 30s. net .... KELLY'S DIRECTORIES, Dec. '21",,,,Dec. '21,1921,net
"Kenya Colony and Protectorate-Despatch relat- ing to native labour. 1d...H.M.S.O., Sep. '21",,,Kenya Colony and Protectorate-Despatch relat- ing to native labour,H.M.S.O.,1d.,,"Kenya Colony and Protectorate-Despatch relat- ing to native labour. Id...H.M.S.O., Sep. '21",,,,Sep. '21,1921,
"Kephart (Horace)-Camping and woodcraft. (2 vols. in 1.) Cr. 8vo. 16s. net. (Rural text book ser.) .MACMILLAN, Apr. '21",,,,MACMILLAN,,8vo.,"Kephart (Horace)-Camping and woodcraft. (2 vols. in 1.) Cr. 8vo. 16s. net. (Rural text book ser.) .MACMILLAN, Apr. '21",,"['Kephart (Horace)-Camping', 'woodcraft. (2 vols. in 1.)']",,Apr. '21,1921,
"Keridon. See Thomas (J. C.). Kernahan (Coulson)—Visions, old and new. 18mo. 6×4, pp. 240, 5s. net HODDER & S., Sep. '21",,,"Visions, old and new",HODDER & S.,5s.,18mo.,"Keridon. See Thomas (J. C.). Kernahan (Coulson)—Visions, old and new. 18mo. 6×4, pp. 240, 5s. net HODDER & S., Sep. '21",,['Keridon. See Thomas (J. C.). Kernahan (Coulson)'],,Sep. '21,1921,net
"CAMB. UNIV. PR., Mar. '21",,,,CAMB. UNIV. PR.,,,"CAMB. UNIV. PR., Mar. '21",,,,Mar. '21,1921,
"Kew Gardens-Bulletin of miscellaneous informa- tion. ca. pt. from 7d. to 1s. net H.M.S.O., Jan., &c., '21",,,Kew Gardens-Bulletin of miscellaneous informa- tion,H.M.S.O.,1s.,,"Kew Gardens-Bulletin of miscellaneous informa- tion. ca. pt. from 7d. to Is. net H.M.S.O., Jan., &c., '21",,,,"Jan., &c., '21",1921,net
"Kew Gardens-Bulletin of miscellaneous informa- tion. Index to vols for 1887-1918, 7s. 6d. net H.M.S.O., Jan. '21",,,Kew Gardens-Bulletin of miscellaneous informa- tion,H.M.S.O.,7s. 6d.,,"Kew Gardens-Bulletin of miscellaneous informa- tion. Index to vols for 1887-1918, 7s. 6d. net H.M.S.O., Jan. '21",,,,Jan. '21,1921,net
"Kew Gardens-Index Kewensis : plantarum phanerogamarum. Suppl. 1-5 (in one vol.), 252s. net; 4to. Suppl. 5, 76s. net Key (A. Cooper-) see Cooper-Key. Key (Uel)-Yellow death: a tale of occult mysteries. Cr. 8vo. 7 × 5, pp. 299, 7s. 6d. net BOOKS, LTD., Apr. '21",,,Kew Gardens-Index Kewensis : plantarum phanerogamarum,"BOOKS, LTD.",7s. 6d.,4to.,"Kew Gardens-Index Kewensis : plantarum phanerogamarum. Suppl. 1-5 (in one vol.), 2525. net; 4to. Suppl. 5, 76s. net Key (A. Cooper-) see Cooper-Key. Key (Uel)-Yellow death: a tale of occult mysteries. Cr. 8vo. 7 × 5, pp. 299, 7s. 6d. net BOOKS, LTD., Apr. '21",,,,Apr. '21,1921,net
"Kiddies' annual (The). Illus. Ryl. 8vo. 10X 71, 4s. net .EPWORTH PR., Aug. '21",,,Kiddies' annual (The),EPWORTH PR.,4s.,8vo.,"Kiddies' annual (The). Illus. Ryl. 8vo. 10X 71, 4s. net .EPWORTH PR., Aug. '21",,,,Aug. '21,1921,net
"Kinema operator's handbk., Ibbetson 4s. 6d. net. Kinematograph Manufacturers (Incorp. Assoc. of) -Standard measurements. 94×6, pp. 21, swd. 6d. net (167, Wardour St., W. 1) OFFICE, Mar. '21",,,Kinema operator's handbk,OFFICE,6d.,,"Kinema operator's handbk., Ibbetson 4s. 6d. net. Kinematograph Manufacturers (Incorp. Assoc. of) -Standard measurements. 94×6, pp. 21, swd. 6d. net (167, Wardour St., W. 1) OFFICE, Mar. '21",,,,Mar. '21,1921,net
"Kingsley (Charles)-Westward Ho! (Abridged) Ed. with intro. and notes by Sterling A. Leonard. 18mo. 2s. 6d. net MACMILLAN, July '21",,,Ed,MACMILLAN,2s. 6d.,18mo.,"Kingsley (Charles)-Westward Ho! (Abridged) Ed. with intro. and notes by Sterling A. Leonard. 18mo. 2s. 6d. net MACMILLAN, July '21",,['Kingsley (Charles)-Westward Ho! (Abridged)'],,July '21,1921,net
"NAT. HOME READING UNION, Sep. '21",,,,NAT. HOME READING UNION,,,"NAT. HOME READING UNION, Sep. '21",,,,Sep. '21,1921,
"Koran (The). Trans. into English from the original Arabic by George Sale. With explanatory notes from the most approved commentators, and Sale's Preliminary discourse. Intro. by Sir Edward Denison Ross. 8vo. 84×5, pp. 624. With Preliminary discourse, 10s. 6d. net; without preliminary discourse, 7s. 6d. net F. WARNE, May 21",,,Koran (The),F. WARNE,7s. 6d.,8vo.,"Koran (The). Trans. into English from the original Arabic by George Sale. With explanatory notes from the most approved commentators, and Sale's Preliminary discourse. Intro. by Sir Edward Denison Ross. 8vo. 84×5, pp. 624. With Preliminary discourse, 10s. 6d. net; without preliminary discourse, 7s. 6d. net F. WARNE, May 21",,,,May 21,1921,net
"Kumarapala Pratibodha of Somaprabhacharza. Ed. by Muniraja Jinavijaya. 8vo. pp. 478, bds. 16s. (Gaekwad Oriental ser., 14) LUZAC, Mar. '21",,,Kumarapala Pratibodha of Somaprabhacharza,LUZAC,16s.,8vo.,"Kumarapala Pratibodha of Somaprabhacharza. Ed. by Muniraja Jinavijaya. 8vo. pp. 478, bds. 16s. (Gaekwad Oriental ser., 14) LUZAC, Mar. '21",,,,Mar. '21,1921,
"Labour international handbook (The). Ed. by R. Palme Dutt. Cr. 8vo. 7×5, pp. 330, 12s. 6d. LABOUR PUBG. Co.; ALLEN & U., May '21",,,Labour international handbook (The),ALLEN & U.,,8vo.,"Labour international handbook (The). Ed. by R. Palme Dutt. Cr. 8vo. 7×5, pp. 330, 12s. 6d. LABOUR PUBG. Co.; ALLEN & U., May '21",,,,May '21,1921,
"Labour (Ministry of)-Gazette. (Monthly.) Ea. 6d. net... ..H.M.S.O., Jan., &c., '21",,,Ea,H.M.S.O.,6d.,,"Labour (Ministry of)-Gazette. (Monthly.) Ea. 6d. net... ..H.M.S.O., Jan., &c., '21",,['Labour (Ministry of)-Gazette. (Monthly.)'],,"Jan., &c., '21",1921,net
"Labour Monthly (The): a magazine of inter- national labour. Vol. 1, no. 1, July, 1921. 9 × 6, 1s. net..LABOUR PUBG CO., July '21",,,Labour Monthly (The): a magazine of inter- national labour,LABOUR PUBG CO.,1s.,,"Labour Monthly (The): a magazine of inter- national labour. Vol. 1, no. 1, July, 1921. 9 × 6, Is. net..LABOUR PUBG CO., July '21",,,,July '21,1921,net
"3×2, lthr. 2s. net. ..L. B. HILL, Nov. '21",,,"3×2, lthr",L. B. HILL,2s.,,"3×2, lthr. 2s. net. ..L. B. HILL, Nov. '21",,,,Nov. '21,1921,net
"La Fontaine et l'amour. (Collection bijou) Lagerlöf (Selma)-Thy Soul shall bear witness! Trans. from the Swedish by William Frederick Harvey. Cr. 8vo. 7×5, pp. 190, 2s. net ODHAMS PR., Nov. '21",,,La Fontaine et l'amour,ODHAMS PR.,2s.,8vo.,"La Fontaine et l'amour. (Collection bijou) Lagerlöf (Selma)-Thy Soul shall bear witness! Trans. from the Swedish by William Frederick Harvey. Cr. 8vo. 7×5, pp. 190, 2s. net ODHAMS PR., Nov. '21",,,,Nov. '21,1921,net
"MACMILLAN, Nov. '21",,,,MACMILLAN,,,"MACMILLAN, Nov. '21",,,,Nov. '21,1921,
"APPLETON, Dec. '21",,,,APPLETON,,,"APPLETON, Dec. '21",,,,Dec. '21,1921,
"Lambeth diary, 1922. 41×2, pp. 30, swd. 4d. Soc. OF SS. PETER AND PAUL, Nov. '21",,,Lambeth diary,OF SS. PETER AND PAUL,,,"Lambeth diary, 1922. 41×2, pp. 30, swd. 4d. Soc. OF SS. PETER AND PAUL, Nov. '21",,,,Nov. '21,1921,
"Lambeth encyclical (The), and other proposals considered. (Scottish Church Society Confer- ences, 1920.) 8vo. 8×51, pp. 32, swd. 1s. A. ELLIOT, Apr. '21",,,"Lambeth encyclical (The), and other proposals considered",A. ELLIOT,1s.,8vo.,"Lambeth encyclical (The), and other proposals considered. (Scottish Church Society Confer- ences, 1920.) 8vo. 8×51, pp. 32, swd. Is. A. ELLIOT, Apr. '21",,,,Apr. '21,1921,
"net net Landreth (James'—A Grampian diary. Ryl. 8vo. 91×61, pp. 113, 6s. net A. GARDNER, Oct. '21",,,Landreth (James'—A Grampian diary,A. GARDNER,6s.,8vo.,"net net Landreth (James'—A Grampian diary. Ryl. 8vo. 91×61, pp. 113, 6s. net A. GARDNER, Oct. '21",,,,Oct. '21,1921,net
"Language of flowers. Illus. by Kate Greenaway. Cr. 8vo. 6×4, pp. 80. 2s. 6d. net WARNE, July '21",,,Language of flowers,WARNE,2s. 6d.,8vo.,"Language of flowers. Illus. by Kate Greenaway. Cr. 8vo. 6×4, pp. 80. 2s. 6d. net WARNE, July '21",,,,July '21,1921,net
"Language training. Illus. Book 7. Cr. 8vo. 71×41, pp. 96, 1s. net (S. & S. ser.) SCHOFIELD & SIMS, May '21",,,Language training,SCHOFIELD & SIMS,1s.,8vo.,"Language training. Illus. Book 7. Cr. 8vo. 71×41, pp. 96, Is. net (S. & S. ser.) SCHOFIELD & SIMS, May '21",,,,May '21,1921,net
"Later exploits of Nick Carter, detective (The). Cheap ed. 8vo. 84×51, pp. 122, swd. 1s. net PEARSON, Nov. '21",,,"Later exploits of Nick Carter, detective (The)",PEARSON,1s.,8vo.,"Later exploits of Nick Carter, detective (The). Cheap ed. 8vo. 84×51, pp. 122, swd. Is. net PEARSON, Nov. '21",,,,Nov. '21,1921,net
"La Tour du Pin (Marquise de)-Recollections of the Revolution and the Empire: from the French of the Journal d'une femme de Cinquante ans. Edit. and trans. by Walter Geer. Ryl. 8vo. 9×6, pp. 444, 30s. net......J. CAPE, Dec. '21",,,La Tour du Pin (Marquise de)-Recollections of the Revolution and the Empire: from the French of the Journal d'une femme de Cinquante ans,J. CAPE,30s.,8vo.,"La Tour du Pin (Marquise de)-Recollections of the Revolution and the Empire: from the French of the Journal d'une femme de Cinquante ans. Edit. and trans. by Walter Geer. Ryl. 8vo. 9×6, pp. 444, 30s. net......J. CAPE, Dec. '21",,,,Dec. '21,1921,net
"Laughter lover's vade-mecum (The). 18mo. 6 × 31, pp. 198, 2s. 6d. net... .S. PAUL, Feb. '21",,,Laughter lover's vade-mecum (The),S. PAUL,2s. 6d.,18mo.,"Laughter lover's vade-mecum (The). 18mo. 6 × 31, pp. 198, 2s. 6d. net... .S. PAUL, Feb. '21",,,,Feb. '21,1921,net
"Law list, 1921. Compiled by Henry Birtles. Cr. 8vo. 7 X 41, pp. 666, 12s. 6d. net STEVENS, Apr. '21",,,Law list,STEVENS,12s. 6d.,8vo.,"Law list, 1921. Compiled by Henry Birtles. Cr. 8vo. 7 X 41, pp. 666, 12s. 6d. net STEVENS, Apr. '21",,,,Apr. '21,1921,net
"Lawn tennis: the Field ' pocket score book for club matches. 18mo. 5×4), swd. 1s. net. FIELD PR., May '21",,,Lawn tennis: the Field ' pocket score book for club matches,FIELD PR.,1s.,18mo.,"Lawn tennis: the Field ' pocket score book for club matches. 18mo. 5×4), swd. Is. net. FIELD PR., May '21",,,,May '21,1921,net
" Lawrence (C. E.)-The Iron bell. Cr. 8vo. 7×5, pp. 319, 8s. 6d. net......O'CONNOR, Apr. '21",,,Lawrence (C. E.)-The Iron bell,O'CONNOR,8s. 6d.,8vo.," Lawrence (C. E.)-The Iron bell. Cr. 8vo. 7×5, pp. 319, 8s. 6d. net......O'CONNOR, Apr. '21",,,,Apr. '21,1921,net
"Lawyer's Remembrancer and pocket book (The). By Arthur Powell. Rev. and ed. for the year 1922 by J. R. McIlraith. 6×4, pp. 207, 5s. net BUTTERWORTH, Nov. '21",,,Lawyer's Remembrancer and pocket book (The),BUTTERWORTH,5s.,,"Lawyer's Remembrancer and pocket book (The). By Arthur Powell. Rev. and ed. for the year 1922 by J. R. McIlraith. 6×4, pp. 207, 5s. net BUTTERWORTH, Nov. '21",,,,Nov. '21,1921,net
"Lead poisoning, industrial: memorandum, 3d. net H.M.S.O., Feb. '21",,,"Lead poisoning, industrial: memorandum",H.M.S.O.,3d.,,"Lead poisoning, industrial: memorandum, 3d. net H.M.S.O., Feb. '21",,,,Feb. '21,1921,net
"Leaders of the blind, Bannerman (A., Sir) 6s. net Νου. '21",,,,A.,,,"Leaders of the blind, Bannerman (A., Sir) 6s. net Νου. '21",,,,Sir) 6s. net Νου. '21,1921,
"....... .......... Leading Strings. Ryl. 8vo. 9 × 71, pp. 96, 2s. 6d. net .GARDNER, DARTON, Oct. '21",,,Leading Strings,"GARDNER, DARTON",2s. 6d.,8vo.,"....... .......... Leading Strings. Ryl. 8vo. 9 × 71, pp. 96, 2s. 6d. net .GARDNER, DARTON, Oct. '21",,,,Oct. '21,1921,net
"League of Nations-Documents [in French and English] concerning the action taken by the Council of the League of Nations under Article 14 of the Covenant and the Adoption by the Assembly of the Statute of the Permanent Court. 12x81, pp. 284, 65s. net CONSTABLE, Sep. '21",,,League of Nations-Documents [in French and English] concerning the action taken by the Council of the League of Nations under Article,CONSTABLE,65s.,,"League of Nations-Documents [in French and English] concerning the action taken by the Council of the League of Nations under Article 14 of the Covenant and the Adoption by the Assembly of the Statute of the Permanent Court. 12x81, pp. 284, 65s. net CONSTABLE, Sep. '21",,,,Sep. '21,1921,net
"League of Nations-Report by the Secretary- General to the First Assembly of the League on the work of the Council, 3d. net H.M.S.O., Jan., '21",,,League of Nations-Report by the Secretary- General to the First Assembly of the League on the work of the Council,H.M.S.O.,3d.,,"League of Nations-Report by the Secretary- General to the First Assembly of the League on the work of the Council, 3d. net H.M.S.O., Jan., '21",,,,"Jan., '21",1921,net
"League of Nations-Speech to the Imperial Con- ference of the Lord President of the Council on the League of Nations, id. ....... H.M.S.O., Aug. '21",,,"League of Nations-Speech to the Imperial Con- ference of the Lord President of the Council on the League of Nations, id. ",H.M.S.O.,,,"League of Nations-Speech to the Imperial Con- ference of the Lord President of the Council on the League of Nations, id. ....... H.M.S.O., Aug. '21",,,,Aug. '21,1921,
"League of Nations Union-The First Assembly: a study of the proceedings of the First Assembly of the League of Nations; by a Committee of the League of Nations Union including Lord Robert Cecil and Lord Phillimore. Ed. by Oliver Brett. Cr. 8vo. 7×4, pp. 285, swd. 3s. 6d. net MACMILLAN, May '21",,,League of Nations Union-The First Assembly: a study of the proceedings of the First Assembly of the League of Nations; by a Committee of the League of Nations Union including Lord Robert Cecil and Lord Phillimore,MACMILLAN,3s. 6d.,8vo.,"League of Nations Union-The First Assembly: a study of the proceedings of the First Assembly of the League of Nations; by a Committee of the League of Nations Union including Lord Robert Cecil and Lord Phillimore. Ed. by Oliver Brett. Cr. 8vo. 7×4, pp. 285, swd. 3s. 6d. net MACMILLAN, May '21",,,,May '21,1921,net
"Leeds University-Calendar, 1921-22. 7×51 pp. 606, swd. 2s. (Leeds) JOWETT & SOWRY, Oct. '21",,,Leeds University-Calendar,JOWETT & SOWRY,2s.,,"Leeds University-Calendar, 1921-22. 7×51 pp. 606, swd. 2s. (Leeds) JOWETT & SOWRY, Oct. '21",,,,Oct. '21,1921,
"Intro. by Leper's bell, Sparroy (M.) 7s. 6d. net. Le Prade (R.) ed.-Debs and the poets. U. Sinclair. Cr. 8vo. 7s. net HENDERSONS, Mar. '21",,,Intro,HENDERSONS,7s.,8vo.,"Intro. by Leper's bell, Sparroy (M.) 7s. 6d. net. Le Prade (R.) ed.-Debs and the poets. U. Sinclair. Cr. 8vo. 7s. net HENDERSONS, Mar. '21",,,,Mar. '21,1921,net
"Illus. by Mary S. Reeve and Gordon Browne. Cr. 8vo. 7×51, pp. 272, 6s. net...... .MILFORD, Oct. '21",,,,MILFORD,6s.,8vo.,"Illus. by Mary S. Reeve and Gordon Browne. Cr. 8vo. 7×51, pp. 272, 6s. net...... .MILFORD, Oct. '21",,,,Oct. '21,1921,net
"Letters from Angel-Land. By Ignatia and Can- dida. Illus. by Scott Calder. Folio 111×81, pp. 101, 4s. net .C. PALMER, Nov. '21",,,Letters from Angel-Land,C. PALMER,4s.,,"Letters from Angel-Land. By Ignatia and Can- dida. Illus. by Scott Calder. Folio 111×81, pp. 101, 4s. net .C. PALMER, Nov. '21",,,,Nov. '21,1921,net
"Letters to a nurse. By a Midland Doctor. 7×41, pp. 99, 5s. net.. .BALE, Apr. '21",,,Letters to a nurse,BALE,5s.,,"Letters to a nurse. By a Midland Doctor. 7×41, pp. 99, 5s. net.. .BALE, Apr. '21",,,,Apr. '21,1921,net
"Cr. 8vo. 7×5, pp. Lewis (Edward)—The Barn. 315, 8s. 6d. net ........ ALLEN & U., Sep. 21",,,,ALLEN & U.,8s. 6d.,8vo.,"Cr. 8vo. 7×5, pp. Lewis (Edward)—The Barn. 315, 8s. 6d. net ........ ALLEN & U., Sep. 21",,,,Sep. 21,1921,net
"Lewis (Leonard P.)-Railway signal engineering (mechanical). 2nd ed., rev. 8vo. 8×51, pp. 376, 14s. net (Glasgow text-books) CONSTABLE, Jan. '21",,,,CONSTABLE,14s.,8vo.,"Lewis (Leonard P.)-Railway signal engineering (mechanical). 2nd ed., rev. 8vo. 8×51, pp. 376, 14s. net (Glasgow text-books) CONSTABLE, Jan. '21",,['Lewis (Leonard P.)-Railway signal engineering (mechanical)'],,Jan. '21,1921,net
"Liberal year book, 1921. Cr. 8vo. 7 × 44, pp. 296, 2s. 6d.; swd. 1s. 6d. net LIBERAL PUBLICATION DEPT., Mar. '21",,,Liberal year book,LIBERAL PUBLICATION DEPT.,1s. 6d.,8vo.,"Liberal year book, 1921. Cr. 8vo. 7 × 44, pp. 296, 2s. 6d.; swd. Is. 6d. net LIBERAL PUBLICATION DEPT., Mar. '21",,,,Mar. '21,1921,net
"Light at eventide: large print readings for the sick and aged. 11th ed. Cr. 8vo. 7}×5, pp. 198, 3s. net.. .SIMPKIN, Apr. '21",,,Light at eventide: large print readings for the sick and aged,SIMPKIN,3s.,8vo.,"Light at eventide: large print readings for the sick and aged. 11th ed. Cr. 8vo. 7}×5, pp. 198, 3s. net.. .SIMPKIN, Apr. '21",,,,Apr. '21,1921,net
"net Light in the Home: an illus. magazine for family reading. New ser., Vol. 2. Ryl. 8vo. 9×71, pp. 188, 3s. net... R.T.S., Sep. '21",,,Light in the Home: an illus,R.T.S.,3s.,8vo.,"net Light in the Home: an illus. magazine for family reading. New ser., Vol. 2. Ryl. 8vo. 9×71, pp. 188, 3s. net... R.T.S., Sep. '21",,,,Sep. '21,1921,net
"Lin bhai-Lien.-The Arabian prophet: a life of Mohammed from Chinese and Arabic sources. Trans. by 1saac Mason. 8vo. pp. 329, 10s. 6d. LUZAC, June '21",,,Lin bhai-Lien,LUZAC,10s. 6d.,8vo.,"Lin bhai-Lien.-The Arabian prophet: a life of Mohammed from Chinese and Arabic sources. Trans. by Isaac Mason. 8vo. pp. 329, 10s. 6d. LUZAC, June '21",,,,June '21,1921,
"Lincoln Diocesan calendar, clergy list and general almanack, 1921. Cr. 8vo. 7X 5, pp. 197, swd. 2s. net..LINCOLNSHIRE CHRONICLE, Mar. '21",,,"Lincoln Diocesan calendar, clergy list and general almanack",LINCOLNSHIRE CHRONICLE,2s.,8vo.,"Lincoln Diocesan calendar, clergy list and general almanack, 1921. Cr. 8vo. 7X 5, pp. 197, swd. 2s. net..LINCOLNSHIRE CHRONICLE, Mar. '21",,,,Mar. '21,1921,net
"Literary year book, 1921. Ed. by Mark Meredith. 8vo. 8×51, pp. 600, 8s. 6d. net ROUTLEDGE, Jan. '21",,,Literary year book,ROUTLEDGE,8s. 6d.,8vo.,"Literary year book, 1921. Ed. by Mark Meredith. 8vo. 8×51, pp. 600, 8s. 6d. net ROUTLEDGE, Jan. '21",,,,Jan. '21,1921,net
"Literature, Russian, Hist. of, Shakhnovski._4s. 6d. net Literature, Spanish, Main currents (J. D. M.) 15s. net Little (R. Craig)—Leonidas and others. Cr. 8vo. 7×5, pp. 125, 6s. net ALEX. GARDNER, Jau. '21",,,"Literature, Russian, Hist",ALEX. GARDNER,6s.,8vo.,"Literature, Russian, Hist. of, Shakhnovski._4s. 6d. net Literature, Spanish, Main currents (J. D. M.) 15s. net Little (R. Craig)—Leonidas and others. Cr. 8vo. 7×5, pp. 125, 6s. net ALEX. GARDNER, Jau. '21",,,,Jau. '21,1921,net
"Little Folks: the magazine for boys and girls. Edit. by Herbert D. Williams. Vol. 93, Illus. Demy 8vo. 91×61, pp. 432, 6s. 6d. net CASSELL, June '21",,,Little Folks: the magazine for boys and girls,CASSELL,6s. 6d.,8vo.,"Little Folks: the magazine for boys and girls. Edit. by Herbert D. Williams. Vol. 93, Illus. Demy 8vo. 91×61, pp. 432, 6s. 6d. net CASSELL, June '21",,,,June '21,1921,net
"Little Folks. Edit. by Herbert D. Williams. Vol. 94, 1921. (The Jubilee volume.) Illus. Ryl. 8vo. 9×61, pp. 480, 7s. 6d. net; bds. 6s. 6d. net... CASSELL, Oct. '21",,,Little Folks,CASSELL,6s. 6d.,8vo.,"Little Folks. Edit. by Herbert D. Williams. Vol. 94, 1921. (The Jubilee volume.) Illus. Ryl. 8vo. 9×61, pp. 480, 75. 6d. net; bds. 6s. 6d. net... CASSELL, Oct. '21",,,,Oct. '21,1921,net
"Little gnome (The). Fcap. fol. 12 × 71, s. net. (Little gnome ser.) .ALLDAY, Aug. '21",,,Little gnome (The),ALLDAY,,,"Little gnome (The). Fcap. fol. 12 × 71, IS. net. (Little gnome ser.) .ALLDAY, Aug. '21",,,,Aug. '21,1921,
"net Little house in the fairy wood, Eliot (E. C.) Livingston (Florence Bingham)—The Custard cup. Cr. 8vo. 7× 5, pp. 297, 8s. 6d. net HODDER & S., May '21",,,"Little house in the fairy wood, Eliot (E. C.) Livingston (Florence Bingham)—The Custard cup",HODDER & S.,8s. 6d.,8vo.,"net Little house in the fairy wood, Eliot (E. C.) Livingston (Florence Bingham)—The Custard cup. Cr. 8vo. 7× 5, pp. 297, 8s. 6d. net HODDER & S., May '21",,,,May '21,1921,net
"Little man and the little gun. Illus. by F. Adams. Folio, bds. 2s. net.... BLACKIE, Sep. '21",,,Little man and the little gun,BLACKIE,2s.,,"Little man and the little gun. Illus. by F. Adams. Folio, bds. 2s. net.... BLACKIE, Sep. '21",,,,Sep. '21,1921,net
"(2nd year.) 4to. bds. ...R. TUCK, June'21",,,2nd year,R. TUCK,,4to.,"(2nd year.) 4to. bds. ...R. TUCK, June'21",,,,June'21,1921,
"Little people's annual. Edit. by E. Vredenburg. 10×8, pp. 111, bds. 5s. net R. TUCK, Nov. '21",,,Little people's annual,R. TUCK,5s.,,"Little people's annual. Edit. by E. Vredenburg. 10×8, pp. 111, bds. 5s. net R. TUCK, Nov. '21",,,,Nov. '21,1921,net
"Little Red Riding Hood. Illus. by H. G. C. Marsh-Lambert. Folio, 10x81, swd. 1s. 3d. net (Shakespeare ser.)......ALLDAY, July '21",,,Little Red Riding Hood,ALLDAY,1s. 3d.,,"Little Red Riding Hood. Illus. by H. G. C. Marsh-Lambert. Folio, 10x81, swd. Is. 3d. net (Shakespeare ser.)......ALLDAY, July '21",,,,July '21,1921,net
"Live Stock Journal Annual, 1922. Illus. Ryl. 8vo. 9×61, pp. 320, swd. 3s. 6d. net VINTON, Dec. '21",,,Live Stock Journal Annual,VINTON,3s. 6d.,8vo.,"Live Stock Journal Annual, 1922. Illus. Ryl. 8vo. 9×61, pp. 320, swd. 3s. 6d. net VINTON, Dec. '21",,,,Dec. '21,1921,net
" Liverpool Chapbook. No. 1, Dec., 1920, &c. IIX8, annual sub., 10s. net (18, Renshaw St., Liverpool) OFFICE, Jan. '21",,,Liverpool Chapbook,OFFICE,10s.,," Liverpool Chapbook. No. 1, Dec., 1920, &c. IIX8, annual sub., 10s. net (18, Renshaw St., Liverpool) OFFICE, Jan. '21",,,,Jan. '21,1921,net
