entry,last_name,first_name,title,publisher,price,format,original_entry,author_name,creators,is_editor,date,is_net
"Acts-Abertillery and District Water Board Act, 1910, 7s. . WYMAN, Dec. 10",,,Acts-Abertillery and District Water Board Act,WYMAN,7s.,,"Acts-Abertillery and District Water Board Act, 1910, 75. . WYMAN, Dec. 10",,,,Dec. 10,
"Acts—Appropriation Act, 1910, 3d. ; Hotels and Restaurants (Dublin), fd.; Standard Life Assurance Company, 3s..... WYMAN, Aug. 10",,,Acts—Appropriation Act,WYMAN,3s.,,"Acts—Appropriation Act, 1910, 3d. ; Hotels and Restaurants (Dublin), fd.; Standard Life Assurance Company, 35..... WYMAN, Aug. 10",,,,Aug. 10,
"Acts-Assam Railways and Trading Company, s.; Provident Association of London, is. 6d.; City of London Tithes and Rates, 6d. WYMAN, Sep. 10",,,"Acts-Assam Railways and Trading Company, s",WYMAN,6d.,,"Acts-Assam Railways and Trading Company, IS.; Provident Association of London, is. 6d.; City of London Tithes and Rates, 6d. WYMAN, Sep. 10",,,,Sep. 10,
"Acts—Bradford Corporation Act, 1910, 4s.; Glasgow Gas Act, 1910, 3s. 3d. ; Expiring Laws Continuance Act, id. .. WYMAN, Dec. 10",,,Acts—Bradford Corporation Act,WYMAN,,,"Acts—Bradford Corporation Act, 1910, 45.; Glasgow Gas Act, 1910, 35. 3d. ; Expiring Laws Continuance Act, id. .. WYMAN, Dec. 10",,,,Dec. 10,
"Acts—Bury Corporation, 12s. ; Colinton Tram- ways Order Confirmation, 5s. gd. WYMAN, Jan. 10",,,Acts—Bury Corporation,WYMAN,,,"Acts—Bury Corporation, 125. ; Colinton Tram- ways Order Confirmation, 55. gd. WYMAN, Jan. 10",,,,Jan. 10,
"Acts—Cambridge University and Town Water- works, 2s. 9d.; Garnant Gas, is. 3d. ; South Lincolnshire Water, 6d. ; Thorne and District Water, s. 6d.; Nottingham Corporation, 1s. gd. WYMAN, Nov. 10",,,Acts—Cambridge University and Town Water- works,WYMAN,,,"Acts—Cambridge University and Town Water- works, 25. 9d.; Garnant Gas, is. 3d. ; South Lincolnshire Water, 6d. ; Thorne and District Water, IS. 6d.; Nottingham Corporation, Is. gd. WYMAN, Nov. 10",,,,Nov. 10,
"Acts-Finance Act, 1909-10, 10 d. WYMAN, May 10",,,Acts-Finance Act,WYMAN,,,"Acts-Finance Act, 1909-10, 10 d. WYMAN, May 10",,,,May 10,
"Acts—Finance Act, 1910, £d. ..WYMAN, Dec. 10",,,Acts—Finance Act,WYMAN,,,"Acts—Finance Act, 1910, £d. ..WYMAN, Dec. 10",,,,Dec. 10,
"Acts-Great Central Railway, 28. 3d.; Great Grimsby Gas, 28....... .WYMAN, Nov. 10",,,Acts-Great Central Railway,WYMAN,,,"Acts-Great Central Railway, 28. 3d.; Great Grimsby Gas, 28....... .WYMAN, Nov. 10",,,,Nov. 10,
"Acts—Land Drainage, Provisional Order, No. 3, 3d.; Local Government Board (Ireland), Provisional Order, No. 5, 6d.; Southend Waterworks, is. 60. ; Electric Lighting Orders Confirmation, 6d. WYMAN, Sep. 10",,,"Acts—Land Drainage, Provisional Order",WYMAN,6d.,,"Acts—Land Drainage, Provisional Order, No. 3, 3d.; Local Government Board (Ireland), Provisional Order, No. 5, 6d.; Southend Waterworks, is. 60. ; Electric Lighting Orders Confirmation, 6d. WYMAN, Sep. 10",,,,Sep. 10,
"Acts—Licensing Consolidation, 8d. ; 1sle of Man Customs, kd.; Registration of Births, Deaths and Marriages, Scotland, d.; Accession Declaration, ld. ; Jury Trials : Scotland, }d. ; Public Works Loans, 1d.; Regency, 1d.; Civil List, id. ; Census, Great Britain, id. ; Yorkshire Electric Power, 6d. ; Port of London (Port Rate on Goods Provisional Order), 3s. 9d. ; Agricultural Holdings (Scotland), kd.; Diseases of Animals, id... .WYMAN, Aug. 10",,,Acts—Licensing Consolidation,WYMAN,,,"Acts—Licensing Consolidation, 8d. ; Isle of Man Customs, kd.; Registration of Births, Deaths and Marriages, Scotland, d.; Accession Declaration, ld. ; Jury Trials : Scotland, }d. ; Public Works Loans, Id.; Regency, Id.; Civil List, id. ; Census, Great Britain, id. ; Yorkshire Electric Power, 6d. ; Port of London (Port Rate on Goods Provisional Order), 3s. 9d. ; Agricultural Holdings (Scotland), kd.; Diseases of Animals, id... .WYMAN, Aug. 10",,,,Aug. 10,
"Acts Local Government Board (Ireland), Pro- visional Order, No. 1, 6d.; Provisional Order No. 2, 6d. .WYMAN, June 10",,,"Acts Local Government Board (Ireland), Pro- visional Order",WYMAN,6d.,,"Acts Local Government Board (Ireland), Pro- visional Order, No. 1, 6d.; Provisional Order No. 2, 6d. .WYMAN, June 10",,,,June 10,
"Acts Local Government Board's Provisional Order, No. 10, s. 3d.; Ditto, No. 5, s. ; Falkirk Corporation Gas Order, 9d. WYMAN, Oct. 10",,,Acts Local Government Board's Provisional Order,WYMAN,9d.,,"Acts Local Government Board's Provisional Order, No. 10, IS. 3d.; Ditto, No. 5, IS. ; Falkirk Corporation Gas Order, 9d. WYMAN, Oct. 10",,,,Oct. 10,
"Acts—Local Government Board's Provisional Order Confirmation, No. 8, 1s. 6d.; Ditto No. 7, 1s. 3d. ; Water Provisional Order, 6d.; Highland Railway Order Confirmation, 3d. ; Gas Orders Confirmation, No. 2, 49. 3d.; Pier and Harbour Orders Confirmation, No. 2, is. gd. ; Surbiton Urban District Council, 6d. ; Electric Lighting Orders Confirmation, No. 2, s. 6d. . WYMAN, Oct. 10",,,Acts—Local Government Board's Provisional Order Confirmation,WYMAN,6d.,,"Acts—Local Government Board's Provisional Order Confirmation, No. 8, Is. 6d.; Ditto No. 7, Is. 3d. ; Water Provisional Order, 6d.; Highland Railway Order Confirmation, 3d. ; Gas Orders Confirmation, No. 2, 49. 3d.; Pier and Harbour Orders Confirmation, No. 2, is. gd. ; Surbiton Urban District Council, 6d. ; Electric Lighting Orders Confirmation, No. 2, IS. 6d. . WYMAN, Oct. 10",,,,Oct. 10,
"Acts Local Government Provisional Order, No. 3, 1s. 3d. .WYMAN, Sep. 10",,,Acts Local Government Provisional Order,WYMAN,1s. 3d.,,"Acts Local Government Provisional Order, No. 3, Is. 3d. .WYMAN, Sep. 10",,,,Sep. 10,
"Acts--London County Council Tramways and Improvements, 3s. ; Norwich Charities Scheme, 4s. ; Water Orders Confirmation, 2s. 3d. ; Gas Orders Confirmation, No. 3, 2s. 6d. WYMAN, Oct. 10",,,Acts--London County Council Tramways and Improvements,WYMAN,2s. 6d.,,"Acts--London County Council Tramways and Improvements, 35. ; Norwich Charities Scheme, 45. ; Water Orders Confirmation, 25. 3d. ; Gas Orders Confirmation, No. 3, 2s. 6d. WYMAN, Oct. 10",,,,Oct. 10,
"Acts-London Electric Supply, 3d ; Oyster and Mussel Fishery (Bay of Firth) Order Con- firmation, 3d. ; Edinburgh Corporation Order Confirmation, s, 6d.; River Don Salmon Fisheries Order Confirmation, 2s. ; Govan Burgh Order Confirmation, 6d.; Loch Leven Water Power (Transfer) Order Confirmation, 6d.; Dundee Gas Commissioners Order Con- firmation, is. 2d... WYMAN, Dec. 10",,,Acts-London Electric Supply,WYMAN,2d.,,"Acts-London Electric Supply, 3d ; Oyster and Mussel Fishery (Bay of Firth) Order Con- firmation, 3d. ; Edinburgh Corporation Order Confirmation, IS, 6d.; River Don Salmon Fisheries Order Confirmation, 25. ; Govan Burgh Order Confirmation, 6d.; Loch Leven Water Power (Transfer) Order Confirmation, 6d.; Dundee Gas Commissioners Order Con- firmation, is. 2d... WYMAN, Dec. 10",,,,Dec. 10,
"Acts—Mallow Urban District Gas, s. 9d. ; London Electric Railway Amalgamation, 3s. ; Education Board Provisional Order, London, gd. ; Local Government Board, Ireland, Provisional Order No. 3, 9d. WYMAN, Sep. 10",,,"Acts—Mallow Urban District Gas, s",WYMAN,9d.,,"Acts—Mallow Urban District Gas, IS. 9d. ; London Electric Railway Amalgamation, 3s. ; Education Board Provisional Order, London, gd. ; Local Government Board, Ireland, Provisional Order No. 3, 9d. WYMAN, Sep. 10",,,,Sep. 10,
"Acts—Municipal Corporations, 1d.; Children's 1908 Amendment, d.; Mines, Accidents, Rescue and Aid, d.; Companies, Converted Societies, kd.; Small Holdings, id. ; Duke of York's School Chapel, fd. ; Trusts, Scotland, d.. WYMAN, Aug. 10",,,Acts—Municipal Corporations,WYMAN,,,"Acts—Municipal Corporations, Id.; Children's 1908 Amendment, d.; Mines, Accidents, Rescue and Aid, d.; Companies, Converted Societies, kd.; Small Holdings, id. ; Duke of York's School Chapel, fd. ; Trusts, Scotland, d.. WYMAN, Aug. 10",,,,Aug. 10,
"Acts—Muirhead Trust Order Confirmation, is. WYMAN, Aug. 10",,,"Acts—Muirhead Trust Order Confirmation, is",WYMAN,,,"Acts—Muirhead Trust Order Confirmation, is. WYMAN, Aug. 10",,,,Aug. 10,
"Acts, Public General, 1909, 3s... WYMAN, Mar. 10",,,"Acts, Public General",WYMAN,3s.,,"Acts, Public General, 1909, 35... WYMAN, Mar. 10",,,,Mar. 10,
"Acts, Public General, 1909 (in Quires), 2s. 6d. WYMAN, Mar. 10",,,"Acts, Public General",WYMAN,2s. 6d.,,"Acts, Public General, 1909 (in Quires), 2s. 6d. WYMAN, Mar. 10",,,,Mar. 10,
"Acts-Shirebrook and District Gas, 1s. 3d. ; Ex- mouth Gas, 1s. 9d.; Barry Railway, 6d.; Cardiff Railway, 6d. ; Matlock Bath and Scarthin Nick Urban District Council, 1s. WYMAN, Nov. 10",,,Acts-Shirebrook and District Gas,WYMAN,1s.,,"Acts-Shirebrook and District Gas, Is. 3d. ; Ex- mouth Gas, Is. 9d.; Barry Railway, 6d.; Cardiff Railway, 6d. ; Matlock Bath and Scarthin Nick Urban District Council, Is. WYMAN, Nov. 10",,,,Nov. 10,
"Acts.-Southampton Corporation, 1910, 4s. WYMAN, Nov. 10",,,Acts,WYMAN,4s.,,"Acts.-Southampton Corporation, 1910, 4s. WYMAN, Nov. 10",,,,Nov. 10,
"Acts—Thames Conservancy (Appointments and Tolls) Provisional Order, 9d. Dick Trust Order Confirmation, ed. W'YMAN, Dec, 10",,,Acts—Thames Conservancy (Appointments and Tolls) Provisional Order,W'YMAN,,,"Acts—Thames Conservancy (Appointments and Tolls) Provisional Order, 9d. Dick Trust Order Confirmation, ed. W'YMAN, Dec, 10",,,,"Dec, 10",
"Acts—Treasury, Temporary Borrowing, d.; War Loan Redemption, }d. ..WYMAN, Mar. 10",,,"Acts—Treasury, Temporary Borrowing, d",WYMAN,,,"Acts—Treasury, Temporary Borrowing, d.; War Loan Redemption, }d. ..WYMAN, Mar. 10",,,,Mar. 10,
"Acts—Wear Navigation and Sunderland Dock, 6d. ; Consolidated Fund, No. 2, 4d. WYMAN, June 10",,,Acts—Wear Navigation and Sunderland Dock,WYMAN,4d.,,"Acts—Wear Navigation and Sunderland Dock, 6d. ; Consolidated Fund, No. 2, 4d. WYMAN, June 10",,,,June 10,
"Adrianople, Consular Report for 1909, 2ļd. WYMAN, J une 10",,,"Adrianople, Consular Report for",WYMAN,,,"Adrianople, Consular Report for 1909, 2ļd. WYMAN, J une 10",,,,J une 10,
"Adventures in the Far North. Cr. 8vo. 71X51, pp. 166, is, 6d. (Romance of the World) FROWDE, Nov. 10",,,Adventures in the Far North,FROWDE,6d.,8vo.,"Adventures in the Far North. Cr. 8vo. 71X51, pp. 166, is, 6d. (Romance of the World) FROWDE, Nov. 10",,,,Nov. 10,
"Adventures in the Far West. Cr. 8vo. 74 x 57, pp. 166, is, 6d. (Romance of the World) FROWDE, Nov. 10",,,Adventures in the Far West,FROWDE,6d.,8vo.,"Adventures in the Far West. Cr. 8vo. 74 x 57, pp. 166, is, 6d. (Romance of the World) FROWDE, Nov. 10",,,,Nov. 10,
"Advertisement Canvassers' Manual, 1910. 8vo. 74 X5, pp. 271, 3s. 6d. net INFORMATION BUREAU, LID., Feb. 10",,,Advertisement Canvassers' Manual,"INFORMATION BUREAU, LID.",3s. 6d.,8vo.,"Advertisement Canvassers' Manual, 1910. 8vo. 74 X5, pp. 271, 3s. 6d. net INFORMATION BUREAU, LID., Feb. 10",,,,Feb. 10,net
"Adviser (The) 1910. Ryl. iómo, bds. s. R. J. JAMES, Dec. 10",,,Adviser (The),R. J. JAMES,,,"Adviser (The) 1910. Ryl. iómo, bds. IS. R. J. JAMES, Dec. 10",,,,Dec. 10,
"Aero Manual (The). Compiled by the Staff of the “Motor. Second edit. 8vo. 74 x 54, pp. 208, s. 6d. net TEMPLE PRESS, June 10",,,Aero Manual (The),TEMPLE PRESS,6d.,8vo.,"Aero Manual (The). Compiled by the Staff of the “Motor. Second edit. 8vo. 74 x 54, pp. 208, IS. 6d. net TEMPLE PRESS, June 10",,,,June 10,net
"Aeronautics, Report of Advisory Committee for, 1909-10, 8s. 5d. WYMAN, Aug. 10",,,"Aeronautics, Report of Advisory Committee for",WYMAN,8s. 5d.,,"Aeronautics, Report of Advisory Committee for, 1909-10, 8s. 5d. WYMAN, Aug. 10",,,,Aug. 10,
"Aeroplane Portfolio (The). In ase, is. net P. MARSHALL, Mar. 10",,,Aeroplane Portfolio (The),P. MARSHALL,,,"Aeroplane Portfolio (The). In ase, is. net P. MARSHALL, Mar. 10",,,,Mar. 10,
"Æschylus --Agamemnon. With Verse Trans., Intro. and Notes, by Walter Headlam. 8vo., pp. 278, ros. net CAMB. UNIV. PRESS, Oct. 10",,,Æschylus --Agamemnon,CAMB. UNIV. PRESS,,8vo.,"Æschylus --Agamemnon. With Verse Trans., Intro. and Notes, by Walter Headlam. 8vo., pp. 278, ros. net CAMB. UNIV. PRESS, Oct. 10",,,,Oct. 10,
"Alexander's Indian Case Law on Torts. 5th edit. by J. W. Orr, 8vo. 12s, net. . THACKER, Aug. 10",,,Alexander's Indian Case Law on Torts,THACKER,12s.,8vo.,"Alexander's Indian Case Law on Torts. 5th edit. by J. W. Orr, 8vo. 12s, net. . THACKER, Aug. 10",,,,Aug. 10,net
"Algeria Consular Report for 1909, 5d. WYMAS, Dec. 10",,,Algeria Consular Report for,WYMAS,5d.,,"Algeria Consular Report for 1909, 5d. WYMAS, Dec. 10",,,,Dec. 10,
"Alice in Wonderland. In Words of One Syllable. 4to. bds, is. ROUTLEDGE, Oct. 10",,,Alice in Wonderland,ROUTLEDGE,,4to.,"Alice in Wonderland. In Words of One Syllable. 4to. bds, is. ROUTLEDGE, Oct. 10",,,,Oct. 10,
"Alien.--A Double Blindness. Cr. 8vo. 7* X5, pp. 320, 6s... ..DIGBY, L., Feb. 10",,,Alien,"DIGBY, L.",6s.,8vo.,"Alien.--A Double Blindness. Cr. 8vo. 7* X5, pp. 320, 6s... ..DIGBY, L., Feb. 10",,,,Feb. 10,
"Aliens Act, Report for 1909, 7d. WYMAN, July 10",,,"Aliens Act, Report for",WYMAN,7d.,,"Aliens Act, Report for 1909, 7d. WYMAN, July 10",,,,July 10,
"Aliens Naturalisation Return, 1909, 3d. WYMAN, Apr. 10",,,Aliens Naturalisation Return,WYMAN,3d.,,"Aliens Naturalisation Return, 1909, 3d. WYMAN, Apr. 10",,,,Apr. 10,
"Aliens, Statement with regard to the Expulsion of, 2d. . WYMAN, June 10",,,"Aliens, Statement with regard to the Expulsion of",WYMAN,2d.,,"Aliens, Statement with regard to the Expulsion of, 2d. . WYMAN, June 10",,,,June 10,
"Alkali Works. Forty-sixth Report, for 1909, 6}d. WYMAN, July 10",,,Alkali Works,WYMAN,,,"Alkali Works. Forty-sixth Report, for 1909, 6}d. WYMAN, July 10",,,,July 10,
"All-Rail Route (The) between the Far East and Europe. Illus. Izmo. 7 x 41, pp. 144, 2s. net CHRISTOPHERS, May 10",,,All-Rail Route (The) between the Far East and Europe,CHRISTOPHERS,2s.,,"All-Rail Route (The) between the Far East and Europe. Illus. Izmo. 7 x 41, pp. 144, 25. net CHRISTOPHERS, May 10",,,,May 10,net
"Allen's Commercial Organic Analysis, Vol. II. 4th edit. entirely re-written. Ryl. Svo. 91 X61, pp. 530, 2iS. net ........CHURCHILL, May 10",,,"Allen's Commercial Organic Analysis, Vol",CHURCHILL,,,"Allen's Commercial Organic Analysis, Vol. II. 4th edit. entirely re-written. Ryl. Svo. 91 X61, pp. 530, 2iS. net ........CHURCHILL, May 10",,,,May 10,
"Allen's Commercial Organic Analysis. Vol. 3. 4th edit. Entirely rewritten. 8vo. 98 x6, pp. 646, 215, net... CHURCHILL, Aug. 10",,,Allen's Commercial Organic Analysis,CHURCHILL,,8vo.,"Allen's Commercial Organic Analysis. Vol. 3. 4th edit. Entirely rewritten. 8vo. 98 x6, pp. 646, 215, net... CHURCHILL, Aug. 10",,,,Aug. 10,
"Almanach de Gotha, 1911. 12mo. 8s. net DULAU, Dec. 10",,,Almanach de Gotha,DULAU,8s.,12mo.,"Almanach de Gotha, 1911. 12mo. 8s. net DULAU, Dec. 10",,,,Dec. 10,net
"Alpine Plants at Home. 2nd ser. 18mo. swd. 6d. net GOWANS & G., July 10",,,Alpine Plants at Home,GOWANS & G.,6d.,18mo.,"Alpine Plants at Home. 2nd ser. 18mo. swd. 6d. net GOWANS & G., July 10",,,,July 10,net
"Amanda and Gherardo and other Poems. By J. E. P. Cr. 8vo. 71 X5, pp. 232, 3s. 6d. net CORNISH BROS., Apr. 10",,,Amanda and Gherardo and other Poems,CORNISH BROS.,3s. 6d.,8vo.,"Amanda and Gherardo and other Poems. By J. E. P. Cr. 8vo. 71 X5, pp. 232, 3s. 6d. net CORNISH BROS., Apr. 10",,,,Apr. 10,net
"American Foreign Policy. By a Diplomatist. 8vo. 5s. net CONSTABLE, Mar. 10",,,American Foreign Policy,CONSTABLE,5s.,8vo.,"American Foreign Policy. By a Diplomatist. 8vo. 5s. net CONSTABLE, Mar. 10",,,,Mar. 10,net
"American Journal of Photography (The), 1910. 8vo. swd. 3s. net......DAWBARN & W., Feb. 10",,,American Journal of Photography (The),DAWBARN & W.,3s.,8vo.,"American Journal of Photography (The), 1910. 8vo. swd. 35. net......DAWBARN & W., Feb. 10",,,,Feb. 10,net
"Amsterdam, Consular Report, 1909, 2}d. WYMAN, May 10",,,"Amsterdam, Consular Report",WYMAN,,,"Amsterdam, Consular Report, 1909, 2}d. WYMAN, May 10",,,,May 10,
"An Old Lady's Literary Likings (and Dislikings) Post 8vo., pp. 80, is, 6d. net MACLEHOSE, Apr. 10",,,An Old Lady's Literary Likings (and Dislikings) Post,MACLEHOSE,6d.,8vo.,"An Old Lady's Literary Likings (and Dislikings) Post 8vo., pp. 80, is, 6d. net MACLEHOSE, Apr. 10",,,,Apr. 10,net
"Anæsthetics, Coroners' Committee Report re Deaths from, id...... .WYMAN, Apr. 10",,,"Anæsthetics, Coroners' Committee Report re Deaths from, id.",WYMAN,,,"Anæsthetics, Coroners' Committee Report re Deaths from, id...... .WYMAN, Apr. 10",,,,Apr. 10,
"Analyst (The) 1909. Vol. 34. Ryl, 8vo, 26s. net SIMPKIN, Feb. 10",,,Analyst (The),SIMPKIN,26s.,"8vo,","Analyst (The) 1909. Vol. 34. Ryl, 8vo, 26s. net SIMPKIN, Feb. 10",,,,Feb. 10,net
"Ancient Monuments in Wales and Monmouth- shire, Report of Commission on, 2fd. WYMAN, Aug. 10",,,"Ancient Monuments in Wales and Monmouth- shire, Report of Commission on",WYMAN,,,"Ancient Monuments in Wales and Monmouth- shire, Report of Commission on, 2fd. WYMAN, Aug. 10",,,,Aug. 10,
"Andersen (Hans)--Fairy Tales (Selections from). Illus. by Gilbert James. 8vo. 61 X5, pp. 64, s, net (Langham Ser. for Children, No. 1) SIEGLE, H., Aug. 10",,,,"SIEGLE, H.",,8vo.,"Andersen (Hans)--Fairy Tales (Selections from). Illus. by Gilbert James. 8vo. 61 X5, pp. 64, IS, net (Langham Ser. for Children, No. 1) SIEGLE, H., Aug. 10",,['Andersen (Hans)--Fairy Tales (Selections from)'],,Aug. 10,
"Angel in the Sun (The)-Books 7-12 and Other Poems. 8vo. 74 X 5, pp. 130 (Bristol) W. GEORGE & SONS, Nov. 10",,,Angel in the Sun (The)-Books 7,W. GEORGE & SONS,,8vo.,"Angel in the Sun (The)-Books 7-12 and Other Poems. 8vo. 74 X 5, pp. 130 (Bristol) W. GEORGE & SONS, Nov. 10",,,,Nov. 10,
"Angelus (The) and the Regina Cæli. With a few short notes, explanatory and historical. Swd. 6d. net .LONGMANS, Jan. 10",,,Angelus (The) and the Regina Cæli,LONGMANS,6d.,,"Angelus (The) and the Regina Cæli. With a few short notes, explanatory and historical. Swd. 6d. net .LONGMANS, Jan. 10",,,,Jan. 10,net
"Anglo-African Who's Who, the. Edit. by Leo. Weinthal. 8vo. 81 x64, pp. 320, 7s. 6d. W. JUDD, A pr. 10",,,"Anglo-African Who's Who, the",W. JUDD,7s. 6d.,8vo.,"Anglo-African Who's Who, the. Edit. by Leo. Weinthal. 8vo. 81 x64, pp. 320, 75. 6d. W. JUDD, A pr. 10",,,,A pr. 10,
"Animal World (The). Vol. 5, New Series, 1910. 4to. 3s., bds. 2s. ...H. E. MORGAN, Dec. 10",,,Animal World (The),H. E. MORGAN,2s.,4to.,"Animal World (The). Vol. 5, New Series, 1910. 4to. 35., bds. 2s. ...H. E. MORGAN, Dec. 10",,,,Dec. 10,
"Animals at the Zoo. 18mo. swd. 6d. net GOWANS & G., Feb. 10",,,Animals at the Zoo,GOWANS & G.,6d.,18mo.,"Animals at the Zoo. 18mo. swd. 6d. net GOWANS & G., Feb. 10",,,,Feb. 10,net
"Animals' Friend (The) Vol. 16. Ryl. 8vo. OFFICE, Oct. 10",,,Animals' Friend (The) Vol,OFFICE,,8vo.,"Animals' Friend (The) Vol. 16. Ryl. 8vo. OFFICE, Oct. 10",,,,Oct. 10,
"Annual Charities Register and Digest (The), 1910. Edit. by C. S. Loch. 8vo. 58. net LONGMANS, Apr. 10",,,Annual Charities Register and Digest (The),LONGMANS,,8vo.,"Annual Charities Register and Digest (The), 1910. Edit. by C. S. Loch. 8vo. 58. net LONGMANS, Apr. 10",,,,Apr. 10,
"Annual Digest (The) 1909. By J. Vews. 8vo. 15s. SWEET & M., Jan. 10",,,Annual Digest (The),SWEET & M.,15s.,8vo.,"Annual Digest (The) 1909. By J. Vews. 8vo. 155. SWEET & M., Jan. 10",,,,Jan. 10,
"Annual Practice (The), 1910. By B. F. Lock and Others. 2 vols. 8vo. 25s. net SWEET & M., Oct. 10",,,Annual Practice (The),SWEET & M.,25s.,8vo.,"Annual Practice (The), 1910. By B. F. Lock and Others. 2 vols. 8vo. 255. net SWEET & M., Oct. 10",,,,Oct. 10,net
"Annual Register (The). A review of Public Events at Home and Abroad for the year 1909. New ser. 8vo. 18s.......LONGMANS, May 10",,,Annual Register (The),LONGMANS,18s.,8vo.,"Annual Register (The). A review of Public Events at Home and Abroad for the year 1909. New ser. 8vo. 18s.......LONGMANS, May 10",,,,May 10,
"Anthology of Prayers for Public Worship. 1ssued by the Church Worship Association of the United Free Church of Scotland. 2nd edit. Cr. 8vo. 71 x 41, pp. 216, 2s. 6d. net MACNIVEN & W., Feb. 10",,,Anthology of Prayers for Public Worship,MACNIVEN & W.,2s. 6d.,8vo.,"Anthology of Prayers for Public Worship. Issued by the Church Worship Association of the United Free Church of Scotland. 2nd edit. Cr. 8vo. 71 x 41, pp. 216, 25. 6d. net MACNIVEN & W., Feb. 10",,,,Feb. 10,net
"Antwerp, Report on the Shipping and Navigation of the Port of, 2 d.... .WYMAN, Mar. 10",,,"Antwerp, Report on the Shipping and Navigation of the Port of",WYMAN,,,"Antwerp, Report on the Shipping and Navigation of the Port of, 2 d.... .WYMAN, Mar. 10",,,,Mar. 10,
"Apuleius—The Metamorphoses ; or, Golden Ass, Trans. by H. E. Butler. 2 vols. Cr. 8vo. 71 X 4, pp. 190, 172, ea. 3s. 6d. net (Clarendon Press) FROWDE, Jan. 10",,,"Apuleius—The Metamorphoses ; or, Golden Ass, Trans",FROWDE,3s. 6d.,8vo.,"Apuleius—The Metamorphoses ; or, Golden Ass, Trans. by H. E. Butler. 2 vols. Cr. 8vo. 71 X 4, pp. 190, 172, ea. 35. 6d. net (Clarendon Press) FROWDE, Jan. 10",,,,Jan. 10,net
"Apuleius-The Story of Cupiil and Psyche. Edit. by L. C. Purser. 8vo. 7s. 6d. net BELL, Mar. 10",,,Apuleius-The Story of Cupiil and Psyche,BELL,7s. 6d.,8vo.,"Apuleius-The Story of Cupiil and Psyche. Edit. by L. C. Purser. 8vo. 75. 6d. net BELL, Mar. 10",,,,Mar. 10,net
"Arabian Nights (The). Selections from. Illus. by Gilbert James. 8vo. 64 X5, pp. 64, is, net (Langham Ser. for Children, No. 3) SIEGLE, H., Aug. 10",,,Arabian Nights (The),"SIEGLE, H.",,8vo.,"Arabian Nights (The). Selections from. Illus. by Gilbert James. 8vo. 64 X5, pp. 64, is, net (Langham Ser. for Children, No. 3) SIEGLE, H., Aug. 10",,,,Aug. 10,
"Arabic History of Gujarat (An), by 'Abdallah Muhammad Bin Omar Al-Makki, Al-Asafi, Ulughkhání. Edit. by E. D. Ross. Vol. I, Text. 8vo. 12s, net MURRAY, Mar. 10",,,"Arabic History of Gujarat (An), by 'Abdallah Muhammad Bin Omar Al-Makki, Al-Asafi, Ulughkhání",MURRAY,12s.,8vo.,"Arabic History of Gujarat (An), by 'Abdallah Muhammad Bin Omar Al-Makki, Al-Asafi, Ulughkhání. Edit. by E. D. Ross. Vol. I, Text. 8vo. I2s, net MURRAY, Mar. 10",,,,Mar. 10,net
"Archæological Report, 1908-1909. Edited by F. LI. Griffiths. 4to. 2s. 6d. net FROWDE, Feb. 10",,,Archæological Report,FROWDE,2s. 6d.,4to.,"Archæological Report, 1908-1909. Edited by F. LI. Griffiths. 4to. 2s. 6d. net FROWDE, Feb. 10",,,,Feb. 10,net
"Archbold's Pleading, Evidence, and Practice in Criminal Cases, by W. F. Craies and H. D. Roome. 24th edit. 8vo. 35s. SWEET & M., Oct. 10",,,"Archbold's Pleading, Evidence, and Practice in Criminal Cases, by W. F. Craies and H. D. Roome",SWEET & M.,35s.,8vo.,"Archbold's Pleading, Evidence, and Practice in Criminal Cases, by W. F. Craies and H. D. Roome. 24th edit. 8vo. 355. SWEET & M., Oct. 10",,,,Oct. 10,
"Aristophanes --Acliarnians, Greek Text, rev. with a trans., &c., by B. B. Rogers. 4to. Ios. 6d. BELL, Jan. 10",,,"Aristophanes --Acliarnians, Greek Text, rev",BELL,6d.,4to.,"Aristophanes --Acliarnians, Greek Text, rev. with a trans., &c., by B. B. Rogers. 4to. Ios. 6d. BELL, Jan. 10",,,,Jan. 10,
"Aristophanes.—Comedies. 1dit., Trans, and Explained by B. B. Rogers. Vol. 1. Imp. 16nio. 15s. . BELL, June 10",,,Aristophanes,BELL,15s.,,"Aristophanes.—Comedies. Idit., Trans, and Explained by B. B. Rogers. Vol. 1. Imp. 16nio. 155. . BELL, June 10",,,,June 10,
"Aristophanes.—The Knights. The Greek Text revised with a trans., by B. B. Rogers. Imp. 16mo., Ios. 60... .BELL, June 10",,,Aristophanes,BELL,,16mo.,"Aristophanes.—The Knights. The Greek Text revised with a trans., by B. B. Rogers. Imp. 16mo., Ios. 60... .BELL, June 10",,,,June 10,
"Aristotle Nicomachean Ethics. Trans. by D. P. Chase. Cr. 8vo. 28. 6d. net (Books that Marked Epochs) ROUTLEDGE, Apr.10",,,Aristotle Nicomachean Ethics,ROUTLEDGE,6d.,8vo.,"Aristotle Nicomachean Ethics. Trans. by D. P. Chase. Cr. 8vo. 28. 6d. net (Books that Marked Epochs) ROUTLEDGE, Apr.10",,,,Apr.10,net
"Aristotle-Works. Translated in English : De Generatione Animalium by A. Platt. 8vo. 78. 6d. net....CLARENDON PRESS, Aug. 10",,,Aristotle-Works,CLARENDON PRESS,6d.,8vo.,"Aristotle-Works. Translated in English : De Generatione Animalium by A. Platt. 8vo. 78. 6d. net....CLARENDON PRESS, Aug. 10",,,,Aug. 10,net
"Army-Amendments to Priced Vocabulary of Clothing and Necessaries, Part 1, id. Amend- ments to Priced Vocabulary of Stores, Part 2, id. . WYMAN, July 10",,,"Army-Amendments to Priced Vocabulary of Clothing and Necessaries, Part 1, id. Amend- ments to Priced Vocabulary of Stores, Part 2, id. ",WYMAN,,,"Army-Amendments to Priced Vocabulary of Clothing and Necessaries, Part 1, id. Amend- ments to Priced Vocabulary of Stores, Part 2, id. . WYMAN, July 10",,,,July 10,
"Army-Amendments to the Standing Orders for the Royal Army Medical Corps, 1907, id. ; Amendinents to the Manual of Military Law, id. .WYMAN, Jan. 10",,,Army-Amendments to the Standing Orders for the Royal Army Medical Corps,WYMAN,,,"Army-Amendments to the Standing Orders for the Royal Army Medical Corps, 1907, id. ; Amendinents to the Manual of Military Law, id. .WYMAN, Jan. 10",,,,Jan. 10,
"Army-Annual Bill, id.. WYMAN, Mar. 10",,,"Army-Annual Bill, id.",WYMAN,,,"Army-Annual Bill, id.. WYMAN, Mar. 10",,,,Mar. 10,
"Army-Army Orders, 1909 : Index, 3d. WYMAN, June 10",,,Army-Army Orders,WYMAN,3d.,,"Army-Army Orders, 1909 : Index, 3d. WYMAN, June 10",,,,June 10,
"Army-Army Service Corps Training, Part 1, 1909, 9d; Courses of Instruction, 1910, 2d. WYMAX, Feb. 10",,,"Army-Army Service Corps Training, Part 1",WYMAX,2d.,,"Army-Army Service Corps Training, Part 1, 1909, 9d; Courses of Instruction, 1910, 2d. WYMAX, Feb. 10",,,,Feb. 10,
