entry,last_name,first_name,title,publisher,price,format,original_entry,author_name,creators,is_editor,date,catalogue_year,is_net
"Law of Copyright in Germany: (1) English Transla- tion of German Act of June 19, 1901, relating to Copyright in Literary and Musical Works; (2) German Act of June 19, 1901, relating to Right of Publication. 8vo. swd. 1s. net LONGMANS, June 02",,,Law of Copyright in Germany: (1) English Transla- tion of German Act of June,LONGMANS,1s.,8vo.,"Law of Copyright in Germany: (1) English Transla- tion of German Act of June 19, 1901, relating to Copyright in Literary and Musical Works; (2) German Act of June 19, 1901, relating to Right of Publication. 8vo. swd. Is. net LONGMANS, June 02",,,,June 02,1902,net
"Law without Lawyers. Epitome of Laws of England for Practical Use. By Two Barristers- at-Law. New ed., full Index, and Alterations necessitated by Legislation of 1901. 8vo. 9×57, pp. 742, 6s...... .MURRAY, Feb. 02",,,Law without Lawyers,MURRAY,6s.,8vo.,"Law without Lawyers. Epitome of Laws of England for Practical Use. By Two Barristers- at-Law. New ed., full Index, and Alterations necessitated by Legislation of 1901. 8vo. 9×57, pp. 742, 6s...... .MURRAY, Feb. 02",,,,Feb. 02,1902,
"Lawyer's Remembrancer and Pocket-book, 1903. Ordinary ed. in limp lthr. 2s. 6d. net; special ed. in leather wallet, 5s. net BUTTERWORTH, Nov. 02",,,Lawyer's Remembrancer and Pocket-book,BUTTERWORTH,5s.,,"Lawyer's Remembrancer and Pocket-book, 1903. Ordinary ed. in limp lthr. 2s. 6d. net; special ed. in leather wallet, 5s. net BUTTERWORTH, Nov. 02",,,,Nov. 02,1902,net
"Laxton's Price Book for Architects, Builders, Engineers and Contractors, 1902. Cr. 8vo. 4s. SIMPKIN, Feb. 02",,,"Laxton's Price Book for Architects, Builders, Engineers and Contractors",SIMPKIN,4s.,8vo.,"Laxton's Price Book for Architects, Builders, Engineers and Contractors, 1902. Cr. 8vo. 4s. SIMPKIN, Feb. 02",,,,Feb. 02,1902,
"Lay of Havelok the Dane. Re-edited from MS. Laud Misc. 108 in the Bodleian Library, Oxford, by Walter W. Skeat. 12mo. 63 × 41, pp. 282, 4s. 6d. FROWDE, Oct. 02",,,Lay of Havelok the Dane,FROWDE,4s. 6d.,12mo.,"Lay of Havelok the Dane. Re-edited from MS. Laud Misc. 108 in the Bodleian Library, Oxford, by Walter W. Skeat. 12mo. 63 × 41, pp. 282, 4s. 6d. FROWDE, Oct. 02",,,,Oct. 02,1902,
"Roy. 8vo. 2s. 6d. SIMPKIN, Dec. 02",,,Roy,SIMPKIN,2s. 6d.,8vo.,"Roy. 8vo. 2s. 6d. SIMPKIN, Dec. 02",,,,Dec. 02,1902,
"Lectures on the History of the 19th Century, delivered at the Cambridge University Extension Summer Meeting, August, 1902. Ed. by F. A. Kirkpatrick. Cr. 8vo. 74 x 5, pp. 892, 4s. 6d. net C. J. CLAY, Dec. 02",,,Lectures on the History of the,C. J. CLAY,4s. 6d.,8vo.,"Lectures on the History of the 19th Century, delivered at the Cambridge University Extension Summer Meeting, August, 1902. Ed. by F. A. Kirkpatrick. Cr. 8vo. 74 x 5, pp. 892, 4s. 6d. net C. J. CLAY, Dec. 02",,,,Dec. 02,1902,net
"Legend of St. Francis. By the Three Companions. Now first translated into English by E. G. Salter. 12mo. 64 × 84, pp. 186, 1s. 6d. net; leather, 2s. net (Temple Classics)... ....DENT, Dec. 02",,,Legend of St,DENT,2s.,12mo.,"Legend of St. Francis. By the Three Companions. Now first translated into English by E. G. Salter. 12mo. 64 × 84, pp. 186, 1s. 6d. net; leather, 2s. net (Temple Classics)... ....DENT, Dec. 02",,,,Dec. 02,1902,net
"Legends (The Ingoldsby); or, Mirth and Marvels. By Thomas Ingoldsby, Esquire. Illus. by Herbert Cole. 8vo. 8 × 53, pp. 660, 68. ...LANE, Nov. 02",,,"Legends (The Ingoldsby); or, Mirth and Marvels",LANE,,8vo.,"Legends (The Ingoldsby); or, Mirth and Marvels. By Thomas Ingoldsby, Esquire. Illus. by Herbert Cole. 8vo. 8 × 53, pp. 660, 68. ...LANE, Nov. 02",,,,Nov. 02,1902,
"Legg (J. W.), Hope (W. H. St. John)-Inventories of Christchurch, Canterbury, with Historical and Topographical Intro. and Illustrative Documents. Trans. and Ed. 8vo. 21s. net CONSTABLE, Mar. 02",,,"Inventories of Christchurch, Canterbury, with Historical and Topographical Intro",CONSTABLE,21s.,8vo.,"Legg (J. W.), Hope (W. H. St. John)-Inventories of Christchurch, Canterbury, with Historical and Topographical Intro. and Illustrative Documents. Trans. and Ed. 8vo. 21s. net CONSTABLE, Mar. 02",,"['Legg (J. W.), Hope (W. H. St. John)']",,Mar. 02,1902,net
"Letters of an Actress. Cr. 8vo. 7 × 5, pp. 296, 6s. E. ARNOLD, Oct. 02",,,Letters of an Actress,E. ARNOLD,6s.,8vo.,"Letters of an Actress. Cr. 8vo. 7 × 5, pp. 296, 6s. E. ARNOLD, Oct. 02",,,,Oct. 02,1902,
"Letters of Dorothea, Princess Lieven, during her Residence in London, 1812-1884. Ed. by Lionel G. Robinson. 2 Photogravure Portraits. Roy. 8vo. 9 x 6, pp. 486, 14s. net...LONGMANS, Sep. 02",,,"Letters of Dorothea, Princess Lieven, during her Residence in London",LONGMANS,14s.,8vo.,"Letters of Dorothea, Princess Lieven, during her Residence in London, 1812-1884. Ed. by Lionel G. Robinson. 2 Photogravure Portraits. Roy. 8vo. 9 x 6, pp. 486, 14s. net...LONGMANS, Sep. 02",,,,Sep. 02,1902,net
"Licensed Victuallers' Year Book for 1902. 8vo. limp, ls. ……………..OFFICE, Jan. 02",,,Licensed Victuallers' Year Book for,OFFICE,,8vo.,"Licensed Victuallers' Year Book for 1902. 8vo. limp, ls. ……………..OFFICE, Jan. 02",,,,Jan. 02,1902,
"Life-Economy of Human. Trans. from Indian MS. New ed. prepared with Preface by D. M. Gane. 16mo. 2s. 6d. net; parchm. 3s. net 48. LUZAC, June 02",,,Life-Economy of Human,LUZAC,,16mo.,"Life-Economy of Human. Trans. from Indian MS. New ed. prepared with Preface by D. M. Gane. 16mo. 2s. 6d. net; parchm. 3s. net 48. LUZAC, June 02",,,,June 02,1902,
"Life Impossible: a Novel. By Member of Paget's Horse and J. P. L. Cr. 8vo. 74 × 43, pp. 252, 8s. 6d. GREENING, Dec. 02",,,Life Impossible: a Novel,GREENING,8s. 6d.,8vo.,"Life Impossible: a Novel. By Member of Paget's Horse and J. P. L. Cr. 8vo. 74 × 43, pp. 252, 8s. 6d. GREENING, Dec. 02",,,,Dec. 02,1902,
"Life of John William Walshe, F.S.A. Ed. with Intro. by Montgomery Carmichael. 8vo. 8 x 5, pp. 284, 6s. net....... ……………………..MURRAY, May 02",,,"Life of John William Walshe, F.S.A. Ed",MURRAY,,8vo.,"Life of John William Walshe, F.S.A. Ed. with Intro. by Montgomery Carmichael. 8vo. 8 x 5, pp. 284, 6s. net....... ……………………..MURRAY, May 02",,,,May 02,1902,
"Life of Mansie Wauch, Tailor in Dalkeith. Written by Himself. With Intro. and Notes by T. F. Henderson. Portr. from Bust. 12mo. 6x34, pp. 326, 1s. 6d. net; lthr. 2s. 6d. net (Little Lib.) ……..METHUEN, Apr. 02",,,"Life of Mansie Wauch, Tailor in Dalkeith",METHUEN,,12mo.,"Life of Mansie Wauch, Tailor in Dalkeith. Written by Himself. With Intro. and Notes by T. F. Henderson. Portr. from Bust. 12mo. 6x34, pp. 326, 1s. 6d. net; lthr. 2s. 6d. net (Little Lib.) ……..METHUEN, Apr. 02",,,,Apr. 02,1902,
"Life of Queen Victoria (The Private). By one of Her Majesty's Servants. Illus. 17th thou. Cr. 8vo. 7 x 43, pp. 254, 2s. 6d. PEARSON, May 02",,,Life of Queen Victoria (The Private),PEARSON,2s. 6d.,8vo.,"Life of Queen Victoria (The Private). By one of Her Majesty's Servants. Illus. 17th thou. Cr. 8vo. 7 x 43, pp. 254, 2s. 6d. PEARSON, May 02",,,,May 02,1902,
"Life and Death (A Little Book of). Selected and arranged by Elizabeth Waterhouse. Front. from a Painting by G. F. Watts. 12mo. 6×3, pp. 298, 1s. 6d. net; lthr. 2s. 6d. net (Little Lib.) METHUEN, June 02",,,Selected and arranged by Elizabeth Waterhouse,METHUEN,2s. 6d.,12mo.,"Life and Death (A Little Book of). Selected and arranged by Elizabeth Waterhouse. Front. from a Painting by G. F. Watts. 12mo. 6×3, pp. 298, 1s. 6d. net; lthr. 2s. 6d. net (Little Lib.) METHUEN, June 02",,"['Life', 'Death (A Little Book of)']",,June 02,1902,net
"Life and Letters of Madame Elisabeth de France. Followed by the Journal of the Temple by Cléry, and the Narrative of Marie Thérèse de France, Duchess D'Angoulême. Translated by Katharine Prescott Wormeley. Illus. with Portraits from the Original. 8vo. 9 × 54, pp. 840, 21s. net HEINEMANN, Apr. 02",,,Life and Letters of Madame Elisabeth de France,HEINEMANN,21s.,8vo.,"Life and Letters of Madame Elisabeth de France. Followed by the Journal of the Temple by Cléry, and the Narrative of Marie Thérèse de France, Duchess D'Angoulême. Translated by Katharine Prescott Wormeley. Illus. with Portraits from the Original. 8vo. 9 × 54, pp. 840, 21s. net HEINEMANN, Apr. 02",,,,Apr. 02,1902,net
"Life and Love Letters of a Dwarf: Memoirs of the celebrated Dwarf, Joseph Boruwlaski; containing a Faithful and Curious Account of his Birth, Edu- cation, Marriage, and Reception in the Principal Courts of Europe. Written by Himself. Rev. and ed. by H. R. Heatley. Cr. 8vo. 74 × 41, pp. 194, 3s. 6d. net... ...ISBISTER, Nov. 02",,,"Life and Love Letters of a Dwarf: Memoirs of the celebrated Dwarf, Joseph Boruwlaski; containing a Faithful and Curious Account of his Birth, Edu- cation, Marriage, and Reception in the Principal Courts of Europe",ISBISTER,3s. 6d.,8vo.,"Life and Love Letters of a Dwarf: Memoirs of the celebrated Dwarf, Joseph Boruwlaski; containing a Faithful and Curious Account of his Birth, Edu- cation, Marriage, and Reception in the Principal Courts of Europe. Written by Himself. Rev. and ed. by H. R. Heatley. Cr. 8vo. 74 × 41, pp. 194, 3s. 6d. net... ...ISBISTER, Nov. 02",,,,Nov. 02,1902,net
"Recollections of a Royal Lindsay (Patricia) Parish. Illus. Cr. 8vo. 8x51, pp. 146, 78. 6d. net ..MURRAY, Dec. 02",,,Recollections of a Royal Lindsay (Patricia) Parish,MURRAY,6d.,8vo.,"Recollections of a Royal Lindsay (Patricia) Parish. Illus. Cr. 8vo. 8x51, pp. 146, 78. 6d. net ..MURRAY, Dec. 02",,,,Dec. 02,1902,net
"List of Schools and Tutors. (Aid to Parents in Selection of Schools.) 5th Annual ed. 1902-1903. Cr. 8vo. 74, pp. 714, 1s. J. & J. PATON, July 02",,,List of Schools and Tutors,J. & J. PATON,1s.,8vo.,"List of Schools and Tutors. (Aid to Parents in Selection of Schools.) 5th Annual ed. 1902-1903. Cr. 8vo. 74, pp. 714, 1s. J. & J. PATON, July 02",,,,July 02,1902,
"Literary Year-book and Bookman's Directory, 1902. Ed. by Herbert Morrah. Portr. of Sir Walter Besant. Cr. 8vo. 5s. net G. ALLEN, Mar. 02",,,Literary Year-book and Bookman's Directory,G. ALLEN,5s.,8vo.,"Literary Year-book and Bookman's Directory, 1902. Ed. by Herbert Morrah. Portr. of Sir Walter Besant. Cr. 8vo. 5s. net G. ALLEN, Mar. 02",,,,Mar. 02,1902,net
"Little Beast Book. By 1srafel. 8vo. 84 × 5, pp. 120, 2s. 6d. net ............UNICORN PRESS, Jan. 02",,,Little Beast Book,UNICORN PRESS,2s. 6d.,8vo.,"Little Beast Book. By Israfel. 8vo. 84 × 5, pp. 120, 2s. 6d. net ............UNICORN PRESS, Jan. 02",,,,Jan. 02,1902,net
"Little Bo-Peep Picture Book. Folio, 8s. 6d.; un- tearable, 5s. .DEAN, Dec. 02",,,Little Bo-Peep Picture Book,DEAN,5s.,,"Little Bo-Peep Picture Book. Folio, 8s. 6d.; un- tearable, 5s. .DEAN, Dec. 02",,,,Dec. 02,1902,
"Roy. 8vo. 5s.; bds. 3s. 6d. Little Folks. Vol. 5s. Little Folks. Vol. 56. Little Folks Animal Book. 4to. 5s. 28. CASSELL, June 02",,,Roy,CASSELL,,8vo.,"Roy. 8vo. 5s.; bds. 3s. 6d. Little Folks. Vol. 55. Little Folks. Vol. 56. Little Folks Animal Book. 4to. 5s. 28. CASSELL, June 02",,,,June 02,1902,
"Roy. 8vo. 5s.; bds. 8s. 6d. CASSELL, Oct. 02",,,Roy,CASSELL,8s. 6d.,8vo.,"Roy. 8vo. 5s.; bds. 8s. 6d. CASSELL, Oct. 02",,,,Oct. 02,1902,
"Little Folks Wonder Book. 4to. bds. 1s. WARNE, Sep. 02",,,Little Folks Wonder Book,WARNE,1s.,4to.,"Little Folks Wonder Book. 4to. bds. 1s. WARNE, Sep. 02",,,,Sep. 02,1902,
"Little Frolic Annual. Imp. 8vo. 8s. 6d. ; bds. ......J. F. SHAW, Sep. 02",,,Little Frolic Annual,J. F. SHAW,,8vo.,"Little Frolic Annual. Imp. 8vo. 8s. 6d. ; bds. ......J. F. SHAW, Sep. 02",,,,Sep. 02,1902,
"Little People at the Farm. 4to. bds. 8s. NISTER, Sep. 02",,,Little People at the Farm,NISTER,8s.,4to.,"Little People at the Farm. 4to. bds. 8s. NISTER, Sep. 02",,,,Sep. 02,1902,
"Little's Law of Burial. 3rd ed. 22s. 6d. BUTTERWORTH, Sep. 02",,,Little's Law of Burial,BUTTERWORTH,22s. 6d.,,"Little's Law of Burial. 3rd ed. 22s. 6d. BUTTERWORTH, Sep. 02",,,,Sep. 02,1902,
"Live Stock Journal Almanac, 1903. Roy. 8vo. 2s.; swd. 1s. ..VINTON, Dec. 02",,,Live Stock Journal Almanac,VINTON,1s.,8vo.,"Live Stock Journal Almanac, 1903. Roy. 8vo. 2s.; swd. 1s. ..VINTON, Dec. 02",,,,Dec. 02,1902,
"Liverpool Diocesan Sunday School Lesson Book for year beginning Advent 1902. Bds. 1s. net; Syllabus, ea. 100, 2s. net (Liverpool) BATES, Nov. 02",,,Liverpool Diocesan Sunday School Lesson Book for year beginning Advent,BATES,2s.,,"Liverpool Diocesan Sunday School Lesson Book for year beginning Advent 1902. Bds. 1s. net; Syllabus, ea. 100, 2s. net (Liverpool) BATES, Nov. 02",,,,Nov. 02,1902,net
"Liverpool School of Tropical Medicine Memoirs. V. Part 1: First Report of Campaign against Mosquitoes in Sierra Leone, 1901, by Major R. Ross. 8vo. 18. VII.: Report of Yellow Fever Expedition to Pará, 1900, by H. E. Durham and late Walter Myers. 4to. 7s. 6d. II.: Notes on Sanitary Conditions obtaining in Pará, by H. E. Durham and late Walter Myers, June 1900 to April 1901. 8vo. 1s. ...LONGMANS, Aug. 02",,,Liverpool School of Tropical Medicine Memoirs,LONGMANS,1s.,8vo.,"Liverpool School of Tropical Medicine Memoirs. V. Part 1: First Report of Campaign against Mosquitoes in Sierra Leone, 1901, by Major R. Ross. 8vo. 18. VII.: Report of Yellow Fever Expedition to Pará, 1900, by H. E. Durham and late Walter Myers. 4to. 7s. 6d. II.: Notes on Sanitary Conditions obtaining in Pará, by H. E. Durham and late Walter Myers, June 1900 to April 1901. 8vo. 1s. ...LONGMANS, Aug. 02",,,,Aug. 02,1902,
"Living Animals of the World: Popular Natural History. Vol. 2: Birds, Reptiles, Amphibians, &c. 4to. 11 × 83, pp. 396, 10s. 6d. net 18. ..... -- HUTCHINSON, July 02",,,Living Animals of the World: Popular Natural History,HUTCHINSON,,4to.,"Living Animals of the World: Popular Natural History. Vol. 2: Birds, Reptiles, Amphibians, &c. 4to. 11 × 83, pp. 396, 10s. 6d. net 18. ..... -- HUTCHINSON, July 02",,,,July 02,1902,
"Livy-Book 1. Ed. Allcroft. Intro., Text, Notes, red. 1s. 6d.; Vocab., Test Papers, red. 18.; Transl. red. 1s; ditto, in 1 vol. cr. 8vo. red. to 8s. (Univ. Tut. Series) .........CLIVE, June 02",,,Livy-Book 1,CLIVE,8s.,8vo.,"Livy-Book 1. Ed. Allcroft. Intro., Text, Notes, red. 1s. 6d.; Vocab., Test Papers, red. 18.; Transl. red. 1s; ditto, in 1 vol. cr. 8vo. red. to 8s. (Univ. Tut. Series) .........CLIVE, June 02",,,,June 02,1902,
"Livy-Book 21. Ed. by A. H. Allcroft and B. J. Hayes. Intro., Text, Notes. Cr. 8vo. pp. 164, 2s. 6d.; do. Vocab. 1s. 6d. (Univ. Tut. Series) CLIVE, May 02",,,Livy-Book,CLIVE,1s. 6d.,8vo.,"Livy-Book 21. Ed. by A. H. Allcroft and B. J. Hayes. Intro., Text, Notes. Cr. 8vo. pp. 164, 2s. 6d.; do. Vocab. 1s. 6d. (Univ. Tut. Series) CLIVE, May 02",,,,May 02,1902,
"Livy-Book 21. Vocab. and Test Papers, Interl. Cr. 8vo. pp. 82, swd. 1s. 6d. (Univ. Tut. Series) CLIVE, Apr. 02",,,Livy-Book,CLIVE,1s. 6d.,8vo.,"Livy-Book 21. Vocab. and Test Papers, Interl. Cr. 8vo. pp. 82, swd. 1s. 6d. (Univ. Tut. Series) CLIVE, Apr. 02",,,,Apr. 02,1902,
"Livy-Book 21. Ed. by A. H. Allcroft and B. J. Hayes. Intro., Text, Notes, Vocab., Test Papers, Trans. 1 vol. cr. 8vo. 74 × 44, pp. 266, 4s. 6d. (Üniv. Tut. Series). .CLIVE, May 02",,,Livy-Book,CLIVE,4s. 6d.,8vo.,"Livy-Book 21. Ed. by A. H. Allcroft and B. J. Hayes. Intro., Text, Notes, Vocab., Test Papers, Trans. 1 vol. cr. 8vo. 74 × 44, pp. 266, 4s. 6d. (Üniv. Tut. Series). .CLIVE, May 02",,,,May 02,1902,
"Livy-History of Rome, Books 5, 6. Trans. by J. Bernard Baker. Intro., Analysis, Notes, Special Map of Central Italy. Cr. 8vo. 7 × 4, 152, swd. 8s. net ..SIMPKIN, Nov. 02",,,"Livy-History of Rome, Books 5, 6",SIMPKIN,8s.,8vo.,"Livy-History of Rome, Books 5, 6. Trans. by J. Bernard Baker. Intro., Analysis, Notes, Special Map of Central Italy. Cr. 8vo. 7 × 4, 152, swd. 8s. net ..SIMPKIN, Nov. 02",,,,Nov. 02,1902,net
"Local Examination Test-Papers in English His- tory, June 1882 to July 1902. Arranged by J. S. Lindsey. 2 pts. Cr. 8vo. swd. ea. 8d. W. HEFFER, Nov. 02",,,"Local Examination Test-Papers in English His- tory, June",W. HEFFER,8d.,8vo.,"Local Examination Test-Papers in English His- tory, June 1882 to July 1902. Arranged by J. S. Lindsey. 2 pts. Cr. 8vo. swd. ea. 8d. W. HEFFER, Nov. 02",,,,Nov. 02,1902,
"Local Examination Test-Papers in English History: all Questions on this Subject set for Oxford and Cambridge Local Exams. (Senior and Junior), July 1882 to July 1902. Arranged (by permission of Authorities) according to Periods and Topics in 50 Test Papers by J. S. Lindsey. Compl. ed. cr. 8vo. swd. 1s. 6d. W. HEFFER, Nov. 02",,,Local Examination Test-Papers in English History: all Questions on this Subject set for Oxford and Cambridge Local Exams,W. HEFFER,1s. 6d.,8vo.,"Local Examination Test-Papers in English History: all Questions on this Subject set for Oxford and Cambridge Local Exams. (Senior and Junior), July 1882 to July 1902. Arranged (by permission of Authorities) according to Periods and Topics in 50 Test Papers by J. S. Lindsey. Compl. ed. cr. 8vo. swd. 1s. 6d. W. HEFFER, Nov. 02",,,,Nov. 02,1902,
"Lockwood's Builder's and Contractor's Price Book, 1902. Cr. 8vo. 4s. ......LOCKWOOD, Jan. 02",,,Lockwood's Builder's and Contractor's Price Book,LOCKWOOD,4s.,8vo.,"Lockwood's Builder's and Contractor's Price Book, 1902. Cr. 8vo. 4s. ......LOCKWOOD, Jan. 02",,,,Jan. 02,1902,
"London in 1902. Originally compiled by Herbert Fry; rev. and corrected to date. Cr. 8vo. swd. 1s. SIMPKIN, June 02",,,London in,SIMPKIN,1s.,8vo.,"London in 1902. Originally compiled by Herbert Fry; rev. and corrected to date. Cr. 8vo. swd. 1s. SIMPKIN, June 02",,,,June 02,1902,
"London in Pictures. Obl. 8vo. 1s. net SANDS, July 02",,,London in Pictures,SANDS,1s.,8vo.,"London in Pictures. Obl. 8vo. 1s. net SANDS, July 02",,,,July 02,1902,net
"London Manual, 1902. Cr. 8vo. 1s. 6d.; swd. 1s. E. LLOYD, Jan. 02",,,London Manual,E. LLOYD,1s.,8vo.,"London Manual, 1902. Cr. 8vo. 1s. 6d.; swd. 1s. E. LLOYD, Jan. 02",,,,Jan. 02,1902,
"London Mathematical Society Proceedings. Vl. 34. 8vo. 20s. ............HODGSON, Nov. 02",,,London Mathematical Society Proceedings,HODGSON,20s.,8vo.,"London Mathematical Society Proceedings. Vl. 34. 8vo. 20s. ............HODGSON, Nov. 02",,,,Nov. 02,1902,
"London Matriculation Directory, No. 82, con- taining Questions set June 1902, with Solutions by Tutors of University Correspondence College. Cr. 8vo. pp. 110, 1s. net (Univ. Tut. Series) CLIVE, July 02",,,London Matriculation Directory,CLIVE,1s.,8vo.,"London Matriculation Directory, No. 82, con- taining Questions set June 1902, with Solutions by Tutors of University Correspondence College. Cr. 8vo. pp. 110, 1s. net (Univ. Tut. Series) CLIVE, July 02",,,,July 02,1902,net
"London Matric. Directory, The. No. 88, Sept. 1902. Containing Papers set at London Matric. Sept. 1902, with Solutions. Cr. 8vo. pp. 164, swd. 1s. net (Univ. Tut. Ser.)W. B. CLIVE, Oct. 02",,,London Matric,W. B. CLIVE,1s.,8vo.,"London Matric. Directory, The. No. 88, Sept. 1902. Containing Papers set at London Matric. Sept. 1902, with Solutions. Cr. 8vo. pp. 164, swd. 1s. net (Univ. Tut. Ser.)W. B. CLIVE, Oct. 02",,,,Oct. 02,1902,net
"London Matriculation Test Papers in English History: Questions on this Subject set for Matriculation at London University, June 1888- Jan. 1902. Arranged according to Periods and Topics in 24 Test Papers by J. S. Lindsey. Cr. 8vo. swd. 8d. W. HEFFER, May 02",,,"London Matriculation Test Papers in English History: Questions on this Subject set for Matriculation at London University, June",W. HEFFER,8d.,8vo.,"London Matriculation Test Papers in English History: Questions on this Subject set for Matriculation at London University, June 1888- Jan. 1902. Arranged according to Periods and Topics in 24 Test Papers by J. S. Lindsey. Cr. 8vo. swd. 8d. W. HEFFER, May 02",,,,May 02,1902,
"London University Guide, 1902-8. Containing the Regulations for Examinations to be held in 1903 and 1904. Cr. 8vo. pp. 206, gratis (Univ. Corr. Coll.) ..........CLIVE, Dec. 02",,,London University Guide,CLIVE,,8vo.,"London University Guide, 1902-8. Containing the Regulations for Examinations to be held in 1903 and 1904. Cr. 8vo. pp. 206, gratis (Univ. Corr. Coll.) ..........CLIVE, Dec. 02",,,,Dec. 02,1902,
"London University Intermediate Mathematics, Guide to Intermediate Exams. in Arts and Science. 6th ed. cr. 8vo. pp. 120, swd. 2s. (Univ. Tut. Series). .CLIVE, Dec. 02",,,"London University Intermediate Mathematics, Guide to Intermediate Exams",CLIVE,2s.,8vo.,"London University Intermediate Mathematics, Guide to Intermediate Exams. in Arts and Science. 6th ed. cr. 8vo. pp. 120, swd. 2s. (Univ. Tut. Series). .CLIVE, Dec. 02",,,,Dec. 02,1902,
"London and Environs. New ed. 12mo. 6s. (Darlington's Handbooks) ......SIMPKIN, June 02",,,London and Environs,SIMPKIN,6s.,12mo.,"London and Environs. New ed. 12mo. 6s. (Darlington's Handbooks) ......SIMPKIN, June 02",,,,June 02,1902,
"London and South-Western Railway Official Guide. Cr. 8vo. 1s. 6d. ; swd. 1s. CASSELL, Jan. 02",,,London and South-Western Railway Official Guide,CASSELL,1s.,8vo.,"London and South-Western Railway Official Guide. Cr. 8vo. 1s. 6d. ; swd. 1s. CASSELL, Jan. 02",,,,Jan. 02,1902,
"Illus. by Charles 322, 7s. 6d. Long (W.J.)-Fowls of the Air. Copeland. Cr. 8vo. 8 x 54, pp. GINN, Nov. 02",,,,GINN,,8vo.,"Illus. by Charles 322, 7s. 6d. Long (W.J.)-Fowls of the Air. Copeland. Cr. 8vo. 8 x 54, pp. GINN, Nov. 02",,,,Nov. 02,1902,
"Longmans' Gazetteer of the World. Ed. by George G. Chisholm. Cheaper re-issue. Imp. 8vo. 18s. net; -mor. 21s. net LONGMANS, Aug. 02",,,Longmans' Gazetteer of the World,LONGMANS,21s.,8vo.,"Longmans' Gazetteer of the World. Ed. by George G. Chisholm. Cheaper re-issue. Imp. 8vo. 18s. net; -mor. 21s. net LONGMANS, Aug. 02",,,,Aug. 02,1902,net
"Love Poems of Herrick. 82mo. 1s. 6d. net; lthr. 28. net (Lover's Library) ..........LANE, Sep. 02",,,Love Poems of Herrick,LANE,,82mo.,"Love Poems of Herrick. 82mo. 1s. 6d. net; lthr. 28. net (Lover's Library) ..........LANE, Sep. 02",,,,Sep. 02,1902,
"Low (W. H.), Briggs (J.)-Matriculation English Course. Cr. 8vo. 74 × 44, pp. 336, 3s. 6d. ( Univ. Tut. Series).. ....CLIVE, Sep. 02",,,Matriculation English Course,CLIVE,3s. 6d.,8vo.,"Low (W. H.), Briggs (J.)-Matriculation English Course. Cr. 8vo. 74 × 44, pp. 336, 3s. 6d. ( Univ. Tut. Series).. ....CLIVE, Sep. 02",,"['Low (W. H.), Briggs (J.)']",,Sep. 02,1902,
"Lucian. Trans. by Augusta M. Campbell Davidson. Cr. 8vo. 5s. net... LONGMANS, Mar. 02",,,Lucian,LONGMANS,5s.,8vo.,"Lucian. Trans. by Augusta M. Campbell Davidson. Cr. 8vo. 5s. net... LONGMANS, Mar. 02",,,,Mar. 02,1902,net
"Lucian's True History. Transl. by F. Hickes. Illus. by W. Strang and others. Intro. by C. Whibley. 4to. 7s. 6d. net A. H. BULLEN, Nov. 02",,,Lucian's True History,A. H. BULLEN,7s. 6d.,4to.,"Lucian's True History. Transl. by F. Hickes. Illus. by W. Strang and others. Intro. by C. Whibley. 4to. 7s. 6d. net A. H. BULLEN, Nov. 02",,,,Nov. 02,1902,net
"Ludwig (A.), Lallemand (H.)-New English and French Vocabulary. Rev. ed. 18mo. 5 x 84, pp. 686, 2s. 6d. net (Hossfeld's Ser.) HIRSCHFELD, Oct. 02",,,New English and French Vocabulary,HIRSCHFELD,2s. 6d.,18mo.,"Ludwig (A.), Lallemand (H.)-New English and French Vocabulary. Rev. ed. 18mo. 5 x 84, pp. 686, 2s. 6d. net (Hossfeld's Ser.) HIRSCHFELD, Oct. 02",,"['Ludwig (A.), Lallemand (H.)']",,Oct. 02,1902,net
"Lysias Pro Mantitheo and Pro Invalido. Literally trans. by J. A. Prout. Cr. 8vo. swd. 18. 6d. (Kelly's Keys) J. CORNISH, Sep. 02",,,Lysias Pro Mantitheo and Pro Invalido,J. CORNISH,6d.,8vo.,"Lysias Pro Mantitheo and Pro Invalido. Literally trans. by J. A. Prout. Cr. 8vo. swd. 18. 6d. (Kelly's Keys) J. CORNISH, Sep. 02",,,,Sep. 02,1902,
"Macaulay-Essay on the Earl of Chatham. General Intro. to Study of Macaulay; Essay on Literary Characteristics. Ed. and Annotated by H. Wesley Dennis. Cr. 8vo. 18. 6d. LONGMANS, June 02",,,Macaulay-Essay on the Earl of Chatham,LONGMANS,6d.,8vo.,"Macaulay-Essay on the Earl of Chatham. General Intro. to Study of Macaulay; Essay on Literary Characteristics. Ed. and Annotated by H. Wesley Dennis. Cr. 8vo. 18. 6d. LONGMANS, June 02",,,,June 02,1902,
"McDonell's 19th Century Poetry. Cr. 8vo. adv. to 1s. 4d. .BLACK, Oct. 02",,,McDonell's,BLACK,1s. 4d.,8vo.,"McDonell's 19th Century Poetry. Cr. 8vo. adv. to 1s. 4d. .BLACK, Oct. 02",,,,Oct. 02,1902,
"Macfadden (B.), Oswald (F.)-Fasting, Hydro- pathy, Exercise: Nature's Wonderful Remedies for Cure of all Chronic and Acute Diseases. Cr. 8vo. 7 x 5, pp. 218, 4s. 6d. net MACFADDEN, Apr. 02",,,"Fasting, Hydro- pathy, Exercise: Nature's Wonderful Remedies for Cure of all Chronic and Acute Diseases",MACFADDEN,4s. 6d.,8vo.,"Macfadden (B.), Oswald (F.)-Fasting, Hydro- pathy, Exercise: Nature's Wonderful Remedies for Cure of all Chronic and Acute Diseases. Cr. 8vo. 7 x 5, pp. 218, 4s. 6d. net MACFADDEN, Apr. 02",,"['Macfadden (B.), Oswald (F.)']",,Apr. 02,1902,net
"Macmillan's Magazine. Vol. 8s. 8vo. 7s. 6d. ............ ...... MACMILLAN, Apr. 02",,,Macmillan's Magazine,MACMILLAN,7s. 6d.,8vo.,"Macmillan's Magazine. Vol. 85. 8vo. 7s. 6d. ............ ...... MACMILLAN, Apr. 02",,,,Apr. 02,1902,
"Macmillan's Magazine. Vol. 86. 8vo. 7s. 6d. MACMILLAN, Oct. 02",,,Macmillan's Magazine,MACMILLAN,7s. 6d.,8vo.,"Macmillan's Magazine. Vol. 86. 8vo. 7s. 6d. MACMILLAN, Oct. 02",,,,Oct. 02,1902,
