entry,last_name,first_name,title,publisher,price,format,original_entry,author_name,creators,is_editor,date,is_net
"Little People's Book of Fun. 4to. bds. 28. 6d. NISTER, Aug. 10",,,Little People's Book of Fun,NISTER,6d.,4to.,"Little People's Book of Fun. 4to. bds. 28. 6d. NISTER, Aug. 10",,,,Aug. 10,
"Live Stock Journal Almanac for 1911. Ryl. 8vo. 28., swd. is. ... VINTON, Dec. 10",,,Live Stock Journal Almanac for,VINTON,,8vo.,"Live Stock Journal Almanac for 1911. Ryl. 8vo. 28., swd. is. ... VINTON, Dec. 10",,,,Dec. 10,
"Liverpool School of Tropical Medicine : Annals of Tropical Medicine and Parasitology. (Amazon Yellow Fever Expedition.) Edit. by Professor R. Ross. 8vo. 101 X7, pp. 150, 1os. 6d. net LIVERPOOL UNIV. PRESS, July 10",,,Liverpool School of Tropical Medicine : Annals of Tropical Medicine and Parasitology,LIVERPOOL UNIV. PRESS,6d.,8vo.,"Liverpool School of Tropical Medicine : Annals of Tropical Medicine and Parasitology. (Amazon Yellow Fever Expedition.) Edit. by Professor R. Ross. 8vo. 101 X7, pp. 150, 1os. 6d. net LIVERPOOL UNIV. PRESS, July 10",,,,July 10,net
"Lloyd's Lawyer : Legal Advice for All. 8d., swd. 6d, net .E. LLOYD, Apr. 10",,,Lloyd's Lawyer : Legal Advice for All,E. LLOYD,6d.,,"Lloyd's Lawyer : Legal Advice for All. 8d., swd. 6d, net .E. LLOYD, Apr. 10",,,,Apr. 10,net
"Loaded Dice. Notes upon British and Foreign Trade and Industry. Being a Criticism of the Fiscal Blue Book presented to both Houses of Parliament and issued in November, 1909. 8vo. swd. id. VACHER, Jan. 10",,,Loaded Dice,VACHER,,8vo.,"Loaded Dice. Notes upon British and Foreign Trade and Industry. Being a Criticism of the Fiscal Blue Book presented to both Houses of Parliament and issued in November, 1909. 8vo. swd. id. VACHER, Jan. 10",,,,Jan. 10,
"Local Government Annual and Official Directory (The), 1910. Cr. 8vo. 2s. 60.  LOCAL GOVT. JOURNAL, Jan. 10",,,Local Government Annual and Official Directory (The),LOCAL GOVT. JOURNAL,,8vo.,"Local Government Annual and Official Directory (The), 1910. Cr. 8vo. 25. 60.  LOCAL GOVT. JOURNAL, Jan. 10",,,,Jan. 10,
"Local Government Board Report (Scotland), 1909, s. 8d. WYMAN, July 10",,,Local Government Board Report (Scotland),WYMAN,8d.,,"Local Government Board Report (Scotland), 1909, IS. 8d. WYMAN, July 10",,,,July 10,
"Local Government Board.—Report of the Medical Officer for 1908-9, 73. 3d.....WYMAN, Jan. 10",,,Local Government Board,WYMAN,3d.,,"Local Government Board.—Report of the Medical Officer for 1908-9, 73. 3d.....WYMAN, Jan. 10",,,,Jan. 10,
"Local Government Report for 1909-10, Part I., 39th issue, is, 3d. WYMAN, Sep. 10",,,Local Government Report for,WYMAN,3d.,,"Local Government Report for 1909-10, Part I., 39th issue, is, 3d. WYMAN, Sep. 10",,,,Sep. 10,
"Local Government Board-Report for 1909-10, Part 2, 2s. . WYMAN, Dec. 10",,,Local Government Board-Report for,WYMAN,2s.,,"Local Government Board-Report for 1909-10, Part 2, 2s. . WYMAN, Dec. 10",,,,Dec. 10,
"Local Government Board Report for Ireland, 1909-10, is. gd. .WYMAN, Sep. 10",,,Local Government Board Report for Ireland,WYMAN,,,"Local Government Board Report for Ireland, 1909-10, is. gd. .WYMAN, Sep. 10",,,,Sep. 10,
"Local Government Board.-Medical Officer's Report for 1909-10, 4s. . WYMAN, Dec. 10",,,Local Government Board,WYMAN,4s.,,"Local Government Board.-Medical Officer's Report for 1909-10, 4S. . WYMAN, Dec. 10",,,,Dec. 10,
"Local Government Directory (The), Almanac and Guide, 1910. Cr. 8vo. 74 X4, pp. 864, 8s. 6d. net..... .C. KNIGHT, Jan. 10",,,"Local Government Directory (The), Almanac and Guide",C. KNIGHT,8s. 6d.,8vo.,"Local Government Directory (The), Almanac and Guide, 1910. Cr. 8vo. 74 X4, pp. 864, 8s. 6d. net..... .C. KNIGHT, Jan. 10",,,,Jan. 10,net
"Local Government, 1908-9. Being a Supple- mentary Volume to “ The Encyclopædia of Local Government Law.” Ryl. 8vo. 25s. net BUTTERWORTH, Apr. 10",,,Local Government,BUTTERWORTH,25s.,8vo.,"Local Government, 1908-9. Being a Supple- mentary Volume to “ The Encyclopædia of Local Government Law.” Ryl. 8vo. 255. net BUTTERWORTH, Apr. 10",,,,Apr. 10,net
"Lock wood's Builder's, Architect's, Contractor's, and Engineer's Price Book, 1910. Cr. 8vo. 4s. C. LOCKWOOD, Jan. 10",,,"Lock wood's Builder's, Architect's, Contractor's, and Engineer's Price Book",C. LOCKWOOD,4s.,8vo.,"Lock wood's Builder's, Architect's, Contractor's, and Engineer's Price Book, 1910. Cr. 8vo. 4s. C. LOCKWOOD, Jan. 10",,,,Jan. 10,
"Locomotive Committee on Standard Locomotives for Indian Railways. Third Report (Engineer- ing Standards Committee, No. 50). Folio swd. 21s. net C. LOCKWOOD, Feb. 10",,,Locomotive Committee on Standard Locomotives for Indian Railways,C. LOCKWOOD,21s.,,"Locomotive Committee on Standard Locomotives for Indian Railways. Third Report (Engineer- ing Standards Committee, No. 50). Folio swd. 21S. net C. LOCKWOOD, Feb. 10",,,,Feb. 10,net
"Lodge's Peerage, Baronetage, Knightage and Companionage of the British Empire, 1911. Ryl. 8vo. 21s. net KELLY'S DIRECTORIES, Dec. 10",,,"Lodge's Peerage, Baronetage, Knightage and Companionage of the British Empire",KELLY'S DIRECTORIES,21s.,8vo.,"Lodge's Peerage, Baronetage, Knightage and Companionage of the British Empire, 1911. Ryl. 8vo. 215. net KELLY'S DIRECTORIES, Dec. 10",,,,Dec. 10,net
"Lombardy, Consular Report for 1909, 4d. WYMAN, Sep. 10",,,"Lombardy, Consular Report for",WYMAN,4d.,,"Lombardy, Consular Report for 1909, 4d. WYMAN, Sep. 10",,,,Sep. 10,
"London and North-Western Railway (The) Official Guide, 1910. Cr. 8vo. is. 6d. net CASSELL, July 10",,,London and North-Western Railway (The) Official Guide,CASSELL,6d.,8vo.,"London and North-Western Railway (The) Official Guide, 1910. Cr. 8vo. is. 6d. net CASSELL, July 10",,,,July 10,net
"London, Cassell's Ready Ref. Guide to, 6d. net May το London, Charities of, Low's Handb., 1910, is. July ro London Citizens in 1651 : being a Transcript of Harleian MS, 4,778. Edit., with Notes and Index, by J. C. and W. Whitebrook. 8vo. 91x7}, pp. 42, 2s. 6d. HUTCHINGS & ROMER, Jan. 10",,,"London, Cassell's Ready Ref",HUTCHINGS & ROMER,2s. 6d.,8vo.,"London, Cassell's Ready Ref. Guide to, 6d. net May το London, Charities of, Low's Handb., 1910, is. July ro London Citizens in 1651 : being a Transcript of Harleian MS, 4,778. Edit., with Notes and Index, by J. C. and W. Whitebrook. 8vo. 91x7}, pp. 42, 25. 6d. HUTCHINGS & ROMER, Jan. 10",,,,Jan. 10,
"London Citizen's Year Book (The), 1910. Rev. to June, 1910. Cr. 8vo. 71 X4*, pp. 340, 2s. net, swd. is, net ..G. ALLEN, Aug. 10",,,London Citizen's Year Book (The),G. ALLEN,,8vo.,"London Citizen's Year Book (The), 1910. Rev. to June, 1910. Cr. 8vo. 71 X4*, pp. 340, 25. net, swd. is, net ..G. ALLEN, Aug. 10",,,,Aug. 10,
"London County Council-Asylums, Report of the Committee for the Year ended March, 1909. 21st Annual. Diagrams, swd. 2s. P. S. KING, Nov. 10",,,"London County Council-Asylums, Report of the Committee for the Year ended March",P. S. KING,2s.,,"London County Council-Asylums, Report of the Committee for the Year ended March, 1909. 21st Annual. Diagrams, swd. 2s. P. S. KING, Nov. 10",,,,Nov. 10,
"London County Council --Attendances. Atten- dances of Members at Meetings of the Council and Committees, March, 1907, to December, 1909, swd. 60. ....P. S. KING, Mar. 10",,,London County Council --Attendances,P. S. KING,,,"London County Council --Attendances. Atten- dances of Members at Meetings of the Council and Committees, March, 1907, to December, 1909, swd. 60. ....P. S. KING, Mar. 10",,,,Mar. 10,
"London County Council-Child Labour. Juvenile Labour in Germany, and how it is being dealt with. Report by Miss Durham, Inspector of Women's Technical Classes, swd. 3d. P. S. KING, Aug. 10",,,London County Council-Child Labour,P. S. KING,3d.,,"London County Council-Child Labour. Juvenile Labour in Germany, and how it is being dealt with. Report by Miss Durham, Inspector of Women's Technical Classes, swd. 3d. P. S. KING, Aug. 10",,,,Aug. 10,
"London County Council-Clerkships, Minor Estab- lishment. Papers set at the Open Competitive Examination, September, 1909, swd. 6d. P. S. KING, Jan. 10",,,"London County Council-Clerkships, Minor Estab- lishment",P. S. KING,6d.,,"London County Council-Clerkships, Minor Estab- lishment. Papers set at the Open Competitive Examination, September, 1909, swd. 6d. P. S. KING, Jan. 10",,,,Jan. 10,
"London County Council-Consumption. Pul- monary Tuberculosis. Report by Dr. Wanklyn as to the Action taken by London Sanitary Authorities with regard to cases of Pulmonary Tuberculosis, swd. 60... ........P. S. KING, Nov. 10",,,London County Council-Consumption,P. S. KING,,,"London County Council-Consumption. Pul- monary Tuberculosis. Report by Dr. Wanklyn as to the Action taken by London Sanitary Authorities with regard to cases of Pulmonary Tuberculosis, swd. 60... ........P. S. KING, Nov. 10",,,,Nov. 10,
"Return showing for each London Local Authority the net debt outstanding and the Annual Charge on the Rates, particulars of services for which the loan was raised, &c., swd. 4d. P. S. KING, Apr. 10",,,"Return showing for each London Local Authority the net debt outstanding and the Annual Charge on the Rates, particulars of services for which the loan was raised, &c",P. S. KING,4d.,,"Return showing for each London Local Authority the net debt outstanding and the Annual Charge on the Rates, particulars of services for which the loan was raised, &c., swd. 4d. P. S. KING, Apr. 10",,,,Apr. 10,
"London County Council.—Dentistry. School Dentistry in Germany. Report by the Educa. tion Officer. Illus. swd. 6d. ..S. KING, Aug. 10",,,London County Council,S. KING,6d.,,"London County Council.—Dentistry. School Dentistry in Germany. Report by the Educa. tion Officer. Illus. swd. 6d. ..S. KING, Aug. 10",,,,Aug. 10,
"London County Council. -Education. Accommo- dation and Attendance in Elementary Schools. Report of Education Officer for 1908-09, with Supplement, 6s. .....P. S. KING, May 10",,,London County Council,P. S. KING,6s.,,"London County Council. -Education. Accommo- dation and Attendance in Elementary Schools. Report of Education Officer for 1908-09, with Supplement, 6s. .....P. S. KING, May 10",,,,May 10,
"London County Council-Education. Conference of Teachers, 1910. Report of Proceedings, swd. 1s. 60. ... ..P. S. KING, Apr. 10",,,London County Council-Education,P. S. KING,,,"London County Council-Education. Conference of Teachers, 1910. Report of Proceedings, swd. Is. 60. ... ..P. S. KING, Apr. 10",,,,Apr. 10,
"London County Council-Education. Elementary Education. Report of the Education Officer for 1908-09, with Charts, swd. is. 6d. P. S. KING, May 10",,,London County Council-Education,P. S. KING,6d.,,"London County Council-Education. Elementary Education. Report of the Education Officer for 1908-09, with Charts, swd. is. 6d. P. S. KING, May 10",,,,May 10,
"London County Council-Education. Higher Education. Report of the Iiducation Officer for 1908-09 swd. od. ...P. S. KING, Apr. 10",,,London County Council-Education,P. S. KING,,,"London County Council-Education. Higher Education. Report of the Iiducation Officer for 1908-09 swd. od. ...P. S. KING, Apr. 10",,,,Apr. 10,
"London County Council.-Education. Provision of Meals for Necessitous Children and the Work of Children's Care Committees. Report of the Education Officer for 1908-09 swd. is. P. S. KING, Apr. 10",,,London County Council,P. S. KING,,,"London County Council.-Education. Provision of Meals for Necessitous Children and the Work of Children's Care Committees. Report of the Education Officer for 1908-09 swd. is. P. S. KING, Apr. 10",,,,Apr. 10,
"London County Council--Education. Report of the Medical Officer (Education) for the year ended December 31st, 1909. Illus and Dia. grams, swd. is, 6d. P. S. KING, Sep. 10",,,London County Council--Education,P. S. KING,6d.,,"London County Council--Education. Report of the Medical Officer (Education) for the year ended December 31st, 1909. Illus and Dia. grams, swd. is, 6d. P. S. KING, Sep. 10",,,,Sep. 10,
"London County Council-Education Special Schools and Industrial Schools. Report of the Education Officer for 1908-09, swd. 1s. P. S. KING, Apr. 10",,,London County Council-Education Special Schools and Industrial Schools,P. S. KING,1s.,,"London County Council-Education Special Schools and Industrial Schools. Report of the Education Officer for 1908-09, swd. Is. P. S. KING, Apr. 10",,,,Apr. 10,
"London County Council-Education.. Schemes of Instruction in First Aid, Home Nursing, Health and Infant Care. Evening Schools, Session 1910-11, swd. 2d. ..P. S. KING, Oct. 10",,,London County Council-Education,P. S. KING,2d.,,"London County Council-Education.. Schemes of Instruction in First Aid, Home Nursing, Health and Infant Care. Evening Schools, Session 1910-11, swd. 2d. ..P. S. KING, Oct. 10",,,,Oct. 10,
"London County Council-Education. Scholarships and Training of Teachers Handbook, Session 1910-11, swd. id. P. S. KING, Oct. 10",,,London County Council-Education,P. S. KING,,,"London County Council-Education. Scholarships and Training of Teachers Handbook, Session 1910-11, swd. id. P. S. KING, Oct. 10",,,,Oct. 10,
"London County Council-Elections. General Elec- tion of County Councillors, 1910. Return Showing Number of Electors, Number Voting, &c. swd. id. .P. S. KING, May 10",,,London County Council-Elections,P. S. KING,,,"London County Council-Elections. General Elec- tion of County Councillors, 1910. Return Showing Number of Electors, Number Voting, &c. swd. id. .P. S. KING, May 10",,,,May 10,
"London County Council-Elections. List of Deputy Returning Officers for the Purposes of the General Election of County Councillors on Saturday, March 5th, 1910, swd. id. P. S. KING, Mar. 10",,,London County Council-Elections,P. S. KING,,,"London County Council-Elections. List of Deputy Returning Officers for the Purposes of the General Election of County Councillors on Saturday, March 5th, 1910, swd. id. P. S. KING, Mar. 10",,,,Mar. 10,
"London County Council-Elections, Borough. Metropolitan Borough Council Elections, 1909. Return of number of Voters on the Register and the number voting, swd. 2d. P. S. KING, Jan. 10",,,"London County Council-Elections, Borough",P. S. KING,2d.,,"London County Council-Elections, Borough. Metropolitan Borough Council Elections, 1909. Return of number of Voters on the Register and the number voting, swd. 2d. P. S. KING, Jan. 10",,,,Jan. 10,
"London County Council-Electricity Supply Undertakings of the Borough Councils and Companies in London : Analysis of Accounts for the year 1908-9, with Statistics relating to the Capacity, Output, Average, Prices, &c., swd. is. P. S. KING, Apr. 10",,,London County Council-Electricity Supply Undertakings of the Borough Councils and Companies in London : Analysis of Accounts for the year,P. S. KING,,,"London County Council-Electricity Supply Undertakings of the Borough Councils and Companies in London : Analysis of Accounts for the year 1908-9, with Statistics relating to the Capacity, Output, Average, Prices, &c., swd. is. P. S. KING, Apr. 10",,,,Apr. 10,
"London County Council-Estimates. Annual Es- timates of the Capital Expenditure by the Council and of the Loans to be advanced by the Council during the year 1910-11, swd. is. P. S. KING, Aug. 10",,,London County Council-Estimates,P. S. KING,,,"London County Council-Estimates. Annual Es- timates of the Capital Expenditure by the Council and of the Loans to be advanced by the Council during the year 1910-11, swd. is. P. S. KING, Aug. 10",,,,Aug. 10,
"London County Council-1stimates. Annual Es- timates of the Receipts and Expenses for the Year 1910-11, swd. is. ....P. S. KING, Sep. 10",,,London County Council,P. S. KING,,,"London County Council-Istimates. Annual Es- timates of the Receipts and Expenses for the Year 1910-11, swd. is. ....P. S. KING, Sep. 10",,,,Sep. 10,
"London County Council-Finance. Abstract of the Receipts and Expenditure of the London County Council and of the Asylums Committee for each year from 1899-1900 to 1908-1909, swd. 6d. ......P. S. KING, Aug. 10",,,London County Council-Finance,P. S. KING,6d.,,"London County Council-Finance. Abstract of the Receipts and Expenditure of the London County Council and of the Asylums Committee for each year from 1899-1900 to 1908-1909, swd. 6d. ......P. S. KING, Aug. 10",,,,Aug. 10,
"London County Council-Fire Brigade. Report o the Chief Officer on the Fires in London and the work of the Brigade during the year, 1909. Maps, swd. is. .....P. S. KING, May. 10",,,London County Council-Fire Brigade,P. S. KING,,,"London County Council-Fire Brigade. Report o the Chief Officer on the Fires in London and the work of the Brigade during the year, 1909. Maps, swd. is. .....P. S. KING, May. 10",,,,May. 10,
"London County Council General Powers Act, 1910, is. 9d. WYMAN, Sep. 10",,,London County Council General Powers Act,WYMAN,9d.,,"London County Council General Powers Act, 1910, is. 9d. WYMAN, Sep. 10",,,,Sep. 10,
"London County Council-Handbook of the Work of the L.C.C. Report of the Council for the year 1908-09. Prepared by the Clerk of the Council. 8vo. swd, is. ....P. S. KING, Aug. 10",,,London County Council-Handbook of the Work of the L.C.C. Report of the Council for the year,P. S. KING,,8vo.,"London County Council-Handbook of the Work of the L.C.C. Report of the Council for the year 1908-09. Prepared by the Clerk of the Council. 8vo. swd, is. ....P. S. KING, Aug. 10",,,,Aug. 10,
"London County Council-Homeless Persons, Result of a Census of, taken on the Night of February 18th, 1910, with Report by the Medi- cal Officer, swd. 2d. ....P. S. KING, Aug. 10",,,"London County Council-Homeless Persons, Result of a Census of, taken on the Night of February",P. S. KING,2d.,,"London County Council-Homeless Persons, Result of a Census of, taken on the Night of February 18th, 1910, with Report by the Medi- cal Officer, swd. 2d. ....P. S. KING, Aug. 10",,,,Aug. 10,
"London County Council-Housing. Working Class Dwellings. Accounts for 1909-10, with Memor- andum, swd. 6d. ; Tables showing Accommo- dation, Rents, Tenants, and other particulars relating to the Council's Dwellings, 1909-10, swd. 6d. P. S. KING, Aug. 10",,,London County Council-Housing,P. S. KING,6d.,,"London County Council-Housing. Working Class Dwellings. Accounts for 1909-10, with Memor- andum, swd. 6d. ; Tables showing Accommo- dation, Rents, Tenants, and other particulars relating to the Council's Dwellings, 1909-10, swd. 6d. P. S. KING, Aug. 10",,,,Aug. 10,
"London County Council-Lodging Houses. By- laws as to Seaman's, December, 1909, swd. id. P. S. KING, Mar. 10",,,London County Council-Lodging Houses,P. S. KING,,,"London County Council-Lodging Houses. By- laws as to Seaman's, December, 1909, swd. id. P. S. KING, Mar. 10",,,,Mar. 10,
"London County Council-London Statistics. Vol. 20. 1909–10. Maps and Diagrams. 8vo., pp. 592 (cloth), 5s. ......P. S. KING, Nov. 10",,,London County Council-London Statistics,P. S. KING,5s.,8vo.,"London County Council-London Statistics. Vol. 20. 1909–10. Maps and Diagrams. 8vo., pp. 592 (cloth), 5s. ......P. S. KING, Nov. 10",,,,Nov. 10,
"London County Council - Members. List of Alder- inen and Councillors, with their Addresses. March, 1910, swd. id. ......P.S. KING, Apr. 10",,,London County Council - Members,P.S. KING,,,"London County Council - Members. List of Alder- inen and Councillors, with their Addresses. March, 1910, swd. id. ......P.S. KING, Apr. 10",,,,Apr. 10,
"London County Council-Memorials, Outdoor, in London, other than Statues on the Exterior of Buildings, Memorials in the Nature of Tombstones, Memorial Buildings and Memorial Trees. Prepared by the Clerk of the London County Council. Illus, swd. 1s. 6d. P. S. KING, Nov. 10",,,"London County Council-Memorials, Outdoor, in London, other than Statues on the Exterior of Buildings, Memorials in the Nature of Tombstones, Memorial Buildings and Memorial Trees",P. S. KING,1s. 6d.,,"London County Council-Memorials, Outdoor, in London, other than Statues on the Exterior of Buildings, Memorials in the Nature of Tombstones, Memorial Buildings and Memorial Trees. Prepared by the Clerk of the London County Council. Illus, swd. Is. 6d. P. S. KING, Nov. 10",,,,Nov. 10,
"London County Council-Rates. County Rate Analysis, 1909-10, with Comparison with Rates levied in previous years. swd. 2d. P. S. KING, Apr. 10",,,London County Council-Rates,P. S. KING,2d.,,"London County Council-Rates. County Rate Analysis, 1909-10, with Comparison with Rates levied in previous years. swd. 2d. P. S. KING, Apr. 10",,,,Apr. 10,
"London County Council-Rates. Return of Rates made, 1909-10, swd. 6d.; Return of Rate Collection, 1907-08, swd. 3d. ; Equalisa- tion Fund, 1910-11. Statement for Half-year ending September 30th, 1910, swd. 30. P. S. KING, Aug. 10",,,London County Council-Rates,P. S. KING,,,"London County Council-Rates. Return of Rates made, 1909-10, swd. 6d.; Return of Rate Collection, 1907-08, swd. 3d. ; Equalisa- tion Fund, 1910-11. Statement for Half-year ending September 30th, 1910, swd. 30. P. S. KING, Aug. 10",,,,Aug. 10,
"London County Council Return, 2d. WYMAN, July 10",,,London County Council Return,WYMAN,2d.,,"London County Council Return, 2d. WYMAN, July 10",,,,July 10,
"London County Council-Sewer Commission. Court Minutes of the Surrey and Kent Sewer Commission. Vol. 1. (Cloth), 5s. P. S. KING, Apr. 10",,,London County Council-Sewer Commission,P. S. KING,5s.,,"London County Council-Sewer Commission. Court Minutes of the Surrey and Kent Sewer Commission. Vol. 1. (Cloth), 5s. P. S. KING, Apr. 10",,,,Apr. 10,
"London County Council-Standing Orders of the Council and References to Conimittees. Rev. to 31st December, 1909, swd. is. P. S. KING, Apr. 10",,,London County Council-Standing Orders of the Council and References to Conimittees,P. S. KING,,,"London County Council-Standing Orders of the Council and References to Conimittees. Rev. to 31st December, 1909, swd. is. P. S. KING, Apr. 10",,,,Apr. 10,
"London County Council—Statistical Abstract for London for the year 1909. Vol. 12. P. S. KING, Apr. 10",,,London County Council—Statistical Abstract for London for the year,P. S. KING,,,"London County Council—Statistical Abstract for London for the year 1909. Vol. 12. P. S. KING, Apr. 10",,,,Apr. 10,
"London County Council-Streets. Supplement to the List of Names of Streets and Places in the Administrative County of London, containing Additions and Alterations for 1909, swd, 2d. P. S. KING, May 10",,,London County Council-Streets,P. S. KING,2d.,,"London County Council-Streets. Supplement to the List of Names of Streets and Places in the Administrative County of London, containing Additions and Alterations for 1909, swd, 2d. P. S. KING, May 10",,,,May 10,
"London County Council-Superannuation and Provident Fund, Amended Scheme, March 1, 1910, swd. id. ..........P. S. KING, Apr. 10",,,"London County Council-Superannuation and Provident Fund, Amended Scheme, March 1",P. S. KING,,,"London County Council-Superannuation and Provident Fund, Amended Scheme, March 1, 1910, swd. id. ..........P. S. KING, Apr. 10",,,,Apr. 10,
"London County Council—Tooting Bec Manor, Court Rolls of. Vol. 1. 5s. P. S. KING, Apr. 10",,,"London County Council—Tooting Bec Manor, Court Rolls of",P. S. KING,5s.,,"London County Council—Tooting Bec Manor, Court Rolls of. Vol. 1. 55. P. S. KING, Apr. 10",,,,Apr. 10,
"London County Council-Tramways Accounts for 1909-10, with Report by the Chief Officer of Tramways, swd. is. ..P. S. KING, Aug. 10",,,London County Council-Tramways Accounts for,P. S. KING,,,"London County Council-Tramways Accounts for 1909-10, with Report by the Chief Officer of Tramways, swd. is. ..P. S. KING, Aug. 10",,,,Aug. 10,
"London County Council ---Valuation (County of London) in force on April 6, 1910, swd. id. P. S. KING, Mar. 10",,,London County Council ---Valuation (County of London) in force on April 6,P. S. KING,,,"London County Council ---Valuation (County of London) in force on April 6, 1910, swd. id. P. S. KING, Mar. 10",,,,Mar. 10,
"London County Council-Workmen's Trains and Trams, Quarterly Time Table and Guide to, with Particulars of the L.C.C.'s Dwellings for Workmen, Trade Schools and Evening Classes, swd. id. .P. S. KING, Jan. 10",,,"London County Council-Workmen's Trains and Trams, Quarterly Time Table and Guide to, with Particulars of the L.C.C.'s Dwellings for Workmen, Trade Schools and Evening Classes, swd",P. S. KING,,,"London County Council-Workmen's Trains and Trams, Quarterly Time Table and Guide to, with Particulars of the L.C.C.'s Dwellings for Workmen, Trade Schools and Evening Classes, swd. id. .P. S. KING, Jan. 10",,,,Jan. 10,
"London County Council-Works Department. Return of the Principal Works executed by the Council between November, 1892, and Septem- ber, 1907, swd. is. ........P. S. KING, Jan. 10",,,London County Council-Works Department,P. S. KING,,,"London County Council-Works Department. Return of the Principal Works executed by the Council between November, 1892, and Septem- ber, 1907, swd. is. ........P. S. KING, Jan. 10",,,,Jan. 10,
"London Diocese Book for 1910. Edit. by the Rev. Prebendary Glendinning Nash. 8vo. 7} X5, pp. 362, 1s. 6d. net ..S.P.C.K., Feb. 10",,,London Diocese Book for,S.P.C.K.,1s. 6d.,8vo.,"London Diocese Book for 1910. Edit. by the Rev. Prebendary Glendinning Nash. 8vo. 7} X5, pp. 362, Is. 6d. net ..S.P.C.K., Feb. 10",,,,Feb. 10,net
"London Gazette. Daily. Ea, is. WYMAN, Oct. 10",,,London Gazette,WYMAN,,,"London Gazette. Daily. Ea, is. WYMAN, Oct. 10",,,,Oct. 10,
"London in 1910. Originally compiled by the late Herbert Fry. Rev. and brought up to date. Cr. 8vo. swd. s. . SIMPKIN, June 10",,,London in,SIMPKIN,,8vo.,"London in 1910. Originally compiled by the late Herbert Fry. Rev. and brought up to date. Cr. 8vo. swd. IS. . SIMPKIN, June 10",,,,June 10,
