entry,last_name,first_name,title,publisher,price,format,original_entry,author_name,creators,is_editor,date,catalogue_year,is_net
"Day by Day of the Christian Year: Daily Readings in Words of Revised Version of Holy Scripture, following the Seasons of the Christian Year. 18mo. 5 × 83, pp. 446, 2s. .........FROWDE, Dec. 02",,,"Day by Day of the Christian Year: Daily Readings in Words of Revised Version of Holy Scripture, following the Seasons of the Christian Year",FROWDE,2s.,18mo.,"Day by Day of the Christian Year: Daily Readings in Words of Revised Version of Holy Scripture, following the Seasons of the Christian Year. 18mo. 5 × 83, pp. 446, 2s. .........FROWDE, Dec. 02",,,,Dec. 02,1902,
"Day of Days. 1902 Vol. Roy. 8vo. 2s. OFFICE, Dec. 02",,,Day of Days,OFFICE,2s.,8vo.,"Day of Days. 1902 Vol. Roy. 8vo. 2s. OFFICE, Dec. 02",,,,Dec. 02,1902,
"Deaf, Teaching the use of Voice by the, Amman ...Nov. 73 (John Conrad) 58. 6d. Deakin (R.)-Matriculation Algebra: being the Tutorial Algebra, Elem. Course. 2nd ed. cr. 8vo. 74 × 43, pp. 464, 8s. 6d. (Univ. Tut. Series) ............. CLIVE, Sep. 02",,,"Deaf, Teaching the use of Voice by the, Amman ",CLIVE,8s. 6d.,8vo.,"Deaf, Teaching the use of Voice by the, Amman ...Nov. 73 (John Conrad) 58. 6d. Deakin (R.)-Matriculation Algebra: being the Tutorial Algebra, Elem. Course. 2nd ed. cr. 8vo. 74 × 43, pp. 464, 8s. 6d. (Univ. Tut. Series) ............. CLIVE, Sep. 02",,,,Sep. 02,1902,
"Debrett's Baronetage, Knightage, and Com- panionage, 1903. 8vo. 16s. 6d. net DEAN, Dec. 02",,,"Debrett's Baronetage, Knightage, and Com- panionage",DEAN,16s. 6d.,8vo.,"Debrett's Baronetage, Knightage, and Com- panionage, 1903. 8vo. 16s. 6d. net DEAN, Dec. 02",,,,Dec. 02,1902,net
"Debrett's Coming Events: Monthly Calendar of Social Fixtures &c. August 1902. 8vo. swd. 6d. DEAN, Aug. 02",,,Debrett's Coming Events: Monthly Calendar of Social Fixtures &c,DEAN,6d.,8vo.,"Debrett's Coming Events: Monthly Calendar of Social Fixtures &c. August 1902. 8vo. swd. 6d. DEAN, Aug. 02",,,,Aug. 02,1902,
"Debrett's House of Commons and the Judicial Bench, 1902. 8vo. 7s. 6d. ............DEAN, Jan. 02",,,Debrett's House of Commons and the Judicial Bench,DEAN,7s. 6d.,8vo.,"Debrett's House of Commons and the Judicial Bench, 1902. 8vo. 7s. 6d. ............DEAN, Jan. 02",,,,Jan. 02,1902,
"Debrett's Peerage and Titles of Courtesy, 1908. 8vo. 16s. 6d. net.. ............DEAN, Dec. 02",,,Debrett's Peerage and Titles of Courtesy,DEAN,16s. 6d.,8vo.,"Debrett's Peerage and Titles of Courtesy, 1908. 8vo. 16s. 6d. net.. ............DEAN, Dec. 02",,,,Dec. 02,1902,net
"Debrett's Peerage, Baronetage, Knightage, and Companionage, 1903. Roy. 8vo. 31s. 6d. net DEAN, Dec. 02",,,"Debrett's Peerage, Baronetage, Knightage, and Companionage",DEAN,31s. 6d.,8vo.,"Debrett's Peerage, Baronetage, Knightage, and Companionage, 1903. Roy. 8vo. 31s. 6d. net DEAN, Dec. 02",,,,Dec. 02,1902,net
"Decadents, a Novel, by H. A. B., 3s. 6d... Decay of London's Fire Brigade: Plea for Public Safety. By Phoenix. Cr. 8vo. 7 × 41, pp. 64, 1s. net .HEINEMANN, Oct. 02",,,"Decadents, a Novel, by H. A. B.",HEINEMANN,1s.,8vo.,"Decadents, a Novel, by H. A. B., 3s. 6d... Decay of London's Fire Brigade: Plea for Public Safety. By Phoenix. Cr. 8vo. 7 × 41, pp. 64, 1s. net .HEINEMANN, Oct. 02",,,,Oct. 02,1902,net
"Delafield (F.), Prudden (T. M.)-Handbook of Intro. Pathological Anatomy and Histology. Section on Post Mortem Examinations and Me- thods of Preserving and Examining Diseased Tissues. 6th ed. roy. 8vo. 9 × 6, pp. 840, 218. ..BAILLIÈRE, Jan. 02",,,Handbook of Intro,BAILLIÈRE,,8vo.,"Delafield (F.), Prudden (T. M.)-Handbook of Intro. Pathological Anatomy and Histology. Section on Post Mortem Examinations and Me- thods of Preserving and Examining Diseased Tissues. 6th ed. roy. 8vo. 9 × 6, pp. 840, 218. ..BAILLIÈRE, Jan. 02",,"['Delafield (F.), Prudden (T. M.)']",,Jan. 02,1902,
"De La More Booklets. 6 in case, 3s. net. Ditto, 8 in case, 1s. 6d. net ...MORING, Dec. 02",,,De La More Booklets,MORING,1s. 6d.,,"De La More Booklets. 6 in case, 3s. net. Ditto, 8 in case, 1s. 6d. net ...MORING, Dec. 02",,,,Dec. 02,1902,net
"Nineteen Thousand .WARD, LOCK, July 02",,,Nineteen Thousand ,"WARD, LOCK",,,"Nineteen Thousand .WARD, LOCK, July 02",,,,July 02,1902,
"Delhi-1857, the Siege, Assault, and Capture as given in Diary and Correspondence of late Col. Keith Young, C.B., Judge Advocate General, Bengal. Ed. by Gen. Sir Henry Wylie Norman, G.C.B., and Miss Keith Young. With Memoir and Intro. by Sir Henry Wylie Norman. Illus., Maps. Roy. 8vo. 94 × 6, pp. 398, 218. net net CHAMBERS, May 02",,,Delhi,CHAMBERS,,8vo.,"Delhi-1857, the Siege, Assault, and Capture as given in Diary and Correspondence of late Col. Keith Young, C.B., Judge Advocate General, Bengal. Ed. by Gen. Sir Henry Wylie Norman, G.C.B., and Miss Keith Young. With Memoir and Intro. by Sir Henry Wylie Norman. Illus., Maps. Roy. 8vo. 94 × 6, pp. 398, 218. net net CHAMBERS, May 02",,,,May 02,1902,
"Denney (E. E.), Roberts (P. Lyddon)-Teachers' Certificate Guide, 1903. Cr. 8vo. swd. 3d. net (Normal Tutorial Series) ......SIMPKIN, May 02",,,Teachers' Certificate Guide,SIMPKIN,3d.,8vo.,"Denney (E. E.), Roberts (P. Lyddon)-Teachers' Certificate Guide, 1903. Cr. 8vo. swd. 3d. net (Normal Tutorial Series) ......SIMPKIN, May 02",,"['Denney (E. E.), Roberts (P. Lyddon)']",,May 02,1902,net
"Dermatological Society of Great Britain and Ireland-Transactions. Vol. 8. Roy. 8vo, 5s. H. K. LEWIS, Nov. 02",,,Dermatological Society of Great Britain and Ireland-Transactions,H. K. LEWIS,5s.,"8vo,","Dermatological Society of Great Britain and Ireland-Transactions. Vol. 8. Roy. 8vo, 5s. H. K. LEWIS, Nov. 02",,,,Nov. 02,1902,
"Diary of a Soul in the Year 1901. Cr. 8vo. 72 × 51, pp. 186, 2s. 6d. net .......... STOCKWELL, June 02",,,Diary of a Soul in the Year,STOCKWELL,2s. 6d.,8vo.,"Diary of a Soul in the Year 1901. Cr. 8vo. 72 × 51, pp. 186, 2s. 6d. net .......... STOCKWELL, June 02",,,,June 02,1902,net
"Diary (The Clergyman's Ready Reference), 1908. 12mo. 2s. 6d. ..BEMROSE, Nov. 02",,,Diary (The Clergyman's Ready Reference),BEMROSE,2s. 6d.,12mo.,"Diary (The Clergyman's Ready Reference), 1908. 12mo. 2s. 6d. ..BEMROSE, Nov. 02",,,,Nov. 02,1902,
"Diary and Correspondence of Count Axel Fersen, Grand-Marshal of Sweden, relating to the Court of France. Trans. by Katharine Prescott Wormeley. 8vo. 91 × 52, pp. 366, 21s. net HEINEMANN, July 02",,,"Diary and Correspondence of Count Axel Fersen, Grand-Marshal of Sweden, relating to the Court of France",HEINEMANN,21s.,8vo.,"Diary and Correspondence of Count Axel Fersen, Grand-Marshal of Sweden, relating to the Court of France. Trans. by Katharine Prescott Wormeley. 8vo. 91 × 52, pp. 366, 21s. net HEINEMANN, July 02",,,,July 02,1902,net
"Diary and Scientific Handbook for 1903. 8vo. bds. 3s. net......... KNOWLEDGE' OFFICE, Dec. 02",,,Diary and Scientific Handbook for,KNOWLEDGE' OFFICE,3s.,8vo.,"Diary and Scientific Handbook for 1903. 8vo. bds. 3s. net......... KNOWLEDGE' OFFICE, Dec. 02",,,,Dec. 02,1902,net
"Carol. Illus. by Dickens (C.)-A Christmas F. S. Coburn. 18mo. Ithr. 2s. 6d. net PUTNAM, Nov. 02",,,Carol,PUTNAM,2s. 6d.,18mo.,"Carol. Illus. by Dickens (C.)-A Christmas F. S. Coburn. 18mo. Ithr. 2s. 6d. net PUTNAM, Nov. 02",,,,Nov. 02,1902,net
"Dickens C.)-Cricket on the Hearth. illus. by F. S. Coburn. 18mo. lthr. 2s. 6d. net PUTNAM, Nov. 02",,,Dickens C.)-Cricket on the Hearth,PUTNAM,2s. 6d.,18mo.,"Dickens C.)-Cricket on the Hearth. illus. by F. S. Coburn. 18mo. lthr. 2s. 6d. net PUTNAM, Nov. 02",,,,Nov. 02,1902,net
"Dickens(C.)-Life and Adventures of Nicholas Nickleby. 89 Illus. by Phiz, and Portrait of Author. Oxford India paper ed. cr. 8vo. 7 x 4, pp. 960, 2s. 6d. net; leather, 3s. 6d. net CHAPMAN, Jan. 02",,,Dickens(C.)-Life and Adventures of Nicholas Nickleby,CHAPMAN,3s. 6d.,8vo.,"Dickens(C.)-Life and Adventures of Nicholas Nickleby. 89 Illus. by Phiz, and Portrait of Author. Oxford India paper ed. cr. 8vo. 7 x 4, pp. 960, 2s. 6d. net; leather, 3s. 6d. net CHAPMAN, Jan. 02",,,,Jan. 02,1902,net
"Dickens Birthday Book. 12 Coloured Illus. 16mo. 3s....... ...TUCK, Oct. 02",,,Dickens Birthday Book,TUCK,3s.,16mo.,"Dickens Birthday Book. 12 Coloured Illus. 16mo. 3s....... ...TUCK, Oct. 02",,,,Oct. 02,1902,
"Dickens Recitations from. Compiled and Adapted by Mr. and Mrs. S. L. Hasluck. 12mo. 63 × 4, pp. 226, 2s. (Hasluck's Recitations) - SIMPKIN, Oct. 02",,,Dickens Recitations from,SIMPKIN,,12mo.,"Dickens Recitations from. Compiled and Adapted by Mr. and Mrs. S. L. Hasluck. 12mo. 63 × 4, pp. 226, 2s. (Hasluck's Recitations) - SIMPKIN, Oct. 02",,,,Oct. 02,1902,
"Dictionary of Artists who have exhibited Works in Principal London Exhibitions from 1760 to 1893. Compiled by Algernon Graves. 3rd ed. with Additions and Corrections. 4to. 128 × 98, pp. 328, 42s......... ………..H. GRAVES, Aug. 02",,,Dictionary of Artists who have exhibited Works in Principal London Exhibitions from,H. GRAVES,,4to.,"Dictionary of Artists who have exhibited Works in Principal London Exhibitions from 1760 to 1893. Compiled by Algernon Graves. 3rd ed. with Additions and Corrections. 4to. 128 × 98, pp. 328, 42s......... ………..H. GRAVES, Aug. 02",,,,Aug. 02,1902,
"Dictionary of Philosophy and Psychology. Including many of the principal Conceptions of Ethics, Logic, Esthetics, Philosophy of Religion, &c., and giving a Terminology in English, French, German, and Italian. Written by many Hands, and ed. by James Mark Baldwin, with co-opera- tion and assistance of an International Board of Consulting Editors. Vol. 2. Imp. 8vo. 107 × 7, pp. 908, 218. net..................MACMILLAN, Nov. 02",,,Dictionary of Philosophy and Psychology,MACMILLAN,,8vo.,"Dictionary of Philosophy and Psychology. Including many of the principal Conceptions of Ethics, Logic, Esthetics, Philosophy of Religion, &c., and giving a Terminology in English, French, German, and Italian. Written by many Hands, and ed. by James Mark Baldwin, with co-opera- tion and assistance of an International Board of Consulting Editors. Vol. 2. Imp. 8vo. 107 × 7, pp. 908, 218. net..................MACMILLAN, Nov. 02",,,,Nov. 02,1902,
"Digest XVII. 2: Pro Socio. Ed., with Trans. and Notes, by C. H. Monro. Cr. 8vo. 5s. C. J. CLAY, Oct. 02",,,Digest XVII,C. J. CLAY,5s.,8vo.,"Digest XVII. 2: Pro Socio. Ed., with Trans. and Notes, by C. H. Monro. Cr. 8vo. 5s. C. J. CLAY, Oct. 02",,,,Oct. 02,1902,
"Directory of Americans resident in London and Great Britain, American Firms and Agencies. Compiled and ed. under the direction of W. B. Bancroft. 12mo. 5s. net...EDEN FISHER, May 02",,,"Directory of Americans resident in London and Great Britain, American Firms and Agencies",EDEN FISHER,5s.,12mo.,"Directory of Americans resident in London and Great Britain, American Firms and Agencies. Compiled and ed. under the direction of W. B. Bancroft. 12mo. 5s. net...EDEN FISHER, May 02",,,,May 02,1902,net
"Disease (The Prevention of). Trans. from German, with Intro. by H. Timbrell Bulstrode. 8vo. 8 x 5, pp. 1082, 81s. 6d. net CONSTABLE, Nov. 02",,,Disease (The Prevention of),CONSTABLE,81s. 6d.,8vo.,"Disease (The Prevention of). Trans. from German, with Intro. by H. Timbrell Bulstrode. 8vo. 8 x 5, pp. 1082, 81s. 6d. net CONSTABLE, Nov. 02",,,,Nov. 02,1902,net
"Divine Magnetism; or, the Attractive Power of the Cross. By a Layman. Long 8vo. pp. 38, 6d. H. R. ALLENSON, Sep. 02",,,"Divine Magnetism; or, the Attractive Power of the Cross",H. R. ALLENSON,6d.,8vo.,"Divine Magnetism; or, the Attractive Power of the Cross. By a Layman. Long 8vo. pp. 38, 6d. H. R. ALLENSON, Sep. 02",,,,Sep. 02,1902,
"Dix (Beulah Marie), Harper (Carrie A.)-Beau's Comedy. Cr. 8vo. 74 × 43, pp. 828, 6s. HARPER, Apr. 02",,,Beau's Comedy,HARPER,6s.,8vo.,"Dix (Beulah Marie), Harper (Carrie A.)-Beau's Comedy. Cr. 8vo. 74 × 43, pp. 828, 6s. HARPER, Apr. 02",,"['Dix (Beulah Marie), Harper (Carrie A.)']",,Apr. 02,1902,
"Dod's Parliamentary Companion, 1902. 32mo. limp, 48. 6d. .WHITTAKER, Jan. 02",,,Dod's Parliamentary Companion,WHITTAKER,6d.,32mo.,"Dod's Parliamentary Companion, 1902. 32mo. limp, 48. 6d. .WHITTAKER, Jan. 02",,,,Jan. 02,1902,
"Dog Owners' Annual for 1902. Cr. 8vo. swd. 1s. DEAN, Feb. 02",,,Dog Owners' Annual for,DEAN,1s.,8vo.,"Dog Owners' Annual for 1902. Cr. 8vo. swd. 1s. DEAN, Feb. 02",,,,Feb. 02,1902,
"Dog, Praise of the: an Anthology. Compiled by Ethel E. Bicknell. 12mo. 63 × 4, pp. 248, 58. RICHARDS, Oct. 02",,,"Dog, Praise of the: an Anthology",RICHARDS,,12mo.,"Dog, Praise of the: an Anthology. Compiled by Ethel E. Bicknell. 12mo. 63 × 4, pp. 248, 58. RICHARDS, Oct. 02",,,,Oct. 02,1902,
"Doidge's Western Counties Illustrated Annual for 1908. Cr. 8vo. bds. 18. net ......SIMPKIN, Dec. 02",,,Doidge's Western Counties Illustrated Annual for,SIMPKIN,,8vo.,"Doidge's Western Counties Illustrated Annual for 1908. Cr. 8vo. bds. 18. net ......SIMPKIN, Dec. 02",,,,Dec. 02,1902,
"Dollies. Pictured by Ruth Cobb. Verses by Richard Hunter. 32mo. 5 x 8, pp. 102, 18. 6d. (Dumpy Books) RICHARDS, Sep. 02",,,Dollies,RICHARDS,6d.,32mo.,"Dollies. Pictured by Ruth Cobb. Verses by Richard Hunter. 32mo. 5 x 8, pp. 102, 18. 6d. (Dumpy Books) RICHARDS, Sep. 02",,,,Sep. 02,1902,
"Dolly's Society Book. Set out in Pictures by Frank Hart. 4to. 11 x 84, pp. 52, bds. 3s. 6d. RICHARDS, Oct. 02",,,Dolly's Society Book,RICHARDS,3s. 6d.,4to.,"Dolly's Society Book. Set out in Pictures by Frank Hart. 4to. 11 x 84, pp. 52, bds. 3s. 6d. RICHARDS, Oct. 02",,,,Oct. 02,1902,
"Donaldson's Engineers' Annual, 1902. Cr. 8vo. swd. 1s. .OFFICE, Jan. 02",,,Donaldson's Engineers' Annual,OFFICE,1s.,8vo.,"Donaldson's Engineers' Annual, 1902. Cr. 8vo. swd. 1s. .OFFICE, Jan. 02",,,,Jan. 02,1902,
"Donaldson's Engineers' Annual, 1908. Almanac, Maps, Illus., Tide Tables, other References. Cr. 8vo. swd. 18. ....SIMPKIN, Oct. 02",,,Donaldson's Engineers' Annual,SIMPKIN,,8vo.,"Donaldson's Engineers' Annual, 1908. Almanac, Maps, Illus., Tide Tables, other References. Cr. 8vo. swd. 18. ....SIMPKIN, Oct. 02",,,,Oct. 02,1902,
"Dover Charters and other Documents in Posses- sion of Corporation of Dover. Transcr. and Transl. by S. P. Statham. Roy. 8vo. 94 × 6, pp. 508, 148. net ......DENT, Oct. 02",,,Dover Charters and other Documents in Posses- sion of Corporation of Dover,DENT,,8vo.,"Dover Charters and other Documents in Posses- sion of Corporation of Dover. Transcr. and Transl. by S. P. Statham. Roy. 8vo. 94 × 6, pp. 508, 148. net ......DENT, Oct. 02",,,,Oct. 02,1902,
"Dowell's Income Tax Act. 5th ed. 8vo. 178. 6d. BUTTERWORTH, Mar. 0 Dowie (Ménie Muriel)-Crooks of the Bough. Ch. ed. cr. 8vo. 74 × 5, pp. 800, 8s. 6d. METHUEN, July 02",,,Dowell's Income Tax Act,METHUEN,8s. 6d.,8vo.,"Dowell's Income Tax Act. 5th ed. 8vo. 178. 6d. BUTTERWORTH, Mar. 0 Dowie (Ménie Muriel)-Crooks of the Bough. Ch. ed. cr. 8vo. 74 × 5, pp. 800, 8s. 6d. METHUEN, July 02",,,,July 02,1902,
"Dream of Infinity, by De Quincey, and other Selected Dreams and Legends. Compiled by Lina Capel. Cr. 8vo. swd. 1s. nt.SIMPKIN, Jan. 02",,,"Dream of Infinity, by De Quincey, and other Selected Dreams and Legends",SIMPKIN,,8vo.,"Dream of Infinity, by De Quincey, and other Selected Dreams and Legends. Compiled by Lina Capel. Cr. 8vo. swd. 1s. nt.SIMPKIN, Jan. 02",,,,Jan. 02,1902,
"Drude P.)-The Theory of Optics, translated from the German by C. Riborg Mann and Robert A. Millikan. With 110 Diagrams. 8vo. 15s. net LONGMANS, May 02",,,"Drude P.)-The Theory of Optics, translated from the German by C. Riborg Mann and Robert A. Millikan",LONGMANS,15s.,8vo.,"Drude P.)-The Theory of Optics, translated from the German by C. Riborg Mann and Robert A. Millikan. With 110 Diagrams. 8vo. 15s. net LONGMANS, May 02",,,,May 02,1902,net
"Drummond (J.), Upton (C. B.)-Life and Letters of James Martineau. 2 vols. 8vo. 9 × 51, pp. 992, 30s. net...... ………………………..NISBET, Oct. 02",,,Life and Letters of James Martineau,NISBET,,8vo.,"Drummond (J.), Upton (C. B.)-Life and Letters of James Martineau. 2 vols. 8vo. 9 × 51, pp. 992, 30s. net...... ………………………..NISBET, Oct. 02",,"['Drummond (J.), Upton (C. B.)']",,Oct. 02,1902,
"Dumas (A.)-Napoleon. 12mo. 2s. (Siepmann's French Series, Ely.) .........MACMILLAN, Mar. 02",,,,MACMILLAN,,,"Dumas (A.)-Napoleon. 12mo. 2s. (Siepmann's French Series, Ely.) .........MACMILLAN, Mar. 02",,"[""Dumas (A.)-Napoleon. 12mo. 2s. (Siepmann's French Series, Ely.)""]",,Mar. 02,1902,
"Dutch Dialogues and 1diomatic Phrases indispen- sable for a Rapid Acquisition and Correct Expres- sion of the Dutch Language. New ed. 18mo. 1s. HIRSCHFELD, Nov. 02",,,Dutch Dialogues and,HIRSCHFELD,1s.,18mo.,"Dutch Dialogues and Idiomatic Phrases indispen- sable for a Rapid Acquisition and Correct Expres- sion of the Dutch Language. New ed. 18mo. 1s. HIRSCHFELD, Nov. 02",,,,Nov. 02,1902,
"Early Days. 1902 Vol. Roy. 8vo. 2s.; bds. 18. 6d. C. H. KELLY, Oct. 02",,,Early Days,C. H. KELLY,6d.,8vo.,"Early Days. 1902 Vol. Roy. 8vo. 2s.; bds. 18. 6d. C. H. KELLY, Oct. 02",,,,Oct. 02,1902,
"Early English Printed Books in University Library, Cambridge, 1475-1640. Vol. 2: E. Mattes to R. Marriot and English Provincial Presses. 8vo. pp. 698, 15s. net C. J. CLAY, May 02",,,"Early English Printed Books in University Library, Cambridge",C. J. CLAY,15s.,8vo.,"Early English Printed Books in University Library, Cambridge, 1475-1640. Vol. 2: E. Mattes to R. Marriot and English Provincial Presses. 8vo. pp. 698, 15s. net C. J. CLAY, May 02",,,,May 02,1902,net
"Eastern Archipelago. Part 1 (Eastern Part). 2nd ed. 48. ....POTTER, Nov. 02",,,Eastern Archipelago,POTTER,,,"Eastern Archipelago. Part 1 (Eastern Part). 2nd ed. 48. ....POTTER, Nov. 02",,,,Nov. 02,1902,
"Economic Journal (The). Vol. 11. 8vo. 21s. net MACMILLAN, Feb. 02",,,Economic Journal (The),MACMILLAN,21s.,8vo.,"Economic Journal (The). Vol. 11. 8vo. 21s. net MACMILLAN, Feb. 02",,,,Feb. 02,1902,net
"Economical Confectionery Book: 64 Recipes to make Confectionery for Home and Business Use. Cr. 8vo. swd. 6d. ...W. E. CLEGG, Nov. 02",,,Economical Confectionery Book:,W. E. CLEGG,6d.,8vo.,"Economical Confectionery Book: 64 Recipes to make Confectionery for Home and Business Use. Cr. 8vo. swd. 6d. ...W. E. CLEGG, Nov. 02",,,,Nov. 02,1902,
"Ecthesis Chronica and Chronicon Athenarum. Ed. with Notes by S. P. Lambros. 8vo. 78. 6d. net (Byzantine Texts) .METHUEN, Feb. 02",,,Ecthesis Chronica and Chronicon Athenarum,METHUEN,6d.,8vo.,"Ecthesis Chronica and Chronicon Athenarum. Ed. with Notes by S. P. Lambros. 8vo. 78. 6d. net (Byzantine Texts) .METHUEN, Feb. 02",,,,Feb. 02,1902,net
"Edgren (H.), Burnett (P. H.)-French and English Word Book: a Dictionary with Indication of Pro- nunciation, Etymologies, Dates of Earliest Ap- pearance of Freach Words in the Language. Explan. Preface by R. J. Lloyd. 8vo. 9 x 53, pp. 1284, 10s......... .HEINEMANN, Feb. 02",,,"French and English Word Book: a Dictionary with Indication of Pro- nunciation, Etymologies, Dates of Earliest Ap- pearance of Freach Words in the Language",HEINEMANN,10s.,8vo.,"Edgren (H.), Burnett (P. H.)-French and English Word Book: a Dictionary with Indication of Pro- nunciation, Etymologies, Dates of Earliest Ap- pearance of Freach Words in the Language. Explan. Preface by R. J. Lloyd. 8vo. 9 x 53, pp. 1284, 10s......... .HEINEMANN, Feb. 02",,"['Edgren (H.), Burnett (P. H.)']",,Feb. 02,1902,
"Edgren (H.), Burnett (P. E.)-French and English Word Book: a Dictionary. 8vo. 4-bnd. 16s. HEINEMANN, Mar. 02",,,French and English Word Book: a Dictionary,HEINEMANN,16s.,8vo.,"Edgren (H.), Burnett (P. E.)-French and English Word Book: a Dictionary. 8vo. 4-bnd. 16s. HEINEMANN, Mar. 02",,"['Edgren (H.), Burnett (P. E.)']",,Mar. 02,1902,
"Egypt &c. Geography, Mardon (H. W.) 28. Egypt &c. Religions, Sayce (A. H.) 8s. net Egypt &c., Sir P. le P. Renouf, 25s. net Egyptian Archæology, Maspero (G.) 68. Egyptian Tragedy, Savage (R. H.) 68. Egyptians, Mod., Lane (Edwd. Wm.) 2s. Eight Cradle Songs: Verses mainly by Claude Monroe. Set to Music by Cecil Fortescue. Decorated Cover, full-page Frontispiece, 12 Designs by Paul Woodroffe. Obl. 4to. 5s. net G. ALLEN, Nov. 02",,,Egypt &c,G. ALLEN,5s.,4to.,"Egypt &c. Geography, Mardon (H. W.) 28. Egypt &c. Religions, Sayce (A. H.) 8s. net Egypt &c., Sir P. le P. Renouf, 25s. net Egyptian Archæology, Maspero (G.) 68. Egyptian Tragedy, Savage (R. H.) 68. Egyptians, Mod., Lane (Edwd. Wm.) 2s. Eight Cradle Songs: Verses mainly by Claude Monroe. Set to Music by Cecil Fortescue. Decorated Cover, full-page Frontispiece, 12 Designs by Paul Woodroffe. Obl. 4to. 5s. net G. ALLEN, Nov. 02",,,,Nov. 02,1902,net
"Elizabethan Calendar for 1908. 16mo. art covers, 1s. net …..ANACKER, Dec. 02",,,Elizabethan Calendar for,ANACKER,,16mo.,"Elizabethan Calendar for 1908. 16mo. art covers, 1s. net …..ANACKER, Dec. 02",,,,Dec. 02,1902,
"Ely Diocesan Calendar and Clergy List, 1902. Cr. 8vo. swd. 1s. net ..SIMPKIN, Feb. 02",,,Ely Diocesan Calendar and Clergy List,SIMPKIN,1s.,8vo.,"Ely Diocesan Calendar and Clergy List, 1902. Cr. 8vo. swd. 1s. net ..SIMPKIN, Feb. 02",,,,Feb. 02,1902,net
"Emerson's Essay on Beauty: Class Study in English Composition. Ed. by Susan Cunnington. Cr. 8vo. 74 × 41, pp. 94, bds. 1s. 6d. net 18........... NORLAND PRESS, Jan. 02",,,Emerson's Essay on Beauty: Class Study in English Composition,NORLAND PRESS,,8vo.,"Emerson's Essay on Beauty: Class Study in English Composition. Ed. by Susan Cunnington. Cr. 8vo. 74 × 41, pp. 94, bds. 1s. 6d. net 18........... NORLAND PRESS, Jan. 02",,,,Jan. 02,1902,
"Emphasised Bible Old Testament, Vol. 8, 8s. net. 8 vols. in 1 vol. 22s. 6d. net. Old & New Testament, in 1 vol. 30s. net...ALLENSON, Aug. 02",,,"Emphasised Bible Old Testament, Vol",ALLENSON,30s.,,"Emphasised Bible Old Testament, Vol. 8, 8s. net. 8 vols. in 1 vol. 22s. 6d. net. Old & New Testament, in 1 vol. 30s. net...ALLENSON, Aug. 02",,,,Aug. 02,1902,net
"Empire Review. Vol. 8. 8vo. 7s. 6d. net - MACMILLAN, July 02",,,Empire Review,MACMILLAN,,8vo.,"Empire Review. Vol. 8. 8vo. 7s. 6d. net - MACMILLAN, July 02",,,,July 02,1902,
"Empire_(The), its Cities, Palaces, and Buildings: No. 9, Famous Buildings of London, 16 views. 10x8; No. 10, St. Paul's Cathedral, 16 views, 10 x 8. Ea. 6d. net (Empire Series) MARION, Aug. 02",,,"Empire_(The), its Cities, Palaces, and Buildings:",MARION,6d.,,"Empire_(The), its Cities, Palaces, and Buildings: No. 9, Famous Buildings of London, 16 views. 10x8; No. 10, St. Paul's Cathedral, 16 views, 10 x 8. Ea. 6d. net (Empire Series) MARION, Aug. 02",,,,Aug. 02,1902,net
"Encyclopedia Biblica: Critical Dictionary of Literary, Political, and Religious History, Archæology, Geography, and Natural History of the Bible. Ed. by Rev. T. K. Cheyne and J. Sutherland Black. Vol. 8: L to P. Folio, 11x7, 20s. net; -mor. 258. net BLACK, Apr. 02",,,"Encyclopedia Biblica: Critical Dictionary of Literary, Political, and Religious History, Archæology, Geography, and Natural History of the Bible",BLACK,,,"Encyclopedia Biblica: Critical Dictionary of Literary, Political, and Religious History, Archæology, Geography, and Natural History of the Bible. Ed. by Rev. T. K. Cheyne and J. Sutherland Black. Vol. 8: L to P. Folio, 11x7, 20s. net; -mor. 258. net BLACK, Apr. 02",,,,Apr. 02,1902,
"English Extracts for Latin Prose. Compiled, with Introductory Hints and Sentences, by A. C. Champneys. Cr. 8vo. 7 x 44, pp. 176, 28. LONGMANS, June 02",,,English Extracts for Latin Prose,LONGMANS,,8vo.,"English Extracts for Latin Prose. Compiled, with Introductory Hints and Sentences, by A. C. Champneys. Cr. 8vo. 7 x 44, pp. 176, 28. LONGMANS, June 02",,,,June 02,1902,
"Engineers' Gazette Annual, 1903. Cr. 8vo. swd. .....OFFICE, Nov. 02",,,Engineers' Gazette Annual,OFFICE,,8vo.,"Engineers' Gazette Annual, 1903. Cr. 8vo. swd. .....OFFICE, Nov. 02",,,,Nov. 02,1902,
"English History, Middle Ages, Companion to. Ed. by Francis Pierrepoint Barnard. 97 Plates. Ex. cr. 8vo. 8 × 51, pp. 388, 8s. 6d. net FROWDE, Mar. 02",,,"English History, Middle Ages, Companion to",FROWDE,8s. 6d.,8vo.,"English History, Middle Ages, Companion to. Ed. by Francis Pierrepoint Barnard. 97 Plates. Ex. cr. 8vo. 8 × 51, pp. 388, 8s. 6d. net FROWDE, Mar. 02",,,,Mar. 02,1902,net
"Vol. 26. Roy. 8vo. ..UNWIN, Apr. 02",,,Vol,UNWIN,,8vo.,"Vol. 26. Roy. 8vo. ..UNWIN, Apr. 02",,,,Apr. 02,1902,
"Vol. 27. Roy. 8vo. ..UNWIN, Sep. 02",,,Vol,UNWIN,,8vo.,"Vol. 27. Roy. 8vo. ..UNWIN, Sep. 02",,,,Sep. 02,1902,
"English Language-Matriculation Model Answers. London University Matriculation Papers from June 1895 to Jan. 1902. With Answers. Cr. 8vo. pp. 142 swd. 2s. (Univ. Tut. Ser.) CLIVE, Mar. 02",,,English Language-Matriculation Model Answers,CLIVE,2s.,8vo.,"English Language-Matriculation Model Answers. London University Matriculation Papers from June 1895 to Jan. 1902. With Answers. Cr. 8vo. pp. 142 swd. 2s. (Univ. Tut. Ser.) CLIVE, Mar. 02",,,,Mar. 02,1902,
"English Songs and Ballads. Compiled by T. W. H. Crosland. 12mo. 61 × 33, pp. 868, 1s. net; lthr. 2s. net (World's Classics) RICHARDS, Apr. 02",,,English Songs and Ballads,RICHARDS,2s.,12mo.,"English Songs and Ballads. Compiled by T. W. H. Crosland. 12mo. 61 × 33, pp. 868, 1s. net; lthr. 2s. net (World's Classics) RICHARDS, Apr. 02",,,,Apr. 02,1902,net
"English Tales in Verse. Intro. by C. H. Herford. Cr. 8vo 7×5, pp. 350, 3s. 6d. (Warwick Library) BLAIKIE, Feb. 02",,,English Tales in Verse,BLAIKIE,3s. 6d.,8vo,"English Tales in Verse. Intro. by C. H. Herford. Cr. 8vo 7×5, pp. 350, 3s. 6d. (Warwick Library) BLAIKIE, Feb. 02",,,,Feb. 02,1902,
"Englishwoman's Year Book & Directory. Ed. ......... by Emily Janes. Cr. 8vo. 2s. 6d. nt. BLACK, Dec. 02",,,Englishwoman's Year Book & Directory,BLACK,,8vo.,"Englishwoman's Year Book & Directory. Ed. ......... by Emily Janes. Cr. 8vo. 2s. 6d. nt. BLACK, Dec. 02",,,,Dec. 02,1902,
