,entry,last_name,first_name,title,publisher,price,format,original_entry,author_name,creators,is_editor,date,catalogue_year,is_net
36,"Adams (John)-1srael's 1deal ; or, Studies in Old Testament Theology. Cr. 8vo. 71 X5, pp. 244, 4s. 6d. net .T. & T. CLARK, Jan. 10",Adams,John,,T. & T. CLARK,4s. 6d.,8vo.,"Adams (John)-Israel's Ideal ; or, Studies in Old Testament Theology. Cr. 8vo. 71 X5, pp. 244, 45. 6d. net .T. & T. CLARK, Jan. 10",John Adams,['Adams (John)'],,Jan. 10,1910,net
107,"Amazing Mutes, Muir (W.) 6s. ....... Sep, ro Amazing Revolution and After (An). Cr. 8vo. 71 X5, pp. 174, 2s. 6d. net..G. ALLEN, Feb. 10","Amazing Mutes, Muir",W.,,G. ALLEN,2s. 6d.,8vo.,"Amazing Mutes, Muir (W.) 6s. ....... Sep, ro Amazing Revolution and After (An). Cr. 8vo. 71 X5, pp. 174, 2s. 6d. net..G. ALLEN, Feb. 10","W. Amazing Mutes, Muir","['Amazing Mutes, Muir (W.)']",,Feb. 10,1910,net
118,"Andersen (Hans)--Fairy Tales (Selections from). Illus. by Gilbert James. 8vo. 61 X5, pp. 64, s, net (Langham Ser. for Children, No. 1) SIEGLE, H., Aug. 10",,,,"SIEGLE, H.",,8vo.,"Andersen (Hans)--Fairy Tales (Selections from). Illus. by Gilbert James. 8vo. 61 X5, pp. 64, IS, net (Langham Ser. for Children, No. 1) SIEGLE, H., Aug. 10",,['Andersen (Hans)--Fairy Tales (Selections from)'],,Aug. 10,1910,
218,"Army-How to Obtain a Commission in the Territorial Force, id. WYMAN, Dec. 10",,,,WYMAN,,,"Army-How to Obtain a Commission in the Territorial Force, id. WYMAN, Dec. 10",,,,Dec. 10,1910,
220,"Army-Memorandum Defining the Duties of the Commander-in-Chief of the Mediterranean, id. WYMAN, June 10",,,,WYMAN,,,"Army-Memorandum Defining the Duties of the Commander-in-Chief of the Mediterranean, id. WYMAN, June 10",,,,June 10,1910,
326,"Australia (Western) Timigration Handbook, id. WYMAN, June 10",Australia,Western,,WYMAN,,,"Australia (Western) Timigration Handbook, id. WYMAN, June 10",Western Australia,['Australia (Western)'],,June 10,1910,
405,"12mo. mons Bankers' Telegraph and Cable Code. 15s. net...... ...SPON, Feb. 10",,,,SPON,15s.,,"I 2mo. mons Bankers' Telegraph and Cable Code. 155. net...... ...SPON, Feb. 10",,,,Feb. 10,1910,net
457,"Illus. 4to. 144 X11, pp. 400, 50s. Barr (Amelia E.)—Woven of Love and Glory. (Budapest) ERDÉLYI, May 10",,,,ERDÉLYI,,4to.,"Illus. 4to. 144 X11, pp. 400, 50s. Barr (Amelia E.)—Woven of Love and Glory. (Budapest) ERDÉLYI, May 10",,,,May 10,1910,
460,"Cr. 8vo. 73 X5, pp. 256, 2s. net ..NASH, Aug. 10",,,,NASH,2s.,8vo.,"Cr. 8vo. 73 X5, pp. 256, 25. net ..NASH, Aug. 10",,,,Aug. 10,1910,net
464,"Cr. 8vo., pp. 318, swd. is, net EVERETT, Sep. 10",,,,EVERETT,,8vo.,"Cr. 8vo., pp. 318, swd. is, net EVERETT, Sep. 10",,,,Sep. 10,1910,
474,"Cr. 8vo. 3s. 6d.........D. C. HEATH, May 10",,,,D. C. HEATH,3s. 6d.,8vo.,"Cr. 8vo. 35. 6d.........D. C. HEATH, May 10",,,,May 10,1910,
810,"Book of Gardens (A). Illus. 12mo. 61 X 43, pp. 138, 2s. 6d. net .FOULIS, Nov. 10",Book of Gardens,A,,FOULIS,2s. 6d.,12mo.,"Book of Gardens (A). Illus. 12mo. 61 X 43, pp. 138, 2s. 6d. net .FOULIS, Nov. 10",A Book of Gardens,['Book of Gardens (A)'],,Nov. 10,1910,net
931,"Briggs (William)–First Stage Mathematics. (With Modern Geometry.) Cr. 8vo., pp. 312, 28. (Organised Science Ser.) ........ CLIVE, Apr. 10",,,,CLIVE,,8vo.,"Briggs (William)–First Stage Mathematics. (With Modern Geometry.) Cr. 8vo., pp. 312, 28. (Organised Science Ser.) ........ CLIVE, Apr. 10",,['Briggs (William)–First Stage Mathematics. (With Modern Geometry.)'],,Apr. 10,1910,
959,"Illus. 8vo., . 848. 208. ...DULAU, Dec, 10",,,,DULAU,,8vo.,"Illus. 8vo., . 848. 208. ...DULAU, Dec, 10",,,,"Dec, 10",1910,
1151,"Butler (Samuel)-Unconscious Memory (Works: Re-issue). Cr. Svo. 78 X5, pp. 224, 5s, net FIFIELD, June 10",,,,FIFIELD,5s.,,"Butler (Samuel)-Unconscious Memory (Works: Re-issue). Cr. Svo. 78 X5, pp. 224, 5s, net FIFIELD, June 10",,['Butler (Samuel)-Unconscious Memory (Works: Re-issue)'],,June 10,1910,net
1190,"Caine (William)-4 Prisoner in Spain. Cr. 8vo. 7! X44, pp. 320, 6s. ......GREENING, Apr. 10",Caine,William,,GREENING,6s.,8vo.,"Caine (William)-4 Prisoner in Spain. Cr. 8vo. 7! X44, pp. 320, 6s. ......GREENING, Apr. 10",William Caine,['Caine (William)'],,Apr. 10,1910,
1194,"Calculus, Integral, Prasad (G.) 5s, net .Νου. ΙΟ Calculus made easy, by F. R. S. 12mo. 7 X45, pp. 188, 2s. net MACMILLAN, Nov. 10","Calculus, Integral, Prasad",G.,,MACMILLAN,2s.,12mo.,"Calculus, Integral, Prasad (G.) 5s, net .Νου. ΙΟ Calculus made easy, by F. R. S. 12mo. 7 X45, pp. 188, 25. net MACMILLAN, Nov. 10","G. Calculus, Integral, Prasad","['Calculus, Integral, Prasad (G.)']",,Nov. 10,1910,net
1266,"Cape of Good Hope--Report of the Astronomer, WYMAN, Apr. 10",,,,WYMAN,,,"Cape of Good Hope--Report of the Astronomer, WYMAN, Apr. 10",,,,Apr. 10,1910,
1300,"Carpenter, Edward, Swan (T.) 6d. net .. June ro Carpenter (William Boyd)—The Communion of Prayer : A Manual of Private Prayers and Devotions. Edit. by W. B. C., Bishop of Ripon, 12mo. 64 X4, pp. 318, 3s. 6d. net, Ithr., 5s. net JARROLD, Nov. 10","Carpenter, Edward, Swan",T.,,JARROLD,5s.,12mo.,"Carpenter, Edward, Swan (T.) 6d. net .. June ro Carpenter (William Boyd)—The Communion of Prayer : A Manual of Private Prayers and Devotions. Edit. by W. B. C., Bishop of Ripon, 12mo. 64 X4, pp. 318, 35. 6d. net, Ithr., 5s. net JARROLD, Nov. 10","T. Carpenter, Edward, Swan","['Carpenter, Edward, Swan (T.)']",,Nov. 10,1910,net
1367,"Ceylon Emigration Handbook, id. WYMAN, Aug. 10",,,,WYMAN,,,"Ceylon Emigration Handbook, id. WYMAN, Aug. 10",,,,Aug. 10,1910,
1420,"Charities (Endowed) Devon, Parish of Uplyme, id. WYMAN, Sep. 10",Charities,Endowed,,WYMAN,,,"Charities (Endowed) Devon, Parish of Uplyme, id. WYMAN, Sep. 10",Endowed Charities,['Charities (Endowed)'],,Sep. 10,1910,
1428,"1910) . 4s. 6d. 3s. 60. 9s. net Charpentier (Ambrose E. L.)-Hæmoglobinuria. Cr. 8vo. 71 x 41, pp. 120, 3s. 6d. net BAILLIÈRE, Oct. 10",,,,BAILLIÈRE,3s. 6d.,8vo.,"I910) . 45. 6d. 3s. 60. 9s. net Charpentier (Ambrose E. L.)-Hæmoglobinuria. Cr. 8vo. 71 x 41, pp. 120, 35. 6d. net BAILLIÈRE, Oct. 10",,,,Oct. 10,1910,net
1665,"NISBET ; ST. CATHERINE'S PRESS, Aug. 10",,,,ST. CATHERINE'S PRESS,,,"NISBET ; ST. CATHERINE'S PRESS, Aug. 10",,,,Aug. 10,1910,
1667,"Cr. 8vo., pp. 284, 1s.........R.T.S., Mar. 10",,,,R.T.S.,1s.,8vo.,"Cr. 8vo., pp. 284, Is.........R.T.S., Mar. 10",,,,Mar. 10,1910,
1909,"Cypher Code, Bellamy (F. S.) 4os. net ..Νου. Το Cyprus, Colonial Report for 1909-10, 4d. WYMAN, Sep. 10","Cypher Code, Bellamy",F. S.,,WYMAN,4d.,,"Cypher Code, Bellamy (F. S.) 4os. net ..Νου. Το Cyprus, Colonial Report for 1909-10, 4d. WYMAN, Sep. 10","F. S. Cypher Code, Bellamy","['Cypher Code, Bellamy (F. S.)']",,Sep. 10,1910,
1916,"12mo. ea. 59. net Dale (T. N.)-The Granites of Vermont. Illus. 8vo. 6 X9, pp. 138, swd. 5s. net (U.S. Geol. Survey) . WESLEY, June 10",,,,WESLEY,5s.,8vo.,"I 2mo. ea. 59. net Dale (T. N.)-The Granites of Vermont. Illus. 8vo. 6 X9, pp. 138, swd. 55. net (U.S. Geol. Survey) . WESLEY, June 10",,,,June 10,1910,net
2296,"Dynasts, Hardy (T.) 78. 6d. .Νου. Το Dyson (C. C.)— The Life of Marie Amélie, Last Queen of the French, 1782-1866. Illus. Svo. 9x54, pp. 318, 12s. 6d. net....LONG, June 10","Dynasts, Hardy",T.,,LONG,12s. 6d.,,"Dynasts, Hardy (T.) 78. 6d. .Νου. Το Dyson (C. C.)— The Life of Marie Amélie, Last Queen of the French, 1782-1866. Illus. Svo. 9x54, pp. 318, 125. 6d. net....LONG, June 10","T. Dynasts, Hardy","['Dynasts, Hardy (T.)']",,June 10,1910,net
2351,"1910 ) Education List of Public Elementary Schools Educational Finance. Address by the Rt. Hon. in England on 31st July, 1910, 2s, 6d. Lord Sheffield, and debate thereon at the WYMAN, Dec. 10",,,,WYMAN,,,"I910 ) Education List of Public Elementary Schools Educational Finance. Address by the Rt. Hon. in England on 31st July, 1910, 2s, 6d. Lord Sheffield, and debate thereon at the WYMAN, Dec. 10",,,,Dec. 10,1910,
2363,"Illus. 8vo. 9X58, pp. 460, Ios. ód. net Education, Science of, Keating (T. P.) 2s. 61, net CHAPMAN & II., Nov. 10",,,,CHAPMAN & II.,,8vo.,"Illus. 8vo. 9X58, pp. 460, Ios. ód. net Education, Science of, Keating (T. P.) 25. 61, net CHAPMAN & II., Nov. 10",,,,Nov. 10,1910,
2381,"Election (General) 1910 Illiterate Voters : Return, 1ļd. .WYMAN, Aug. 10",Election,General,,WYMAN,,,"Election (General) 1910 Illiterate Voters : Return, 1ļd. .WYMAN, Aug. 10",General Election,['Election (General)'],,Aug. 10,1910,
2388,"Electric Supply Bill Report, London, id. WYMAN, July 10",,,,WYMAN,,,"Electric Supply Bill Report, London, id. WYMAN, July 10",,,,July 10,1910,
2915,"Gayley (C. M.) ed.-1dols of Education. Selected and Annotated. Cr. 8vo. 2s. 6d. net HODDER & S., June 10",Gayley,C. M.,,HODDER & S.,2s. 6d.,8vo.,"Gayley (C. M.) ed.-Idols of Education. Selected and Annotated. Cr. 8vo. 2s. 6d. net HODDER & S., June 10",C. M. Gayley,['Gayley (C. M.)'],ed.,June 10,1910,net
2923,"Geographical Readers, Chambers's 20th Cent., Bk. 7, s, 6d. ..4 pr. 10",,,,,,,"Geographical Readers, Chambers's 20th Cent., Bk. 7, IS, 6d. ..4 pr. 10",,,,,1910,
3020,"Cr. 8vo. 8 X5, pp. 706, 6s. net ..LOW, July 10",,,,LOW,6s.,8vo.,"Cr. 8vo. 8 X5, pp. 706, 6s. net ..LOW, July 10",,,,July 10,1910,net
3166,"1910 on an Gregory (Lady)-- The Image : a Play in 3 Acts. Cr. 8vo., pp. 106, swd, is, net MAUNSEI., June 10",,,,MAUNSEI.,,8vo.,"I910 on an Gregory (Lady)-- The Image : a Play in 3 Acts. Cr. 8vo., pp. 106, swd, is, net MAUNSEI., June 10",,,,June 10,1910,
3252,"Hæmoglobinuria, Charpentier (A. E. L.) 3s. 60. net Haenen (F. de) and Dobson (G.)-St. Petersburg. Painted by F. De H.; described by G. D. 8vo. 9 x64, pp. 180, 7s. 6d..... BLACK, June 10","Hæmoglobinuria, Charpentier",A. E. L.,,BLACK,7s. 6d.,8vo.,"Hæmoglobinuria, Charpentier (A. E. L.) 35. 60. net Haenen (F. de) and Dobson (G.)-St. Petersburg. Painted by F. De H.; described by G. D. 8vo. 9 x64, pp. 180, 7s. 6d..... BLACK, June 10","A. E. L. Hæmoglobinuria, Charpentier","['Hæmoglobinuria, Charpentier (A. E. L.)']",,June 10,1910,
3355,"120 3s. 6d. 12mo. Harland (Marion)-Autobiography; The Story of a Long Life. 8vo. 7s. 6d. net HARPER, Apr. 10",,,,HARPER,7s. 6d.,12mo.,"I20 35. 6d. I 2mo. Harland (Marion)-Autobiography; The Story of a Long Life. 8vo. 7s. 6d. net HARPER, Apr. 10",,,,Apr. 10,1910,net
3361,"Harper (Charles G.)--The Corni-h Coast (North). Illus. 8vo. 91 X5, pp. 292, 15s. net CHAPMAN & H., May 10",,,,CHAPMAN & H.,15s.,8vo.,"Harper (Charles G.)--The Corni-h Coast (North). Illus. 8vo. 91 X5, pp. 292, 155. net CHAPMAN & H., May 10",,['Harper (Charles G.)--The Corni-h Coast (North)'],,May 10,1910,net
3373,"Harry Lorrequer, Lever (C.) 1s., 2s. net .. July to Hart (A. B.)-The Southern South. Cr. 8vo 6s. net • APPLETON, July 10","Harry Lorrequer, Lever",C.,,APPLETON,,8vo,"Harry Lorrequer, Lever (C.) Is., 25. net .. July to Hart (A. B.)-The Southern South. Cr. 8vo 6s. net • APPLETON, July 10","C. Harry Lorrequer, Lever","['Harry Lorrequer, Lever (C.)']",,July 10,1910,
3386,"Harum Scarum, Stuart (E.) 7d. net .....Sep. 01 Harvard Studies in Classical Philology. Vol. 21. 1910. 8vo. 6s. 6d. net ..LONGMAXS, Dec. 10","Harum Scarum, Stuart",E.,,LONGMAXS,6s. 6d.,8vo.,"Harum Scarum, Stuart (E.) 7d. net .....Sep. 01 Harvard Studies in Classical Philology. Vol. 21. 1910. 8vo. 6s. 6d. net ..LONGMAXS, Dec. 10","E. Harum Scarum, Stuart","['Harum Scarum, Stuart (E.)']",,Dec. 10,1910,net
3451,"Healy (C.)-Ye Olde Childewall (Childwall Abbey Inn, near Liverpool]. Illus. swd. 3d. (Liverpool) LYCEUM PRESS, June 10",,,,LYCEUM PRESS,,,"Healy (C.)-Ye Olde Childewall (Childwall Abbey Inn, near Liverpool]. Illus. swd. 3d. (Liverpool) LYCEUM PRESS, June 10",,"['Healy (C.)-Ye Olde Childewall (Childwall Abbey Inn, near Liverpool]. Illus. swd. 3d. (Liverpool)']",,June 10,1910,
3453,"Heart of the Antarctic, Shackleton (E., Sir) 6s. net Νου. 10",,,,E.,,,"Heart of the Antarctic, Shackleton (E., Sir) 6s. net Νου. 10",,,,Sir) 6s. net Νου. 10,1910,
3462,"CAMB, UNIV. PRESS, Nov. 10",,,,"CAMB, UNIV. PRESS",,,"CAMB, UNIV. PRESS, Nov. 10",,,,Nov. 10,1910,
3466,"Cr. 8vo. 58. net . PUTNAM, Jan. 10",,,,PUTNAM,,8vo.,"Cr. 8vo. 58. net . PUTNAM, Jan. 10",,,,Jan. 10,1910,
3798,"1deal Health: How to attain it by Physical Culture, Ву M.D. 2nd edit. Cr. 8vo., pp. 124, swd. is. SIMPKIN, Jan. 10",,,,SIMPKIN,,8vo.,"Ideal Health: How to attain it by Physical Culture, Ву M.D. 2nd edit. Cr. 8vo., pp. 124, swd. is. SIMPKIN, Jan. 10",,,,Jan. 10,1910,
3868,"1s Christianity True ? and other Lectures delivered in the Central Hall, Manchester. Cheap edit. Cr. 8vo. swd. is. net ....C. H. KELLY, Oct. 10",,,,C. H. KELLY,,8vo.,"Is Christianity True ? and other Lectures delivered in the Central Hall, Manchester. Cheap edit. Cr. 8vo. swd. is. net ....C. H. KELLY, Oct. 10",,,,Oct. 10,1910,
3869,"1s Death the End ? By a Well-known Writer. Cr. 8vo. swd. is, net....F. GRIFFITHS, Mar. 10",,,,F. GRIFFITHS,,8vo.,"Is Death the End ? By a Well-known Writer. Cr. 8vo. swd. is, net....F. GRIFFITHS, Mar. 10",,,,Mar. 10,1910,
3870,"1s that Lamp Going Out ? By the author of  Where's Master? Cr. 8vo., pp. 48, bds. s, net .HODDER & S., Sep. 10",,,,HODDER & S.,,8vo.,"Is that Lamp Going Out ? By the author of  Where's Master? Cr. 8vo., pp. 48, bds. IS, net .HODDER & S., Sep. 10",,,,Sep. 10,1910,
3875,"1slam-Encyclopædia of 1slam : a Dictionary of the Geography, Ethnography and Biography of the Mohammedan Peoples, &c. Part 6, 3s. 6d. net ..... ..LUZAC, Sep. 10",,,,LUZAC,3s. 6d.,,"Islam-Encyclopædia of Islam : a Dictionary of the Geography, Ethnography and Biography of the Mohammedan Peoples, &c. Part 6, 3s. 6d. net ..... ..LUZAC, Sep. 10",,,,Sep. 10,1910,net
3933,"Jay (Allen)-Autobiography (1831-1910). Cr. 8vo. 81 X54, pp. 422, 6s, net.... HEADLEY, July 10",,,,HEADLEY,6s.,8vo.,"Jay (Allen)-Autobiography (1831-1910). Cr. 8vo. 81 X54, pp. 422, 6s, net.... HEADLEY, July 10",,['Jay (Allen)-Autobiography (1831-1910)'],,July 10,1910,net
3956,"Jepson (Edgar)-No. 19. Cr. 8vo. 7*X5, pp. 316, MILLS & B., Jan. 10",Jepson,Edgar,,MILLS & B.,,8vo.,"Jepson (Edgar)-No. 19. Cr. 8vo. 7*X5, pp. 316, MILLS & B., Jan. 10",Edgar Jepson,['Jepson (Edgar)'],,Jan. 10,1910,
4020,"Jones (Henry)—1dealism as a Practical Creed. Lectures on Philosophy and Modern Life delivered before the University of Sydney. 2nd edit. Post 8vo., pp. 299, 6s. net MACLEHOSE, A pr. 10",Jones,Henry,,MACLEHOSE,6s.,8vo.,"Jones (Henry)—Idealism as a Practical Creed. Lectures on Philosophy and Modern Life delivered before the University of Sydney. 2nd edit. Post 8vo., pp. 299, 6s. net MACLEHOSE, A pr. 10",Henry Jones,['Jones (Henry)'],,A pr. 10,1910,net
4182,"King's Religion, Statutory Enactments, id. W'YMAN, July 10",,,,W'YMAN,,,"King's Religion, Statutory Enactments, id. W'YMAN, July 10",,,,July 10,1910,
4183,"King's Speech to both IIouses of Parliament, id. WYMAX, Feb. 10",,,,WYMAX,,,"King's Speech to both IIouses of Parliament, id. WYMAX, Feb. 10",,,,Feb. 10,1910,
4227,"Knatchbull-Hugessen (R.) see Hugessen (R. Knatchbull-) Kneass (Strickland L.)--Practice and Theory of the Injector. 3rd edit., rev, and enlrgd. Illus. 8vo., pp. 180, 6s, 6d. net CHAPMAN & H., Mar. 10",Knatchbull-Hugessen,R.,,CHAPMAN & H.,6s. 6d.,8vo.,"Knatchbull-Hugessen (R.) see Hugessen (R. Knatchbull-) Kneass (Strickland L.)--Practice and Theory of the Injector. 3rd edit., rev, and enlrgd. Illus. 8vo., pp. 180, 6s, 6d. net CHAPMAN & H., Mar. 10",R. Knatchbull-Hugessen,['Knatchbull-Hugessen (R.)'],,Mar. 10,1910,net
4334,"Latin, Teaching of in Secondary Schools (Circular), id. WYMAN, Feb. 10",,,,WYMAN,,,"Latin, Teaching of in Secondary Schools (Circular), id. WYMAN, Feb. 10",,,,Feb. 10,1910,
4372,"Leblanc (Maurice) -813. Trans. by Alexander Teixeira de Mattos. Cr. 8vo. 74 X5, pp. 434, 6s, MILLS & B., Sep. 10",Leblanc,Maurice,,MILLS & B.,6s.,8vo.,"Leblanc (Maurice) -813. Trans. by Alexander Teixeira de Mattos. Cr. 8vo. 74 X5, pp. 434, 6s, MILLS & B., Sep. 10",Maurice Leblanc,['Leblanc (Maurice)'],,Sep. 10,1910,
4492,"Lilly (William S.)--1dola Fori. Being an Exam- ination of Seven Questions of the Day. 8vo. 9 X54, pp. 296, 12s. 6d. net CHAPMAN & H., Nov. 10",Lilly,William S.,,CHAPMAN & H.,12s. 6d.,8vo.,"Lilly (William S.)--Idola Fori. Being an Exam- ination of Seven Questions of the Day. 8vo. 9 X54, pp. 296, 12s. 6d. net CHAPMAN & H., Nov. 10",William S. Lilly,['Lilly (William S.)'],,Nov. 10,1910,net
4493,"Limitations, Benson (E. F.) 28. net ..Νου. Το Lincoln (Joseph C.)-Cap'n Eri. 8vo. swd. 6d. AMAL. PRESS, Aug. 10","Limitations, Benson",E. F.,,AMAL. PRESS,6d.,8vo.,"Limitations, Benson (E. F.) 28. net ..Νου. Το Lincoln (Joseph C.)-Cap'n Eri. 8vo. swd. 6d. AMAL. PRESS, Aug. 10","E. F. Limitations, Benson","['Limitations, Benson (E. F.)']",,Aug. 10,1910,
4829,"Cr. 8vo. 7} X5, pp. 166, 5s. net Maclean (J. Kennedy)-Heroes of the Polar Seas. C. & E. LAYTON, Apr. 10",,,,C. & E. LAYTON,,8vo.,"Cr. 8vo. 7} X5, pp. 166, 5s. net Maclean (J. Kennedy)-Heroes of the Polar Seas. C. & E. LAYTON, Apr. 10",,,,Apr. 10,1910,
4830,"Cr. 8vo. 7* X5, pp. 390, 6s. CHAMBERS, Oct. 10",,,,CHAMBERS,6s.,8vo.,"Cr. 8vo. 7* X5, pp. 390, 6s. CHAMBERS, Oct. 10",,,,Oct. 10,1910,
4834,"1s. 6d. net ; Swd., is, net PARTRIDGE, Dec. 10",,,,PARTRIDGE,,,"Is. 6d. net ; Swd., is, net PARTRIDGE, Dec. 10",,,,Dec. 10,1910,
4837,"Cr. Svo. 71 X 48, pp. 222, 2s. 6d. net Macleane (D.)— The Battle Round Creed GOWANS & G., Nov. 10",,,,GOWANS & G.,,,"Cr. Svo. 71 X 48, pp. 222, 2s. 6d. net Macleane (D.)— The Battle Round Creed GOWANS & G., Nov. 10",,,,Nov. 10,1910,
4842,"Cr. 8vo. 8 X5, pp. 438, 5s. net Macnaughton, (S.) The Andersons. Cr. 8vo. TIEIVEMAYX, 4 pr. 10",,,,TIEIVEMAYX,,8vo.,"Cr. 8vo. 8 X5, pp. 438, 5s. net Macnaughton, (S.) The Andersons. Cr. 8vo. TIEIVEMAYX, 4 pr. 10",,,,4 pr. 10,1910,
4851,"Illus. Cr. 8vo. 71 X 43, pp. 142, swd. is. net Maclean (Norman)-Can the World be Won for E, MACKAY, Aug. 10",,,,"E, MACKAY",,8vo.,"Illus. Cr. 8vo. 71 X 43, pp. 142, swd. is. net Maclean (Norman)-Can the World be Won for E, MACKAY, Aug. 10",,,,Aug. 10,1910,
4855,"Cr. 8vo. 7*X5, pp. 210, 23. 6d. net SIMPKIN, Aug. 10",,,,SIMPKIN,6d.,8vo.,"Cr. 8vo. 7*X5, pp. 210, 23. 6d. net SIMPKIN, Aug. 10",,,,Aug. 10,1910,net
5222,"Military Interest, Recent Publications of, January, WYMAN, Feb. 10",,,,WYMAN,,,"Military Interest, Recent Publications of, January, WYMAN, Feb. 10",,,,Feb. 10,1910,
5302,"Modlen (W.)-Notes for the Use of Schools on Marlowe's Faustus, is, net (Aberystwyth) GALLOWAY, Mar. 10",Modlen,W.,,GALLOWAY,,,"Modlen (W.)-Notes for the Use of Schools on Marlowe's Faustus, is, net (Aberystwyth) GALLOWAY, Mar. 10",W. Modlen,['Modlen (W.)'],,Mar. 10,1910,
5316,"Moncrieff (G. K. Scott, Brig.-Gen.)--Works Economics. (Prof. Papers of the Corps of Royal Engineers). 4th series. Diag. 8vo., pp. 17, swd. 28. net (Chatham) W. & J. MACKAY, Aug. 10",,,,W. & J. MACKAY,,8vo.,"Moncrieff (G. K. Scott, Brig.-Gen.)--Works Economics. (Prof. Papers of the Corps of Royal Engineers). 4th series. Diag. 8vo., pp. 17, swd. 28. net (Chatham) W. & J. MACKAY, Aug. 10",,"['Moncrieff (G. K. Scott, Brig.-Gen.)--Works Economics. (Prof. Papers of the Corps of Royal Engineers)']",,Aug. 10,1910,
5402,"Regulation, id. WYMAN, J ulv 10",,,,WYMAN,,,"Regulation, id. WYMAN, J ulv 10",,,,J ulv 10,1910,
5434,"Mulliken (S. P.)-1dentification of the Commercial Dye Stuffs. Ryl. 8vo. 2 is. net CHAPMAN & H., June 10",Mulliken,S. P.,,CHAPMAN & H.,,8vo.,"Mulliken (S. P.)-Identification of the Commercial Dye Stuffs. Ryl. 8vo. 2 is. net CHAPMAN & H., June 10",S. P. Mulliken,['Mulliken (S. P.)'],,June 10,1910,
5506,"Natal, Emigration Handbook, id. WYMAN, Mar. 10",,,,WYMAN,,,"Natal, Emigration Handbook, id. WYMAN, Mar. 10",,,,Mar. 10,1910,
5517,"Naval Expenditure of Principal Naval Powers : Return, id. WYMAN, Oct. 10",,,,WYMAN,,,"Naval Expenditure of Principal Naval Powers : Return, id. WYMAN, Oct. 10",,,,Oct. 10,1910,
5724,"Orange Free State, Imigration Handbook, id. WYMAN, July 10",,,,WYMAN,,,"Orange Free State, Imigration Handbook, id. WYMAN, July 10",,,,July 10,1910,
5988,"Cr. 8vo. 7! X41, pp. 109, 28. 60. net Philip Compton's Will, Kelly (Mrs. H.) is. 6d. MURRAY, July 10",,,,MURRAY,6d.,8vo.,"Cr. 8vo. 7! X41, pp. 109, 28. 60. net Philip Compton's Will, Kelly (Mrs. H.) is. 6d. MURRAY, July 10",,,,July 10,1910,
5994,"Cr. 8vo. 78 X5, pp. 392, 68. APPLETON, Oct. 10",,,,APPLETON,,8vo.,"Cr. 8vo. 78 X5, pp. 392, 68. APPLETON, Oct. 10",,,,Oct. 10,1910,
5997,"Illus. 8vo. 5 X7], pp. 127, 1s. 6d. net Photography. A complete guide to the Art of BALE, Feb. 10",,,,BALE,,8vo.,"Illus. 8vo. 5 X7], pp. 127, Is. 6d. net Photography. A complete guide to the Art of BALE, Feb. 10",,,,Feb. 10,1910,
6029,"Cr. 8vo. 1s. 3d..... .PITMAN, May 10",,,,PITMAN,1s. 3d.,8vo.,"Cr. 8vo. Is. 3d..... .PITMAN, May 10",,,,May 10,1910,
6092,"Pope (Alexander)-1ssay on Man, Tipistles i, and II. Edit. by E. Frisby. Cr. Svo. limp, s, net NORMAL PRESS, Apr. 10",Pope,Alexander,,NORMAL PRESS,,,"Pope (Alexander)-Issay on Man, Tipistles i, and II. Edit. by E. Frisby. Cr. Svo. limp, IS, net NORMAL PRESS, Apr. 10",Alexander Pope,['Pope (Alexander)'],,Apr. 10,1910,
6194,"Quaint Beasts and Odd Birds, Willoughby (V.) s, 6d. net .Νου. 10",,,,,,,"Quaint Beasts and Odd Birds, Willoughby (V.) IS, 6d. net .Νου. 10",,,,,1910,
6198,"Queensland, Emigration Handbook, id. WYMAN, Mar. 10",,,,WYMAN,,,"Queensland, Emigration Handbook, id. WYMAN, Mar. 10",,,,Mar. 10,1910,
6445,"Roberts, Richard, Young (D. T.) 2s. 6d. net Νου. ΙΟ Roberts (W.)-F. Wheatley, R.A., His Life and Works. With a Catalogue of his Engraved Pictures. 4to. bds. 75, 6d. net, swd. 5s. net (“ Connoisseur Extra Number) OFFICE, Nov. 10","Roberts, Richard, Young",D. T.,,OFFICE,5s.,4to.,"Roberts, Richard, Young (D. T.) 25. 6d. net Νου. ΙΟ Roberts (W.)-F. Wheatley, R.A., His Life and Works. With a Catalogue of his Engraved Pictures. 4to. bds. 75, 6d. net, swd. 55. net (“ Connoisseur Extra Number) OFFICE, Nov. 10","D. T. Roberts, Richard, Young","['Roberts, Richard, Young (D. T.)']",,Nov. 10,1910,net
6558,"Cr. 8vo. 71 x4), pp. 244, 3s. 6d. Ruskin for Boys and Girls, Macgregor (M.) is. 6d. TIOMEOPATHIC PUB. CO., July 10",,,,TIOMEOPATHIC PUB. CO.,6d.,8vo.,"Cr. 8vo. 71 x4), pp. 244, 3s. 6d. Ruskin for Boys and Girls, Macgregor (M.) is. 6d. TIOMEOPATHIC PUB. CO., July 10",,,,July 10,1910,
6561,"PEOPLE'S SUFFRAGE FEDERATION, June 10",,,,PEOPLE'S SUFFRAGE FEDERATION,,,"PEOPLE'S SUFFRAGE FEDERATION, June 10",,,,June 10,1910,
6567,"Rural Rides, Cobbett (W.) 2 vols, ca. is. net Russell (John) — The Task of Rationalism in Jan., llar 10 Retrospect and Prospect. 64 X4, Rus Divinum, Poems, Adam (W. A.) 28. 64. net pp. 80, is. net, swd. 6d. net.... WATTS, A pr. 10","Rural Rides, Cobbett",W.,,WATTS,6d.,,"Rural Rides, Cobbett (W.) 2 vols, ca. is. net Russell (John) — The Task of Rationalism in Jan., llar 10 Retrospect and Prospect. 64 X4, Rus Divinum, Poems, Adam (W. A.) 28. 64. net pp. 80, is. net, swd. 6d. net.... WATTS, A pr. 10","W. Rural Rides, Cobbett","['Rural Rides, Cobbett (W.)']",,A pr. 10,1910,net
6750,"Seamen and Fishermen, Return of the Deaths of WYMAN, Oct. 10",,,,WYMAN,,,"Seamen and Fishermen, Return of the Deaths of WYMAN, Oct. 10",,,,Oct. 10,1910,
6780,"Senn (C. Herman)--1deal Breakfast Dishes, Savouries, and Curries, Narrow Cr. 8vo. 8 X4, pp. 72, 1s. net... .SIMPKIN, May 10",Senn,C. Herman,,SIMPKIN,1s.,8vo.,"Senn (C. Herman)--Ideal Breakfast Dishes, Savouries, and Curries, Narrow Cr. 8vo. 8 X4, pp. 72, Is. net... .SIMPKIN, May 10",C. Herman Senn,['Senn (C. Herman)'],,May 10,1910,net
6829,"Cr. 8vo. is. net, swd. 6d, net (Standard Lib.) METHUEN, Mar. 10",,,,METHUEN,6d.,8vo.,"Cr. 8vo. is. net, swd. 6d, net (Standard Lib.) METHUEN, Mar. 10",,,,Mar. 10,1910,net
6875,"Ship-Surgeon's Handbk., Elder (A. V.) 5s. net Dec. To Shipman (Louis Evan)-D'Arcy of the Guards ; or, The Fortunes of War. Cr. 8vo., pp. 288, swd. is, net MILLS & B., Sep. 10","Ship-Surgeon's Handbk., Elder",A. V.,,MILLS & B.,,8vo.,"Ship-Surgeon's Handbk., Elder (A. V.) 5s. net Dec. To Shipman (Louis Evan)-D'Arcy of the Guards ; or, The Fortunes of War. Cr. 8vo., pp. 288, swd. is, net MILLS & B., Sep. 10","A. V. Ship-Surgeon's Handbk., Elder","[""Ship-Surgeon's Handbk., Elder (A. V.)""]",,Sep. 10,1910,
6879,"Shoemaker (Michael M.)-1slam Lands : Nubia, The Sudan, Tunisia and Algeria. Illus. 8vo. 8} *52, pp. 266, 1os. 6d. net ..PUTNAM, Nov. 10",Shoemaker,Michael M.,,PUTNAM,6d.,8vo.,"Shoemaker (Michael M.)-Islam Lands : Nubia, The Sudan, Tunisia and Algeria. Illus. 8vo. 8} *52, pp. 266, 1os. 6d. net ..PUTNAM, Nov. 10",Michael M. Shoemaker,['Shoemaker (Michael M.)'],,Nov. 10,1910,net
6963,"Slant Book, Newell (P.) 5s.. Νου. Το Slater (Emily 1.)-Stories from the Classics : (1) Jason and the Golden Fleece ; (2) The Heroes of Troy. Illus. Cr. 8vo. 4**7], pp. 80, 4d. net .PITMAN, Mar. 10","Slant Book, Newell",P.,,PITMAN,4d.,8vo.,"Slant Book, Newell (P.) 55.. Νου. Το Slater (Emily 1.)-Stories from the Classics : (1) Jason and the Golden Fleece ; (2) The Heroes of Troy. Illus. Cr. 8vo. 4**7], pp. 80, 4d. net .PITMAN, Mar. 10","P. Slant Book, Newell","['Slant Book, Newell (P.)']",,Mar. 10,1910,net
7040,"1910 3s. 6d. SNARK'S Snark's Winter Annual (The). 1910-11 [Starr Wood.] 4to. swd. is. net H. L. ANGOLD, Nov. 10",,,,H. L. ANGOLD,,4to.,"I910 35. 6d. SNARK'S Snark's Winter Annual (The). 1910-11 [Starr Wood.] 4to. swd. is. net H. L. ANGOLD, Nov. 10",,,,Nov. 10,1910,
7198,"Steen (Jan)-Masterpieces (c. 1626-1679) 18mo. is. net, swd. 6d. net....GOWANS & G., Dec. 10",,,,GOWANS & G.,6d.,,"Steen (Jan)-Masterpieces (c. 1626-1679) 18mo. is. net, swd. 6d. net....GOWANS & G., Dec. 10",,['Steen (Jan)-Masterpieces (c. 1626-1679)'],,Dec. 10,1910,net
7230,"Stevenson, Robert Louis, Day with, Clare (M.) s, net ..Νου. 10",,,,,,,"Stevenson, Robert Louis, Day with, Clare (M.) IS, net ..Νου. 10",,,,,1910,
