,entry,last_name,first_name,title,publisher,price,format,original_entry,author_name,creators,is_editor,date,catalogue_year,is_net
7355,"Sutherland (W. D. M.)-1deals for the Christian Life. Cr. 8vo. 78 X 44, pp. 174, 2s. 6d. net R. SCOTT, Dec. 10",Sutherland,W. D. M.,,R. SCOTT,2s. 6d.,8vo.,"Sutherland (W. D. M.)-Ideals for the Christian Life. Cr. 8vo. 78 X 44, pp. 174, 2s. 6d. net R. SCOTT, Dec. 10",W. D. M. Sutherland,['Sutherland (W. D. M.)'],,Dec. 10,1910,net
7508,"Thames, Mitton (G. E.) and Haslehurst (E. W.) 28. net · June ro Thames Conservancy Report, 1909, 3.d. W'YMAN, July 10","Thames, Mitton",G. E.,,W'YMAN,,,"Thames, Mitton (G. E.) and Haslehurst (E. W.) 28. net · June ro Thames Conservancy Report, 1909, 3.d. W'YMAN, July 10","G. E. Thames, Mitton","['Thames, Mitton (G. E.)', 'Haslehurst (E. W.)']",,July 10,1910,
7552,"Thomson (C. H.) and Skinner (John)—1saiah 1.-XXXIX. 12mo. 61 X 4, pp. 192, 1s. 60. net (Revised Version for Schools) CAMB. UNIV. PRESS, Apr. 10",Thomson,C. H.,,CAMB. UNIV. PRESS,,12mo.,"Thomson (C. H.) and Skinner (John)—Isaiah 1.-XXXIX. 12mo. 61 X 4, pp. 192, Is. 60. net (Revised Version for Schools) CAMB. UNIV. PRESS, Apr. 10",C. H. Thomson,"['Thomson (C. H.)', 'Skinner (John)']",,Apr. 10,1910,
7575,"Thornton (Alfred A.)--Thornton Patents (British and Foreign) 8vo., 21s. net CHARLES JONES, Jan. 10",,,,CHARLES JONES,21s.,,"Thornton (Alfred A.)--Thornton Patents (British and Foreign) 8vo., 21s. net CHARLES JONES, Jan. 10",,"['Thornton (Alfred A.)--Thornton Patents (British)', '--Thornton Patents (Foreign)']",,Jan. 10,1910,net
7583,"Ithr. 2s. net (Everyman's Lib.)..DENT, Sep. 10",Ithr. 2s. net,Everyman's Lib.,,DENT,,,"Ithr. 25. net (Everyman's Lib.)..DENT, Sep. 10",Everyman's Lib. Ithr. 2s. net,"[""Ithr. 2s. net (Everyman's Lib.)""]",,Sep. 10,1910,
7592,"Cr. 8vo. 8 X51, pp. 684, 5s, net Threnodies, Sketches and other Poems. By the REBMAN, Apr. 10",,,,REBMAN,,8vo.,"Cr. 8vo. 8 X51, pp. 684, 5s, net Threnodies, Sketches and other Poems. By the REBMAN, Apr. 10",,,,Apr. 10,1910,
7595,"1s. 62. net, Ithr, 3s, net .. SIMPKIN, Oct. 10",,,,SIMPKIN,3s.,,"Is. 62. net, Ithr, 3s, net .. SIMPKIN, Oct. 10",,,,Oct. 10,1910,net
7616,"Tobacco, Indian, Howard (A. and G. L. C.) No. 1, 6s, net · June ro Tocher (J. F.)-The Book of Buchan. 8vo., 84 x7, pp. 530 (sub) (Peterhead) BUCHAN CLUB, Nov. 10","Tobacco, Indian, Howard",A.,,BUCHAN CLUB,,8vo.,"Tobacco, Indian, Howard (A. and G. L. C.) No. 1, 6s, net · June ro Tocher (J. F.)-The Book of Buchan. 8vo., 84 x7, pp. 530 (sub) (Peterhead) BUCHAN CLUB, Nov. 10","A. Tobacco, Indian, Howard","['Tobacco, Indian, Howard (A.)', 'Tobacco, Indian, Howard (G. L. C.)']",,Nov. 10,1910,
7801,"Venturesome Virgin, Haliiax (R.) 6s..... June ro Vera Cruz, Consular Report for 1909, 1 d. WYMAN, June 10","Venturesome Virgin, Haliiax",R.,,WYMAN,,,"Venturesome Virgin, Haliiax (R.) 6S..... June ro Vera Cruz, Consular Report for 1909, 1 d. WYMAN, June 10","R. Venturesome Virgin, Haliiax","['Venturesome Virgin, Haliiax (R.)']",,June 10,1910,
7817,"Victoria, Emigration Handbook, id. WYMAN, June 10",,,,WYMAN,,,"Victoria, Emigration Handbook, id. WYMAN, June 10",,,,June 10,1910,
7966,"Water Supplies Protection Bill : Report, id. WYMAN, July 10",,,,WYMAN,,,"Water Supplies Protection Bill : Report, id. WYMAN, July 10",,,,July 10,1910,
8055,"Were-Wolf, Beallie (W. B.) 6s. Νου. Το Wemaer (R. M.)-- Romanticism and the Romantic School in Germany. 8vo. 7s. 6d, net APPLETON, Jan. 10","Were-Wolf, Beallie",W. B.,,APPLETON,7s. 6d.,8vo.,"Were-Wolf, Beallie (W. B.) 6s. Νου. Το Wemaer (R. M.)-- Romanticism and the Romantic School in Germany. 8vo. 75. 6d, net APPLETON, Jan. 10","W. B. Were-Wolf, Beallie","['Were-Wolf, Beallie (W. B.)']",,Jan. 10,1910,net
8449,"Young April, Castle (E.) 6d..... Young Crusader (The) 1910. 4to. bds. is. C.E.T.S., Nov. 10","Young April, Castle",E.,,C.E.T.S.,,4to.,"Young April, Castle (E.) 6d..... Young Crusader (The) 1910. 4to. bds. is. C.E.T.S., Nov. 10","E. Young April, Castle","['Young April, Castle (E.)']",,Nov. 10,1910,
