"Cr. 8vo., pp. 370, 28. 6d. ..FROWDE, Oct. 14 Stammering, Hourigan (J.) is. 8d. net ....Sep.<PAGE_NUM:259><DOCUMENT_PAGE_NUM:267> 14"
"71x5, pp. 332, 6s. ....MILLS & B., Apr. 14 Stamp-collecting, Creeke (A. B.) is. net ..Aug.<PAGE_NUM:259><DOCUMENT_PAGE_NUM:267> 14"
"Stacpoole (H. de Vere) — The Crimson azaleas. Stamp duties, Handbk. to, Picken (C. H.) 25. 60 12mo., 7d. net .NEWNES, May 14 net. Feb.<PAGE_NUM:259><DOCUMENT_PAGE_NUM:267> 14"
"8vo. 71 X 5, pp. 320, 38. 6d. (Adelphi library) UNWIN, Jan. 14 Stanford (Sir Charles Villiers) - Pages from an Stacpoole (H. de Vere)-Fanny Lambert unwritten diary. 8vo. 9 x 54, pp 342, 128. 6d. 18mo. 7d. net .NEWNES, July<PAGE_NUM:259><DOCUMENT_PAGE_NUM:267> 14"
"Ireland. With plates of characteristic fossils. Stacpoole (H. de Vere)—Garryowen. I 2mo. By Horace B. Woodward. 3rd edit. Cr. 8vo. 7d. net. NEWNES, June 14 74 x 44, pp. 226, 125. 6d. net STANFORD, Feb.<PAGE_NUM:259><DOCUMENT_PAGE_NUM:267> 14"
"Stacpoole (H. de Vere)-Monsieur de Rochefort : Stanhope (Aubrey)-On the track of the great : a romance of old Paris. Cr. 8vo., 8 X 5, pp. 360, recollections of a special correspondent."" 6s. ..HUTCHINSON, July 14 8vo. 9 X51, pp. 322, 7s. 6d. net NASH, A pr.<PAGE_NUM:259><DOCUMENT_PAGE_NUM:267> 14"
"LANE, June 14 Stanhope (Ghita)—The Life of Charles, Third Stacpoole (H. de Vere)-Patsy. 12mo., 7d. net Earl Stanhope. Rev, and completed by G. P. W. COLLINS, May 14 Gooch. Illus. 8vo. 94 X5ł, pp. 296, ios, net Stacpoole (H. de Vere)—The Pools of silence. LONGMANS, May<PAGE_NUM:259><DOCUMENT_PAGE_NUM:267> 14"
"12mo., 7d. net ...NEWNES, Jan. 14 Stanhope, Lady Hester, Cleveland (Duchess of), Stacpoole (H. de Vere)—The Pools of silence. ..Feb.<PAGE_NUM:259><DOCUMENT_PAGE_NUM:267> 14"
"Stock Exchanges, London and provincial, Ten- year record of prices and dividends, 1904 to 1913. Imp. 8vo., pp. 486, 1os. net E. WILSON, Apr. 14, Stockbroking, &c.: Pitman's Shorthand writers' phrase bks., Is. 6d. net. . May<PAGE_NUM:262><DOCUMENT_PAGE_NUM:270> 14"
"58. net War: a novel, Newton (W. D.) 25. net ..Feb. 14 War, Christianity and, Temple (W.) 2d. net Nov.<PAGE_NUM:286><DOCUMENT_PAGE_NUM:294> 14"
"War : Allies' alphabet, Fay (S. J.) is. net Dec. 14 War correspondents, Famous, Bullard (F. L.) War and alien enemies, Page (A) 5s. net Sep. 14 78. 6d. net. .Nov.<PAGE_NUM:286><DOCUMENT_PAGE_NUM:294> 14"
"War-and Arcadia, Mitford (B.) 6d. ....Mar. 14 War : Day of God, Ingram (A. F. W., Bp.) is, net War and Christian ethics, Barry (F. R.) 6d. net Nov.<PAGE_NUM:286><DOCUMENT_PAGE_NUM:294> 14"
"War: Decisive hour, is it lost? Oldham (J. H.) War and Christianity. By the Archbishop of 2d. net Canterbury and others. 16mo., swd., 6d. net War: Deeds that will never die, Fraser (J. F.) IS. JARROLD, Dec. 14 net.. War and democracy, Seton-Watson (R. W.), &c. War, Diplomatic hist. of the, Price (M.P.) 7s.6d. 28. net ..Dec.<PAGE_NUM:286><DOCUMENT_PAGE_NUM:294> 14"
"net.. War and finance, Radclyffe (R.) is. net ..Oct. 14 War, Effect on commercial engagements, Gore- War and neutrality, Letters to “ Times,"" Holland Browne (F.) 28. 6d. net (T E.) 78. 6d. net ..Feb. 14 War: England, my England, anthology, Good. War and peace, .Nov.<PAGE_NUM:286><DOCUMENT_PAGE_NUM:294> 14"
"Daily Mirror” reflections of, child (G.) 28. 6d. net Haselden (W. K.) 6d. net ..Nov. 14 War: England's mission, Benett (W.) 2d. net Nov.<PAGE_NUM:286><DOCUMENT_PAGE_NUM:294> 14"
"War, Astrological survey of the. 6d. net Aug. 14 War: French Sir John): Despatches (Mons, &c.) War, Atkins at, Kilpatrick (J. A.) is. net Oct. 14 IS. net Dec.<PAGE_NUM:286><DOCUMENT_PAGE_NUM:294> 14"
"25. 6d, net ..A. W. SHAW, Aug. 14 War, God, humanity and the, Morgan (G. C.) is. War, Boys' illus. bk. of the. 35. 60. ..Nov.<PAGE_NUM:286><DOCUMENT_PAGE_NUM:294> 14"
"net War: Britain and Armageddon. 6d. net Oct. 14 War, Great. Edit. by Wilson (H. W.). Pt. 1, War : Britain and Turkey, Cook (Sir E.) 2d. Dec."" 14 6d. net .Aug.<PAGE_NUM:286><DOCUMENT_PAGE_NUM:294> 14"
"War : Britain justified, Ballard (F.) is. net Dec. 14 War, Great, Wilson (H. W.) and Hammerton War: Britain's call to arms, Webster (N. H.) id. (J. A.) Vol. 1. 128., 14s. net .Dec.<PAGE_NUM:286><DOCUMENT_PAGE_NUM:294> 14"
"War: Brothers all, Bevan (E.) 2d. net ..Nov. 14 War: Heroes all, Wallace (E.) 3s. 6d. .. Nov.<PAGE_NUM:286><DOCUMENT_PAGE_NUM:294> 14"
"Cr. 8vo., pp. 320, 25. net ; Swil. is, net Weigall (Ethel) -Mrs. Trigley's visitors. Cr. 8vo. SIDGWICK & J., Oct. 14 78 X 5, pp. 262, 2s... ....S.S.U., Oct.<PAGE_NUM:291><DOCUMENT_PAGE_NUM:299> 14"
"300, 6s. net HEATH, CRANTOV, May 14 Weights and measures, Early, Warren (Sir C.) .Jan.<PAGE_NUM:291><DOCUMENT_PAGE_NUM:299> 14"
"Webster (F. A. M.)-From recruit to firing-line. Cr. 8vo. 7* X 5, pp. 216, 25. net Weights and measures-Report by Board of SIDGWICK & J., Dec. 14 Trade on their proceedings and business under Webster (F. S.)—Trusting and triumphing. the Weights and Measures Acts, for 1913, illus. Cr. 8vo. 73 x5, pp. 274, 2s. net R.T.S., Mar. 14 41d. WYMAN, Mar.<PAGE_NUM:291><DOCUMENT_PAGE_NUM:299> 14"
"Webster (Henry Mitchell) ——The Butterfly : Weindel (Henri de) --Behind the scenes at the novel. Cr. 8vo. 78 X 5, pp. 318, 6s. Court of Vienna. Popular edit. Cr. 8vo., APPLETON, Oct. 14 pp. 256, 25. net...... .LONG, Oct.<PAGE_NUM:291><DOCUMENT_PAGE_NUM:299> 14"
"CAMB. UNIV. PRESS, Nov. 14 Welcome readers, “ A. L.” Bks. 4A and 5A, ea. Webster (Mrs. J. J.) and Llewelyn (Mrs. H.)-- rod. net. .Sep.<PAGE_NUM:291><DOCUMENT_PAGE_NUM:299> 14"
"MURRAY, Feb. 14 Well by Bethlehem's gate, Knight (W. A.) is. 6d. Webster's Revised unabridged dictionary of the net English language. 4to. 215. net; thin paper Well sinking, Harrison (B. A.) is. 60. net May<PAGE_NUM:291><DOCUMENT_PAGE_NUM:299> 14"
"Wellbye (Reginald)—Road touring in central Webster's Royal red book, May, 1914. Ryl. England. 12mo. 71X4, pp. 98, is. 6d. net. 16mo. 58. net WEBSTER, May 14 (Roadfaring guides, vol. 2) ....LARBY, Apr.<PAGE_NUM:291><DOCUMENT_PAGE_NUM:299> 14"
"Webster's Royal red book. January, 1915. Ryl. Weller (Charles Heald) -Athens and its monu- 16mo. 59. net OFFICE, Dec. 14 ments. Illus. 8vo. 8* X54, pp. 438, 178. net Wedding day, Williamson (C. N. and A. M.) MACMILLAN, Jan.<PAGE_NUM:291><DOCUMENT_PAGE_NUM:299> 14"
"... July 14 Wellesley papers (The) : The life and corres- Wee bits o' fhings, Aris (E.) is, net .Sep. 14 pondence of Richard Colley Wellesley, Marquess Wee Jenny Mouse, Aris (E.)is. net ....Sep. 14 Wellesley, 1760-1842. By the editor of ""The Wee Johnnie Patterson, &c., Stevenson (W.G.) is. Windham papers.' 2 vols. 8vo. 8 X 51, pp. net ..Nov.<PAGE_NUM:291><DOCUMENT_PAGE_NUM:299> 14"
"Weedon (W. J.)-In the grip of a demon. Cr. 8vo., Wellington, Somerset : Woollen manuf., Fox 6s. DRANE, Mar. 14 (J. H) Ios, 6d. net . May<PAGE_NUM:291><DOCUMENT_PAGE_NUM:299> 14"
"Jan. 14 Woman in China, Gaunt (M.) 155. net....dov.<PAGE_NUM:300><DOCUMENT_PAGE_NUM:308> 14"
"people to learn English, 12mo., pp. 64, sud. 6d. Woman's place in world of letters, Green (A. S.) net SIMPKIN, Nov. 14 28. net .Jan.<PAGE_NUM:300><DOCUMENT_PAGE_NUM:308> 14"
"SIMPKIN. Nov. 14 Women: White slaves of toil, Willis (W. N.) Wizard's gillie, etc., McKay (J. G.) 25. 6d. net IS. net .Mar.<PAGE_NUM:300><DOCUMENT_PAGE_NUM:308> 14"
"stories. Cr. 8vo. 76 X 5, pp. 324, 6s. Women, Education of, in Japan, Burton (M. E.) METHUEN, Jan. 14 3s. 6d. net .. Sep.<PAGE_NUM:300><DOCUMENT_PAGE_NUM:308> 14"
"swd., 60. .S. PAUL, A nr. 14 Women, Notable, in history, Abbott (W. J.) Iós. Wold wavs a-gwain, Read (J.) 35. 60. net Aug. 14 net .Mar.<PAGE_NUM:300><DOCUMENT_PAGE_NUM:308> 14"
"Jan. 14 Women of France, Remarkable, Haggard (A.C.P.) Wolf-on-the-trail, Walkey (S.) 35. 6d.... Sep. 14 16s, net. ..Feb.<PAGE_NUM:300><DOCUMENT_PAGE_NUM:308> 14"
"Jan. 14 Women's movement, Religious aspect of the, 4d. Woman alone, Harrison (M.) 6S. June<PAGE_NUM:300><DOCUMENT_PAGE_NUM:308> 14"
"NEWNES, Feb. 14 Wonder year, Goldring (M.) 6s. meil. Nov<PAGE_NUM:300><DOCUMENT_PAGE_NUM:308> 14"
"an Year of grace, Hodges (G.) advent to Trinity ; Young (F. E. Brett)-Robert Bridges : a critical Trinity to Advent, ea. 55. 6d. net...... June 14 study. 8vo. 9 X57, pp. 216, 78. 6d. net M. SECKER, Seb.<PAGE_NUM:304><DOCUMENT_PAGE_NUM:312> 14"
"Yearly digest, 1913. 8vo. 155. BUTTERWORTH, Jan. 14 Young (F. E. Mills)—The Purple mists. Cr. 8vo. Yearly Supreme Court practice, 1915. 8vo., 77X5, pp. 364, 6s...... ..LANE, Jan.<PAGE_NUM:304><DOCUMENT_PAGE_NUM:312> 14"
"Years of forgetting, Russell (L.) 6s. ...Apr. 14 Young (Filson) ed.-Trial of the Seddons. 8vo. Year's work in classical studies (The), 1913. 8vo. 81X51, pp. 450, 5s. net (Notable English trials) swd., 28. 6d. net.... . MURRAY, Feb.<PAGE_NUM:304><DOCUMENT_PAGE_NUM:312> 14"
"6d. net ..NELSON, Apr. 14 Young Franc-Tireurs, Henty (G. A.) is, net May<PAGE_NUM:304><DOCUMENT_PAGE_NUM:312> 14"
"Yorke (Curtis)-Delphine. 8vo., swd., 6d. Younger (W. R.)-A Summary of Gibbon's LONG, Mar. 14 History of Rome,"" to the Fall of the Western Yorke (Curtis)—The Girl in grey. 12mo, 7d. net Empire in the year 476 A.D. 8vo. 7+ x5), pp. LONG, Mar.<PAGE_NUM:304><DOCUMENT_PAGE_NUM:312> 14"
"Yorke (Curtis)—Irresponsible Kitty. 12mo., 7d. Younger generation, Key (E.) 6s, net.... .LONG, July 14 Youngest world, Dunn (R.) 6s. July<PAGE_NUM:304><DOCUMENT_PAGE_NUM:312> 14"
"Yorke (Curtis)—Mollie Deverill. 12mo. 7d. net Youtz (H. A.)-The Enlarging conception of God. LONG, May 14 Cr. 8vo., 55. 6d. net .... MACMILLAN, June<PAGE_NUM:304><DOCUMENT_PAGE_NUM:312> 14"
"Yorko (Curtis) —The Woman Ruth. Cr. 8vo. 74X4, pp. 316, 6s. ...LONG, Nov. 14 Yule (Sir Henry) ed. trans.- Cathay and the way Yorkshire, Place-names of S.W., Goodall (A.) thither : being a collection of mediæval no ices. 75. 6d. net .. Sep.<PAGE_NUM:304><DOCUMENT_PAGE_NUM:312> 14"
"of China. New edit., rev. throughout in the Yorkshire tyke, Cowling (G. H.) 25. 6d., Is. 6d. net light of recent discoveries. By Henri Cordier. Vol. 2. Ordoric of Pordenone. 8vo. 9X57, pp. You and I, Monroe (H.) 5s. 6d. net ......Nov. 14 367 (sub.) HAKLUYT Soc., Feb.<PAGE_NUM:304><DOCUMENT_PAGE_NUM:312> 14"
"Young (Ernest)–From Russia to Siam : with a Zahm (A. F.)-Report on European aeronautical voyage down the Danube. Illus. 8vo. 9X51, laboratories. (Smithsonian Misc. Coll.). Illus. pp. 340, 1os. 6d. net......M. Goschey, May 14 8vo. 91 X64, pp. 23, swd. is. net WESLEY, Dec.<PAGE_NUM:304><DOCUMENT_PAGE_NUM:312> 14"
