"Bames (Irene H.)-Doctor Alec's son. Cr. 8vo. 71 x 44, pp. 192, is. 6d. CHURCH MISS. Soc. Nov. 11, Bames (R.)—Chrysanthemums for exhibitors and amateurs. Cr, 8vo. Swd. 6d. net CABLE PUB, Co., May II"
"Civil procedure, Shearwood's. 6s. ..May 11, Civil Service, Cornering of the, Ammon (C. G.) id. Apr. II"
"Darwin (Sir George Howard)—The Tides. 3rd edit. Cr. 8vo. 7* X5, pp. 462, 75. 6d. net MURRAY July 11, Dasent (Arthur Irwin)-The Speakers of the House of Commons from the earliest times to the present day. Illus. 8vo. 84x54, pp. 496, 2IS, net. ..LANE, Apr. II"
"Jan. 11 Dishes, Dainty, St. Clair (Lady H.) is. net Dimock (N.)-Eucharistic worship in the English Νου. ΙΙ Church. Cr. 8vo., 25. 6d. net Dispensing, Notes on, Stirling (G.) is. 6d. net LONGMANS, May II"
"Diplomatist's wife in Japan, Fraser (Mrs. H.) Ditman (Norman Edward)—Education and IS. net . Apr. 11 preventive medicine. Ryl. 8vo. swd. is. 6d. net Diplomatist's wife in many lands, Fraser (Mrs. H.) FROWDE, Sep. 11"
"Disaster, Margueritte (P. and V.) is. 6d., 25. net Diver (Maud)-Lilamani: a study in possi- July 11 bilities. Cr. 8vo. 7* X5, pp. 432, 6s. Disciple, Bourget (P.) 18. net .Feb. 11"
"(C. M.) 6s. net .Dec. 11 Football annual, Gamage's Association, 1911-12. Flowers, Wild, and their wonderful ways, Hall i 60. net. .Sep. II"
"(C. A.) is. 6d. net Oct. 11 Football annual, Spalding's, 1911, 6d. net Flowers, wild, as they grow, Corke (H. E.) and Sep. 11"
"Nuttall (G. C.) 5s. net .. Feb. 11 Football, Association, Williams (A. J.) 6d. Jan. II"
"Welch -C.) Ios. 6d. net. Dec. II Footner (Hulbert)--Two on the trail. Cr. 8vo. Flutterfly, Burnham (C. L.) 35. 6d.. ..Oct. 11 71 X5, pp. 360, 6s......... METHUEN, July 11"
"Herrick (F. H.)—Natural history of the American lobster. 19 col. plates, 42 illus. Imp. 8vo., II X7, pp. 408, swd. gs. net (Bureau of Fisheries): WESLEY, Nov. 11, Herrick (Robert)-Selections from Herrick. 12mo 6X48, Ithr., boxed, is, 6d. net. (Selected ser., 14). SIEGLE, H.,May II"
"(Annesley)--saith Mrs. Grundy. CAMB. UNIV . PRESS, Jan. 11 Kec. 570.51x3, pp. 320, 38. od. Losg, June 11"
"2 parts. Ryl. 8vo. 9* X67, pp. 1292, 638. net Lynch (Denis M.)— The Elements of Irish coin- GURNEY & J., Oct. II position : with grammar, graduated exercises, Lungs and pleuræ, Diseases of, Powell (Sir R. D.) full vocabularies, &c. Cr. 8vo. 71 X 48, pp. 150, and Hartley (P. H.-S.) 21s. net........ June 11 IS. 3d. net ..M. H. GILL, Jan. II"
"(H.) 39. 6d. net.. ..May 11 Lytton (Lord)-Harold, the last of the Saxon Kings. Cr. 8vo. 7} * 41, pp. 456, is, and 2s. Lyall (David)—The Heritage of the free. Popular PARTRIDGE, Sep. II"
"Mackie (John)-In search of Smith. . Pete'A. RIVERS , Aug. 11 Maartes, p. 277,23. odolnet Richards, Oct. 11"
"Maskelyne (Nevil) and Devant (David)--Our magic: the art of magic, the theory of magic, the practice of magic. Illus, 8vo. 81 X 51, pp. 504, 78. 6d. net ROUTLEDGE, Nov. 11, Masks and minstrels of new Germany, Pollard (P.) 59, net... .Oct, 11"
"Mines) WESLEY, July 11 Monroe (P.)- Syllabus of a course of study on Mole (Marion)-The Wind bloweth. Cr. 8vo. Cr. the history and principles of education. 74 X4*, pp. 318, 6s....... A. MELROSE, Oct. II"
"Momerie (Alfred Williams)--Modern scepticism Montesquieu (Charles de S., Baron de)-Euvres. and modern faith. Cr. 8vo. 71 X 4*, pp. 146, Tome premier, Lettres persanes. 12mo., pp. 38. 6d. net W. BLACKWOOD, Feb. 11 254, IS. net.. .DENT, Oct. II"
": 4s, net WALLIS-TAYLER Wake up England : a speech delivered by H.M. Walker (Mrs. E. A.)-From the Crib to the Cross : the King when Prince of Wales. Ryl. 16mo., the story of Jesus for little children. 2nd edit. bds., is, net...... .NISBET, May 11 Cr. Svo. 71 x 41, pp. 318, 25. 6d. Wakefield Diocesan church calendar, clergy list BAGSTER, Nov. II"
"Walford (L. B.)-Star. Cr. 8vo. 71 x5, pp. 370, Waller (Mary E.)-My ragpicker. 12mo. 71 x 41, 28. net NELSON, Oct. 11 pp. 134, 2s. net. .A. MELROSE, Od. II"
"BAILLIERE, June 11 Wallis-Tayler (A. J.)-The Pocket-book of Walker (A. Stodart)-Breakers of the law. refrigeration and ice-making. 5th edit., rev. and Cr. 8vo. 71 x5, pp. 288, 6s. ....NASH, Feb. II enlarged. 12mo. 7 X 41, pp. 206, 3s. 6d. net Walker (E. A.) see Williams (A. J.) and Walker C. LOCKWOOD, May II"
