"Besant (Sir Walter)-The Rebel queen. Cr. 8vo. pp. 380, is. net. (Khakilib.) CHATTO, Mar. 15, Besant (Sir Walter) - St. Katherine's by the Tower. Cr. 8vo., pp. 382, is. net. (Khaki library) . CHATTO, Jan, 15"
"Bruising of Belgium, sermons, Mursell (W. A.) Buffs (The), East Kent Regiment. 18mo. 61 x 4}, 28. 6d. net .....Nov. 15 pp. 62, is. net; swd. 6d. net. (Stories of our Brunel's Tower, Phillpotts (E.) 6s. ..Mar. 15 regiments) . SISLEY, Aug. 15"
"Cr. 8vo. 71 X41, pp. 320, 6S... SIMPKIN, Jan. 15 Building construction, Notes on, Rivington's. (Twelvetrees) 2 pts. ea. 78. 6d. net ....Sep. 15"
"71 X5, pp. 254, is, net ..BLACKWOOD, Oct. 15 Bulgaria, Fox (F.) 10s. net. . Apr. 15"
"pp. 428, 78. 6d. net ....LIVINGSTONE, July 15 Bull (Paul B.)—The Sacramental principle. Cr. 8vo. 8 X 5, pp. 222, 3s. 6d. net Buchanan (Robert)— The New Abelard: a romance LONGMANS, Mar. 15"
"8vo. 71 x5, pp. 316, 6s. ..MILLS & B., Jan. 15 Bullivant (Cecil H.)-Every boy's bk. of hobbies. Cheaper ed. 8vo. 8 1 X 51, pp. 540, 39. 60. Budden (Charles W.)--Model-making for the JACK, Nov. 15"
"WYMAN, May 15 Bunch of poppies, Meredith (H.) 6s. Νου, 15"
"Cup of blessing (The). 32mo., swd. 2d. SPOTTISWOODE, July 15, Cup of war (The). By the author of “ Especially, &c. 12mo. 63 x 44, pp. 62, is, net ; swd. 6d. net LONGMANS, May 15"
"Gardner (Monica M.)— Poland : a study in national idealism. Cr. 8vo. 74 x 5, pp. 256, 35. 6d. net BURNS & o., Dec. 15 (Page) 103. 6d. net... Gardner (Percy)- The Ephesian Gospel. Cr. 8vo. 7} X 5, pp. 374, 5s. net WILLIAMS & N., June 15"
"Kean (Francis J.)--The Petrol engine : a text-bk.. dealing with the principles of design and con-- struction, with a special chapter on the two- stroke engine. 8vo. 33 x5, pp. 138, 45. net SPON, Oct. 15; Kearton (Cherry)-Wild life across the world.. Intro. by Theodore Roosevelt. Ryl. 8vo.. 83 x6, pp. 316, 6s. net HODDER & S., Oct. 15."
"Legislation (Emergency)-Manual of. Supp. No. 4, to Aug. 31, 1915, 25. 6d. WYMAN, Oct. 15, Legislation (Private) Procedure (Scotland) Act, 1899— Jnl. of proceedings upon applications for provisional orders under. ea. 3d. WYMAN, Jan. 15"
"Local Legislation (Select Com. on)-Special WYMAN, May 15 zd, 45. on Nov. 15"
"McDowall (Stewart A.)-Evolution and spiritual life. Cr. 8vo. 71 x 48, pp. 332, 6s. net CAMB. UNIV. PR., June 15, Mc Do well (John)---Dwight L. Moody. Cr. 8vo. bds., is. net .REVELL, May 15"
"8vo., pp. 345, swd. 135. 6d... WESLEY, Mar. 15 Marriage service, Retention of word obey Marine Bd. Examinations (Local)-Reduction to in, Legg (J. W.) 25. 6d. net. .. June 15"
"soundings for 1915, Maxwell (É. W.) is. net Marriages are made in Heaven-and elsewhere, Apr. 15 Price (G.) 6d. net ...Feb. 15"
"Feb. 15 Married women's work, Black (C.) 28. 6d. net Marine steam engine, Sennett (R.) and Orani Sep. 15"
"Mark (Thiselton)-Factors in conduct. Cr. 8vo. 8 x 5, pp. 128, 35. 6d. net ....UNWIN, Mar. 15 Marsh (Lewis)--The British Isles. Cr. 8vo., ed. Mark Seaworth, Kingston (W. H. G.) rod. net (Rambler travel bks.) .BLACKIE, Nov. 15"
"Cammaerts. Cr. 8vo. 71 x 5, pp. 138, 25. 6d. net E. MACDONALT, Aug. 15 Marsh (Richard)—The Flying girl. Cr. 8vo. Marksmanship for boys, Baden-Powell (Sir R.) 3d 78 x 4, pp. 320, 6s. .. WARD, L., Sep. 15"
"plants. Vol. 4, Monocotyledones. II X8, pp. 208, 425. net .WESLEY, Nov. 15 Marsh (Richard)-A Master of deception. 8vo. swd. 6d. ...CASSELL, June 15"
"(Clarendon Pr.) MILFORD, Oct. 15 Marsh (Richard)-A Royal indiscretion. 8vo. Marlowe (Christopher) Marlowe's Doctor swd. 6d. ..COLLINS, June 15"
"Adolphus W. Ward, and notes by C. B. Wheeler. Fcap 8vo. 6 X 4, pp. 323. Marsh (Richard)—The Woman in the car. Cr. (Clarendon Pr.) MILFORD, July 15 8vo. 74 X5, pp. 318, 6s. ....UNWIN, Mar. 15"
"pp. 332, swd. is. net....Hodder & S., June 15 Nadja-Love and war. IS. net ........Oct, 15"
"suggest, Fry (Sir F. and A.) 25. 6d. net Aug. 15 Nairn, Counties of Moray and, Matheson (C.) IS. 6d. net Mar. 15"
"Myddleton (Fay)—Souris: a novel. Cr. 8vo. 71 X41, pp. 316, 6s... MAUNSEL, Mar. 15 Nairne (w. P.)— Dewrgalon Papua (James Chalmers). Cyfieithiedig Gan Bodfan. (Welsh Myddleton (Fay)—Souris. Cheap ed. Cr. 8vo. edit. of “Greatheart of Papua."") Cr. 8vo. 7* X 5, pp. 316, 2s. net ....MAUNSEL, Oct. 15"
"Nankivell (Constance)-A Scheme of teaching Mysterious Mr. Sabin, Oppenheim (E. P.) 25. net for the Church's year and a year's course of June 15 lessons for Sunday School classes. Cr. Svo. Mysterious three, Le Queux (W.) 6s. . Apr. 15 74 X 48, pp. 272, 2s. 6d. net ALLENSON, Oct. 15"
"Mystery of Castle Veor, Cowper (F. E.) 25. Oct. 15 Napoleon in exile, Young (N.) 325. net..Mar. 15"
"Mystery of Enid Belairs, Whitelaw (D.) 6s. Feb. 15 Napoleon : The Little Corporal, his rise, decline and fall, O'Hara (M. M.) 25. 6d. net.... June 15"
"Mystery of Lucien Delorme, Téramond (G. de) 6s. Napoleon III and the women he loved, Fleisch- Apr. 15 main (H.) 7s. 671. net. ..Mar. 15"
"Mystery of the Boule cabinet, Stevenson (B. E.) Napoleon's death-mask, Story of, Watson 6s. .Apr.15 (G. L. de St. M.) 6s. net Mar. 15"
"Mystery of the green ray, Le Queux (W.) 28. net Nassau (Robert H.)—Where animals talk ; July 15 with African folk lore tales. Cr. 8vo. 71 X 5, pp. Mystery of the islands, Mulliken (Mrs. E. G.) 253, 55. net .....DUCKWORTH, Oct. 15"
"Mysticism and war, Underhill (E.) 3d, net Apr. 15 National finance, System of, Young (E. H.) 75. 60. Mysticism : Christianity as mystical fact, &c., net Mar. 15"
"May 15 National Gallery Committee-Enquiry into reten- Mysticism : Religion and reality, Tuckwell tion of important pictures in this country: (J. H.) 75. 6d. net .Oct. 15"
"i Newton (W. Douglas)—The Undying story : the work of the British Expeditionary Force on the Continent, from Mons, Aug. 23rd, 1914, to Ypres, Nov. 15th, 1914. Cr. 8vo. 71 X 4*, pp. 384, 6s. net . JARROLD, Sep. 15"
"Pratt (Edwin A.)-The Rise of rail-power in war and conquest, 1833-1914. With a bibliog. 8vo. 81x55, pp. 418, 75. 6d. net P.S. KING, Dec. 15, Pratt (Lucy)---Felix tells it. Cr. 8vo. 71x41, pp. 366, 6s. ..APPLETON, May 15"
"Committee on : ist Report, Foreign-going Shorthand: Rip Van Winkle, Irving (W.) passenger steamers. Vol. i, Report and appen- (Advanced style) 6d. net dices. 9d. . WYMAN, Jan. 15 Shorthand : Selections from American authors: IS. Shipping (Merchant), Sub-division of ships- easy advan. style (Pitman's] Cent. edit. net Bulk-heads and watertight compartments, .May 15"
"IOS. Shorthand writers' phrase books and guides : net , Feb. Ships, Bk. of British, Mason (F. H.) 3s. 64. Oct. 15 Banking, Pitman's. IS. 6d, net ....Feb. 15"
"Chart of, Liddell (K.) 6d. net ........ Aug. 15 Shumaker (E. Ellsworth)-The World crisis and Ships of the British, French, Russian and German the way to peace. 7} x 48, pp. 110, 2s. 6d. net Navies : their names, class, tonnage and date PUTNAM, June 15"
"of completion. 32mo., swd. 6d. net Siamese language, Student's manual of, Cart- G. F. HARNDEN, Mar. 15 wright (B. O.) 125. 6d. Ships, War, Structural design of, Hovgaard (W.) Siberia, Aboriginal, Czaplicka (M. A.) 145. net 2IS. net ..Feb., May 15"
"a study in the early history of Dumfries. 91x6, pp. 52, is. net Sibree (James)--A Naturalist in Madagascar : (Dumfries) HUNTER, WATSON, Dec. 15 observation, experiences and impressions of Shirley (Ralph)—The Angel warriors at Mons : over fifty years' intimate association with the an authentic record. Cr. 8vo., pp. 16, swd. id. natives and study of the animal and vegetable NEWSPAPER PUB. Co., Sep. 15 life of the Island. 8vo. 9 X 51, pp. 322, 16s. net Shirley's plays, Relations of to Eliz.drama. SEELEY, S., Oct. 15"
"Forsythe (R. S.) 8s. 6d. net . ...Feb. 15 Sicilian studies, Hood (A. N.) 55. net ..Sep. 15"
"Shorthand : Legend of Sleepy Hollow (advanced Sidonius---Letters. Trans. with intro, and notes s.) Irving (W.) 8d. net ..Aug. 15 by O. M. Dalton. Vols. 1 and 2. Fcap. 8vo. Shorthand, Pitman's Commercial readers in : 7x41, pp. 270, pp. 268, ea. 35. 6d. net inter. style. No. 2, Commodities. 6d. net (Clarendon Pr.) MILFORD Feb. 15"
"IS. netj. .. June 15 Sight to the blind, Furman (L.) 45. 6d. net Jan, 15"
"Cr. 8vo. 71 x 5, pp. 160, 28. net BELL, Nov. 15 Smith (H.) see Wright (J.) and Smith. Smith (Alexander)-A Summer in Skye. New ed. Smith (H. Clifford)—The Goldsmith and the young 12mo., pp. 576, bds. is. net .NIMMO, June 15"
"Smith (B. T. D.)-The Story of the Eucharistic Smith (H. G.) and Ball (G. H.)-English gram- liturgy. Pp. 31, 3d. ...S.P.C.K., Nov. 15 mar, with analysis and parsing. Being Pt. 1 Smith (C. Fox)-The Naval crown : ballads of English grammar and composition.” and songs of the war. 16mo., pp. 64 swd., Cr. 8vo. 71 X 5, pp. 140, Is. 6d. MILLS & B., Aug. 15"
"repoit: Zoology. Vol. 2, no. 4, Mollusca. Smith (J. Allen) — The Spirit of American govern- British Museuni (N.H.) 45. .Apr. 15 ment. New ed. Cr. 8vo., 28. net Smith (E. J.)-Maternity and child welfare : a MACMILLAN, Dec. 15"
"animals. Cr. 8vo. 73 x 44, pp. 206, 3s. net Smith (J. F.)-My father's business and mine. CAMB. UNIV. PR., June 15 Cr. 8vo. 38. 6d. net .REVELL, Jan, 15"
"Smith (Mrs. George)-A Thackeray reader. Cr. 8vo. 71 x 54, pp. 160, Is. 6d. Smith (V. A.)—The Oxford student's history of (Clarendon Press), MILFORD, Feb. 15 India. 5th ed., rev. and enlarged. Illus. Cr. Smith (George A.) and Bartholomew (J. G.)- 8vo. 71 x 54, pp. 384, 28. 6d. net Atlas of the historical geography of the Holy (Clarendon Pr.) MILFORD, Sep. 15"
"Steel metallurgy, British and German, Arnold (J. O.) 2d. net Feb. 15- Steel, Structural, drafting and elem. design, Conklin (C. D.) 1os. 6d. net ...Mar. 15"
"8vo. 81x55, pp. 90, bds. Is. net Tagore, Sir Rabindranath, Six portraits of, HODDER & S., May 15 Rothenstein (W.) 1os. net ..Nov. 15"
"SMITH, E., Feb. 15 Tailoring industry, Estab. of minimum rates in, Sykes (Sir Mark)—The Caliphs' last heritage : Tawney (R. H.) 3s. 6d. net. ...Apr. 15"
"pp. 650, 2os. net MACMILLAN, Oct. 15 Tainted gold, Williams (H. N.) 6s....... Mar. 15"
"Jan. 15 Talbot (H. H.)-Blackie's Modern business arith- Syrett (N.)-The Castle of Four Towers. Illus. by metic. 12mo., pp. 124, is. BLACKIE, Feb. 15"
"S. Reid and D. Andrews, New ed. Fcap. 4to. 84 X 7, pp. 134, 23. 6d. ......MILFORD, July 15 Talbot (Henry H.)-A New commercial arith- metic. Pt. 2, without answers. Cr. 8vo. Syrett (Netta)—The Victorians. Cr. 8vo. 78x4X, 71 X 5, Is. net . ARNOLD, Oct. 15"
"Adam Szymanski; Stefan Zeromski; Waclaw T. Haviland Hicks, freshman, Elderdice (J. R.) Sieroszewski. Trans. by Else C. M. Benecke. 6s. ... Nov. 15 Cr. 8vo. 73 X5, pp. 206, 35. 6d. net T. J. C. R.-French military pocket vocabulary. BLACKWELL, Oct. 15"
"Tables, squares and logarithms, Inskip's 155. Tales from the Odyssey. Cr. 8vo., pp. 22, swd., net ..May 15 itd. (A.L. Bright story readers) Tacitus-Annals. Bk. 4. Ed. with intro. and ARNOLD, Nov. 15"
"ST. CATHERINE PRISS, Feb. 15 Talks by Abdul Baba. 28. 6d. net ... Apr. 15"
"pp. 336, 7s. 6d. net ......E. ARNOLD, Feb. 15 Temperance, Scotland, `Act, 1913 and Intox. Liquor Temp. Restric. Act, 1914, Dewar (D.) Taylor (Winifred L.)—The Man behind the bars. New ed. Cr. 8vo. 71 x 51, pp. 400, 6s. net Temperance, taxation and housing reform, BICKERS, Sep. 15"
"Cr. 8vo. 74 x 4, pp. 304,6s. HEINEMANN, May 15 Temple and the doctrine of holiness, The, Hippis- Tchekov. See also Chekov ley (E. W.) is. net .. Aug. 15"
"Plumon (E.) 28. net ...Jan. 15 Tennyson (Alfred, Lord)-Morte d'Arthur. Repr. Teddy Tail of the “ Daily Mail ” in nursery rhyme in col, after drawings by Alberto Sangorski. land, Folkard (C.) is. 6d. net.. Cheaper ed. Folio, 10% X8, 35. 6d. net Teeth of the tiger, Leblanc (M.) 6s. .... Apr. 15"
"Thermochemistry, Thomsen (J.) 78. 6d. net June 15, Thermodynamics: Conversion chart, Woljard (M. R.) and Carpenter (C. K.) is. net. .Feb. 15"
"Treaty Series, 1915—No. 5, Convention between U.K. and the Netherlands, renewing for a further period of five years the Arbitration Convention of Feb. 15, 1905. Signed at London, Mar. 25, 1915. d. WYMAN, Aug. 15"
