"Canadian nights, Dunraven (Earl of) 7s. 60. net Capen (E. W.)-Sociological progress in mission May 14 lands. 8vo. 58. net. ..REVELL, June<PAGE_NUM:51><DOCUMENT_PAGE_NUM:59> 14"
"Canadian people, Short hist. of, Bryce (G.) ios. 6d. Capes (Bernard)--The Story of Fifine. Cr. 8vo. net.. . June 14 71 X 5, pp. 324, 6s. CONSTABLE, June<PAGE_NUM:51><DOCUMENT_PAGE_NUM:59> 14"
"Candle and crib, Purdon (K. F.) is. net Dec. 14 Capricious Caroline, Albanesi (E. M.) 7d. net Candytuft-I mean Veronica, Barnes-Grundy (11.) May<PAGE_NUM:51><DOCUMENT_PAGE_NUM:59> 14"
"6s. ..Sep. 14 Capstick (J. W.)—Sound: an elementary text- Cannan (Gilbert)-Love. Cr. 8vo., pp. 58, 25. net book for schools and colleges. Cr. 8vo. 71 x 41, (Fellowship books) BATSFORD, Mar. 14 pp. 304, 4s. 6d... CAMB. UNIV. PRESS, Dec.<PAGE_NUM:51><DOCUMENT_PAGE_NUM:59> 13"
"M. SECKER, Feb. 14 Captain Nancy, Moore (D.) 35. 6d. .Sep.<PAGE_NUM:51><DOCUMENT_PAGE_NUM:59> 14"
"(Art and craft of letters)....M. SECKER, May 14 Captain of the Gordons (A): service experiences, Cannan (Fdwin)--Wealth : a brief explanation of 1900-1909. Edit. by his mother, Mrs. Margaret Miller, and his sister, Helen Russell Miller. Cr. 8vo. the causes of economic welfare. 8vo. 9 X5}, pp. 316, Ios. 6d. net Low, Dec.<PAGE_NUM:51><DOCUMENT_PAGE_NUM:59> 13"
"38 od net Canon of the New Test., Polkinghorne (G. W.) is. Road book and guide (The), 1914. July 14 Cr. 8vo., Ithr., 125. 6d. net CAR ILLUSTRATED,"" Apr.<PAGE_NUM:51><DOCUMENT_PAGE_NUM:59> 14"
"Coney (H. R. H.) 6d. net .July 14 Career of Mr. P. Prendergast, Sackville (Lady M.) Cap of youth, Albanesi (E. M.) 6s. .. July<PAGE_NUM:51><DOCUMENT_PAGE_NUM:59> 14"
"for 1914-15. d. .WYMAN, Mar. 14 Civilisation, Theory of, Douglas (S. O. G.) 5s. net Civil Service-Estimates, 1914-15. Class I, Civilisations of India, China, &c., Dickinson Public works and buildings, 8d. ; 2, Salaries and (G. L.) is. 6d. net .Nov.<PAGE_NUM:62><DOCUMENT_PAGE_NUM:70> 14"
"2d. WYMAN, Feb. 14 Clark (Arthur J.)-Mine ownı : a bundle of essays, 8vo. 81x6, pp. 190, 5s, net R. Scott, Dec.<PAGE_NUM:62><DOCUMENT_PAGE_NUM:70> 13"
"Civil Service-Supplementary estimate, 1914-5, 2ļd.; Ditto, ld. WYMAN, July 14 Clark (C. H.)—Marine gas engines. Cr. 8vo. 55. net C. LOCKWOOD, Apr.<PAGE_NUM:62><DOCUMENT_PAGE_NUM:70> 14"
"WYMAN, June 14 Clark (Georgina Binnie-) See Binnie-Clark. Civil Service Commission-Examination papers : Greenwich. Royal Observatory, junior assis- Clark (H. H.) and Crocker (R. W.)-Electric tant. Feb. 1914, 6d. ; Royal Navy: Modern switches for use in gaseous mines. (U.S. Bur. of Mines.) 6 illus. foreign languages, Jan. 1914, IS. 8vo. 9 X6, pp. 38, swd. WYMAN, Apr.<PAGE_NUM:62><DOCUMENT_PAGE_NUM:70> 14"
"29th April to 7th May, 1914, 7d. Clarke (Charles) and Gilbert (Mottram)-Common- WYMAX, June 14 sense golf. Cr. 8vo. 71 x 47, pp. 132, 25. 6d. net Civil Service Commission-Rules and regula- SIMPKIN, Feb.<PAGE_NUM:62><DOCUMENT_PAGE_NUM:70> 14"
"gd. net Clarke (Isabel C.)-Fine clay : a novel. Cr. 8vo. Civilization, Epochs of, Bose (P. N.) 6s. net Oct. 14 74 x4, pp. 390, 6s. HUTCHINSON, Mar.<PAGE_NUM:62><DOCUMENT_PAGE_NUM:70> 14"
"IS. England, Green roads of, Cox (R. H.) 10s. 6d. net English course, A. L.,"" Hints and helps to, June 14 Easies (J.). Bk. 5. Is. 6d. net ...Sep.<PAGE_NUM:94><DOCUMENT_PAGE_NUM:102> 14"
"Vols. 2-5, ei. Ios. 6d. net.. .....Mar.-Dec. 14 English dictionary, British Empire universities, England, Hist of, Macaulay (T. B., Lord), . . Jan.<PAGE_NUM:94><DOCUMENT_PAGE_NUM:102> 14"
"(G. H.) 6s. net .. July 14 English dictionary, Shorter modern, is. net England, Industrial, Journeys in, Claxton (W. J.) Jan.<PAGE_NUM:94><DOCUMENT_PAGE_NUM:102> 14"
"is. 6d. net..... . Apr. 14 English hist., First bk. of, Hearnshaw (F. J. C.) England, Royal Family of, Bagshawe (F. G.) 65. IS, 6d. ..Apr,<PAGE_NUM:94><DOCUMENT_PAGE_NUM:102> 14"
"English address book (The) of British and North American residents, business houses, institutions English history in conteniporary oetry. No. 5, &c., in the Argentine Republic, 1914. 8vo. The 18th century; by Miss C. L. Thomson. 83 X6, pp. 434, 6s. ........ LEDGER, Mar. 14 Svo., limp, is. net .. BELL, Sep.<PAGE_NUM:94><DOCUMENT_PAGE_NUM:102> 14"
"English lang., Webster's Revised unabridged dict. English catalogue of books (The) : books issued 219., 225, 6d. net .. June 14, in the United Kingdom of Great Britain and English language: Tudor and Stuart words, Ireland, 1801-1836. Edit. by R. A. Peddie and Skea! (W. W.) 5s, net... ... Jan,<PAGE_NUM:94><DOCUMENT_PAGE_NUM:102> 14"
"8vo. 10 x6}, pp. 366, 78. 6d. net PUBLISHERS' CIRCULAR, Feb. 14 English literature, Pageant of, Parrott (E.) 6s. net English Church ways, Frere (W. H.) 25. 6d. net July<PAGE_NUM:94><DOCUMENT_PAGE_NUM:102> 14"
"English literature. See also under Literature. English composition, Bate (R. S.) 35. 60...Oct. 14 English : Matriculation model answers, Pt. 2, 28. English course, A.L."" new : Hints and helps Mar<PAGE_NUM:94><DOCUMENT_PAGE_NUM:102> 14"
"to, Eades (J.) Bk. 3, is. 3d. net ; bk. 4, Is. 6d. English medieval literature, Baldwin (C. S.) 45, (d. net.. . Apr. 14 nct Sep.<PAGE_NUM:94><DOCUMENT_PAGE_NUM:102> 14"
"French : Soldiers' language manual. 3d. Nov. 14 Frobenius (H.)— The German Empire's hour of French trans, and compos., Chaytor (H. J.) and destiny. Cr. 8vo. 71 X 5, pp. 138, 25. net Renault (E.) 25. net . May<PAGE_NUM:109><DOCUMENT_PAGE_NUM:117> 14"
"LONG, Oct. In French unseens, Florian (A. R.) is. 6d... Apr. 14 Froebel as pioneer in modern psychology, Murray French unseens, Florian (A. R.) Junior, is. 4d.; (E. R.) 3S, 6d. net Senior, is. 60. . June<PAGE_NUM:109><DOCUMENT_PAGE_NUM:117> 14"
"net, swd. 29. net. CONSTABLE, Oct. 14 From far nds: poems, Rentoul (J. L.) 58. Apr.<PAGE_NUM:109><DOCUMENT_PAGE_NUM:117> 14"
"MURRAY, Dec. 14 From memory's shrine, Elizabeth of Roumania. Fresh voyages on unfrequented waters, Cheyne 48. 6d.net.. .Aug.<PAGE_NUM:109><DOCUMENT_PAGE_NUM:117> 14"
"8vo. 9 X5t, pp. 128, 5s. net E. ARNOLD, Apr. 14 From pillar to post, Diehl (A. M.) 6s. .Jan.<PAGE_NUM:109><DOCUMENT_PAGE_NUM:117> 14"
"SIMPKIN, Od. 14 From the outposts : poems, Gouldsbury(C.) 35. 6d Friend of the children (The). Illus. by Harold net Copping. 4to. 101x8, 6d. R. T. S., Apr. 14 From the sepulchre to the throne, Cecilia (Mme.) 58. net Friendly societies, industrial and provident From the trenches, Young (G. W.) 25. 6d., 25. net societies, buildings societies, trade unions, &c.- Reports of Chief Registrar for 1912. Part A, Fromont junior and Risler senior, Daudet (A.) General report, 25. .WYMAN, Mar.<PAGE_NUM:109><DOCUMENT_PAGE_NUM:117> 14"
"WYMAN, July 14 Frost (Henry W.)—Men who prayed. Cr. 8vo. Friends and memories, White (M. V.) 125. 6d. net 74 X 5, pp. 198, 35. 6d. net MORGAN &S, Dec.<PAGE_NUM:109><DOCUMENT_PAGE_NUM:117> 14"
"Friendship, Value of, 6d., Is. 6d. net....May 14 Frost (Ralph)—How to be happy in business. Cr. 8vo., pp. 152, 25. 6d. net, swd., is. net Frings (J. W.)-God in the Universe : the imma- RICHARDS, Oct.<PAGE_NUM:109><DOCUMENT_PAGE_NUM:117> 14"
"Aug. 14 Germany and the Prussian spirit. Reprinted German, Chemical, Phillips (F. C.) 8s. 6d. net from the special War number of “ The Round Feb.<PAGE_NUM:115><DOCUMENT_PAGE_NUM:123> 14"
"German danger, Kennedy (B.) is. net ....Oct. 14 Germany, Great Britain and, Wilkinson (S.) 2d. German dictionary : Lilliput dictionaries. is. net net Oct.<PAGE_NUM:115><DOCUMENT_PAGE_NUM:123> 14"
"(F. M.) 6d. net... ..Feb. 14 Germany, Modern, and the modern world, German Empire's hour of destiny, Frobenius (H.) Sadler (M. E.) 2d .Sep.<PAGE_NUM:115><DOCUMENT_PAGE_NUM:123> 14"
"German invasion, Sewill (H.) is. net....Mar. 14 Germany, Reformation in, Vedder (H. C.) 125. 6d. German language, Grammar of, Clarke (G. H.) and net .Mar.<PAGE_NUM:115><DOCUMENT_PAGE_NUM:123> 14"
"Jan. 14 Germany, Southern, Baedeker (K.) 6s. net Aug.<PAGE_NUM:115><DOCUMENT_PAGE_NUM:123> 14"
"(G.) is. net .Nov. 14 Germany's case tried in court, Beck (J.) 6d. net Nov.<PAGE_NUM:115><DOCUMENT_PAGE_NUM:123> 14"
"German trade, War on. is, net.. ...Oct. 14 Getting together : religious thought, Whiton German war (The), Doyle (Sir A. C.) is. net Dec.<PAGE_NUM:115><DOCUMENT_PAGE_NUM:123> 14"
"78 x5, pp. 224, 35. 6d. T. W. LAURIE Jan. 4 Germans in Africa, Lewin (E.) 3d. net ..Dec. 14 Ghosh (Birenda Nath) and Das (Jahar Lal)-A Germany, Holland (A. W.) 7s. 6d. net May 14 Treatise on hygiene and public health with Germany and England, Blatchford (R.) 18. Sept. 14 special reference to the tropics. 2nd edit. Germany and England, Cramb (J. A.) 25. 6d. net Cr. 8vo. 71 X 48, pp. 410, 6s. net June<PAGE_NUM:115><DOCUMENT_PAGE_NUM:123> 14"
"3s. 6d. net Gleanings from works, Fox (G.) is. net ..May 14 God, Visions of, Denison (H. P.) 5s. net..Nov.<PAGE_NUM:118><DOCUMENT_PAGE_NUM:126> 14"
"HEFFER, July 14 Goddard (H. H.)-Feeblemindedness. 8vo. 178. net Glehn (L. C. von) and others—Cours Français du MACMILLAN, Oct.<PAGE_NUM:118><DOCUMENT_PAGE_NUM:126> 14"
"(W. W.) 55. net ..Jan. 14 God's fool, Maartens (M.) 35. 6d. ..Apr.<PAGE_NUM:118><DOCUMENT_PAGE_NUM:126> 14"
"Gloucester, Kelly's Direct. of Somerset and, 1914. 36s. .Jan. 14 Gods of gold (The): a tale of destiny. Cr. 8vo., Gloucestershire, Cox (J. C.) (Little guides) 25. 6d. Pp. 320, 3s. net .Mar.<PAGE_NUM:118><DOCUMENT_PAGE_NUM:126> 14"
"Cr. 8vo., pp. 400, swd., is. net Goethe (Johann W. von) - Faust. Trans. by DUCKWORTH, May 14 Anna Swanwick. 1 2mo., pp. 490, IS. net Gnomic poetry in Anglo-Saxon, Williams (B. C.) (Bohn's pop. library) BELL, Mar.<PAGE_NUM:118><DOCUMENT_PAGE_NUM:126> 14"
"God, Enlarging conception of, Youts (H. A.) Going (Ethel M.)-Chart of medieval and 55. 6d. net .... June 14 modern painters. 6d. net ....LAMLEY, Jan,<PAGE_NUM:118><DOCUMENT_PAGE_NUM:126> 14"
"Nov. 14 Gold of dawn, Whitwell (R.) is. 6d. net .. June<PAGE_NUM:118><DOCUMENT_PAGE_NUM:126> 14"
"June 14 Gold-mines, Hydraulic stowing in, Gullachsen God of philosophy, Aveling (F.) is. net. . Nov. 14 (B. C.) is. 6d. net .... Nov.<PAGE_NUM:118><DOCUMENT_PAGE_NUM:126> 14"
"Apr. 14 Goll thread, c., Macleod (N.) is. God, Proof of, Begbie (H.) 25. 6d. net... .Sep. 14 Gold trail, Bindloss (H.) 7d. net. God : Roman ideas of deity, Fowler (W. W.) 5S. Golden age, Graham (K.) illus. I2s. 6d. net net ..May<PAGE_NUM:118><DOCUMENT_PAGE_NUM:126> 14"
H. (R. S.)-Confessions of a dog. Is. net.. Jan. 141 H. (W. E) ed.. Lady of the decoration friendship bk. IS. 6d. net .Nov.<PAGE_NUM:124><DOCUMENT_PAGE_NUM:132> 14
"Insurance (National)—Medical benefit: Regula- tions, Jan. 14: (England), 3!d. ; (Scotland), 3d. ; (Wales), 3d. ..... . WYMAN, Mar.<PAGE_NUM:145><DOCUMENT_PAGE_NUM:153> 14"
"Jeffs (H.)–Portrait preaching: studies in Bible Jerrold (Walter)-Field-Marshal Earl Roberts, characters. Cr. 8vo. 7* X5, pp. 280, 35. 6d. net V.C. : the life-story of a great soldier. Cheaper J. CLARKE, Oct. 14 edit. Cr. 8vo. 71 X43, pp. 286, is. net Jeffs (Harry) and Evans (Herbert) eds. --Social W. A. HAMMOND, Nov.<PAGE_NUM:150><DOCUMENT_PAGE_NUM:158> 14"
"Cr. 8vo., 6s. .APPLETON, Dec. 14 Jesson (Franz de)-Katya : a romance of Russia. Jenkins (Marshall) — Troop Five at camp. Cr. 8vo. 7* X 48, pp. 414, 6s. Cr. HEINEMANN, Jan.<PAGE_NUM:150><DOCUMENT_PAGE_NUM:158> 14"
"The Pros and cons ; Acid drops. Cr. 8vo, pp. Jesus Christ, In the face of, Jenks (D.) 6s. net 102, 25. net, swd., is. 6d. net FRENCH, May 14 Jesus, Difficult words of, Stephenson (A. R.) 25. 6d. Jenny Cartwright, Stevenson (G.) 6s. .. July<PAGE_NUM:150><DOCUMENT_PAGE_NUM:158> 14"
"HUTCHINSON, Mar. 14 Jesus, Wonderful deeds of. 6d.. Apr.<PAGE_NUM:150><DOCUMENT_PAGE_NUM:158> 14"
"PEARSON, May 14 Jeunesse de Cyrano de Bergerac, Gorsse (H. de) Jepson (Edgar) — The Second Pollyooly book, and Jacquin (J.) 45. 6d. net ..July<PAGE_NUM:150><DOCUMENT_PAGE_NUM:158> 14"
"Cr. 8vo. 8 X 5, pp. 322, 68. HUTCHINSON, Nov. 14 Jevons (F. B.)-Philosophy: what is it? 12mo., Jepson (W. L.)-A Flora of California. Part 4. pp. 144, Is. 6d. net CAMB. UNIV. PRESS, May<PAGE_NUM:150><DOCUMENT_PAGE_NUM:158> 14"
"Jerome (Jerome K.)-Paul Kelver : a novel. Pop. edit. Cr. 8vo., pp. 406, is. net Je wett (Sophie)-God's troubadour : the story of HUTCHINSON, June 14 St. Francis of Assisi. Cr. 8vo. 81 X54, pp. 194, Jerome (Jerome K.)-They and I. 12mo. 7d. net 3s. 6d. net ..DUCKWORTH, Dec.<PAGE_NUM:150><DOCUMENT_PAGE_NUM:158> 14"
"Morgan Heiskell. 8vo. 9 X51, pp. 354, 75. 6d. Jews, Unknown hist. of the, Jessel (E. E.) 6d., IS. net MILLS & B., Feb. 14 net... .Apr.<PAGE_NUM:150><DOCUMENT_PAGE_NUM:158> 14"
"Illus. 8vo. 9 X 51, pp. 430, 155. net NASH, May 14 Joachim (Joseph)—Letters from and to Joseph Jerrold (Laurence)--The French and the English. Joachim. Selected and trans. by Nora Bickley. New and cheaper edit. Cr. 8vo. 7! X5, PP. 236 8vo. 91 X53, pp. 484, 125. 6d. net 28. 60. net ..CHAPMAN & H., Nov.<PAGE_NUM:150><DOCUMENT_PAGE_NUM:158> 14"
"IS. 6d. . Apr. 14 I.ectures illustrées : grammaire, Magee (E.) et Lay views, Colchester (H. B.) 3s. 6d. net ..May 14 Anceau (M.) is. 6d. Jan.<PAGE_NUM:163><DOCUMENT_PAGE_NUM:171> 14"
"64 x5, pp. 122, 25. 6d. net SIMPKIN, Feb. 14 Lee (A.)—Little stories of big men. Cr. 8vo., 55. net PUTNAM, Jan.<PAGE_NUM:163><DOCUMENT_PAGE_NUM:171> 14"
"the idle rich. Cr. 8vo. 7* X 5, pp. 308, 35. 6d. net Lee (Vernon) — The Tower of the mirrors, and LANE, Nov. 14 other essays on the spirit of places. Cr. 8vo. Leader” Annual and gazetteer of British East 71 X5, pp. 254, 3s. 6d. net ..LANE, Feb.<PAGE_NUM:163><DOCUMENT_PAGE_NUM:171> 14"
"BLACKIE, May 14 Lecitas, Stevens (E. J. C.) 6s. . . Apr.<PAGE_NUM:163><DOCUMENT_PAGE_NUM:171> 14"
"of “ From kitchen to garret,” &c. Cr. 8vo. Lees (E.)-Duty and privilege : the seven aspects 71 X41, pp. 352, 5s. net.. ..NASH, Feb. 14 of the Holy Communion. Cr. 8vo. 7! X 48, PP. Leaves from the country-side : an episode. By 58, is, net SKEFFINGTON, Nov.<PAGE_NUM:163><DOCUMENT_PAGE_NUM:171> 14"
"Meteorological Committee-9th annual report, 1913-14. 4d. WYMAN, Aug. 14, Meteorological Committee (International)-Re- port of the roth meeting, Rome, 1913, 2S. WYMAN, June<PAGE_NUM:188><DOCUMENT_PAGE_NUM:196> 14"
"Monopolies, Prevention and control of, Brown (W. J.) 6s. net Monro (Harold) Children of love. 4to., pp. 304 swd., 6d. net ......POETRY BOOKSHOP, Nov. 14, Monroe (Harriet)-You and I. Cr. 8vo., 5s. 6d. net ..... MACMILLAN, Nov.<PAGE_NUM:193><DOCUMENT_PAGE_NUM:201> 14"
"(H.) 125. 6d. net .. July 14 Peru, Vivian (E. C.) 6s. net · July<PAGE_NUM:216><DOCUMENT_PAGE_NUM:224> 14"
"Perrin (Alice)-The Anglo-Indians. Pop. edit. Peskett (A. G.) trans.—Civil wars, Caesar. (Loeb;, 12mo., pp. 256, is. net ....METHUEN, Nov. 14 55., 6s. 6d. net . .Dec.<PAGE_NUM:216><DOCUMENT_PAGE_NUM:224> 14"
"Pet Marjorie, Macbean (L.) 28. 6d. net..Mar. If Perrin (Alice)-A Free solitude. 8vo., swd., 6d. CHATTO, Mar. 14 Petavel (E.)—God's plan in evolution. Trans. by Perrin (Alice) —The Happy hunting ground. Rev. H. W. C. Geldart. Cr. 8vo., Is. 6d. net Cr. 8vo. 7*X5, pp. 312, 6s. . . METHUEN, Feb.<PAGE_NUM:216><DOCUMENT_PAGE_NUM:224> 14"
"QUARITCH, Mar. 14 Peter Pan, Story of, O'Connor (D.) is. 6d. net Perrin (Mrs. Henry)—British flowering plants, Nov.<PAGE_NUM:216><DOCUMENT_PAGE_NUM:224> 14"
"Col. plates. Folio 13 X101 (set of 4 gd. vols.) 3155. net ... QUARITCH, May 14 Peter Pink-eye, Rountree (H.) and Hamer (S. H.) Perrins (C. W.)—-Italian book illustrations and Peter Simple, Marryat (F., Capt.) is. net Apr.<PAGE_NUM:216><DOCUMENT_PAGE_NUM:224> 14"
"CHANCERY LANE PRESS, July 14 Peterson (William) trans.-Dialogues, &c., Tacitus Perrott (A. D.) see Borchardt (W. G.) and Perrott. (Loeb.)55., 6s. 6d. net Mar.<PAGE_NUM:216><DOCUMENT_PAGE_NUM:224> 14"
"Persia, Hints for residents and travellers, Petrie (W. M. Flinders) —Tarkhan I and Memphis Neligan (A. R.) 5s. net .. June 14 V. 81 plates. 4to., pp. 39, 255. net Persia, Political poetry of, Browne (E. G.) 55. net QUARITCH, Dec.<PAGE_NUM:216><DOCUMENT_PAGE_NUM:224> 13"
"F. PALMER. Apr. 14 Pfaundler (M.) ed. - The Diseases of children. Personal magnetism, Dumont (T. Q.) 45. 6d. net Vol. 6. 4t0, 21$. net LIPPINCOTT, May<PAGE_NUM:216><DOCUMENT_PAGE_NUM:224> 14"
"July 14 | Phantom Peer, Pugh (E.) 6s. Personality and revelation, Butler (F. W.) 25. net Phantom regiment, Grant (J.) 6d. net. . Apr.<PAGE_NUM:216><DOCUMENT_PAGE_NUM:224> 14"
"Poincaré (Henri)-Science and method. Cr. 8vo. Pollen (J. H.) See Burton (E. H.) and Pollen. 8 X 51, pp. 288, 6s, net .....NELSON, Apr. 14 Pollexfen (Muriel) --Grey ghost. 12mo., 7d. net NEWNES, May<PAGE_NUM:222><DOCUMENT_PAGE_NUM:230> 14"
"Polarized law, Baty (T.) 78. 6d. ..Aug. 14 Polo annual (The), for 1914. 12mo., bds., 28. 6d. Police (England and Wales) - Reports of In- net.. ....H. Cox, Apr.<PAGE_NUM:222><DOCUMENT_PAGE_NUM:230> 14"
"spectors, 1913. IS. 3d. ....WYMAN, May 14 Polsue (George L.) ed. Who's who in the war. IS. net ...Aug.<PAGE_NUM:222><DOCUMENT_PAGE_NUM:230> 14"
"Polyphase currents, Still (A.) 6s. net Police (Scotland)—56th annual report for 1913. Pomm's daughter, Pratz (C. de) 6s. 8ļd. WYMAN, Apr. 14 Pomponia, Webb (Mrs.) is... ...Feb.<PAGE_NUM:222><DOCUMENT_PAGE_NUM:230> 14"
"Policeman X, Oxenham (J.) 2d. net...... Dec. 14 Pond problems, Unwin (E. E.) 25. net .. July<PAGE_NUM:222><DOCUMENT_PAGE_NUM:230> 14"
"Political and literary essays, Cromer (Earl of) Ponsonby (Magdalen)—Idle women: a study in 2nd ser., jos. 6d. net .Sep. 14 futility, in one act and twoscenes. Ryl. 16mo., Political economy, Gide (C.) ios, 6d. net May 14 pp. 50, swd. is. net.. A. L. HUMPHREYS, Feb.<PAGE_NUM:222><DOCUMENT_PAGE_NUM:230> 14"
"IS. net . June 14 Poor little rich girl, Gates (E.) is. net ..Jan.<PAGE_NUM:222><DOCUMENT_PAGE_NUM:230> 14"
"Pollard (A. F.) ed.—The Reign of Henry VII from contemporary sources. Selected and Popenoe (Paul B.)—Date growing in the old arranged in 3 volumes with an intro. Vols. 2-3. and new worlds; with a chapter on the food Cr. 8vo. 8 X 51, pp. 324, 350, ea. Ios. 6d. net value of the date by C. Bennett. Illus. 8vo. LONGMANS, Jan., Feb. 14 of x6, pp. 316, 8s. 6d. net .. WESLEY, Sep.<PAGE_NUM:222><DOCUMENT_PAGE_NUM:230> 14"
"materials. Cr. 8vo. 7} X41, pp. 88, 28. net Quantitative organic analysis, Methods of, WHITTAKER, Feb. 14 Kingscott (P. C. R.) 6s. 6d. net ......Sep.<PAGE_NUM:227><DOCUMENT_PAGE_NUM:235> 14"
"Queen "" Newspaper book of travel. Compiled Punch. Vol. 146. 4to. 8s. 6d. OFFICE, July 14 by the Travel Editor, M. Hornsby. (11th Punctuation, Graded lessons in, Cronson (B.) 28. year.) 12mo. 71 X 4, pp. 542, 25. 6d. net Nov.<PAGE_NUM:227><DOCUMENT_PAGE_NUM:235> 14"
"Purple frogs, Westbrook (H. W.) and Grossmith Quelch (Harry)--Literary remains. Edit., with (L.) 6s. ..Apr. 14 a biographical intro., by E. Belfort Bax. Cr. Purple light, Landor (B.) 6s. Mar.<PAGE_NUM:227><DOCUMENT_PAGE_NUM:235> 14"
"Purple robe, Hocking (J.) 25. net. Jan. 14 Quella, Farmer (G. N.) 6s. May<PAGE_NUM:227><DOCUMENT_PAGE_NUM:235> 14"
"Jan. 14 Quest of the unseen, Lloyd (A. J.) 25. 6d. net Pursuit, Sarile (F. A.) 6d. July<PAGE_NUM:227><DOCUMENT_PAGE_NUM:235> 14"
"Pyramids of snow, Metcalle (E.) 7d. net..Feb. 14 Quiggin's Nautical almanac and tide-tables, 1915. Pyrenees, With Wellington in the, Beatson (F. C.) Cr. 8vo., swd. 6d. and is. ..SIMPKIN, Nov.<PAGE_NUM:227><DOCUMENT_PAGE_NUM:235> 14"
"Ries (H.) and Watson (T. L)-Engineering geology. 8vo., 178. net CHAPMAN & H., June 14 i Rifle and carton, Robinson (E. H.) is. net Oct.<PAGE_NUM:234><DOCUMENT_PAGE_NUM:242> 14"
"25. net (Everyman's library) DENT, Apr. 14 Russia : Tsar and his people, Elchaninov (A.) 28. 6d., 28. net .....Oct.<PAGE_NUM:240><DOCUMENT_PAGE_NUM:248> 14"
"selected ser., 8) . SIEGLE, H., June 14 Russian ally, Our, Wallace (Sir D. M.) 2d. Oct.<PAGE_NUM:240><DOCUMENT_PAGE_NUM:248> 14"
"HARRAP, Aug. 14 Russian campaign, Napoleon's, Foord (E.) 16s. net Russell (Hon. B.)-The Philosophy of Bergson : Sep.<PAGE_NUM:240><DOCUMENT_PAGE_NUM:248> 14"
"with a reply of Mr. H. W. Carr and a rejoinder Russian Empire of to-day, &c., Winter (N. 0.) by Mr. Russell. 8vo., swd., Is. net IOS. 6d. net MACMILLAN, Feb. 14 Russian language, Manual of the. IS. 6d. Russell (Bertrand) -Our knowledge of the ex- May<PAGE_NUM:240><DOCUMENT_PAGE_NUM:248> 14"
"intervening periods. 4to. 45. 60. BELL, Mar. 14 Russian novelists, Contemporary, Persky (S.) Russell (Charles E. B.)—Social problems of the 3s. 6d. net.. Apr.<PAGE_NUM:240><DOCUMENT_PAGE_NUM:248> 14"
"net MOWBRAY, June 14 Russian picture tales, More, Carrick (V.) 28. 6d. net Russell (Dora)-Rose Fleming. 8vo., swd., 6d. Sep.<PAGE_NUM:240><DOCUMENT_PAGE_NUM:248> 14"
"8vo. 71 x5, pp. 320, 6s. .. WARD, L., Apr. 14 Russo-Japanese war: Japanese in Manchuria, 1904, Cordonnier (E. L. V.) Vol. 2, pts. 2-3, Russell (Marie)-Russian rebels. Cr. 8vo., 6s. F. GRIFFITHS, Feb.<PAGE_NUM:240><DOCUMENT_PAGE_NUM:248> 14"
"Russia, Mainsprings of, Baring (M.) 25. net June 14 Ryle (E.)-Olim. Ludi Scaenici. Cr. 8vo., swd., Russia, Modern, Alexinsky (G.) 5s, net ..Nov. 14 IS. ..BELL, June<PAGE_NUM:240><DOCUMENT_PAGE_NUM:248> 14"
"Russia, Napoleon's invasion of, Burton (R G.) Ryle (Herbert E., Bp.)- The Book of Genesis : ..May 14 in the Revised Version, with intro, and notes. Russia of the Russians, Williams (H. W.) 6s. net 12mo., pp. 546, 48.6d. net. (Cambridge Bible for schools and colleges) Russia, Soul of, Byford (C. T.) 5s. net .... Apr.<PAGE_NUM:240><DOCUMENT_PAGE_NUM:248> 14"
"Savi (E. W.)-Baba and the black sheep. Cr. Sanitary engineering, Wood (F.) 8s. 6d. net Feb. 14 8vo. 8 X5, pp. 388, 6s. ..HURST & B., Mar.<PAGE_NUM:243><DOCUMENT_PAGE_NUM:251> 14"
"treatment of disease. 4th edit., thoroughly Santa Claus's treasury, Bone (F.) is. 6d. net Oct. 14 rev. 8vo. 91 X54, pp. 976, 259. net E. ARNOLD, Oct.<PAGE_NUM:243><DOCUMENT_PAGE_NUM:251> 14"
"GAY & H., May 14 Saxifrage, or rockfoils, Irving (W.) and Malby Satchell (William)—The Greenstone door. Cr. 8vo. (R. A.) 28. 6d. net July<PAGE_NUM:243><DOCUMENT_PAGE_NUM:251> 14"
"25. 6d. net Satire of Hades, Bannatyne (P.) IS. ..Apr. 14 Sayer (A. G. W.) and Williamson (W.)- Junior Satires of circumstance, Hardy (T.) 48. 6d. net Scripture examination papers : New Testament. Nov.<PAGE_NUM:243><DOCUMENT_PAGE_NUM:251> 14"
"C. GRIFFIN, June 14 ' Scare-mongerings"" from the “ Daily Mail,” Saunders (A. V.)-Chats with girls. 12mo., pp. 62, Brex (T.) 6d. net ....Nov.<PAGE_NUM:243><DOCUMENT_PAGE_NUM:251> 14"
"IS. net ....S. P. C. K., Mar. 14 Scarlet runner, Williamson (C. N. and A. M.) 28: Saunders (C. F.)--Under the sky in California. net 8vo., 75. 6d. net . ..........RICHARDS, June<PAGE_NUM:243><DOCUMENT_PAGE_NUM:251> 14"
"Saunders, Admiral Charles, Life of, Salmon Scenes of Hanoverian times—12mo. 7X48, (E.) 6s. net ....May 14 limp, 6d. net. (Oxford suppl. readers) MILFORD), June<PAGE_NUM:243><DOCUMENT_PAGE_NUM:251> 14"
"bills of lading. 7th edit., rev. 8vo., 18s. Seaver (George) —The Dionysius-cult in its SWEET & M., May 14 relation to Christianity. Fcap. 8vo., pp. 37, swd. Scudder (H.)--The Electrical conductivity and 6d. net THEOSOPHICAL PUBL. Soc., July<PAGE_NUM:246><DOCUMENT_PAGE_NUM:254> 14"
"12s. 6d net DUCKWORTH, Oct. 14 Second blooming, George (W. L.) 6s. ....Oct.<PAGE_NUM:246><DOCUMENT_PAGE_NUM:254> 14"
"Sculpture, Royal Academy, 1914, Is. 3d. Apr. 14 Secret agent, Conrad (J.) 25. net .Feb.<PAGE_NUM:246><DOCUMENT_PAGE_NUM:254> 14"
"..Aug. 14 Secret cargo, Fletcher (J. S.) 6d. . . Sep.<PAGE_NUM:246><DOCUMENT_PAGE_NUM:254> 14"
"255. net ..Aug. 14 Secret of Chauville, Whitelaw (D.) 6d. ..Apr.<PAGE_NUM:246><DOCUMENT_PAGE_NUM:254> 14"
"Sea, Book of the blue, Newbolt (H.) 5s. net Oct. 14 Secret of Intercession, Murray (A.) 6d., Is., Sea captain, Bailey (H. C.) 6s. ..Feb.<PAGE_NUM:246><DOCUMENT_PAGE_NUM:254> 14"
"Sea dogs, Roberts (M.) 7d. net ..May 14 Secret of the raft, Townley (H.) 25. net .. July<PAGE_NUM:246><DOCUMENT_PAGE_NUM:254> 14"
"Sea, Life at, Cooke (A. O.) 35. 6d. net ....Oct. 14 Secretary to Bayne, M.P., Ridge (W. P.) 6d. Sea, My life at, Crutchley (W. C.) 7d. net May<PAGE_NUM:246><DOCUMENT_PAGE_NUM:254> 14"
"Sea story, Britain's, Speight (E. E.) and Nance Sedgwick (Anne Douglas)—The Encounter. Cr. (R. M.) 35. 6d. ...Oct. 14 8vo. 7* X5, pp. 342, 6s. ..E. ARNOLD, Oct.<PAGE_NUM:246><DOCUMENT_PAGE_NUM:254> 14"
"8vo. IOS 6d. net BELL, Mar. 14 Seebohm (Frederic)-Customary acres and their Seal-matrices and seals, Irish, Armstrong (E. C. R.) historical importance : being a series of un- 6s. net ..Jan. 14 finished essays. 8vo. 91x58, pp. 288, 125. éd. Seamen (Deceased)— Wages and effects : account net LONGMANS, Mar.<PAGE_NUM:246><DOCUMENT_PAGE_NUM:254> 14"
"1913. id. W'YMAN, Mar. 14 Seebohm (M. L.) ed.-Till Eulenspiegel. is, od Search after truth, Maunsell (W. P.) 25. 6d. July<PAGE_NUM:246><DOCUMENT_PAGE_NUM:254> 14"
"Sca's anthology, Patterson (J. E.) 25. net June 14 Seeley (M.)- The Later Evangelical Fathers. 2nd Seashore (C. E.)-Psychology in daily life. edit., with pref. by Bishop H. C. G. Moule. Cr. 8vo. 6s. net APPLETON, Jan.<PAGE_NUM:246><DOCUMENT_PAGE_NUM:254> 14"
"6} X4, pp. 734, Ithr. 8s. 6d. net C. GRIFFIN, June 14 Seen in the shadow, Hume (F.) 6d. May<PAGE_NUM:246><DOCUMENT_PAGE_NUM:254> 14"
"GALE & P., Aug 14 Staffordshire, Incised effigies of, Oliver (A.) 145. Squad, section, platoon and company drill made Mar.<PAGE_NUM:259><DOCUMENT_PAGE_NUM:267> 14"
"limp is. 6d. net ..GALE & P., Nov. 14 Stage, Forty years on the, Barnes (J. H.) 10s. 6d. Squair (J.) see Fraser (W.) and Squair, net ..Oct.<PAGE_NUM:259><DOCUMENT_PAGE_NUM:267> 14"
"Stables (Gordon) - Just like Jack. New edit. Stalker (James)—The Ethics of Jesus according Cr. 8vo. 78 X 5, pp. 398, 25. 6d. to the Synoptic Gospels. Re-issue. &. 8vo., FROWDE, Oct. 14 pp. 416, 2s. net (Expositor's library) HODDER & S., Nov.<PAGE_NUM:259><DOCUMENT_PAGE_NUM:267> 14"
