"June 05 Cheyne (T. K.) Trans. of Book of Psalms, 18. 6d., 28. net Chemistry, Warren (A. T.) 2s... Sep. 05"
"Cricketers, The Empire's, 158....... ..Nov. 05 | Crime of Under-Seas, Boothby (Guy) 58. ...Feb. 05"
"Faerie Queene, Day Bk. of P. from, 1s. 6d. Dec. 051 Fair Maid of Graystones, Dix (B. M.) 6s. ...Oct. 05"
"BLACK, Nov. 05 Merriman (H. 9.)-Roden's Corner. 8vo. swd. Mengel (C.)-German Exercises and Idioms. 8vo. 28. net ....HIRSCHFELD, May 05"
"'One and All' Gardening, 1905. ………............. .... Onion Culture, New, Greine (T.) 2s. 6d....... Oct. 05; Onions (C. T.)-Advanced English Syntax. Based on Principles and Requirements of Grammatical Society. Cr. 8vo. 7×51, pp. 174, 2s. 6d. (Parallel Gram. Ser.) ...SONNENSCHEIN, Oct. 05"
"Boys. Cr. 8vo. 74 × 43, pp. 168, 18. PARTRIDGE, Oct. 05 Physics, Poynting (J. H.) &c., 10s. 6d. ...... Physics, Chem., Mining, Byrom (T.) 3s. 6d. net Phillips (L.)-Transvaal Problems; Some Notes on Current Politics. 8vo. 9 × 53, pp. 882, 12s. net J. MURRAY, Nov. 05 Physics, Notes, &c., Shearer (J. S.) 7s. 6d. net Phillips (Leoline)-Woman Disposes. Psychology Cr. 8vo. 7 x 47, Physics, Prac., Schuster (Art.) 88. of an Experiment. Novel. Physics, Prac. Prob., Pearson (F.) 6d. ..SKEFFINGTON, Oct. 05"
"Trade of the U. Kingdom, Annual Statement, 1904, Vol. 1 [Cd. 2497] 7s. 7d. WYMAN, June 05′ Trade Policy, G.B. & Colonies, since 1860, Fuchs (Carl Johannes) 7s. 6d. net ……………………..May 05"
"Worcestershire, C. War in, Bund (J. W. Willis) Workshop Costs for Engineers &c., Pearn (Sinclair 48. net....... .....Nov. 05 and Frank) 12s. 6d. net ........... Sep. 05"
"Yorke (C.)-Alix of the Glen. Novel. Cr. 8vo. 74 × 4, pp. 812, 68......................LONG, July 05, Yorke (C.)-Delphine. Cr. 8vo. 7× 43, pp. 820, 28. 6d. (Haymarket Novels).........LONG, May 05"
"Youngest Miss Brown, Warden (F.) 65. ...Apr. 05: Yoxall (J. H.)-Alain Tanger's Wife. 8vo. swd. 6d.. .HUTCHINSON, Apr. 05"
