entry,last_name,first_name,title,publisher,price,price_in_pounds,format,original_entry,author_name,creators,is_editor,date,is_net
"Abdomen, Acute, Battle (W. H.) 4s. net Mar. II Abdur Rahim-The Principles of Muhammadan jurisprudence according to the Hanafi, Maliki, Shafi'i and Hanbali Schools. Ryl. 8vo., pp. 460, 21s. net.. .... LUZAC, June 11","Abdomen, Acute, Battle",W. H.,,LUZAC,21s.,1.05,8vo.,"Abdomen, Acute, Battle (W. H.) 45. net Mar. II Abdur Rahim-The Principles of Muhammadan jurisprudence according to the Hanafi, Maliki, Shafi'i and Hanbali Schools. Ryl. 8vo., pp. 460, 21S. net.. .... LUZAC, June 11","W. H. Abdomen, Acute, Battle","['Abdomen, Acute, Battle (W. H.)']",,June 11,net
"Ailsa Page, Chambers (R. W.) 6s. ..Mar.is Ainsley's Nautical almanac and tide tables for 1912. 8vo. swd. 6d. and is. SIMPKIN, Sep. Il Ainsworth (Percy C.)-Poems and sonnets. 12mo. 28. 6d. net C. H. KELLY, Dec. 10 Ainsworth (Percy C.)-A Thornless world, and other sermons. Cr. 8vo. 8 X 51, pp. 238, 3s. 6d. net ...C. H. KELLY, Dec. II Ainsworth (W. Harrison)-Old St. Paul's. 12mo. pp. 492, s. net ; Ithr. 2s. net (Everyman's library) ..DENT, Sep. 11","Ailsa Page, Chambers",R. W.,,DENT,2s.,0.1,8vo.,"Ailsa Page, Chambers (R. W.) 6s. ..Mar.is Ainsley's Nautical almanac and tide tables for 1912. 8vo. swd. 6d. and is. SIMPKIN, Sep. Il Ainsworth (Percy C.)-Poems and sonnets. 12mo. 28. 6d. net C. H. KELLY, Dec. 10 Ainsworth (Percy C.)-A Thornless world, and other sermons. Cr. 8vo. 8 X 51, pp. 238, 3s. 6d. net ...C. H. KELLY, Dec. II Ainsworth (W. Harrison)-Old St. Paul's. I 2mo. pp. 492, IS. net ; Ithr. 25. net (Everyman's library) ..DENT, Sep. 11","R. W. Ailsa Page, Chambers","['Ailsa Page, Chambers (R. W.)']",,Sep. 11,net
"Autumn voices, Hayhurst (C.) 39. 6d. net Dec. 10 Auvergne (Edmund B. d')—The Coburgs: the story of the rise of a great royal house. 8vo. 9x5), pp. 340, 16s, net......S. PAUL, Oct. II Auvergne (Edmund B. d')-Famous castles and palaces of Italy. 8vo. 91 * 5), pp. 330, 15s. net T. W. LAURIE, J une in Auvergne (E. B. d'.)--The Night side of Paris, Pop. edit. Cr. 8vo. pp. 216, is. 6d. net; swd. is. net T. W. LAURIE, Feb. II Auvergne (M. Nelson d')—Tarnished coronets : studies in the history of the British Peerage. 8vo. 9 X54, pp. 288, 128, 6d, net T. W. LAURIE, Oct. 11","Autumn voices, Hayhurst",C.,,T. W. LAURIE,6d.,0.025,8vo.,"Autumn voices, Hayhurst (C.) 39. 6d. net Dec. 10 Auvergne (Edmund B. d')—The Coburgs: the story of the rise of a great royal house. 8vo. 9x5), pp. 340, 16s, net......S. PAUL, Oct. II Auvergne (Edmund B. d')-Famous castles and palaces of Italy. 8vo. 91 * 5), pp. 330, 155. net T. W. LAURIE, J une in Auvergne (E. B. d'.)--The Night side of Paris, Pop. edit. Cr. 8vo. pp. 216, is. 6d. net; swd. is. net T. W. LAURIE, Feb. II Auvergne (M. Nelson d')—Tarnished coronets : studies in the history of the British Peerage. 8vo. 9 X54, pp. 288, 128, 6d, net T. W. LAURIE, Oct. 11","C. Autumn voices, Hayhurst","['Autumn voices, Hayhurst (C.)']",,Oct. 11,net
"Blue lilies, Cleeve (L.) 6d.. . Apr, II Blue of the sea, Meade (L. T.) 2s. Feb. II Bluebell and heather ; by Coila. Cr. 8vo., 69. J. OUSELEY, Od. II Bluff (Hilary)-Guide to the Bar. Expurgated and edit. by St. John Lucas. 12mo. 64 X 4, pp. 152, 2s._6d. net... ...METHUEN, Sep. II Blumhardt (J. F.) Suppl. cata. of Bengali books, British Museum 255, net... . Jan. II Blundell (A.)—1dealism, possible and impossible. Cr. 8vo., 28. 6d. net......J. OUSELEY, May II Blundell (Madge)-Katherine of the barge. Cr. 8vo., 1s. 6d. net... .SANDS, June 11","Blue lilies, Cleeve",L.,,SANDS,1s. 6d.,0.07500000000000001,8vo.,"Blue lilies, Cleeve (L.) 6d.. . Apr, II Blue of the sea, Meade (L. T.) 25. Feb. II Bluebell and heather ; by Coila. Cr. 8vo., 69. J. OUSELEY, Od. II Bluff (Hilary)-Guide to the Bar. Expurgated and edit. by St. John Lucas. 12mo. 64 X 4, pp. 152, 25._6d. net... ...METHUEN, Sep. II Blumhardt (J. F.) Suppl. cata. of Bengali books, British Museum 255, net... . Jan. II Blundell (A.)—Idealism, possible and impossible. Cr. 8vo., 28. 6d. net......J. OUSELEY, May II Blundell (Madge)-Katherine of the barge. Cr. 8vo., Is. 6d. net... .SANDS, June 11","L. Blue lilies, Cleeve","['Blue lilies, Cleeve (L.)']",,June 11,net
"Borgias, Dumas (A.) 12s, net ... Nov. II Boris in Russia, Macdonald(E. B.) and Dalrymple (J.) is. 6d. net.. ... Nov. II Borneo, Sea Dyaks of, Gomes (E.) 16s. net Jan. II Borrow (George)-- 1sobel Berners. Pop. edit. Cr. 8vo., pp. 376, is, net. . HODDER & S., Oct. 11","Borgias, Dumas",A.,,HODDER & S.,,0.0,8vo.,"Borgias, Dumas (A.) 12s, net ... Nov. II Boris in Russia, Macdonald(E. B.) and Dalrymple (J.) is. 6d. net.. ... Nov. II Borneo, Sea Dyaks of, Gomes (E.) 16s. net Jan. II Borrow (George)-- Isobel Berners. Pop. edit. Cr. 8vo., pp. 376, is, net. . HODDER & S., Oct. 11","A. Borgias, Dumas","['Borgias, Dumas (A.)']",,Oct. 11,
"Brazen lyre, Knox (E. V.) 3s. 6d, net....Nov. II Brazenhead the Great, Hewlett (M.) 6s... Mar. II Brazil (Angela)-A Fourth form friendship : a school story. Cr. 8vo. 75 X 5, pp. 256, 2s. 60. BLACKIE, Oct. II Brazil (Angela)—The New girl at St. Chad's : a story of school life. Cr. 8vo. 7} X5, pp. 288, .BLACKIE, Oct. II Brazil, Denis P.) 10s. 6d. net Feb. II Brazil, Through the wilderness of, Cook (W. A.) 78. 6d. net ..Apr. II Bread : Report on the nutritive value of bread made from different varieties of wheat flour (post free) 4d... WYMAN, Aug. 11","Brazen lyre, Knox",E. V.,,WYMAN,4d.,0.016666666666666666,8vo.,"Brazen lyre, Knox (E. V.) 35. 6d, net....Nov. II Brazenhead the Great, Hewlett (M.) 6s... Mar. II Brazil (Angela)-A Fourth form friendship : a school story. Cr. 8vo. 75 X 5, pp. 256, 25. 60. BLACKIE, Oct. II Brazil (Angela)—The New girl at St. Chad's : a story of school life. Cr. 8vo. 7} X5, pp. 288, .BLACKIE, Oct. II Brazil, Denis P.) 10s. 6d. net Feb. II Brazil, Through the wilderness of, Cook (W. A.) 78. 6d. net ..Apr. II Bread : Report on the nutritive value of bread made from different varieties of wheat flour (post free) 4d... WYMAN, Aug. 11","E. V. Brazen lyre, Knox","['Brazen lyre, Knox (E. V.)']",,Aug. 11,
"Bridge, Principles of (Badsworth) 3s. 6d. net J une Bridges (H. J.) ed.-The Ethical movement : the principles and aims. 8vo. 71 X5, pp. 138. UNION OF ETHICAL Soc., Mayil Bridges (Philippa)— The Green wave of destiny. Cr. 8vo. 73 X4, PP. 350, 6s. W. BLACKWOOD, A pr. II Bridges, Book of, Arcambeau (E.) 12s. 6d. net Dec. II Brierley (J.)—The Secret of living. Cr. 8vo. 73 X5, pp. 288, 3s. 6d. net ......J. CLARKE, Oct. II Brieux (Eugène)-Three plays. With a pref. by Bernard Shaw. Cr. 8vo. 7 X5, pp. 378, 5s. net FIFIELD, May 11","Bridge, Principles of",Badsworth,,FIFIELD,5s.,0.25,8vo.,"Bridge, Principles of (Badsworth) 35. 6d. net J une Bridges (H. J.) ed.-The Ethical movement : the principles and aims. 8vo. 71 X5, pp. 138. UNION OF ETHICAL Soc., Mayil Bridges (Philippa)— The Green wave of destiny. Cr. 8vo. 73 X4, PP. 350, 6S. W. BLACKWOOD, A pr. II Bridges, Book of, Arcambeau (E.) I2s. 6d. net Dec. II Brierley (J.)—The Secret of living. Cr. 8vo. 73 X5, pp. 288, 3s. 6d. net ......J. CLARKE, Oct. II Brieux (Eugène)-Three plays. With a pref. by Bernard Shaw. Cr. 8vo. 7 X5, pp. 378, 55. net FIFIELD, May 11","Badsworth Bridge, Principles of","['Bridge, Principles of (Badsworth)']",,May 11,net
"Brownings, The, Whiting (L.) 12s. net Nou. II Brownlie (John) ed.-Hymns from the morning land : being translations, centos and suggestions from the Service Books of the Holy Eastern Church. With intro. Cr. 8vo. 7*X5, pp. 216, 3s. 6d. net.. A. GARDNER, July II Brownlow (J. M. E.)Women's work in local government (England and Wales). Cr. 8vo. 7} X48, pp. 226, 2s. 6d. net....Nurt, Dec. II Brown's Nautical diary and day's work book. Folio. 4s. net ....J. BROWN, July 11","Brownings, The, Whiting",L.,,J. BROWN,4s.,0.2,8vo.,"Brownings, The, Whiting (L.) 125. net Nou. II Brownlie (John) ed.-Hymns from the morning land : being translations, centos and suggestions from the Service Books of the Holy Eastern Church. With intro. Cr. 8vo. 7*X5, pp. 216, 35. 6d. net.. A. GARDNER, July II Brownlow (J. M. E.)Women's work in local government (England and Wales). Cr. 8vo. 7} X48, pp. 226, 25. 6d. net....Nurt, Dec. II Brown's Nautical diary and day's work book. Folio. 45. net ....J. BROWN, July 11","L. Brownings, The, Whiting","['Brownings, The, Whiting (L.)']",,July 11,net
"Camera fiend, Hornung (E. W.) 6s. .Feb. II Cameras, Hand, Bayley (R. C.) is. 6d. net Aug. II Cameron (Adelaide M.)— Their wedding day, and other stories suitable for reading at mothers' meetings. Cr. 8vo. 71 X41, pp. 154, s. 6d. net . ALLENSON, Apr. II Cameron (Charlotte)-A Passion in Morocco. Cr. 8vo. 73 X 41, pp. 288, 6s. S. PAUL, Aug. II Cameron (Charlotte)-A Woman's winter in South America. Cr. 8vo. 78 X 5, pp. 292, 6s. net S. PAUL, Oct. II Cameron (Margaret)-Nature's pageant: the story of the seasons. 4to. 84 X6, pp. 124, s. BLACKIE, May II Cameron (Margaret)—The Pretender person. Cr. 8vo. 74 X5, pp. 394, 6s. HARPER, Nov. II Cameron (Margaret)— The Story of the seasons a second nature reader. 8vo. 7+ x4, pp. 160, 9d. ; also in four parts; paper, ea. 2d. ; cloth, ea. 3d.... CHAMBERS, Mar. 11","Camera fiend, Hornung",E. W.,,CHAMBERS,3d.,0.0125,8vo.,"Camera fiend, Hornung (E. W.) 6s. .Feb. II Cameras, Hand, Bayley (R. C.) is. 6d. net Aug. II Cameron (Adelaide M.)— Their wedding day, and other stories suitable for reading at mothers' meetings. Cr. 8vo. 71 X41, pp. 154, IS. 6d. net . ALLENSON, Apr. II Cameron (Charlotte)-A Passion in Morocco. Cr. 8vo. 73 X 41, pp. 288, 6s. S. PAUL, Aug. II Cameron (Charlotte)-A Woman's winter in South America. Cr. 8vo. 78 X 5, pp. 292, 6s. net S. PAUL, Oct. II Cameron (Margaret)-Nature's pageant: the story of the seasons. 4to. 84 X6, pp. 124, IS. BLACKIE, May II Cameron (Margaret)—The Pretender person. Cr. 8vo. 74 X5, pp. 394, 6s. HARPER, Nov. II Cameron (Margaret)— The Story of the seasons a second nature reader. 8vo. 7+ x4, pp. 160, 9d. ; also in four parts; paper, ea. 2d. ; cloth, ea. 3d.... CHAMBERS, Mar. 11","E. W. Camera fiend, Hornung","['Camera fiend, Hornung (E. W.)']",,Mar. 11,
"Challenge, The, Begbie (H.) 6s.. .Oct. II Challis' Real property. 3rd edit., rev. by C. Sweet. Ryl. 8vo. 20s. BUTTERWORTH, Apr. II Chalmers (Dr.) and the Poor Laws: a com- parison of Scotch and English pauperism and evidence before the Committee of the House of Commons. With pref, by Mrs. George Kerr, and intro. by Miss Grace Chalmers Wood. Cr. 8vo. 7} X 41, pp. 248, 2s. net. DOUGLAS, Aug. II Chamberlain (A. B.)-Romney folio, 315s. net Oct. II Chamberlain (Annie R.)--Practical plain needle- work. Illus. 4to. 81 X6), pp. 204, 38. 6d. net PITMAN, May II Chamberlain (Basil Hall) — Japanese poetry. 8vo. 81 X55, pp. 272, 7s. 6d. net .. MURRAY, May it Chamberlain (Charles J.)—Methods in plant histology. 2nd edit. 8vo., pp. 272, 9s. net CAMB. UNIV. PRESS, May it Chamberlain (J. F. and A. H.)-North America : a supplementary geography. Cr. 8vo., 3s. MACMILLAN, July 11","Challenge, The, Begbie",H.,,MACMILLAN,3s.,0.15,8vo.,"Challenge, The, Begbie (H.) 6s.. .Oct. II Challis' Real property. 3rd edit., rev. by C. Sweet. Ryl. 8vo. 205. BUTTERWORTH, Apr. II Chalmers (Dr.) and the Poor Laws: a com- parison of Scotch and English pauperism and evidence before the Committee of the House of Commons. With pref, by Mrs. George Kerr, and intro. by Miss Grace Chalmers Wood. Cr. 8vo. 7} X 41, pp. 248, 25. net. DOUGLAS, Aug. II Chamberlain (A. B.)-Romney folio, 3155. net Oct. II Chamberlain (Annie R.)--Practical plain needle- work. Illus. 4to. 81 X6), pp. 204, 38. 6d. net PITMAN, May II Chamberlain (Basil Hall) — Japanese poetry. 8vo. 81 X55, pp. 272, 75. 6d. net .. MURRAY, May it Chamberlain (Charles J.)—Methods in plant histology. 2nd edit. 8vo., pp. 272, 9s. net CAMB. UNIV. PRESS, May it Chamberlain (J. F. and A. H.)-North America : a supplementary geography. Cr. 8vo., 3s. MACMILLAN, July 11","H. Challenge, The, Begbie","['Challenge, The, Begbie (H.)']",,July 11,
"Colonel's story, Pryor (Mrs. R. A.) 6s... Apr. II Colonel's story, Pryor (Mrs. R. A.) 6s. ....July II Colonial Office list (The), 1911. WATERLOW, Apr. II Colonial Reports-Bahamas (post free) 4}d. WYMAN, Sep. II Colonial Reports—British Guiana, 1909-10, 4d.; East Africa Protectorate, 1909-10, rod. WYMAN, Feb. 11","Colonel's story, Pryor",Mrs. R. A.,,WYMAN,,0.0,,"Colonel's story, Pryor (Mrs. R. A.) 6s... Apr. II Colonel's story, Pryor (Mrs. R. A.) 6s. ....July II Colonial Office list (The), 1911. WATERLOW, Apr. II Colonial Reports-Bahamas (post free) 4}d. WYMAN, Sep. II Colonial Reports—British Guiana, 1909-10, 4d.; East Africa Protectorate, 1909-10, rod. WYMAN, Feb. 11","Mrs. R. A. Colonel's story, Pryor","[""Colonel's story, Pryor (Mrs. R. A.)""]",,Feb. 11,
"Colters, Whitfeld (J. M.) 5s. Oct. II Colum (Padraic)—Thomas Muskerry: a play in acts. a. 8vo. 71 X4, pp. 64, 19. 6d. net MAUNSEL, Od. II Columbia River, Lyman (W. D.) 7s, 6d, net Oct. II Columbus of space, Serviss (G. P.) 6s.....Dec. II Columns, Calculation of, Nielsen (T.) 4s. 6d. net May II Colville (Mrs. Arthur)—1,000 miles in a machilla : travel and sport in Nyasaland, Angoniland and Rhodesia, &c. Illus. 8vo. 9 X54, pp. 324, Ios. net .W. Scott, May II Colvin (F. H.)—Machine shop mechanics, the why of things in the shop. 12mo., 4s. 6d. net HILL PUB, Co., Oct. II Colyer (J. F.)-Dental disease in its relation to general medicine. Cr. 8vo. 73 x5, pp. 198, 4s. 6d, net ..LONGMANS, Sep. II Comb (R. G. N.)-Law of light. Ryl. 8vo. 25s. BUTTERWORTH, Apr. II Comedies, Aristophanes, (Rogers). Vol. 4. 15s. Νου. ΙΙ Comedies of courtship, Hope (A.) 2s. net Sep. II Comedy of circumstance, Gavj (E.) 6s... Sep. II Comet, Halley's, Shaw (H. K.) 4s. net....Nov. II Comfort (Will Levington)- She buildeth her house. Cr. 8vo. 7* X5, pp. 352, 6s. LIPPINCOTT, Sep. 11","Colters, Whitfeld",J. M.,,LIPPINCOTT,6s.,0.3,8vo.,"Colters, Whitfeld (J. M.) 5s. Oct. II Colum (Padraic)—Thomas Muskerry: a play in acts. a. 8vo. 71 X4, pp. 64, 19. 6d. net MAUNSEL, Od. II Columbia River, Lyman (W. D.) 7s, 6d, net Oct. II Columbus of space, Serviss (G. P.) 6s.....Dec. II Columns, Calculation of, Nielsen (T.) 45. 6d. net May II Colville (Mrs. Arthur)—1,000 miles in a machilla : travel and sport in Nyasaland, Angoniland and Rhodesia, &c. Illus. 8vo. 9 X54, pp. 324, Ios. net .W. Scott, May II Colvin (F. H.)—Machine shop mechanics, the why of things in the shop. 12mo., 4s. 6d. net HILL PUB, Co., Oct. II Colyer (J. F.)-Dental disease in its relation to general medicine. Cr. 8vo. 73 x5, pp. 198, 45. 6d, net ..LONGMANS, Sep. II Comb (R. G. N.)-Law of light. Ryl. 8vo. 255. BUTTERWORTH, Apr. II Comedies, Aristophanes, (Rogers). Vol. 4. 155. Νου. ΙΙ Comedies of courtship, Hope (A.) 25. net Sep. II Comedy of circumstance, Gavj (E.) 6s... Sep. II Comet, Halley's, Shaw (H. K.) 45. net....Nov. II Comfort (Will Levington)- She buildeth her house. Cr. 8vo. 7* X5, pp. 352, 6s. LIPPINCOTT, Sep. 11","J. M. Colters, Whitfeld","['Colters, Whitfeld (J. M.)']",,Sep. 11,
"Cookery, Simple, Booth (A. M.) 4s. 6d. net June, Sep. II Cooks, 365 dishes for little, Marshall (Mrs.) s. net ...May Cook's Handbook for Egypt and the Egyptian Sûdân. 3rd edit. Cr. 8vo., pp. 970, ios, net SIMPKIN, Oct. 11","Cookery, Simple, Booth",A. M.,,SIMPKIN,,0.0,8vo.,"Cookery, Simple, Booth (A. M.) 45. 6d. net June, Sep. II Cooks, 365 dishes for little, Marshall (Mrs.) IS. net ...May Cook's Handbook for Egypt and the Egyptian Sûdân. 3rd edit. Cr. 8vo., pp. 970, ios, net SIMPKIN, Oct. 11","A. M. Cookery, Simple, Booth","['Cookery, Simple, Booth (A. M.)']",,Oct. 11,
"Courageous girl, Marchant (B.) 3s. 60. ..Sep. II Cours pratique de français élémentaire et moyen (ire et 2de année) Méthode directe combinée La vie par l'image.. Traduit et arrangé d'après la nouvelle édit. anglaise. 12mo., 28. 6d. net DULAU, Jan. II Court, Eng., in exile, Grew (E. and M. S.) 15s. net Od. II Court guide, Boyle's Fashionable, May, 1911, 5s. net.. ..May II Courthope (W. J.) -- The Connexion between ancient and modern romance. Ryl. 8vo. swd. s. net (British Academy)....FROWDE, Dec. II Courtier stoops, Yoxall (Sir J. H.) 6s.....0d. II Courtney (W. L.)—In search of Egeria : episodes in the life of Maurice Westerton. Cr. 8vo. 7*X48, pp. 338, 6s... CHAPMAN & H., July 11","Courageous girl, Marchant",B.,,CHAPMAN & H.,6s.,0.3,12mo.,"Courageous girl, Marchant (B.) 35. 60. ..Sep. II Cours pratique de français élémentaire et moyen (ire et 2de année) Méthode directe combinée La vie par l'image.. Traduit et arrangé d'après la nouvelle édit. anglaise. 12mo., 28. 6d. net DULAU, Jan. II Court, Eng., in exile, Grew (E. and M. S.) 155. net Od. II Court guide, Boyle's Fashionable, May, 1911, 55. net.. ..May II Courthope (W. J.) -- The Connexion between ancient and modern romance. Ryl. 8vo. swd. IS. net (British Academy)....FROWDE, Dec. II Courtier stoops, Yoxall (Sir J. H.) 6s.....0d. II Courtney (W. L.)—In search of Egeria : episodes in the life of Maurice Westerton. Cr. 8vo. 7*X48, pp. 338, 6S... CHAPMAN & H., July 11","B. Courageous girl, Marchant","['Courageous girl, Marchant (B.)']",,July 11,
"Cuba, Wright (I. A.) 1os. 6d. net Jan. II Cubic surface, Twenty-seven lines upon, Henderson (A.) 4s. 6d. net..... ...0d. II Cubitt (Edith A.)-Little people in other lands alphabet : a series of coloured drawings with handbook. 4to. 9 X71, 4s. net (Hull) A. BROWN, Dec. II Cubitt (Horace)—Building in London : a treatise on the law and Practice affecting the erection and maintenance of buildings in the Metropolis. Ryl. 8vo. 10 X6), pp. 812, 315, 6d. net CONSTABLE, July 11","Cuba, Wright",I. A.,,CONSTABLE,6d.,0.025,4to.,"Cuba, Wright (I. A.) 1os. 6d. net Jan. II Cubic surface, Twenty-seven lines upon, Henderson (A.) 4s. 6d. net..... ...0d. II Cubitt (Edith A.)-Little people in other lands alphabet : a series of coloured drawings with handbook. 4to. 9 X71, 4s. net (Hull) A. BROWN, Dec. II Cubitt (Horace)—Building in London : a treatise on the law and Practice affecting the erection and maintenance of buildings in the Metropolis. Ryl. 8vo. 10 X6), pp. 812, 315, 6d. net CONSTABLE, July 11","I. A. Cuba, Wright","['Cuba, Wright (I. A.)']",,July 11,net
"Deep down, Ballantyne (R. M.) 1s. 6d... July ir Deephaven, J ewett (S. O.) 3s, net........Oct. II Deeping (Warwick)—Bertrand of Brittany. Pop. edit. Cr. 8vo. pp. 370, is. net CASSELL, Sep. II Deeping (Warwick)—Bess of the woods. Cr. 8vo, 74 X 5, pp. 412, 2s. net ..... CASSELL, Feb. II Deeping (Warwick)—Fox Farm. Cr. 8vo. 77X5, pp. 408, 6s........ ..... CASSELL, Aug. 11","Deep down, Ballantyne",R. M.,,CASSELL,6s.,0.3,8vo.,"Deep down, Ballantyne (R. M.) Is. 6d... July ir Deephaven, J ewett (S. O.) 3s, net........Oct. II Deeping (Warwick)—Bertrand of Brittany. Pop. edit. Cr. 8vo. pp. 370, is. net CASSELL, Sep. II Deeping (Warwick)—Bess of the woods. Cr. 8vo, 74 X 5, pp. 412, 2s. net ..... CASSELL, Feb. II Deeping (Warwick)—Fox Farm. Cr. 8vo. 77X5, pp. 408, 6s........ ..... CASSELL, Aug. 11","R. M. Deep down, Ballantyne","['Deep down, Ballantyne (R. M.)']",,Aug. 11,
"Deeside, Smith (W., jun.) and Anderson (R.) 78. 6d. net ....0d. ií Defender of the faith, Bowen (M.) 6s. ....Feb. II Deflections and stresses, Hudson (C. W.) 15s. net Nov. II Defoe (Daniel)-The Life and strange surprising adventures of Robinson Crusoe. Illus. by the Brothers Rhead. 8vo. 9 X6, pp. 374, 5s. DENT, Oct. II Defoe (Daniel) —— Robinson Crusoe. 12mo., pp. 430, is net (World library) WARD, L., May 11","Deeside, Smith","W., jun.",,"WARD, L.",,0.0,8vo.,"Deeside, Smith (W., jun.) and Anderson (R.) 78. 6d. net ....0d. ií Defender of the faith, Bowen (M.) 6s. ....Feb. II Deflections and stresses, Hudson (C. W.) 155. net Nov. II Defoe (Daniel)-The Life and strange surprising adventures of Robinson Crusoe. Illus. by the Brothers Rhead. 8vo. 9 X6, pp. 374, 5s. DENT, Oct. II Defoe (Daniel) —— Robinson Crusoe. 12mo., pp. 430, is net (World library) WARD, L., May 11","W., jun. Deeside, Smith","['Deeside, Smith (W., jun.)', 'Anderson (R.)']",,May 11,
"Desborough's wife, Meade (L. T.) 6s. Jan. II Descartes (René)-Philosophical works. Ren- dered into English by Elizabeth S. Haldane and G. R. T. Ross. Vol. 1. 8vo. 82X5], pp. 462, Ios. 6d. net CAMB. UNIV. PRESS, May 11","Desborough's wife, Meade",L. T.,,CAMB. UNIV. PRESS,6d.,0.025,8vo.,"Desborough's wife, Meade (L. T.) 6s. Jan. II Descartes (René)-Philosophical works. Ren- dered into English by Elizabeth S. Haldane and G. R. T. Ross. Vol. 1. 8vo. 82X5], pp. 462, Ios. 6d. net CAMB. UNIV. PRESS, May 11","L. T. Desborough's wife, Meade","[""Desborough's wife, Meade (L. T.)""]",,May 11,net
"Drilling, Rock, Dana (R. T.) and Saunders (W. L.) 17s. net .Nov. II Drink problem, Economics of, Baker (J. J.) 1s. Oct. II Drink water (J.)-Poems of men and hours. Cr. 8vo. bds., 1s. 6d. net .... ...NUTT, June II Driver (S. R.) The Book of Exodus. In the Revised Version, with intro. and notes. 12mo., 64 X4}, pp. 516, 3s. 6d. net. (Cambridge Bible for schools and colleges) CAMB. UNIV. PRESS, June 11","Drilling, Rock, Dana",R. T.,,CAMB. UNIV. PRESS,,0.0,8vo.,"Drilling, Rock, Dana (R. T.) and Saunders (W. L.) 175. net .Nov. II Drink problem, Economics of, Baker (J. J.) Is. Oct. II Drink water (J.)-Poems of men and hours. Cr. 8vo. bds., Is. 6d. net .... ...NUTT, June II Driver (S. R.) The Book of Exodus. In the Revised Version, with intro. and notes. 12mo., 64 X4}, pp. 516, 3s. 6d. net. (Cambridge Bible for schools and colleges) CAMB. UNIV. PRESS, June 11","R. T. Drilling, Rock, Dana","['Drilling, Rock, Dana (R. T.)', 'Saunders (W. L.)']",,June 11,
"Economics, Outlines of (Chicago Univ.) 4s, net Oct. II Economics, Principles of, Taussig (T. W.) 17s. net Νου. ΙΙ Economy, personal, and social reform, Wood (H. G.) 1s. 6d. ..Mar. II Ecroyd (Edith Mary) ed.—Readings from Bible and Apocrypha : sclected and arranged. Cr. 8vo.74 x 5, pp. 342, 2s. net FROWDE, Nov. II Eden (Thomas Watts)-A Manual of gynæcology. Illus. 8vo. 94 X6, pp. 654, 18s. net CHURCHILL, Jan. II Eden (Thomas Watts)-A Manual of midwifery 3rd edit. 8vo. 9 X51, pp. 720, 15s. net CHURCHILL, Oct. II Edgar (Frank)-Litafi na Tatsuniyoyi na Hausa. 2 vols. 8vo. ea, ios, 6d. net (3, Donegal Square West, Belfast) ERSKINE MAYNE, Od. II Edgar (J.)--The Expansion of Europe during five centuries, with special reference to South Africa. Part 1: For the Junior Certificate. Cr. 8vo. 78 X 5), pp. 332, 5s. net SIMPKIN, May 11","Economics, Outlines of",Chicago Univ.,,SIMPKIN,5s.,0.25,8vo,"Economics, Outlines of (Chicago Univ.) 4s, net Oct. II Economics, Principles of, Taussig (T. W.) 175. net Νου. ΙΙ Economy, personal, and social reform, Wood (H. G.) 15. 6d. ..Mar. II Ecroyd (Edith Mary) ed.—Readings from Bible and Apocrypha : sclected and arranged. Cr. 8vo.74 x 5, pp. 342, 25. net FROWDE, Nov. II Eden (Thomas Watts)-A Manual of gynæcology. Illus. 8vo. 94 X6, pp. 654, 18s. net CHURCHILL, Jan. II Eden (Thomas Watts)-A Manual of midwifery 3rd edit. 8vo. 9 X51, pp. 720, 155. net CHURCHILL, Oct. II Edgar (Frank)-Litafi na Tatsuniyoyi na Hausa. 2 vols. 8vo. ea, ios, 6d. net (3, Donegal Square West, Belfast) ERSKINE MAYNE, Od. II Edgar (J.)--The Expansion of Europe during five centuries, with special reference to South Africa. Part 1: For the Junior Certificate. Cr. 8vo. 78 X 5), pp. 332, 5s. net SIMPKIN, May 11","Chicago Univ. Economics, Outlines of","['Economics, Outlines of (Chicago Univ.)']",,May 11,net
"Education, Infant Pritchard (E.) 28. net Feb. II Education (Intermediate) Board for Ireland- Report for 1910 (post free), 4d. WYMAN, Sep. II Education (Ireland)--Commissioners' report for 1910 (post free), 6fd.......WYMAN, June 11","Education, Infant Pritchard",E.,,WYMAN,,0.0,,"Education, Infant Pritchard (E.) 28. net Feb. II Education (Intermediate) Board for Ireland- Report for 1910 (post free), 4d. WYMAN, Sep. II Education (Ireland)--Commissioners' report for 1910 (post free), 6fd.......WYMAN, June 11","E. Education, Infant Pritchard","['Education, Infant Pritchard (E.)']",,June 11,
"Elizabethan interiors, Charles (C. J.) 428. nel Dec. II Elliot (Hon. Arthur D.)— The Life of George Joachim Goschen, First Viscount Coschen 1831-1907. 2 vols. 8vo. 91 X5), pp. 326, 310, 25s. net ..LONGMANS, Apr. II Elliot (1.t.-Col. the Hon Fitzwilliam) — The Battle of Flodden and the raids of 1513. 8vo. 8 X5), pp. 228, 5s. net (Edinburgh) ELLIOT, Oct. II Elliot (G. P. Scott)—Chile; its history and development, natural features, &c. Illus. 3rd. impress. 8vo. 9 X 51, pp. 392, 1os. 6d. net UNWIN, Sep. 11","Elizabethan interiors, Charles",C. J.,,UNWIN,6d.,0.025,8vo.,"Elizabethan interiors, Charles (C. J.) 428. nel Dec. II Elliot (Hon. Arthur D.)— The Life of George Joachim Goschen, First Viscount Coschen 1831-1907. 2 vols. 8vo. 91 X5), pp. 326, 310, 255. net ..LONGMANS, Apr. II Elliot (1.t.-Col. the Hon Fitzwilliam) — The Battle of Flodden and the raids of 1513. 8vo. 8 X5), pp. 228, 5s. net (Edinburgh) ELLIOT, Oct. II Elliot (G. P. Scott)—Chile; its history and development, natural features, &c. Illus. 3rd. impress. 8vo. 9 X 51, pp. 392, 1os. 6d. net UNWIN, Sep. 11","C. J. Elizabethan interiors, Charles","['Elizabethan interiors, Charles (C. J.)']",,Sep. 11,net
"Enchanted parrot, Wortham (B. H.) 3s. 6d. net Feb.nl Encyclopedia Biblica, 4 vols. Ryl. 8vo., 42s. net WATTS, May 11","Enchanted parrot, Wortham",B. H.,,WATTS,42s.,2.1,8vo.,"Enchanted parrot, Wortham (B. H.) 35. 6d. net Feb.nl Encyclopedia Biblica, 4 vols. Ryl. 8vo., 425. net WATTS, May 11","B. H. Enchanted parrot, Wortham","['Enchanted parrot, Wortham (B. H.)']",,May 11,net
