entry,last_name,first_name,title,publisher,price,price_in_pounds,format,original_entry,author_name,creators,is_editor,date,is_net
"Soundless tide, Crichton (F. E.) 6s. .Feb. II South (Weston)-The Parson and clerk : a legend of the Devon coast ; with an illus. by 1da M. Bogue. 121110., pp. 20, swd. 6d. WESSEX PRESS, Aug. II South Africa to-day, Fyfe (H. H.) Ios. 6d. net Sep. II South African sketches and stories. 19th ser. 8vo., swd. 6d.......  SOUTH AFRICA, June II South African Who's who, 1911. Roy. 8vo., lthr., 2 s. net .....G. ALLEN, July II South Sea bubbles. By the Earl and the Doctor. Pop. edit. 121110., pp. 334, is. net MACMILLAN, July 11","Soundless tide, Crichton",F. E.,,MACMILLAN,,0.0,8vo.,"Soundless tide, Crichton (F. E.) 65. .Feb. II South (Weston)-The Parson and clerk : a legend of the Devon coast ; with an illus. by Ida M. Bogue. 121110., pp. 20, swd. 6d. WESSEX PRESS, Aug. II South Africa to-day, Fyfe (H. H.) Ios. 6d. net Sep. II South African sketches and stories. 19th ser. 8vo., swd. 6d.......  SOUTH AFRICA, June II South African Who's who, 1911. Roy. 8vo., lthr., 2 IS. net .....G. ALLEN, July II South Sea bubbles. By the Earl and the Doctor. Pop. edit. 121110., pp. 334, is. net MACMILLAN, July 11","F. E. Soundless tide, Crichton","['Soundless tide, Crichton (F. E.)']",,July 11,
"Stecl crown, Hume (F.) 6s..... .Nov. II Steel, Hardening and tempering, Jones (B. E.) 28. Apr. II Steel, Heat treatment of tool, Brearley (H.) Ios. 6d. net..... Dec. II Steel, Metallurgy of, Harbord (F. W.) and Hall I. W) 36s. net... .Dec. II Steel process, Basic open-hearth, Dichmann (C.) Ios. 6d. net .Sep. II Steele (J. C.) see Thomson (S.) and Steele. Steele (Robert)-Revival of printing, 168., 255, net Nov. II Steiner (Rudolf)—The Education of children from the standpoint of theosophy. 12mo. 64 x 41, pp. 84, 1s. net THEOSOPHICAL PUB. Co., June II Steiner (Rudolf)-Initiation and its results : a sequel to “ The Way of initiation. Cr. 8vo. 75 x5, pp. 198, 3s. 6d. net THEOSOPHICAL PUB, Soc., Feb. II Steiner (Rudolf-Mystics of the Renaissance. 8vo. 71 X5, pp. 278, 45, 6d. net THEOSOPHICAL PUBL. Co., Oct. II Steiner (Rudolf—The Submerged continents of Atlantis and Lemuria, their history and civilization. Cr. 8vo., 3s. 6d. net THEOSOPHICAL PUB. CO., June 11","Stecl crown, Hume",F.,,THEOSOPHICAL PUB. CO.,3s. 6d.,0.175,12mo.,"Stecl crown, Hume (F.) 6s..... .Nov. II Steel, Hardening and tempering, Jones (B. E.) 28. Apr. II Steel, Heat treatment of tool, Brearley (H.) Ios. 6d. net..... Dec. II Steel, Metallurgy of, Harbord (F. W.) and Hall I. W) 36s. net... .Dec. II Steel process, Basic open-hearth, Dichmann (C.) Ios. 6d. net .Sep. II Steele (J. C.) see Thomson (S.) and Steele. Steele (Robert)-Revival of printing, 168., 255, net Nov. II Steiner (Rudolf)—The Education of children from the standpoint of theosophy. 12mo. 64 x 41, pp. 84, Is. net THEOSOPHICAL PUB. Co., June II Steiner (Rudolf)-Initiation and its results : a sequel to “ The Way of initiation. Cr. 8vo. 75 x5, pp. 198, 35. 6d. net THEOSOPHICAL PUB, Soc., Feb. II Steiner (Rudolf-Mystics of the Renaissance. 8vo. 71 X5, pp. 278, 45, 6d. net THEOSOPHICAL PUBL. Co., Oct. II Steiner (Rudolf—The Submerged continents of Atlantis and Lemuria, their history and civilization. Cr. 8vo., 35. 6d. net THEOSOPHICAL PUB. CO., June 11","F. Stecl crown, Hume","['Stecl crown, Hume (F.)']",,June 11,net
"Stenographie Pitman, Herbert (S.) 3s. 6d. Jan. II Stenton (F. M.) Types of manorial structure, Vinogradoj (P.) Oxford studies, 128, 6d. net Jan. II Stenton (F. M.)—The Place-names of Berkshire : an essay. 8vo, 9 X6, pp. 56, 2s. 6d. net. (University College, Reading, Studies in Local History.) (READING) UNIVERSITY COLLEGE, Mar. 11","Stenographie Pitman, Herbert",S.,,UNIVERSITY COLLEGE,,0.0,"8vo,","Stenographie Pitman, Herbert (S.) 35. 6d. Jan. II Stenton (F. M.) Types of manorial structure, Vinogradoj (P.) Oxford studies, 128, 6d. net Jan. II Stenton (F. M.)—The Place-names of Berkshire : an essay. 8vo, 9 X6, pp. 56, 25. 6d. net. (University College, Reading, Studies in Local History.) (READING) UNIVERSITY COLLEGE, Mar. 11","S. Stenographie Pitman, Herbert","['Stenographie Pitman, Herbert (S.)']",,Mar. 11,
"Stradella, Crawjord (F. M.) 3s. 6d.......Sep. II Stræten (E. van der)---The Romance of the fiddle : the origin of the modern virtuoso and the adventures of his ancestors. 8vo. 87 X64, pp. 332, 178. 6d. net........ . REBMAN, Aug. II Strahom (C. A.)-Fifteen thousand miles by stage. 8vo. 16s. net.. PUTNAM, Sep. II Straight road, Mendl (G.) 6s. Mar. II Straits of poverty, Mac Mahon (E.) 6s. ..Feb. II Straits Settlements : Arms (post free) 31d. WYMAN, Sep. 11","Stradella, Crawjord",F. M.,,WYMAN,31d.,0.12916666666666668,8vo.,"Stradella, Crawjord (F. M.) 35. 6d.......Sep. II Stræten (E. van der)---The Romance of the fiddle : the origin of the modern virtuoso and the adventures of his ancestors. 8vo. 87 X64, pp. 332, 178. 6d. net........ . REBMAN, Aug. II Strahom (C. A.)-Fifteen thousand miles by stage. 8vo. 16s. net.. PUTNAM, Sep. II Straight road, Mendl (G.) 6s. Mar. II Straits of poverty, Mac Mahon (E.) 6s. ..Feb. II Straits Settlements : Arms (post free) 31d. WYMAN, Sep. 11","F. M. Stradella, Crawjord","['Stradella, Crawjord (F. M.)']",,Sep. 11,
"Track's end, Carruth (H.) 3s. 6d.........Nov. II Tracy (H. C.)—Significance of white markings in birds of the order passeriformes. (Univ. of California). Ryl. 8vo. 101 X7}, pp. 38, swd. 28. net WESLEY, NOV. II Tracy (Louis)—The Silent barrier. 8vo., swd. 6d. WARD, L., Nov. II Tracy (Louis)—The Silent house. Cr. 8vo. 7*X48, pp. 320, 2s. net........NASI, Aug. 11","Track's end, Carruth",H.,,NASI,2s.,0.1,8vo.,"Track's end, Carruth (H.) 3s. 6d.........Nov. II Tracy (H. C.)—Significance of white markings in birds of the order passeriformes. (Univ. of California). Ryl. 8vo. 101 X7}, pp. 38, swd. 28. net WESLEY, NOV. II Tracy (Louis)—The Silent barrier. 8vo., swd. 6d. WARD, L., Nov. II Tracy (Louis)—The Silent house. Cr. 8vo. 7*X48, pp. 320, 25. net........NASI, Aug. 11","H. Track's end, Carruth","[""Track's end, Carruth (H.)""]",,Aug. 11,net
"Trees, Indian, Brandis (D.) 16. net ... Mar. II Trees, Scouts' bk. of, Gofion (J. W.) 6d. net May II Trees, Talks about, Sandford (A. L) 3s. 60. Jan. II Trench (F.)-Manæuvre orders. Toth rev. edit., by Major B. M. Bateman. 16mo. 2s. net W. CLOWES, July 11","Trees, Indian, Brandis",D.,,W. CLOWES,2s.,0.1,16mo.,"Trees, Indian, Brandis (D.) 16. net ... Mar. II Trees, Scouts' bk. of, Gofion (J. W.) 6d. net May II Trees, Talks about, Sandford (A. L) 35. 60. Jan. II Trench (F.)-Manæuvre orders. Toth rev. edit., by Major B. M. Bateman. 16mo. 25. net W. CLOWES, July 11","D. Trees, Indian, Brandis","['Trees, Indian, Brandis (D.)']",,July 11,net
"Under the storm, Yonge (C. M.) 3s. 60. ..Oct. II Under the Swedish colours, Judd (F. A.) 2s. 6d., s, net.. ..0d. 11",,,,,,0.0,,"Under the storm, Yonge (C. M.) 35. 60. ..Oct. II Under the Swedish colours, Judd (F. A.) 25. 6d., IS, net.. ..0d. 11",,,,,
"Violetty's fortune, Murray (M. E.) 2s..... Jan. II Virgil-Æneid. Books 1, 2 and 6. Trans. by John Dryden. Edit. by A. Hamilton Thomp- 12mo., pp. 160, is. CAMB. UNIV. PRESS, Jan. II Virgil-Georgics. Book 4. Edit. by L. D. Wain- wright. 12mo., 1s. 6d.. .BELL, Dec. 11","Violetty's fortune, Murray",M. E.,,BELL,1s. 6d.,0.07500000000000001,12mo.,"Violetty's fortune, Murray (M. E.) 25..... Jan. II Virgil-Æneid. Books 1, 2 and 6. Trans. by John Dryden. Edit. by A. Hamilton Thomp- 12mo., pp. 160, is. CAMB. UNIV. PRESS, Jan. II Virgil-Georgics. Book 4. Edit. by L. D. Wain- wright. 12mo., Is. 6d.. .BELL, Dec. 11","M. E. Violetty's fortune, Murray","[""Violetty's fortune, Murray (M. E.)""]",,Dec. 11,
"Wilmot (E. A. Eardley-) see Eardley-Wilmot. Wilmot (Sir S. Eardley-) see Eardley-Wilmot Wilmot-Buxton (E. M.)--The Story of the Crusades. Illus. 4to. 84x54, pp. 286, 3s. 6d.net HARRAP, July 11",Wilmot,E. A. Eardley-,,HARRAP,3s. 6d.,0.175,4to.,"Wilmot (E. A. Eardley-) see Eardley-Wilmot. Wilmot (Sir S. Eardley-) see Eardley-Wilmot Wilmot-Buxton (E. M.)--The Story of the Crusades. Illus. 4to. 84x54, pp. 286, 35. 6d.net HARRAP, July 11",E. A. Eardley- Wilmot,['Wilmot (E. A. Eardley-)'],,July 11,net
"Wisdom of Schopenhauer (Jekyll) 6s. net. ,Mar, II WOMAN Wise (Clement)—The New life of St. Paul. Cr. 8vo. 73 X5, pp. 498, 6s. net F. GRIFFITHS, Oct. 11",Wisdom of Schopenhauer,Jekyll,,F. GRIFFITHS,6s.,0.3,8vo.,"Wisdom of Schopenhauer (Jekyll) 6s. net. ,Mar, II WOMAN Wise (Clement)—The New life of St. Paul. Cr. 8vo. 73 X5, pp. 498, 6s. net F. GRIFFITHS, Oct. 11",Jekyll Wisdom of Schopenhauer,['Wisdom of Schopenhauer (Jekyll)'],,Oct. 11,net
"Woodman's handbooks, Graves (H.) and Ziegler (E.) 3s. net ..Mar. II Woodroffe and Ameer Ali's Law of evidence applicable to British India. 5th edit., edit. by J. G. Woodroffe and F. J. Mathew. Ryl. 8vo. 278. net .. THACKER, A pr. 11","Woodman's handbooks, Graves",H.,,THACKER,,0.0,8vo.,"Woodman's handbooks, Graves (H.) and Ziegler (E.) 3s. net ..Mar. II Woodroffe and Ameer Ali's Law of evidence applicable to British India. 5th edit., edit. by J. G. Woodroffe and F. J. Mathew. Ryl. 8vo. 278. net .. THACKER, A pr. 11","H. Woodman's handbooks, Graves","[""Woodman's handbooks, Graves (H.)"", 'Ziegler (E.)']",,A pr. 11,
"Young pretenders, Fowler (E. H.) 2s. 60. net Aug. II Young standard bearer (The), 1910. 4to. 1s. 6d. GARDNER, D., Feb. II Young wife, Rowlands (E. A.) 6d. ...... July II Young woman (The)—Vol. 19, Oct. 1910-Sept. 1911. Roy. 8vo., 5s...H. MARSHALL, Sep. 11","Young pretenders, Fowler",E. H.,,H. MARSHALL,5s.,0.25,4to.,"Young pretenders, Fowler (E. H.) 25. 60. net Aug. II Young standard bearer (The), 1910. 4to. Is. 6d. GARDNER, D., Feb. II Young wife, Rowlands (E. A.) 6d. ...... July II Young woman (The)—Vol. 19, Oct. 1910-Sept. 1911. Roy. 8vo., 5s...H. MARSHALL, Sep. 11","E. H. Young pretenders, Fowler","['Young pretenders, Fowler (E. H.)']",,Sep. 11,
"Your forces, Larson (C. D.) 6s. 6d. net. Jan. II Youth's noble path, Gould (F. J.) 2s..... . Apr. II Yoxall (Sir J. H.)—The Courtier stoops. Cr. 8vo. pp. 374, 6s. SMITH, E., Od. II Yoxall (Sir James)—The Doings of Dick and Dan. Imp. 16mo. 7* *5), pp. 332, 3s. 6d. PARTRIDGE, Sep. 11","Your forces, Larson",C. D.,,PARTRIDGE,3s. 6d.,0.175,8vo.,"Your forces, Larson (C. D.) 6s. 6d. net. Jan. II Youth's noble path, Gould (F. J.) 25..... . Apr. II Yoxall (Sir J. H.)—The Courtier stoops. Cr. 8vo. pp. 374, 6s. SMITH, E., Od. II Yoxall (Sir James)—The Doings of Dick and Dan. Imp. 16mo. 7* *5), pp. 332, 35. 6d. PARTRIDGE, Sep. 11","C. D. Your forces, Larson","['Your forces, Larson (C. D.)']",,Sep. 11,
