entry,last_name,first_name,title,publisher,price,format,original_entry,author_name,creators,is_editor,date,catalogue_year,is_net
"Kempis (Thomas à)-Imitation of Christ. Now for the first time set forth in Rhythmic sen- tences according to the original intention of the author. New erlit. 12m0., pp. 318, 2s. net E. STOCK, Dec. 08",Kempis,Thomas à,Imitation of Christ,E. STOCK,2s.,,"Kempis (Thomas à)-Imitation of Christ. Now for the first time set forth in Rhythmic sen- tences according to the original intention of the author. New erlit. 12m0., pp. 318, 25. net E. STOCK, Dec. 08",Thomas à Kempis,['Kempis (Thomas à)'],,Dec. 08,1908,net
"Kennel Encyclopædia (The). Edit. by J. Sidney 'Turner. Vol. 2, part 3. Ryl. Svo. sid. 5s. net ENCYCLOPÆDIC PRESS, Jan. 08",,,Kennel Encyclopædia (The),ENCYCLOPÆDIC PRESS,5s.,,"Kennel Encyclopædia (The). Edit. by J. Sidney 'Turner. Vol. 2, part 3. Ryl. Svo. sid. 55. net ENCYCLOPÆDIC PRESS, Jan. 08",,,,Jan. 08,1908,net
"Kew Gardens-Bulletin, Appendix II., 5d. WYMAN, Mar. 08",,,"Kew Gardens-Bulletin, Appendix II",WYMAN,5d.,,"Kew Gardens-Bulletin, Appendix II., 5d. WYMAN, Mar. 08",,,,Mar. 08,1908,
"Kew Gardens-Bulletin No. 2, 3d. WYMAN, Feb. 08",,,Kew Gardens-Bulletin,WYMAN,3d.,,"Kew Gardens-Bulletin No. 2, 3d. WYMAN, Feb. 08",,,,Feb. 08,1908,
"Kew Gardens-Bulletin No. 3, 3d. WYMAN, April 08",,,Kew Gardens-Bulletin,WYMAN,3d.,,"Kew Gardens-Bulletin No. 3, 3d. WYMAN, April 08",,,,April 08,1908,
"Kew Gardens-Bulletin No. 5, 3d. WYMAN, June 08",,,Kew Gardens-Bulletin,WYMAN,3d.,,"Kew Gardens-Bulletin No. 5, 3d. WYMAN, June 08",,,,June 08,1908,
"Kew Gardens-Bulletin, No. 6, 4d. WYMAN, July 08",,,Kew Gardens-Bulletin,WYMAN,4d.,,"Kew Gardens-Bulletin, No. 6, 4d. WYMAN, July 08",,,,July 08,1908,
"Kew Gardens.-Bulletin, Additional Series, VIII., is. 6d. WYMAN, Aug. 08",,,Kew Gardens,WYMAN,6d.,,"Kew Gardens.-Bulletin, Additional Series, VIII., is. 6d. WYMAN, Aug. 08",,,,Aug. 08,1908,
"Kew Gardens-Bulletin of Miscellaneous Infor- mation, 5s. .WYMAN, Feb. 08",,,Kew Gardens-Bulletin of Miscellaneous Infor- mation,WYMAN,5s.,,"Kew Gardens-Bulletin of Miscellaneous Infor- mation, 5s. .WYMAN, Feb. 08",,,,Feb. 08,1908,
"Kew Gardens-- List of Seeds of Hardy Herba- ceous Plants, and of Trees and Shrubs, 2d. WYMAN, Dec. 08",,,"Kew Gardens-- List of Seeds of Hardy Herba- ceous Plants, and of Trees and Shrubs",WYMAN,2d.,,"Kew Gardens-- List of Seeds of Hardy Herba- ceous Plants, and of Trees and Shrubs, 2d. WYMAN, Dec. 08",,,,Dec. 08,1908,
"Khorasan, Trade of, 1907-8. 4}d. WYMAN, Nov. 08",,,"Khorasan, Trade of",WYMAN,,,"Khorasan, Trade of, 1907-8. 4}d. WYMAN, Nov. 08",,,,Nov. 08,1908,
"Kimpson (F. Claude) - The Church in Modern England : a Study of the place in Christendom and the distinctive mission to the World of the Anglican Communion. Cr. Svo. 73 X5, pp. 215, 2s. 6d. net PITMIX, June 08",Kimpson,F. Claude,The Church in Modern England : a Study of the place in Christendom and the distinctive mission to the World of the Anglican Communion,PITMIX,2s. 6d.,,"Kimpson (F. Claude) - The Church in Modern England : a Study of the place in Christendom and the distinctive mission to the World of the Anglican Communion. Cr. Svo. 73 X5, pp. 215, 2s. 6d. net PITMIX, June 08",F. Claude Kimpson,['Kimpson (F. Claude)'],,June 08,1908,net
"King (J.)-Electoral Reform. An inqury into our system of Parliamentary Representation. Cr. Svo. 7! X1), pp. 188, 28. 6d. net CYTIN, J ul. 08",King,J.,Electoral Reform,CYTIN,6d.,,"King (J.)-Electoral Reform. An inqury into our system of Parliamentary Representation. Cr. Svo. 7! X1), pp. 188, 28. 6d. net CYTIN, J ul. 08",J. King,['King (J.)'],,J ul. 08,1908,net
"King (William)-A Great Archbishop of Dublin : William King, D.D. 1650-1729. Ilis Auto- biography, family, and a selection from his Correspondence. Edit. by Sir Charles Simeon King, Bt. Re-issue. Svo. 9 X54, pp. 346, 5s. LONGMANS, Oct. 08",King,William,"A Great Archbishop of Dublin : William King, D.D",LONGMANS,5s.,,"King (William)-A Great Archbishop of Dublin : William King, D.D. 1650-1729. Ilis Auto- biography, family, and a selection from his Correspondence. Edit. by Sir Charles Simeon King, Bt. Re-issue. Svo. 9 X54, pp. 346, 5s. LONGMANS, Oct. 08",William King,['King (William)'],,Oct. 08,1908,
"King's Bench Judges : Return for 1905 and 1906, 7d. ... WYMAN, Mar. 08",,,King's Bench Judges : Return for,WYMAN,7d.,,"King's Bench Judges : Return for 1905 and 1906, 7d. ... WYMAN, Mar. 08",,,,Mar. 08,1908,
"King's Speech, id W'YMAN, Jan. 08",,,,W'YMAN,,,"King's Speech, id W'YMAN, Jan. 08",,,,Jan. 08,1908,
"King's Speech, id. · WYMAX, Dec. 08",,,,WYMAX,,,"King's Speech, id. · WYMAX, Dec. 08",,,,Dec. 08,1908,
"Kingsley (Charles)— Hcreward the Wake. I 2m0., pp. 578, 1s. net, Ithr. 2s. net (Illus. Pocket Classics) . COLLINS, Aug. 08",Kingsley,Charles,Hcreward the Wake,COLLINS,2s.,,"Kingsley (Charles)— Hcreward the Wake. I 2m0., pp. 578, Is. net, Ithr. 25. net (Illus. Pocket Classics) . COLLINS, Aug. 08",Charles Kingsley,['Kingsley (Charles)'],,Aug. 08,1908,net
"Kingsley (Charles)--Viscellaneous Poems. 6d. net (Carlton Classics) ..LONG, Nov.08",Kingsley,Charles,Viscellaneous Poems,LONG,6d.,,"Kingsley (Charles)--Viscellaneous Poems. 6d. net (Carlton Classics) ..LONG, Nov.08",Charles Kingsley,['Kingsley (Charles)'],,Nov.08,1908,net
"Knowledge Circular Slide Rule Calculator. Designed by B. Baden Powell. 3s. 6d. net KING, SELL, Nov. 08",,,Knowledge Circular Slide Rule Calculator,"KING, SELL",3s. 6d.,,"Knowledge Circular Slide Rule Calculator. Designed by B. Baden Powell. 3s. 6d. net KING, SELL, Nov. 08",,,,Nov. 08,1908,net
"Kuhns (0.)—Ihe Sense of the Infinite. Cr. Svo. 6s. net ...BELL, Oct. 08",Kuhns,0.,Ihe Sense of the Infinite,BELL,6s.,,"Kuhns (0.)—Ihe Sense of the Infinite. Cr. Svo. 6s. net ...BELL, Oct. 08",0. Kuhns,['Kuhns (0.)'],,Oct. 08,1908,net
"Laboratory, Government: Report for the Year ended March, 1908. 3d. WYMAN, July 08",,,"Laboratory, Government: Report for the Year ended March",WYMAN,3d.,,"Laboratory, Government: Report for the Year ended March, 1908. 3d. WYMAN, July 08",,,,July 08,1908,
"Labour Statistics, Abstract of, 1906–7, 1s. 2d. WYMAN, Dec, 08",,,"Labour Statistics, Abstract of",WYMAN,1s. 2d.,,"Labour Statistics, Abstract of, 1906–7, Is. 2d. WYMAN, Dec, 08",,,,"Dec, 08",1908,
"Lafargue (P.)—The Evolution of Property from Savagery to Civilisation. 5th edit. Cr. Svo. 73 X5, pp. 182, 28. 6d. (Social Science Ser.) SONNENSCHEIN, Feb. 08",Lafargue,P.,The Evolution of Property from Savagery to Civilisation,SONNENSCHEIN,6d.,,"Lafargue (P.)—The Evolution of Property from Savagery to Civilisation. 5th edit. Cr. Svo. 73 X5, pp. 182, 28. 6d. (Social Science Ser.) SONNENSCHEIN, Feb. 08",P. Lafargue,['Lafargue (P.)'],,Feb. 08,1908,
"Lambert (F. C.)-The Photographer's Concise Dictionary. Svo. 8} X54, pp. 108, is. net HOUDER & S., April 08",Lambert,F. C.,The Photographer's Concise Dictionary,HOUDER & S.,,,"Lambert (F. C.)-The Photographer's Concise Dictionary. Svo. 8} X54, pp. 108, is. net HOUDER & S., April 08",F. C. Lambert,['Lambert (F. C.)'],,April 08,1908,
"Langbridge (F.)–Stories from the Life of David. New edit. Cr. Svo. 7X4), pp. 296, 1s. 6d. R.T.S., Feb. 08",Langbridge,F.,Stories from the Life of David. New edit,R.T.S.,1s. 6d.,,"Langbridge (F.)–Stories from the Life of David. New edit. Cr. Svo. 7X4), pp. 296, Is. 6d. R.T.S., Feb. 08",F. Langbridge,['Langbridge (F.)'],,Feb. 08,1908,
"Latin and English Languages, Pocket Dictionary HIRSCHFELD, April 08",,,,HIRSCHFELD,,,"Latin and English Languages, Pocket Dictionary HIRSCHFELD, April 08",,,,April 08,1908,
"Latin-English and English-Latin Vest-Pocket Dictionary. 5} X2, is. net SIEGLE, H., Oct. 08",,,Latin-English and English-Latin Vest-Pocket Dictionary,"SIEGLE, H.",,,"Latin-English and English-Latin Vest-Pocket Dictionary. 5} X2, is. net SIEGLE, H., Oct. 08",,,,Oct. 08,1908,
"Law (William)-32m0. 47X2, pp. 160, 1s. net (Miniature Lib. of Devotion)....SEELEY, Oct. 08",Law,William,,SEELEY,1s.,,"Law (William)-32m0. 47X2, pp. 160, Is. net (Miniature Lib. of Devotion)....SEELEY, Oct. 08",William Law,['Law (William)'],,Oct. 08,1908,net
"Lawrence (J. T.)--Masonic Jurisprudence and Symbolism. 12 mo. 4s. 6d. net A. LEWIS, Nov. 08",Lawrence,J. T.,Masonic Jurisprudence and Symbolism,A. LEWIS,4s. 6d.,,"Lawrence (J. T.)--Masonic Jurisprudence and Symbolism. 12 mo. 45. 6d. net A. LEWIS, Nov. 08",J. T. Lawrence,['Lawrence (J. T.)'],,Nov. 08,1908,net
"Leach (J. G.)- The Lake of Garda. Officia Guide. Izmo. swd. 1s. net HEALTH RESORTS BUREAU, Jan. 08",Leach,J. G.,The Lake of Garda,HEALTH RESORTS BUREAU,1s.,,"Leach (J. G.)- The Lake of Garda. Officia Guide. Izmo. swd. Is. net HEALTH RESORTS BUREAU, Jan. 08",J. G. Leach,['Leach (J. G.)'],,Jan. 08,1908,net
"Le Blond (Mrs. Aubrey)-Mountaineering in the Land of the Midnight Sun. Illus. Svo. 9 X 51, pp. 316, ios. 6d. net .. UNWIN, Oct. 08",Le Blond,Mrs. Aubrey,Mountaineering in the Land of the Midnight Sun,UNWIN,6d.,,"Le Blond (Mrs. Aubrey)-Mountaineering in the Land of the Midnight Sun. Illus. Svo. 9 X 51, pp. 316, ios. 6d. net .. UNWIN, Oct. 08",Mrs. Aubrey Le Blond,['Le Blond (Mrs. Aubrey)'],,Oct. 08,1908,net
"Lediard (Henry A.)—Anatomy and Art. A lecture delivered before the Society of Arts and Crafts of Carlisle, September 27th, 1907. Svo, swd. 6d. .SIMPKIN, May 08",Lediard,Henry A.,Anatomy and Art,SIMPKIN,6d.,,"Lediard (Henry A.)—Anatomy and Art. A lecture delivered before the Society of Arts and Crafts of Carlisle, September 27th, 1907. Svo, swd. 6d. .SIMPKIN, May 08",Henry A. Lediard,['Lediard (Henry A.)'],,May 08,1908,
"Lees (Harrington C.)-The Work of Witness and the Promise of Power. Izmo. 61 X 3), pp. 42, 1s, net, swd. 6d, net.. R. SCOTT, Aug. 08",Lees,Harrington C.,The Work of Witness and the Promise of Power,R. SCOTT,6d.,,"Lees (Harrington C.)-The Work of Witness and the Promise of Power. Izmo. 61 X 3), pp. 42, Is, net, swd. 6d, net.. R. SCOTT, Aug. 08",Harrington C. Lees,['Lees (Harrington C.)'],,Aug. 08,1908,net
"Lely (J. M.) and Aggs (W. H.)–Chitty's Statutes, 1902-1907, Vol. 1s. SWEET & M., Mar. 08",Lely,J. M.,Chitty's Statutes,SWEET & M.,1s.,,"Lely (J. M.) and Aggs (W. H.)–Chitty's Statutes, 1902-1907, Vol. 15. SWEET & M., Mar. 08",J. M. Lely,"['Lely (J. M.)', 'Aggs (W. H.)']",,Mar. 08,1908,
"Le Queux (William)-The Count's Chauffeur. New edit. I 2ino., PP. 314, 1s. net NASH, May 08",Le Queux,William,The Count's Chauffeur,NASH,1s.,,"Le Queux (William)-The Count's Chauffeur. New edit. I 2ino., PP. 314, Is. net NASH, May 08",William Le Queux,['Le Queux (William)'],,May 08,1908,net
"Letters which Never Reached Him (The). New edit. 1 2m0., pp. 306, is. net....NASH, May 08",,,Letters which Never Reached Him (The),NASH,,,"Letters which Never Reached Him (The). New edit. 1 2m0., pp. 306, is. net....NASH, May 08",,,,May 08,1908,
"Liberal Publication Department-Pamphlets and Leatlets. 2s. 6d. net.. .L. P. D., Dec, 08",,,Liberal Publication Department-Pamphlets and Leatlets,L. P. D.,2s. 6d.,,"Liberal Publication Department-Pamphlets and Leatlets. 25. 6d. net.. .L. P. D., Dec, 08",,,,"Dec, 08",1908,net
"Licensed Victualler's Year Book, 1908. Svo., . OFFICE, Jan. 08",,,Licensed Victualler's Year Book,OFFICE,,,"Licensed Victualler's Year Book, 1908. Svo., . OFFICE, Jan. 08",,,,Jan. 08,1908,
"Licensing Statistics, 1907, 2s. 6d. WYMAN, Mar. 08",,,Licensing Statistics,WYMAN,2s. 6d.,,"Licensing Statistics, 1907, 25. 6d. WYMAN, Mar. 08",,,,Mar. 08,1908,
"Liddon (Henry P.)---32mo. 41 X2, pp. 160, is, net (Miniature Lib. of Devotion)..SEELEY, Oct. 08",Liddon,Henry P.,,SEELEY,,,"Liddon (Henry P.)---32mo. 41 X2, pp. 160, is, net (Miniature Lib. of Devotion)..SEELEY, Oct. 08",Henry P. Liddon,['Liddon (Henry P.)'],,Oct. 08,1908,
"Life-Saving Apparatus on the Coasts of the United Kingdom, Report on the, 6d. WYMAN, Sep. 08",,,"Life-Saving Apparatus on the Coasts of the United Kingdom, Report on the",WYMAN,6d.,,"Life-Saving Apparatus on the Coasts of the United Kingdom, Report on the, 6d. WYMAN, Sep. 08",,,,Sep. 08,1908,
"Lighthouse Administration, Royal Commission Vol. 1, Report, 4d. ....WYMAN, Feb. 08",,,"Lighthouse Administration, Royal Commission Vol",WYMAN,4d.,,"Lighthouse Administration, Royal Commission Vol. 1, Report, 4d. ....WYMAN, Feb. 08",,,,Feb. 08,1908,
"Lighthouse Administration Commission : Vol. 2, Evidence, Appendices and Index, 3s. 5d. WYMAN, Mar. 08",,,Lighthouse Administration Commission : Vol,WYMAN,3s. 5d.,,"Lighthouse Administration Commission : Vol. 2, Evidence, Appendices and Index, 3s. 5d. WYMAN, Mar. 08",,,,Mar. 08,1908,
"Littler's Compensation in Licensing. 4th edit. s. net ..BUTTERWORTH, Oct. 08",,,Littler's Compensation in Licensing,BUTTERWORTH,,,"Littler's Compensation in Licensing. 4th edit. IS. net ..BUTTERWORTH, Oct. 08",,,,Oct. 08,1908,
"Local Government Board.—Thirty-sixth Annual Report, 1906-7: Supplement (Medical Officer's Report), is. 9d. .WYMAN, Oct. 08",,,Local Government Board,WYMAN,9d.,,"Local Government Board.—Thirty-sixth Annual Report, 1906-7: Supplement (Medical Officer's Report), is. 9d. .WYMAN, Oct. 08",,,,Oct. 08,1908,
"Lodeman (E. G.)--The Spraying of Plants. Cr. Svo. 7* *5), pp. 418, 5s. net MACMILLAN, Nov. 08",Lodeman,E. G.,The Spraying of Plants,MACMILLAN,5s.,,"Lodeman (E. G.)--The Spraying of Plants. Cr. Svo. 7* *5), pp. 418, 5s. net MACMILLAN, Nov. 08",E. G. Lodeman,['Lodeman (E. G.)'],,Nov. 08,1908,net
"London County Council-- Annual Report of the Proceedings of the Council for the year ending 31st March, 1908. Folio, pp. 321, swd, is. P. S. KING, Dec. 08",,,London County Council-- Annual Report of the Proceedings of the Council for the year ending,P. S. KING,,,"London County Council-- Annual Report of the Proceedings of the Council for the year ending 31st March, 1908. Folio, pp. 321, swd, is. P. S. KING, Dec. 08",,,,Dec. 08,1908,
"London County Council : Returns relating to the Council, 2d. ..WYMAN, July 08",,,London County Council : Returns relating to the Council,WYMAN,2d.,,"London County Council : Returns relating to the Council, 2d. ..WYMAN, July 08",,,,July 08,1908,
"Longfellow (Henry Wadsworth)— Poetical Works. Cr. Svo 74 x 4, pp. 566, Ed. net; lihr. is. 60. net (People's Lib.)....CASSELL, Feb. 08",Longfellow,Henry Wadsworth,Poetical Works,CASSELL,,,"Longfellow (Henry Wadsworth)— Poetical Works. Cr. Svo 74 x 4, pp. 566, Ed. net; lihr. is. 60. net (People's Lib.)....CASSELL, Feb. 08",Henry Wadsworth Longfellow,['Longfellow (Henry Wadsworth)'],,Feb. 08,1908,
"Lords, House of, Manuscripts, 1699-1702, 2s. 9d. WYMAX, Sep. 08",,,"Lords, House of, Manuscripts",WYMAX,2s. 9d.,,"Lords, House of, Manuscripts, 1699-1702, 2s. 9d. WYMAX, Sep. 08",,,,Sep. 08,1908,
"Lords (House of) Reform : Report of the Select Committee, 4 d. WYMAN, Dec. 08",Lords,House of,Reform : Report of the Select Committee,WYMAN,,,"Lords (House of) Reform : Report of the Select Committee, 4 d. WYMAN, Dec. 08",House of Lords,['Lords (House of)'],,Dec. 08,1908,
"Lorimer (George Horace)-Old Gorgon Graham. Izmo. 7d. net .. :: .NELSON, Nov. 08",Lorimer,George Horace,Old Gorgon Graham,NELSON,,,"Lorimer (George Horace)-Old Gorgon Graham. Izmo. 7d. net .. :: .NELSON, Nov. 08",George Horace Lorimer,['Lorimer (George Horace)'],,Nov. 08,1908,
"Lotteries and Indecent Advertisements, Select Committee on.-Digest of Evidence, 2d. WYMAN, Dec. 08",,,"Lotteries and Indecent Advertisements, Select Committee on",WYMAN,2d.,,"Lotteries and Indecent Advertisements, Select Committee on.-Digest of Evidence, 2d. WYMAN, Dec. 08",,,,Dec. 08,1908,
"Louys (Pierre)—Woman and Puppet, &c. izmo. 7X4), pp. 256, 1s. 6d. net, Ithr. 2s. net (Lotus Lib.) GREENING, Nov, 08",Louys,Pierre,"Woman and Puppet, &c",GREENING,2s.,,"Louys (Pierre)—Woman and Puppet, &c. izmo. 7X4), pp. 256, Is. 6d. net, Ithr. 25. net (Lotus Lib.) GREENING, Nov, 08",Pierre Louys,['Louys (Pierre)'],,"Nov, 08",1908,net
"Lowell (Russell)--Poems. 1210. 61 X 4, pp. 330, s. 6d. net, Ithr, 2s. net (Red Letter Lib.) BLACKIE, Dec. 08",Lowell,Russell,Poems,BLACKIE,2s.,,"Lowell (Russell)--Poems. 1210. 61 X 4, pp. 330, IS. 6d. net, Ithr, 2s. net (Red Letter Lib.) BLACKIE, Dec. 08",Russell Lowell,['Lowell (Russell)'],,Dec. 08,1908,net
"Lucas (E. V.)-Anne's Terrible Good Nature and other Stories for Children. Illus. Cr. Svo 71 X5, pp. 270, 6s. CHATTO, Oct. 08",Lucas,E. V.,Anne's Terrible Good Nature and other Stories for Children,CHATTO,6s.,,"Lucas (E. V.)-Anne's Terrible Good Nature and other Stories for Children. Illus. Cr. Svo 71 X5, pp. 270, 6s. CHATTO, Oct. 08",E. V. Lucas,['Lucas (E. V.)'],,Oct. 08,1908,
"Lucas (E. V.) ed.--Her Infinite Variety : Feminine Portrait Gallery. 12 mo. 7 X 41, Pp. 388, 5s. METHUEN, Oct. 08",Lucas,E. V.,Her Infinite Variety : Feminine Portrait Gallery,METHUEN,5s.,,"Lucas (E. V.) ed.--Her Infinite Variety : Feminine Portrait Gallery. 12 mo. 7 X 41, Pp. 388, 5s. METHUEN, Oct. 08",E. V. Lucas,['Lucas (E. V.)'],ed.,Oct. 08,1908,
"Luke (Thomas D.)-Guide to Anæsthetics. 4th edit. Demy Svo. 5s. net (Edin.) W. GREEN, Nov. 08",Luke,Thomas D.,Guide to Anæsthetics,W. GREEN,5s.,,"Luke (Thomas D.)-Guide to Anæsthetics. 4th edit. Demy Svo. 5s. net (Edin.) W. GREEN, Nov. 08",Thomas D. Luke,['Luke (Thomas D.)'],,Nov. 08,1908,net
"Lummis-Paterson (G. W.)-see Paterson (G. W. Lummis-) Lunacy Commission-Report to the Lord Chan- cellor, 3s. WYMAN, Aug. 08",,,Lunacy Commission-Report to the Lord Chan- cellor,WYMAN,3s.,,"Lummis-Paterson (G. W.)-see Paterson (G. W. Lummis-) Lunacy Commission-Report to the Lord Chan- cellor, 35. WYMAN, Aug. 08",,['Lummis-Paterson (G. W.)-see Paterson (G. W. Lummis-)'],,Aug. 08,1908,
"Luracy--50th Annual Report of General Board of Commissioners for Scotland, is. 7d. WYMAN, July 08",,,Luracy-,WYMAN,7d.,,"Luracy--50th Annual Report of General Board of Commissioners for Scotland, is. 7d. WYMAN, July 08",,,,July 08,1908,
"Luther (Martin-Letters. Selected and trans, by Margaret A. Currie. 8vo. 9 X 5), pp. 518, 12s. net . MACMILLAN, Mar. 08",Luther,Martin-Letters. Selected,518,MACMILLAN,12s.,,"Luther (Martin-Letters. Selected and trans, by Margaret A. Currie. 8vo. 9 X 5), pp. 518, I2s. net . MACMILLAN, Mar. 08",Martin-Letters. Selected Luther,"['Luther (Martin-Letters. Selected)', 'Luther (trans, by Margaret A. Currie. 8vo. 9 X 5)']",,Mar. 08,1908,net
"Lynch (II. F. B.)- Europe in Macedonia. Svo. ..STANFORD, Feb. 08",Lynch,II. F. B.,Europe in Macedonia,STANFORD,,,"Lynch (II. F. B.)- Europe in Macedonia. Svo. ..STANFORD, Feb. 08",II. F. B. Lynch,['Lynch (II. F. B.)'],,Feb. 08,1908,
"Lynch (II. Foulks)— The Accountants' Pre- liminary Examination Course. 8v0. 84 X5 Pp. 120, 28. od. net .. LYNCH, Mar, 08",Lynch,II. Foulks,The Accountants' Pre- liminary Examination Course,LYNCH,,,"Lynch (II. Foulks)— The Accountants' Pre- liminary Examination Course. 8v0. 84 X5 Pp. 120, 28. od. net .. LYNCH, Mar, 08",II. Foulks Lynch,['Lynch (II. Foulks)'],,"Mar, 08",1908,
"Lyons (Andrew W.)-Grammar of Lettering : A Handbook of Alphabets for art students, decorators, sign-writers, and all classes of craftsmen. Illus. Svo. 9 X54, pp. 122, Ios. 6d. net. MACLAREN, Sep. 08",Lyons,Andrew W.,"Grammar of Lettering : A Handbook of Alphabets for art students, decorators, sign-writers, and all classes of craftsmen",MACLAREN,6d.,,"Lyons (Andrew W.)-Grammar of Lettering : A Handbook of Alphabets for art students, decorators, sign-writers, and all classes of craftsmen. Illus. Svo. 9 X54, pp. 122, Ios. 6d. net. MACLAREN, Sep. 08",Andrew W. Lyons,['Lyons (Andrew W.)'],,Sep. 08,1908,net
"Lyons, Consular Report, 2fd. .. WYMAN, July 08",,,"Lyons, Consular Report",WYMAN,,,"Lyons, Consular Report, 2fd. .. WYMAN, July 08",,,,July 08,1908,
"Lytton (Lord) --Rienzi. 12m0., pp. 606, is, net ; Ithr, 23. net (Illus. Pocket Classics) COLLINS, Mar. 08",Lytton,Lord,Rienzi,COLLINS,,,"Lytton (Lord) --Rienzi. 12m0., pp. 606, is, net ; Ithr, 23. net (Illus. Pocket Classics) COLLINS, Mar. 08",Lord Lytton,['Lytton (Lord)'],,Mar. 08,1908,
"Macaulay (Lord)—The Lays of Ancient Rome. 12 mo. 6d. net, Ithr. is. net (Favourite Classics) HEINEMANN, Nov. 08",Macaulay,Lord,The Lays of Ancient Rome,HEINEMANN,,,"Macaulay (Lord)—The Lays of Ancient Rome. 12 mo. 6d. net, Ithr. is. net (Favourite Classics) HEINEMANN, Nov. 08",Lord Macaulay,['Macaulay (Lord)'],,Nov. 08,1908,
"Macdonald (George)--Light to Live by. A Selection of passages from the 'Unspoken Sermons” of G. M. 12m0., pp. 126, 1s. 6d. net, Ithr. 2s. 6d. net .FOULIS, Nov. 08",Macdonald,George,Light to Live by,FOULIS,2s. 6d.,,"Macdonald (George)--Light to Live by. A Selection of passages from the 'Unspoken Sermons” of G. M. 12m0., pp. 126, Is. 6d. net, Ithr. 25. 6d. net .FOULIS, Nov. 08",George Macdonald,['Macdonald (George)'],,Nov. 08,1908,net
"Macdonald (w.) ed.- Documentary Source Book of American History, 1606-1898. Cr. Svo. 78. 6d. net MACMILLAN, Oct. 08",Macdonald,w.,Documentary Source Book of American History,MACMILLAN,6d.,,"Macdonald (w.) ed.- Documentary Source Book of American History, 1606-1898. Cr. Svo. 78. 6d. net MACMILLAN, Oct. 08",w. Macdonald,['Macdonald (w.)'],ed.,Oct. 08,1908,net
"PP. 170, swd. s. net Macfie (R. C.) Sackville (Lady M.) Fairy Tales, QU'ESTALL PRESS, July 08",,,PP,QU'ESTALL PRESS,,,"PP. 170, swd. IS. net Macfie (R. C.) Sackville (Lady M.) Fairy Tales, QU'ESTALL PRESS, July 08",,,,July 08,1908,
"Macdonell (Anne)-In the Abruzzi. Illus. Svo. McGillivray (D.)--A Century of Protestant 8} X 51, pp. 320, 6s. net ..CHATTO, Sep. 08",Macdonell,Anne,In the Abruzzi,CHATTO,6s.,,"Macdonell (Anne)-In the Abruzzi. Illus. Svo. McGillivray (D.)--A Century of Protestant 8} X 51, pp. 320, 6s. net ..CHATTO, Sep. 08",Anne Macdonell,['Macdonell (Anne)'],,Sep. 08,1908,net
"McEnery (T.)-The Vision of the Form. Cr. Svo. Machine Drawing, &c., Spooner (H. J.) 3s. 6d. 7} X41, pp. 320, 6$....... GREENING, Jan. 08",McEnery,T.,The Vision of the Form,GREENING,,,"McEnery (T.)-The Vision of the Form. Cr. Svo. Machine Drawing, &c., Spooner (H. J.) 3s. 6d. 7} X41, pp. 320, 6$....... GREENING, Jan. 08",T. McEnery,['McEnery (T.)'],,Jan. 08,1908,
"ALLENSON, Mar. og Mackay (A. M.)—Sermons on the Future Life. Macfall (Haldane) -- Boucher : The Man, his! Cr. Svo, swd. is. net...... STOCKWELL, July 08",,,"ALLENSON, Mar",STOCKWELL,,,"ALLENSON, Mar. og Mackay (A. M.)—Sermons on the Future Life. Macfall (Haldane) -- Boucher : The Man, his! Cr. Svo, swd. is. net...... STOCKWELL, July 08",,,,July 08,1908,
"M'Laren (R. S.)- Mechanical Engineering for Beginners. 8v), 8 X5, pp. 300, 5s. net GRIFFIN, Feb. 08",M'Laren,R. S.,Mechanical Engineering for Beginners,GRIFFIN,5s.,,"M'Laren (R. S.)- Mechanical Engineering for Beginners. 8v), 8 X5, pp. 300, 5s. net GRIFFIN, Feb. 08",R. S. M'Laren,"[""M'Laren (R. S.)""]",,Feb. 08,1908,net
"Maclaren (Shaw)-What and Why: being the Philosophy of Things as they Are. Immo. 68 X 41, pp. 136, 1thr. 2s. net G. ALLEN, Oct. 08",Maclaren,Shaw,What and Why: being the Philosophy of Things as they Are,G. ALLEN,2s.,,"Maclaren (Shaw)-What and Why: being the Philosophy of Things as they Are. Immo. 68 X 41, pp. 136, 1thr. 2s. net G. ALLEN, Oct. 08",Shaw Maclaren,['Maclaren (Shaw)'],,Oct. 08,1908,net
"McLean (Archibald)—Where the Book Speaks : or, Mission Studies in the Bible. 2nd edit. Cr. Svo. 78 X 5, pp. 242, 3s. 6d. net REVELL, April 08",McLean,Archibald,"Where the Book Speaks : or, Mission Studies in the Bible",REVELL,3s. 6d.,,"McLean (Archibald)—Where the Book Speaks : or, Mission Studies in the Bible. 2nd edit. Cr. Svo. 78 X 5, pp. 242, 35. 6d. net REVELL, April 08",Archibald McLean,['McLean (Archibald)'],,April 08,1908,net
"Macnaughtan (S.)- A Lame Dog's Diary. d. net . NELSON, Jan, 08",Macnaughtan,S.,A Lame Dog's Diary,NELSON,,,"Macnaughtan (S.)- A Lame Dog's Diary. d. net . NELSON, Jan, 08",S. Macnaughtan,['Macnaughtan (S.)'],,"Jan, 08",1908,
"Macquoid (P.)- A History of English Furniture, Vol. 3. The Age of Mahogally. Folio, 15} XII pp. 276, 125, net..... LAWRENCE & B., Feb. 08",Macquoid,P.,"A History of English Furniture, Vol",LAWRENCE & B.,,,"Macquoid (P.)- A History of English Furniture, Vol. 3. The Age of Mahogally. Folio, 15} XII pp. 276, 125, net..... LAWRENCE & B., Feb. 08",P. Macquoid,['Macquoid (P.)'],,Feb. 08,1908,
"Macquoid (Percy)- A History of English Furni- ture. Vol. 4, Parts 16-20. Folio swd. ea. 78. 6d. net . LAWRENCE & B., Nov.08",Macquoid,Percy,A History of English Furni- ture,LAWRENCE & B.,6d.,,"Macquoid (Percy)- A History of English Furni- ture. Vol. 4, Parts 16-20. Folio swd. ea. 78. 6d. net . LAWRENCE & B., Nov.08",Percy Macquoid,['Macquoid (Percy)'],,Nov.08,1908,net
"Madras Educational Exhibition, 1907, Report of the. Ip. 92 and plate, swd. 8d. (Madras) HIGGINBOTHAM, Mar. 08",,,Madras Educational Exhibition,HIGGINBOTHAM,8d.,,"Madras Educational Exhibition, 1907, Report of the. Ip. 92 and plate, swd. 8d. (Madras) HIGGINBOTHAM, Mar. 08",,,,Mar. 08,1908,
"Maeterlinck (Maurice)-Ruysbroeck and the Mystics. With selections from Ruysbroeck. 2nd edit. 65 X 4), pp. 162, 28. net, ithr. 28. 6d. net HODDER & S., Nov. 08",Maeterlinck,Maurice,Ruysbroeck and the Mystics,HODDER & S.,6d.,,"Maeterlinck (Maurice)-Ruysbroeck and the Mystics. With selections from Ruysbroeck. 2nd edit. 65 X 4), pp. 162, 28. net, ithr. 28. 6d. net HODDER & S., Nov. 08",Maurice Maeterlinck,['Maeterlinck (Maurice)'],,Nov. 08,1908,net
"Magazine and other Danger Buildings, Table Showing Distances from Protected Works, is. WYMAN, July 08",,,"Magazine and other Danger Buildings, Table Showing Distances from Protected Works, is",WYMAN,,,"Magazine and other Danger Buildings, Table Showing Distances from Protected Works, is. WYMAN, July 08",,,,July 08,1908,
