entry,last_name,first_name,title,publisher,price,format,original_entry,author_name,creators,is_editor,date,catalogue_year,is_net
"Phillott (Lieut.-Col., D.C.)--Hindustani Stepping Stones. A practical method of acquiring a new language. Demy 12m0., pp. 196, 6s. net LUZAC, Sep.08",Phillott,"Lieut.-Col., D.C.",Hindustani Stepping Stones,LUZAC,6s.,,"Phillott (Lieut.-Col., D.C.)--Hindustani Stepping Stones. A practical method of acquiring a new language. Demy 12m0., pp. 196, 6s. net LUZAC, Sep.08","Lieut.-Col., D.C. Phillott","['Phillott (Lieut.-Col., D.C.)']",,Sep.08,1908,net
"Philpotts (I:den)— The Whirlwind. Svo. swd. od .CASSELI, Jan, 08",Philpotts,I:den,The Whirlwind,CASSELI,,,"Philpotts (I:den)— The Whirlwind. Svo. swd. od .CASSELI, Jan, 08",I:den Philpotts,['Philpotts (I:den)'],,"Jan, 08",1908,
"Physical Laboratory (National) Committee.- Report, idd.; Evidence and Index, ud. WYMAN, Feb. 08",Physical Laboratory,National,Committee,WYMAN,,,"Physical Laboratory (National) Committee.- Report, idd.; Evidence and Index, ud. WYMAN, Feb. 08",National Physical Laboratory,['Physical Laboratory (National)'],,Feb. 08,1908,
"Physical Training, Manual of, is. WYMAN, Sep. 08",,,"Physical Training, Manual of, is",WYMAN,,,"Physical Training, Manual of, is. WYMAN, Sep. 08",,,,Sep. 08,1908,
"Pike (Oliver G.)—Behind the Veil in Birdland : Some Nature Secrets Revealed by Pen and Camera. Folio. 144 X10, pp. 106 and Plates, Ios. 6d. net ...R.T.S., Dec. 08",Pike,Oliver G.,Behind the Veil in Birdland : Some Nature Secrets Revealed by Pen and Camera,R.T.S.,6d.,,"Pike (Oliver G.)—Behind the Veil in Birdland : Some Nature Secrets Revealed by Pen and Camera. Folio. 144 X10, pp. 106 and Plates, Ios. 6d. net ...R.T.S., Dec. 08",Oliver G. Pike,['Pike (Oliver G.)'],,Dec. 08,1908,net
"Pilotage : Return, 3s. 1d. . . WYMAN, Feb. 08",,,Pilotage : Return,WYMAN,3s. 1d.,,"Pilotage : Return, 3s. Id. . . WYMAN, Feb. 08",,,,Feb. 08,1908,
"Pitman's Business Bookkeeping Transactions No. 2. Folio. Packet 29.....PITMAN, June 08",,,Pitman's Business Bookkeeping Transactions,PITMAN,,,"Pitman's Business Bookkeeping Transactions No. 2. Folio. Packet 29.....PITMAN, June 08",,,,June 08,1908,
"Pitman's Evening School Record-Syllabus Book adapted to the Codal Requirements of both Rural and Urban Evening Schools. 81 X10, Pp. 30, s..... . PITMAN, Nov. 08",,,Pitman's Evening School Record-Syllabus Book adapted to the Codal Requirements of both Rural and Urban Evening Schools,PITMAN,,,"Pitman's Evening School Record-Syllabus Book adapted to the Codal Requirements of both Rural and Urban Evening Schools. 81 X10, Pp. 30, IS..... . PITMAN, Nov. 08",,,,Nov. 08,1908,
"Plaice l'isheries on the North Sea : Special Statistics, Size and Weight, 1s. 9d. WYMAN, Aug. 08",,,"Plaice l'isheries on the North Sea : Special Statistics, Size and Weight",WYMAN,1s. 9d.,,"Plaice l'isheries on the North Sea : Special Statistics, Size and Weight, Is. 9d. WYMAN, Aug. 08",,,,Aug. 08,1908,
"Plautus—Mostellaria. Acting edit., is. net MANCHESTER UNIV. PRESS, Aug. 08",,,Plautus—Mostellaria,MANCHESTER UNIV. PRESS,,,"Plautus—Mostellaria. Acting edit., is. net MANCHESTER UNIV. PRESS, Aug. 08",,,,Aug. 08,1908,
"1s. net (World's Story Tellers).... JACK, July 08",1s. net,World's Story Tellers,,JACK,,,"Is. net (World's Story Tellers).... JACK, July 08",World's Story Tellers 1s. net,"[""1s. net (World's Story Tellers)""]",,July 08,1908,
"Poet's Year Birthday Book (1 he) --Selected by F. Chapman. 1610. ..DRANE, Oct. 08",,,Poet's Year Birthday Book ,DRANE,,,"Poet's Year Birthday Book (1 he) --Selected by F. Chapman. 1610. ..DRANE, Oct. 08",,,,Oct. 08,1908,
"Pogson (N. R.)-Observations of thirty-one Variable Stars. 13s. (Memoirs of the Roy. Astronomical Soc., Vol. 58) WILLIAMS & N., Dec. 08",Pogson,N. R.,Observations of thirty-one Variable Stars,WILLIAMS & N.,13s.,,"Pogson (N. R.)-Observations of thirty-one Variable Stars. 135. (Memoirs of the Roy. Astronomical Soc., Vol. 58) WILLIAMS & N., Dec. 08",N. R. Pogson,['Pogson (N. R.)'],,Dec. 08,1908,
"Poisons and Pharmacy Bill : Digest of Evidence before the Committee, 2d..... WYMAN, Oct. 08",,,Poisons and Pharmacy Bill : Digest of Evidence before the Committee,WYMAN,2d.,,"Poisons and Pharmacy Bill : Digest of Evidence before the Committee, 2d..... WYMAN, Oct. 08",,,,Oct. 08,1908,
"Police (Counties and Boroughs, England and Wales): Reports for 1907, 2s. WYMAN, June 08",Police,"Counties and Boroughs, England",Reports for,WYMAN,2s.,,"Police (Counties and Boroughs, England and Wales): Reports for 1907, 25. WYMAN, June 08","Counties and Boroughs, England Police","['Police (Counties and Boroughs, England)', 'Police (Wales)']",,June 08,1908,
"Police, Metropolitan, Commission : Report and Appendices, 4s. .WYMAN, July 08",,,"Police, Metropolitan, Commission : Report and Appendices",WYMAN,4s.,,"Police, Metropolitan, Commission : Report and Appendices, 4s. .WYMAN, July 08",,,,July 08,1908,
"Police, Metropolitan, Royal Commission on- Evidence, Appendices and Index, Vols. II. and III., 12s. 4d. WYMAN, Aug. 08",,,"Police, Metropolitan, Royal Commission on- Evidence, Appendices and Index, Vols",WYMAN,12s. 4d.,,"Police, Metropolitan, Royal Commission on- Evidence, Appendices and Index, Vols. II. and III., 12s. 4d. WYMAN, Aug. 08",,,,Aug. 08,1908,
"Political Socialism : A Remonstrance. A Collec- tion of Papers by embers of the British Constitution Association. Cr. Svo. 71 X 44, pp. 194, is. 6d, net; bds. 1s. net P. S. KING, Aug. 08",,,Political Socialism : A Remonstrance,P. S. KING,1s.,,"Political Socialism : A Remonstrance. A Collec- tion of Papers by embers of the British Constitution Association. Cr. Svo. 71 X 44, pp. 194, is. 6d, net; bds. Is. net P. S. KING, Aug. 08",,,,Aug. 08,1908,net
"Poorhouses, L.G.B. Rules and Regulations for Management of, 4d. . . WYMAN, Jan. 08",,,"Poorhouses, L.G.B. Rules and Regulations for Management of",WYMAN,4d.,,"Poorhouses, L.G.B. Rules and Regulations for Management of, 4d. . . WYMAN, Jan. 08",,,,Jan. 08,1908,
"Potter (Thomas) Concrete ; its uses in Building Port of London Bill : Report of Select Committee from Foundations to Finish. 3rd edit., rev. and enl. on, with Proceedings, 3d. ....WYMAN, Aug. 08",Potter,Thomas,Concrete ; its uses in Building Port of London Bill : Report of Select Committee from Foundations to Finish,WYMAN,3d.,,"Potter (Thomas) Concrete ; its uses in Building Port of London Bill : Report of Select Committee from Foundations to Finish. 3rd edit., rev. and enl. on, with Proceedings, 3d. ....WYMAN, Aug. 08",Thomas Potter,['Potter (Thomas)'],,Aug. 08,1908,
"Post Office (Changes in Wages) : Return, 7d. Poverty, Bible and, Godbey (S. M.) 3s. 6d. net WYMAN, July 08",Post Office,Changes in Wages,Return,WYMAN,3s. 6d.,,"Post Office (Changes in Wages) : Return, 7d. Poverty, Bible and, Godbey (S. M.) 35. 6d. net WYMAN, July 08",Changes in Wages Post Office,['Post Office (Changes in Wages)'],,July 08,1908,net
"Post Office (Life Insurance): Report of Com- Powell (B. H. Baden-)-The Origin and Growth mittee ; with evidence, iod... WYMAN, Nov. 08",Post Office,Life Insurance,"Report of Com- Powell (B. H. Baden-)-The Origin and Growth mittee ; with evidence, iod",WYMAN,,,"Post Office (Life Insurance): Report of Com- Powell (B. H. Baden-)-The Origin and Growth mittee ; with evidence, iod... WYMAN, Nov. 08",Life Insurance Post Office,['Post Office (Life Insurance)'],,Nov. 08,1908,
"Powell (R. S. S. Baden-)- Scouting for Boys. WYMAN, Sep.08",Powell,R. S. S. Baden-,Scouting for Boys,WYMAN,,,"Powell (R. S. S. Baden-)- Scouting for Boys. WYMAN, Sep.08",R. S. S. Baden- Powell,['Powell (R. S. S. Baden-)'],,Sep.08,1908,
"Power Generators, Modern, French (J. W.) 42s. BAILLIERE, A pril 08",,,"Power Generators, Modern, French (J. W.)",BAILLIERE,42s.,,"Power Generators, Modern, French (J. W.) 425. BAILLIERE, A pril 08",,,,A pril 08,1908,
"Precious Stones, considered in their Scientific and Artistic relations, with a catalogue of the Townshend collection (by Professor Church) 2s. 3d. ; swd. 1s. 6d. .WYMAN, Nov. 08",,,"Precious Stones, considered in their Scientific and Artistic relations, with a catalogue of the Townshend collection (by Professor Church)",WYMAN,1s. 6d.,,"Precious Stones, considered in their Scientific and Artistic relations, with a catalogue of the Townshend collection (by Professor Church) 25. 3d. ; swd. Is. 6d. .WYMAN, Nov. 08",,,,Nov. 08,1908,
"Prints, Catalogue of : The Liber Studiorum of J. M. W. Turner, R.A., 9d. ....WYMAN, Oct. 08",,,"Prints, Catalogue of : The Liber Studiorum of J. M. W. Turner, R.A.",WYMAN,9d.,,"Prints, Catalogue of : The Liber Studiorum of J. M. W. Turner, R.A., 9d. ....WYMAN, Oct. 08",,,,Oct. 08,1908,
"Prisonniers du Caucase (1.es). Edit. by W. G. Hartog. I 21110. s. RIVINGTONS, June 08",Prisonniers du Caucase,1.es,Edit,RIVINGTONS,,,"Prisonniers du Caucase (1.es). Edit. by W. G. Hartog. I 21110. IS. RIVINGTONS, June 08",1.es Prisonniers du Caucase,['Prisonniers du Caucase (1.es)'],,June 08,1908,
"Prisons Commissioners-Report. Parts 1 and 2, WYMAN, Sep. 08",,,Prisons Commissioners-Report,WYMAN,,,"Prisons Commissioners-Report. Parts 1 and 2, WYMAN, Sep. 08",,,,Sep. 08,1908,
"Proby (W. H. B.)- Lessons on the Kingdom. For Little ones of the Church of England. New edit. 12m0., pp. 128, limpis. and is. 6d. SONNENSCHEIN, July 08",Proby,W. H. B.,Lessons on the Kingdom,SONNENSCHEIN,6d.,,"Proby (W. H. B.)- Lessons on the Kingdom. For Little ones of the Church of England. New edit. 12m0., pp. 128, limpis. and is. 6d. SONNENSCHEIN, July 08",W. H. B. Proby,['Proby (W. H. B.)'],,July 08,1908,
"Proby (W. H. B.)- Stories about the Great King. 5th edit. 12m10, 6X3, pp. 326, 38, 6d SONNENSCHEIN, ſ uly 08",Proby,W. H. B.,Stories about the Great King,SONNENSCHEIN,6d,,"Proby (W. H. B.)- Stories about the Great King. 5th edit. 12m10, 6X3, pp. 326, 38, 6d SONNENSCHEIN, ſ uly 08",W. H. B. Proby,['Proby (W. H. B.)'],,ſ uly 08,1908,
"Publications Committee : Index and Digest of Protestantism, Romance of, Alcock (D.) 3s. 6d. Evidence, id. .WYMAN, Mar. 08",,,"Publications Committee : Index and Digest of Protestantism, Romance of, Alcock (D.)",WYMAN,,,"Publications Committee : Index and Digest of Protestantism, Romance of, Alcock (D.) 35. 6d. Evidence, id. .WYMAN, Mar. 08",,,,Mar. 08,1908,
"Plays for Children. Cr. Svo. 71 X 41, pp. 72, Protheroe (Ernest)-St. Merville's Scholarship ..CURWEN, Jan. 08",,,Plays for Children,CURWEN,,,"Plays for Children. Cr. Svo. 71 X 41, pp. 72, Protheroe (Ernest)-St. Merville's Scholarship ..CURWEN, Jan. 08",,,,Jan. 08,1908,
"Quarries, List of, 5s. WYMAN, Aug. 08",,,"Quarries, List of",WYMAN,5s.,,"Quarries, List of, 5s. WYMAN, Aug. 08",,,,Aug. 08,1908,
"Queensland-Papers re Taxation of Land, 2{d. WYMAN, Feb. 08",,,"Queensland-Papers re Taxation of Land, 2{d",WYMAN,,,"Queensland-Papers re Taxation of Land, 2{d. WYMAN, Feb. 08",,,,Feb. 08,1908,
"Quiver (The), 1908. Ryl. Svo. 7s. 60. CASSELL, Oct. 08",,,Quiver (The),CASSELL,,,"Quiver (The), 1908. Ryl. Svo. 75. 60. CASSELL, Oct. 08",,,,Oct. 08,1908,
"Radford (L. B.)--The Epistle to Diognetus. 12m0., pp. 96, is. 61. (Early Church Classics) S.P.CK., April 08",Radford,L. B.,The Epistle to Diognetus,S.P.CK.,,,"Radford (L. B.)--The Epistle to Diognetus. 12m0., pp. 96, is. 61. (Early Church Classics) S.P.CK., April 08",L. B. Radford,['Radford (L. B.)'],,April 08,1908,
"Raeburn (David)---Hoodman Grey, Christian. Cr. 7{ x 5. pp. 302, 6s.........CASSELL, Oct. 08",Raeburn,David,"Hoodman Grey, Christian",CASSELL,6s.,,"Raeburn (David)---Hoodman Grey, Christian. Cr. 7{ x 5. pp. 302, 6s.........CASSELL, Oct. 08",David Raeburn,['Raeburn (David)'],,Oct. 08,1908,
"Railway Accidents, Reports on, is. 7d. WYMAN, April 08",,,"Railway Accidents, Reports on, is",WYMAN,7d.,,"Railway Accidents, Reports on, is. 7d. WYMAN, April 08",,,,April 08,1908,
"Railway Accidents, Return of, for 3 months ending December, 1907, 4s. 6d. WYMAN, May 08",,,"Railway Accidents, Return of, for",WYMAN,4s. 6d.,,"Railway Accidents, Return of, for 3 months ending December, 1907, 45. 6d. WYMAN, May 08",,,,May 08,1908,
"Railway Accidents, Return of, during Three Months ending June, 1908, id. WYMAN, Nov. 08",,,"Railway Accidents, Return of, during Three Months ending June",WYMAN,,,"Railway Accidents, Return of, during Three Months ending June, 1908, id. WYMAN, Nov. 08",,,,Nov. 08,1908,
"Railway Companies of the U.K. Returns of the Capital, Traffic Receipts and Working Expendi- ture for 1907, 1s. 3d......... WYMAN, Nov. 08",,,"Railway Companies of the U.K. Returns of the Capital, Traffic Receipts and Working Expendi- ture for",WYMAN,1s. 3d.,,"Railway Companies of the U.K. Returns of the Capital, Traffic Receipts and Working Expendi- ture for 1907, Is. 3d......... WYMAN, Nov. 08",,,,Nov. 08,1908,
"Railway Diary and Officials' Directory, 1908 Svo. s. MCCORDIODALE, Jan. 08",,,Railway Diary and Officials' Directory,MCCORDIODALE,,,"Railway Diary and Officials' Directory, 1908 Svo. IS. MCCORDIODALE, Jan. 08",,,,Jan. 08,1908,
"Rama Varma Raja (K.)-Comparative Studies (Indian Mythology, Caste, &c.). 8vo., pp. 47, swd. 8d. (Madras) HIGGINBOTHAM, Mar. 08",,,,HIGGINBOTHAM,8d.,,"Rama Varma Raja (K.)-Comparative Studies (Indian Mythology, Caste, &c.). 8vo., pp. 47, swd. 8d. (Madras) HIGGINBOTHAM, Mar. 08",,"['Rama Varma Raja (K.)-Comparative Studies (Indian Mythology, Caste, &c.)']",,Mar. 08,1908,
"Ramakrishna, The Gospel of. · Edit. by Swami Abhedananda. Authorised edit., with illustra- tions. pp. ix. and 436 ; 6s. 6d. ; full Ithr., flexible cover, 13s. .LUZAC, Feb. 08",,,"Ramakrishna, The Gospel of",LUZAC,13s.,,"Ramakrishna, The Gospel of. · Edit. by Swami Abhedananda. Authorised edit., with illustra- tions. pp. ix. and 436 ; 6s. 6d. ; full Ithr., flexible cover, 13S. .LUZAC, Feb. 08",,,,Feb. 08,1908,
"Ranking (D. F. de l'H.)- Parallel Abstract of Companies Acts of 1900 and 1907, and Limited Partnership Act, 1907. Svo. swd. is. net H. F. LYNCH, Jan, 08",Ranking,D. F. de l'H.,Parallel Abstract of Companies Acts of,H. F. LYNCH,,,"Ranking (D. F. de l'H.)- Parallel Abstract of Companies Acts of 1900 and 1907, and Limited Partnership Act, 1907. Svo. swd. is. net H. F. LYNCH, Jan, 08",D. F. de l'H. Ranking,"[""Ranking (D. F. de l'H.)""]",,"Jan, 08",1908,
"Record Office, Public, List of Chancery Rolls. . W'YMAN, July 08",,,"Record Office, Public, List of Chancery Rolls",W'YMAN,,,"Record Office, Public, List of Chancery Rolls. . W'YMAN, July 08",,,,July 08,1908,
"Records, Public, Guide to the, 7s. WYMAN, Jan. 08",,,"Records, Public, Guide to the",WYMAN,7s.,,"Records, Public, Guide to the, 75. WYMAN, Jan. 08",,,,Jan. 08,1908,
"Redlich ( ) --The Procedure of the House of Conuons : A Study of Its History and Present Form. 'Trans, from the German by A. Ernest Steinthal. 3 vols. Ryl. Svo 10 X6, pp. 254, 272, 342, 3's, 6d, net ....CONSTABLE, Jan. 08",Redlich, ,The Procedure of the House of Conuons : A Study of Its History and Present Form,CONSTABLE,6d.,,"Redlich ( ) --The Procedure of the House of Conuons : A Study of Its History and Present Form. 'Trans, from the German by A. Ernest Steinthal. 3 vols. Ryl. Svo 10 X6, pp. 254, 272, 342, 3's, 6d, net ....CONSTABLE, Jan. 08",  Redlich,['Redlich ( )'],,Jan. 08,1908,net
"Redmayne (R. A. S.)-Report on Shaft Accidents at Collieries, is. 3d.........WYMAN, April 08",Redmayne,R. A. S.,"Report on Shaft Accidents at Collieries, is",WYMAN,3d.,,"Redmayne (R. A. S.)-Report on Shaft Accidents at Collieries, is. 3d.........WYMAN, April 08",R. A. S. Redmayne,['Redmayne (R. A. S.)'],,April 08,1908,
"Rees (David J.)-Cours d'Anglais Illustré Revu et corrigé par J. McLaughlin. Cr. Svo. 71 X41. pp. 140, 2s. MODERN LANGUAGE PRESS, May 08",Rees,David J.,Cours d'Anglais Illustré Revu et corrigé par J. McLaughlin,MODERN LANGUAGE PRESS,2s.,,"Rees (David J.)-Cours d'Anglais Illustré Revu et corrigé par J. McLaughlin. Cr. Svo. 71 X41. pp. 140, 25. MODERN LANGUAGE PRESS, May 08",David J. Rees,['Rees (David J.)'],,May 08,1908,
"Reformatory and Industrial Schools : Fifty-first Report. 1907, s. 2d. WYMAN, May 08",,,Reformatory and Industrial Schools : Fifty-first Report,WYMAN,2d.,,"Reformatory and Industrial Schools : Fifty-first Report. 1907, s. 2d. WYMAN, May 08",,,,May 08,1908,
"Reich (Emil)-Atlas Antiquus. In Forty-eight Original Graphic Maps, &c. Imp. 8vu. 104 x 74, ios. net...... MACMILLAN, Mar. 08",Reich,Emil,Atlas Antiquus,MACMILLAN,,,"Reich (Emil)-Atlas Antiquus. In Forty-eight Original Graphic Maps, &c. Imp. 8vu. 104 x 74, ios. net...... MACMILLAN, Mar. 08",Emil Reich,['Reich (Emil)'],,Mar. 08,1908,
"Reich (Emil)-A Dictionary of Classical Antiqui- ties. Abridged from Dr. Oscar Seyffert's Larger Dictionary. Cr. Svo. 7! X4, pp: 320, 3s. 6d. net, Ithr. 4s. 6d. net (New Classical Lib. SONNENSCHEIN, April 08",Reich,Emil,A Dictionary of Classical Antiqui- ties,SONNENSCHEIN,,,"Reich (Emil)-A Dictionary of Classical Antiqui- ties. Abridged from Dr. Oscar Seyffert's Larger Dictionary. Cr. Svo. 7! X4, pp: 320, 3s. 6d. net, Ithr. 45. 6d. net (New Classical Lib. SONNENSCHEIN, April 08",Emil Reich,['Reich (Emil)'],,April 08,1908,
"Reich (Emil-Woman through the Ages. vols. Illus. 8vo. 9 X5), pp. 282, 304, 2 is. net METHUEN, Oct. 08",Reich,Emil-Woman through the Ages. vols. Illus. 8vo. 9 X5,282,METHUEN,,,"Reich (Emil-Woman through the Ages. vols. Illus. 8vo. 9 X5), pp. 282, 304, 2 is. net METHUEN, Oct. 08",Emil-Woman through the Ages. vols. Illus. 8vo. 9 X5 Reich,['Reich (Emil-Woman through the Ages. vols. Illus. 8vo. 9 X5)'],,Oct. 08,1908,
"Reilly (C. H.) and Abercrombie (P.) ed.-Port- folio of Measured Drawings. Vol. 2. Folio 2S. net ....LOCKWOOD, Mar. 08",Reilly,C. H.,Port- folio of Measured Drawings,LOCKWOOD,,,"Reilly (C. H.) and Abercrombie (P.) ed.-Port- folio of Measured Drawings. Vol. 2. Folio 2IS. net ....LOCKWOOD, Mar. 08",C. H. Reilly,"['Reilly (C. H.)', 'Abercrombie (P.)']",ed.,Mar. 08,1908,
"Rentals and Surveys, &c., Preserved at the Public Record Office, List of, 14s... WYMAN, June 08",,,"Rentals and Surveys, &c",WYMAN,14s.,,"Rentals and Surveys, &c., Preserved at the Public Record Office, List of, 145... WYMAN, June 08",,,,June 08,1908,
"Reuterdahl (A.)– Theory and Design of Reinforced Concrete Archies. Svo, Ss. 6d, net SPON, Dec. 08",Reuterdahl,A.,Theory and Design of Reinforced Concrete Archies,SPON,6d.,,"Reuterdahl (A.)– Theory and Design of Reinforced Concrete Archies. Svo, Ss. 6d, net SPON, Dec. 08",A. Reuterdahl,['Reuterdahl (A.)'],,Dec. 08,1908,net
"Pp. 284, is. net ; Ithr. is. Ed. net (World's Classics).. FROWDE, Jan. 08",,,Pp,FROWDE,,,"Pp. 284, is. net ; Ithr. is. Ed. net (World's Classics).. FROWDE, Jan. 08",,,,Jan. 08,1908,
"IOS. 6d. net PUTNAM, Feb. 08",,,IOS,PUTNAM,6d.,,"IOS. 6d. net PUTNAM, Feb. 08",,,,Feb. 08,1908,net
"Rhys (Mrs. Ernest)-The Children's England. Richmond (Leigh)—The Dairymau's Daughter and Ryl. 16io. pp. 228, is. 60... CASSELL, Oct. 08",Rhys,Mrs. Ernest,The Children's England,CASSELL,,,"Rhys (Mrs. Ernest)-The Children's England. Richmond (Leigh)—The Dairymau's Daughter and Ryl. 16io. pp. 228, is. 60... CASSELL, Oct. 08",Mrs. Ernest Rhys,['Rhys (Mrs. Ernest)'],,Oct. 08,1908,
"Rickaby (Joseph)-Scholasticism. I 2010., PP. Richard (Th.)-Guide to Buddahood : Being a 130, is. net (Philosophies Ancient and Modern) Standard Manual of Clunese Buddhism. Trans. CONSTABLE, Sep. 08",Rickaby,Joseph,Scholasticism,CONSTABLE,,,"Rickaby (Joseph)-Scholasticism. I 2010., PP. Richard (Th.)-Guide to Buddahood : Being a 130, is. net (Philosophies Ancient and Modern) Standard Manual of Clunese Buddhism. Trans. CONSTABLE, Sep. 08",Joseph Rickaby,['Rickaby (Joseph)'],,Sep. 08,1908,
"Rickett (Leonard A. Compton-)-Philomela, a Lyrical Drama in Five Acts and Poems. Cr. 38. 6d. net......E. MATHEWS, July 08",Rickett,Leonard A. Compton-,"Philomela, a Lyrical Drama in Five Acts and Poems",E. MATHEWS,6d.,,"Rickett (Leonard A. Compton-)-Philomela, a Lyrical Drama in Five Acts and Poems. Cr. 38. 6d. net......E. MATHEWS, July 08",Leonard A. Compton- Rickett,['Rickett (Leonard A. Compton-)'],,July 08,1908,net
"Rigby (R.)-The Inky Imps. Illus. Folio bds. 28. od. net ..SIEGLE, HILL, Sep. 08",Rigby,R.,The Inky Imps,"SIEGLE, HILL",,,"Rigby (R.)-The Inky Imps. Illus. Folio bds. 28. od. net ..SIEGLE, HILL, Sep. 08",R. Rigby,['Rigby (R.)'],,Sep. 08,1908,
"Roberts (Charles G. D.)-The House in the Water. A Book of Animal Life. Cr. 8 X5, pp. 324, 6s. WARD, LOCK, Oct, 08",Roberts,Charles G. D.,The House in the Water,"WARD, LOCK",6s.,,"Roberts (Charles G. D.)-The House in the Water. A Book of Animal Life. Cr. 8 X5, pp. 324, 6s. WARD, LOCK, Oct, 08",Charles G. D. Roberts,['Roberts (Charles G. D.)'],,"Oct, 08",1908,
"Robertson (C.)-Modern Geography and the Copernican Hypothesis. Svo. 9**5), pp. 92, bds. is, net .E. MACKAY, May 08",Robertson,C.,Modern Geography and the Copernican Hypothesis,E. MACKAY,,,"Robertson (C.)-Modern Geography and the Copernican Hypothesis. Svo. 9**5), pp. 92, bds. is, net .E. MACKAY, May 08",C. Robertson,['Robertson (C.)'],,May 08,1908,
"Robertson (Eric)— The Cure of “Bad Throats by Good Breathing. A Plea for Nature in Therapeutics. Svo. 8} <5), pp. 56, bds. 2s. net SIMPKIN, July 08",Robertson,Eric,The Cure of “Bad Throats by Good Breathing,SIMPKIN,2s.,,"Robertson (Eric)— The Cure of “Bad Throats by Good Breathing. A Plea for Nature in Therapeutics. Svo. 8} <5), pp. 56, bds. 25. net SIMPKIN, July 08",Eric Robertson,['Robertson (Eric)'],,July 08,1908,net
"Robertson (G. S.)-The Law and Practice of Civil Proceedings By and Against the Crown and Departments of the Government. Ryl. Svo. 38s. .STEVENS & SONS, June od Robertson (James) --Spiritualism : The Open Door to the Unseen Universe. Cr. Svo, 71 X 41, pp. 424. 5s. net .I. N. FOWLER, Sep 08",Robertson,G. S.,The Law and Practice of Civil Proceedings By and Against the Crown and Departments of the Government,I. N. FOWLER,5s.,,"Robertson (G. S.)-The Law and Practice of Civil Proceedings By and Against the Crown and Departments of the Government. Ryl. Svo. 38s. .STEVENS & SONS, June od Robertson (James) --Spiritualism : The Open Door to the Unseen Universe. Cr. Svo, 71 X 41, pp. 424. 55. net .I. N. FOWLER, Sep 08",G. S. Robertson,['Robertson (G. S.)'],,Sep 08,1908,net
"Robertson (W. G. A.)— Manual of Medical Juris- prudence, Toxicology and Public Health. Cr. Svo. 7! X5, pp. 572, 8s. net SIMPKIN, May 08",Robertson,W. G. A.,"Manual of Medical Juris- prudence, Toxicology and Public Health",SIMPKIN,8s.,,"Robertson (W. G. A.)— Manual of Medical Juris- prudence, Toxicology and Public Health. Cr. Svo. 7! X5, pp. 572, 8s. net SIMPKIN, May 08",W. G. A. Robertson,['Robertson (W. G. A.)'],,May 08,1908,net
"Robertson (W. Graham)- Pinkie and the Fairies. Cr. Svo. 7} X5, pp. 156, 2s., Swil is. HEINEMAXX, Dec. 08",Robertson,W. Graham,Pinkie and the Fairies,HEINEMAXX,,,"Robertson (W. Graham)- Pinkie and the Fairies. Cr. Svo. 7} X5, pp. 156, 25., Swil is. HEINEMAXX, Dec. 08",W. Graham Robertson,['Robertson (W. Graham)'],,Dec. 08,1908,
"Robinson (Evelyn F.)— Thoughts on Life and Deatlı. Taken from the Book of Ecclesiasticus, B.C. 190. Selected and arranged Pp. 40. swd. is. net.... MASTERS, Oct. 08",Robinson,Evelyn F.,Thoughts on Life and Deatlı,MASTERS,,,"Robinson (Evelyn F.)— Thoughts on Life and Deatlı. Taken from the Book of Ecclesiasticus, B.C. 190. Selected and arranged Pp. 40. swd. is. net.... MASTERS, Oct. 08",Evelyn F. Robinson,['Robinson (Evelyn F.)'],,Oct. 08,1908,
"Romance of a Farm (The)--By the author of Rock in the Baltic, Barr (R.) 6d. ....Sep. 08 The Scamp.” Svo, swd. 6d. Rock-Climbing in Skye, Abraham (A. P.) 21s. net W. STEVENS, J une 08",,,"Romance of a Farm (The)--By the author of Rock in the Baltic, Barr (R.)",W. STEVENS,21s.,,"Romance of a Farm (The)--By the author of Rock in the Baltic, Barr (R.) 6d. ....Sep. 08 The Scamp.” Svo, swd. 6d. Rock-Climbing in Skye, Abraham (A. P.) 215. net W. STEVENS, J une 08",,,,J une 08,1908,net
"Rosario District, Consular Report, 2}d. WYMAN, Aug. 08",,,"Rosario District, Consular Report",WYMAN,,,"Rosario District, Consular Report, 2}d. WYMAN, Aug. 08",,,,Aug. 08,1908,
"Ross-Scott (T.)-see Scott (T. Ross-) Rossetti (Christina G.)-Poems. 32nio. Ithr. is, net. .NIMMO, Aug. 08",,,Rossetti (Christina G.)-Poems,NIMMO,,,"Ross-Scott (T.)-see Scott (T. Ross-) Rossetti (Christina G.)-Poems. 32nio. Ithr. is, net. .NIMMO, Aug. 08",,['Ross-Scott (T.)-see Scott (T. Ross-)'],,Aug. 08,1908,
"Rousseau (Jean Jacques)--The Humane Philo- sophy: Maxims and Principles, selected and classified by Frederika Macdonald. 121110. 64 X4, pp. 296, 2s. net ..DENT, Sep.08",Rousseau,Jean Jacques,"The Humane Philo- sophy: Maxims and Principles, selected and classified by Frederika Macdonald",DENT,2s.,,"Rousseau (Jean Jacques)--The Humane Philo- sophy: Maxims and Principles, selected and classified by Frederika Macdonald. 121110. 64 X4, pp. 296, 25. net ..DENT, Sep.08",Jean Jacques Rousseau,['Rousseau (Jean Jacques)'],,Sep.08,1908,net
"Rousseau (Jean Jacques)--Morals. 12m0., PP. 286, is, net (Sisley Books). ... SISLEY, Mar. 08",Rousseau,Jean Jacques,Morals,SISLEY,,,"Rousseau (Jean Jacques)--Morals. 12m0., PP. 286, is, net (Sisley Books). ... SISLEY, Mar. 08",Jean Jacques Rousseau,['Rousseau (Jean Jacques)'],,Mar. 08,1908,
"Royal Society of Victoria-Proceedings. New ser. Vol. 21, Pt. I. swd, ios. 6d. WILLIAMS & N., Dec, 08",,,Royal Society of Victoria-Proceedings,WILLIAMS & N.,6d.,,"Royal Society of Victoria-Proceedings. New ser. Vol. 21, Pt. I. swd, ios. 6d. WILLIAMS & N., Dec, 08",,,,"Dec, 08",1908,
"Roye (J.)-Astrology, the Key to Roulette. 16ino, 58. net .NICHOLS, Mar. 08",Roye,J.,"Astrology, the Key to Roulette",NICHOLS,,,"Roye (J.)-Astrology, the Key to Roulette. 16ino, 58. net .NICHOLS, Mar. 08",J. Roye,['Roye (J.)'],,Mar. 08,1908,
