entry,last_name,first_name,title,publisher,price,format,original_entry,author_name,creators,is_editor,date,catalogue_year,is_net
"Bills-Small dwellings acquisition, id. ; County and Borough Councils (qualification), id.; Work. men's compensation (amendment, No. 2), 14d.; Pedlars (amend.), id.; Electric lighting, id.; Stony Stratford charities, id.; Baptist chapels charities, Ild.; Burnham-on-Crouch Chapel charity, ijd.; Holligrave charity, {d.; Milk and dairies (Scotland) as amended, 2}d. ; National Insurance (Pt. 2, amend.) 2d. WYMAN, July 14",,,"Bills-Small dwellings acquisition, id. ; County and Borough Councils (qualification), id.; Work",WYMAN,2d.,,"Bills-Small dwellings acquisition, id. ; County and Borough Councils (qualification), id.; Work. men's compensation (amendment, No. 2), 14d.; Pedlars (amend.), id.; Electric lighting, id.; Stony Stratford charities, id.; Baptist chapels charities, Ild.; Burnham-on-Crouch Chapel charity, ijd.; Holligrave charity, {d.; Milk and dairies (Scotland) as amended, 2}d. ; National Insurance (Pt. 2, amend.) 2d. WYMAN, July 14",,,,July 14,1914,
"Bills—Police, įd.; Labourers (Ireland), įd.; Wine privileges, įd.; London street traffic, I d.; Govt. of Ireland (amend.), id.; Police (weekly rest-day, Scot.), }d.; Bankruptcy, 11jd. ; Deeds arrangement, 2d.; Sheriff Courts Appeal Court, id.; Rural credit banks, idd.; Finance (amend.), 2d.; Town charities (extension), id.; Health resorts and watering places, id.; Criminal justice ad- ministration, 4d.; Asylums officers' super- annuation, id. ; Places of worship (enfran- chisement), id. WYMAN, July 14",,,"Bills—Police, įd",WYMAN,,,"Bills—Police, įd.; Labourers (Ireland), įd.; Wine privileges, įd.; London street traffic, I d.; Govt. of Ireland (amend.), id.; Police (weekly rest-day, Scot.), }d.; Bankruptcy, 11jd. ; Deeds arrangement, 2d.; Sheriff Courts Appeal Court, id.; Rural credit banks, idd.; Finance (amend.), 2d.; Town charities (extension), id.; Health resorts and watering places, id.; Criminal justice ad- ministration, 4d.; Asylums officers' super- annuation, id. ; Places of worship (enfran- chisement), id. WYMAN, July 14",,,,July 14,1914,
"Bills-Indictments, 21d.;. British nationality and status of aliens, Jd.; Coal mines, }d.; Aliens restriction, fd.; Prize courts (procedure), d.; Real property and conveyancing, is. rod. ; Currency and Bank notes, id.; Injuries in war (compensation), £d.; Army_(supply of food, &c.), }d.; Defence of the Realm, fd.; Un- reasonable withholding of foodstuffs, įd. WYMAN, Aug. 14",,,Bills-Indictments,WYMAN,,,"Bills-Indictments, 21d.;. British nationality and status of aliens, Jd.; Coal mines, }d.; Aliens restriction, fd.; Prize courts (procedure), d.; Real property and conveyancing, is. rod. ; Currency and Bank notes, id.; Injuries in war (compensation), £d.; Army_(supply of food, &c.), }d.; Defence of the Realm, fd.; Un- reasonable withholding of foodstuffs, įd. WYMAN, Aug. 14",,,,Aug. 14,1914,
"Bird life. Illustrations from photographs by Charles Reid, Wishaw. 16io. bds. is. net FOULIS, Nov. 14",,,Bird life,FOULIS,,,"Bird life. Illustrations from photographs by Charles Reid, Wishaw. 16io. bds. is. net FOULIS, Nov. 14",,,,Nov. 14,1914,
"Births, deaths and marriages (England and Wales) ---General abstract for 1913. id. WYMAN, Mar. 14",,,"Births, deaths and marriages (England and Wales) ---General abstract for",WYMAN,,,"Births, deaths and marriages (England and Wales) ---General abstract for 1913. id. WYMAN, Mar. 14",,,,Mar. 14,1914,
"Births, deaths and marriages (England and Wales)-75th report, 1912. 5s. 9d. WYMAN, June 14",,,"Births, deaths and marriages (England and Wales)",WYMAN,5s. 9d.,,"Births, deaths and marriages (England and Wales)-75th report, 1912. 55. 9d. WYMAN, June 14",,,,June 14,1914,
"Births, deaths and marriages (Ireland)- 50th detailed annual report of the Registrar- General for Ireland, for 1913. s. uid. WYMAN, Aug. 14",,,"Births, deaths and marriages (Ireland)-",WYMAN,,,"Births, deaths and marriages (Ireland)- 50th detailed annual report of the Registrar- General for Ireland, for 1913. IS. uid. WYMAN, Aug. 14",,,,Aug. 14,1914,
"Births, deaths and marriages (Scotland)-57th annual report of the Registrar-General for 1911. W'YMAN, Apr. 14",,,"Births, deaths and marriages (Scotland)",W'YMAN,,,"Births, deaths and marriages (Scotland)-57th annual report of the Registrar-General for 1911. W'YMAN, Apr. 14",,,,Apr. 14,1914,
"Bishop among his flock, Talbot (E., Bp.) 5s, net Bishop of London's calendar (The), 191s. SIMPKIN, July 14",,,"Bishop among his flock, Talbot (E., Bp",SIMPKIN,191s.,,"Bishop among his flock, Talbot (E., Bp.) 5s, net Bishop of London's calendar (The), 1915. SIMPKIN, July 14",,,,July 14,1914,
"Bisschop (E. V.)-Flemish-English and English dictionary, with conversations and idioms. 5* x2, is. net. (Hill's vest pocket dictionaries) L. B. HILL, Dec. 14",Bisschop,E. V.,"Flemish-English and English dictionary, with conversations and idioms",L. B. HILL,,,"Bisschop (E. V.)-Flemish-English and English dictionary, with conversations and idioms. 5* x2, is. net. (Hill's vest pocket dictionaries) L. B. HILL, Dec. 14",E. V. Bisschop,['Bisschop (E. V.)'],,Dec. 14,1914,
"Bisschop (E. V.)-Shops and shopping phrase book in English, French and Flemish. 6d. net. L. B. HILL, Dec. 14",Bisschop,E. V.,"Shops and shopping phrase book in English, French and Flemish",L. B. HILL,6d.,,"Bisschop (E. V.)-Shops and shopping phrase book in English, French and Flemish. 6d. net. L. B. HILL, Dec. 14",E. V. Bisschop,['Bisschop (E. V.)'],,Dec. 14,1914,net
"Black water fever in the Tropical African Depen- dencies: reports for 1912. Maps and diag. WYMAN, Feb. 14",,,Black water fever in the Tropical African Depen- dencies: reports for,WYMAN,,,"Black water fever in the Tropical African Depen- dencies: reports for 1912. Maps and diag. WYMAN, Feb. 14",,,,Feb. 14,1914,
"Blatchford (Robert)-Germany and England. New and rev. edit., reprinted from The Daily Mail.” Svo., swd., id. AMALGAMATED PRESS, Sept. 14",Blatchford,Robert,Germany and England,AMALGAMATED PRESS,,,"Blatchford (Robert)-Germany and England. New and rev. edit., reprinted from The Daily Mail.” Svo., swd., id. AMALGAMATED PRESS, Sept. 14",Robert Blatchford,['Blatchford (Robert)'],,Sept. 14,1914,
"Blatchford (Robert)-My life in the army. 7d. net . CLARION PRESS, Aug. 14",Blatchford,Robert,My life in the army,CLARION PRESS,7d.,,"Blatchford (Robert)-My life in the army. 7d. net . CLARION PRESS, Aug. 14",Robert Blatchford,['Blatchford (Robert)'],,Aug. 14,1914,net
"Boller explosions : Board of Trade reports on enquiries. Various prices (usually from 2d. to 6d.). . WYMAN, Jan., &c., 14",,,Boller explosions : Board of Trade reports on enquiries,WYMAN,,,"Boller explosions : Board of Trade reports on enquiries. Various prices (usually from 2d. to 6d.). . WYMAN, Jan., &c., 14",,,,"Jan., &c., 14",1914,
"Boiler explosions—Report on the working of the boiler explosion Acts during the year ended 30th June, 1913, 2}d. .WYMAN, Sep. 14",,,Boiler explosions—Report on the working of the boiler explosion Acts during the year ended,WYMAN,,,"Boiler explosions—Report on the working of the boiler explosion Acts during the year ended 30th June, 1913, 2}d. .WYMAN, Sep. 14",,,,Sep. 14,1914,
"Booth (Edward C.)-The Cliff end. 121110., PP. 380, is, net (Wayfarer's litrary) DENT, July 14",Booth,Edward C.,The Cliff end,DENT,,,"Booth (Edward C.)-The Cliff end. 121110., PP. 380, is, net (Wayfarer's litrary) DENT, July 14",Edward C. Booth,['Booth (Edward C.)'],,July 14,1914,
"Boothby (Guy)-Long live the King. Izmo. 7d net .WARD, L., Nov. 14",Boothby,Guy,Long live the King,"WARD, L.",7d,,"Boothby (Guy)-Long live the King. Izmo. 7d net .WARD, L., Nov. 14",Guy Boothby,['Boothby (Guy)'],,Nov. 14,1914,net
"Boothby (Guy)—A Maker of nations. I 2010., 7d. net WARD, L., June 14",Boothby,Guy,A Maker of nations,"WARD, L.",7d.,,"Boothby (Guy)—A Maker of nations. I 2010., 7d. net WARD, L., June 14",Guy Boothby,['Boothby (Guy)'],,June 14,1914,net
"Boothby (Guy)-Pharos the Egyptian. Izmo. 7d. net WARD, L., Feb. 14",Boothby,Guy,Pharos the Egyptian,"WARD, L.",7d.,,"Boothby (Guy)-Pharos the Egyptian. Izmo. 7d. net WARD, L., Feb. 14",Guy Boothby,['Boothby (Guy)'],,Feb. 14,1914,net
"Borchardt (W. G.) and Perrott (A. D.)-A Junior trigonometry. With answers. Cr. Svo. 7X41 pp. 258, 35, 6d. BELL, Mar, 14",Borchardt,W. G.,A Junior trigonometry,BELL,6d.,,"Borchardt (W. G.) and Perrott (A. D.)-A Junior trigonometry. With answers. Cr. Svo. 7X41 pp. 258, 35, 6d. BELL, Mar, 14",W. G. Borchardt,"['Borchardt (W. G.)', 'Perrott (A. D.)']",,"Mar, 14",1914,
"Bosanquet (Dalmund)—The Dice of love. Cr. Evo. 71 X5, pp. 320, 6s. .... LONG, Nov. 14",Bosanquet,Dalmund,The Dice of love,LONG,6s.,,"Bosanquet (Dalmund)—The Dice of love. Cr. Evo. 71 X5, pp. 320, 6S. .... LONG, Nov. 14",Dalmund Bosanquet,['Bosanquet (Dalmund)'],,Nov. 14,1914,
"Bostock (Adelaide H. E. A.)-Guard our soldiers and our sailors : intercessory hymn, with music. id... ..SIMPKIN, Oct. 14",Bostock,Adelaide H. E. A.,"Guard our soldiers and our sailors : intercessory hymn, with music",SIMPKIN,,,"Bostock (Adelaide H. E. A.)-Guard our soldiers and our sailors : intercessory hymn, with music. id... ..SIMPKIN, Oct. 14",Adelaide H. E. A. Bostock,['Bostock (Adelaide H. E. A.)'],,Oct. 14,1914,
"Botanic Garden (Royal Edinburgh),-Notes, Dec. 1913: List of seeds collected during 1913. 9d.... WYMAN, Jan. 14",Botanic Garden,Royal Edinburgh,"Notes, Dec",WYMAN,9d.,,"Botanic Garden (Royal Edinburgh),-Notes, Dec. 1913: List of seeds collected during 1913. 9d.... WYMAN, Jan. 14",Royal Edinburgh Botanic Garden,['Botanic Garden (Royal Edinburgh)'],,Jan. 14,1914,
"Boulger (D. C.)-England's arch-enemy. Cr.8ve, 6s. net .... AUTHOR, Dec. 14",Boulger,D. C.,England's arch-enemy,AUTHOR,6s.,,"Boulger (D. C.)-England's arch-enemy. Cr.8ve, 6s. net .... AUTHOR, Dec. 14",D. C. Boulger,['Boulger (D. C.)'],,Dec. 14,1914,net
"Boulnois (H. Percy)-A Glossary of road terms. Cr. Svo., 7* *41, pp. 72, 2s. net ST. BRIDE'S PRESS, June 14",Boulnois,H. Percy,A Glossary of road terms,ST. BRIDE'S PRESS,2s.,,"Boulnois (H. Percy)-A Glossary of road terms. Cr. Svo., 7* *41, pp. 72, 25. net ST. BRIDE'S PRESS, June 14",H. Percy Boulnois,['Boulnois (H. Percy)'],,June 14,1914,net
"Bowen (Louise de K.)-Safeguards for city youth at work and at play. Cr. 8v0., 6s. 6d. net MACMILLAN, Dec. 14",Bowen,Louise de K.,Safeguards for city youth at work and at play,MACMILLAN,6s. 6d.,,"Bowen (Louise de K.)-Safeguards for city youth at work and at play. Cr. 8v0., 65. 6d. net MACMILLAN, Dec. 14",Louise de K. Bowen,['Bowen (Louise de K.)'],,Dec. 14,1914,net
"Bowen (Marjorie) - Prince and heretic. Cr. 810 71 X5, pp. 382, 68. VETHUEN, Oct. 14",Bowen,Marjorie,Prince and heretic,VETHUEN,,,"Bowen (Marjorie) - Prince and heretic. Cr. 810 71 X5, pp. 382, 68. VETHUEN, Oct. 14",Marjorie Bowen,['Bowen (Marjorie)'],,Oct. 14,1914,
"Bowman (F. H.) see Bradiey (F. E.) and Bowman Bowser (Thekla)—The Whole art of bandaging. 12m0., pp. 120, limp, is. net .. BALE, Nov. 14",Bowman,F. H.,,BALE,,,"Bowman (F. H.) see Bradiey (F. E.) and Bowman Bowser (Thekla)—The Whole art of bandaging. 12m0., pp. 120, limp, is. net .. BALE, Nov. 14",F. H. Bowman,['Bowman (F. H.)'],,Nov. 14,1914,
"Box (G. H.) ed.-II. Kings. Revised version, edit. for the use of schools. izmo., pp. 176, 1s. 60 net CAMB. UNIV. PRESS, Mar. 14",Box,G. H.,II,CAMB. UNIV. PRESS,,,"Box (G. H.) ed.-II. Kings. Revised version, edit. for the use of schools. izmo., pp. 176, Is. 60 net CAMB. UNIV. PRESS, Mar. 14",G. H. Box,['Box (G. H.)'],ed.,Mar. 14,1914,
"Boyd (A. K. 11.)-A. K. HI. B.: a volume of selec- iions. Edit. by his Son. 12010., pp. 478, is. net .NELSON, Feb. 14",Boyd,A. K. 11.,A. K. HI,NELSON,,,"Boyd (A. K. 11.)-A. K. HI. B.: a volume of selec- iions. Edit. by his Son. 12010., pp. 478, is. net .NELSON, Feb. 14",A. K. 11. Boyd,['Boyd (A. K. 11.)'],,Feb. 14,1914,
"Boy's Own annual (The), 1914. Folio, 8s. R. T. S., Sep. 14",,,Boy's Own annual (The),R. T. S.,8s.,,"Boy's Own annual (The), 1914. Folio, 8s. R. T. S., Sep. 14",,,,Sep. 14,1914,
"Bramah (Ernest)-Max Carrados. Cr. 73 X5, pp. 302, 6s... ..METHUEN, Jan. 14",Bramah,Ernest,Max Carrados,METHUEN,6s.,,"Bramah (Ernest)-Max Carrados. Cr. 73 X5, pp. 302, 6s... ..METHUEN, Jan. 14",Ernest Bramah,['Bramah (Ernest)'],,Jan. 14,1914,
"Branscombe (H. A.) see Coles (V. S. S.) angi Bransombe. Brash (W. B.)-Peace in time of war. Izmo., pp. 72, swd. 6d. net .C. H. KELLY, Dec. 14",Branscombe,H. A.,Peace in time of war,C. H. KELLY,6d.,,"Branscombe (H. A.) see Coles (V. S. S.) angi Bransombe. Brash (W. B.)-Peace in time of war. Izmo., pp. 72, swd. 6d. net .C. H. KELLY, Dec. 14",H. A. Branscombe,"['Branscombe (H. A.)', 'Brash (W. B.)']",,Dec. 14,1914,net
"Bretton (Percival)— Pigeons for profit. Cr. Svo., pp. 126, bds., is. net (Smallholder library) PEARSON, May 14",Bretton,Percival,Pigeons for profit,PEARSON,,,"Bretton (Percival)— Pigeons for profit. Cr. Svo., pp. 126, bds., is. net (Smallholder library) PEARSON, May 14",Percival Bretton,['Bretton (Percival)'],,May 14,1914,
"Brewers' licences-Accounts relating to brewers, victuallers, &c., in the several collections of the U.K., year ended 30th Sep., 1913, 2}d. W'YMAN, A pr. 14",,,"Brewers' licences-Accounts relating to brewers, victuallers, &c",W'YMAN,,,"Brewers' licences-Accounts relating to brewers, victuallers, &c., in the several collections of the U.K., year ended 30th Sep., 1913, 2}d. W'YMAN, A pr. 14",,,,A pr. 14,1914,
"Brierley (J.)-Faith's certainties. Cr. OVU 74 x 5, pp. 288, 3s. 6d. net J. CLARKE, Oct. 14",Brierley,J.,Faith's certainties,J. CLARKE,3s. 6d.,,"Brierley (J.)-Faith's certainties. Cr. OVU 74 x 5, pp. 288, 35. 6d. net J. CLARKE, Oct. 14",J. Brierley,['Brierley (J.)'],,Oct. 14,1914,net
"Brieux (Eugène) ---Damaged goods : a play: Trans. by John Pollock; with prer. by Bernard Shaw. Cr. Svo., swd., is, net FIFIELD, Apr. 14",Brieux,Eugène,Damaged goods : a play: Trans,FIFIELD,,,"Brieux (Eugène) ---Damaged goods : a play: Trans. by John Pollock; with prer. by Bernard Shaw. Cr. Svo., swd., is, net FIFIELD, Apr. 14",Eugène Brieux,['Brieux (Eugène)'],,Apr. 14,1914,
"Brighter side mottoes. On cards, 7XII, 6s. net L. B. HILL, Sep. 14",,,Brighter side mottoes,L. B. HILL,6s.,,"Brighter side mottoes. On cards, 7XII, 6s. net L. B. HILL, Sep. 14",,,,Sep. 14,1914,net
"British girls' annual (The; -Ryl. 810. 9) X7, PP. 5s. CASSELL, Oct. 14",,,British girls' annual (The; ,CASSELL,5s.,,"British girls' annual (The; -Ryl. 810. 9) X7, PP. 55. CASSELL, Oct. 14",,,,Oct. 14,1914,
"British Museum-Accounts for 1913-14, number of persons admitted to visit the Museum and the British Museum (Natural History) in each year from 1908 to 1913, and statement of progress made and objects added in 1913. 1s. WYMAN, Aug. 14",,,British Museum-Accounts for,WYMAN,1s.,,"British Museum-Accounts for 1913-14, number of persons admitted to visit the Museum and the British Museum (Natural History) in each year from 1908 to 1913, and statement of progress made and objects added in 1913. Is. WYMAN, Aug. 14",,,,Aug. 14,1914,
"British Museum– The Buildings of the British Museum : illustrated from prints and drawings prepared by order of the Trustees on the occasion of the opening of King Edward the Seventh's Galleries, May 1914. Folio, 19 X141, pp. 16 and 25 plates, 40s. net MILFORD, May 14",,,"British Museum– The Buildings of the British Museum : illustrated from prints and drawings prepared by order of the Trustees on the occasion of the opening of King Edward the Seventh's Galleries, May",MILFORD,40s.,,"British Museum– The Buildings of the British Museum : illustrated from prints and drawings prepared by order of the Trustees on the occasion of the opening of King Edward the Seventh's Galleries, May 1914. Folio, 19 X141, pp. 16 and 25 plates, 40s. net MILFORD, May 14",,,,May 14,1914,net
"British Museum-Cuneiform texts from Baby- lonian tablets, &c. Part 24. Folio, 7s. 6d. net MILFORD, Aug. 14",,,"British Museum-Cuneiform texts from Baby- lonian tablets, &c",MILFORD,7s. 6d.,,"British Museum-Cuneiform texts from Baby- lonian tablets, &c. Part 24. Folio, 7s. 6d. net MILFORD, Aug. 14",,,,Aug. 14,1914,net
"British Army, 52 stories of, Miles (A. H.) 3s. 6d. British Army war-song album. Folio swd. 6d. net NEWNES, Ar!g. 14",,,British Army,NEWNES,6d.,,"British Army, 52 stories of, Miles (A. H.) 35. 6d. British Army war-song album. Folio swd. 6d. net NEWNES, Ar!g. 14",,,,Ar!g. 14,1914,net
"British Museum-Hieroglyphic texts from Egyptian stelæ, &c. Part 5. Folio, pp. 16 and 50 plates, 7s.6d. net .... MILFORD, June 14",,,"British Museum-Hieroglyphic texts from Egyptian stelæ, &c",MILFORD,7s.6d.,,"British Museum-Hieroglyphic texts from Egyptian stelæ, &c. Part 5. Folio, pp. 16 and 50 plates, 7s.6d. net .... MILFORD, June 14",,,,June 14,1914,net
"British Red Cross anatomical diagrams: six linen charts. 5 ft. X3 ft. ea. 7s. 6d. net, sets 30s. net MILFORD, June 14",,,British Red Cross anatomical diagrams: six linen charts,MILFORD,30s.,,"British Red Cross anatomical diagrams: six linen charts. 5 ft. X3 ft. ea. 75. 6d. net, sets 30s. net MILFORD, June 14",,,,June 14,1914,net
"British standard method of specifying resistance of steel conductor rails. (Engineering Standards Committee.) Folio, swd. Ios. 6d. net C. LOCKWOOD, Aug. 14",,,British standard method of specifying resistance of steel conductor rails,C. LOCKWOOD,6d.,,"British standard method of specifying resistance of steel conductor rails. (Engineering Standards Committee.) Folio, swd. Ios. 6d. net C. LOCKWOOD, Aug. 14",,,,Aug. 14,1914,net
"British standard specification for copper-alloy three-piece unions for low and medium pressure, &c. Folio swd. 58. net. (Engineering Standards Committee) C. LOCKWOOD, Aug. 14",,,"British standard specification for copper-alloy three-piece unions for low and medium pressure, &c",C. LOCKWOOD,,,"British standard specification for copper-alloy three-piece unions for low and medium pressure, &c. Folio swd. 58. net. (Engineering Standards Committee) C. LOCKWOOD, Aug. 14",,,,Aug. 14,1914,
"British standard specification for salt-glazed ware pipes. Folio, swd. 58. net. (Engineering Stan- dards Committee) .....C. LOCKWOOD, Aug. 14",,,British standard specification for salt-glazed ware pipes,C. LOCKWOOD,,,"British standard specification for salt-glazed ware pipes. Folio, swd. 58. net. (Engineering Stan- dards Committee) .....C. LOCKWOOD, Aug. 14",,,,Aug. 14,1914,
"British standard specification for two- and three- plate oiling roses. Folio, swd. 5s. net. (Engineer- ing Standards Committee) C. LOCKWOOD, Aug. 14",,,British standard specification for two- and three- plate oiling roses,C. LOCKWOOD,,,"British standard specification for two- and three- plate oiling roses. Folio, swd. 55. net. (Engineer- ing Standards Committee) C. LOCKWOOD, Aug. 14",,,,Aug. 14,1914,
"Brooks (Geoffrey)—The Mechanical engineers' price book. 2nd edit. 12o., pp. 192, 4s, net SPON, Sep. 14",Brooks,Geoffrey,The Mechanical engineers' price book,SPON,4s.,,"Brooks (Geoffrey)—The Mechanical engineers' price book. 2nd edit. 12o., pp. 192, 4s, net SPON, Sep. 14",Geoffrey Brooks,['Brooks (Geoffrey)'],,Sep. 14,1914,net
"Browne (Gordon)—Dr. Jollyboy's A B C. s. 6d. net Browne (G. W.) How to teach signalling, 16:no. swd. 6d. net FULLER, HART, Jury 14",Browne,Gordon,Dr,"FULLER, HART",6d.,,"Browne (Gordon)—Dr. Jollyboy's A B C. IS. 6d. net Browne (G. W.) How to teach signalling, 16:no. swd. 6d. net FULLER, HART, Jury 14",Gordon Browne,['Browne (Gordon)'],,Jury 14,1914,net
"Budge (E. A.Walis) see also under British Museum. Budget-Statement of revenue and expenditure as laid before the House by the Chancellor of the Exchequer when opening the Budget, id. ; Statement showing effect of proposed changes, id. WYMAN, May 14",Budge,E. A.Walis,,WYMAN,,,"Budge (E. A.Walis) see also under British Museum. Budget-Statement of revenue and expenditure as laid before the House by the Chancellor of the Exchequer when opening the Budget, id. ; Statement showing effect of proposed changes, id. WYMAN, May 14",E. A.Walis Budge,['Budge (E. A.Walis)'],,May 14,1914,
"Building societies--18th annual report of proceed. ings of Registrars under the Building Societies Acts; with Abstract of Annual Accounts and Statements of Societies. For 1912. Part I, Report, 3d. ; Part 2, Abstract of accounts, s, 2d. WYMAN, Mar. 14",,,Building societies-,WYMAN,2d.,,"Building societies--18th annual report of proceed. ings of Registrars under the Building Societies Acts; with Abstract of Annual Accounts and Statements of Societies. For 1912. Part I, Report, 3d. ; Part 2, Abstract of accounts, IS, 2d. WYMAN, Mar. 14",,,,Mar. 14,1914,
"Burghs (Areas and Rates) (Scotland)-Return showing for 1911-12 with respect to each Royal, Parliamentary, and Police burgh in Scotland, the area of the burgh and of the agricultural lands, etc., and the total amount of Rates collected, id. .... WYMAN, Apr. 14",Burghs,Areas,Scotland)-Return showing for,WYMAN,,,"Burghs (Areas and Rates) (Scotland)-Return showing for 1911-12 with respect to each Royal, Parliamentary, and Police burgh in Scotland, the area of the burgh and of the agricultural lands, etc., and the total amount of Rates collected, id. .... WYMAN, Apr. 14",Areas Burghs,"['Burghs (Areas)', 'Burghs (Rates)']",,Apr. 14,1914,
"Byron (May) ed.—The Golden garden of the poets : lyrics of love and friendship. Illus, Svo. 81x57, pp. 360, 6s. net .. HODDER & S., Nov. 14",Byron,May,The Golden garden of the poets : lyrics of love and friendship,HODDER & S.,6s.,,"Byron (May) ed.—The Golden garden of the poets : lyrics of love and friendship. Illus, Svo. 81x57, pp. 360, 6s. net .. HODDER & S., Nov. 14",May Byron,['Byron (May)'],ed.,Nov. 14,1914,net
"Byron (Lord)—Childe Harold. Edit. by H. F. Toyer. Reduced to us. 6d. ; Cantos 1-2, red. to s. 8d. ; Cantos 3-4, red. to is. 8d. MILFORD, May 14",Byron,Lord,Childe Harold,MILFORD,8d.,,"Byron (Lord)—Childe Harold. Edit. by H. F. Toyer. Reduced to us. 6d. ; Cantos 1-2, red. to IS. 8d. ; Cantos 3-4, red. to is. 8d. MILFORD, May 14",Lord Byron,['Byron (Lord)'],,May 14,1914,
"Caine (William) — The Revolt at Roskelly's. Cheaper edit. Cr. Svo. 74 X 5, pp. 316, 2s. net GREENING, May 14",Caine,William,The Revolt at Roskelly's,GREENING,2s.,,"Caine (William) — The Revolt at Roskelly's. Cheaper edit. Cr. Svo. 74 X 5, pp. 316, 25. net GREENING, May 14",William Caine,['Caine (William)'],,May 14,1914,net
"Caledonian Canal—109th report for 1913-14, 2d. WYMAN, July 14",,,Caledonian Canal,WYMAN,2d.,,"Caledonian Canal—109th report for 1913-14, 2d. WYMAN, July 14",,,,July 14,1914,
"Cambridge University--Prolusiones Academicæ ; or, Exercises which having obtained a prize in the Univ. of Cambridge were recited in the Senate House on 5th June, 1914. Cr. Svo., PP. 32, swd, is. ......CAMB. UNIV. PRESS, June 14",,,"Cambridge University--Prolusiones Academicæ ; or, Exercises which having obtained a prize in the Univ",CAMB. UNIV. PRESS,,,"Cambridge University--Prolusiones Academicæ ; or, Exercises which having obtained a prize in the Univ. of Cambridge were recited in the Senate House on 5th June, 1914. Cr. Svo., PP. 32, swd, is. ......CAMB. UNIV. PRESS, June 14",,,,June 14,1914,
"Canada, Schoolboy in, FitzGerald (C.) 78. 6d. net Canada to-day, 1914. Illus. Folio swd. 1s. net CANADA, Sep. 14",,,"Canada, Schoolboy in, FitzGerald (C.)",CANADA,1s.,,"Canada, Schoolboy in, FitzGerald (C.) 78. 6d. net Canada to-day, 1914. Illus. Folio swd. Is. net CANADA, Sep. 14",,,,Sep. 14,1914,net
"the Local Government Board's Report for Capital and labour, Relations of, Layton (W. T.) s. net. . WYMAN, Jan. 14",,,"Local Government Board's Report for Capital and labour, Relations of, Layton (W. T.) s",WYMAN,,,"the Local Government Board's Report for Capital and labour, Relations of, Layton (W. T.) IS. net. . WYMAN, Jan. 14",,,,Jan. 14,1914,
"M. SECKER, Feb. 14",,,,M. SECKER,,,"M. SECKER, Feb. 14",,,,Feb. 14,1914,
"(Art and craft of letters)....M. SECKER, May 14",,,Art and craft of letters),M. SECKER,,,"(Art and craft of letters)....M. SECKER, May 14",,,,May 14,1914,
"7! X4, pp. 298, 3s. 6d. net P. S. KING, Jan. 14",,,"7! X4, pp",P. S. KING,3s. 6d.,,"7! X4, pp. 298, 35. 6d. net P. S. KING, Jan. 14",,,,Jan. 14,1914,net
"12mo., pp. 168 s. net (Cambridge manuals of science and Care committee : child and parent, Pepler (D.) literature) CAMB. UNIV. PRESS, J une 14",,,,CAMB. UNIV. PRESS,,,"12mo., pp. 168 IS. net (Cambridge manuals of science and Care committee : child and parent, Pepler (D.) literature) CAMB. UNIV. PRESS, J une 14",,,,J une 14,1914,
"EVERETT, Jan. 14",,,,EVERETT,,,"EVERETT, Jan. 14",,,,Jan. 14,1914,
"Carpenter (Rhys) ---The Sun-thief and other poems. Cr. Svo), PP. 158, 5s. net MII.FORD, July 14",Carpenter,Rhys,The Sun-thief and other poems,MII.FORD,5s.,,"Carpenter (Rhys) ---The Sun-thief and other poems. Cr. Svo), PP. 158, 5s. net MII.FORD, July 14",Rhys Carpenter,['Carpenter (Rhys)'],,July 14,1914,net
"Carr (H. Wilson)— The Ph'losophy of change : a study of the fundamental principle of the philo- sophy of Bergson. Svo. 9 x5, pp. 228, 6s. net MACMILLAN, Oct. 14",Carr,H. Wilson,The Ph'losophy of change : a study of the fundamental principle of the philo- sophy of Bergson,MACMILLAN,6s.,,"Carr (H. Wilson)— The Ph'losophy of change : a study of the fundamental principle of the philo- sophy of Bergson. Svo. 9 x5, pp. 228, 6s. net MACMILLAN, Oct. 14",H. Wilson Carr,['Carr (H. Wilson)'],,Oct. 14,1914,net
"Carroll (Lewis) -Alice's adventures in Wonderland Illus. by Alice B. Woodward. Cr. Svo. 74 x 5 pp. 170, 2s. 6d. net. (Queen's treasures ser.) BELL, Oct. 14",Carroll,Lewis,Alice's adventures in Wonderland,BELL,,,"Carroll (Lewis) -Alice's adventures in Wonderland Illus. by Alice B. Woodward. Cr. Svo. 74 x 5 pp. 170, 25. 6d. net. (Queen's treasures ser.) BELL, Oct. 14",Lewis Carroll,['Carroll (Lewis)'],,Oct. 14,1914,
