entry,last_name,first_name,title,publisher,price,format,original_entry,author_name,creators,is_editor,date,catalogue_year,is_net
"Mental deficiency-Provisional regulations, under Section 30 (ii) of the Mental Deficiency Act, 1913, £d.; Ditto, under Section 30 (iii), įd. ; Provisional Rules, under Section 29 of the Summary Jurisdiction Act, 1879, and Section 44 (5) of the Mental Deficiency Act, 1913, d. WYMAN, Mar. 14",,,"Mental deficiency-Provisional regulations, under Section",WYMAN,,,"Mental deficiency-Provisional regulations, under Section 30 (ii) of the Mental Deficiency Act, 1913, £d.; Ditto, under Section 30 (iii), įd. ; Provisional Rules, under Section 29 of the Summary Jurisdiction Act, 1879, and Section 44 (5) of the Mental Deficiency Act, 1913, d. WYMAN, Mar. 14",,,,Mar. 14,1914,
"Mental Deficiency Act, 1913—Provisional regula- tions, 310. WYMAX, Apr. 14",,,Mental Deficiency Act,WYMAX,,,"Mental Deficiency Act, 1913—Provisional regula- tions, 310. WYMAX, Apr. 14",,,,Apr. 14,1914,
"Mercantile marine-Return showing legal obliga- tions of owners of merchant vessels of certain foreign countries towards their captains, officers and scamen, &c. 9. ....WYMAN, Mar, 14",,,"Mercantile marine-Return showing legal obliga- tions of owners of merchant vessels of certain foreign countries towards their captains, officers and scamen, &c",WYMAN,,,"Mercantile marine-Return showing legal obliga- tions of owners of merchant vessels of certain foreign countries towards their captains, officers and scamen, &c. 9. ....WYMAN, Mar, 14",,,,"Mar, 14",1914,
"Metcalfe (William C.)-Nailing the colours; or, The Light that shines. Cr. Svo. 7* *4*, pp. 360, 28. 61. . . JARROLD, Oct. 14",Metcalfe,William C.,"Nailing the colours; or, The Light that shines",JARROLD,,,"Metcalfe (William C.)-Nailing the colours; or, The Light that shines. Cr. Svo. 7* *4*, pp. 360, 28. 61. . . JARROLD, Oct. 14",William C. Metcalfe,['Metcalfe (William C.)'],,Oct. 14,1914,
"Meteor flag (The): the story of the Union Jack. 12ino., swd., id. .E. MACDONALD, Oct. 14",,,Meteor flag (The): the story of the Union Jack,E. MACDONALD,,,"Meteor flag (The): the story of the Union Jack. 12ino., swd., id. .E. MACDONALD, Oct. 14",,,,Oct. 14,1914,
"Meteorological Committee-9th annual report, 1913-14. 4d. WYMAN, Aug. 14",,,Meteorological Committee,WYMAN,4d.,,"Meteorological Committee-9th annual report, 1913-14. 4d. WYMAN, Aug. 14",,,,Aug. 14,1914,
"Meteorological Ofice-Charts (Monthly) : Indian Ocean from 15 deg. North Lat. to 35 deg. South lat., ea. 6d. ; North Atlantic and Mediterranean, ea. 6d. (annual sub., ea. 5s.) J. D. POTTER, Feb. 14",Meteorological Ofice-Charts,Monthly,Indian Ocean from,J. D. POTTER,6d.,,"Meteorological Ofice-Charts (Monthly) : Indian Ocean from 15 deg. North Lat. to 35 deg. South lat., ea. 6d. ; North Atlantic and Mediterranean, ea. 6d. (annual sub., ea. 5s.) J. D. POTTER, Feb. 14",Monthly Meteorological Ofice-Charts,['Meteorological Ofice-Charts (Monthly)'],,Feb. 14,1914,
"Meteorological Office - Seaman's handbook 01 meteorolgy: a companion to the “ Barometer manual. WYMAN, Apr. 14",,,Meteorological Office - Seaman's handbook,WYMAN,,,"Meteorological Office - Seaman's handbook 01 meteorolgy: a companion to the “ Barometer manual. WYMAN, Apr. 14",,,,Apr. 14,1914,
"Meteorological Office-Weather reports (Weekly) ea. 6d. . WYMAN, Jan., &c. 14",Meteorological Office-Weather reports,Weekly,6d,WYMAN,6d.,,"Meteorological Office-Weather reports (Weekly) ea. 6d. . WYMAN, Jan., &c. 14",Weekly Meteorological Office-Weather reports,['Meteorological Office-Weather reports (Weekly)'],,"Jan., &c. 14",1914,
"Methodist Conference-Minutes of several con- versations at the 171st yearly conference of the people called Methodists, begun in Leeds on Wednesday, July 15, 1914. Cr. 8v0., 2s. net METHODIST BOOK ROOM, Aug. 14",,,Methodist Conference-Minutes of several con- versations at the,METHODIST BOOK ROOM,2s.,,"Methodist Conference-Minutes of several con- versations at the 171st yearly conference of the people called Methodists, begun in Leeds on Wednesday, July 15, 1914. Cr. 8v0., 25. net METHODIST BOOK ROOM, Aug. 14",,,,Aug. 14,1914,net
"TUTCHINSON, Oct. 14",,,,TUTCHINSON,,,"TUTCHINSON, Oct. 14",,,,Oct. 14,1914,
"Milan (René)—The Undying race. Cr. Evo. 74X41, pp. 340, 6s.........S. PAUL, Nov, 14",Milan,René,The Undying race,S. PAUL,6s.,,"Milan (René)—The Undying race. Cr. Evo. 74X41, pp. 340, 65.........S. PAUL, Nov, 14",René Milan,['Milan (René)'],,"Nov, 14",1914,
"Mines and quarries-General report with statistics, for 1911. Pt. 4, Colonial and foreign statistics. (Persons employed, output, and accidents) 8d... .WYMAN, Jan. 14",,,"Mines and quarries-General report with statistics, for",WYMAN,8d.,,"Mines and quarries-General report with statistics, for 1911. Pt. 4, Colonial and foreign statistics. (Persons employed, output, and accidents) 8d... .WYMAN, Jan. 14",,,,Jan. 14,1914,
"Mines and quarries-General report with statistics, for 1912. Part 3, Output. 1s. 5d. WYMAN, Jan. 14",,,"Mines and quarries-General report with statistics, for",WYMAN,1s. 5d.,,"Mines and quarries-General report with statistics, for 1912. Part 3, Output. Is. 5d. WYMAN, Jan. 14",,,,Jan. 14,1914,
"Mines and quarries—General report with statistics for 1913. Part 1. Divisional statistics. (With Map) 70. . WYMAN, J 119€ 14",,,Mines and quarries—General report with statistics for,WYMAN,,,"Mines and quarries—General report with statistics for 1913. Part 1. Divisional statistics. (With Map) 70. . WYMAN, J 119€ 14",,,,J 119€ 14,1914,
"Mines and quarries—Reports of Inspectors of Mines for 1913. Northern Division (No. 2), 8d.; Yorkshire and North Midland Division (No. 31, s. 1 d.; South Wales Division (No. 5), 7d.; Midland and Southern Division (No. 6), 8ļd. WYMAN, July 14",,,Mines and quarries—Reports of Inspectors of Mines for,WYMAN,,,"Mines and quarries—Reports of Inspectors of Mines for 1913. Northern Division (No. 2), 8d.; Yorkshire and North Midland Division (No. 31, s. 1 d.; South Wales Division (No. 5), 7d.; Midland and Southern Division (No. 6), 8ļd. WYMAN, July 14",,,,July 14,1914,
"Mines and quarries-Reports of Inspectors of Mines for 1913. Scotland Division (No. 1) (with plans and illus.), 1s. 3d.; Manchester and Ireland District (No. 49), 4 d.; Liverpool and North Wales District (No. 4B) (with illus.), 6 d. WYMAN, June 14",,,Mines and quarries-Reports of Inspectors of Mines for,WYMAN,,,"Mines and quarries-Reports of Inspectors of Mines for 1913. Scotland Division (No. 1) (with plans and illus.), Is. 3d.; Manchester and Ireland District (No. 49), 4 d.; Liverpool and North Wales District (No. 4B) (with illus.), 6 d. WYMAN, June 14",,,,June 14,1914,
"Mines and quarries (Metalliferous)—Second report, is. 9d. ; Minutes of evidence, Vol. 2, 3s. 3d. ; ditto, Vol. 3, 2s. 7d. ...... WYMAN, July 14",,,"Second report, is",WYMAN,2s. 7d.,,"Mines and quarries (Metalliferous)—Second report, is. 9d. ; Minutes of evidence, Vol. 2, 3s. 3d. ; ditto, Vol. 3, 25. 7d. ...... WYMAN, July 14",,"['Mines', 'quarries (Metalliferous)']",,July 14,1914,
"Mines Committee (Explosions in)—6th report. r}d. WYMAN, Oct. 14",Mines Committee,Explosions in,,WYMAN,,,"Mines Committee (Explosions in)—6th report. r}d. WYMAN, Oct. 14",Explosions in Mines Committee,['Mines Committee (Explosions in)'],,Oct. 14,1914,
"Mines in the United Kingdom and the 1sle of Man, List of, 1913. 4s. WYMAN, Aug. 14",,,Mines in the United Kingdom and the,WYMAN,4s.,,"Mines in the United Kingdom and the Isle of Man, List of, 1913. 45. WYMAN, Aug. 14",,,,Aug. 14,1914,
"Minot (Laurence)-Poems. Edit., with intro. and notes, by Joseph Hall. 3rd edit. 12no. 64 X 4, pp. 180, 4s. 6d. CLARENDON PRESS, Nov. 14",Minot,Laurence,Poems,CLARENDON PRESS,4s. 6d.,,"Minot (Laurence)-Poems. Edit., with intro. and notes, by Joseph Hall. 3rd edit. 12no. 64 X 4, pp. 180, 4s. 6d. CLARENDON PRESS, Nov. 14",Laurence Minot,['Minot (Laurence)'],,Nov. 14,1914,
"Mint—44th annual report, 1913, illus., 1s. WYMAN, Oct. 14",,,Mint,WYMAN,1s.,,"Mint—44th annual report, 1913, illus., Is. WYMAN, Oct. 14",,,,Oct. 14,1914,
"Miracles of our Lord (The). Rev. by Bishop Challoner. Iamo., parchment is, net BURNS & OATES, Oct. 14",,,Miracles of our Lord (The),BURNS & OATES,,,"Miracles of our Lord (The). Rev. by Bishop Challoner. Iamo., parchment is, net BURNS & OATES, Oct. 14",,,,Oct. 14,1914,
"Montezuma's daughter, Haggard (Sir H. R.) 7d. net Montfaucon de Villars (N. de)--Comte de Gabalis. Newly rendered into English with mentary and annotations. Svo 9x5), pp. 376. 78. 6d. net ......W. RIDER, Oct. 14","Montezuma's daughter, Haggard",Sir H. R.,,W. RIDER,6d.,,"Montezuma's daughter, Haggard (Sir H. R.) 7d. net Montfaucon de Villars (N. de)--Comte de Gabalis. Newly rendered into English with mentary and annotations. Svo 9x5), pp. 376. 78. 6d. net ......W. RIDER, Oct. 14","Sir H. R. Montezuma's daughter, Haggard","[""Montezuma's daughter, Haggard (Sir H. R.)""]",,Oct. 14,1914,net
"Monuments (Ancient)-Report of Inspector for year ending March 31, 1913. Illus. 6s. WYMAN, Feb. 14",Monuments,Ancient,Report of Inspector for year ending March,WYMAN,6s.,,"Monuments (Ancient)-Report of Inspector for year ending March 31, 1913. Illus. 6s. WYMAN, Feb. 14",Ancient Monuments,['Monuments (Ancient)'],,Feb. 14,1914,
"Monuments (Ancient)-Reports showing the systems adopted in Hungary and France for the preservation of ancient monuments. 2d. WYMAN, Feb. 14",Monuments,Ancient,Reports showing the systems adopted in Hungary and France for the preservation of ancient monuments,WYMAN,2d.,,"Monuments (Ancient)-Reports showing the systems adopted in Hungary and France for the preservation of ancient monuments. 2d. WYMAN, Feb. 14",Ancient Monuments,['Monuments (Ancient)'],,Feb. 14,1914,
"Monuments and Constructions of Scotland (Royal Commission on Ancient and Historical) -Reports and inventories of constructions: 5, Galloway. Vol. 2, County of the Stewartry of Kirkcudbright, od. . . WYMAN, Mar, 14",,,"Monuments and Constructions of Scotland (Royal Commission on Ancient and Historical) -Reports and inventories of constructions: 5, Galloway",WYMAN,,,"Monuments and Constructions of Scotland (Royal Commission on Ancient and Historical) -Reports and inventories of constructions: 5, Galloway. Vol. 2, County of the Stewartry of Kirkcudbright, od. . . WYMAN, Mar, 14",,,,"Mar, 14",1914,
"Monuments, Great stone, Fewkes (J.) is. 6d. net Monypenny (William Flavelle) and Buckle (Gorge Earle)-The Life of Benjamin Disraeli, Earl of Beaconsfield. Vol. 3, 1846-185s. Illus. Svo. 8*X5, pp. 600, 12s. net.... MURRAY, Nov. 14",,,"Monuments, Great stone, Fewkes (J.) is",MURRAY,12s.,,"Monuments, Great stone, Fewkes (J.) is. 6d. net Monypenny (William Flavelle) and Buckle (Gorge Earle)-The Life of Benjamin Disraeli, Earl of Beaconsfield. Vol. 3, 1846-1855. Illus. Svo. 8*X5, pp. 600, 125. net.... MURRAY, Nov. 14",,,,Nov. 14,1914,net
"Moore (George)—The Untilled field. New edit. Cr. Svo. 77 X5, pp. 330, 6s. TIFINEMANN, Oct. 14",Moore,George,The Untilled field,TIFINEMANN,6s.,,"Moore (George)—The Untilled field. New edit. Cr. Svo. 77 X5, pp. 330, 65. TIFINEMANN, Oct. 14",George Moore,['Moore (George)'],,Oct. 14,1914,
"Moss (A R. Runnels-) see Runnels Moss. Moss (C. E.) and others—The Cambridge British flora. Vol. 2: Salicace e to Chenopodiaceæ. Illus. from drawings by E. W. Hunnybun, Demy folio, pp. 226 and 206 plates, 5os. net; #mor. 120s. net ..CAMB. UNIV. PRESS, Mar. 14",Moss,A R. Runnels-,The Cambridge British flora,CAMB. UNIV. PRESS,120s.,,"Moss (A R. Runnels-) see Runnels Moss. Moss (C. E.) and others—The Cambridge British flora. Vol. 2: Salicace e to Chenopodiaceæ. Illus. from drawings by E. W. Hunnybun, Demy folio, pp. 226 and 206 plates, 5os. net; #mor. 120s. net ..CAMB. UNIV. PRESS, Mar. 14",A R. Runnels- Moss,"['Moss (A R. Runnels-)', 'Moss (C. E.)']",,Mar. 14,1914,net
"Motor Traffic (Select Committee on)-- Index and digest of evidence, und. ....WYMAN, Mar. 14",Motor Traffic,Select Committee on,"Index and digest of evidence, und",WYMAN,,,"Motor Traffic (Select Committee on)-- Index and digest of evidence, und. ....WYMAN, Mar. 14",Select Committee on Motor Traffic,['Motor Traffic (Select Committee on)'],,Mar. 14,1914,
"Moulton (F. R.)- An Introduction to celestial mechanics. 2nd rev. edit. Syn). 159. net MACMILLAV, June 14",Moulton,F. R.,An Introduction to celestial mechanics,MACMILLAV,,,"Moulton (F. R.)- An Introduction to celestial mechanics. 2nd rev. edit. Syn). 159. net MACMILLAV, June 14",F. R. Moulton,['Moulton (F. R.)'],,June 14,1914,
"Mulford (Clarence E.)-Bar-20. Cr. Svo., pp. 252, s. net HODDER & S., Mar. 14",Mulford,Clarence E.,Bar,HODDER & S.,,,"Mulford (Clarence E.)-Bar-20. Cr. Svo., pp. 252, IS. net HODDER & S., Mar. 14",Clarence E. Mulford,['Mulford (Clarence E.)'],,Mar. 14,1914,
"Mundy (Talbot)-Rung ho! a novel of India. Cr. Svo. 8 X5, pp. 354, 6s. ..CASSELL, Apr. 14",Mundy,Talbot,Rung ho! a novel of India,CASSELL,6s.,,"Mundy (Talbot)-Rung ho! a novel of India. Cr. Svo. 8 X5, pp. 354, 6s. ..CASSELL, Apr. 14",Talbot Mundy,['Mundy (Talbot)'],,Apr. 14,1914,
"Munro (Neil)--The New road. Cr. 8vɔ. 7° X4, pp. 380, 6s. .W. BLACKWOOD, June 14",Munro,Neil,The New road,W. BLACKWOOD,6s.,,"Munro (Neil)--The New road. Cr. 8vɔ. 7° X4, pp. 380, 6s. .W. BLACKWOOD, June 14",Neil Munro,['Munro (Neil)'],,June 14,1914,
"Murray of Elibank (Lord), Select Committee on charges against--Report, with proceedings, &c., 1s hd ; Report, id. WYMAN, May 14",Murray of Elibank,Lord,"Select Committee on charges against--Report, with proceedings, &c",WYMAN,,,"Murray of Elibank (Lord), Select Committee on charges against--Report, with proceedings, &c., Is hd ; Report, id. WYMAN, May 14",Lord Murray of Elibank,['Murray of Elibank (Lord)'],,May 14,1914,
"Museums (Public)-Return of number of visitors, method of demonstration, &c., for all public museums, in or near London, and in Edinburgh and Dublin, 1913, 1 d. WYMAX, Mar. 14",Museums,Public,"Return of number of visitors, method of demonstration, &c",WYMAX,,,"Museums (Public)-Return of number of visitors, method of demonstration, &c., for all public museums, in or near London, and in Edinburgh and Dublin, 1913, 1 d. WYMAX, Mar. 14",Public Museums,['Museums (Public)'],,Mar. 14,1914,
"National Gallery-Report of the Director, for 1913 2}d. WYMAN, Mar. 14",,,"National Gallery-Report of the Director, for",WYMAN,,,"National Gallery-Report of the Director, for 1913 2}d. WYMAN, Mar. 14",,,,Mar. 14,1914,
"National Gallery of British Art-Catalogue : with descriptions, historical notes, and lives of deceased artists. 21st edit. 6d. NAT. GAL. OF BRIT. ART, May 14",,,"National Gallery of British Art-Catalogue : with descriptions, historical notes, and lives of deceased artists",NAT. GAL. OF BRIT. ART,6d.,,"National Gallery of British Art-Catalogue : with descriptions, historical notes, and lives of deceased artists. 21st edit. 6d. NAT. GAL. OF BRIT. ART, May 14",,,,May 14,1914,
"National Portrait Gallery-Pictures, busts, &c. historical and descriptive catalogue. 15th edit., with suppl. 60. NAT. PORTRAIT GAL., Apr. 14",,,"National Portrait Gallery-Pictures, busts, &c",NAT. PORTRAIT GAL.,,,"National Portrait Gallery-Pictures, busts, &c. historical and descriptive catalogue. 15th edit., with suppl. 60. NAT. PORTRAIT GAL., Apr. 14",,,,Apr. 14,1914,
"Naval expenditure-Return of the naval ex- penditure of each of the principal naval powers in each of the last 10 years, itd. WYMAN, Sep. 14",,,Naval expenditure-Return of the naval ex- penditure of each of the principal naval powers in each of the last,WYMAN,,,"Naval expenditure-Return of the naval ex- penditure of each of the principal naval powers in each of the last 10 years, itd. WYMAN, Sep. 14",,,,Sep. 14,1914,
"Navigation and shipping of the United Kingdom -Annual statement, for 1913. 3s. WYMAX, Oct. 14",,,"Navigation and shipping of the United Kingdom -Annual statement, for",WYMAX,3s.,,"Navigation and shipping of the United Kingdom -Annual statement, for 1913. 35. WYMAX, Oct. 14",,,,Oct. 14,1914,
"Navy and Army Illustrated. Vol. 1. New ser. Folio. 6s. net .NEWXES, Nov. 14",,,Navy and Army Illustrated,NEWXES,6s.,,"Navy and Army Illustrated. Vol. 1. New ser. Folio. 6s. net .NEWXES, Nov. 14",,,,Nov. 14,1914,net
"Navy estimates for 1913-14 -Programme of ship- building, repairs, alterations, maintenance, &c. d. .WYMAN, J une 14",,,Navy estimates for,WYMAN,,,"Navy estimates for 1913-14 -Programme of ship- building, repairs, alterations, maintenance, &c. d. .WYMAN, J une 14",,,,J une 14,1914,
"Nettlefold (J. S.)-Garden cities and canals. Cr. 8vɔ. 7 X 48, pp. 234, 1s. net ST. CATHERINE PRESS, May 14",Nettlefold,J. S.,Garden cities and canals,ST. CATHERINE PRESS,1s.,,"Nettlefold (J. S.)-Garden cities and canals. Cr. 8vɔ. 7 X 48, pp. 234, Is. net ST. CATHERINE PRESS, May 14",J. S. Nettlefold,['Nettlefold (J. S.)'],,May 14,1914,net
"Neville (F. H.) see Heycock (C. T.) and Neville. Nevinson (Henry W.)—The Plea of Pan. New edit. Izmo, 61 X41, pp. 164, 28. 6d. net DUCKWORTH, Oct. 14",Neville,F. H.,The Plea of Pan,DUCKWORTH,6d.,,"Neville (F. H.) see Heycock (C. T.) and Neville. Nevinson (Henry W.)—The Plea of Pan. New edit. Izmo, 61 X41, pp. 164, 28. 6d. net DUCKWORTH, Oct. 14",F. H. Neville,"['Neville (F. H.)', 'Nevinson (Henry W.)']",,Oct. 14,1914,net
"Now English dictionary. Edit. by Sir James A. H. Murray. Vol. 9, part“ Sorrow-Speech; by W. A. Craigie. Folio, pp. 449-560, 5s. MILFORD, Jan. 14",,,Now English dictionary,MILFORD,5s.,,"Now English dictionary. Edit. by Sir James A. H. Murray. Vol. 9, part“ Sorrow-Speech; by W. A. Craigie. Folio, pp. 449-560, 5s. MILFORD, Jan. 14",,,,Jan. 14,1914,
" New Guide Weather charts (The). 12 charts corresponding to 12 months in the year. 15 X 10!, in packet, 2s. 6d. DAVIS & MOUGHTON, Apr. 14",,,New Guide Weather charts (The),DAVIS & MOUGHTON,2s. 6d.,," New Guide Weather charts (The). 12 charts corresponding to 12 months in the year. 15 X 10!, in packet, 2s. 6d. DAVIS & MOUGHTON, Apr. 14",,,,Apr. 14,1914,
"New Zealand Institute-Transactions and Pro- ceedings for the year 1913. Vol. 46. Illus. Ryl. Svo. 9 X6, pp. 436, swd. 21s. net WESLEY, Dec. 14",,,New Zealand Institute-Transactions and Pro- ceedings for the year,WESLEY,21s.,,"New Zealand Institute-Transactions and Pro- ceedings for the year 1913. Vol. 46. Illus. Ryl. Svo. 9 X6, pp. 436, swd. 215. net WESLEY, Dec. 14",,,,Dec. 14,1914,net
"Newbolt (W. C. E.)The World : being five sermons preached in St. Paul's during the month of August, 1913. 12m). 64 x 4, pp. 94, 1s. 6d. net GARDNER, D., Feb. 14",Newbolt,W. C. E.,The World : being five sermons preached in St,"GARDNER, D.",1s. 6d.,,"Newbolt (W. C. E.)The World : being five sermons preached in St. Paul's during the month of August, 1913. 12m). 64 x 4, pp. 94, Is. 6d. net GARDNER, D., Feb. 14",W. C. E. Newbolt,['Newbolt (W. C. E.)'],,Feb. 14,1914,net
"Ne wsham (J. C.)-The Horticultural note book 3rd edit., thoroughly rev. izmo. 64 x 4, pp. 438' 4s. 6d. net .C. LOCKWOOD, May 14",Ne wsham,J. C.,The Horticultural note book,C. LOCKWOOD,4s. 6d.,,"Ne wsham (J. C.)-The Horticultural note book 3rd edit., thoroughly rev. izmo. 64 x 4, pp. 438' 45. 6d. net .C. LOCKWOOD, May 14",J. C. Ne wsham,['Ne wsham (J. C.)'],,May 14,1914,net
"Newton (W. Douglas)-War! A novel. Cr. Evo. 78 x 5, pp. 252, 2s. net...... METHUEN, Feb. 14",Newton,W. Douglas,War! A novel,METHUEN,2s.,,"Newton (W. Douglas)-War! A novel. Cr. Evo. 78 x 5, pp. 252, 25. net...... METHUEN, Feb. 14",W. Douglas Newton,['Newton (W. Douglas)'],,Feb. 14,1914,net
"Nicholson (Jonathan)- Marriage and all about it. Abridged by C. W. Child. lomo., pp. 104, swd. s. net HEALTH AND VITALITY, May 14",Nicholson,Jonathan,Marriage and all about it,HEALTH AND VITALITY,,,"Nicholson (Jonathan)- Marriage and all about it. Abridged by C. W. Child. lomo., pp. 104, swd. IS. net HEALTH AND VITALITY, May 14",Jonathan Nicholson,['Nicholson (Jonathan)'],,May 14,1914,
"Nicholson (Josiah Walker)-History of Crosby Garrett, Westmorland. Svo, 2s. 6d. (Kirby Stephen) J. W. BRAITHWAITE, May 14",Nicholson,Josiah Walker,"History of Crosby Garrett, Westmorland",J. W. BRAITHWAITE,2s. 6d.,,"Nicholson (Josiah Walker)-History of Crosby Garrett, Westmorland. Svo, 25. 6d. (Kirby Stephen) J. W. BRAITHWAITE, May 14",Josiah Walker Nicholson,['Nicholson (Josiah Walker)'],,May 14,1914,
"Nightingale (Agnes)-Handwork models to accom- pany visual geography. In packet 6d. BLACK, Oct. 14",Nightingale,Agnes,Handwork models to accom- pany visual geography,BLACK,6d.,,"Nightingale (Agnes)-Handwork models to accom- pany visual geography. In packet 6d. BLACK, Oct. 14",Agnes Nightingale,['Nightingale (Agnes)'],,Oct. 14,1914,
"Nose, throat and ear, Diseases of, Ballenger (W.L.) 28s, net Nose, throat and ear : Obiter scripta, Friel (A. R.) 28. 6d. net Nose, throat and ear, Operative surgery of, Loeb (H. W.) 50s, net Not wanted, Hume (F.) 6s. Notes and reflections : a calendar for 191s. Arranged by May and November. s. net HEADLEY, Oct. 14",,,"Nose, throat and ear, Diseases of, Ballenger (W.L.)",HEADLEY,,,"Nose, throat and ear, Diseases of, Ballenger (W.L.) 28s, net Nose, throat and ear : Obiter scripta, Friel (A. R.) 28. 6d. net Nose, throat and ear, Operative surgery of, Loeb (H. W.) 50s, net Not wanted, Hume (F.) 6s. Notes and reflections : a calendar for 1915. Arranged by May and November. IS. net HEADLEY, Oct. 14",,,,Oct. 14,1914,
"Notes of a son and brother, James (H.) 12s. net Notes of my ministry, Henson (11. 11.) is. net Nursing, District, in London: Proceedings of Conference and reports of the Provisional Committee. 41.. WYMAN, June 14",,,"Notes of a son and brother, James (H.)",WYMAN,,,"Notes of a son and brother, James (H.) 125. net Notes of my ministry, Henson (11. 11.) is. net Nursing, District, in London: Proceedings of Conference and reports of the Provisional Committee. 41.. WYMAN, June 14",,,,June 14,1914,
"Ogilvie (Alexander)-Applications of electricity, for non-technical readers. I 2m0. 6d. net (People's books) .. JACK, Feb. 14",Ogilvie,Alexander,"Applications of electricity, for non-technical readers",JACK,6d.,,"Ogilvie (Alexander)-Applications of electricity, for non-technical readers. I 2m0. 6d. net (People's books) .. JACK, Feb. 14",Alexander Ogilvie,['Ogilvie (Alexander)'],,Feb. 14,1914,net
"Olcutt (William T.)- Sun lore of all ages. 810., IOS, 6d. net.. .PUTNAM, Nov. 14",Olcutt,William T.,Sun lore of all ages,PUTNAM,6d.,,"Olcutt (William T.)- Sun lore of all ages. 810., IOS, 6d. net.. .PUTNAM, Nov. 14",William T. Olcutt,['Olcutt (William T.)'],,Nov. 14,1914,net
"Oliver (A.)The incised effigies of Staffordshire. 40 plates. Folio 15 X101, pp. 23, 14s. SPRAGUE, Mar. 14",Oliver,A.,The incised effigies of Staffordshire,SPRAGUE,14s.,,"Oliver (A.)The incised effigies of Staffordshire. 40 plates. Folio 15 X101, pp. 23, 14s. SPRAGUE, Mar. 14",A. Oliver,['Oliver (A.)'],,Mar. 14,1914,
"Oman (Charles)-A History of the Peninsular war. Vol. 5, Oct. 1811-Aug. 31, 1812. With maps and illus. Svo. 9 X54, pp. 648, 149. net (Clarendon Press) MILFORD, Oct. 14",Oman,Charles,A History of the Peninsular war,MILFORD,,,"Oman (Charles)-A History of the Peninsular war. Vol. 5, Oct. 1811-Aug. 31, 1812. With maps and illus. Svo. 9 X54, pp. 648, 149. net (Clarendon Press) MILFORD, Oct. 14",Charles Oman,['Oman (Charles)'],,Oct. 14,1914,
"Open letter to Sir Edward Carson (An). Svo , pp. 48, swd. is. net .. UNWIN, July 14",,,Open letter to Sir Edward Carson (An),UNWIN,,,"Open letter to Sir Edward Carson (An). Svo , pp. 48, swd. is. net .. UNWIN, July 14",,,,July 14,1914,
"Oppenheim (E. Phillips)-Havoc. Svo., swd., 6d. HODDER & S., Jan. 14",Oppenheim,E. Phillips,Havoc,HODDER & S.,6d.,,"Oppenheim (E. Phillips)-Havoc. Svo., swd., 6d. HODDER & S., Jan. 14",E. Phillips Oppenheim,['Oppenheim (E. Phillips)'],,Jan. 14,1914,
"Ordnance Survey-Report to 31st March, 1914 (with maps). 10 d. WYMAN, June 14",,,Ordnance Survey-Report to,WYMAN,,,"Ordnance Survey-Report to 31st March, 1914 (with maps). 10 d. WYMAN, June 14",,,,June 14,1914,
"Osborno (Dorothy) -Letters to Sir William Temple. izmo., pp. 330, is. net ; Ithr. 2s. net (Everyman's Library). ...DENT, Apr. 14",Osborno,Dorothy,Letters to Sir William Temple,DENT,2s.,,"Osborno (Dorothy) -Letters to Sir William Temple. izmo., pp. 330, is. net ; Ithr. 25. net (Everyman's Library). ...DENT, Apr. 14",Dorothy Osborno,['Osborno (Dorothy)'],,Apr. 14,1914,net
"Osler (William)-A Way of life: an address to Yale students. 167o., pp. 62, is. net CONSTABLE, Jan. 14",Osler,William,A Way of life: an address to Yale students,CONSTABLE,,,"Osler (William)-A Way of life: an address to Yale students. 167o., pp. 62, is. net CONSTABLE, Jan. 14",William Osler,['Osler (William)'],,Jan. 14,1914,
"Oston (M.)--Queer patients. 2nd elit. Cr. Svo 71 X41, pp. 336, 23. net MURRAY & E., June 14",Oston,M.,Queer patients,MURRAY & E.,,,"Oston (M.)--Queer patients. 2nd elit. Cr. Svo 71 X41, pp. 336, 23. net MURRAY & E., June 14",M. Oston,['Oston (M.)'],,June 14,1914,
"Oswald (F.)--Geological map of the Caucasus. In 2 sheets, with explanatory text. Scale 1,000,000. 1 58. net ....DULAU, July 14",Oswald,F.,Geological map of the Caucasus,DULAU,,,"Oswald (F.)--Geological map of the Caucasus. In 2 sheets, with explanatory text. Scale 1,000,000. 1 58. net ....DULAU, July 14",F. Oswald,['Oswald (F.)'],,July 14,1914,
"Outcault (R. F.)--Buster Brown at home. Oblong to, bds. 3s. 6d. net .. .... CHAMBERS, Oct. 14",Outcault,R. F.,Buster Brown at home,CHAMBERS,3s. 6d.,,"Outcault (R. F.)--Buster Brown at home. Oblong to, bds. 35. 6d. net .. .... CHAMBERS, Oct. 14",R. F. Outcault,['Outcault (R. F.)'],,Oct. 14,1914,net
