,entry,last_name,first_name,title,publisher,price,price_in_pounds,format,original_entry,author_name,creators,is_editor,date,is_net
1433,"Called to judgment, Stanton (C.) and Hosken (H.) 63... Callender (G, A, R.)- The Life of Nelson, with illus. Prize edit. Cr. Svo., 2s. 60. LONGMANS, Jan. 13",,,"Called to judgment, Stanton (C.) and Hosken (H.)",LONGMANS,,0.0,,"Called to judgment, Stanton (C.) and Hosken (H.) 63... Callender (G, A, R.)- The Life of Nelson, with illus. Prize edit. Cr. Svo., 25. 60. LONGMANS, Jan. 13",,,,Jan. 13,
1436,"Callhrop (M. M. C.)—The Crusades. 12m0., 6d. net (People's books)..... .. JACK, Sep. 13",Callhrop,M. M. C.,The Crusades,JACK,6d.,0.025,,"Callhrop (M. M. C.)—The Crusades. 12m0., 6d. net (People's books)..... .. JACK, Sep. 13",M. M. C. Callhrop,['Callhrop (M. M. C.)'],,Sep. 13,net
1443,"Cambridge Diary (The) for the Academical year 1913-1914. 58 sheets, 10 X8, mounted on card, s. net CAMB. UNIV PRESS, Sep. 13",,,Cambridge Diary (The) for the Academical year,CAMB. UNIV PRESS,,0.0,,"Cambridge Diary (The) for the Academical year 1913-1914. 58 sheets, 10 X8, mounted on card, IS. net CAMB. UNIV PRESS, Sep. 13",,,,Sep. 13,
1480,"Canada-Construction of war-ships : correspond- ence id. .W'YMAN, Jar. 13",,,Canada-Construction of war-ships : correspond- ence id. ,W'YMAN,,0.0,,"Canada-Construction of war-ships : correspond- ence id. .W'YMAN, Jar. 13",,,,Jar. 13,
1481,"Canal boats: extract from the Local Government Board Report for 1911-12. 2£d. (post free) WYMAN, Feb. 13",,,Canal boats: extract from the Local Government Board Report for,WYMAN,,0.0,,"Canal boats: extract from the Local Government Board Report for 1911-12. 2£d. (post free) WYMAN, Feb. 13",,,,Feb. 13,
1495,"Carducci (Giosuè)--A Selection of his poems. With verse trans., notes, and three intro. essays by G. I,. Bickerstcih. Svo., Ios. 6d. net LONGMAXS, Sep. 13",Carducci,Giosuè,A Selection of his poems,LONGMAXS,6d.,0.025,,"Carducci (Giosuè)--A Selection of his poems. With verse trans., notes, and three intro. essays by G. I,. Bickerstcih. Svo., Ios. 6d. net LONGMAXS, Sep. 13",Giosuè Carducci,['Carducci (Giosuè)'],,Sep. 13,net
1516,"Carroll (Lewis) picture book (The). Edit. by S. D. Collingwood. 12o. 7d. net W. COLLINS, May 13",Carroll,Lewis,The),W. COLLINS,7d.,0.029166666666666667,,"Carroll (Lewis) picture book (The). Edit. by S. D. Collingwood. 12o. 7d. net W. COLLINS, May 13",Lewis Carroll,['Carroll (Lewis)'],,May 13,net
1525,"Cary (F. R.)—Solution of railroad problems by the slide rule. Smo. 45, 6d. net CONSTABLE, Dec. 13",Cary,F. R.,Solution of railroad problems by the slide rule,CONSTABLE,6d.,0.025,,"Cary (F. R.)—Solution of railroad problems by the slide rule. Smo. 45, 6d. net CONSTABLE, Dec. 13",F. R. Cary,['Cary (F. R.)'],,Dec. 13,net
1547,"Cassavetti (D. J.)--Hellas and the Balkan Wars. Illus. Svo. 9 X 51, pp. 384, Ios. 6d. net USWIX, Dec. 13",Cassavetti,D. J.,Hellas and the Balkan Wars,USWIX,6d.,0.025,,"Cassavetti (D. J.)--Hellas and the Balkan Wars. Illus. Svo. 9 X 51, pp. 384, Ios. 6d. net USWIX, Dec. 13",D. J. Cassavetti,['Cassavetti (D. J.)'],,Dec. 13,net
1549,"Cassell's Guide to London. Imp. 16m0., swd. 6d. net CASSELL, Apr. 13",,,Cassell's Guide to London,CASSELL,6d.,0.025,,"Cassell's Guide to London. Imp. 16m0., swd. 6d. net CASSELL, Apr. 13",,,,Apr. 13,net
1564,"Caton (A. Gertrude)-Stories from history and literature. Illus. Ryl. iómo. 71 X5}, is. 3d. MACMILLAN, June 13",Caton,A. Gertrude,Stories from history and literature,MACMILLAN,3d.,0.0125,,"Caton (A. Gertrude)-Stories from history and literature. Illus. Ryl. iómo. 71 X5}, is. 3d. MACMILLAN, June 13",A. Gertrude Caton,['Caton (A. Gertrude)'],,June 13,
1577,"Census (England and Wales) — Vol. 5, Iudex to Population tables, 3s......... WYMAN, Mar. 13",Census,England,Vol,WYMAN,3s.,0.15,,"Census (England and Wales) — Vol. 5, Iudex to Population tables, 3S......... WYMAN, Mar. 13",England Census,"['Census (England)', 'Census (Wales)']",,Mar. 13,
1578,"Census (England and Wales) ----Vol. 6, Buildings of various kinds, 3s...... . WYMAN, May 13",Census,England,Vol,WYMAN,3s.,0.15,,"Census (England and Wales) ----Vol. 6, Buildings of various kinds, 3S...... . WYMAN, May 13",England Census,"['Census (England)', 'Census (Wales)']",,May 13,
1579,"Census (England and Wales) ---Vol. 7, Ages and condition as to marriage. 4s. ind. WYMAX, June 13",Census,England,Vol,WYMAX,,0.0,,"Census (England and Wales) ---Vol. 7, Ages and condition as to marriage. 45. ind. WYMAX, June 13",England Census,"['Census (England)', 'Census (Wales)']",,June 13,
1580,"Census (England and Wales)- Population statis- tics. Vol. 8, Tenements in Administrative Counties and Urban and Rural Districts. WYMAN, 11!5. 13",Census,England,Population statis- tics,WYMAN,,0.0,,"Census (England and Wales)- Population statis- tics. Vol. 8, Tenements in Administrative Counties and Urban and Rural Districts. WYMAN, 11!5. 13",England Census,"['Census (England)', 'Census (Wales)']",,11!5. 13,
1581,"Census (England and Wales) — Vol. 9, Birthplace of persons enumerated in Administrative Counties, &c., and ages and occupations of foreigners. 2s. 6d. ... WYMAN, Oct. 13",Census,England,Vol,WYMAN,2s. 6d.,0.125,,"Census (England and Wales) — Vol. 9, Birthplace of persons enumerated in Administrative Counties, &c., and ages and occupations of foreigners. 25. 6d. ... WYMAN, Oct. 13",England Census,"['Census (England)', 'Census (Wales)']",,Oct. 13,
1582,"Census (Tingland and Wales) — Vol. 12, Language spoken in Wales and Monmouthshire. 6. WYMAY, July 13",Census,Tingland,Vol,WYMAY,,0.0,,"Census (Tingland and Wales) — Vol. 12, Language spoken in Wales and Monmouthshire. 6. WYMAY, July 13",Tingland Census,"['Census (Tingland)', 'Census (Wales)']",,July 13,
1583,"Census (Ireland)-General report. With tables and appendix. 5s. 30. WYMAN, Apr. 13",Census,Ireland,General report,WYMAN,,0.0,,"Census (Ireland)-General report. With tables and appendix. 55. 30. WYMAN, Apr. 13",Ireland Census,['Census (Ireland)'],,Apr. 13,
1584,"Census (Ireland)-Summary tables, &c. 60. WYMAX, Apr. 13",Census,Ireland,"Summary tables, &c",WYMAX,,0.0,,"Census (Ireland)-Summary tables, &c. 60. WYMAX, Apr. 13",Ireland Census,['Census (Ireland)'],,Apr. 13,
1585,"Census (Ireland) --Supplement to the general topographical index. +d. .. WYMAV, May 13",Census,Ireland,Supplement to the general topographical index,WYMAV,,0.0,,"Census (Ireland) --Supplement to the general topographical index. +d. .. WYMAV, May 13",Ireland Census,['Census (Ireland)'],,May 13,
1586,"Census (Scotland)--Counties of Selkirk, Jd. ; Shetland, 4d. ; Stirling, 8 d. ; Sutherland, 401. WYMIX, Feb. 13",Census,Scotland,"Counties of Selkirk, Jd",WYMIX,,0.0,,"Census (Scotland)--Counties of Selkirk, Jd. ; Shetland, 4d. ; Stirling, 8 d. ; Sutherland, 401. WYMIX, Feb. 13",Scotland Census,['Census (Scotland)'],,Feb. 13,
1587,"Census (Scotland) ---County of Peebles, 40.; County of Renfrew, 9d. ; County of Ross and Cromarty, 6d. ; County of Roxburgh, 5 d. WYMAX, Jar. 13",Census,Scotland,County of Peebles,WYMAX,,0.0,,"Census (Scotland) ---County of Peebles, 40.; County of Renfrew, 9d. ; County of Ross and Cromarty, 6d. ; County of Roxburgh, 5 d. WYMAX, Jar. 13",Scotland Census,['Census (Scotland)'],,Jar. 13,
1588,"Census (Scotland)--County of Wigtown. 4]. WYMAN, Jar. 13",Census,Scotland,County of Wigtown,WYMAN,,0.0,,"Census (Scotland)--County of Wigtown. 4]. WYMAN, Jar. 13",Scotland Census,['Census (Scotland)'],,Jar. 13,
1589,"Census (Scotland) - Report. Vol. 2. With diagrams. 6s, 2d. WYMAN, Aug. 13",Census,Scotland,Report,WYMAN,6s. 2d.,0.30833333333333335,,"Census (Scotland) - Report. Vol. 2. With diagrams. 6s, 2d. WYMAN, Aug. 13",Scotland Census,['Census (Scotland)'],,Aug. 13,
1590,"Century Bible (The) : The Book of Daniel. Intro- duction, Revised Version with notes, index and map. Edit. by R. II. Charles. 121110. 6.1 X41, PP. 207, 2s. 6d. net, Ilhr. 3s. 6d. net JACK, N1r. 13",,,Century Bible (The) : The Book of Daniel,JACK,3s. 6d.,0.175,,"Century Bible (The) : The Book of Daniel. Intro- duction, Revised Version with notes, index and map. Edit. by R. II. Charles. 121110. 6.1 X41, PP. 207, 25. 6d. net, Ilhr. 35. 6d. net JACK, N1r. 13",,,,N1r. 13,net
1614,"Chambers (Robert W.)-Tlie Firing line. 7d. net ...NEWNES, Dec. 13",Chambers,Robert W.,Tlie Firing line,NEWNES,7d.,0.029166666666666667,,"Chambers (Robert W.)-Tlie Firing line. 7d. net ...NEWNES, Dec. 13",Robert W. Chambers,['Chambers (Robert W.)'],,Dec. 13,net
1625,"Chancery proceedings : Bridges' Division, 1613- 1714. Iudex. Vol. 1, A-C. 138. WYMAN, Mar. 13",,,Chancery proceedings : Bridges' Division,WYMAN,,0.0,,"Chancery proceedings : Bridges' Division, 1613- 1714. Iudex. Vol. 1, A-C. 138. WYMAN, Mar. 13",,,,Mar. 13,
1643,"CHARITIES Charities (Endowed)-Reports, County of Devon : Berry Pomeroy, id. ; Bridestow, id. ; Darting. ton, id. ; Harberton, 3d.; Rattery, 1d. ; Sampford Courtenay, id.; S. Tawton, 11d. ; Spreyton, id. ; Throwleigh, 1d. ; Widecombe- in-the-Moor, Ild. ; North Law, id. ; Ashbury, }d.; Ashford, kd.; Broadwood Kelly, td.; Highampton, yd.; Sampford Spiney, jd. WYMAN, Jan. 13",CHARITIES Charities,Endowed,"Reports, County of Devon : Berry Pomeroy, id. ; Bridestow, id. ; Darting",WYMAN,,0.0,,"CHARITIES Charities (Endowed)-Reports, County of Devon : Berry Pomeroy, id. ; Bridestow, id. ; Darting. ton, id. ; Harberton, 3d.; Rattery, Id. ; Sampford Courtenay, id.; S. Tawton, 11d. ; Spreyton, id. ; Throwleigh, 1d. ; Widecombe- in-the-Moor, Ild. ; North Law, id. ; Ashbury, }d.; Ashford, kd.; Broadwood Kelly, td.; Highampton, yd.; Sampford Spiney, jd. WYMAN, Jan. 13",Endowed CHARITIES Charities,['CHARITIES Charities (Endowed)'],,Jan. 13,
1644,"Charities (Endowed)—Reports, County of Devon : Lydford, id. WYMAN, May 13",Charities,Endowed,,WYMAN,,0.0,,"Charities (Endowed)—Reports, County of Devon : Lydford, id. WYMAN, May 13",Endowed Charities,['Charities (Endowed)'],,May 13,
1645,"Charities (Endowed)-Reports, County of Devon : Monk Okehampton, id.; Bondleigh, ļd.; Dolton, id.; Hawkchurch, id. ; Jacobstowe, }d.; Roborough, id.; Stockleigh English, 1d.; Chardstock, 2d. ; Fast Stonehouse, I'd.; Hatherleigh, 2}d. ; Landkey, 2ļd.; Newtou Tracey, fd., Walkhampton, 2}d. WYMAN, Apr. 13",Charities,Endowed,"Reports, County of Devon : Monk Okehampton, id.; Bondleigh, ļd",WYMAN,,0.0,,"Charities (Endowed)-Reports, County of Devon : Monk Okehampton, id.; Bondleigh, ļd.; Dolton, id.; Hawkchurch, id. ; Jacobstowe, }d.; Roborough, id.; Stockleigh English, Id.; Chardstock, 2d. ; Fast Stonehouse, I'd.; Hatherleigh, 2}d. ; Landkey, 2ļd.; Newtou Tracey, fd., Walkhampton, 2}d. WYMAN, Apr. 13",Endowed Charities,['Charities (Endowed)'],,Apr. 13,
1646,"Charities (Endowed)-Reports, County of Devon : Okehampton, 6d. ; Tormoham-with-Torquay, &c., 7d. ; Totnes, 6 d. . WYMAX, July 13",Charities,Endowed,"Reports, County of Devon : Okehampton",WYMAX,,0.0,,"Charities (Endowed)-Reports, County of Devon : Okehampton, 6d. ; Tormoham-with-Torquay, &c., 7d. ; Totnes, 6 d. . WYMAX, July 13",Endowed Charities,['Charities (Endowed)'],,July 13,
1647,"Charities (Endowed)—Reports, County of Devon : Staverton, 1 d.; Beaford, sd.; Belstone, 1d. ; Dowland, id. ; Exbourne, id. ; 1ddesleigh, id.; Inwardleigh, Little Hempston, id. ; N. Petherwin, id.; N. Tawton, 20. ; Sourton, d. WYMAN, Feb. 13",Charities,Endowed,"Reports, County of Devon : Staverton",WYMAN,,0.0,,"Charities (Endowed)—Reports, County of Devon : Staverton, 1 d.; Beaford, sd.; Belstone, Id. ; Dowland, id. ; Exbourne, id. ; Iddesleigh, id.; Inwardleigh, Little Hempston, id. ; N. Petherwin, id.; N. Tawton, 20. ; Sourton, d. WYMAN, Feb. 13",Endowed Charities,['Charities (Endowed)'],,Feb. 13,
1653,"Charity Commissioners for England and Wales- 60 report, for 1912. 3d. .WYMAN, A pr. 13",,,Charity Commissioners for England and Wales-,WYMAN,3d.,0.0125,,"Charity Commissioners for England and Wales- 60 report, for 1912. 3d. .WYMAN, A pr. 13",,,,A pr. 13,
1654,"Charles (R. 11.) and others—The Apocrypha and Pseudepigraphia of the Old Testament in English. With intro. and critical and explanatory notes to the several books. Edited in conjunction with many scholars by R. H. Charles. Vol. I, Apocryphia, pp. 696; Vol. 2, Pseudepigraphia, pp. 886. 4t0., 63s, net (Clarendon Press) MILFORD, June 13",Charles,R. 11.,The Apocrypha and Pseudepigraphia of the Old Testament in English,MILFORD,63s.,3.15,,"Charles (R. 11.) and others—The Apocrypha and Pseudepigraphia of the Old Testament in English. With intro. and critical and explanatory notes to the several books. Edited in conjunction with many scholars by R. H. Charles. Vol. I, Apocryphia, pp. 696; Vol. 2, Pseudepigraphia, pp. 886. 4t0., 63s, net (Clarendon Press) MILFORD, June 13",R. 11. Charles,['Charles (R. 11.)'],,June 13,net
1665,"Chaytor (H. J.) and Hartog (W. G.)-Matricula- tion French essays. Cr. Evo., pp. 134, is, 6d. CLIVE, Mar. 13",Chaytor,H. J.,Matricula- tion French essays,CLIVE,6d.,0.025,,"Chaytor (H. J.) and Hartog (W. G.)-Matricula- tion French essays. Cr. Evo., pp. 134, is, 6d. CLIVE, Mar. 13",H. J. Chaytor,"['Chaytor (H. J.)', 'Hartog (W. G.)']",,Mar. 13,
1669,"Chelsea Hospital ---Account, 1911-12, id. (post frie) W'YMAN, Mar. 13",,,Chelsea Hospital ---Account,W'YMAN,,0.0,,"Chelsea Hospital ---Account, 1911-12, id. (post frie) W'YMAN, Mar. 13",,,,Mar. 13,
1674,"Langham booklets, 129) .. SIEGLE, H., May 13",,,Langham booklets,"SIEGLE, H.",,0.0,,"Langham booklets, 129) .. SIEGLE, H., May 13",,,,May 13,
1675,"Chemistry, inorganic and organic, Bloxam (C. L.) Chesterton (Gilbert K.)-The Club of queer 21s. net trades. Pop. edit. 12m0., pp. 192, s. net Chemistry, Junior pract., Bausor (H. W.) is. HODDER & S., July 13",,,"Chemistry, inorganic and organic, Bloxam (C. L.) Chesterton (Gilbert K.)-The Club of queer",HODDER & S.,,0.0,,"Chemistry, inorganic and organic, Bloxam (C. L.) Chesterton (Gilbert K.)-The Club of queer 215. net trades. Pop. edit. 12m0., pp. 192, IS. net Chemistry, Junior pract., Bausor (H. W.) is. HODDER & S., July 13",,,,July 13,
1676,"CASSELL, Jan. 13",,,,CASSELL,,0.0,,"CASSELL, Jan. 13",,,,Jan. 13,
1680,"BLACK, Jan. 13",,,,BLACK,,0.0,,"BLACK, Jan. 13",,,,Jan. 13,
1681,"LONGMAYS, Nov. 13",,,,LONGMAYS,,0.0,,"LONGMAYS, Nov. 13",,,,Nov. 13,
1684,"Child (J.) cd. ---Belfast as a British Empire asset. Second edit. Folio. pp. 36, swd. is. MANCHESTER COURIER, Apr. 13",Child,J.,Belfast as a British Empire asset,MANCHESTER COURIER,,0.0,,"Child (J.) cd. ---Belfast as a British Empire asset. Second edit. Folio. pp. 36, swd. is. MANCHESTER COURIER, Apr. 13",J. Child,['Child (J.)'],,Apr. 13,
1696,"China despatches—Russo-Mongolian agreement. October 21st, 1912, 2d. (post free) WYMAN, Feb. 13",,,China despatches—Russo-Mongolian agreement,WYMAN,2d.,0.008333333333333333,,"China despatches—Russo-Mongolian agreement. October 21st, 1912, 2d. (post free) WYMAN, Feb. 13",,,,Feb. 13,
1702,"Chisholm readers (The). Book 1, 10d., Book 2, is. JACK, Nov. 13",,,Chisholm readers (The),JACK,,0.0,,"Chisholm readers (The). Book 1, 10d., Book 2, is. JACK, Nov. 13",,,,Nov. 13,
1725,"Church decoration : some practical suggestions for the painting and decorating of churches, with coloured examples, &c. Folio, pp. 44, swd. 5s. .... SIMPKIN, Jan. 13",,,"Church decoration : some practical suggestions for the painting and decorating of churches, with coloured examples, &c",SIMPKIN,5s.,0.25,,"Church decoration : some practical suggestions for the painting and decorating of churches, with coloured examples, &c. Folio, pp. 44, swd. 55. .... SIMPKIN, Jan. 13",,,,Jan. 13,
1731,"Church temporalities (Ireland --Accounts for 19I-12, 20. WYMAN, Feb. 13",,,Church temporalities (Ireland --Accounts for,WYMAN,,0.0,,"Church temporalities (Ireland --Accounts for I9II-I2, 20. WYMAN, Feb. 13",,,,Feb. 13,
1739,"Civil Service-Appointments made without com- petitive examination, froin Feb. 27th, 1912, 7d. WYMAN, Mar. 13",,,"Civil Service-Appointments made without com- petitive examination, froin Feb",WYMAN,7d.,0.029166666666666667,,"Civil Service-Appointments made without com- petitive examination, froin Feb. 27th, 1912, 7d. WYMAN, Mar. 13",,,,Mar. 13,
1740,"Civil Service Commission- Abstract of rules and regulations, 1913, 1s. 3d. (post free) WYMAN, Apr. 13",,,Civil Service Commission- Abstract of rules and regulations,WYMAN,1s. 3d.,0.0625,,"Civil Service Commission- Abstract of rules and regulations, 1913, Is. 3d. (post free) WYMAN, Apr. 13",,,,Apr. 13,
1741,"Civil Service Commission--Appendix to 2nd report, 5s. 7d. (post free) WYMAN, Jan. 13",,,Civil Service Commission--Appendix to,WYMAN,5s. 7d.,0.2791666666666667,,"Civil Service Commission--Appendix to 2nd report, 5s. 7d. (post free) WYMAN, Jan. 13",,,,Jan. 13,
1742,"Civil Service-Estimates, 1913–14 : Class 1, Public works and buildings, old. ; Class 2, Salaries and expenses, is, 9d. ; Class 3, Law and justice, is. 5d. ; Class 4, Education, &c., 9 d. ; Class 5, Foreign and Colonial services, 6 d. ; Class 6, Non-effective services, 4}d. ; Revenue estimates, 1s. 5d. ; Post Office estimates, 7d. ; Class 7, Miscellaneous, 3}d. ; Class 8, Old age pensions, labour exchanges, insurance, &c., 4d. (post free) WYMAN, Mar. 13",,,Civil Service-Estimates,WYMAN,4d.,0.016666666666666666,,"Civil Service-Estimates, 1913–14 : Class 1, Public works and buildings, old. ; Class 2, Salaries and expenses, is, 9d. ; Class 3, Law and justice, is. 5d. ; Class 4, Education, &c., 9 d. ; Class 5, Foreign and Colonial services, 6 d. ; Class 6, Non-effective services, 4}d. ; Revenue estimates, Is. 5d. ; Post Office estimates, 7d. ; Class 7, Miscellaneous, 3}d. ; Class 8, Old age pensions, labour exchanges, insurance, &c., 4d. (post free) WYMAN, Mar. 13",,,,Mar. 13,
1743,"Civil Service--Estimates, 1913-14 : Memo. by the Financial Secretary to the Trcasury, No. 2, 5d. (post free)...... ......WYMAN, Mar. 13",,,Civil Service--Estimates,WYMAN,5d.,0.020833333333333332,,"Civil Service--Estimates, 1913-14 : Memo. by the Financial Secretary to the Trcasury, No. 2, 5d. (post free)...... ......WYMAN, Mar. 13",,,,Mar. 13,
1744,"Clvil Service-Fstimates, 1913-14, with memo., abstract and index, 5s. 2d. .. WYMAN, A pr. 13",,,Clvil Service-Fstimates,WYMAN,5s. 2d.,0.25833333333333336,,"Clvil Service-Fstimates, 1913-14, with memo., abstract and index, 5s. 2d. .. WYMAN, A pr. 13",,,,A pr. 13,
1745,"Civil Service Commission-57th report, for 1912, 6d. .WYMAN, July 13",,,Civil Service Commission,WYMAN,6d.,0.025,,"Civil Service Commission-57th report, for 1912, 6d. .WYMAN, July 13",,,,July 13,
1746,"Civil Service Commission-Second report, ļd. ; Appendix to second report: minutes of evi- dence, &c., 5s. id. . WYMAN, Jan. 13",,,"Civil Service Commission-Second report, ļd",WYMAN,,0.0,,"Civil Service Commission-Second report, ļd. ; Appendix to second report: minutes of evi- dence, &c., 55. id. . WYMAN, Jan. 13",,,,Jan. 13,
1747,"Civil Service Commission.—Third report, $d.; Appendix : minutes of evidence, 10 Oct.- 13 Dec., 1912, 3s. WYMAN, Apr.13",,,Civil Service Commission,WYMAN,3s.,0.15,,"Civil Service Commission.—Third report, $d.; Appendix : minutes of evidence, 10 Oct.- 13 Dec., 1912, 3s. WYMAN, Apr.13",,,,Apr.13,
1749,"Civil Services and Revenue Departments--Ap- propriation accounts, 1911-12, 3s. 8d. WYMAN, Mar, 13",,,Civil Services and Revenue Departments--Ap- propriation accounts,WYMAN,3s. 8d.,0.18333333333333332,,"Civil Services and Revenue Departments--Ap- propriation accounts, 1911-12, 35. 8d. WYMAN, Mar, 13",,,,"Mar, 13",
1806,"Clifford (Mrs. W. K.)-Love-letters of a worldly woman. New and enlarged edit. 61 X41, pp. 278, 2s. 6d. net CONSTABLE, May 13",Clifford,Mrs. W. K.,Love-letters of a worldly woman,CONSTABLE,2s. 6d.,0.125,,"Clifford (Mrs. W. K.)-Love-letters of a worldly woman. New and enlarged edit. 61 X41, pp. 278, 25. 6d. net CONSTABLE, May 13",Mrs. W. K. Clifford,['Clifford (Mrs. W. K.)'],,May 13,net
1807,"Clinton (W. C.)-Electric wirings: a primer for use of wiremen and students. 3rd edit. Immo. 64 X44, pp. 200, 2s. .MURRAY, June 13",Clinton,W. C.,Electric wirings: a primer for use of wiremen and students,MURRAY,2s.,0.1,,"Clinton (W. C.)-Electric wirings: a primer for use of wiremen and students. 3rd edit. Immo. 64 X44, pp. 200, 25. .MURRAY, June 13",W. C. Clinton,['Clinton (W. C.)'],,June 13,
1809,"12mo J. M. WATKINS, Jan. 13",,,,J. M. WATKINS,,0.0,,"I2mo J. M. WATKINS, Jan. 13",,,,Jan. 13,
1818,"Coal-Prices of exported, 1912. 2d. WYMAN, Aug. 13",,,Coal-Prices of exported,WYMAN,2d.,0.008333333333333333,,"Coal-Prices of exported, 1912. 2d. WYMAN, Aug. 13",,,,Aug. 13,
1819,"Coal shipments—Tables for each quarter of 1911-2 6d. WYMAN, June 13",,,Coal shipments—Tables for each quarter of,WYMAN,6d.,0.025,,"Coal shipments—Tables for each quarter of 1911-2 6d. WYMAN, June 13",,,,June 13,
1820,"Coal tables, 1911-Statistical tables relating to the production, consumption and imports and exports of coal in recent years (to 1911). 5 d. WYMAN, Jan, 13",,,Coal tables,WYMAN,,0.0,,"Coal tables, 1911-Statistical tables relating to the production, consumption and imports and exports of coal in recent years (to 1911). 5 d. WYMAN, Jan, 13",,,,"Jan, 13",
1855,"Cole (Sanford D. Shipmaster's handbook to the Merchant Shipping Acts. 8vo. 8} 5), pp. 246, 5s. net.. .J. BROWN, July 13",Cole,Sanford D. Shipmaster's handbook to the Merchant Shipping Acts. 8vo. 8} 5,246,J. BROWN,5s.,0.25,,"Cole (Sanford D. Shipmaster's handbook to the Merchant Shipping Acts. 8vo. 8} 5), pp. 246, 55. net.. .J. BROWN, July 13",Sanford D. Shipmaster's handbook to the Merchant Shipping Acts. 8vo. 8} 5 Cole,"[""Cole (Sanford D. Shipmaster's handbook to the Merchant Shipping Acts. 8vo. 8} 5)""]",,July 13,net
1867,"Cole's Treasury of song: a collection of the most popular songs. Cr. Svo. 71 X 44, pp. 400, 2s. 6d. HUTCHINSON, Oct. 13",,,Cole's Treasury of song: a collection of the most popular songs,HUTCHINSON,2s. 6d.,0.125,,"Cole's Treasury of song: a collection of the most popular songs. Cr. Svo. 71 X 44, pp. 400, 25. 6d. HUTCHINSON, Oct. 13",,,,Oct. 13,
1883,"Colonial reports-Basutoland, id.; Gold Coast, 3}d. ; Ashanti, 4d.; S. Nigeria (mineral survey), id. WYMAX, Od. 13",,,"Colonial reports-Basutoland, id.; Gold Coast",WYMAX,,0.0,,"Colonial reports-Basutoland, id.; Gold Coast, 3}d. ; Ashanti, 4d.; S. Nigeria (mineral survey), id. WYMAX, Od. 13",,,,Od. 13,
1884,"Colonial reports--Cayman 1slands, 5d. WYMAN, May 13",,,Colonial reports--Cayman,WYMAN,5d.,0.020833333333333332,,"Colonial reports--Cayman Islands, 5d. WYMAN, May 13",,,,May 13,
1885,"Colonial reports-Gibraltar, 2}d.; St. Helena, 3}d. WYMAN, June 13",,,Colonial reports-Gibraltar,WYMAN,,0.0,,"Colonial reports-Gibraltar, 2}d.; St. Helena, 3}d. WYMAN, June 13",,,,June 13,
1886,"Colonial reports-Gilbert and Ellice 1slands, 1}d.; West Africa : vital statistics of non- native officials, 5d. . WYMAN, Apr. 13",,,Colonial reports-Gilbert and Ellice,WYMAN,5d.,0.020833333333333332,,"Colonial reports-Gilbert and Ellice Islands, 1}d.; West Africa : vital statistics of non- native officials, 5d. . WYMAN, Apr. 13",,,,Apr. 13,
1887,"Colonial reports—Malay States, 1911, iod. (post free) WYMAN, Feb. 13",,,Colonial reports—Malay States,WYMAN,,0.0,,"Colonial reports—Malay States, 1911, iod. (post free) WYMAN, Feb. 13",,,,Feb. 13,
1888,"Colonial reports—Mauritius, 1911, 4 d.; Trinidad and Tobago, 1911, 9 d. (post free) WYMAN, Jan. 13",,,Colonial reports—Mauritius,WYMAN,,0.0,,"Colonial reports—Mauritius, 1911, 4 d.; Trinidad and Tobago, 1911, 9 d. (post free) WYMAN, Jan. 13",,,,Jan. 13,
1889,"Colonial reports-St. Lucia, 2 d. WYMAN, Mar. 13",,,Colonial reports-St,WYMAN,,0.0,,"Colonial reports-St. Lucia, 2 d. WYMAN, Mar. 13",,,,Mar. 13,
1896,"Colonial reports—Sierra Leone, 3d. ; Seychelles, 5 d.; Hong Kong, 4!d. ; Turks and Caicos 1sles, 2d. ; Falkland 1sles, 1 d.; Gold Coast (N.), 4d.; Bahamas, 3}d.; Gambia, 7}d. ; Fiji, 2\d. ; Cyprus, 4 d. . WYMAN, Sep. 13",,,Colonial reports—Sierra Leone,WYMAN,,0.0,,"Colonial reports—Sierra Leone, 3d. ; Seychelles, 5 d.; Hong Kong, 4!d. ; Turks and Caicos Isles, 2d. ; Falkland Isles, 1 d.; Gold Coast (N.), 4d.; Bahamas, 3}d.; Gambia, 7}d. ; Fiji, 2\d. ; Cyprus, 4 d. . WYMAN, Sep. 13",,,,Sep. 13,
1897,"Colonial reports-Somaliland, 11d. WYMAN, Aug. 13",,,Colonial reports-Somaliland,WYMAN,11d.,0.04583333333333333,,"Colonial reports-Somaliland, 11d. WYMAN, Aug. 13",,,,Aug. 13,
1898,"Colonial reports-Uganda, 5d.; British Guiana, 4d. WYMAN, Jan. 13",,,Colonial reports-Uganda,WYMAN,4d.,0.016666666666666666,,"Colonial reports-Uganda, 5d.; British Guiana, 4d. WYMAN, Jan. 13",,,,Jan. 13,
1899,"Colonial reports-Weihaiwei, 3d. ; Ceylon, 5 d. WYMAN, July 13",,,Colonial reports-Weihaiwei,WYMAN,,0.0,,"Colonial reports-Weihaiwei, 3d. ; Ceylon, 5 d. WYMAN, July 13",,,,July 13,
1900,"Colonial system, Old, Beer (G. L.) Pt. I, 17s. net Colonies, Handbook on the British, 23. 6d. (post free) . WYMAN, Jan 13",,,"Colonial system, Old, Beer (G. L.) Pt",WYMAN,6d.,0.025,,"Colonial system, Old, Beer (G. L.) Pt. I, 175. net Colonies, Handbook on the British, 23. 6d. (post free) . WYMAN, Jan 13",,,,Jan 13,
1906,"Coming fashions, May, 1913. Folio, swd. 3d. “ DAILY CHRONICLE, May 13",,,"Coming fashions, May",DAILY CHRONICLE,,0.0,,"Coming fashions, May, 1913. Folio, swd. 3d. “ DAILY CHRONICLE, May 13",,,,May 13,
1909,"Commercial treaties, &c., between Great Britain and foreign powers : Handbook, Ios. (Foreign Office) WYMAN, Jan. 13",,,"Commercial treaties, &c",WYMAN,,0.0,,"Commercial treaties, &c., between Great Britain and foreign powers : Handbook, Ios. (Foreign Office) WYMAN, Jan. 13",,,,Jan. 13,
