entry,last_name,first_name,title,publisher,price,format,original_entry,author_name,creators,is_editor,date,is_net
"Clarko (Edwin Leavitt)--American men of letters: their nature and nurture. pp. 169, 6s. (Columbia Univ. Studies). .P. S. KING, Sep. 16",Clarko,Edwin Leavitt,American men of letters: their nature and nurture,P. S. KING,6s.,,"Clarko (Edwin Leavitt)--American men of letters: their nature and nurture. pp. 169, 6s. (Columbia Univ. Studies). .P. S. KING, Sep. 16",Edwin Leavitt Clarko,['Clarko (Edwin Leavitt)'],,Sep. 16,
"Clarke (Laurence)-The Borrowed liner. Čr. Svo. 73 x 5, pp. 318, 6s. ......MILLS & B., Oct. 16",Clarke,Laurence,The Borrowed liner,MILLS & B.,6s.,,"Clarke (Laurence)-The Borrowed liner. Čr. Svo. 73 x 5, pp. 318, 6s. ......MILLS & B., Oct. 16",Laurence Clarke,['Clarke (Laurence)'],,Oct. 16,
"Olaxton (William J.)--Cotton and the spinner. 71 x 5, pp. 80, 7d. net. (Rambles among our industries) .BLACKIE, Nov. 16",Olaxton,William J.,Cotton and the spinner,BLACKIE,,,"Olaxton (William J.)--Cotton and the spinner. 71 x 5, pp. 80, 7d. net. (Rambles among our industries) .BLACKIE, Nov. 16",William J. Olaxton,['Olaxton (William J.)'],,Nov. 16,
"Clay (Henry) and Greenwood (Arthur)-An Intro. atlas of internat, relations. Maps by H, S. Hattin. Fol. 93x7), pp. 120, 1s. 6d. net HEADLEY, July 16",Clay,Henry,An Intro,HEADLEY,1s. 6d.,,"Clay (Henry) and Greenwood (Arthur)-An Intro. atlas of internat, relations. Maps by H, S. Hattin. Fol. 93x7), pp. 120, Is. 6d. net HEADLEY, July 16",Henry Clay,"['Clay (Henry)', 'Greenwood (Arthur)']",,July 16,net
"Clergy list, 1916. 84x57, 12s. 6d. KELLY'S DIRECTORIES, July 16",,,Clergy list,KELLY'S DIRECTORIES,12s. 6d.,,"Clergy list, 1916. 84x57, 12s. 6d. KELLY'S DIRECTORIES, July 16",,,,July 16,
"Close (Albert)---The Divine programme of the world's history. 63 X 4, pp. 234, 2s. 6d. net PROTESTANT TRUTH SOC., July 16",Close,Albert,The Divine programme of the world's history,PROTESTANT TRUTH SOC.,2s. 6d.,,"Close (Albert)---The Divine programme of the world's history. 63 X 4, pp. 234, 2s. 6d. net PROTESTANT TRUTH SOC., July 16",Albert Close,['Close (Albert)'],,July 16,net
"Closo (L. H., Lt.-Col.)-New interpretations. 91x6, pp. 246 Cox's SHIPPING AGENCY, June 16",Closo,"L. H., Lt.-Col.",New interpretations,SHIPPING AGENCY,,,"Closo (L. H., Lt.-Col.)-New interpretations. 91x6, pp. 246 Cox's SHIPPING AGENCY, June 16","L. H., Lt.-Col. Closo","['Closo (L. H., Lt.-Col.)']",,June 16,
"Close Rolls, Calendar of : Henry III, in Latin. Vol. V, 1242-1 247, 178, 6d. WYMAN, June 16",,,"Close Rolls, Calendar of : Henry III, in Latin",WYMAN,6d.,,"Close Rolls, Calendar of : Henry III, in Latin. Vol. V, 1242-1 247, 178, 6d. WYMAN, June 16",,,,June 16,
"Clow (W. M.)- The Evangel of the strait gate. 8 x 51, pp. 321, 6s. net HODDER & S., Nov. 16",Clow,W. M.,The Evangel of the strait gate,HODDER & S.,6s.,,"Clow (W. M.)- The Evangel of the strait gate. 8 x 51, pp. 321, 6s. net HODDER & S., Nov. 16",W. M. Clow,['Clow (W. M.)'],,Nov. 16,net
"Clutterbuck (L. A., Col.), Dooner (W. T., Col.) and Denison (C. A., Commr.) eds.---The Bond of sacrifice: a biographical record of all British officers who fell in the Great War. Vol. 1, Aug.- Dec., 1914. II{ x 8, pp. 507, 31s. 60. ANGLO-AFRICAN PUB, CONTRACTORS, Oct. 16",,,The Bond of sacrifice: a biographical record of all British officers who fell in the Great War,"ANGLO-AFRICAN PUB, CONTRACTORS",,,"Clutterbuck (L. A., Col.), Dooner (W. T., Col.) and Denison (C. A., Commr.) eds.---The Bond of sacrifice: a biographical record of all British officers who fell in the Great War. Vol. 1, Aug.- Dec., 1914. II{ x 8, pp. 507, 315. 60. ANGLO-AFRICAN PUB, CONTRACTORS, Oct. 16",,"['Clutterbuck (L. A., Col.), Dooner (W. T., Col.)', 'Denison (C. A., Commr.)']",eds.,Oct. 16,
"Clutton-Brock (A.)--International life and the Kingdom of God. pp. 22, id. FRIENDS' PEACE COM., June 16",Clutton-Brock,A.,International life and the Kingdom of God,FRIENDS' PEACE COM.,,,"Clutton-Brock (A.)--International life and the Kingdom of God. pp. 22, id. FRIENDS' PEACE COM., June 16",A. Clutton-Brock,['Clutton-Brock (A.)'],,June 16,
"Clutton-Brock (A.)-A Modern creed of work, 8} x 55, pp. 18, 3d. (6, Queen Square, W.C.) DESIGN AND INDUSTRIES ASSN., Sep. 16",Clutton-Brock,A.,"A Modern creed of work, 8} x",DESIGN AND INDUSTRIES ASSN.,3d.,,"Clutton-Brock (A.)-A Modern creed of work, 8} x 55, pp. 18, 3d. (6, Queen Square, W.C.) DESIGN AND INDUSTRIES ASSN., Sep. 16",A. Clutton-Brock,['Clutton-Brock (A.)'],,Sep. 16,
"Coal Mines Act: Safety Lamps Order, May 15, 1916, 5d. · WYMAN, July 16",,,"Coal Mines Act: Safety Lamps Order, May",WYMAN,,,"Coal Mines Act: Safety Lamps Order, May 15, 1916, 5d. · WYMAN, July 16",,,,July 16,
"Coal (Output of)-Return showing estimated quantities raised in U.K. in quarters ended 31st Mar. and 30th June, 1916, comp. w. corres. periods, 1915 and 1914. fd. WYMAN, Sep. 16",Coal,Output of,Return showing estimated quantities raised in U.K. in quarters ended,WYMAN,,,"Coal (Output of)-Return showing estimated quantities raised in U.K. in quarters ended 31st Mar. and 30th June, 1916, comp. w. corres. periods, 1915 and 1914. fd. WYMAN, Sep. 16",Output of Coal,['Coal (Output of)'],,Sep. 16,
"Coal shipments-Tables rela. to, for 1914 and 191s. 2ļd. . WYMAN, July 16",,,Coal shipments-Tables rela,WYMAN,,,"Coal shipments-Tables rela. to, for 1914 and 1915. 2ļd. . WYMAN, July 16",,,,July 16,
"Cock (W. H.)-Love and cruelty. 78 x 51, pp 148, 2s. net R. SCOTT, Oct. 16",Cock,W. H.,Love and cruelty,R. SCOTT,2s.,,"Cock (W. H.)-Love and cruelty. 78 x 51, pp 148, 2s. net R. SCOTT, Oct. 16",W. H. Cock,['Cock (W. H.)'],,Oct. 16,net
"Collio (Sir John, Lt.-Col.) and Wightman (C. F., Maj.)-A Short course ou first-aid in accidents. 65 X 4, pp. 48, 3d. net......G. GILL, Sep. 16",Collio,"Sir John, Lt.-Col.",A Short course ou first-aid in accidents,G. GILL,3d.,,"Collio (Sir John, Lt.-Col.) and Wightman (C. F., Maj.)-A Short course ou first-aid in accidents. 65 X 4, pp. 48, 3d. net......G. GILL, Sep. 16","Sir John, Lt.-Col. Collio","['Collio (Sir John, Lt.-Col.)', 'Wightman (C. F., Maj.)']",,Sep. 16,net
"Coffman (L. D.) see Jessup (W. A.) and Coffman. Coghlan (P.)--The Passion and death of Jesus. 64 x 4, pp. 140, 2s, net .. WASHBOURNE, June 16",Coffman,L. D.,The Passion and death of Jesus,WASHBOURNE,2s.,,"Coffman (L. D.) see Jessup (W. A.) and Coffman. Coghlan (P.)--The Passion and death of Jesus. 64 x 4, pp. 140, 2s, net .. WASHBOURNE, June 16",L. D. Coffman,"['Coffman (L. D.)', 'Coghlan (P.)']",,June 16,net
"Colo (R. E. G.) ed.-Chapter Acts of the Cathedral Church of St. Mary of Lincoln. 103 x6, pp. 260, subscr. (Lincoln Record Soc.) MORTON, July 16",Colo,R. E. G.,Chapter Acts of the Cathedral Church of St,MORTON,,,"Colo (R. E. G.) ed.-Chapter Acts of the Cathedral Church of St. Mary of Lincoln. 103 x6, pp. 260, subscr. (Lincoln Record Soc.) MORTON, July 16",R. E. G. Colo,['Colo (R. E. G.)'],ed.,July 16,
"Coley (May)-Nature talks for primary workers. F'cap. Svo., 64 x 4, pp. 77, is. net ALLENSON, Nov. 16.",Coley,May,Nature talks for primary workers,ALLENSON,,,"Coley (May)-Nature talks for primary workers. F'cap. Svo., 64 x 4, pp. 77, is. net ALLENSON, Nov. 16.",May Coley,['Coley (May)'],,Nov. 16,
"Collins' Children's Annual. Fol. 111X9, pp. 192, 39. 6d. net.... COLLINS, Oct. 16",,,Collins' Children's Annual,COLLINS,6d.,,"Collins' Children's Annual. Fol. 111X9, pp. 192, 39. 6d. net.... COLLINS, Oct. 16",,,,Oct. 16,net
"Oompanies--24th Annual rpt. by Bd. of Trade. s. 2d. WYMAN, Jan. 16",,,Oompanies-,WYMAN,2d.,,"Oompanies--24th Annual rpt. by Bd. of Trade. IS. 2d. WYMAN, Jan. 16",,,,Jan. 16,
"Comrades-in-Armlets : humorous drawings. Fol. 123 x 91, pp. 32, is, net CHATTO & W., Nov. 16",,,Comrades-in-Armlets : humorous drawings,CHATTO & W.,,,"Comrades-in-Armlets : humorous drawings. Fol. 123 x 91, pp. 32, is, net CHATTO & W., Nov. 16",,,,Nov. 16,
"Confessions of a clergyman. 8 X 53, pp. 352, 6s. net MCBRIDE, N., Od. 16",,,Confessions of a clergyman,"MCBRIDE, N.",6s.,,"Confessions of a clergyman. 8 X 53, pp. 352, 6s. net MCBRIDE, N., Od. 16",,,,Od. 16,net
"Connolly (Dom R. Hugh)-- The so-called Egyptian Churcb Order and deriver documents. (Texts and Studies : Centrib. to Biblical and fatristic lit.) Deny Svo. 9 X54, pp. 212, 10s. 6d. net CAMB, UNIV. PR., Oct. 16",Connolly,Dom R. Hugh,The so-called Egyptian Churcb Order and deriver documents,"CAMB, UNIV. PR.",10s. 6d.,,"Connolly (Dom R. Hugh)-- The so-called Egyptian Churcb Order and deriver documents. (Texts and Studies : Centrib. to Biblical and fatristic lit.) Deny Svo. 9 X54, pp. 212, 105. 6d. net CAMB, UNIV. PR., Oct. 16",Dom R. Hugh Connolly,['Connolly (Dom R. Hugh)'],,Oct. 16,net
"Conrad (Joseph)-A Personal record. 18no. 6} X4*, pp. 285, 1s. 3d. net . . NELSON, Oct. 16",Conrad,Joseph,A Personal record,NELSON,1s. 3d.,,"Conrad (Joseph)-A Personal record. 18no. 6} X4*, pp. 285, Is. 3d. net . . NELSON, Oct. 16",Joseph Conrad,['Conrad (Joseph)'],,Oct. 16,net
"Consular reports--Bordeaux (map), itd. ; New Caledonia (map), itd.; Nagasaki (map), 2d. ; Oporto (map), 2d.; Cyclades (map), 24d. ; Saigon (map), 2d. ; Seistan and Kain (map), 2d.; Distr. of Portland (Oregon) (map), 5d.; Mengtzu (map), 1 d.; Boston (map), 4d.; Distr. of Baltimore (map), 3 d. ; Odessa (map), 5d.; Chefoo (map), itd.; Hankow (map): 20.; Society 1slands, id. .WYMAN, Jan. 16",Consular reports--Bordeaux,map,"New Caledonia (map), itd",WYMAN,,,"Consular reports--Bordeaux (map), itd. ; New Caledonia (map), itd.; Nagasaki (map), 2d. ; Oporto (map), 2d.; Cyclades (map), 24d. ; Saigon (map), 2d. ; Seistan and Kain (map), 2d.; Distr. of Portland (Oregon) (map), 5d.; Mengtzu (map), 1 d.; Boston (map), 4d.; Distr. of Baltimore (map), 3 d. ; Odessa (map), 5d.; Chefoo (map), itd.; Hankow (map): 20.; Society Islands, id. .WYMAN, Jan. 16",map Consular reports--Bordeaux,['Consular reports--Bordeaux (map)'],,Jan. 16,
"Consular reports-Porto Rico (map), 2d. ; Yoko- hama (map), 2fd.; Finland (map), 3d.; Savannah (map), 3d. ; Costa Rica (map), itd.; Bahrein 1slands, 2 d. ; Chiengmai (map), 2d. ; Lourenço Marques, &c., 3d. ; Tangier (map), 3}d.; Tachieulu, id. ; Corunna (Vigo) (map), . WYMAN, Feb. 16",Consular reports-Porto Rico,map,2d,WYMAN,,,"Consular reports-Porto Rico (map), 2d. ; Yoko- hama (map), 2fd.; Finland (map), 3d.; Savannah (map), 3d. ; Costa Rica (map), itd.; Bahrein Islands, 2 d. ; Chiengmai (map), 2d. ; Lourenço Marques, &c., 3d. ; Tangier (map), 3}d.; Tachieulu, id. ; Corunna (Vigo) (map), . WYMAN, Feb. 16",map Consular reports-Porto Rico,['Consular reports-Porto Rico (map)'],,Feb. 16,
"Consular reports--Pakhoi, Trade, 1914 (map), ifd.; Patras, Trade, 1914 (map), itd.; Per- nambuco, Trade, 1914 (map), 24d.; Farcë 1slands and Iceland, Trade, 1914, 2 d. WYMAN, Mar. 16",,,"Consular reports--Pakhoi, Trade",WYMAN,,,"Consular reports--Pakhoi, Trade, 1914 (map), ifd.; Patras, Trade, 1914 (map), itd.; Per- nambuco, Trade, 1914 (map), 24d.; Farcë Islands and Iceland, Trade, 1914, 2 d. WYMAN, Mar. 16",,,,Mar. 16,
"Conveyancer (The). Vol. 1, Dec., 1915, to May, 1916. 101 X 8, pp. 271, 18s. 6d. net. 1-lthr., 205, net.. ..SWEET & M., June 16",,,Conveyancer (The),SWEET & M.,,,"Conveyancer (The). Vol. 1, Dec., 1915, to May, 1916. 101 X 8, pp. 271, 18s. 6d. net. 1-lthr., 205, net.. ..SWEET & M., June 16",,,,June 16,
"Cook (Herbert) ed.-Cata. of the paintings at Doughty House, Richmond, and elsewhere, in coll. of Sir Frederick Cook. Vol. 3, English, French, early Flemish, German and Spanish Schools; and Addenda by M. W. Brockwell. 15 XII, pp. 222, 126s. net HEINEMANN, July 16",Cook,Herbert,Cata,HEINEMANN,126s.,,"Cook (Herbert) ed.-Cata. of the paintings at Doughty House, Richmond, and elsewhere, in coll. of Sir Frederick Cook. Vol. 3, English, French, early Flemish, German and Spanish Schools; and Addenda by M. W. Brockwell. 15 XII, pp. 222, 126s. net HEINEMANN, July 16",Herbert Cook,['Cook (Herbert)'],ed.,July 16,net
"Cook (Sir Theodore Andrea)—Twenty-five great houses of France. Intro. by W. H. Ward. Folio 16 XII, pp. 476, 428. net; } mor. 50s. net. (Country Lifelib.) .NEWNES, Nov. 16",Cook,Sir Theodore Andrea,Twenty-five great houses of France,NEWNES,,,"Cook (Sir Theodore Andrea)—Twenty-five great houses of France. Intro. by W. H. Ward. Folio 16 XII, pp. 476, 428. net; } mor. 50s. net. (Country Lifelib.) .NEWNES, Nov. 16",Sir Theodore Andrea Cook,['Cook (Sir Theodore Andrea)'],,Nov. 16,
"Cooke (Arthur 0.)-The Story of Lord Kitchener. 71 x 57, pp. 95, is. net. (Little stories of great lives). ..FROWDE, AND H. & S., Nov. 16",Cooke,Arthur 0.,The Story of Lord Kitchener,"FROWDE, AND H. & S.",,,"Cooke (Arthur 0.)-The Story of Lord Kitchener. 71 x 57, pp. 95, is. net. (Little stories of great lives). ..FROWDE, AND H. & S., Nov. 16",Arthur 0. Cooke,['Cooke (Arthur 0.)'],,Nov. 16,
"Cooko (W. Bourne)-The Fortune face. 71x5}, pp. 383, 3s, 6d. net. .NELSON, Dec. 16",Cooko,W. Bourne,The Fortune face,NELSON,3s. 6d.,,"Cooko (W. Bourne)-The Fortune face. 71x5}, pp. 383, 3s, 6d. net. .NELSON, Dec. 16",W. Bourne Cooko,['Cooko (W. Bourne)'],,Dec. 16,net
"Coomaraswamy (Ananda)-Rajput painting. vols. Fol. 15 x 11, 105s. net MILFORD, Jan. 16",Coomaraswamy,Ananda,Rajput painting,MILFORD,105s.,,"Coomaraswamy (Ananda)-Rajput painting. vols. Fol. 15 x 11, 105s. net MILFORD, Jan. 16",Ananda Coomaraswamy,['Coomaraswamy (Ananda)'],,Jan. 16,net
"Oooto (William Alexander) ed.--A Romance of philanthropy : being a record of some of the principal incidents connected with the ex- ceptionally successful thirty years' work of the National Vigilance Association. 71 x 44, pp. 255, 18. net .NAT. VIGILANCE ASSN., Nov. 16",Oooto,William Alexander,A Romance of philanthropy : being a record of some of the principal incidents connected with the ex- ceptionally successful thirty years' work of the National Vigilance Association,NAT. VIGILANCE ASSN.,,,"Oooto (William Alexander) ed.--A Romance of philanthropy : being a record of some of the principal incidents connected with the ex- ceptionally successful thirty years' work of the National Vigilance Association. 71 x 44, pp. 255, 18. net .NAT. VIGILANCE ASSN., Nov. 16",William Alexander Oooto,['Oooto (William Alexander)'],ed.,Nov. 16,
"Copeland (Fanny S.)-The Women of Serbia : a lecture. Pref. by Lady Ralph Paget. 87 x 5}, pp. 16, 6d. net. FAITH PR., Aug. 16",Copeland,Fanny S.,The Women of Serbia : a lecture,FAITH PR.,6d.,,"Copeland (Fanny S.)-The Women of Serbia : a lecture. Pref. by Lady Ralph Paget. 87 x 5}, pp. 16, 6d. net. FAITH PR., Aug. 16",Fanny S. Copeland,['Copeland (Fanny S.)'],,Aug. 16,net
"Copplestone (Bennet)- Jitny and the boys. pp. 313, 6s, . SMITH, E., May 16",Copplestone,Bennet,Jitny and the boys,"SMITH, E.",6s.,,"Copplestone (Bennet)- Jitny and the boys. pp. 313, 6s, . SMITH, E., May 16",Bennet Copplestone,['Copplestone (Bennet)'],,May 16,
"Corbet (Richard) — The Fairies' farewell. Decorated by C. Lovat Fraser. 51x2), pp. 8, 6d. net (46, Museum Street, W.C.) E. MEYNELL, Nov, 16",Corbet,Richard,The Fairies' farewell,E. MEYNELL,6d.,,"Corbet (Richard) — The Fairies' farewell. Decorated by C. Lovat Fraser. 51x2), pp. 8, 6d. net (46, Museum Street, W.C.) E. MEYNELL, Nov, 16",Richard Corbet,['Corbet (Richard)'],,"Nov, 16",net
"Corcoran (T.) ed. State policy in Irish education, A.D. 1536 to 1816 : exemplified in documents. 98 x6, pp. 235, 6s. net (Dublin) FALLON BROS. ; LONGMANS, Oct. 16",Corcoran,T.,"State policy in Irish education, A.D",LONGMANS,,,"Corcoran (T.) ed. State policy in Irish education, A.D. 1536 to 1816 : exemplified in documents. 98 x6, pp. 235, 6s. net (Dublin) FALLON BROS. ; LONGMANS, Oct. 16",T. Corcoran,['Corcoran (T.)'],ed.,Oct. 16,
"Cornish (J. B.) and Bridger (J. A. D.) eds.- Penzance and the Land's End district. Illus. pp. 128, 6d. net. (Homeland hdbks.) WARNE, Mar. 16",Cornish,J. B.,Penzance and the Land's End district,WARNE,,,"Cornish (J. B.) and Bridger (J. A. D.) eds.- Penzance and the Land's End district. Illus. pp. 128, 6d. net. (Homeland hdbks.) WARNE, Mar. 16",J. B. Cornish,"['Cornish (J. B.)', 'Bridger (J. A. D.)']",eds.,Mar. 16,
"Cottager and Artisan (The). Fol. 131 X 10, pp. 144, s. 6d. net .R.T.S., Sep. 16",,,Cottager and Artisan (The),R.T.S.,6d.,,"Cottager and Artisan (The). Fol. 131 X 10, pp. 144, IS. 6d. net .R.T.S., Sep. 16",,,,Sep. 16,net
"County Courts (Plaints and sittings) --Return for 191s. 2s. WYMAN, Aug. 16",County Courts,Plaints,Return for,WYMAN,2s.,,"County Courts (Plaints and sittings) --Return for 1915. 25. WYMAN, Aug. 16",Plaints County Courts,"['County Courts (Plaints)', 'County Courts (sittings)']",,Aug. 16,
"Coutts (John)-Homely thoughts on re-incar. nation in the light of the law of development. 71x41, pp. 64, 4d. (36, Hardy Terr., Wood Green, N.) G. LYAL, Sep. 16",Coutts,John,Homely thoughts on re-incar,G. LYAL,4d.,,"Coutts (John)-Homely thoughts on re-incar. nation in the light of the law of development. 71x41, pp. 64, 4d. (36, Hardy Terr., Wood Green, N.) G. LYAL, Sep. 16",John Coutts,['Coutts (John)'],,Sep. 16,
"Cowan (Amy B.) ed.-Schoolroom poetry. Bk. 1, 70x41, pp. 24, 3d. net STOCKWELL, June 16",Cowan,Amy B.,Schoolroom poetry,STOCKWELL,3d.,,"Cowan (Amy B.) ed.-Schoolroom poetry. Bk. 1, 70x41, pp. 24, 3d. net STOCKWELL, June 16",Amy B. Cowan,['Cowan (Amy B.)'],ed.,June 16,net
"Cowper (Frances M. M.)—Contemplations of the dread and love of God. Fr. MS. Harleian 2409 in the British Museum. pp. 180, is. net WASHBOURNE, Nov. 16",Cowper,Frances M. M.,Contemplations of the dread and love of God,WASHBOURNE,,,"Cowper (Frances M. M.)—Contemplations of the dread and love of God. Fr. MS. Harleian 2409 in the British Museum. pp. 180, is. net WASHBOURNE, Nov. 16",Frances M. M. Cowper,['Cowper (Frances M. M.)'],,Nov. 16,
"Cox (Edwin Marion)-Sappho and the Sapphic metre in English. W. bibliog. notes. pp. 24, is. net CHISWICK PR., June 16",Cox,Edwin Marion,Sappho and the Sapphic metre in English,CHISWICK PR.,,,"Cox (Edwin Marion)-Sappho and the Sapphic metre in English. W. bibliog. notes. pp. 24, is. net CHISWICK PR., June 16",Edwin Marion Cox,['Cox (Edwin Marion)'],,June 16,
"Craigio (J. K.)-Scottish selections from the Waverley novels.” 7X5, pp. 213, 1s. 6d. MILFORD, Aug. 16",Craigio,J. K.,Scottish selections from the Waverley novels,MILFORD,1s. 6d.,,"Craigio (J. K.)-Scottish selections from the Waverley novels.” 7X5, pp. 213, Is. 6d. MILFORD, Aug. 16",J. K. Craigio,['Craigio (J. K.)'],,Aug. 16,
"Crawford (D.)—The Way home from the Home- land. pp. 31, 6d. net ....OLIPHANTS, June 16",Crawford,D.,The Way home from the Home- land,OLIPHANTS,6d.,,"Crawford (D.)—The Way home from the Home- land. pp. 31, 6d. net ....OLIPHANTS, June 16",D. Crawford,['Crawford (D.)'],,June 16,net
"Cress well (Beatrix F.)--The Edwardian inven- tories for the City and County of Exeter. Transcribed fr. orig. docs. in the Guildhall, Exeter. 101 x64, pp. 106, 1os. net (Alcuin Club Coll.) MOWBRAY, Sep. 16",Cress well,Beatrix F.,The Edwardian inven- tories for the City and County of Exeter,MOWBRAY,,,"Cress well (Beatrix F.)--The Edwardian inven- tories for the City and County of Exeter. Transcribed fr. orig. docs. in the Guildhall, Exeter. 101 x64, pp. 106, 1os. net (Alcuin Club Coll.) MOWBRAY, Sep. 16",Beatrix F. Cress well,['Cress well (Beatrix F.)'],,Sep. 16,
"Crew (Albert)—Bribes and bribery in business. Cr. Svo. 71 x 41, pp. 100, limp is. net JORDAN, May 16",Crew,Albert,Bribes and bribery in business,JORDAN,,,"Crew (Albert)—Bribes and bribery in business. Cr. Svo. 71 x 41, pp. 100, limp is. net JORDAN, May 16",Albert Crew,['Crew (Albert)'],,May 16,
"Crimes of Germany (The). II X8, pp. 106, is. “ THE FIELD, Dec. 16",,,Crimes of Germany (The),THE FIELD,,,"Crimes of Germany (The). II X8, pp. 106, is. “ THE FIELD, Dec. 16",,,,Dec. 16,
"Criminal appeal reports : a digest. Vols. 1 and 2, by Edmund D. Purcell. 93 x6, pp. 152, 158. niet STEVENS & H., Oct. 16",,,Criminal appeal reports : a digest,STEVENS & H.,,,"Criminal appeal reports : a digest. Vols. 1 and 2, by Edmund D. Purcell. 93 x6, pp. 152, 158. niet STEVENS & H., Oct. 16",,,,Oct. 16,
"Cripps (Arthur Shearly) -A Martyr's heir : the tale of John Kent, A.D. 1563–1594. 61 X 4), pp. 184, 28. 6d. net DUCKWORTH, Oct. 16",Cripps,Arthur Shearly,"A Martyr's heir : the tale of John Kent, A.D",DUCKWORTH,6d.,,"Cripps (Arthur Shearly) -A Martyr's heir : the tale of John Kent, A.D. 1563–1594. 61 X 4), pp. 184, 28. 6d. net DUCKWORTH, Oct. 16",Arthur Shearly Cripps,['Cripps (Arthur Shearly)'],,Oct. 16,net
"Crosse (Gordon)-Some Protestant fallacies ex: posed. 81 x 54, pp. 28, 6d. net ENG. CHURCH UNION, June 16",Crosse,Gordon,Some Protestant fallacies ex: posed,ENG. CHURCH UNION,6d.,,"Crosse (Gordon)-Some Protestant fallacies ex: posed. 81 x 54, pp. 28, 6d. net ENG. CHURCH UNION, June 16",Gordon Crosse,['Crosse (Gordon)'],,June 16,net
"Crotch (W. Walter)—The Pageant of Dickens. 2nd and rev. ed.' 9X58, pp. 281, 5s, net CHAPMAN & H., July 16",Crotch,W. Walter,The Pageant of Dickens,CHAPMAN & H.,5s.,,"Crotch (W. Walter)—The Pageant of Dickens. 2nd and rev. ed.' 9X58, pp. 281, 5s, net CHAPMAN & H., July 16",W. Walter Crotch,['Crotch (W. Walter)'],,July 16,net
"Crown Agents for the Colonies Accounts of Office Funds for 191s. 11d. WYMAN, Aug. 16",,,Crown Agents for the Colonies Accounts of Office Funds for,WYMAN,191s. 11d.,,"Crown Agents for the Colonies Accounts of Office Funds for 1915. 11d. WYMAN, Aug. 16",,,,Aug. 16,
"Crown's Nominee account, 1915, d. WYMAN, June 16",,,Crown's Nominee account,WYMAN,,,"Crown's Nominee account, 1915, d. WYMAN, June 16",,,,June 16,
"Cunningham (W.)-British citizens and their responsibility to God : six sermons. 61 X4!, pp. 46, 6d. .S.P.C.K., Nov. 16",Cunningham,W.,British citizens and their responsibility to God : six sermons,S.P.C.K.,6d.,,"Cunningham (W.)-British citizens and their responsibility to God : six sermons. 61 X4!, pp. 46, 6d. .S.P.C.K., Nov. 16",W. Cunningham,['Cunningham (W.)'],,Nov. 16,
"Curious cases and amusing actions at law. 81 x 5 t, pp. 234, 4s. 6d. net Sweet & M., June 16",,,Curious cases and amusing actions at law,M.,,,"Curious cases and amusing actions at law. 81 x 5 t, pp. 234, 4s. 6d. net Sweet & M., June 16",,,,June 16,
"Currey. (E. Hamilton, Commr.)—Ian Hardy fighting the Moors. Er. Svo. 8 X 5), pp. 320, 5s. SEELEY, S., Sep. 16",Currey.,"E. Hamilton, Commr.",Ian Hardy fighting the Moors,"SEELEY, S.",5s.,,"Currey. (E. Hamilton, Commr.)—Ian Hardy fighting the Moors. Er. Svo. 8 X 5), pp. 320, 5s. SEELEY, S., Sep. 16","E. Hamilton, Commr. Currey.","['Currey. (E. Hamilton, Commr.)']",,Sep. 16,
"Curwood (James Oliver)--The Grizzly. 7* X 5, pp. 270, 6s. ..CASSELL, Oct. 16",Curwood,James Oliver,The Grizzly,CASSELL,6s.,,"Curwood (James Oliver)--The Grizzly. 7* X 5, pp. 270, 6s. ..CASSELL, Oct. 16",James Oliver Curwood,['Curwood (James Oliver)'],,Oct. 16,
"Customs and excise-6th Rpt. of the Commis- sioners, 1914-15, 9 d. ... ... WYMAN, July 16",,,Customs and excise,WYMAN,,,"Customs and excise-6th Rpt. of the Commis- sioners, 1914-15, 9 d. ... ... WYMAN, July 16",,,,July 16,
"Czarnomski (Francis Bauer)--Hill's Polish-English and E.-P. vest pocket dictionary, w. conversa- tions and idioms. 51 x 21, pp. 382, is. net. (Vest pocket series) .L. B. HILL, Oct. 16",Czarnomski,Francis Bauer,"Hill's Polish-English and E.-P. vest pocket dictionary, w",L. B. HILL,,,"Czarnomski (Francis Bauer)--Hill's Polish-English and E.-P. vest pocket dictionary, w. conversa- tions and idioms. 51 x 21, pp. 382, is. net. (Vest pocket series) .L. B. HILL, Oct. 16",Francis Bauer Czarnomski,['Czarnomski (Francis Bauer)'],,Oct. 16,
"D'Aeth (F. G.)--- Liverpool social workers' hibk. 2nd ed. rev. and enl. 7*X41, pp. 301, is. (Liverpool) GLEDSDALE & JENNINGS, May 16",D'Aeth,F. G.,Liverpool social workers' hibk,GLEDSDALE & JENNINGS,,,"D'Aeth (F. G.)--- Liverpool social workers' hibk. 2nd ed. rev. and enl. 7*X41, pp. 301, is. (Liverpool) GLEDSDALE & JENNINGS, May 16",F. G. D'Aeth,"[""D'Aeth (F. G.)""]",,May 16,
"Daily Telegraph War atlas. Folio, 94 x 15, pp. 16, paper is. net ; ed. de luxe, mounted on clo. GEOGRAPHIA, Aug. 16",,,Daily Telegraph War atlas,GEOGRAPHIA,,,"Daily Telegraph War atlas. Folio, 94 x 15, pp. 16, paper is. net ; ed. de luxe, mounted on clo. GEOGRAPHIA, Aug. 16",,,,Aug. 16,
"Daniell-Bainbridge (H. G.)-A National return to God: its basis and its conditions. 1&mo. 64 x 4, pp. 60, 6d. net ..REES, Aug. 16",Daniell-Bainbridge,H. G.,A National return to God: its basis and its conditions,REES,6d.,,"Daniell-Bainbridge (H. G.)-A National return to God: its basis and its conditions. 1&mo. 64 x 4, pp. 60, 6d. net ..REES, Aug. 16",H. G. Daniell-Bainbridge,['Daniell-Bainbridge (H. G.)'],,Aug. 16,net
"Davenport (James)--Notes on the Bishopric of Worcester, 1547-1559. 9X7, pp. 36, is, net (Worcester) E. G. HUMPHREYS, Sep. 16",Davenport,James,Notes on the Bishopric of Worcester,E. G. HUMPHREYS,,,"Davenport (James)--Notes on the Bishopric of Worcester, 1547-1559. 9X7, pp. 36, is, net (Worcester) E. G. HUMPHREYS, Sep. 16",James Davenport,['Davenport (James)'],,Sep. 16,
"David (A. A.)-Twelve short meditations for intercession services. 64 X5, pp. 31, 6d. net S.P.C.K., July 16",David,A. A.,Twelve short meditations for intercession services,S.P.C.K.,6d.,,"David (A. A.)-Twelve short meditations for intercession services. 64 X5, pp. 31, 6d. net S.P.C.K., July 16",A. A. David,['David (A. A.)'],,July 16,net
"Davidson (Randall T., Archbp. of Canterbury) - Redeeming the time : a sermon. 9} X 6, pp. 15, 6d. net .FAITH PR., Aug. 16",Davidson,"Randall T., Archbp. of Canterbury",Redeeming the time : a sermon,FAITH PR.,6d.,,"Davidson (Randall T., Archbp. of Canterbury) - Redeeming the time : a sermon. 9} X 6, pp. 15, 6d. net .FAITH PR., Aug. 16","Randall T., Archbp. of Canterbury Davidson","['Davidson (Randall T., Archbp. of Canterbury)']",,Aug. 16,net
