entry,last_name,first_name,title,publisher,price,format,original_entry,author_name,creators,is_editor,date,catalogue_year,is_net
"Churchill (Lida A.)—The Magic Seven. bds, 1s, net ..L. N. FOWLER, Jan. 08",Churchill,Lida A.,The Magic Seven,L. N. FOWLER,1s.,,"Churchill (Lida A.)—The Magic Seven. bds, Is, net ..L. N. FOWLER, Jan. 08",Lida A. Churchill,['Churchill (Lida A.)'],,Jan. 08,1908,net
"Civil Service and Revenue Appropriation Accounts, ...WYMAN, Feb. 08",,,"Civil Service and Revenue Appropriation Accounts, ",WYMAN,,,"Civil Service and Revenue Appropriation Accounts, ...WYMAN, Feb. 08",,,,Feb. 08,1908,
"Civil Service Commission: Abstract of Rules and Regulations re Examinations, is. WYMAN, April 08",,,"Civil Service Commission: Abstract of Rules and Regulations re Examinations, is",WYMAN,,,"Civil Service Commission: Abstract of Rules and Regulations re Examinations, is. WYMAN, April 08",,,,April 08,1908,
"Civil Service Estimates—Class 1, Public Works and Buildings, 7 d. ; 2, Salaries and Expenses of Departments, is. 30.; 3, Law and Justice, s. id. ; 4, Education, Science and Art, 6 d.; 5, Foreign and Colonial Services, 5 d. ; 6, Non- Effective and Charitable Services, 4d.; 7, Miscellaneous, 24d...........WYMAN, Mar. 08",,,"Civil Service Estimates—Class 1, Public Works and Buildings",WYMAN,24d.,,"Civil Service Estimates—Class 1, Public Works and Buildings, 7 d. ; 2, Salaries and Expenses of Departments, is. 30.; 3, Law and Justice, IS. id. ; 4, Education, Science and Art, 6 d.; 5, Foreign and Colonial Services, 5 d. ; 6, Non- Effective and Charitable Services, 4d.; 7, Miscellaneous, 24d...........WYMAN, Mar. 08",,,,Mar. 08,1908,
"Civil Service-52nd Report of H.M. Commis- sioners, with Appendices, 3 d. WYMAN, July 08",,,Civil Service,WYMAN,,,"Civil Service-52nd Report of H.M. Commis- sioners, with Appendices, 3 d. WYMAN, July 08",,,,July 08,1908,
"Civil Service-Rules and Regulations for Exami- nations, is. .WYMAN, Nov. 08",,,"Civil Service-Rules and Regulations for Exami- nations, is",WYMAN,,,"Civil Service-Rules and Regulations for Exami- nations, is. .WYMAN, Nov. 08",,,,Nov. 08,1908,
"Civil Service Year Book and Official Calendar (The) 1908. Cr. Svo, sud. 2s. SHEPPARD, Feb. 08",,,Civil Service Year Book and Official Calendar (The),SHEPPARD,2s.,,"Civil Service Year Book and Official Calendar (The) 1908. Cr. Svo, sud. 2s. SHEPPARD, Feb. 08",,,,Feb. 08,1908,
"Clare (John)—Poems. Edit. with an Intro. by Arthur Symons. 7X45, pp. 208, 2s. 6d, net.. .FROWDE, Nov. 08",Clare,John,Poems,FROWDE,2s. 6d.,,"Clare (John)—Poems. Edit. with an Intro. by Arthur Symons. 7X45, pp. 208, 2s. 6d, net.. .FROWDE, Nov. 08",John Clare,['Clare (John)'],,Nov. 08,1908,net
"Clarke (M. Cowden)- Shakespeare Proverbs. Edit. by W. J. Rolfe. Cr. Svo. 6s. net PUTNAM, Nov. 08",Clarke,M. Cowden,Shakespeare Proverbs,PUTNAM,6s.,,"Clarke (M. Cowden)- Shakespeare Proverbs. Edit. by W. J. Rolfe. Cr. Svo. 6s. net PUTNAM, Nov. 08",M. Cowden Clarke,['Clarke (M. Cowden)'],,Nov. 08,1908,net
"Clarke (Marcus)— For the Term of his Natural Life. Svo. swd. 6d.....MACMILLAN, Dec. 08",Clarke,Marcus,For the Term of his Natural Life,MACMILLAN,6d.,,"Clarke (Marcus)— For the Term of his Natural Life. Svo. swd. 6d.....MACMILLAN, Dec. 08",Marcus Clarke,['Clarke (Marcus)'],,Dec. 08,1908,
"Clarke (Sidney W.)-The Law of Small Holdings in England and Wales. Clarke (W.)-Writings : A Collection, with a Biographical Sketch. Svo. 8* *5), pp. 450, SONNENSCHEIN, Jan, 08",Clarke,Sidney W.,The Law of Small Holdings in England and Wales,SONNENSCHEIN,,,"Clarke (Sidney W.)-The Law of Small Holdings in England and Wales. Clarke (W.)-Writings : A Collection, with a Biographical Sketch. Svo. 8* *5), pp. 450, SONNENSCHEIN, Jan, 08",Sidney W. Clarke,['Clarke (Sidney W.)'],,"Jan, 08",1908,
"Clarke (W. E.)—Why! Two hundred every-day Facts and Phenomena popularly and scienti- fically explained. Cr. Svo. sud. is. net (Normal Tutorial Ser.) .SIMPKIN, Jan, 08",Clarke,W. E.,Why! Two hundred every-day Facts and Phenomena popularly and scienti- fically explained,SIMPKIN,,,"Clarke (W. E.)—Why! Two hundred every-day Facts and Phenomena popularly and scienti- fically explained. Cr. Svo. sud. is. net (Normal Tutorial Ser.) .SIMPKIN, Jan, 08",W. E. Clarke,['Clarke (W. E.)'],,"Jan, 08",1908,
"Cleeve (I.ucas)—The Real Christian. Svo. swd. 6d. .T. S. CLARK, July 08",Cleeve,I.ucas,The Real Christian,T. S. CLARK,6d.,,"Cleeve (I.ucas)—The Real Christian. Svo. swd. 6d. .T. S. CLARK, July 08",I.ucas Cleeve,['Cleeve (I.ucas)'],,July 08,1908,
"Close Rolls, Calendar of, Edward I. (1302–1307). 15s. . WYMAN, Aug. 08",,,"Close Rolls, Calendar of, Edward I. ",WYMAN,15s.,,"Close Rolls, Calendar of, Edward I. (1302–1307). 155. . WYMAN, Aug. 08",,,,Aug. 08,1908,
"Coal Exports Return, 4d.. ...WYMAN, April 08",,,Coal Exports Return,WYMAN,4d.,,"Coal Exports Return, 4d.. ...WYMAN, April 08",,,,April 08,1908,
"Coast Guard, Inter-Departmental Conference on the, 1907-Report. is. {d. .. WYMAN, May 08",,,"Coast Guard, Inter-Departmental Conference on the",WYMAN,,,"Coast Guard, Inter-Departmental Conference on the, 1907-Report. is. {d. .. WYMAN, May 08",,,,May 08,1908,
"Coleman (G, S.)-Reinforced Concrete, Diagrams for the Calculation of Beams, Slabs, and Columns in Reinforced Concrete. Fol. 3s. 6d. net ...LOCKWOOD, Aug. 08",Coleman,"G, S.","Reinforced Concrete, Diagrams for the Calculation of Beams, Slabs, and Columns in Reinforced Concrete",LOCKWOOD,3s. 6d.,,"Coleman (G, S.)-Reinforced Concrete, Diagrams for the Calculation of Beams, Slabs, and Columns in Reinforced Concrete. Fol. 3s. 6d. net ...LOCKWOOD, Aug. 08","G, S. Coleman","['Coleman (G, S.)']",,Aug. 08,1908,net
"College of Preceptors. The Calendar 1908. Svo. 29. 60. F. HODGSON, April 08",,,College of Preceptors,F. HODGSON,,,"College of Preceptors. The Calendar 1908. Svo. 29. 60. F. HODGSON, April 08",,,,April 08,1908,
"Collieries-Report on Explosions at Benwell and Whitehaven, 1s. 1d. ...... WYMAN, July 08",,,Collieries-Report on Explosions at Benwell and Whitehaven,WYMAN,1s. 1d.,,"Collieries-Report on Explosions at Benwell and Whitehaven, Is. Id. ...... WYMAN, July 08",,,,July 08,1908,
"Collingwood (W. G1-Scandinavian Britain. 12mo. 64 X43, pp. 272, 3s. 6d. (Early Britain) S.P.C.K., Oct. 08",Collingwood,"W. G1-Scandinavian Britain. 12mo. 64 X43, pp. 272, 3s. 6d. (Early Britain",,S.P.C.K.,,,"Collingwood (W. G1-Scandinavian Britain. 12mo. 64 X43, pp. 272, 35. 6d. (Early Britain) S.P.C.K., Oct. 08","W. G1-Scandinavian Britain. 12mo. 64 X43, pp. 272, 3s. 6d. (Early Britain Collingwood","['Collingwood (W. G1-Scandinavian Britain. 12mo. 64 X43, pp. 272, 3s. 6d. (Early Britain)']",,Oct. 08,1908,
"Collins (Wilkie)—The Woman in White. 12nio. 7d. net ...J. LENG, J uly 08",Collins,Wilkie,The Woman in White,J. LENG,7d.,,"Collins (Wilkie)—The Woman in White. 12nio. 7d. net ...J. LENG, J uly 08",Wilkie Collins,['Collins (Wilkie)'],,J uly 08,1908,net
"N Colombia, Trade of, 1907. Consular Rept. WYMAN, Feb. 08",,,"N Colombia, Trade of",WYMAN,,,"N Colombia, Trade of, 1907. Consular Rept. WYMAN, Feb. 08",,,,Feb. 08,1908,
"Colonial Service, H.M., Regulations, is. WYMAN, July 08",,,"Colonial Service, H.M., Regulations, is",WYMAN,,,"Colonial Service, H.M., Regulations, is. WYMAN, July 08",,,,July 08,1908,
"Colonies (British) Handbooks on, 2s. WYMAN, Sep. 08",Colonies,British,Handbooks on,WYMAN,2s.,,"Colonies (British) Handbooks on, 2s. WYMAN, Sep. 08",British Colonies,['Colonies (British)'],,Sep. 08,1908,
"Colonies, Possessions, and Protectorates, Britisı. Statistical Abstract for 1892-1906, s d. WYMAY, Jan. 08",,,"Colonies, Possessions, and Protectorates, Britisı",WYMAY,,,"Colonies, Possessions, and Protectorates, Britisı. Statistical Abstract for 1892-1906, IS d. WYMAY, Jan. 08",,,,Jan. 08,1908,
"Commerce and Navigation between Great Britain and Foreign Powers, Handbook of Treaties, &c., relating to, ios.........WYMAN, Feb. 08",,,"Commerce and Navigation between Great Britain and Foreign Powers, Handbook of Treaties, &c",WYMAN,,,"Commerce and Navigation between Great Britain and Foreign Powers, Handbook of Treaties, &c., relating to, ios.........WYMAN, Feb. 08",,,,Feb. 08,1908,
"Commercial Treaties in force on January ist. 5}d. WYMAN, June 08",,,Commercial Treaties in force on January ist,WYMAN,,,"Commercial Treaties in force on January ist. 5}d. WYMAN, June 08",,,,June 08,1908,
"Commons, House of-Manual of Procedure in the Public Business, 1908, 3s. 6d. WYMAN, April 08",,,"Commons, House of-Manual of Procedure in the Public Business",WYMAN,3s. 6d.,,"Commons, House of-Manual of Procedure in the Public Business, 1908, 3s. 6d. WYMAN, April 08",,,,April 08,1908,
"Companles-17th General Annual Report by the Board of Trade, is. 1d...... WYMAN, Aug. 08",,,Companles,WYMAN,1d.,,"Companles-17th General Annual Report by the Board of Trade, is. Id...... WYMAN, Aug. 08",,,,Aug. 08,1908,
"Compensation for Industrial Diseases Committee : Minutes of Evidence of and Report, 7 d. WYMAN, Nov. 08",,,Compensation for Industrial Diseases Committee : Minutes of Evidence of and Report,WYMAN,,,"Compensation for Industrial Diseases Committee : Minutes of Evidence of and Report, 7 d. WYMAN, Nov. 08",,,,Nov. 08,1908,
"Confessio Medici. By the Writer of The Young People. Svo. 81 x 54, pp. 170, 3s. 6d. net MACMILLAN, Feb. 08",,,Confessio Medici,MACMILLAN,3s. 6d.,,"Confessio Medici. By the Writer of The Young People. Svo. 81 x 54, pp. 170, 35. 6d. net MACMILLAN, Feb. 08",,,,Feb. 08,1908,net
"Congo-Further Correspondence, 64d. WYMAN, Feb. 08",,,Congo-Further Correspondence,WYMAN,64d.,,"Congo-Further Correspondence, 64d. WYMAN, Feb. 08",,,,Feb. 08,1908,
"Congo State: Further Correspondence respecting the Taxation of Natives and other Questions, 2d. WYMAN, Aug. 08",,,Congo State: Further Correspondence respecting the Taxation of Natives and other Questions,WYMAN,2d.,,"Congo State: Further Correspondence respecting the Taxation of Natives and other Questions, 2d. WYMAN, Aug. 08",,,,Aug. 08,1908,
"Constantinople, Consular Report, 2fd. WYMAN, June 08",,,"Constantinople, Consular Report",WYMAN,,,"Constantinople, Consular Report, 2fd. WYMAN, June 08",,,,June 08,1908,
"Consular Reports, Index to. s. 2d. WYMAN, Feb, 08",,,"Consular Reports, Index to",WYMAN,2d.,,"Consular Reports, Index to. IS. 2d. WYMAN, Feb, 08",,,,"Feb, 08",1908,
"Consumption, Report on Sanitoria for, and certain other aspects of the Tuberculosis Question, by Dr. Bulstrode, ros. 2d. ....WYMAN, Jan. 08",,,"Consumption, Report on Sanitoria for, and certain other aspects of the Tuberculosis Question, by Dr",WYMAN,2d.,,"Consumption, Report on Sanitoria for, and certain other aspects of the Tuberculosis Question, by Dr. Bulstrode, ros. 2d. ....WYMAN, Jan. 08",,,,Jan. 08,1908,
"Consumption (Sanatoria for) and Certain Other Aspects of the Tuberculosis Question : Report by Dr. Bulstrode, 5s. WYMAN, Aug. 08",Consumption,Sanatoria for,Certain Other Aspects of the Tuberculosis Question : Report by Dr,WYMAN,5s.,,"Consumption (Sanatoria for) and Certain Other Aspects of the Tuberculosis Question : Report by Dr. Bulstrode, 5s. WYMAN, Aug. 08",Sanatoria for Consumption,['Consumption (Sanatoria for)'],,Aug. 08,1908,
"Contour Charts, Aid for Reading Ordnance Survey Maps. Sheets 1 and 2. On canvas and rollers, ea. 58. net BELL, June 08",,,"Contour Charts, Aid for Reading Ordnance Survey Maps",BELL,,,"Contour Charts, Aid for Reading Ordnance Survey Maps. Sheets 1 and 2. On canvas and rollers, ea. 58. net BELL, June 08",,,,June 08,1908,
" Contour Road Book of Ireland (The). From special surveys, by Harry R. G. Inglis. Tamo., pp. 288, 28. net. GALL & I., Sep. 08",,,Contour Road Book of Ireland (The),GALL & I.,,," Contour Road Book of Ireland (The). From special surveys, by Harry R. G. Inglis. Tamo., pp. 288, 28. net. GALL & I., Sep. 08",,,,Sep. 08,1908,
"Copping (Harold)— The Gospel in the Old Testa- ment: a series of pictures by H. C. ; with descriptive letterpress by Handley C. G. Moule, Bishop of Durham. Folio 16} X 12, pp. 58 and plates, 16s. net ..R.T.S., Dec. 08",Copping,Harold,"The Gospel in the Old Testa- ment: a series of pictures by H. C. ; with descriptive letterpress by Handley C. G. Moule, Bishop of Durham",R.T.S.,16s.,,"Copping (Harold)— The Gospel in the Old Testa- ment: a series of pictures by H. C. ; with descriptive letterpress by Handley C. G. Moule, Bishop of Durham. Folio 16} X 12, pp. 58 and plates, 16s. net ..R.T.S., Dec. 08",Harold Copping,['Copping (Harold)'],,Dec. 08,1908,net
"Corfu, Consular Report, Ifd. WYMAN, June 08",,,"Corfu, Consular Report, Ifd",WYMAN,,,"Corfu, Consular Report, Ifd. WYMAN, June 08",,,,June 08,1908,
"Correggio-Masterpieces. 1smo. swd. 6d. net GOWANS & G., June 08",,,Correggio-Masterpieces,GOWANS & G.,6d.,,"Correggio-Masterpieces. Ismo. swd. 6d. net GOWANS & G., June 08",,,,June 08,1908,net
"Couch (A. T. Quiller-;.(Q)-Hetty Wesley. Cheap edit. with special pref. 12m0., pp. 278, s. net ARROWSMITH, Oct, 08",Couch,A. T. Quiller-;.(Q,Hetty Wesley,ARROWSMITH,,,"Couch (A. T. Quiller-;.(Q)-Hetty Wesley. Cheap edit. with special pref. 12m0., pp. 278, IS. net ARROWSMITH, Oct, 08",A. T. Quiller-;.(Q Couch,['Couch (A. T. Quiller-;.(Q)'],,"Oct, 08",1908,
"Classics) ..FROWDE, Jan. 08",,,Classics) ,FROWDE,,,"Classics) ..FROWDE, Jan. 08",,,,Jan. 08,1908,
"Dogs. Illus. Imp: 410. 15 XII, pp. 270, 63s. net .. L'ANCETT, MCQUIRE, Dec. 08",,,Dogs,"L'ANCETT, MCQUIRE",63s.,,"Dogs. Illus. Imp: 410. 15 XII, pp. 270, 635. net .. L'ANCETT, MCQUIRE, Dec. 08",,,,Dec. 08,1908,net
"Courtney (William Prideaux)--The Secrets of our GRIFFIN, Oct. 08",Courtney,William Prideaux,,GRIFFIN,,,"Courtney (William Prideaux)--The Secrets of our GRIFFIN, Oct. 08",William Prideaux Courtney,['Courtney (William Prideaux)'],,Oct. 08,1908,
"Cracknell (4. G.) Workman (W. P.) Geometry. .MACMILLAN, Oct. 08",Cracknell,4. G.,Workman (W. P.) Geometry,MACMILLAN,,,"Cracknell (4. G.) Workman (W. P.) Geometry. .MACMILLAN, Oct. 08",4. G. Cracknell,['Cracknell (4. G.)'],,Oct. 08,1908,
"Crescent and the Cross, Warburton (E.) 2s. 6d. pp. 436, is. net ........MACMILLAN, Oct. 08",,,"Crescent and the Cross, Warburton (E.)",MACMILLAN,,,"Crescent and the Cross, Warburton (E.) 25. 6d. pp. 436, is. net ........MACMILLAN, Oct. 08",,,,Oct. 08,1908,
"Crake (E. E.) The Royalist Brothers : a Tale of Crete, Trade of, 1907, 4 d. WYMAN, July 08",Crake,E. E.,"The Royalist Brothers : a Tale of Crete, Trade of",WYMAN,,,"Crake (E. E.) The Royalist Brothers : a Tale of Crete, Trade of, 1907, 4 d. WYMAN, July 08",E. E. Crake,['Crake (E. E.)'],,July 08,1908,
"Criminal Statistics, 1906, with diagrams, 2s. 3d. WYMAN, Feb. 08",,,Criminal Statistics,WYMAN,2s. 3d.,,"Criminal Statistics, 1906, with diagrams, 2s. 3d. WYMAN, Feb. 08",,,,Feb. 08,1908,
"Crisp (F. A.).-A Catalogue of Lowestoft China in the Possession of Frederick A. Crisp, with Plates in Colour. 4t0. 10 X 13 (sub.) 21s. (270, Walworth Rd.) GROVE PARK PRESS, Jan. 08",Crisp,F. A.,"A Catalogue of Lowestoft China in the Possession of Frederick A. Crisp, with Plates in Colour",GROVE PARK PRESS,21s.,,"Crisp (F. A.).-A Catalogue of Lowestoft China in the Possession of Frederick A. Crisp, with Plates in Colour. 4t0. 10 X 13 (sub.) 21S. (270, Walworth Rd.) GROVE PARK PRESS, Jan. 08",F. A. Crisp,['Crisp (F. A.)'],,Jan. 08,1908,
"Crockett (S. R.)-Lad's Love. Svo. swd. 6d. HODDER & S., April 08",Crockett,S. R.,Lad's Love,HODDER & S.,6d.,,"Crockett (S. R.)-Lad's Love. Svo. swd. 6d. HODDER & S., April 08",S. R. Crockett,['Crockett (S. R.)'],,April 08,1908,
"Croker (B. M.)— The Happy Valley. 12 mo., 7d. net ..W. COLLINS, Jan. 08",Croker,B. M.,The Happy Valley,W. COLLINS,7d.,,"Croker (B. M.)— The Happy Valley. 12 mo., 7d. net ..W. COLLINS, Jan. 08",B. M. Croker,['Croker (B. M.)'],,Jan. 08,1908,net
"Cross (A. W. S.) and Munby (A. E.)--Practical Notes for Architectural Draughtsmen. In port- folio, 1żs. net .. TECHNICAL JOURNALS, Feb. 08",Cross,A. W. S.,Practical Notes for Architectural Draughtsmen,TECHNICAL JOURNALS,,,"Cross (A. W. S.) and Munby (A. E.)--Practical Notes for Architectural Draughtsmen. In port- folio, 1żs. net .. TECHNICAL JOURNALS, Feb. 08",A. W. S. Cross,"['Cross (A. W. S.)', 'Munby (A. E.)']",,Feb. 08,1908,
"Crown Jewels Commission (Ireland) : Minutes of Evidence, 8£d. WYMAN, Feb. 08",Crown Jewels Commission,Ireland,"Minutes of Evidence, 8£d",WYMAN,,,"Crown Jewels Commission (Ireland) : Minutes of Evidence, 8£d. WYMAN, Feb. 08",Ireland Crown Jewels Commission,['Crown Jewels Commission (Ireland)'],,Feb. 08,1908,
"Cruickshank (A. H.)–Fair Copies. Svo. 71 x 5, bds., pp. 78, 2s. 6d. net B. H. BLACKWELL, Oct. 08",Cruickshank,A. H.,Fair Copies,B. H. BLACKWELL,2s. 6d.,,"Cruickshank (A. H.)–Fair Copies. Svo. 71 x 5, bds., pp. 78, 2s. 6d. net B. H. BLACKWELL, Oct. 08",A. H. Cruickshank,['Cruickshank (A. H.)'],,Oct. 08,1908,net
"Cyprus-Hig Commissioner's Report for 1907-8, 4d. WYMAN, Sep. 08",,,Cyprus-Hig Commissioner's Report for,WYMAN,4d.,,"Cyprus-Hig Commissioner's Report for 1907-8, 4d. WYMAN, Sep. 08",,,,Sep. 08,1908,
"Dawson (L. H.)--A Book of the Saints. Ithr. is. net (Miniature Reference Lib.) ROUTLEDGE, Jan, 08",Dawson,L. H.,A Book of the Saints,ROUTLEDGE,,,"Dawson (L. H.)--A Book of the Saints. Ithr. is. net (Miniature Reference Lib.) ROUTLEDGE, Jan, 08",L. H. Dawson,['Dawson (L. H.)'],,"Jan, 08",1908,
"Day at the Zoo (A)— With illus. in Black and White and Folding Coloured Cages. Folio bds. 28. ..S.P.C.K., Oct. 08",,,Day at the Zoo (A)— With illus,S.P.C.K.,,,"Day at the Zoo (A)— With illus. in Black and White and Folding Coloured Cages. Folio bds. 28. ..S.P.C.K., Oct. 08",,,,Oct. 08,1908,
"Day Dreams of Greece, Stork (C. W.) is, net OFFICE, Dec. 08",,,,OFFICE,,,"Day Dreams of Greece, Stork (C. W.) is, net OFFICE, Dec. 08",,,,Dec. 08,1908,
"Daylight Saving Bill : Select Committee, Report, Proceedings, Evidence and Appendix, is. 6d. WYMAN, Aug. 08",,,"Daylight Saving Bill : Select Committee, Report, Proceedings, Evidence and Appendix, is",WYMAN,6d.,,"Daylight Saving Bill : Select Committee, Report, Proceedings, Evidence and Appendix, is. 6d. WYMAN, Aug. 08",,,,Aug. 08,1908,
"Denmark, Consular Report, 21d... WYMAN, Sep. 08",,,"Denmark, Consular Report",WYMAN,21d.,,"Denmark, Consular Report, 21d... WYMAN, Sep. 08",,,,Sep. 08,1908,
"Dickens (Charles)-Little Dorrit. 12m0., pp. 798, is, net, Ithr. 2s. net (Everyman's Lib.) DENT, Feb. 08",Dickens,Charles,Little Dorrit,DENT,2s.,,"Dickens (Charles)-Little Dorrit. 12m0., pp. 798, is, net, Ithr. 25. net (Everyman's Lib.) DENT, Feb. 08",Charles Dickens,['Dickens (Charles)'],,Feb. 08,1908,net
"Dickinson (B. B.) and Andrews (A. W.)-Mac millan's Orographical Map of Europe. Cloth mounted on rollers and varnished, 15s. net MACMILLAN, June 08",Dickinson,B. B.,Mac millan's Orographical Map of Europe,MACMILLAN,15s.,,"Dickinson (B. B.) and Andrews (A. W.)-Mac millan's Orographical Map of Europe. Cloth mounted on rollers and varnished, 155. net MACMILLAN, June 08",B. B. Dickinson,"['Dickinson (B. B.)', 'Andrews (A. W.)']",,June 08,1908,net
"Diehl (Alice M.)-Her Ladyship of the Season. Cr. Svo. 73 X 5, pp. 316, 6s. . . LONG, April 08",Diehl,Alice M.,Her Ladyship of the Season,LONG,6s.,,"Diehl (Alice M.)-Her Ladyship of the Season. Cr. Svo. 73 X 5, pp. 316, 6s. . . LONG, April 08",Alice M. Diehl,['Diehl (Alice M.)'],,April 08,1908,
"Diseases, Dangerous and Unhealthy : Regulations and Special Rules in Force, January, 1908, 6d. WYMAN, Jan. 08",,,"Diseases, Dangerous and Unhealthy : Regulations and Special Rules in Force, January",WYMAN,6d.,,"Diseases, Dangerous and Unhealthy : Regulations and Special Rules in Force, January, 1908, 6d. WYMAN, Jan. 08",,,,Jan. 08,1908,
"Disney (Henry W.). -The Elements of Commercial Law. Cr. Svo. 7° X41, pp. 220, 2s. 6d. MACDONALD & EVANS, Oct. 08",Disney,Henry W.,The Elements of Commercial Law,MACDONALD & EVANS,2s. 6d.,,"Disney (Henry W.). -The Elements of Commercial Law. Cr. Svo. 7° X41, pp. 220, 25. 6d. MACDONALD & EVANS, Oct. 08",Henry W. Disney,['Disney (Henry W.)'],,Oct. 08,1908,
"Diving, Deep Water, Report of Committee upon the Effects of. Illus., is. .WYMAN, Feb. 08",,,"Diving, Deep Water, Report of Committee upon the Effects of",WYMAN,,,"Diving, Deep Water, Report of Committee upon the Effects of. Illus., is. .WYMAN, Feb. 08",,,,Feb. 08,1908,
"Drainage Manual. Rev. Edit., 2s. 6d. WYMAN, Mar. 08",,,Drainage Manual,WYMAN,2s. 6d.,,"Drainage Manual. Rev. Edit., 25. 6d. WYMAN, Mar. 08",,,,Mar. 08,1908,
"Dreyer (J. L. E.)-Second Index Catalogue of Nebulæ and Clusters of Stars : containing objects found in the years 1895-1907, with Notes and Corrections to the New General Catalogue and to the Index Catalogue for 1888-94. 8s. (Memoirs of the Roy. Astro- nomical Soc., Vol. 59, Pt. 2) WILLIAMS & N., Dec. 08",Dreyer,J. L. E.,Second Index Catalogue of Nebulæ and Clusters of Stars : containing objects found in the years,WILLIAMS & N.,8s.,,"Dreyer (J. L. E.)-Second Index Catalogue of Nebulæ and Clusters of Stars : containing objects found in the years 1895-1907, with Notes and Corrections to the New General Catalogue and to the Index Catalogue for 1888-94. 8s. (Memoirs of the Roy. Astro- nomical Soc., Vol. 59, Pt. 2) WILLIAMS & N., Dec. 08",J. L. E. Dreyer,['Dreyer (J. L. E.)'],,Dec. 08,1908,
"Drill and March Music. 410. swd. is. net CASSELL, Feb. 08",,,Drill and March Music,CASSELL,,,"Drill and March Music. 410. swd. is. net CASSELL, Feb. 08",,,,Feb. 08,1908,
"Dryden (John)-Essays on the Drama. 2s. (English Reading Ser.) ....BELL, July 08",Dryden,John,Essays on the Drama,BELL,2s.,,"Dryden (John)-Essays on the Drama. 25. (English Reading Ser.) ....BELL, July 08",John Dryden,['Dryden (John)'],,July 08,1908,
"Didden (F. H.)-In Christ's Name. Four Addresses delivered to Candidates for Ordina- tion in the Chapel of Fulham Palace, Advent, 1907. Svo. 9 X 51, pp. 82, 2s. net LONGMANS, Feb. 08",Didden,F. H.,In Christ's Name,LONGMANS,2s.,,"Didden (F. H.)-In Christ's Name. Four Addresses delivered to Candidates for Ordina- tion in the Chapel of Fulham Palace, Advent, 1907. Svo. 9 X 51, pp. 82, 2s. net LONGMANS, Feb. 08",F. H. Didden,['Didden (F. H.)'],,Feb. 08,1908,net
"Dudley (Rosetta)—The Emerald Cross. Cr. Svo 74X41, pp. 374, 6s.... DRAVE, Jan. 08",Dudley,Rosetta,The Emerald Cross,DRAVE,6s.,,"Dudley (Rosetta)—The Emerald Cross. Cr. Svo 74X41, pp. 374, 65.... DRAVE, Jan. 08",Rosetta Dudley,['Dudley (Rosetta)'],,Jan. 08,1908,
"Duff (Col. Mildred)— Toddlers. Illus. II X81, pp. 78, 2s. ; swd is. SALVATION ARMY, Jan. 08",Duff,Col. Mildred,Toddlers,SALVATION ARMY,,,"Duff (Col. Mildred)— Toddlers. Illus. II X81, pp. 78, 25. ; swd is. SALVATION ARMY, Jan. 08",Col. Mildred Duff,['Duff (Col. Mildred)'],,Jan. 08,1908,
"Duffield (W.G.)-The Effect of Pressure upon Arc Spectra No. 2. Copper, h4000 to h 4600. 4t0., 2 plates, swd. 28. net......DULAU, Dec. 08",Duffield,W.G.,The Effect of Pressure upon Arc Spectra,DULAU,,,"Duffield (W.G.)-The Effect of Pressure upon Arc Spectra No. 2. Copper, h4000 to h 4600. 4t0., 2 plates, swd. 28. net......DULAU, Dec. 08",W.G. Duffield,['Duffield (W.G.)'],,Dec. 08,1908,
"Dumas (Alexandre, fils)--The Lady with the Camelias. 1210., pp. 258, is. net (Sisley Books) SISLEY, Jan. 08",Dumas,"Alexandre, fils",The Lady with the Camelias,SISLEY,,,"Dumas (Alexandre, fils)--The Lady with the Camelias. 1210., pp. 258, is. net (Sisley Books) SISLEY, Jan. 08","Alexandre, fils Dumas","['Dumas (Alexandre, fils)']",,Jan. 08,1908,
"Dundonald (Earl of)--The Autobiography of a Seaman New edit. Imp. 16ino. 8 X 58, pp. 366, 28, 6d..... MACLAREN, Dec. 08",Dundonald,Earl of,The Autobiography of a Seaman New edit,MACLAREN,6d.,,"Dundonald (Earl of)--The Autobiography of a Seaman New edit. Imp. 16ino. 8 X 58, pp. 366, 28, 6d..... MACLAREN, Dec. 08",Earl of Dundonald,['Dundonald (Earl of)'],,Dec. 08,1908,
"Dunkirk, Consular Report 2d. . . WYMAN, June 08",,,"Dunkirk, Consular Report",WYMAN,2d.,,"Dunkirk, Consular Report 2d. . . WYMAN, June 08",,,,June 08,1908,
"Dynamics, Notes on. 2nd edit., 3s. WYMAN, Dec. 08",,,"Dynamics, Notes on",WYMAN,3s.,,"Dynamics, Notes on. 2nd edit., 35. WYMAN, Dec. 08",,,,Dec. 08,1908,
"Early Days, 1908. 410. 28., bds. 1s. 60. R. CULLEY, Oct. 08",,,Early Days,R. CULLEY,,,"Early Days, 1908. 410. 28., bds. Is. 60. R. CULLEY, Oct. 08",,,,Oct. 08,1908,
"East Africa Protectorate, Colonial Report, 3d. ; Correspondence re Tenure of Land, 3!d. WYMAN, June 08",,,"East Africa Protectorate, Colonial Report",WYMAN,,,"East Africa Protectorate, Colonial Report, 3d. ; Correspondence re Tenure of Land, 3!d. WYMAN, June 08",,,,June 08,1908,
"East India-Statement showing Progress and Condition during year 1906-07, is. 8d. WYMAN, June 08",,,East India-Statement showing Progress and Condition during year,WYMAN,8d.,,"East India-Statement showing Progress and Condition during year 1906-07, is. 8d. WYMAN, June 08",,,,June 08,1908,
"Ec:lesiastical Commissioners for England: both Report, with an Appendix, 5d. WYMAN, Mar. 08",,,"Ec:lesiastical Commissioners for England: both Report, with an Appendix",WYMAN,5d.,,"Ec:lesiastical Commissioners for England: both Report, with an Appendix, 5d. WYMAN, Mar. 08",,,,Mar. 08,1908,
"Edinburgh Vedical Journal. New ser. Vol. I. (sub.) 21s. ...(Edin.) W'. GREEN, Jan., &c., 08",,,Edinburgh Vedical Journal,W'. GREEN,,,"Edinburgh Vedical Journal. New ser. Vol. I. (sub.) 215. ...(Edin.) W'. GREEN, Jan., &c., 08",,,,"Jan., &c., 08",1908,
"Edinburgh, Royal Observatory, Annals, Vol. II., 6s. .WYMAN, Nov. 08",,,"Edinburgh, Royal Observatory, Annals, Vol",WYMAN,6s.,,"Edinburgh, Royal Observatory, Annals, Vol. II., 6s. .WYMAN, Nov. 08",,,,Nov. 08,1908,
"Education (Board of)-Catalogue of Japanese Colour Prints, i įd. WYMAN, Jan. 08",Education,Board of,"Catalogue of Japanese Colour Prints, i įd",WYMAN,,,"Education (Board of)-Catalogue of Japanese Colour Prints, i įd. WYMAN, Jan. 08",Board of Education,['Education (Board of)'],,Jan. 08,1908,
