entry,last_name,first_name,title,publisher,price,format,original_entry,author_name,creators,is_editor,date,catalogue_year,is_net
"Outcault (R. F.)-Buster Brown's Latest Frolics. Illus. Oblong fol. bds., 3s. 6d. net DEAN, Sep. 07",Outcault,R. F.,Buster Brown's Latest Frolics,DEAN,3s. 6d.,,"Outcault (R. F.)-Buster Brown's Latest Frolics. Illus. Oblong fol. bds., 3s. 6d. net DEAN, Sep. 07",R. F. Outcault,['Outcault (R. F.)'],,Sep. 07,1907,net
"Oxenham (J.)-Barbe of Grand Bayou. 6×4, pp. 322, 28. net, lthr. 2s. 6d. net. (Red Cloth Lib.) ..HODDER & S., June 07",Oxenham,J.,Barbe of Grand Bayou,HODDER & S.,,,"Oxenham (J.)-Barbe of Grand Bayou. 6×4, pp. 322, 28. net, lthr. 2s. 6d. net. (Red Cloth Lib.) ..HODDER & S., June 07",J. Oxenham,['Oxenham (J.)'],,June 07,1907,
"Paints and Colours, Regulations for the Manufac- id. ture of. Paints, Mixed, Toch (Maximilian) 12s. 6d. net .WYMAN, Feb. 07",,,"Paints and Colours, Regulations for the Manufac- id. ture of",WYMAN,12s. 6d.,,"Paints and Colours, Regulations for the Manufac- id. ture of. Paints, Mixed, Toch (Maximilian) 12s. 6d. net .WYMAN, Feb. 07",,,,Feb. 07,1907,net
"Paisley Thread Ind., Blair (Matthew) 6s. net Palace of Westminster, Report. 8d. WYMAN, Feb. 07",,,Paisley Thread Ind,WYMAN,8d.,,"Paisley Thread Ind., Blair (Matthew) 6s. net Palace of Westminster, Report. 8d. WYMAN, Feb. 07",,,,Feb. 07,1907,
"Palmer (F. B.)-Peerage Law in England: A Practical Treatise for Lawyers and Laymen. With an Appendix of Peerage Charters and Letters Patent (In English). Oblong Svo., 12s. 6d. ..STEVENS & SONS, July 07",Palmer,F. B.,Peerage Law in England: A Practical Treatise for Lawyers and Laymen,STEVENS & SONS,12s. 6d.,,"Palmer (F. B.)-Peerage Law in England: A Practical Treatise for Lawyers and Laymen. With an Appendix of Peerage Charters and Letters Patent (In English). Oblong Svo., 12s. 6d. ..STEVENS & SONS, July 07",F. B. Palmer,['Palmer (F. B.)'],,July 07,1907,
"Parish Trusts (Scotland) Return, 1s. 1d. WYMAN, May 07",Parish Trusts,Scotland,Return,WYMAN,1s. 1d.,,"Parish Trusts (Scotland) Return, Is. Id. WYMAN, May 07",Scotland Parish Trusts,['Parish Trusts (Scotland)'],,May 07,1907,
"Parish Trusts, Scotl., Return. WYMAN, Feb. 07",,,"Parish Trusts, Scotl",WYMAN,,,"Parish Trusts, Scotl., Return. WYMAN, Feb. 07",,,,Feb. 07,1907,
"Parishes, &c., in Districts of County Courts, Index to, 1907, 6s. WYMAN, Sep. 07",,,"Parishes, &c",WYMAN,6s.,,"Parishes, &c., in Districts of County Courts, Index to, 1907, 6s. WYMAN, Sep. 07",,,,Sep. 07,1907,
"Parliamentary Constituencies: Electors &c. 3d. WYMAN, Mar. 07",,,Parliamentary Constituencies: Electors &c,WYMAN,3d.,,"Parliamentary Constituencies: Electors &c. 3d. WYMAN, Mar. 07",,,,Mar. 07,1907,
"Parliamentary Debates Committee: Index and Digest, 4d. WYMAN, Oct. 07",,,Parliamentary Debates Committee: Index and Digest,WYMAN,4d.,,"Parliamentary Debates Committee: Index and Digest, 4d. WYMAN, Oct. 07",,,,Oct. 07,1907,
"Parliamentary Debates Committee-Report, Pro- ceedings, Evidence and Appendix, is. 6d. WYMAN, Aug. 07",,,"Parliamentary Debates Committee-Report, Pro- ceedings, Evidence and Appendix, is",WYMAN,6d.,,"Parliamentary Debates Committee-Report, Pro- ceedings, Evidence and Appendix, is. 6d. WYMAN, Aug. 07",,,,Aug. 07,1907,
"Parliamentary Debates Report of Select Com- mittee on. rd. ...WYMAN, July 07",,,Parliamentary Debates Report of Select Com- mittee on,WYMAN,,,"Parliamentary Debates Report of Select Com- mittee on. rd. ...WYMAN, July 07",,,,July 07,1907,
"Pascal (B.)-Selections. Edit. by F. M. Warren. ..HARRAP, Feb. 07",Pascal,B.,Selections,HARRAP,,,"Pascal (B.)-Selections. Edit. by F. M. Warren. ..HARRAP, Feb. 07",B. Pascal,['Pascal (B.)'],,Feb. 07,1907,
"Passenger Accommodation, Board of Trade Instructions as to Survey of, 4d. WYMAN, Aug. 07",,,"Passenger Accommodation, Board of Trade Instructions as to Survey of",WYMAN,4d.,,"Passenger Accommodation, Board of Trade Instructions as to Survey of, 4d. WYMAN, Aug. 07",,,,Aug. 07,1907,
"Pasture (Mrs. Henry De La)-Deborah of Tod's. New edit. Cr. vo. 7X4, pp. 344, 3s. 6d. (Waterloo Lib.). SMITH, E., June 07",Pasture,Mrs. Henry De La,Deborah of Tod's,"SMITH, E.",3s. 6d.,,"Pasture (Mrs. Henry De La)-Deborah of Tod's. New edit. Cr. vo. 7X4, pp. 344, 3s. 6d. (Waterloo Lib.). SMITH, E., June 07",Mrs. Henry De La Pasture,['Pasture (Mrs. Henry De La)'],,June 07,1907,
"Patent Rolls, Calendar of: Edward III., 1350- 1354, 15s. WYMAN, Nov. 07",,,"Patent Rolls, Calendar of: Edward III",WYMAN,15s.,,"Patent Rolls, Calendar of: Edward III., 1350- 1354, I5S. WYMAN, Nov. 07",,,,Nov. 07,1907,
"Patent Rolls, Calendar of, Henry VI., 1436-1441, .WYMAN, Aug. 07",,,"Patent Rolls, Calendar of, Henry VI",WYMAN,,,"Patent Rolls, Calendar of, Henry VI., 1436-1441, .WYMAN, Aug. 07",,,,Aug. 07,1907,
"Patents, Designs, and Trade Marks: Twenty- fourth Report, with Appendices, 6d. WYMAN, June 07",,,"Patents, Designs, and Trade Marks: Twenty- fourth Report, with Appendices",WYMAN,6d.,,"Patents, Designs, and Trade Marks: Twenty- fourth Report, with Appendices, 6d. WYMAN, June 07",,,,June 07,1907,
"Paton (W.)-Handbooks on British Colonies. 2s. WYMAN, Sep. 07",Paton,W.,Handbooks on British Colonies,WYMAN,2s.,,"Paton (W.)-Handbooks on British Colonies. 25. WYMAN, Sep. 07",W. Paton,['Paton (W.)'],,Sep. 07,1907,
"Pattison (Mrs. P. B.)-The Machinations of Cissy. Svo. swd., 6d. .SEALY, BRYERS, April 07",Pattison,Mrs. P. B.,The Machinations of Cissy,"SEALY, BRYERS",6d.,,"Pattison (Mrs. P. B.)-The Machinations of Cissy. Svo. swd., 6d. .SEALY, BRYERS, April 07",Mrs. P. B. Pattison,['Pattison (Mrs. P. B.)'],,April 07,1907,
"Cr. 8vo. Peabody (J. P.)-Marlowe, a Drama. 4s. 6d. net .CONSTABLE, Oct. 07",Cr. 8vo. Peabody,J. P.,"Marlowe, a Drama",CONSTABLE,4s. 6d.,,"Cr. 8vo. Peabody (J. P.)-Marlowe, a Drama. 4s. 6d. net .CONSTABLE, Oct. 07",J. P. Cr. 8vo. Peabody,['Cr. 8vo. Peabody (J. P.)'],,Oct. 07,1907,net
"Peacham's Compleat Gentleman, 1634. Intro. by G. S. Gordon. Imitation vellum, 5s. net H. FROWDE, Jan. 07",,,Peacham's Compleat Gentleman,H. FROWDE,5s.,,"Peacham's Compleat Gentleman, 1634. Intro. by G. S. Gordon. Imitation vellum, 5s. net H. FROWDE, Jan. 07",,,,Jan. 07,1907,net
"Penny Postage-Copy of Letters, &c. 14. WYMAN, Jan. 07",,,"Penny Postage-Copy of Letters, &c",WYMAN,,,"Penny Postage-Copy of Letters, &c. 14. WYMAN, Jan. 07",,,,Jan. 07,1907,
"Pernambuco (Brazil), Consular Report, 1d. WYMAN, Sep. 07",Pernambuco,Brazil,Consular Report,WYMAN,1d.,,"Pernambuco (Brazil), Consular Report, 1d. WYMAN, Sep. 07",Brazil Pernambuco,['Pernambuco (Brazil)'],,Sep. 07,1907,
"Perry (J.)-Practical Mathematics, 9d. WYMAN, April 07",Perry,J.,Practical Mathematics,WYMAN,9d.,,"Perry (J.)-Practical Mathematics, 9d. WYMAN, April 07",J. Perry,['Perry (J.)'],,April 07,1907,
"Petitions, Index to Public, &c. (House of Com- mons), 2d. .WYMAN, Oct. 07",,,"Petitions, Index to Public, &c",WYMAN,2d.,,"Petitions, Index to Public, &c. (House of Com- mons), 2d. .WYMAN, Oct. 07",,,,Oct. 07,1907,
"IS. net Pharn's Map and Guide to London. Folded, s. net .SIEGLE & H., Feb. 07",,,IS,SIEGLE & H.,,,"IS. net Pharn's Map and Guide to London. Folded, IS. net .SIEGLE & H., Feb. 07",,,,Feb. 07,1907,
"Philadelphia-Trade for 1906, 21d. 2s. net .... WYMAN, July 07",,,Philadelphia-Trade for,WYMAN,2s.,,"Philadelphia-Trade for 1906, 21d. 2s. net .... WYMAN, July 07",,,,July 07,1907,net
"Piggott (F.)-Nationality, including Naturaliza- tion. In 2 pts. Svo. 6os. net net. net W. CLOWES, Feb. 07",Piggott,F.,"Nationality, including Naturaliza- tion",W. CLOWES,,,"Piggott (F.)-Nationality, including Naturaliza- tion. In 2 pts. Svo. 6os. net net. net W. CLOWES, Feb. 07",F. Piggott,['Piggott (F.)'],,Feb. 07,1907,
"Places out of Europe, Passengers to and from, December. id. ..WYMAN, Jan. 07",,,"Places out of Europe, Passengers to and from, December",WYMAN,,,"Places out of Europe, Passengers to and from, December. id. ..WYMAN, Jan. 07",,,,Jan. 07,1907,
"Plain Man's Faith (A). 8vo. 81 ×51, pp. 224, 5s. net .CONSTABLE, June 07",Plain Man's Faith,A,,CONSTABLE,5s.,,"Plain Man's Faith (A). 8vo. 81 ×51, pp. 224, 55. net .CONSTABLE, June 07",A Plain Man's Faith,"[""Plain Man's Faith (A)""]",,June 07,1907,net
"Platt (R. O.), Bacon (Lord) Essays, 2nd ser., 1s. PITMAN, Sep. 07",,,Essays,PITMAN,1s.,,"Platt (R. O.), Bacon (Lord) Essays, 2nd ser., Is. PITMAN, Sep. 07",,"['Platt (R. O.), Bacon (Lord)']",,Sep. 07,1907,
"Pitman's Shorthand Weekly. Vol. 3s. 6d. .PITMAN, Jan. 07",,,Pitman's Shorthand Weekly,PITMAN,3s. 6d.,,"Pitman's Shorthand Weekly. Vol. 3s. 6d. .PITMAN, Jan. 07",,,,Jan. 07,1907,
"Poland and Lithuania Trade for 1906. 24d. WYMAN, Feb. 07",,,Poland and Lithuania Trade for,WYMAN,24d.,,"Poland and Lithuania Trade for 1906. 24d. WYMAN, Feb. 07",,,,Feb. 07,1907,
"Police (Counties and Boroughs): Reports of Inspectors, 2s. id. .WYMAN, May 07",Police,Counties,Reports of Inspectors,WYMAN,,,"Police (Counties and Boroughs): Reports of Inspectors, 2s. id. .WYMAN, May 07",Counties Police,"['Police (Counties)', 'Police (Boroughs)']",,May 07,1907,
"Pollard (A. W.)-Books in the House. Ryl. 16m0. 7×51, pp. 160, 3s. 6d. net ..... A. L. HUMPHREYS, Nov. 07",Pollard,A. W.,Books in the House,A. L. HUMPHREYS,3s. 6d.,,"Pollard (A. W.)-Books in the House. Ryl. 16m0. 7×51, pp. 160, 3s. 6d. net ..... A. L. HUMPHREYS, Nov. 07",A. W. Pollard,['Pollard (A. W.)'],,Nov. 07,1907,net
"Poor Relief-Statement for Half-year ended Lady Day 1906. 3d. .WYMAN, Jan. 07",,,Poor Relief-Statement for Half-year ended Lady Day,WYMAN,3d.,,"Poor Relief-Statement for Half-year ended Lady Day 1906. 3d. .WYMAN, Jan. 07",,,,Jan. 07,1907,
"Porter (Rose)-Looking toward Sunrise. pp. 116, bds. 1s. net (Quiet Hour Ser.) DE LA MORE P., Jan. 07",Porter,Rose,Looking toward Sunrise,DE LA MORE P.,1s.,,"Porter (Rose)-Looking toward Sunrise. pp. 116, bds. Is. net (Quiet Hour Ser.) DE LA MORE P., Jan. 07",Rose Porter,['Porter (Rose)'],,Jan. 07,1907,net
"Post Office Agreement: U.K. and Peru, 2ld. WYMAN, Aug. 07",,,Post Office Agreement: U.K. and Peru,WYMAN,,,"Post Office Agreement: U.K. and Peru, 2ld. WYMAN, Aug. 07",,,,Aug. 07,1907,
"Post Office-53rd Report of the Postmaster General, 5d. ..WYMAN, Sep. 07",,,Post Office,WYMAN,5d.,,"Post Office-53rd Report of the Postmaster General, 5d. ..WYMAN, Sep. 07",,,,Sep. 07,1907,
"Post Office Servants Committee: Appendices to Evidence, 1od. ............ .WYMAN, Sep. 07",,,Post Office Servants Committee: Appendices to Evidence,WYMAN,,,"Post Office Servants Committee: Appendices to Evidence, 1od. ............ .WYMAN, Sep. 07",,,,Sep. 07,1907,
"Post Office Servants Committee: Evidence, IOS. 8d. ………..WYMAN, Aug. 07",,,"Post Office Servants Committee: Evidence, IOS",WYMAN,,,"Post Office Servants Committee: Evidence, IOS. 8d. ………..WYMAN, Aug. 07",,,,Aug. 07,1907,
"Post Office Servants, Select Committee on Re- port with Map, is. 2d. ...WYMAN, July 07",,,"Post Office Servants, Select Committee on Re- port with Map, is",WYMAN,2d.,,"Post Office Servants, Select Committee on Re- port with Map, is. 2d. ...WYMAN, July 07",,,,July 07,1907,
"Post Offices in U.K. d.. .WYMAN, Jan. 07",,,Post Offices in U.K. d,WYMAN,,,"Post Offices in U.K. d.. .WYMAN, Jan. 07",,,,Jan. 07,1907,
"Postal Union, Universal: Convention of Rome, 3d. Agreement for Exchange of Insured Letters and Boxes, 2d. ....WYMAN, Dec. 07",,,"Postal Union, Universal: Convention of Rome",WYMAN,2d.,,"Postal Union, Universal: Convention of Rome, 3d. Agreement for Exchange of Insured Letters and Boxes, 2d. ....WYMAN, Dec. 07",,,,Dec. 07,1907,
"Pott (F.) and Brown (A. H.)--Free-Rhythm Psalter (The). Choir and People's Edit., Rev. F'cap, 3s. ..FROWDE, Aug. 07",Pott,F.,Free-Rhythm Psalter (The),FROWDE,3s.,,"Pott (F.) and Brown (A. H.)--Free-Rhythm Psalter (The). Choir and People's Edit., Rev. F'cap, 35. ..FROWDE, Aug. 07",F. Pott,"['Pott (F.)', 'Brown (A. H.)']",,Aug. 07,1907,
"Price (D. T.)-A Ready Aid to Distinguish the Commoner Wild Birds of Great Britain. pp. 64, 1s. net ........GURNEY & J., Mar. 07",Price,D. T.,A Ready Aid to Distinguish the Commoner Wild Birds of Great Britain,GURNEY & J.,1s.,,"Price (D. T.)-A Ready Aid to Distinguish the Commoner Wild Birds of Great Britain. pp. 64, 1s. net ........GURNEY & J., Mar. 07",D. T. Price,['Price (D. T.)'],,Mar. 07,1907,net
"Prisons-Report of Commissioners and Directors, with Appendices, is. çd....... WYMAN, Sep. 07",,,"Prisons-Report of Commissioners and Directors, with Appendices, is",WYMAN,,,"Prisons-Report of Commissioners and Directors, with Appendices, is. çd....... WYMAN, Sep. 07",,,,Sep. 07,1907,
"Privy Council, Acts of the, 1601-1604, 10s. WYMAN, Aug. 07",,,"Privy Council, Acts of the",WYMAN,10s.,,"Privy Council, Acts of the, 1601-1604, 10s. WYMAN, Aug. 07",,,,Aug. 07,1907,
"Prout (E.)-Some Notes on Bach's Church Can- tatas, with musical illustrations, 2 facsimiles and a Portrait of Bach. 5×81, pp. 32, 1s. net BREITKOPP, July 07",Prout,E.,"Some Notes on Bach's Church Can- tatas, with musical illustrations",BREITKOPP,1s.,,"Prout (E.)-Some Notes on Bach's Church Can- tatas, with musical illustrations, 2 facsimiles and a Portrait of Bach. 5×81, pp. 32, Is. net BREITKOPP, July 07",E. Prout,['Prout (E.)'],,July 07,1907,net
"Public Health (Re-committed) Bill: Report and Proceedings, 2d.... … … … … … … … … … … … . WYMAN, Aug. 07",Public Health,Re-committed,Bill: Report and Proceedings,WYMAN,,,"Public Health (Re-committed) Bill: Report and Proceedings, 2d.... … … … … … … … … … … … . WYMAN, Aug. 07",Re-committed Public Health,['Public Health (Re-committed)'],,Aug. 07,1907,
"Public Houses, Frequenting of, by Women and Children: Information obtained from certain Police Forces, 2d. WYMAN, Nov. 07",,,"Public Houses, Frequenting of, by Women and Children: Information obtained from certain Police Forces",WYMAN,2d.,,"Public Houses, Frequenting of, by Women and Children: Information obtained from certain Police Forces, 2d. WYMAN, Nov. 07",,,,Nov. 07,1907,
"Public Record Office, Catalogue of Manuscripts in Museum of, 6d. ...WYMAN, May 07",,,"Public Record Office, Catalogue of Manuscripts in Museum of",WYMAN,6d.,,"Public Record Office, Catalogue of Manuscripts in Museum of, 6d. ...WYMAN, May 07",,,,May 07,1907,
"Publications Committee: Report, Proceedings and Evidence, gd. WYMAN, Aug. 07",,,"Publications Committee: Report, Proceedings and Evidence, gd",WYMAN,,,"Publications Committee: Report, Proceedings and Evidence, gd. WYMAN, Aug. 07",,,,Aug. 07,1907,
"Pugh (E.)-The Shuttlecock: a novel. Cr. Svo. 8 X 5, pp. 322, 6s. ...... HURST & B., Oct. 07",Pugh,E.,The Shuttlecock: a novel,HURST & B.,6s.,,"Pugh (E.)-The Shuttlecock: a novel. Cr. Svo. 8 X 5, pp. 322, 6s. ...... HURST & B., Oct. 07",E. Pugh,['Pugh (E.)'],,Oct. 07,1907,
"Quarries, List of, 1906, 4s. 10d. Quarterly Journal of Medicine. WYMAN, July 07",,,"Quarries, List of",WYMAN,,,"Quarries, List of, 1906, 45. 10d. Quarterly Journal of Medicine. WYMAN, July 07",,,,July 07,1907,
"Queen's College, Belfast, Report on, 41d. WYMAN, Sep. 07",,,"Queen's College, Belfast, Report on",WYMAN,41d.,,"Queen's College, Belfast, Report on, 41d. WYMAN, Sep. 07",,,,Sep. 07,1907,
"Radford (Dollie)-A Ballad of Victory, and other Poems. Imp. 16m0., pp. 40, swd. is. net RIVERS, July 07",Radford,Dollie,"A Ballad of Victory, and other Poems",RIVERS,,,"Radford (Dollie)-A Ballad of Victory, and other Poems. Imp. 16m0., pp. 40, swd. is. net RIVERS, July 07",Dollie Radford,['Radford (Dollie)'],,July 07,1907,
"Radiotelegraphic Convention: Index and Digest of Evidence, 5d. .WYMAN, Oct. 07",,,Radiotelegraphic Convention: Index and Digest of Evidence,WYMAN,5d.,,"Radiotelegraphic Convention: Index and Digest of Evidence, 5d. .WYMAN, Oct. 07",,,,Oct. 07,1907,
"Radiotelegraphic Convention: Report with Pro- ceedings, 6d. Radiotelegraphic Convention Committee: Report, Evidence and Appendix, 3s. 2d. net WYMAN, July 07",,,Radiotelegraphic Convention: Report with Pro- ceedings,WYMAN,3s. 2d.,,"Radiotelegraphic Convention: Report with Pro- ceedings, 6d. Radiotelegraphic Convention Committee: Report, Evidence and Appendix, 3s. 2d. net WYMAN, July 07",,,,July 07,1907,net
"Railway Accidents: Board of Trade Report, 7d. WYMAN, Aug. 07",,,Railway Accidents: Board of Trade Report,WYMAN,7d.,,"Railway Accidents: Board of Trade Report, 7d. WYMAN, Aug. 07",,,,Aug. 07,1907,
"Railway Accidents: Reports on. 3s. 3d. WYMAN, Feb. 07",,,Railway Accidents: Reports on,WYMAN,3s. 3d.,,"Railway Accidents: Reports on. 3s. 3d. WYMAN, Feb. 07",,,,Feb. 07,1907,
"Railway Accidents: Returns, 1s. 5d. WYMAN, Oct. 07",,,Railway Accidents: Returns,WYMAN,1s. 5d.,,"Railway Accidents: Returns, Is. 5d. WYMAN, Oct. 07",,,,Oct. 07,1907,
"Rallway and Canal Traffic Acts, 1854 to 1904- General Rules. s......... WYMAN, Mar. 07",,,Rallway and Canal Traffic Acts,WYMAN,,,"Rallway and Canal Traffic Acts, 1854 to 1904- General Rules. IS......... WYMAN, Mar. 07",,,,Mar. 07,1907,
"Railway Returns for 1906, 1s. 3d. WYMAN, Oct. 07",,,Railway Returns for,WYMAN,1s. 3d.,,"Railway Returns for 1906, Is. 3d. WYMAN, Oct. 07",,,,Oct. 07,1907,
"Railway Servants (Hours of Labour): Return, 3ld. WYMAN, July 07",Railway Servants,Hours of Labour,Return,WYMAN,,,"Railway Servants (Hours of Labour): Return, 3ld. WYMAN, July 07",Hours of Labour Railway Servants,['Railway Servants (Hours of Labour)'],,July 07,1907,
"Railway Servants (Hours of Labour): Board of Trade Report, 44d......... WYMAN, Sep. 07",Railway Servants,Hours of Labour,Board of Trade Report,WYMAN,44d.,,"Railway Servants (Hours of Labour): Board of Trade Report, 44d......... WYMAN, Sep. 07",Hours of Labour Railway Servants,['Railway Servants (Hours of Labour)'],,Sep. 07,1907,
"Railway Servants (Hours of Labour): Return, 4d. WYMAN, Nov. 07",Railway Servants,Hours of Labour,Return,WYMAN,4d.,,"Railway Servants (Hours of Labour): Return, 4d. WYMAN, Nov. 07",Hours of Labour Railway Servants,['Railway Servants (Hours of Labour)'],,Nov. 07,1907,
"Railway Servants, Return of Hours of Labour, 7d. WYMAN, Feb. 07",,,"Railway Servants, Return of Hours of Labour",WYMAN,7d.,,"Railway Servants, Return of Hours of Labour, 7d. WYMAN, Feb. 07",,,,Feb. 07,1907,
"Railways, Light, Acts, 1896. Report of the Pro- ceedings of the Board of Trade, 1906, 11d. WYMAN, July 07",,,"Railways, Light, Acts",WYMAN,11d.,,"Railways, Light, Acts, 1896. Report of the Pro- ceedings of the Board of Trade, 1906, 11d. WYMAN, July 07",,,,July 07,1907,
"Reade (A. L.)-The Reades of Blackwood Hill in the Parish of Horton, Staffordshire : A Record of their Descendants, with a full account of Dr. Johnson's Ancestry, his Kinsfolk and Family Connexions. Illus. Fol. pp. 34s. PRIVATELY PRINTED, Jan. 07",Reade,A. L.,"The Reades of Blackwood Hill in the Parish of Horton, Staffordshire : A Record of their Descendants, with a full account of Dr",PRIVATELY PRINTED,34s.,,"Reade (A. L.)-The Reades of Blackwood Hill in the Parish of Horton, Staffordshire : A Record of their Descendants, with a full account of Dr. Johnson's Ancestry, his Kinsfolk and Family Connexions. Illus. Fol. pp. 345. PRIVATELY PRINTED, Jan. 07",A. L. Reade,['Reade (A. L.)'],,Jan. 07,1907,
"PP. 322, 3s. 6d. Reid (H. M. B.)-A Country Parish: Studies in Pastoral Theology and Church Law. 71 × 41, pp. 154, 2s. 6d. net MACLEHOSE, Dec. 07",,,PP,MACLEHOSE,2s. 6d.,,"PP. 322, 35. 6d. Reid (H. M. B.)-A Country Parish: Studies in Pastoral Theology and Church Law. 71 × 41, pp. 154, 2s. 6d. net MACLEHOSE, Dec. 07",,,,Dec. 07,1907,net
"Reformatory and Industrial Schools: 50th Report, for 1906, 10d. ...... WYMAN, Oct. 07",,,Reformatory and Industrial Schools:,WYMAN,10d.,,"Reformatory and Industrial Schools: 50th Report, for 1906, 10d. ...... WYMAN, Oct. 07",,,,Oct. 07,1907,
"British Standards for Electrical Machinery (Engineering Standards Committee, Report, No. 36) Folio, swd. 1s. net LOCKWOOD, Aug. 07",,,"British Standards for Electrical Machinery (Engineering Standards Committee, Report",LOCKWOOD,1s.,,"British Standards for Electrical Machinery (Engineering Standards Committee, Report, No. 36) Folio, swd. Is. net LOCKWOOD, Aug. 07",,,,Aug. 07,1907,net
"Report on British Standard Systems for Limit Gauges for Screw Threads (Engineering Standards Committee, Report No. 38). Fol. swd. is. net LOCKWOOD, Aug. 07",,,"Report on British Standard Systems for Limit Gauges for Screw Threads (Engineering Standards Committee, Report",LOCKWOOD,,,"Report on British Standard Systems for Limit Gauges for Screw Threads (Engineering Standards Committee, Report No. 38). Fol. swd. is. net LOCKWOOD, Aug. 07",,,,Aug. 07,1907,
"IS. net Reliquary (The). New Series. Vol. 12s. net Rembrandt-Etchings. Folio, 11 x81, 7s. 6d. net (Great Etchers) .NEWNES, Nov. 07",,,IS,NEWNES,7s. 6d.,,"IS. net Reliquary (The). New Series. Vol. I2S. net Rembrandt-Etchings. Folio, 11 x81, 7s. 6d. net (Great Etchers) .NEWNES, Nov. 07",,,,Nov. 07,1907,net
"Return, Annual, Prescribed by the Chief Regis- trar for a Registered Collecting Society, 3d. WYMAN, Jan. 07",,,"Return, Annual, Prescribed by the Chief Regis- trar for a Registered Collecting Society",WYMAN,3d.,,"Return, Annual, Prescribed by the Chief Regis- trar for a Registered Collecting Society, 3d. WYMAN, Jan. 07",,,,Jan. 07,1907,
"Rice (Alice Hegan)-Lovey Mary. Cheap edit. Ryl. 16m0. pp. 170, swd. 1s. net HODDER & S., May 07",Rice,Alice Hegan,Lovey Mary,HODDER & S.,1s.,,"Rice (Alice Hegan)-Lovey Mary. Cheap edit. Ryl. 16m0. pp. 170, swd. Is. net HODDER & S., May 07",Alice Hegan Rice,['Rice (Alice Hegan)'],,May 07,1907,net
"Riddell (Mrs. J. H.)-The Senior Partner. Svo. swd. 6d. .PEARSON, Oct. 07",Riddell,Mrs. J. H.,The Senior Partner,PEARSON,6d.,,"Riddell (Mrs. J. H.)-The Senior Partner. Svo. swd. 6d. .PEARSON, Oct. 07",Mrs. J. H. Riddell,['Riddell (Mrs. J. H.)'],,Oct. 07,1907,
"Riga (Russia), Consular Reports, 41d. WYMAN, Sep. 07",Riga,Russia,Consular Reports,WYMAN,41d.,,"Riga (Russia), Consular Reports, 41d. WYMAN, Sep. 07",Russia Riga,['Riga (Russia)'],,Sep. 07,1907,
"Ringwood (R.)-Outlines of Banking Law. Cr. STEVENS & H., Jan. 07",Ringwood,R.,Outlines of Banking Law,STEVENS & H.,,,"Ringwood (R.)-Outlines of Banking Law. Cr. STEVENS & H., Jan. 07",R. Ringwood,['Ringwood (R.)'],,Jan. 07,1907,
"Risht, Trade of, 1903-7, 2d.....WYMAN, July 07",,,"Risht, Trade of",WYMAN,2d.,,"Risht, Trade of, 1903-7, 2d.....WYMAN, July 07",,,,July 07,1907,
"Svo. Robertson (J. M.)-Pioneer Humanists. WATTS, May 07",Svo. Robertson,J. M.,Pioneer Humanists,WATTS,,,"Svo. Robertson (J. M.)-Pioneer Humanists. WATTS, May 07",J. M. Svo. Robertson,['Svo. Robertson (J. M.)'],,May 07,1907,
"Robins (Elizabeth)-Woman's Secret. swd. 6d. net ....GARDEN CITY PRESS, Oct. 07",Robins,Elizabeth,Woman's Secret,GARDEN CITY PRESS,6d.,,"Robins (Elizabeth)-Woman's Secret. swd. 6d. net ....GARDEN CITY PRESS, Oct. 07",Elizabeth Robins,['Robins (Elizabeth)'],,Oct. 07,1907,net
"Robinson (C. W.)-Wellington's Campaigns: Peninsula-Waterloo, 1808-15; also Moore's Campaign of Corunna. Pt. 3. 2nd edit. 81×51, pp. 366, 3s. 6d. net .REES, June 07",Robinson,C. W.,Wellington's Campaigns: Peninsula-Waterloo,REES,3s. 6d.,,"Robinson (C. W.)-Wellington's Campaigns: Peninsula-Waterloo, 1808-15; also Moore's Campaign of Corunna. Pt. 3. 2nd edit. 81×51, pp. 366, 3s. 6d. net .REES, June 07",C. W. Robinson,['Robinson (C. W.)'],,June 07,1907,net
"A Prisoner's Story HODDER & S., April 07",,,,HODDER & S.,,,"A Prisoner's Story HODDER & S., April 07",,,,April 07,1907,
"Rosmini-Serbati, Antonio, Pagani (G. net Ross (Araminta)-Masseuse's Pocket Book, 16m0. 5 × 3, pp. 170, 2s. net SCIENTIFIC PRESS, Sep. 07","Rosmini-Serbati, Antonio, Pagani",G. net Ross (Araminta,Masseuse's Pocket Book,SCIENTIFIC PRESS,2s.,,"Rosmini-Serbati, Antonio, Pagani (G. net Ross (Araminta)-Masseuse's Pocket Book, 16m0. 5 × 3, pp. 170, 25. net SCIENTIFIC PRESS, Sep. 07","G. net Ross (Araminta Rosmini-Serbati, Antonio, Pagani","['Rosmini-Serbati, Antonio, Pagani (G. net Ross (Araminta)']",,Sep. 07,1907,net
"Rothschild (W., Hon.)-Extinct Birds. Illus. Folio, 500s. net HUTCHINSON, Nov. 07",Rothschild,"W., Hon.",Extinct Birds,HUTCHINSON,500s.,,"Rothschild (W., Hon.)-Extinct Birds. Illus. Folio, 500s. net HUTCHINSON, Nov. 07","W., Hon. Rothschild","['Rothschild (W., Hon.)']",,Nov. 07,1907,net
"Rotterdam, Trade of, 1d. ...WYMAN, June 07",,,"Rotterdam, Trade of",WYMAN,1d.,,"Rotterdam, Trade of, 1d. ...WYMAN, June 07",,,,June 07,1907,
"Rousseau (J. J.)-Confessions. Newly trans. into English. 2 vols. New edit. 7X4, PP. 372, 356, 5s. net.. GIBBINGS, Dec. 07",Rousseau,J. J.,Confessions,GIBBINGS,5s.,,"Rousseau (J. J.)-Confessions. Newly trans. into English. 2 vols. New edit. 7X4, PP. 372, 356, 5s. net.. GIBBINGS, Dec. 07",J. J. Rousseau,['Rousseau (J. J.)'],,Dec. 07,1907,net
"Rowley Letters (The) from France and Italy. Cr. Svo. 7X5, pp. 304, 3s. 6d. net FOULIS, Nov. 07",,,Rowley Letters (The) from France and Italy,FOULIS,3s. 6d.,,"Rowley Letters (The) from France and Italy. Cr. Svo. 7X5, pp. 304, 35. 6d. net FOULIS, Nov. 07",,,,Nov. 07,1907,net
"Royal London Ophthalmic Hospital Reports Vol. 17, Part 1, 5s. net ..CHURCHILL, May 07",,,Royal London Ophthalmic Hospital Reports Vol,CHURCHILL,5s.,,"Royal London Ophthalmic Hospital Reports Vol. 17, Part 1, 5s. net ..CHURCHILL, May 07",,,,May 07,1907,net
"Royal Patriotic Fund Corporation. Third Report, 61d. WYMAN, July 07",,,Royal Patriotic Fund Corporation,WYMAN,61d.,,"Royal Patriotic Fund Corporation. Third Report, 61d. WYMAN, July 07",,,,July 07,1907,
"Index to, 1906, 10s. WYMAN, Sep. 07",,,Index to,WYMAN,10s.,,"Index to, 1906, 10s. WYMAN, Sep. 07",,,,Sep. 07,1907,
"Ruskin (J.)-Aratra Pent lici. (Pocket Edit.) 12mo. 6×4, pp. 336, 2s. 6d. net, 1thr. 3s. 6d. net G. ALEN, Sep. 07",,,,G. ALEN,3s. 6d.,,"Ruskin (J.)-Aratra Pent lici. (Pocket Edit.) 12mo. 6×4, pp. 336, 2s. 6d. net, 1thr. 3s. 6d. net G. ALEN, Sep. 07",,['Ruskin (J.)-Aratra Pent lici. (Pocket Edit.)'],,Sep. 07,1907,net
