entry,last_name,first_name,title,publisher,price,format,original_entry,author_name,creators,is_editor,date,is_net
"Abbott-Brown (C., Maj.)---How to do it: the A.S.C. subaltern's and N.C.O.'s vade mecum ; also applic. for cavalry, artillery, engineers ard infantry. 44 X 31, pp. 97, is. net F. GROOM, Aug. 16",Abbott-Brown,"C., Maj.",How to do it: the A.S.C. subaltern's and N.C.O.'s vade mecum ; also applic,F. GROOM,,,"Abbott-Brown (C., Maj.)---How to do it: the A.S.C. subaltern's and N.C.O.'s vade mecum ; also applic. for cavalry, artillery, engineers ard infantry. 44 X 31, pp. 97, is. net F. GROOM, Aug. 16","C., Maj. Abbott-Brown","['Abbott-Brown (C., Maj.)']",,Aug. 16,
"Accounts (Public), Ctte. of, 1916—Memo. by Comptroller and Auditor-Gen. for inform. of, rid. ... WYMAN, Sept. 16",Accounts,Public,Ctte,WYMAN,,,"Accounts (Public), Ctte. of, 1916—Memo. by Comptroller and Auditor-Gen. for inform. of, rid. ... WYMAN, Sept. 16",Public Accounts,['Accounts (Public)'],,Sept. 16,
"Acts-Index to Public General Acts, 1914-16, W. tables, &c. 7d. ..WYMAN, Feb. 16",,,Acts-Index to Public General Acts,WYMAN,7d.,,"Acts-Index to Public General Acts, 1914-16, W. tables, &c. 7d. ..WYMAN, Feb. 16",,,,Feb. 16,
"Acts Local and Private Acts, 1914-16, w. index, tables, &c. 4s. WYMAN, Aug. 16",,,Acts Local and Private Acts,WYMAN,4s.,,"Acts Local and Private Acts, 1914-16, w. index, tables, &c. 4s. WYMAN, Aug. 16",,,,Aug. 16,
"Acts—Public General Acts, 1914-16, w. index, tables, &c. 3s. WYMAN, Apr. 16",,,Acts—Public General Acts,WYMAN,3s.,,"Acts—Public General Acts, 1914-16, w. index, tables, &c. 35. WYMAN, Apr. 16",,,,Apr. 16,
"Acts-Education (Small population grants), fd.; Evidence (Amend.), d.; Increase of rent and mortgage interest (war restric.), id.; Indict- ments, 2 d.; Trading with the Enemy (Exten. of powers), įd. ; War Loan (Supp. prov.), id. Local and private : Beamish divorce, 9d. ; Clackmannan County Water Order, 38. 3d. ; Denny's divorce, 6d.; Glasgow Water Ord. Confirm., 2s. 9d.; Lincoln Corporation, 6s.; L.C.C. (Celluloid), is, 3d. ; do. (Tramways and improvements), is.gd. ; Pier and Harbour Ord. Confirm. (No. 2), 2s. 3d. ; Port Dundas Church and Parish, Quoad Sacra, Glasgow Ord. Confirm., 6d. ; Rhondda Urban Distr. Council (Tramways Exten.), 2s. 6d. ; Stalybridge, &c., Tramways and Elec. Bd., 3s. 6. WYMAN, Jan. 16",,,Increase of rent and mortgage interest (war restric,WYMAN,,,"Acts-Education (Small population grants), fd.; Evidence (Amend.), d.; Increase of rent and mortgage interest (war restric.), id.; Indict- ments, 2 d.; Trading with the Enemy (Exten. of powers), įd. ; War Loan (Supp. prov.), id. Local and private : Beamish divorce, 9d. ; Clackmannan County Water Order, 38. 3d. ; Denny's divorce, 6d.; Glasgow Water Ord. Confirm., 25. 9d.; Lincoln Corporation, 6s.; L.C.C. (Celluloid), is, 3d. ; do. (Tramways and improvements), is.gd. ; Pier and Harbour Ord. Confirm. (No. 2), 25. 3d. ; Port Dundas Church and Parish, Quoad Sacra, Glasgow Ord. Confirm., 6d. ; Rhondda Urban Distr. Council (Tramways Exten.), 25. 6d. ; Stalybridge, &c., Tramways and Elec. Bd., 35. 6. WYMAN, Jan. 16",,"['Acts-Education (Small population grants), fd.; Evidence (Amend.)']",,Jan. 16,
"Acts---Army (Suspension of sentences) Amend., jd.; Customs (War powers), id.; Military service, itd.; Munitions of War (Amend.), 2d.; Naval Forces (Service on shore), d.; Parliament and registration, d.; Trading with the Enemy Amend., Ifd. WYMAN, Feb. 16",Acts---Army,Suspension of sentences,Amend,WYMAN,,,"Acts---Army (Suspension of sentences) Amend., jd.; Customs (War powers), id.; Military service, itd.; Munitions of War (Amend.), 2d.; Naval Forces (Service on shore), d.; Parliament and registration, d.; Trading with the Enemy Amend., Ifd. WYMAN, Feb. 16",Suspension of sentences Acts---Army,['Acts---Army (Suspension of sentences)'],,Feb. 16,
"Acts-Consolidated Fund (No. 1), £d.; Naval prize (Procedure), fd.; Local and privale : Glasgow celluloid, is. 3d. ..WYMAN, Mar. 16",Acts-Consolidated Fund,No. 1,"Naval prize (Procedure), fd",WYMAN,3d.,,"Acts-Consolidated Fund (No. 1), £d.; Naval prize (Procedure), fd.; Local and privale : Glasgow celluloid, is. 3d. ..WYMAN, Mar. 16",No. 1 Acts-Consolidated Fund,['Acts-Consolidated Fund (No. 1)'],,Mar. 16,
"Acts-Army (Annual), 4d.; Consolidated Fund (No. 2), 1d.; Imperial Institute (Management), d.; Naval and military war pensions, &c. (Expenses), d.; Pacific 1slands regulations (Validation), id. ..WYMAN, Apr. 16",Acts-Army,Annual,4d,WYMAN,,,"Acts-Army (Annual), 4d.; Consolidated Fund (No. 2), Id.; Imperial Institute (Management), d.; Naval and military war pensions, &c. (Expenses), d.; Pacific Islands regulations (Validation), id. ..WYMAN, Apr. 16",Annual Acts-Army,['Acts-Army (Annual)'],,Apr. 16,
"Acts—Courts (Emerg. powers) : Amend., d; Education (Prov. of meals) : Ireland, d.; Finance (New duties), 1 d.; Local govern- ment (Energ. prov.), 2d.; Marriage (Scotland), 1d. ; Military service, 1 d. ; Summer time, fd.; War risks (Insurance by trustees), 4d. ; Army act (1885, w. Amend. to end of Sess. 5 and 6 Geo. V), is. ; Plymouth Corporation, 15s. 6d. WYMAN, May 16",,,Acts—Courts (Emerg,WYMAN,15s. 6d.,,"Acts—Courts (Emerg. powers) : Amend., d; Education (Prov. of meals) : Ireland, d.; Finance (New duties), 1 d.; Local govern- ment (Energ. prov.), 2d.; Marriage (Scotland), Id. ; Military service, 1 d. ; Summer time, fd.; War risks (Insurance by trustees), 4d. ; Army act (1885, w. Amend. to end of Sess. 5 and 6 Geo. V), is. ; Plymouth Corporation, 155. 6d. WYMAN, May 16",,,,May 16,
"Acts—British North America, Jd. ; Consolidated Fund (No. 3), įd.; Courts (Emerg. Powers), d.; Naval discipline (Delegation of powers), {d.; Aberdeen Corp. Water Ord. Confirm., 5s. ; Gas orders confirm., 3d. ...WYMAN, J une 16",,,"Acts—British North America, Jd",WYMAN,3d.,,"Acts—British North America, Jd. ; Consolidated Fund (No. 3), įd.; Courts (Emerg. Powers), d.; Naval discipline (Delegation of powers), {d.; Aberdeen Corp. Water Ord. Confirm., 55. ; Gas orders confirm., 3d. ...WYMAN, J une 16",,,,J une 16,
"Acts—Finance, 4]d ; Marriage of British subjects (facilities) amendment, d.; Nat. Insurance (Pt. 2) (Munition workers), id.; Re-election of ministers, kd.; Royal marines, fd. Local and private : Alexander's restitution, 3d. ; Cardiff Railway, 3d. ; Colonial bank, 3d. WYMAN, July 16",,,"Acts—Finance, 4]d ; Marriage of British subjects (facilities) amendment, d",WYMAN,3d.,,"Acts—Finance, 4]d ; Marriage of British subjects (facilities) amendment, d.; Nat. Insurance (Pt. 2) (Munition workers), id.; Re-election of ministers, kd.; Royal marines, fd. Local and private : Alexander's restitution, 3d. ; Cardiff Railway, 3d. ; Colonial bank, 3d. WYMAN, July 16",,,,July 16,
"Acts—Anglo-Portuguese commercial treaty, id. ; Army (Courts of inquiry), įd.; British ships (Transfer restric.), jd.; Consolidated Fund (No. 4), įd.; Elem. education (Fee grant), įd.; Expiring laws continuance, id.; Finance (Exchequer Bonds) Amendment, Jd.; Gas (Standard of calorific power), 4d.; Government of India (Amend.), 1 d.; 1sle of Man (Customs), id.; Law procedure (Emerg. prov.) (Ireland), d. ; Merchant shipping (Salvage), id. ; Muni- cipal savings banks (War Loan invest.), jd.; Output of beer (Restric.), id.; Parliament and local elections, id.; Police, factories, &c. (Misc. prov.), itd.; Public works loans, įd.; Small holding colonies, id.; Special Cominis- sions (Dardanelles and Mesopotamia), d.; Telegraph (Construction), įd.; Time (Ireland), d. ; Trading with the Enemy (Copyright), 1d.; War charities, Ild. Local and private : Burnley Corporation, 9d. ; City of Dublin Steam Packet Company, 6d.; Edinburgh Corporation Ord. Confirm., 3s. 30.; Electric Lighting Ord. Confirm., 6d.; Halifax Corporation Act Prov. Ord. Confirm., 3d.; Imperial Continental Gas Association, gd.; Land drainage (Feltwell) Prov. Ord. Confirm., 6d.; Local Gov. Board's Prov. Ord. Confirm., No. 1, 9d. ; do., No. 2, s. ; do., No. 4, 9d.; do., No. 6, 6d.; Local Govt. Board (Ireland) Prov. Ord. Confirm. No. 1, 3d.; do., (Gas), 6d.; Metropolitan Electric Tram- ways, 6d.; Plymouth and Stonehouse gas, s. 3d. ; Prov. Ord. (Marriages) Confirm., 3d. ; Swansea Harbour, 6d.; Weston-super-Mare Grand Pier, gd. .. WYMAN, Aug. 16",,,"Acts—Anglo-Portuguese commercial treaty, id. ; Army (Courts of inquiry), įd",WYMAN,,,"Acts—Anglo-Portuguese commercial treaty, id. ; Army (Courts of inquiry), įd.; British ships (Transfer restric.), jd.; Consolidated Fund (No. 4), įd.; Elem. education (Fee grant), įd.; Expiring laws continuance, id.; Finance (Exchequer Bonds) Amendment, Jd.; Gas (Standard of calorific power), 4d.; Government of India (Amend.), 1 d.; Isle of Man (Customs), id.; Law procedure (Emerg. prov.) (Ireland), d. ; Merchant shipping (Salvage), id. ; Muni- cipal savings banks (War Loan invest.), jd.; Output of beer (Restric.), id.; Parliament and local elections, id.; Police, factories, &c. (Misc. prov.), itd.; Public works loans, įd.; Small holding colonies, id.; Special Cominis- sions (Dardanelles and Mesopotamia), d.; Telegraph (Construction), įd.; Time (Ireland), d. ; Trading with the Enemy (Copyright), Id.; War charities, Ild. Local and private : Burnley Corporation, 9d. ; City of Dublin Steam Packet Company, 6d.; Edinburgh Corporation Ord. Confirm., 3s. 30.; Electric Lighting Ord. Confirm., 6d.; Halifax Corporation Act Prov. Ord. Confirm., 3d.; Imperial Continental Gas Association, gd.; Land drainage (Feltwell) Prov. Ord. Confirm., 6d.; Local Gov. Board's Prov. Ord. Confirm., No. 1, 9d. ; do., No. 2, IS. ; do., No. 4, 9d.; do., No. 6, 6d.; Local Govt. Board (Ireland) Prov. Ord. Confirm. No. 1, 3d.; do., (Gas), 6d.; Metropolitan Electric Tram- ways, 6d.; Plymouth and Stonehouse gas, IS. 3d. ; Prov. Ord. (Marriages) Confirm., 3d. ; Swansea Harbour, 6d.; Weston-super-Mare Grand Pier, gd. .. WYMAN, Aug. 16",,,,Aug. 16,
"Acts—Local and private : Alexandra (Newport and S. Wales) Docks and Railway, gd. ; Canada Co., 39. 6d. ; Clayton Aniline Co., Ltd. (Railways), 2s. 6d. ; Craven Estates, 23. 9d. ; Land Drainage (Lilleshall) Prov. Ord. Confirm., 3d.; L. G. Bd.'s Prov. Ord. Confirm. No. 3, 1s. 6d.; do., No. 5, 1s. 6d. ; do., No. 7, 6d. ; L. G. Bd. (Ireland) Prov. Ord. Confirm., No. 2, 6d.; L. C.C. (Money), gd. ; South Metropolitan Gas, is. . WYMAN, Sep. 16",,,"Acts—Local and private : Alexandra (Newport and S. Wales) Docks and Railway, gd",WYMAN,,,"Acts—Local and private : Alexandra (Newport and S. Wales) Docks and Railway, gd. ; Canada Co., 39. 6d. ; Clayton Aniline Co., Ltd. (Railways), 25. 6d. ; Craven Estates, 23. 9d. ; Land Drainage (Lilleshall) Prov. Ord. Confirm., 3d.; L. G. Bd.'s Prov. Ord. Confirm. No. 3, Is. 6d.; do., No. 5, Is. 6d. ; do., No. 7, 6d. ; L. G. Bd. (Ireland) Prov. Ord. Confirm., No. 2, 6d.; L. C.C. (Money), gd. ; South Metropolitan Gas, is. . WYMAN, Sep. 16",,,,Sep. 16,
"Acts Local and private: Great Central and Sheffield District Railway, gd.; Municipal corporations (Buxton scheme confirm.), is. 3d. ; North British Railway, is. 3d. ; Pier and Har- bour Prov. Ord. Confirm., 2s. 3d. ; River Glen, s. ; Saint John's Church, Kingston-upon-Hull, 3d.; Shropshire, Worcestershire, and Staffordshire electric power, 6d. ; Van Diemen's Land Company, 2s. 9d. ...WYMAN, Oct. 16",,,"Acts Local and private: Great Central and Sheffield District Railway, gd",WYMAN,2s. 9d.,,"Acts Local and private: Great Central and Sheffield District Railway, gd.; Municipal corporations (Buxton scheme confirm.), is. 3d. ; North British Railway, is. 3d. ; Pier and Har- bour Prov. Ord. Confirm., 25. 3d. ; River Glen, IS. ; Saint John's Church, Kingston-upon-Hull, 3d.; Shropshire, Worcestershire, and Staffordshire electric power, 6d. ; Van Diemen's Land Company, 2s. 9d. ...WYMAN, Oct. 16",,,,Oct. 16,
"Adam (H. Pearl)- International cartoons of the War. Fol. 143 x8, 3s. 6d. net; swd. is. net CHATTO & W., June 16",Adam,H. Pearl,International cartoons of the War,CHATTO & W.,,,"Adam (H. Pearl)- International cartoons of the War. Fol. 143 x8, 35. 6d. net; swd. is. net CHATTO & W., June 16",H. Pearl Adam,['Adam (H. Pearl)'],,June 16,
"Adam (V. de l'1sle) see L'1sle-Adam. Adams (Arthur B.)--Marketing perishable farm products. Pp. 180, 6s. (Columbia Univ. Studies in polit, science) ..P.S. KING, Aug. 16",Adam,V. de l'1sle,Marketing perishable farm products,P.S. KING,6s.,,"Adam (V. de l'Isle) see L'Isle-Adam. Adams (Arthur B.)--Marketing perishable farm products. Pp. 180, 6s. (Columbia Univ. Studies in polit, science) ..P.S. KING, Aug. 16",V. de l'1sle Adam,"[""Adam (V. de l'1sle)"", 'Adams (Arthur B.)']",,Aug. 16,
"Adler (Felix)--Marriage and divorce. 7*X5, pp. 91, 29. 6d, net . .APPLETON, Feb. 16",Adler,Felix,Marriage and divorce,APPLETON,6d.,,"Adler (Felix)--Marriage and divorce. 7*X5, pp. 91, 29. 6d, net . .APPLETON, Feb. 16",Felix Adler,['Adler (Felix)'],,Feb. 16,net
"Adler (Felix)—The World crisis and its meaning. 71x57, pp. 233, 4s. 6d. net APPLETON, Feb. 16",Adler,Felix,The World crisis and its meaning,APPLETON,4s. 6d.,,"Adler (Felix)—The World crisis and its meaning. 71x57, pp. 233, 4s. 6d. net APPLETON, Feb. 16",Felix Adler,['Adler (Felix)'],,Feb. 16,net
"Admiralty-Anatomy (Elem.) and physiology for those studying physical training, 6d. WYMAN, Oct. 16",Admiralty-Anatomy,Elem.,6d,WYMAN,6d.,,"Admiralty-Anatomy (Elem.) and physiology for those studying physical training, 6d. WYMAN, Oct. 16",Elem. Admiralty-Anatomy,['Admiralty-Anatomy (Elem.)'],,Oct. 16,
"Admiralty-Flags of all nations, Admiralty bk. of. 2S. WYMAN, Oct. 16",,,"Admiralty-Flags of all nations, Admiralty bk",S. WYMAN,,,"Admiralty-Flags of all nations, Admiralty bk. of. 2IS. WYMAN, Oct. 16",,,,Oct. 16,
"Admiralty-Hydrographic. Supplements to Pilots are gratis to purchasers of various Pilots. Admiralty-Hydrographic. Africa pilot. Pt. 2, 1910: Rev. supp., 1916 ..POTTER, Apr. 16",,,Admiralty-Hydrographic,POTTER,,,"Admiralty-Hydrographic. Supplements to Pilots are gratis to purchasers of various Pilots. Admiralty-Hydrographic. Africa pilot. Pt. 2, 1910: Rev. supp., 1916 ..POTTER, Apr. 16",,,,Apr. 16,
"Admiralty--Hydrographic. Arctic pilot. Vol. 2, 1911 : Supp. (2), 1915; Vol. 3. 2nd ed., 1915 6s. POTTER, Jan. 16",,,Admiralty--Hydrographic,POTTER,6s.,,"Admiralty--Hydrographic. Arctic pilot. Vol. 2, 1911 : Supp. (2), 1915; Vol. 3. 2nd ed., 1915 6s. POTTER, Jan. 16",,,,Jan. 16,
"Admiralty-Hydrographic. Australia directory, Vol. 1, 1907. Rev. supp. (2), 1916 POTTER, June 16",,,Admiralty-Hydrographic,POTTER,,,"Admiralty-Hydrographic. Australia directory, Vol. 1, 1907. Rev. supp. (2), 1916 POTTER, June 16",,,,June 16,
"Admiralty-Hydrographic. Baltic pilot, Pt. 2, 1914, Supp., 1916; Do., Pt. 3, 1913, Supp., .POTTER, July 16",,,Admiralty-Hydrographic,POTTER,,,"Admiralty-Hydrographic. Baltic pilot, Pt. 2, 1914, Supp., 1916; Do., Pt. 3, 1913, Supp., .POTTER, July 16",,,,July 16,
"Admiralty-Hydrographic. Bay of Bengal pilot, 1910 : Rev. supp., 1916 ..POTTER, Apr. 16",,,Admiralty-Hydrographic,POTTER,,,"Admiralty-Hydrographic. Bay of Bengal pilot, 1910 : Rev. supp., 1916 ..POTTER, Apr. 16",,,,Apr. 16,
"Admiralty-Hydrographic. Black Sea pilot, 1908 : Supp. No. 3, 1916. .POTTER, Sep. 16",,,Admiralty-Hydrographic,POTTER,,,"Admiralty-Hydrographic. Black Sea pilot, 1908 : Supp. No. 3, 1916. .POTTER, Sep. 16",,,,Sep. 16,
"Admiralty-Hydrographic. British Columbia pilot. Vols. I and 2, 1913 : Supps., 1915, POTTER, Feb. 16",,,Admiralty-Hydrographic,POTTER,,,"Admiralty-Hydrographic. British Columbia pilot. Vols. I and 2, 1913 : Supps., 1915, POTTER, Feb. 16",,,,Feb. 16,
"Admiralty - Hydrographic. England (West Coast) pilot, 1916. Rev. supp., 1916 POTTER, July 16",,,Admiralty - Hydrographic,POTTER,,,"Admiralty - Hydrographic. England (West Coast) pilot, 1916. Rev. supp., 1916 POTTER, July 16",,,,July 16,
"Admiralty-Hydrographic. France, Spain and Portugal (West Coasts) pilot, 1910: Rev. supp., .POTTER, Feb. 16",,,Admiralty-Hydrographic,POTTER,,,"Admiralty-Hydrographic. France, Spain and Portugal (West Coasts) pilot, 1910: Rev. supp., .POTTER, Feb. 16",,,,Feb. 16,
"Admiralty-Hydrographic. Irish Coast pilot, 1911. Rev. supplement, 1916 POTTER, July 16",,,Admiralty-Hydrographic,POTTER,,,"Admiralty-Hydrographic. Irish Coast pilot, 1911. Rev. supplement, 1916 POTTER, July 16",,,,July 16,
"Admiralty-Hydrographic. Lights and time signals, List of, 1916. Pt. 1, British 1slands, is. 6d. ; 2, North and Arctic Seas, except Brit. 1sles, 28. 6d. ; 3, Baltic Sea, 2s. ; 4, E. side of N. and S. Atlantic Oceans, S. of Dunkerque, 1s. 6d. ; 5, Mediterranean, Black and Red Seas, is. 6d.; 6, Indian and West Pacific Oceans, 2s.; 7, W. side of S. Atlantic Ocean and E. Pacific Ocean, is. ; 8, W. side of N. Atlantic Ocean (Canada, Newfoundland and Labrador), is. 6d. ; 9, do. (U.S. of America, Gulf of Mexico, West Indies and N. Coast of S. America to Cape Orange), is. 6d. .POTTER, Feb. 16",,,Admiralty-Hydrographic,POTTER,6d.,,"Admiralty-Hydrographic. Lights and time signals, List of, 1916. Pt. 1, British Islands, is. 6d. ; 2, North and Arctic Seas, except Brit. Isles, 28. 6d. ; 3, Baltic Sea, 2s. ; 4, E. side of N. and S. Atlantic Oceans, S. of Dunkerque, Is. 6d. ; 5, Mediterranean, Black and Red Seas, is. 6d.; 6, Indian and West Pacific Oceans, 25.; 7, W. side of S. Atlantic Ocean and E. Pacific Ocean, is. ; 8, W. side of N. Atlantic Ocean (Canada, Newfoundland and Labrador), is. 6d. ; 9, do. (U.S. of America, Gulf of Mexico, West Indies and N. Coast of S. America to Cape Orange), is. 6d. .POTTER, Feb. 16",,,,Feb. 16,
"Admiralty-Hydrographic. Notices to mariners, Index to, 1915, s. .POTTER, Feb. 16",,,Admiralty-Hydrographic,POTTER,,,"Admiralty-Hydrographic. Notices to mariners, Index to, 1915, IS. .POTTER, Feb. 16",,,,Feb. 16,
"Admiralty-Hydrographic. Oceanic depths re- ceived at the Admiralty during 1915, 1s. 6d. J. D. POTTER, May 16",,,Admiralty-Hydrographic,J. D. POTTER,1s. 6d.,,"Admiralty-Hydrographic. Oceanic depths re- ceived at the Admiralty during 1915, Is. 6d. J. D. POTTER, May 16",,,,May 16,
"Admiralty-Hydrographic. Pacific 1slands pilot, Vol. 2, 1908. Supp. No. 3, 1916 POTTER, June 16",,,Admiralty-Hydrographic,POTTER,,,"Admiralty-Hydrographic. Pacific Islands pilot, Vol. 2, 1908. Supp. No. 3, 1916 POTTER, June 16",,,,June 16,
"Admiralty--Hydrographic. Persian Gulf pilot, 1915 : Supp., 1916 .POTTER, Mar. 16",,,Admiralty--Hydrographic,POTTER,,,"Admiralty--Hydrographic. Persian Gulf pilot, 1915 : Supp., 1916 .POTTER, Mar. 16",,,,Mar. 16,
"Admiralty-_Hydrographic. Tide tables, for 1917, for standard ports in the U.K, and other parts of the world. s, 6d. .POTTER, Sep. 16",,,Admiralty-_Hydrographic,POTTER,6d.,,"Admiralty-_Hydrographic. Tide tables, for 1917, for standard ports in the U.K, and other parts of the world. IS, 6d. .POTTER, Sep. 16",,,,Sep. 16,
"Admiralty-Hydrographic. United States (East Coast) pilot. Pt. I, 1909 : Rev. supp., 1915 POTTER, Jan. 16",Admiralty-Hydrographic. United States,East Coast,Pt,POTTER,,,"Admiralty-Hydrographic. United States (East Coast) pilot. Pt. I, 1909 : Rev. supp., 1915 POTTER, Jan. 16",East Coast Admiralty-Hydrographic. United States,['Admiralty-Hydrographic. United States (East Coast)'],,Jan. 16,
"Admiralty-Hydrographic. Yangtse Kiang pilot, 1914. Supp., 1916 ..POTTER, July 16",,,Admiralty-Hydrographic,POTTER,,,"Admiralty-Hydrographic. Yangtse Kiang pilot, 1914. Supp., 1916 ..POTTER, July 16",,,,July 16,
"Admiralty--King's regulations and Admiralty instructions, 191s. Vol. 2, Addenda to Vol. 1, appendices, compar. tab., and index, is. 6d. WYMAN, June 16",,,Admiralty--King's regulations and Admiralty instructions,WYMAN,6d.,,"Admiralty--King's regulations and Admiralty instructions, 1915. Vol. 2, Addenda to Vol. 1, appendices, compar. tab., and index, is. 6d. WYMAN, June 16",,,,June 16,
"Admiralty-Nautical almanac and astronomical ephemeris, for the meridian of the Roy. Observ. at Greenwich, 1919. 2s. 6d. WYMAN, Oct. 16",,,"Admiralty-Nautical almanac and astronomical ephemeris, for the meridian of the Roy",WYMAN,2s. 6d.,,"Admiralty-Nautical almanac and astronomical ephemeris, for the meridian of the Roy. Observ. at Greenwich, 1919. 25. 6d. WYMAN, Oct. 16",,,,Oct. 16,
"Admiralty-Navy list (quarterly) ea. 1s. 6d. WYMAN, Jan. etc., 16",Admiralty-Navy list,quarterly,1s,WYMAN,1s. 6d.,,"Admiralty-Navy list (quarterly) ea. Is. 6d. WYMAN, Jan. etc., 16",quarterly Admiralty-Navy list,['Admiralty-Navy list (quarterly)'],,"Jan. etc., 16",
"Verb. sap. Africa, W.-Edible and oil-producing nuts and seeds : Rpt. of Committee, &c., 5d.; Do. : Minutes of evidence, is. I1d. WYMAN, June 16",,,Verb,WYMAN,1d.,,"Verb. sap. Africa, W.-Edible and oil-producing nuts and seeds : Rpt. of Committee, &c., 5d.; Do. : Minutes of evidence, is. IId. WYMAN, June 16",,,,June 16,
"Agnew (A. T.) The Last farewell ; The Tyrant, and other poems. 8.1 x 51, pp. 28, 60. net (Walsall) T. KIRBY, Aug. 16",Agnew,A. T.,"The Last farewell ; The Tyrant, and other poems",T. KIRBY,,,"Agnew (A. T.) The Last farewell ; The Tyrant, and other poems. 8.1 x 51, pp. 28, 60. net (Walsall) T. KIRBY, Aug. 16",A. T. Agnew,['Agnew (A. T.)'],,Aug. 16,
"Agricultural statistics, 1914. Vol. 49. Pt. 3, Prices and supplies of corn, live stock and other agric. produce in Eng, and Wales. 5d. ; Pt. 4, Im- ports and exports of corn, live stock and other agric. produce. 5d. . WYMAN, Jan. 16",,,Agricultural statistics,WYMAN,5d.,,"Agricultural statistics, 1914. Vol. 49. Pt. 3, Prices and supplies of corn, live stock and other agric. produce in Eng, and Wales. 5d. ; Pt. 4, Im- ports and exports of corn, live stock and other agric. produce. 5d. . WYMAN, Jan. 16",,,,Jan. 16,
"Agricultural statistics (Ireland) w. detailed report for 1914. 8 d..... WYMAN, Od. 16",Agricultural statistics,Ireland,1914,WYMAN,,,"Agricultural statistics (Ireland) w. detailed report for 1914. 8 d..... WYMAN, Od. 16",Ireland Agricultural statistics,['Agricultural statistics (Ireland)'],,Od. 16,
"Agricultural statistics (Ireland) 1916--Gen. abstracts showing acreage under crops and numbers and descrip. of live stock in ca. County and Province, for 1915-16. 2d. WYMAN, Sep. 16",Agricultural statistics,Ireland,,WYMAN,2d.,,"Agricultural statistics (Ireland) 1916--Gen. abstracts showing acreage under crops and numbers and descrip. of live stock in ca. County and Province, for 1915-16. 2d. WYMAN, Sep. 16",Ireland Agricultural statistics,['Agricultural statistics (Ireland)'],,Sep. 16,
"Agricultural statistics, Scotland, 1914-Vol. 3, Pt. 3, Prices and supplies of grain, live stock, and other agric. produce. 3d. WYMAN, Feb. 16",,,"Agricultural statistics, Scotland",WYMAN,3d.,,"Agricultural statistics, Scotland, 1914-Vol. 3, Pt. 3, Prices and supplies of grain, live stock, and other agric. produce. 3d. WYMAN, Feb. 16",,,,Feb. 16,
"Agriculture and Fisheries (Bd. of)-Diseases of Animals Acts and the Markets and Fairs (Weighing of Cattle) Acts, &c. : Annual rpt. of proceedings, for 1915, 3d. WYMAN, May 16",,,"Diseases of Animals Acts and the Markets and Fairs (Weighing of Cattle) Acts, &c",WYMAN,3d.,,"Agriculture and Fisheries (Bd. of)-Diseases of Animals Acts and the Markets and Fairs (Weighing of Cattle) Acts, &c. : Annual rpt. of proceedings, for 1915, 3d. WYMAN, May 16",,"['Agriculture', 'Fisheries (Bd. of)']",,May 16,
"Agriculture and Fisheries (Board of)--Veterinary Officer (Chief): Annual rpt., 1915, id. WYMAN, June 16",,,Annual rpt,WYMAN,,,"Agriculture and Fisheries (Board of)--Veterinary Officer (Chief): Annual rpt., 1915, id. WYMAN, June 16",,"['Agriculture', 'Fisheries (Board of)--Veterinary Officer (Chief)']",,June 16,
"Agriculture for Ireland (Dept. of)-15th Annual gen. rpt. for 1914-1s. s. . . WYMAN, Aug. 16",Agriculture for Ireland,Dept. of,,WYMAN,,,"Agriculture for Ireland (Dept. of)-15th Annual gen. rpt. for 1914-15. IS. . . WYMAN, Aug. 16",Dept. of Agriculture for Ireland,['Agriculture for Ireland (Dept. of)'],,Aug. 16,
"Agriculture for Ireland (Dept. of)- Journal (quarterly), ea. 6d. ...WYMAN, Jan., etc., 16",,,6d,WYMAN,6d.,,"Agriculture for Ireland (Dept. of)- Journal (quarterly), ea. 6d. ...WYMAN, Jan., etc., 16",,['Agriculture for Ireland (Dept. of)- Journal (quarterly)'],,"Jan., etc., 16",
"Agriculture for Scotland (Board of)---4th Report for 1915, 3}d. .WYMAN, July 16",Agriculture for Scotland,Board of,,WYMAN,,,"Agriculture for Scotland (Board of)---4th Report for 1915, 3}d. .WYMAN, July 16",Board of Agriculture for Scotland,['Agriculture for Scotland (Board of)'],,July 16,
"Agriculture (Wales) --Agricul. educa. and improve- ment of live stock in W.: Rpt. for yrs. 1912-13 to 1914-1s. 2 d. WYMAN, June 16",Agriculture,Wales,Agricul,WYMAN,,,"Agriculture (Wales) --Agricul. educa. and improve- ment of live stock in W.: Rpt. for yrs. 1912-13 to 1914-15. 2 d. WYMAN, June 16",Wales Agriculture,['Agriculture (Wales)'],,June 16,
"Aiming instruction. Svo. 8} x 51, pp. 17, 6d. net (Hythe ser. of aids to training, 5) W. S. PAINE, Oct. 16",,,Aiming instruction,W. S. PAINE,6d.,,"Aiming instruction. Svo. 8} x 51, pp. 17, 6d. net (Hythe ser. of aids to training, 5) W. S. PAINE, Oct. 16",,,,Oct. 16,net
"Album national de la Guerre. Fol. 14 XII. 50 copies containing 60 plates, 15 being reproduced in facsimile, ea. £40; 150 copies containing 60 plates, io in facsimile, ea. £8; copies containing 60 plates, 5 in facsimile, ea. £4; copies contain- ing 60 plates, ea. (2.. Thos. AGNEW, Mar. 16",,,Album national de la Guerre,AGNEW,,,"Album national de la Guerre. Fol. 14 XII. 50 copies containing 60 plates, 15 being reproduced in facsimile, ea. £40; 150 copies containing 60 plates, io in facsimile, ea. £8; copies containing 60 plates, 5 in facsimile, ea. £4; copies contain- ing 60 plates, ea. (2.. Thos. AGNEW, Mar. 16",,,,Mar. 16,
