,entry,last_name,first_name,title,publisher,price,price_in_pounds,format,original_entry,author_name,creators,is_editor,date,is_net
3809,"Henty (E. A.)--Australian idylls, and other poems. 1s. 6d. net; swd. is. net E. MATHEWS, Jan. 13",Henty,E. A.,"Australian idylls, and other poems",E. MATHEWS,,0.0,,"Henty (E. A.)--Australian idylls, and other poems. Is. 6d. net; swd. is. net E. MATHEWS, Jan. 13",E. A. Henty,['Henty (E. A.)'],,Jan. 13,
3836,"Herring-Shaw (A.)—Modern sanitary engineering and plumbers' work: progressive scale draw- ings of current practice. Vol. I, 2s. net Vol. 2, 28. 6d. net. Oblong folio LONGMANS, May 13",Herring-Shaw,A.,Modern sanitary engineering and plumbers' work: progressive scale draw- ings of current practice,LONGMANS,,0.0,,"Herring-Shaw (A.)—Modern sanitary engineering and plumbers' work: progressive scale draw- ings of current practice. Vol. I, 25. net Vol. 2, 28. 6d. net. Oblong folio LONGMANS, May 13",A. Herring-Shaw,['Herring-Shaw (A.)'],,May 13,
3838,"Hervey (Arthur)-Meyerbeer. Folio, pp. 64, 1s. 6d. net (Masterpieces of music) JACK, May 13",Hervey,Arthur,Meyerbeer,JACK,1s. 6d.,0.07500000000000001,,"Hervey (Arthur)-Meyerbeer. Folio, pp. 64, Is. 6d. net (Masterpieces of music) JACK, May 13",Arthur Hervey,['Hervey (Arthur)'],,May 13,net
3847,"Hewlett (F. G. W.BIancashire. Cr. 8vo., pp. 256, 1s. 6d. net (Oxford county histories) (Clarendon Press) MILFORD, Oct. 13",Hewlett,"F. G. W.BIancashire. Cr. 8vo., pp. 256, 1s. 6d. net (Oxford county histories",,MILFORD,,0.0,,"Hewlett (F. G. W.BIancashire. Cr. 8vo., pp. 256, Is. 6d. net (Oxford county histories) (Clarendon Press) MILFORD, Oct. 13","F. G. W.BIancashire. Cr. 8vo., pp. 256, 1s. 6d. net (Oxford county histories Hewlett","['Hewlett (F. G. W.BIancashire. Cr. 8vo., pp. 256, 1s. 6d. net (Oxford county histories)']",,Oct. 13,
3882,"HIII (Henry Erskine)—The Parables of the Advent. Ilmo., pp. 100, 1s. 6d. net SKEFFINGTON, Aug. 13",HIII,Henry Erskine,The Parables of the Advent,SKEFFINGTON,1s. 6d.,0.07500000000000001,,"HIII (Henry Erskine)—The Parables of the Advent. Ilmo., pp. 100, Is. 6d. net SKEFFINGTON, Aug. 13",Henry Erskine HIII,['HIII (Henry Erskine)'],,Aug. 13,net
3900,"Hird (Frank)—Lancashire stories. Vol. 2. Ryl. Svo 91 X6, pp. 460, 6s. net ..JACK, May 13",Hird,Frank,Lancashire stories,JACK,6s.,0.3,,"Hird (Frank)—Lancashire stories. Vol. 2. Ryl. Svo 91 X6, pp. 460, 6s. net ..JACK, May 13",Frank Hird,['Hird (Frank)'],,May 13,net
3936,"Hodgson (Mrs. Willoughby)—Old English China. Illus. Folio 13} X93, pp. 222, 258. net BELL, Nov. 13",Hodgson,Mrs. Willoughby,Old English China,BELL,,0.0,,"Hodgson (Mrs. Willoughby)—Old English China. Illus. Folio 13} X93, pp. 222, 258. net BELL, Nov. 13",Mrs. Willoughby Hodgson,['Hodgson (Mrs. Willoughby)'],,Nov. 13,
3938,"Hoey (W.)—“Going East”: advice regarding outfit, the voyage, and procedure on arrival. 12m0., pp. 30, 2s. net B. H. BLACKWELL, July 13",Hoey,W.,"Going East”: advice regarding outfit, the voyage, and procedure on arrival",B. H. BLACKWELL,2s.,0.1,,"Hoey (W.)—“Going East”: advice regarding outfit, the voyage, and procedure on arrival. 12m0., pp. 30, 25. net B. H. BLACKWELL, July 13",W. Hoey,['Hoey (W.)'],,July 13,net
3995,"Hopa (W. H. St. John)-Windsor Castle : architectural history. 2 vols. and portfolio of plans. Folio 15 X 10, pp. 670, 126s. net  COUNTRY LIFE, Dec. 13",Hopa,W. H. St. John,Windsor Castle : architectural history,COUNTRY LIFE,126s.,6.3,,"Hopa (W. H. St. John)-Windsor Castle : architectural history. 2 vols. and portfolio of plans. Folio 15 X 10, pp. 670, 126s. net  COUNTRY LIFE, Dec. 13",W. H. St. John Hopa,['Hopa (W. H. St. John)'],,Dec. 13,net
4035,"Horse-breeding—Annual report on the adminis- tration of the grant for the encouragement and improvement of light horse-breeding, 1911-12 3d. WYMAN, A pr. 13",,,Horse-breeding—Annual report on the adminis- tration of the grant for the encouragement and improvement of light horse-breeding,WYMAN,3d.,0.0125,,"Horse-breeding—Annual report on the adminis- tration of the grant for the encouragement and improvement of light horse-breeding, 1911-12 3d. WYMAN, A pr. 13",,,,A pr. 13,
4059,"Housing of the working classes : memorandum, with respect to the provision and arrangement ...WYMAN, Apr. 13",,,"Housing of the working classes : memorandum, with respect to the provision and arrangement ",WYMAN,,0.0,,"Housing of the working classes : memorandum, with respect to the provision and arrangement ...WYMAN, Apr. 13",,,,Apr. 13,
4081,"Howe (P. P.)-Malthus and the publishing trade, M SECKER, Sep. 13",Howe,P. P.,,M SECKER,,0.0,,"Howe (P. P.)-Malthus and the publishing trade, M SECKER, Sep. 13",P. P. Howe,['Howe (P. P.)'],,Sep. 13,
4085,"Huggins (Sir William and Lady)-Atlas of repre- sentative stellar spectra from 4,870 to 3,300. Discussion of evolutional order of stars, and interpretation of their spectra, preceded by a short history of Sir William Huggins' Observa. tory and its work, with 13 plates. Folio, advanced to 31s. 6d. net ....WESLEY, June 13",Huggins,Sir William,Atlas of repre- sentative stellar spectra from 4,WESLEY,31s. 6d.,1.575,,"Huggins (Sir William and Lady)-Atlas of repre- sentative stellar spectra from 4,870 to 3,300. Discussion of evolutional order of stars, and interpretation of their spectra, preceded by a short history of Sir William Huggins' Observa. tory and its work, with 13 plates. Folio, advanced to 31s. 6d. net ....WESLEY, June 13",Sir William Huggins,"['Huggins (Sir William)', 'Huggins (Lady)']",,June 13,net
4090,"Hughes (H. V.) ed.--Early English harmony from the 11th to the 15th century. Vol. 2. (Plainsong and Medieval Music Society). Folio, pp. 134, 40s, net QUARITCH, Mar. 13",Hughes,H. V.,Early English harmony from the,QUARITCH,40s.,2.0,,"Hughes (H. V.) ed.--Early English harmony from the 11th to the 15th century. Vol. 2. (Plainsong and Medieval Music Society). Folio, pp. 134, 40s, net QUARITCH, Mar. 13",H. V. Hughes,['Hughes (H. V.)'],ed.,Mar. 13,net
4103,"Hugo (Victor)—Depuis l'exil. 2 vols, ea, s. net .NELSON, Jan. 13",Hugo,Victor,Depuis l'exil,NELSON,,0.0,,"Hugo (Victor)—Depuis l'exil. 2 vols, ea, IS. net .NELSON, Jan. 13",Victor Hugo,['Hugo (Victor)'],,Jan. 13,
4105,"Hugo (Victor)-Littérature et philosophie ; Paris. 12m1o., PP. 512, is. net .....NELSON, June 13",Hugo,Victor,Littérature et philosophie ; Paris,NELSON,,0.0,,"Hugo (Victor)-Littérature et philosophie ; Paris. 12m1o., PP. 512, is. net .....NELSON, June 13",Victor Hugo,['Hugo (Victor)'],,June 13,
4141,"Humphreys (H.) see Mills (G. P.) and Humphreys. Humphreys (Mary)—Personal hygiene for girls. 410. 8} x6, pp. 160, 1s. 6d.....CASSELL, Jan. 13",Humphreys,H.,Personal hygiene for girls,CASSELL,1s. 6d.,0.07500000000000001,,"Humphreys (H.) see Mills (G. P.) and Humphreys. Humphreys (Mary)—Personal hygiene for girls. 410. 8} x6, pp. 160, Is. 6d.....CASSELL, Jan. 13",H. Humphreys,"['Humphreys (H.)', 'Humphreys (Mary)']",,Jan. 13,
4176,"Hutchinson (Walter) ed.-Customs of the world : a popular account of the manners, rites, and ceremonies of men and women in all countries. Vol. 1. 410. 11 X 81, pp. 608, 13s. 6d. net HUTCHIINSON, May 13",Hutchinson,Walter,"Customs of the world : a popular account of the manners, rites, and ceremonies of men and women in all countries",HUTCHIINSON,13s. 6d.,0.675,,"Hutchinson (Walter) ed.-Customs of the world : a popular account of the manners, rites, and ceremonies of men and women in all countries. Vol. 1. 410. 11 X 81, pp. 608, 135. 6d. net HUTCHIINSON, May 13",Walter Hutchinson,['Hutchinson (Walter)'],ed.,May 13,net
4194,"Hythe (Viscount)–Problems of Empire : papers and addresses. New edit. Svo. 5s. net LONGMANS, Nov. 13",Hythe,Viscount,Problems of Empire : papers and addresses,LONGMANS,5s.,0.25,,"Hythe (Viscount)–Problems of Empire : papers and addresses. New edit. Svo. 55. net LONGMANS, Nov. 13",Viscount Hythe,['Hythe (Viscount)'],,Nov. 13,net
4203,"Hygiene (The Journal of). Fa. number 7s. net CAMB. UNIV. PRESS, Jan., &c. 13",,,Hygiene (The Journal of),CAMB. UNIV. PRESS,7s.,0.35,,"Hygiene (The Journal of). Fa. number 7s. net CAMB. UNIV. PRESS, Jan., &c. 13",,,,"Jan., &c. 13",net
4206,"Ibsen (Henrik)-Peer Gynt. A new trans. by R. Ellis Roberts. Imp. iómo. 71 x5), pp. 286, 58. net... ....M. SECKER, Feb. 13",Ibsen,Henrik,Peer Gynt,M. SECKER,,0.0,,"Ibsen (Henrik)-Peer Gynt. A new trans. by R. Ellis Roberts. Imp. iómo. 71 x5), pp. 286, 58. net... ....M. SECKER, Feb. 13",Henrik Ibsen,['Ibsen (Henrik)'],,Feb. 13,
4210,"Ibsen calendar (The), 1914. 12m0., pp. 96, swd. s. net F. PALMER, Nov. 13",,,Ibsen calendar (The),F. PALMER,,0.0,,"Ibsen calendar (The), 1914. 12m0., pp. 96, swd. IS. net F. PALMER, Nov. 13",,,,Nov. 13,
4211,"Icelandic sagas, Craigie (W. A.) 1s., 2s. od. net Icely (H. E. M.)-English history illustrated from original sources, 1715-181s. 12m0., pp. 124, 2s. BLACK, May 13","Icelandic sagas, Craigie",W. A.,,BLACK,2s.,0.1,,"Icelandic sagas, Craigie (W. A.) Is., 25. od. net Icely (H. E. M.)-English history illustrated from original sources, 1715-1815. 12m0., pp. 124, 25. BLACK, May 13","W. A. Icelandic sagas, Craigie","['Icelandic sagas, Craigie (W. A.)']",,May 13,
4213,"Igglesden (Charles)-A Saunter through Kent. with pen and pencil. Illus. by X. Willis. 4t0., pp. 82, 2s. 60. KENTISH EXPRESS, May 13",Igglesden,Charles,A Saunter through Kent,KENTISH EXPRESS,,0.0,,"Igglesden (Charles)-A Saunter through Kent. with pen and pencil. Illus. by X. Willis. 4t0., pp. 82, 25. 60. KENTISH EXPRESS, May 13",Charles Igglesden,['Igglesden (Charles)'],,May 13,
4215,"Illing worth (J. R.HDivine Immanence: essay on the spiritual significance of prayer Cr. 8vo., pp. 228, is. net (Macmillan's theo- logical lib.). .MACMILLAN, July 13",Illing worth,"J. R.HDivine Immanence: essay on the spiritual significance of prayer Cr. 8vo., pp. 228, is. net (Macmillan's theo- logical lib.",,MACMILLAN,,0.0,,"Illing worth (J. R.HDivine Immanence: essay on the spiritual significance of prayer Cr. 8vo., pp. 228, is. net (Macmillan's theo- logical lib.). .MACMILLAN, July 13","J. R.HDivine Immanence: essay on the spiritual significance of prayer Cr. 8vo., pp. 228, is. net (Macmillan's theo- logical lib. Illing worth","[""Illing worth (J. R.HDivine Immanence: essay on the spiritual significance of prayer Cr. 8vo., pp. 228, is. net (Macmillan's theo- logical lib.)""]",,July 13,
4223,"Income tax assessment, Rhodes (J.) is. net Income tax cases.-Reports. Vol. 6, part 2, 8d. (post free). WYMAN, Feb. 13",,,"Income tax assessment, Rhodes (J.) is",WYMAN,8d.,0.03333333333333333,,"Income tax assessment, Rhodes (J.) is. net Income tax cases.-Reports. Vol. 6, part 2, 8d. (post free). WYMAN, Feb. 13",,,,Feb. 13,
4226,"India (British) - Statistical abstract relating to, from 1901-2 to 1910-11, s. 3d. WYMAN, Mar. 13",India,British,"Statistical abstract relating to, from",WYMAN,3d.,0.0125,,"India (British) - Statistical abstract relating to, from 1901-2 to 1910-11, IS. 3d. WYMAN, Mar. 13",British India,['India (British)'],,Mar. 13,
4227,"India, Decisive battles of, Malleson (G. B.) 18s. India (East)-Attempt upon the life of His Excellency the Viceroy, 1dd. (post free) WYMAN, Mar. 13",,,"India, Decisive battles of, Malleson (G. B.)",WYMAN,,0.0,,"India, Decisive battles of, Malleson (G. B.) 18s. India (East)-Attempt upon the life of His Excellency the Viceroy, Idd. (post free) WYMAN, Mar. 13",,,,Mar. 13,
4228,"India (East)—Delhi Town Planning Committee on choice of site for Imperial Capital. 1st report, is. 2d. ; 2nd report, is. 3d. ; final report, s. 8d. With maps. ... WYMAN, July 13",India,East,Delhi Town Planning Committee on choice of site for Imperial Capital,WYMAN,,0.0,,"India (East)—Delhi Town Planning Committee on choice of site for Imperial Capital. Ist report, is. 2d. ; 2nd report, is. 3d. ; final report, IS. 8d. With maps. ... WYMAN, July 13",East India,['India (East)'],,July 13,
4229,"India (East)-Home accounts, 1911-12 and 1912- 13. 6 d. .. WYMAN, May 13",India,East,Home accounts,WYMAN,,0.0,,"India (East)-Home accounts, 1911-12 and 1912- 13. 6 d. .. WYMAN, May 13",East India,['India (East)'],,May 13,
4230,"India (East)-Income and expenditure : return of the net income and expenditure for the eleven years from 1901-2 to 1911-12. 7d. WYMAN, Apr. 13",India,East,Income and expenditure : return of the net income and expenditure for the eleven years from,WYMAN,7d.,0.029166666666666667,,"India (East)-Income and expenditure : return of the net income and expenditure for the eleven years from 1901-2 to 1911-12. 7d. WYMAN, Apr. 13",East India,['India (East)'],,Apr. 13,
4231,"India (East)—Indian financial statement and budget for 1913-14, 28. 6d.; Estimate of revenue and expenditure for 1912-13, 2d. WYMAN, June 13",India,East,Indian financial statement and budget for,WYMAN,2d.,0.008333333333333333,,"India (East)—Indian financial statement and budget for 1913-14, 28. 6d.; Estimate of revenue and expenditure for 1912-13, 2d. WYMAN, June 13",East India,['India (East)'],,June 13,
4232,"India (East)—Mint for gold coinage, 8 d. (post free) WYMAN, Feb. 13",India,East,Mint for gold coinage,WYMAN,,0.0,,"India (East)—Mint for gold coinage, 8 d. (post free) WYMAN, Feb. 13",East India,['India (East)'],,Feb. 13,
4233,"India (East)-Moral and material progress and condition during 1911-12, &c. WYMAN, Aug. 13",India,East,Moral and material progress and condition during,WYMAN,,0.0,,"India (East)-Moral and material progress and condition during 1911-12, &c. WYMAN, Aug. 13",East India,['India (East)'],,Aug. 13,
4234,"India (Fast)--Proceedings of the Second All- India Sanitary Conference, held at Madras in s. 3d. ..WYMAN, May 13",India,Fast,"Proceedings of the Second All- India Sanitary Conference, held at Madras in s",WYMAN,3d.,0.0125,,"India (Fast)--Proceedings of the Second All- India Sanitary Conference, held at Madras in IS. 3d. ..WYMAN, May 13",Fast India,['India (Fast)'],,May 13,
4235,"India (East)-Report of committee on the system of state technical scholarships established by the Government of India in 1904, 1s. 5d. WYMAN, June 13",India,East,Report of committee on the system of state technical scholarships established by the Government of India in,WYMAN,1s. 5d.,0.07083333333333333,,"India (East)-Report of committee on the system of state technical scholarships established by the Government of India in 1904, Is. 5d. WYMAN, June 13",East India,['India (East)'],,June 13,
4236,"IS. d. WYMAN, Sep. 13",,,IS,WYMAN,,0.0,,"IS. d. WYMAN, Sep. 13",,,,Sep. 13,
4237,"India, European in, Hervey (H.) 125, 6d. net Indian Finance and Currency (Royal Commission on)—Interim report, ld.; Evidence, vol. I, 2s. rod. ; Appendices, vol. 1, 2s. iod; vol. 2, 28. 5d.; Index, etc., 6d. . . WYMAN, Sep. 13",,,"India, European in, Hervey (H.)",WYMAN,6d.,0.025,,"India, European in, Hervey (H.) 125, 6d. net Indian Finance and Currency (Royal Commission on)—Interim report, ld.; Evidence, vol. I, 25. rod. ; Appendices, vol. 1, 25. iod; vol. 2, 28. 5d.; Index, etc., 6d. . . WYMAN, Sep. 13",,,,Sep. 13,
4238,"India Office list (The), for 1913. Svo., Ios. 6d. HARRISON, June 13",,,"India Office list (The), for",HARRISON,6d.,0.025,,"India Office list (The), for 1913. Svo., Ios. 6d. HARRISON, June 13",,,,June 13,
4240,"Industrial and provident societies : Reports for 1911. 2s. 6d. WYMAN, June 13",,,Industrial and provident societies : Reports for,WYMAN,2s. 6d.,0.125,,"Industrial and provident societies : Reports for 1911. 25. 6d. WYMAN, June 13",,,,June 13,
4241,"Industrial Council --Enquiry into industrial agree- ments : Minutes of evidence, appendices and index. 58. 4d. WYMAN, Aug. 13",,,"Industrial Council --Enquiry into industrial agree- ments : Minutes of evidence, appendices and index",WYMAN,4d.,0.016666666666666666,,"Industrial Council --Enquiry into industrial agree- ments : Minutes of evidence, appendices and index. 58. 4d. WYMAN, Aug. 13",,,,Aug. 13,
4242,"Industrial Disputes Investigation Act of Canada Report on the, 4]d. (post free) WYMAN, Feb. 13",,,"Industrial Disputes Investigation Act of Canada Report on the, 4]d",WYMAN,,0.0,,"Industrial Disputes Investigation Act of Canada Report on the, 4]d. (post free) WYMAN, Feb. 13",,,,Feb. 13,
4244,"Inebriates Acts-Report of Inspector for 1911. 4d. WYMAN, May 13",,,Inebriates Acts-Report of Inspector for,WYMAN,4d.,0.016666666666666666,,"Inebriates Acts-Report of Inspector for 1911. 4d. WYMAN, May 13",,,,May 13,
4261,"Inland Revenue-Report, 1912-13. 1s. 5d. WYMAN, Oct. 13",,,Inland Revenue-Report,WYMAN,1s. 5d.,0.07083333333333333,,"Inland Revenue-Report, 1912-13. Is. 5d. WYMAN, Oct. 13",,,,Oct. 13,
4263,"Insurance (National)—Medical benefit under the German sickness insurance legislation. 4}d. WYMAN, Jan. 13",Insurance,National,Medical benefit under the German sickness insurance legislation,WYMAN,,0.0,,"Insurance (National)—Medical benefit under the German sickness insurance legislation. 4}d. WYMAN, Jan. 13",National Insurance,['Insurance (National)'],,Jan. 13,
4264,"Insurance (National)—National Health Insurance. Statutory rules and orders issued during 1912 ; with an index to the Statutory Powers and Rules and Orders in force on Dec. 31st, 1912 WYMAN, May 13",Insurance,National,National Health Insurance,WYMAN,,0.0,,"Insurance (National)—National Health Insurance. Statutory rules and orders issued during 1912 ; with an index to the Statutory Powers and Rules and Orders in force on Dec. 31st, 1912 WYMAN, May 13",National Insurance,['Insurance (National)'],,May 13,
4265,"Insurance (National) -Part 1 (Health) : Adminis- tration in Ireland. Report for 1912-13. 6d. WYMAN, July 13",Insurance,National,Part 1 (Health) : Adminis- tration in Ireland,WYMAN,6d.,0.025,,"Insurance (National) -Part 1 (Health) : Adminis- tration in Ireland. Report for 1912-13. 6d. WYMAN, July 13",National Insurance,['Insurance (National)'],,July 13,
4266,"WYMAN, July 13",,,,WYMAN,,0.0,,"WYMAN, July 13",,,,July 13,
4267,"Insurance (National) - Part 1 (Health) : Adminis- tration in Wales. Report for 1912-13. 6d. WYMAN, July 13",Insurance,National,Part 1 (Health) : Adminis- tration in Wales,WYMAN,6d.,0.025,,"Insurance (National) - Part 1 (Health) : Adminis- tration in Wales. Report for 1912-13. 6d. WYMAN, July 13",National Insurance,['Insurance (National)'],,July 13,
4268,"Insurance (National)-Part 2. Unemployment Insurance. Decisions given by the Umpire. Being those published in the “ Board of Trade Journals, Sept. 19th to Dec. 26th, 1912, inclusive, 3d. WYMAN, Jan. 13",Insurance,National,Part 2,WYMAN,3d.,0.0125,,"Insurance (National)-Part 2. Unemployment Insurance. Decisions given by the Umpire. Being those published in the “ Board of Trade Journals, Sept. 19th to Dec. 26th, 1912, inclusive, 3d. WYMAN, Jan. 13",National Insurance,['Insurance (National)'],,Jan. 13,
4269,"Insurance (National)-Report on an enquiry into the reasons why certain insured persons became deposit contributors. 1 d. WYMAN, Aug. 13",Insurance,National,Report on an enquiry into the reasons why certain insured persons became deposit contributors,WYMAN,,0.0,,"Insurance (National)-Report on an enquiry into the reasons why certain insured persons became deposit contributors. 1 d. WYMAN, Aug. 13",National Insurance,['Insurance (National)'],,Aug. 13,
4270,"Insurance (National) —Report for 1912–13 on administration of Pt. I of the Act (Health Insurance). 2s. gd. ... WYMAN, July 13",Insurance,National,Report for,WYMAN,,0.0,,"Insurance (National) —Report for 1912–13 on administration of Pt. I of the Act (Health Insurance). 25. gd. ... WYMAN, July 13",National Insurance,['Insurance (National)'],,July 13,
4271,"Insurance (National)—-Table showing voluntary rate for female insured persons, id. ; Unemploy- ment regulations, Jan. 8th, 1913, id. (post free) WYMAN, Jan. 13",Insurance,National,"Table showing voluntary rate for female insured persons, id. ; Unemploy- ment regulations, Jan",WYMAN,,0.0,,"Insurance (National)—-Table showing voluntary rate for female insured persons, id. ; Unemploy- ment regulations, Jan. 8th, 1913, id. (post free) WYMAN, Jan. 13",National Insurance,['Insurance (National)'],,Jan. 13,
4272,"Insurance (National)—Unemployment insurance : return relating to courts of referees. 8ļd. WYMAN, June 13",Insurance,National,Unemployment insurance : return relating to courts of referees,WYMAN,,0.0,,"Insurance (National)—Unemployment insurance : return relating to courts of referees. 8ļd. WYMAN, June 13",National Insurance,['Insurance (National)'],,June 13,
4278,"Insurance (National)-Handbook to the adminis- tration of sickness and maternity benefits. The Approved Societies'. Provisional 1ssue. WYMAN, Jan. 13",Insurance,National,Handbook to the adminis- tration of sickness and maternity benefits,WYMAN,,0.0,,"Insurance (National)-Handbook to the adminis- tration of sickness and maternity benefits. The Approved Societies'. Provisional Issue. WYMAN, Jan. 13",National Insurance,['Insurance (National)'],,Jan. 13,
4279,"Insurance (National), Ireland-Regulations, Dec- ember 18th, 1912, id. ; Do., Rules, November 28th, 1912 (Ireland), id. (post free) WYMAN, Jan. 13",Insurance,National,"Ireland-Regulations, Dec- ember",WYMAN,,0.0,,"Insurance (National), Ireland-Regulations, Dec- ember 18th, 1912, id. ; Do., Rules, November 28th, 1912 (Ireland), id. (post free) WYMAN, Jan. 13",National Insurance,['Insurance (National)'],,Jan. 13,
4280,"Insurance (National) —List of Societies approved up to Dec. 31st, 1912, by the National Health Joint Committee and by the National Health Insurance Commissioners for England, Scotland. Ireland and Wales 9d. ....WYMAN, A pr. 13",Insurance,National,List of Societies approved up to Dec,WYMAN,9d.,0.0375,,"Insurance (National) —List of Societies approved up to Dec. 31st, 1912, by the National Health Joint Committee and by the National Health Insurance Commissioners for England, Scotland. Ireland and Wales 9d. ....WYMAN, A pr. 13",National Insurance,['Insurance (National)'],,A pr. 13,
4284,"Irish Finance (Committee on)-Evidence. 2s. WYMAN, May 13",Irish Finance,Committee on,Evidence,WYMAN,2s.,0.1,,"Irish Finance (Committee on)-Evidence. 25. WYMAN, May 13",Committee on Irish Finance,['Irish Finance (Committee on)'],,May 13,
4285,"Irish Land Commission-Accounts, 1911-12. 2}d. WYMAN, Feb. 13",,,Irish Land Commission-Accounts,WYMAN,,0.0,,"Irish Land Commission-Accounts, 1911-12. 2}d. WYMAN, Feb. 13",,,,Feb. 13,
4286,"Irish Land Commission-Report, 1912-13. iS. 3d. WYMAN, Aug. 13",,,Irish Land Commission-Report,WYMAN,3d.,0.0125,,"Irish Land Commission-Report, 1912-13. iS. 3d. WYMAN, Aug. 13",,,,Aug. 13,
4287,"Irish Land Commission-Returns of advances. Monthly (various prices)..WYMAN, Jan., &c., 13",,,Irish Land Commission-Returns of advances,WYMAN,,0.0,,"Irish Land Commission-Returns of advances. Monthly (various prices)..WYMAN, Jan., &c., 13",,,,"Jan., &c., 13",
4288,"Irish Land Commission-Returns of proceedings. (Monthly) ea. 2d.. . WYMAN, Jan., &c., 13",,,Irish Land Commission-Returns of proceedings,WYMAN,2d.,0.008333333333333333,,"Irish Land Commission-Returns of proceedings. (Monthly) ea. 2d.. . WYMAN, Jan., &c., 13",,,,"Jan., &c., 13",
4290,"Irish Universities Act, 1908-Accounts of Univer- sities and Colleges, Ireland, for 1911-12; with report of the Comptroller and Auditor- General 2!d. WYMAN, Jan. 13",,,Irish Universities Act,WYMAN,,0.0,,"Irish Universities Act, 1908-Accounts of Univer- sities and Colleges, Ireland, for 1911-12; with report of the Comptroller and Auditor- General 2!d. WYMAN, Jan. 13",,,,Jan. 13,
4294,"Iron and steel, 1911–Tables showing production and consumption, &c., in recent years. 7d. WYMAN, Jan. 13",,,Iron and steel,WYMAN,7d.,0.029166666666666667,,"Iron and steel, 1911–Tables showing production and consumption, &c., in recent years. 7d. WYMAN, Jan. 13",,,,Jan. 13,
4296,"Ireland : Congested Districts Board—20th report of proceedings, 1911-12. 5d. WYMAN, Jan. 13",,,Ireland : Congested Districts Board,WYMAN,5d.,0.020833333333333332,,"Ireland : Congested Districts Board—20th report of proceedings, 1911-12. 5d. WYMAN, Jan. 13",,,,Jan. 13,
4297,"Ireland—Emigration statistics, 1912. 2}d. WYMAN, Apr. Ireland --Emigration statistics. (Monthly.) ea. id. WYMAN, Jan., &c., 13",,,Ireland—Emigration statistics,WYMAN,,0.0,,"Ireland—Emigration statistics, 1912. 2}d. WYMAN, Apr. Ireland --Emigration statistics. (Monthly.) ea. id. WYMAN, Jan., &c., 13",,,,"Jan., &c., 13",
4298,"Ireland—Land Purchase Fund account, 1911-12, 2d. (post free) .WYMAN, Feb. 13",,,Ireland—Land Purchase Fund account,WYMAN,2d.,0.008333333333333333,,"Ireland—Land Purchase Fund account, 1911-12, 2d. (post free) .WYMAN, Feb. 13",,,,Feb. 13,
4321,"Jacobs (W. W.)-Odd craft. Pop. ., . Jackson (Alice F.)–Oliver Twist, Dickens ici ? Jaepuo es lo metotle HODDER & S., June 13",Jacobs,W. W.,Odd craft,HODDER & S.,,0.0,,"Jacobs (W. W.)-Odd craft. Pop. ., . Jackson (Alice F.)–Oliver Twist, Dickens ici ? Jaepuo es lo metotle HODDER & S., June 13",W. W. Jacobs,['Jacobs (W. W.)'],,June 13,
4331,"Jackson (Holbrook) —Town : essay. swd. 6d. .STEVENS, July 13",Jackson,Holbrook,Town : essay,STEVENS,6d.,0.025,,"Jackson (Holbrook) —Town : essay. swd. 6d. .STEVENS, July 13",Holbrook Jackson,['Jackson (Holbrook)'],,July 13,
4340,"Jacobs (W. W.)-Captains all. Svo., swd. 6. HODDER & S., May 13",Jacobs,W. W.,Captains all,HODDER & S.,,0.0,,"Jacobs (W. W.)-Captains all. Svo., swd. 6. HODDER & S., May 13",W. W. Jacobs,['Jacobs (W. W.)'],,May 13,
4375,"Jenkins (H. D.)—Behind Turkish lattices. Izmo., W. COLLINS, Apr. 13",Jenkins,H. D.,Behind Turkish lattices,W. COLLINS,,0.0,,"Jenkins (H. D.)—Behind Turkish lattices. Izmo., W. COLLINS, Apr. 13",H. D. Jenkins,['Jenkins (H. D.)'],,Apr. 13,
