,entry,last_name,first_name,title,publisher,price,price_in_pounds,format,original_entry,author_name,creators,is_editor,date,is_net
5842,"Moulton (James Hope)-Early Zoroastrianism. (Hibbert lectures, and ser.) 8vo. 84 X5 , pp. 488, ios, 6d. net . WILLIAMS & N., Dec. 13",,,,WILLIAMS & N.,6d.,0.025,,"Moulton (James Hope)-Early Zoroastrianism. (Hibbert lectures, and ser.) 8vo. 84 X5 , pp. 488, ios, 6d. net . WILLIAMS & N., Dec. 13",,"['Moulton (James Hope)-Early Zoroastrianism. (Hibbert lectures,)', '-Early Zoroastrianism. (ser.)']",,Dec. 13,net
5862,"Municipal and County Engineers (Institution of) -Specification for concrete flags. 2nd edit. rev., Dec. 1912. Folio swd. 2s. 6d. net SPON, Jan. 13",,,Municipal and County Engineers (Institution of) -Specification for concrete flags,SPON,2s. 6d.,0.125,,"Municipal and County Engineers (Institution of) -Specification for concrete flags. 2nd edit. rev., Dec. 1912. Folio swd. 2s. 6d. net SPON, Jan. 13",,,,Jan. 13,net
5866,"Munro (James)-Canada (1535-present-day). Cr. Evo., pp. 128, 1s. net. (English history source books) ..BELL, June 13",,,,BELL,,0.0,,"Munro (James)-Canada (1535-present-day). Cr. Evo., pp. 128, Is. net. (English history source books) ..BELL, June 13",,['Munro (James)-Canada (1535-present-day)'],,June 13,
5876,"Musical Association-Proceedings. Thirty-ninth Session. 1912-13. Svo. 8} 5), pp. 202, 21s. net .NOVELLO, Dec. 13",,,Musical Association-Proceedings,NOVELLO,21s.,1.05,,"Musical Association-Proceedings. Thirty-ninth Session. 1912-13. Svo. 8} 5), pp. 202, 21S. net .NOVELLO, Dec. 13",,,,Dec. 13,net
5885,"Murray (M. A. Ancient Egyptian legends Ryl. 16mo. 64 x 41, pp. 120, 2s. net (Wisdom of the East) • MURRAY, Jan. 13",Murray,"M. A. Ancient Egyptian legends Ryl. 16mo. 64 x 41, pp. 120, 2s. net (Wisdom of the East",,MURRAY,,0.0,,"Murray (M. A. Ancient Egyptian legends Ryl. 16mo. 64 x 41, pp. 120, 25. net (Wisdom of the East) • MURRAY, Jan. 13","M. A. Ancient Egyptian legends Ryl. 16mo. 64 x 41, pp. 120, 2s. net (Wisdom of the East Murray","['Murray (M. A. Ancient Egyptian legends Ryl. 16mo. 64 x 41, pp. 120, 2s. net (Wisdom of the East)']",,Jan. 13,
5889,"Mursell (Arthur)Memories of my life. Svo. 81 X54, pp. 296, 6s, net FODDER & S., Nov. 13",Mursell,Arthur,Memories of my life,FODDER & S.,6s.,0.3,,"Mursell (Arthur)Memories of my life. Svo. 81 X54, pp. 296, 6s, net FODDER & S., Nov. 13",Arthur Mursell,['Mursell (Arthur)'],,Nov. 13,net
5908,"Nairne (W. P.)-Greatheart of Papua : James Chalmers, Cr. Evo. 78 X 41, pp. 24. 2s. net MILFORD, Dec. 13",Nairne,W. P.,Greatheart of Papua : James Chalmers,MILFORD,2s.,0.1,,"Nairne (W. P.)-Greatheart of Papua : James Chalmers, Cr. Evo. 78 X 41, pp. 24. 25. net MILFORD, Dec. 13",W. P. Nairne,['Nairne (W. P.)'],,Dec. 13,net
5909,"Naish (P. L1.)--Chestnuts hot a'id cold. Cr. Svo. Swd. is, net ...HEATH, CRANTON, Apr. 13",Naish,P. L1.,Chestnuts hot a'id cold,"HEATH, CRANTON",,0.0,,"Naish (P. L1.)--Chestnuts hot a'id cold. Cr. Svo. Swd. is, net ...HEATH, CRANTON, Apr. 13",P. L1. Naish,['Naish (P. L1.)'],,Apr. 13,
5912,"National Reserve regulations, 1913, 11d. (post free) WYMAN, Mar. 13",,,National Reserve regulations,WYMAN,11d.,0.04583333333333333,,"National Reserve regulations, 1913, 11d. (post free) WYMAN, Mar. 13",,,,Mar. 13,
5920,"National Gallery-British and foreign pictures : descriptive and historical catalogue, with biographical notices of the painters, &c. 81st eclit. s........ ..NAT. GALLERY, June 13",,,"National Gallery-British and foreign pictures : descriptive and historical catalogue, with biographical notices of the painters, &c",NAT. GALLERY,,0.0,,"National Gallery-British and foreign pictures : descriptive and historical catalogue, with biographical notices of the painters, &c. 81st eclit. IS........ ..NAT. GALLERY, June 13",,,,June 13,
5921,"National Gallery-Report, 1912. 2}d. WYMAS, May 13",,,National Gallery-Report,WYMAS,,0.0,,"National Gallery-Report, 1912. 2}d. WYMAS, May 13",,,,May 13,
5922,"National Gallery of British Art-Loan Exlibition of Works by William Blake. Oct.--Dec. 1913. 6d. NAT. GALLERY OF BRIT, ART, Oct. 13",,,National Gallery of British Art-Loan Exlibition of Works by William Blake,"NAT. GALLERY OF BRIT, ART",6d.,0.025,,"National Gallery of British Art-Loan Exlibition of Works by William Blake. Oct.--Dec. 1913. 6d. NAT. GALLERY OF BRIT, ART, Oct. 13",,,,Oct. 13,
5923,"National Gallery of British Art-Catalogue, with descriptions, historical notes, and lives of deceased artists. 20th edit. 6d. NAT. GALLERY OF BRIT. ART., Jan. 13",,,"National Gallery of British Art-Catalogue, with descriptions, historical notes, and lives of deceased artists",NAT. GALLERY OF BRIT. ART.,6d.,0.025,,"National Gallery of British Art-Catalogue, with descriptions, historical notes, and lives of deceased artists. 20th edit. 6d. NAT. GALLERY OF BRIT. ART., Jan. 13",,,,Jan. 13,
5925,"National Portrait Gallery-Paintings, sculptures, miniatures, &c. Illus. list. 2nd edit. 6d. NAT. PORT. GALLERY, Feb. 13",,,"National Portrait Gallery-Paintings, sculptures, miniatures, &c",NAT. PORT. GALLERY,6d.,0.025,,"National Portrait Gallery-Paintings, sculptures, miniatures, &c. Illus. list. 2nd edit. 6d. NAT. PORT. GALLERY, Feb. 13",,,,Feb. 13,
5926,"National Portrait Gallery-56th annual report of the trustees, for 1912-13. 2d. WYMAN, July 13",,,National Portrait Gallery,WYMAN,2d.,0.008333333333333333,,"National Portrait Gallery-56th annual report of the trustees, for 1912-13. 2d. WYMAN, July 13",,,,July 13,
5928,"National proverbs: Ireland. 1бmo., pp. 86, bds., s. net.. F. PALMER, Oct. 13",,,National proverbs: Ireland,F. PALMER,,0.0,,"National proverbs: Ireland. 1бmo., pp. 86, bds., IS. net.. F. PALMER, Oct. 13",,,,Oct. 13,
5931,"Naunton (G. H.)- Japanese sword fittings : a descriptive catalogue of the collection of G. H. Naunton. Illus. Fol., 52s. 6d. net AUTHOR, Mar. 13",Naunton,G. H.,Japanese sword fittings : a descriptive catalogue of the collection of G. H. Naunton,AUTHOR,52s. 6d.,2.625,,"Naunton (G. H.)- Japanese sword fittings : a descriptive catalogue of the collection of G. H. Naunton. Illus. Fol., 525. 6d. net AUTHOR, Mar. 13",G. H. Naunton,['Naunton (G. H.)'],,Mar. 13,net
5934,"Naval mutinies of 1797, Gill (C.) 10s. 6d. net Naval pocket book (The), 1913. Founded by Sir W. Laird Clowes. Edit. by R. C. Anderson. 1бmo., 7ѕ. 6d. net THACKER, May 13",,,Naval mutinies of,THACKER,6d.,0.025,,"Naval mutinies of 1797, Gill (C.) 105. 6d. net Naval pocket book (The), 1913. Founded by Sir W. Laird Clowes. Edit. by R. C. Anderson. 1бmo., 7ѕ. 6d. net THACKER, May 13",,,,May 13,net
5936,"Navy-Correspondence between the First Lord of the Admiralty and the Prime Minister of the Dominion of Canada, ijd. (post free) WYMAN, Mar. 13",,,"Navy-Correspondence between the First Lord of the Admiralty and the Prime Minister of the Dominion of Canada, ijd",WYMAN,,0.0,,"Navy-Correspondence between the First Lord of the Admiralty and the Prime Minister of the Dominion of Canada, ijd. (post free) WYMAN, Mar. 13",,,,Mar. 13,
5937,"Navy-Courts-martial return, 1911, 14d. (post free) WYMAN, Jan. 13",,,Navy-Courts-martial return,WYMAN,14d.,0.058333333333333334,,"Navy-Courts-martial return, 1911, 14d. (post free) WYMAN, Jan. 13",,,,Jan. 13,
5938,"Navy-Estimates for 1913-14, with explanations of differences, 3s. ud. ; Explanatory statement of the First Lord of the Admiralty, 3d. WYMAN, Mar 13",,,Navy-Estimates for,WYMAN,3d.,0.0125,,"Navy-Estimates for 1913-14, with explanations of differences, 3s. ud. ; Explanatory statement of the First Lord of the Admiralty, 3d. WYMAN, Mar 13",,,,Mar 13,
5939,"Navy_Naval saving bank account, id. (post free) WYMAN, Jan. 13",,,,WYMAN,,0.0,,"Navy_Naval saving bank account, id. (post free) WYMAN, Jan. 13",,,,Jan. 13,
5940,"Navy-Reports of the Committee appointed to enquire into the education and training of cadets, midshipmen, and junior officers of H.M. Fleet. s. 5d. .. WYMAN, Mar. 13",,,"Navy-Reports of the Committee appointed to enquire into the education and training of cadets, midshipmen, and junior officers of H.M. Fleet",WYMAN,5d.,0.020833333333333332,,"Navy-Reports of the Committee appointed to enquire into the education and training of cadets, midshipmen, and junior officers of H.M. Fleet. IS. 5d. .. WYMAN, Mar. 13",,,,Mar. 13,
5941,"Navy-Result of test of guulayers with heavy guns, 1912, 2]d.; Result of battle practice, 1912, 1}d. . WYMAN, Apr. 13",,,Navy-Result of test of guulayers with heavy guns,WYMAN,,0.0,,"Navy-Result of test of guulayers with heavy guns, 1912, 2]d.; Result of battle practice, 1912, 1}d. . WYMAN, Apr. 13",,,,Apr. 13,
5942,"Navy-Return of number of Courts-Martial held and summary punishmentsinflicted during 1911, id. WYMAN, Jan. 13",,,Navy-Return of number of Courts-Martial held and summary punishmentsinflicted during,WYMAN,,0.0,,"Navy-Return of number of Courts-Martial held and summary punishmentsinflicted during 1911, id. WYMAN, Jan. 13",,,,Jan. 13,
5943,"Navy—Trafalgar : Report of Committee ap- pointed to examine and consider the evidence relating to the tactics employed by Nelson at Trafalgar. With plans. 2s. 3d. WYMAN, Oct. 13",,,Navy—Trafalgar : Report of Committee ap- pointed to examine and consider the evidence relating to the tactics employed by Nelson at Trafalgar,WYMAN,2s. 3d.,0.1125,,"Navy—Trafalgar : Report of Committee ap- pointed to examine and consider the evidence relating to the tactics employed by Nelson at Trafalgar. With plans. 25. 3d. WYMAN, Oct. 13",,,,Oct. 13,
5946,"Naybard (Hugh)— Zoe the Gypsr. Cr. Svo. 71 X43, pp. 238, 2s. net MURRAT & E., Ap7.13",Naybard,Hugh,Zoe the Gypsr,MURRAT & E.,2s.,0.1,,"Naybard (Hugh)— Zoe the Gypsr. Cr. Svo. 71 X43, pp. 238, 25. net MURRAT & E., Ap7.13",Hugh Naybard,['Naybard (Hugh)'],,Ap7.13,net
5952,"Nearing (S.)-Social religion. Cr. Svo., 4s, 6d. net MACMILLAN, Mar. 13",Nearing,S.,Social religion,MACMILLAN,4s. 6d.,0.225,,"Nearing (S.)-Social religion. Cr. Svo., 4s, 6d. net MACMILLAN, Mar. 13",S. Nearing,['Nearing (S.)'],,Mar. 13,net
5962,"Nelson Universal hand-atlas (The), 12m0., 28. net NELSON, June 13",,,Nelson Universal hand-atlas (The),NELSON,,0.0,,"Nelson Universal hand-atlas (The), 12m0., 28. net NELSON, June 13",,,,June 13,
5966,"New handbook of illustration (The). Cr. Svo 8 X5, pp. 567, 3s. 6d. net (Tools for teachers ser.) .E. STOCK, Sep. 13",,,New handbook of illustration (The),E. STOCK,3s. 6d.,0.175,,"New handbook of illustration (The). Cr. Svo 8 X5, pp. 567, 35. 6d. net (Tools for teachers ser.) .E. STOCK, Sep. 13",,,,Sep. 13,net
6006,"Newte (Horace W. C.)-Calico Jack. Svo. swd. 6d. MILLS & &., Apr. 13",Newte,Horace W. C.,Calico Jack,MILLS & &.,6d.,0.025,,"Newte (Horace W. C.)-Calico Jack. Svo. swd. 6d. MILLS & &., Apr. 13",Horace W. C. Newte,['Newte (Horace W. C.)'],,Apr. 13,
6007,"Newte (Horace W. C.)--The Home of the seven devils. Cr. Syo. 74 X 4), pp. 384, 6s. CHATTO, Sep. 13",Newte,Horace W. C.,The Home of the seven devils,CHATTO,6s.,0.3,,"Newte (Horace W. C.)--The Home of the seven devils. Cr. Syo. 74 X 4), pp. 384, 6s. CHATTO, Sep. 13",Horace W. C. Newte,['Newte (Horace W. C.)'],,Sep. 13,
6033,"Night employment of male young persons in factories and workshops (Departmental Com- mittee on)-Minutes of evidence and appendices 2s. 41. WYMAN, Apr. 13",,,Night employment of male young persons in factories and workshops (Departmental Com- mittee on)-Minutes of evidence and appendices,WYMAN,,0.0,,"Night employment of male young persons in factories and workshops (Departmental Com- mittee on)-Minutes of evidence and appendices 25. 41. WYMAN, Apr. 13",,,,Apr. 13,
6041,"Nithsdale (W. H.) and Manton (A. J.)---Practical hrewing: an elementary treatise. Svo. 71 x 41, pp. 78, 1s. . . SHEPPARD, July 13",Nithsdale,W. H.,Practical hrewing: an elementary treatise,SHEPPARD,1s.,0.05,,"Nithsdale (W. H.) and Manton (A. J.)---Practical hrewing: an elementary treatise. Svo. 71 x 41, pp. 78, Is. . . SHEPPARD, July 13",W. H. Nithsdale,"['Nithsdale (W. H.)', 'Manton (A. J.)']",,July 13,
6043,"Nivedita (Sister) and Coomaraswamy (Ananda K.) --Myths of the liindus and Buddhists. Illus. Ryl. Svo. 91 X64, pp. 412, 15s. net HARRAP, Nov. 13",Nivedita,Sister,Myths of the liindus and Buddhists,HARRAP,15s.,0.75,,"Nivedita (Sister) and Coomaraswamy (Ananda K.) --Myths of the liindus and Buddhists. Illus. Ryl. Svo. 91 X64, pp. 412, 155. net HARRAP, Nov. 13",Sister Nivedita,"['Nivedita (Sister)', 'Coomaraswamy (Ananda K.)']",,Nov. 13,net
6050,"Noble (Margaret E.) see Nivedita (Sister) Noble (Mrs. Nicholas)-Druidean the mystic, and other Irish stories. 12mo. 61 X5, pp. 93, 1s. (Dundalk) W. TEMPEST, Nov. 13",Noble,Margaret E.,,W. TEMPEST,1s.,0.05,,"Noble (Margaret E.) see Nivedita (Sister) Noble (Mrs. Nicholas)-Druidean the mystic, and other Irish stories. 12mo. 61 X5, pp. 93, Is. (Dundalk) W. TEMPEST, Nov. 13",Margaret E. Noble,['Noble (Margaret E.)'],,Nov. 13,
6073,"Notes and reflections. A calendar for 1914, arranged by May and November. 1s. net HEADLEY, Aug. 13",,,Notes and reflections,HEADLEY,1s.,0.05,,"Notes and reflections. A calendar for 1914, arranged by May and November. Is. net HEADLEY, Aug. 13",,,,Aug. 13,net
6092,"Obscene publications and the “ white slave traffic : correspondence respecting the Inter- national Conferences held in Paris, April and May, 1910. 5d. 1... WYMAN, Jan. 13",,,"Obscene publications and the “ white slave traffic : correspondence respecting the Inter- national Conferences held in Paris, April and May",WYMAN,,0.0,,"Obscene publications and the “ white slave traffic : correspondence respecting the Inter- national Conferences held in Paris, April and May, 1910. 5d. 1... WYMAN, Jan. 13",,,,Jan. 13,
6093,"Obstetric practice, Difficulties of, Berkeley (C.) and Bonney (V.) 24s. net Obstetrical Society (Edinburgh) — Transactions, Vol. 38, Session 1912-1913. 8v0., pp. 352, Ios. 6d. .....OLIVE & B., Nov. 13",,,"Obstetric practice, Difficulties of, Berkeley (C.) and Bonney (V.)",OLIVE & B.,6d.,0.025,,"Obstetric practice, Difficulties of, Berkeley (C.) and Bonney (V.) 245. net Obstetrical Society (Edinburgh) — Transactions, Vol. 38, Session 1912-1913. 8v0., pp. 352, Ios. 6d. .....OLIVE & B., Nov. 13",,,,Nov. 13,
6112,"Ogilvie (G.) and Albert (E.)--A Practical course in secondary English. Parts 1, 2, 3. Cr. 80., ea. is. 6d. ; Parts 1 and 2 in 1 vol., 3s. ; Parts 1, 2 and 3 complete, 4s. 6d. HARRAP, Sep. 13",Ogilvie,G.,A Practical course in secondary English,HARRAP,4s. 6d.,0.225,,"Ogilvie (G.) and Albert (E.)--A Practical course in secondary English. Parts 1, 2, 3. Cr. 80., ea. is. 6d. ; Parts 1 and 2 in 1 vol., 35. ; Parts 1, 2 and 3 complete, 4s. 6d. HARRAP, Sep. 13",G. Ogilvie,"['Ogilvie (G.)', 'Albert (E.)']",,Sep. 13,
6118,"Oil from Palm Fruits, West Africa correspondence re, 7d. (post free) WYMAN, Jan. 13",,,"Oil from Palm Fruits, West Africa correspondence re",WYMAN,7d.,0.029166666666666667,,"Oil from Palm Fruits, West Africa correspondence re, 7d. (post free) WYMAN, Jan. 13",,,,Jan. 13,
6119,"Old English costumes : selected from the collec- tion formed by Mr. Talbot Hughes : a sequence of fashions through the 18th and 19th centuries. Illus. 410. 121 X98, pp. 82, 28. 6d. net HARRODS, Dec. 13",,,Old English costumes : selected from the collec- tion formed by Mr,HARRODS,6d.,0.025,,"Old English costumes : selected from the collec- tion formed by Mr. Talbot Hughes : a sequence of fashions through the 18th and 19th centuries. Illus. 410. 121 X98, pp. 82, 28. 6d. net HARRODS, Dec. 13",,,,Dec. 13,net
6134,"Opium Conference, 1911-12.-Instructions to the British Delegates. Ifd. (post free) WYMAN, Feb. 13",,,Opium Conference,WYMAN,,0.0,,"Opium Conference, 1911-12.-Instructions to the British Delegates. Ifd. (post free) WYMAN, Feb. 13",,,,Feb. 13,
6136,"Oppenheim (Annie 1.)—The Face and how to read it. Cr. Ávo. 71 X54, pp. 188, 2s. 6d. net BALLIN, July 13",Oppenheim,Annie 1.,The Face and how to read it,BALLIN,2s. 6d.,0.125,,"Oppenheim (Annie 1.)—The Face and how to read it. Cr. Ávo. 71 X54, pp. 188, 25. 6d. net BALLIN, July 13",Annie 1. Oppenheim,['Oppenheim (Annie 1.)'],,July 13,net
6155,"Oppenheim (L.)—The Panama Canal conflict between Great Britain and the United States of America: a study. Cr. Svo. 7 | X5, pp. 62, 29. 60 net CAMB. UNIV. PRESS, Jan. 13",Oppenheim,L.,The Panama Canal conflict between Great Britain and the United States of America: a study,CAMB. UNIV. PRESS,,0.0,,"Oppenheim (L.)—The Panama Canal conflict between Great Britain and the United States of America: a study. Cr. Svo. 7 | X5, pp. 62, 29. 60 net CAMB. UNIV. PRESS, Jan. 13",L. Oppenheim,['Oppenheim (L.)'],,Jan. 13,
6174,"Orczy (Baroness)—Le Mouron rouge, 1792. 12m0., pp. 370, 1s. net...... NELSON, Mar. 13",Orczy,Baroness,Le Mouron rouge,NELSON,1s.,0.05,,"Orczy (Baroness)—Le Mouron rouge, 1792. 12m0., pp. 370, Is. net...... NELSON, Mar. 13",Baroness Orczy,['Orczy (Baroness)'],,Mar. 13,net
6182,"Ordnance Survey-Professional papers. Investi- gation into the accuracy of the principal trian- gulation of the United Kingdom. 2s. WYMAX, Nov 13",,,Ordnance Survey-Professional papers,WYMAX,2s.,0.1,,"Ordnance Survey-Professional papers. Investi- gation into the accuracy of the principal trian- gulation of the United Kingdom. 25. WYMAX, Nov 13",,,,Nov 13,
6200,"Osgood (Iréne)-A Mother in dreams. 32 mo., pp. 30, 6d. net. .... J. RICHMOND, Jan. 13",Osgood,Iréne,A Mother in dreams,J. RICHMOND,6d.,0.025,,"Osgood (Iréne)-A Mother in dreams. 32 mo., pp. 30, 6d. net. .... J. RICHMOND, Jan. 13",Iréne Osgood,['Osgood (Iréne)'],,Jan. 13,net
6247,"IS. 6d. Oxford Fortnightly (The). No. 1, Jan. 24th, 1913. 6d. ...(Oxford) HOLYWELL PRESS, Feb. 13",,,IS,HOLYWELL PRESS,,0.0,,"IS. 6d. Oxford Fortnightly (The). No. 1, Jan. 24th, 1913. 6d. ...(Oxford) HOLYWELL PRESS, Feb. 13",,,,Feb. 13,
6249,"Oxford University-Abstract of the accounts of the Curators of the University Chest and of University Institutions : together with the accounts of the Colleges for the year ending Dec. 31, 1912. Folio. 3s. 6d. (Clarendon Press) MILFORD, Apr. 13",,,Oxford University-Abstract of the accounts of the Curators of the University Chest and of University Institutions : together with the accounts of the Colleges for the year ending Dec,MILFORD,3s. 6d.,0.175,,"Oxford University-Abstract of the accounts of the Curators of the University Chest and of University Institutions : together with the accounts of the Colleges for the year ending Dec. 31, 1912. Folio. 35. 6d. (Clarendon Press) MILFORD, Apr. 13",,,,Apr. 13,
6263,"Pack transport, Notes on, i}d. (post free) WYMAN, Jan. 13",,,"Pack transport, Notes on, i}d",WYMAN,,0.0,,"Pack transport, Notes on, i}d. (post free) WYMAN, Jan. 13",,,,Jan. 13,
6278,"Palmer (John)—The Comedy of manners. 8yo 9 x 51, pp. 320, 1os. 6d. net....BELL, Oct. 13",Palmer,John,The Comedy of manners,BELL,6d.,0.025,,"Palmer (John)—The Comedy of manners. 8yo 9 x 51, pp. 320, 1os. 6d. net....BELL, Oct. 13",John Palmer,['Palmer (John)'],,Oct. 13,net
6283,"Palmer (W. Scott) and Haggard (A. M.) Michael Fairless. With two portraits. Izmo. 64 X4, pp. 144, 2s. 6d. net DUCKWORTH, Apr.13",Palmer,W. Scott,Michael Fairless,DUCKWORTH,2s. 6d.,0.125,,"Palmer (W. Scott) and Haggard (A. M.) Michael Fairless. With two portraits. Izmo. 64 X4, pp. 144, 25. 6d. net DUCKWORTH, Apr.13",W. Scott Palmer,"['Palmer (W. Scott)', 'Haggard (A. M.)']",,Apr.13,net
6295,"Paradise of the Christian soul, enriched with choicest delights of varied pity. By Horst. New edit. Iamo. 61 X 4, pp. 688, 3s. net PARKER, Apr. 13",,,"Paradise of the Christian soul, enriched with choicest delights of varied pity",PARKER,3s.,0.15,,"Paradise of the Christian soul, enriched with choicest delights of varied pity. By Horst. New edit. Iamo. 61 X 4, pp. 688, 3s. net PARKER, Apr. 13",,,,Apr. 13,net
6297,"Parasite, Martin (H. R.) 6s. Parasitology. Quarterly. Ea. Ios. net CAMB. UNIV. PRESS, Feb., &c., 13","Parasite, Martin",H. R.,,CAMB. UNIV. PRESS,,0.0,,"Parasite, Martin (H. R.) 6s. Parasitology. Quarterly. Ea. Ios. net CAMB. UNIV. PRESS, Feb., &c., 13","H. R. Parasite, Martin","['Parasite, Martin (H. R.)']",,"Feb., &c., 13",
6302,"MACMILLAN, May 13",,,,MACMILLAN,,0.0,,"MACMILLAN, May 13",,,,May 13,
6317,"Parry (R. St. John) ed.—Epistle of Paul the Apostle to the Romans. izmo. 64 X 41, pp. 294, 3s. 6d. net (Greek Testament) CAMB. UNIV. PRESS, Jan. 13",Parry,R. St. John,Epistle of Paul the Apostle to the Romans,CAMB. UNIV. PRESS,3s. 6d.,0.175,,"Parry (R. St. John) ed.—Epistle of Paul the Apostle to the Romans. izmo. 64 X 41, pp. 294, 35. 6d. net (Greek Testament) CAMB. UNIV. PRESS, Jan. 13",R. St. John Parry,['Parry (R. St. John)'],ed.,Jan. 13,net
6319,"Partington (James Riddick)-A Text-book of thermodynamics : with special reference to chemistry. Svo. 8} *5), pp. 554, 14s. net CONSTABLE, May 13",Partington,James Riddick,A Text-book of thermodynamics : with special reference to chemistry,CONSTABLE,14s.,0.7,,"Partington (James Riddick)-A Text-book of thermodynamics : with special reference to chemistry. Svo. 8} *5), pp. 554, 145. net CONSTABLE, May 13",James Riddick Partington,['Partington (James Riddick)'],,May 13,net
6321,"Pascal (Blaise)-Les Pensées. 12no., pp. 236, s. net .DENT, Jan. 13",Pascal,Blaise,Les Pensées,DENT,,0.0,,"Pascal (Blaise)-Les Pensées. 12no., pp. 236, IS. net .DENT, Jan. 13",Blaise Pascal,['Pascal (Blaise)'],,Jan. 13,
6323,"Passenger movement from and to the United Kingdom-Return (Monthly) ea. Įd. or id. WYMAN, Jan. , &c., 13",,,Passenger movement from and to the United Kingdom-Return (Monthly) ea,WYMAN,,0.0,,"Passenger movement from and to the United Kingdom-Return (Monthly) ea. Įd. or id. WYMAN, Jan. , &c., 13",,,,"Jan. , &c., 13",
6331,"Patent rolls, Calendar of, Henry III. Vol. 6, 1266-1272. 15s. .WYMAN, June 13",,,"Patent rolls, Calendar of, Henry III",WYMAN,15s.,0.75,,"Patent rolls, Calendar of, Henry III. Vol. 6, 1266-1272. 15S. .WYMAN, June 13",,,,June 13,
6332,"Patent rolls, Calendar of. Edward III. Vol. 13, 1364-1367. 15s. . WYMAN, Jan. 13",,,"Patent rolls, Calendar of",WYMAN,15s.,0.75,,"Patent rolls, Calendar of. Edward III. Vol. 13, 1364-1367. 155. . WYMAN, Jan. 13",,,,Jan. 13,
6333,"Patent rolls, Calendar of. Edward III. Vol. 14, 1367-1370. 15s. WYMAN, Mar. 13",,,"Patent rolls, Calendar of",WYMAN,15s.,0.75,,"Patent rolls, Calendar of. Edward III. Vol. 14, 1367-1370. 155. WYMAN, Mar. 13",,,,Mar. 13,
6335,"Patents, Designs, and Trade marks—30th report of the Comptroller-General, 1912. 2 d. WYMAN, Jan. 13",,,"Patents, Designs, and Trade marks",WYMAN,,0.0,,"Patents, Designs, and Trade marks—30th report of the Comptroller-General, 1912. 2 d. WYMAN, Jan. 13",,,,Jan. 13,
6345,"Paton (Henry) ed.—The Clan Campbell : abstracts of entries relating to Campbells in the Sheriff Court Books of Argyll at Inverary, from the Campbell collections formed by Sir Duncan Campbell. Cr. 410., pp. 320, 21s. net. 0. SCHULZE, J une 13",Paton,Henry,"The Clan Campbell : abstracts of entries relating to Campbells in the Sheriff Court Books of Argyll at Inverary, from the Campbell collections formed by Sir Duncan Campbell",SCHULZE,,0.0,,"Paton (Henry) ed.—The Clan Campbell : abstracts of entries relating to Campbells in the Sheriff Court Books of Argyll at Inverary, from the Campbell collections formed by Sir Duncan Campbell. Cr. 410., pp. 320, 21s. net. 0. SCHULZE, J une 13",Henry Paton,['Paton (Henry)'],ed.,J une 13,
6359,"Pears' Annual, Christmas 1913. Illus. Folio. 6d. net .OFFICE, Nov. 13",,,"Pears' Annual, Christmas",OFFICE,6d.,0.025,,"Pears' Annual, Christmas 1913. Illus. Folio. 6d. net .OFFICE, Nov. 13",,,,Nov. 13,net
6379,"Pease (Sir Alfred E.-Some observations on the English land question. 8vo. swd. 2d. (Guisborough) STOKELD, Nov. 13",Pease,Sir Alfred E.-Some observations on the English land question. 8vo. swd. 2d. (Guisborough,,STOKELD,,0.0,,"Pease (Sir Alfred E.-Some observations on the English land question. 8vo. swd. 2d. (Guisborough) STOKELD, Nov. 13",Sir Alfred E.-Some observations on the English land question. 8vo. swd. 2d. (Guisborough Pease,['Pease (Sir Alfred E.-Some observations on the English land question. 8vo. swd. 2d. (Guisborough)'],,Nov. 13,
6381,"Pease and latter on Contracts. 2nd edit. Svo. Ios. BUTTERWORTH, Oct. 13",,,Pease and latter on Contracts,BUTTERWORTH,,0.0,,"Pease and latter on Contracts. 2nd edit. Svo. Ios. BUTTERWORTH, Oct. 13",,,,Oct. 13,
6389,"Peeps into Pepys. Ryl. _16mo., pp. 78, swd., 28. 6d. net. .A. L. HUMPHREYS, Oct. 13",,,Peeps into Pepys,A. L. HUMPHREYS,6d.,0.025,,"Peeps into Pepys. Ryl. _16mo., pp. 78, swd., 28. 6d. net. .A. L. HUMPHREYS, Oct. 13",,,,Oct. 13,net
6391,"Peers (Mrs. C. R.)--In the National Gallery : a first introduction to the works of the early Italian Schools as there represented. Illus. Svo. 8} x 51, pp. 212, 5s. net P. LEEWARNER, Oct. 13",Peers,Mrs. C. R.,In the National Gallery : a first introduction to the works of the early Italian Schools as there represented,P. LEEWARNER,5s.,0.25,,"Peers (Mrs. C. R.)--In the National Gallery : a first introduction to the works of the early Italian Schools as there represented. Illus. Svo. 8} x 51, pp. 212, 5s. net P. LEEWARNER, Oct. 13",Mrs. C. R. Peers,['Peers (Mrs. C. R.)'],,Oct. 13,net
6392,"Pegler (L. H.)-Anatomy and physiology of the fifth cranial or trigeminal nerve and of its ganglia and connections. A chart, 48 in. X 60 ins. 21s. net; do., dissected and mounted on linen, in portfolio, 21s. net BAILLIÈRE, Sep. 13",Pegler,L. H.,Anatomy and physiology of the fifth cranial or trigeminal nerve and of its ganglia and connections,BAILLIÈRE,21s.,1.05,,"Pegler (L. H.)-Anatomy and physiology of the fifth cranial or trigeminal nerve and of its ganglia and connections. A chart, 48 in. X 60 ins. 215. net; do., dissected and mounted on linen, in portfolio, 21s. net BAILLIÈRE, Sep. 13",L. H. Pegler,['Pegler (L. H.)'],,Sep. 13,net
