entry,last_name,first_name,title,publisher,price,format,original_entry,author_name,creators,is_editor,date,is_net
"Housing-Increases in rental of small dwelling houses in indus. districts in Scotland. Dept. Ctte. on : Report, 1d.; minutes of evidence, &c. s. id. ..WYMAN, Jan. 16",,,Housing-Increases in rental of small dwelling houses in indus,WYMAN,,,"Housing-Increases in rental of small dwelling houses in indus. districts in Scotland. Dept. Ctte. on : Report, Id.; minutes of evidence, &c. IS. id. ..WYMAN, Jan. 16",,,,Jan. 16,
"How (Marjorie N.)--Dreams and visions in Eng- lish poetry. 85x54, pp. 88, 28. net UNIV. OF LONDON PR., Nov. 16",How,Marjorie N.,Dreams and visions in Eng- lish poetry,UNIV. OF LONDON PR.,,,"How (Marjorie N.)--Dreams and visions in Eng- lish poetry. 85x54, pp. 88, 28. net UNIV. OF LONDON PR., Nov. 16",Marjorie N. How,['How (Marjorie N.)'],,Nov. 16,
"Howden (J. Russell)--Victory in life : a ser. of Convention addresses. 77 x 5, pp. 206, 28. 6d. net MORGAN & S., Dec. 16.",Howden,J. Russell,Victory in life : a ser,MORGAN & S.,6d.,,"Howden (J. Russell)--Victory in life : a ser. of Convention addresses. 77 x 5, pp. 206, 28. 6d. net MORGAN & S., Dec. 16.",J. Russell Howden,['Howden (J. Russell)'],,Dec. 16,net
"Howes (Edith)—The Cradle ship. 81 x 6}, pp. 219, 38. 6d. net CASSELL, Oct. 16",Howes,Edith,The Cradle ship,CASSELL,6d.,,"Howes (Edith)—The Cradle ship. 81 x 6}, pp. 219, 38. 6d. net CASSELL, Oct. 16",Edith Howes,['Howes (Edith)'],,Oct. 16,net
"Hoxie (R. T'.)-Scientific management and labor. 77 x 5ł, pp. 392, 6s. net . . APPLETON, Feb. 16",Hoxie,R. T'.,Scientific management and labor,APPLETON,6s.,,"Hoxie (R. T'.)-Scientific management and labor. 77 x 5ł, pp. 392, 6s. net . . APPLETON, Feb. 16",R. T'. Hoxie,"[""Hoxie (R. T'.)""]",,Feb. 16,net
"Hubbs (C.. see Gilbert (C.) and Hubbs. Huberich (Charles Henry) and Nicol-Speyer (Alexander) eds.---German legislation for the occupied territories of Belgium : official texts. 74 x 5, ea. ser. 8s. 6d. net (The Hague) M. NIJHOFF, May, &e. 16",,,German legislation for the occupied territories of Belgium : official texts,M. NIJHOFF,8s. 6d.,,"Hubbs (C.. see Gilbert (C.) and Hubbs. Huberich (Charles Henry) and Nicol-Speyer (Alexander) eds.---German legislation for the occupied territories of Belgium : official texts. 74 x 5, ea. ser. 8s. 6d. net (The Hague) M. NIJHOFF, May, &e. 16",,"['Hubbs (C..', 'Huberich (Charles Henry)', 'Nicol-Speyer (Alexander)']",eds.,"May, &e. 16",net
"Hudson (William Henry)-A Quiet corner in a library. 7*4*, pp. 249, 3s. 6d, net HARRAP, Nov. 16",Hudson,William Henry,A Quiet corner in a library,HARRAP,3s. 6d.,,"Hudson (William Henry)-A Quiet corner in a library. 7*4*, pp. 249, 3s. 6d, net HARRAP, Nov. 16",William Henry Hudson,['Hudson (William Henry)'],,Nov. 16,net
"Hume (Fergus)-The Mystery of a hansom cab. Cheap ed. i8mo. 64 x 41, pp. 322, iod. net JARROLD, May 16",Hume,Fergus,The Mystery of a hansom cab,JARROLD,,,"Hume (Fergus)-The Mystery of a hansom cab. Cheap ed. i8mo. 64 x 41, pp. 322, iod. net JARROLD, May 16",Fergus Hume,['Hume (Fergus)'],,May 16,
"Hun hunters : cautionary tales from the trenches. 9X11, 2s. 6d. net ..G. RICHARDS, Aug. 16",,,Hun hunters : cautionary tales from the trenches,G. RICHARDS,2s. 6d.,,"Hun hunters : cautionary tales from the trenches. 9X11, 25. 6d. net ..G. RICHARDS, Aug. 16",,,,Aug. 16,net
"Hunsaker (Jerome C.) and others—Dynamical Hughes (Myra) ed.--The Henry Arthur Jones calendar. 61 x 41, pp. 123, is. net PALMER & H., Nov. 16",Hunsaker,Jerome C.,Dynamical Hughes (Myra) ed,PALMER & H.,,,"Hunsaker (Jerome C.) and others—Dynamical Hughes (Myra) ed.--The Henry Arthur Jones calendar. 61 x 41, pp. 123, is. net PALMER & H., Nov. 16",Jerome C. Hunsaker,['Hunsaker (Jerome C.)'],,Nov. 16,
"Hughes (William)-A Hist. of the Church of the Cymry, fr. the earliest period to the present time. New ed., rev. 84% 51, pp. 427, ios, net STOCK, Nov. 16",Hughes,William,A Hist,STOCK,,,"Hughes (William)-A Hist. of the Church of the Cymry, fr. the earliest period to the present time. New ed., rev. 84% 51, pp. 427, ios, net STOCK, Nov. 16",William Hughes,['Hughes (William)'],,Nov. 16,
"Hugo (Victor)-Anthologie. 31x2, v. c. yapp, is. net (French booklets, No. 14) L. B. HILL, Nov. 16",Hugo,Victor,Anthologie,L. B. HILL,,,"Hugo (Victor)-Anthologie. 31x2, v. c. yapp, is. net (French booklets, No. 14) L. B. HILL, Nov. 16",Victor Hugo,['Hugo (Victor)'],,Nov. 16,
"Hull (A. Eaglefield)-Scriabin: a great Russian tone poet. 71 X 5, pp. 312, 28. 6d. net (Lib. of music and musicians)... ........K. PAUL, Nov. 16",Hull,A. Eaglefield,Scriabin: a great Russian tone poet,K. PAUL,6d.,,"Hull (A. Eaglefield)-Scriabin: a great Russian tone poet. 71 X 5, pp. 312, 28. 6d. net (Lib. of music and musicians)... ........K. PAUL, Nov. 16",A. Eaglefield Hull,['Hull (A. Eaglefield)'],,Nov. 16,net
"Hull (Walter)—Poems of fantasy.. 16 mo. 61 x 5, pp. 64, swd. 1s. net. (Vigo cabinet ser. 2nd cent.) .MATHEWS, May 16",Hull,Walter,Poems of fantasy,MATHEWS,,,"Hull (Walter)—Poems of fantasy.. 16 mo. 61 x 5, pp. 64, swd. Is. net. (Vigo cabinet ser. 2nd cent.) .MATHEWS, May 16",Walter Hull,['Hull (Walter)'],,May 16,
"Hunter (J. Hamilton)--Proposed removal of the Home Rule impasse by a rev. of the Franchise Clauses of the suspended Irish Government Bill (3 & 4 Geo. V). 81 x 54, pp. 32, 6d. HODGES, F., Dec. 16",Hunter,J. Hamilton,Proposed removal of the Home Rule impasse by a rev,"HODGES, F.",6d.,,"Hunter (J. Hamilton)--Proposed removal of the Home Rule impasse by a rev. of the Franchise Clauses of the suspended Irish Government Bill (3 & 4 Geo. V). 81 x 54, pp. 32, 6d. HODGES, F., Dec. 16",J. Hamilton Hunter,['Hunter (J. Hamilton)'],,Dec. 16,
"Hurst (G. H.)-Colour : a hdbk. of the theory of colour. 2nd ed., rev. Illus, 8 X 54, pp. 160, 7s. 6d. net. .Scott, G., June 16",Hurst,G. H.,Colour : a hdbk,G.,,,"Hurst (G. H.)-Colour : a hdbk. of the theory of colour. 2nd ed., rev. Illus, 8 X 54, pp. 160, 75. 6d. net. .Scott, G., June 16",G. H. Hurst,['Hurst (G. H.)'],,June 16,
"Hussey-de-Burgh (Digby)-Cheap food. 1s, net. (Drankin, co. Limerick) AUTHOR, Feb. 16",Hussey-de-Burgh,Digby,Cheap food,AUTHOR,,,"Hussey-de-Burgh (Digby)-Cheap food. Is, net. (Drankin, co. Limerick) AUTHOR, Feb. 16",Digby Hussey-de-Burgh,['Hussey-de-Burgh (Digby)'],,Feb. 16,
"Hutchinson (Walter) ed.--History of the nations. Vol. 4. Fol. II X 81, ros. 6d. net HUTCHINSON, Mar. 16",Hutchinson,Walter,History of the nations,HUTCHINSON,6d.,,"Hutchinson (Walter) ed.--History of the nations. Vol. 4. Fol. II X 81, ros. 6d. net HUTCHINSON, Mar. 16",Walter Hutchinson,['Hutchinson (Walter)'],ed.,Mar. 16,net
"Hyde (H. E.)--The Two roads, international govt. or militarism: will England lead the way. pp. 167, swd. 1s. 3d. net ..P. S. KING, Feb. 16",Hyde,H. E.,"The Two roads, international govt",P. S. KING,1s. 3d.,,"Hyde (H. E.)--The Two roads, international govt. or militarism: will England lead the way. pp. 167, swd. Is. 3d. net ..P. S. KING, Feb. 16",H. E. Hyde,['Hyde (H. E.)'],,Feb. 16,net
"Hyne (C. J. Cutcliffe)—Captain Kettle on the warpath. 6s. .METHUEN, May 16",Hyne,C. J. Cutcliffe,Captain Kettle on the warpath,METHUEN,6s.,,"Hyne (C. J. Cutcliffe)—Captain Kettle on the warpath. 6s. .METHUEN, May 16",C. J. Cutcliffe Hyne,['Hyne (C. J. Cutcliffe)'],,May 16,
"If ye fulfil the royal law. By A. H. W. (Canada). 71 X 5, pp. 290, 6s, net ...STOCK, Apr. 16",,,If ye fulfil the royal law,STOCK,6s.,,"If ye fulfil the royal law. By A. H. W. (Canada). 71 X 5, pp. 290, 6s, net ...STOCK, Apr. 16",,,,Apr. 16,net
"Imperial College of Science and Technology. See under Science. Imperial Institute-Report for 1914 2d. WYMAN, May 16",,,Imperial College of Science and Technology,WYMAN,2d.,,"Imperial College of Science and Technology. See under Science. Imperial Institute-Report for 1914 2d. WYMAN, May 16",,,,May 16,
"Income and expenditure (Public)-Account for 1915-16. fd. ... WYMAN, May 16",,,Account for,WYMAN,,,"Income and expenditure (Public)-Account for 1915-16. fd. ... WYMAN, May 16",,"['Income', 'expenditure (Public)']",,May 16,
"Income tax : how to claim repayment of income tax for yr. 1916-17. Pp. 94, swd., 1s. net. MATHIESON, Sep. 16",,,Income tax : how to claim repayment of income tax for yr,MATHIESON,1s.,,"Income tax : how to claim repayment of income tax for yr. 1916-17. Pp. 94, swd., Is. net. MATHIESON, Sep. 16",,,,Sep. 16,net
"Increase of Rent and Mortgage Interest (War Restric.) Act, 191s. Full text, w. notes and explan. comments. By the Editors of “ Law Notes. 81x5), pp. 23, is. net. LAW NOTES, Jan. 16",,,Increase of Rent and Mortgage Interest (War Restric,LAW NOTES,,,"Increase of Rent and Mortgage Interest (War Restric.) Act, 1915. Full text, w. notes and explan. comments. By the Editors of “ Law Notes. 81x5), pp. 23, is. net. LAW NOTES, Jan. 16",,,,Jan. 16,
"India (East)-Estimate of revenue and expen. of Govt. of I. for 1915–16, comp. w. results of 1914-15, 2d. ..WYMAN, June 16",India,East,Estimate of revenue and expen,WYMAN,2d.,,"India (East)-Estimate of revenue and expen. of Govt. of I. for 1915–16, comp. w. results of 1914-15, 2d. ..WYMAN, June 16",East India,['India (East)'],,June 16,
"India (East)-Home accounts of Govt. of I. for 1914-15 and 1915–16, 8d. WYMAN, June 16",India,East,Home accounts of Govt,WYMAN,8d.,,"India (East)-Home accounts of Govt. of I. for 1914-15 and 1915–16, 8d. WYMAN, June 16",East India,['India (East)'],,June 16,
"India (East)—Indian financial statement and budget for 1916-17, and discussions thereon in Legis. Council, 3s. id.,...... WYMAN, June 16",India,East,Indian financial statement and budget for,WYMAN,,,"India (East)—Indian financial statement and budget for 1916-17, and discussions thereon in Legis. Council, 3s. id.,...... WYMAN, June 16",East India,['India (East)'],,June 16,
"India (East)- Indian Students' Dept. : Rept. yr. ended 30th June, 191s. 2d. WYMAN, Jan. 16",India,East,Indian Students' Dept,WYMAN,191s. 2d.,,"India (East)- Indian Students' Dept. : Rept. yr. ended 30th June, 1915. 2d. WYMAN, Jan. 16",East India,['India (East)'],,Jan. 16,
"India (East)— Military : Papers rela, to Maj.-Gen. Townshend's appreciation of the position after the Battle of Kut-el-Amara. id. WYMAN, May 16",India,East,"Military : Papers rela, to Maj",WYMAN,,,"India (East)— Military : Papers rela, to Maj.-Gen. Townshend's appreciation of the position after the Battle of Kut-el-Amara. id. WYMAN, May 16",East India,['India (East)'],,May 16,
"India (East)Statement Income tax and inhabited house duties Reports exhibiting the entral and material progress and of cases in . index, ea, 6d. WYMAN, Feb. 16",India,East,Statement Income tax and inhabited house duties Reports exhibiting the entral and material progress and of cases in ,WYMAN,6d.,,"India (East)Statement Income tax and inhabited house duties Reports exhibiting the entral and material progress and of cases in . index, ea, 6d. WYMAN, Feb. 16",East India,['India (East)'],,Feb. 16,
"IS. 6d. s. 6d. India (East)—Return of net income and expen. of Brit. I. 1912-13 to 1914-1s. 2 d. WYMAN, June 16",,,IS,WYMAN,,,"IS. 6d. IS. 6d. India (East)—Return of net income and expen. of Brit. I. 1912-13 to 1914-15. 2 d. WYMAN, June 16",,,,June 16,
"India (East)-Statistical abstract relat. to British India from 1904-05 to 1913-14. s. 3d. WYMAN, Jan. 16",India,East,Statistical abstract relat,WYMAN,3d.,,"India (East)-Statistical abstract relat. to British India from 1904-05 to 1913-14. IS. 3d. WYMAN, Jan. 16",East India,['India (East)'],,Jan. 16,
"IS. rod. WYMAN, Apr. 16",,,IS,WYMAN,,,"IS. rod. WYMAN, Apr. 16",,,,Apr. 16,
"India (East)—Trade : Tab. rela. to trade of Brit. India w. Brit. Emp. and foreign countries, 1910–11 to 1914-1s. is. 7d. WYMAN, Sep. 16",India,East,Trade : Tab,WYMAN,7d.,,"India (East)—Trade : Tab. rela. to trade of Brit. India w. Brit. Emp. and foreign countries, 1910–11 to 1914-15. is. 7d. WYMAN, Sep. 16",East India,['India (East)'],,Sep. 16,
"Industrial fatigue-Inter. rpt. on investigation by physiological methods. WYMAN, Sep. 16",,,Industrial fatigue-Inter,WYMAN,,,"Industrial fatigue-Inter. rpt. on investigation by physiological methods. WYMAN, Sep. 16",,,,Sep. 16,
"Infantry defence and protection. Pp. 22 ; I. drill and attack. pp. 18; I. night operations, reconnaissance, &c. pp. 18. 81x5i, ea. 6d. net. (Hythe ser. of aids to training) W. S. PAINE, Oct. 16",,,Infantry defence and protection,W. S. PAINE,,,"Infantry defence and protection. Pp. 22 ; I. drill and attack. pp. 18; I. night operations, reconnaissance, &c. pp. 18. 81x5i, ea. 6d. net. (Hythe ser. of aids to training) W. S. PAINE, Oct. 16",,,,Oct. 16,
"Infectious Diseases (Notifiable)-Statistics of incidence in each sanitary district in England and Wales, 1915, 9d. .WYMAN, Apr. 16",Infectious Diseases,Notifiable,Statistics of incidence in each sanitary district in England and Wales,WYMAN,9d.,,"Infectious Diseases (Notifiable)-Statistics of incidence in each sanitary district in England and Wales, 1915, 9d. .WYMAN, Apr. 16",Notifiable Infectious Diseases,['Infectious Diseases (Notifiable)'],,Apr. 16,
"Inglis' Pricing calculator. 18010., 7d. GALL & I., July 16",,,Inglis' Pricing calculator,GALL & I.,7d.,,"Inglis' Pricing calculator. 18010., 7d. GALL & I., July 16",,,,July 16,
"Ingram (John H.)-Chatterton and his poetry. Pp. 149, 1s. net. (Poetry and life ser.) HARRAP, Nov. 16",Ingram,John H.,Chatterton and his poetry,HARRAP,,,"Ingram (John H.)-Chatterton and his poetry. Pp. 149, Is. net. (Poetry and life ser.) HARRAP, Nov. 16",John H. Ingram,['Ingram (John H.)'],,Nov. 16,
"Innes-Browne (Mrs.)-Little Donald. 28. 6d. WASHBOURNE, May 16",Innes-Browne,Mrs.,Little Donald,WASHBOURNE,6d.,,"Innes-Browne (Mrs.)-Little Donald. 28. 6d. WASHBOURNE, May 16",Mrs. Innes-Browne,['Innes-Browne (Mrs.)'],,May 16,
"Insurance (National) Audit Dept. -2nd Rpt., 1915 2d. ..WYMAN, Mar. 16",Insurance,National,Audit Dept,WYMAN,2d.,,"Insurance (National) Audit Dept. -2nd Rpt., 1915 2d. ..WYMAN, Mar. 16",National Insurance,['Insurance (National)'],,Mar. 16,
"Insurance (Nat. Health)-Approved Soc. : Con. solidated regulations. 5d. .. WYMAN, May 16",Insurance,Nat. Health,Approved Soc,WYMAN,5d.,,"Insurance (Nat. Health)-Approved Soc. : Con. solidated regulations. 5d. .. WYMAN, May 16",Nat. Health Insurance,['Insurance (Nat. Health)'],,May 16,
"Insurance (Nat. Health)--Approved Soc. Finance and Administration, Dept. Com. on : Interim rpt. and correspondence, 4d. WYMAN, May 16",Insurance,Nat. Health,Approved Soc,WYMAN,4d.,,"Insurance (Nat. Health)--Approved Soc. Finance and Administration, Dept. Com. on : Interim rpt. and correspondence, 4d. WYMAN, May 16",Nat. Health Insurance,['Insurance (Nat. Health)'],,May 16,
"Insurance (Nat. Health) (Eng.)- Decisions on appeals and applications under Sect. 67 of N. I. Act, 1911, &c., Rpts. of. Pt. 3. 3d. WYMAN, May 16",Insurance,Nat. Health,Eng,WYMAN,3d.,,"Insurance (Nat. Health) (Eng.)- Decisions on appeals and applications under Sect. 67 of N. I. Act, 1911, &c., Rpts. of. Pt. 3. 3d. WYMAN, May 16",Nat. Health Insurance,['Insurance (Nat. Health)'],,May 16,
"Insurance (Nat. Health) Fund-Accounts for period 15th July, 1912, to nth Jan., 1914. 4fd. .WYMAN, Feb. 16",Insurance,Nat. Health,Fund-Accounts for period,WYMAN,,,"Insurance (Nat. Health) Fund-Accounts for period 15th July, 1912, to nth Jan., 1914. 4fd. .WYMAN, Feb. 16",Nat. Health Insurance,['Insurance (Nat. Health)'],,Feb. 16,
"Insurance (Nat. Health)-Hdbk. for use of approved socs. Eng., Scot., and Welsh eds., rev. to Aug., 191s. Ea. 1s. WYMAN, Jan., etc., 16",Insurance,Nat. Health,Hdbk,WYMAN,1s.,,"Insurance (Nat. Health)-Hdbk. for use of approved socs. Eng., Scot., and Welsh eds., rev. to Aug., 1915. Ea. Is. WYMAN, Jan., etc., 16",Nat. Health Insurance,['Insurance (Nat. Health)'],,"Jan., etc., 16",
"Insurance (Nat. Health)-- Statutes, regns. and orders. W. notes, cross-references and index. 28. 6d. . WYMAN, Oct. 16",Insurance,Nat. Health,"Statutes, regns",WYMAN,6d.,,"Insurance (Nat. Health)-- Statutes, regns. and orders. W. notes, cross-references and index. 28. 6d. . WYMAN, Oct. 16",Nat. Health Insurance,['Insurance (Nat. Health)'],,Oct. 16,
"Insurances (Government) and annuities Account for 191s. fd. .WYMAN, May 16",Insurances,Government,Account for,WYMAN,,,"Insurances (Government) and annuities Account for 1915. fd. .WYMAN, May 16",Government Insurances,['Insurances (Government)'],,May 16,
"International Relations (Council for Study of), Aids to study. Var, issues and prices, id.-6d. COUNCIL, Apr. 16",International Relations,Council for Study of,Aids to study,COUNCIL,6d.,,"International Relations (Council for Study of), Aids to study. Var, issues and prices, id.-6d. COUNCIL, Apr. 16",Council for Study of International Relations,['International Relations (Council for Study of)'],,Apr. 16,
"Internment camps in U.K.--Rpts. of visits of inspection by Officials of U.S. Embassy. 4 d. WYMAN, Sep. 16",,,Internment camps in U.K.--Rpts,WYMAN,,,"Internment camps in U.K.--Rpts. of visits of inspection by Officials of U.S. Embassy. 4 d. WYMAN, Sep. 16",,,,Sep. 16,
"Investors' four shilling yr. bk. 10x 61, pp. 540, 4s. net. FINANCIAL Rev. OF REVIEWS, Jan. 16",,,Investors' four shilling yr,OF REVIEWS,,,"Investors' four shilling yr. bk. 10x 61, pp. 540, 45. net. FINANCIAL Rev. OF REVIEWS, Jan. 16",,,,Jan. 16,
"Ireland-Banking, railway and shipping statistics, Dec., 191s. 2d. ... WYMAN, Sep. 16",,,"Ireland-Banking, railway and shipping statistics, Dec",WYMAN,191s. 2d.,,"Ireland-Banking, railway and shipping statistics, Dec., 1915. 2d. ... WYMAN, Sep. 16",,,,Sep. 16,
"Ireland-Charitable donations and bequests for. 715t Rept. of Commissioners, for 191s. 20. WYMAN, Sep. 16",,,Ireland-Charitable donations and bequests for,WYMAN,,,"Ireland-Charitable donations and bequests for. 715t Rept. of Commissioners, for 1915. 20. WYMAN, Sep. 16",,,,Sep. 16,
"Ireland (Congested Districts Bd. for)-24th Rpt., for 1915-16. 4d. . WYMAN, Oct. 16",Ireland,Congested Districts Bd. for,,WYMAN,4d.,,"Ireland (Congested Districts Bd. for)-24th Rpt., for 1915-16. 4d. . WYMAN, Oct. 16",Congested Districts Bd. for Ireland,['Ireland (Congested Districts Bd. for)'],,Oct. 16,
"Ireland County officers and courts : Accounts for 1915-16. fd.... ...WYMAN, Aug. 16",,,Ireland County officers and courts : Accounts for,WYMAN,,,"Ireland County officers and courts : Accounts for 1915-16. fd.... ...WYMAN, Aug. 16",,,,Aug. 16,
"Ireland (Government of)-Headings of a settle- ment. 4d. . WYMAN, July 16",Ireland,Government of,Headings of a settle- ment,WYMAN,4d.,,"Ireland (Government of)-Headings of a settle- ment. 4d. . WYMAN, July 16",Government of Ireland,['Ireland (Government of)'],,July 16,
"Ireland-Public records : 48th Rpt. of the Deputy Keeper, for 191s. Ifd. ...WYMAN, Oct. 16",,,Ireland-Public records :,WYMAN,,,"Ireland-Public records : 48th Rpt. of the Deputy Keeper, for 1915. Ifd. ...WYMAN, Oct. 16",,,,Oct. 16,
"Ireland (Rebellion in) --Royal Com. on : Minutes of evidence and appen. of documents. s. : Rpt., 2d. .WYMAN, July 16",Ireland,Rebellion in,Royal Com,WYMAN,2d.,,"Ireland (Rebellion in) --Royal Com. on : Minutes of evidence and appen. of documents. IS. : Rpt., 2d. .WYMAN, July 16",Rebellion in Ireland,['Ireland (Rebellion in)'],,July 16,
"Irenæus (St.) of Lugdunum—The Treatise against the heresies. A tr. of prin. passages, w. notes and arguments, by F. R. Montgomery Hitchcock. 2 vols. 67 x 44, pp. 146, 151, ea. 28. net (Early Church classics) ..S.P.C.K., Nov. 16",Irenæus,St.,Lugdunum—The Treatise against the heresies,S.P.C.K.,,,"Irenæus (St.) of Lugdunum—The Treatise against the heresies. A tr. of prin. passages, w. notes and arguments, by F. R. Montgomery Hitchcock. 2 vols. 67 x 44, pp. 146, 151, ea. 28. net (Early Church classics) ..S.P.C.K., Nov. 16",St. Irenæus,['Irenæus (St.)'],,Nov. 16,
"Irish Land Commission-Index to estates, 1914. ild. . WYMAN, Jan, 16",,,Irish Land Commission-Index to estates,WYMAN,,,"Irish Land Commission-Index to estates, 1914. ild. . WYMAN, Jan, 16",,,,"Jan, 16",
"Irish Land Commission-Ret. of advances (monthly) various prices fr. 6d. WYMAN, Jan., etc. 16",,,Irish Land Commission-Ret,WYMAN,6d.,,"Irish Land Commission-Ret. of advances (monthly) various prices fr. 6d. WYMAN, Jan., etc. 16",,,,"Jan., etc. 16",
"1sle of Man (Customs)--Account for 1915-16. id. WYMAN, Aug. 16",1sle of Man,Customs,Account for,WYMAN,,,"Isle of Man (Customs)--Account for 1915-16. id. WYMAN, Aug. 16",Customs 1sle of Man,['1sle of Man (Customs)'],,Aug. 16,
"Italy in the War, Low (S.) 6s, net Italy our ally : acc. of visit of Rt. Hon. H. H. Asquith. Swd. 2d. .UNWIN, July 16",,,"Italy in the War, Low (S.)",UNWIN,2d.,,"Italy in the War, Low (S.) 6s, net Italy our ally : acc. of visit of Rt. Hon. H. H. Asquith. Swd. 2d. .UNWIN, July 16",,,,July 16,
"Irish universities--Accs. of universities and colleges in Ireland, 1915-16. 2fd. WYMAN, Oct. 16",,,Irish universities--Accs,WYMAN,,,"Irish universities--Accs. of universities and colleges in Ireland, 1915-16. 2fd. WYMAN, Oct. 16",,,,Oct. 16,
"Ironmonger Metal market yr. bk., 1916. 64 X4, pp. 159, 3s. 6d. net  THE IRONMONGER, Feb. 16",,,Ironmonger Metal market yr,THE IRONMONGER,3s. 6d.,,"Ironmonger Metal market yr. bk., 1916. 64 X4, pp. 159, 35. 6d. net  THE IRONMONGER, Feb. 16",,,,Feb. 16,net
"Irving (H. B.)-The Amusement of the people : a lecture. 81 x 54, pp. 27, 6d. net. HUMPHREYS, Dec. 16",Irving,H. B.,The Amusement of the people : a lecture,HUMPHREYS,6d.,,"Irving (H. B.)-The Amusement of the people : a lecture. 81 x 54, pp. 27, 6d. net. HUMPHREYS, Dec. 16",H. B. Irving,['Irving (H. B.)'],,Dec. 16,net
"1saac (James J.)-The Temple keys. 71 X 5, PP. 163, 28. 6d. net ...STONEHAM, Dec. 16",1saac,James J.,The Temple keys,STONEHAM,6d.,,"Isaac (James J.)-The Temple keys. 71 X 5, PP. 163, 28. 6d. net ...STONEHAM, Dec. 16",James J. 1saac,['1saac (James J.)'],,Dec. 16,net
"1saac (Winifred F. E. C.)-Storied games : being a series of 12 musical games w. stories. Accom. by Clement W. Courtney. 81 x64, pp. 145, 28. 6d. net... . PITMAN, Dec. 16",1saac,Winifred F. E. C.,Storied games : being a series of,PITMAN,6d.,,"Isaac (Winifred F. E. C.)-Storied games : being a series of 12 musical games w. stories. Accom. by Clement W. Courtney. 81 x64, pp. 145, 28. 6d. net... . PITMAN, Dec. 16",Winifred F. E. C. 1saac,['1saac (Winifred F. E. C.)'],,Dec. 16,net
"Jack and the beanstalk painting bk. Fol. 12 X 91 6d. ALLDAY, Dec. 16",,,Jack and the beanstalk painting bk,ALLDAY,6d.,,"Jack and the beanstalk painting bk. Fol. 12 X 91 6d. ALLDAY, Dec. 16",,,,Dec. 16,
"James (Henry)—Roderick Hudson. 18ino. 64 x 41, pp. 474, 7d. net......NELSON, July 16",James,Henry,Roderick Hudson,NELSON,7d.,,"James (Henry)—Roderick Hudson. 18ino. 64 x 41, pp. 474, 7d. net......NELSON, July 16",Henry James,['James (Henry)'],,July 16,net
"Jackman (A. N.) ed.---The Far Eastern mines of the Witwatersran.. s, net “ FINANCIAL TIMES, May 16",Jackman,A. N.,The Far Eastern mines of the Witwatersran,FINANCIAL TIMES,,,"Jackman (A. N.) ed.---The Far Eastern mines of the Witwatersran.. IS, net “ FINANCIAL TIMES, May 16",A. N. Jackman,['Jackman (A. N.)'],ed.,May 16,
"Jacks (L. P.)-Philosophers in trouble : a volunie of stories. Cr. Svo. 71 x 41, pp. 216. 2s. 6d. net WILLIAMS & N., May 16",Jacks,L. P.,Philosophers in trouble : a volunie of stories,WILLIAMS & N.,2s. 6d.,,"Jacks (L. P.)-Philosophers in trouble : a volunie of stories. Cr. Svo. 71 x 41, pp. 216. 2s. 6d. net WILLIAMS & N., May 16",L. P. Jacks,['Jacks (L. P.)'],,May 16,net
"Jacob (Edgar)-Five addresses to the clergy of the Diocese of St. Albans, in prep. for the National Mission. 71 X 4), pp. 71, 6d. net S.P.C.K., July 16",Jacob,Edgar,Five addresses to the clergy of the Diocese of St,S.P.C.K.,6d.,,"Jacob (Edgar)-Five addresses to the clergy of the Diocese of St. Albans, in prep. for the National Mission. 71 X 4), pp. 71, 6d. net S.P.C.K., July 16",Edgar Jacob,['Jacob (Edgar)'],,July 16,net
"James (A. F. Brodie), ed.-Nitrate facts and figures, 1916. 28, 6d. net F. C. MATHIESON & SONS, May 16",James,A. F. Brodie,Nitrate facts and figures,F. C. MATHIESON & SONS,6d.,,"James (A. F. Brodie), ed.-Nitrate facts and figures, 1916. 28, 6d. net F. C. MATHIESON & SONS, May 16",A. F. Brodie James,['James (A. F. Brodie)'],,May 16,net
"Joaffreson (H. H.)--Letters of the Rev. H. H. Jeaffreson. Ed. by Rev. C. E. Lambert. 71 x 54, pp. 292, 4s. 6d. net LONGMANS, Nov. 16",Joaffreson,H. H.,Letters of the Rev,LONGMANS,4s. 6d.,,"Joaffreson (H. H.)--Letters of the Rev. H. H. Jeaffreson. Ed. by Rev. C. E. Lambert. 71 x 54, pp. 292, 45. 6d. net LONGMANS, Nov. 16",H. H. Joaffreson,['Joaffreson (H. H.)'],,Nov. 16,net
"Jeans (J. H.)--The Dynamical theory of gases. 2nd ed. Fol. 104 x 7, pp. 444, 165, net CAMB. UNIV. PRESS, Apr. 16",Jeans,J. H.,The Dynamical theory of gases,CAMB. UNIV. PRESS,,,"Jeans (J. H.)--The Dynamical theory of gases. 2nd ed. Fol. 104 x 7, pp. 444, 165, net CAMB. UNIV. PRESS, Apr. 16",J. H. Jeans,['Jeans (J. H.)'],,Apr. 16,
"Jevons (F. B.)—Polytheism. 61 x 4, pp. 48, 3d. net LAY READER HEADQUARTERS, Aug. 16",Jevons,F. B.,Polytheism,LAY READER HEADQUARTERS,3d.,,"Jevons (F. B.)—Polytheism. 61 x 4, pp. 48, 3d. net LAY READER HEADQUARTERS, Aug. 16",F. B. Jevons,['Jevons (F. B.)'],,Aug. 16,net
"Jevons (L. C.)--Puddings without eggs. 3d. net JARROLD, May 16",Jevons,L. C.,Puddings without eggs,JARROLD,3d.,,"Jevons (L. C.)--Puddings without eggs. 3d. net JARROLD, May 16",L. C. Jevons,['Jevons (L. C.)'],,May 16,net
"Jinarajadasa (C.)-The Message of the future. 61 4, pp. 157, 2s., 2s. 6d. net; Ithr. 38. 6d. STAR PUB. TRUST, Dec. 16",Jinarajadasa,C.,The Message of the future,STAR PUB. TRUST,6d.,,"Jinarajadasa (C.)-The Message of the future. 61 4, pp. 157, 25., 25. 6d. net; Ithr. 38. 6d. STAR PUB. TRUST, Dec. 16",C. Jinarajadasa,['Jinarajadasa (C.)'],,Dec. 16,
