entry,last_name,first_name,title,publisher,price,price_in_pounds,format,original_entry,author_name,creators,is_editor,date,is_net
"Consular reports-Odessa, 7d.; Chungking, 3d. ; Boston, 4d.; Wuhu, 4d. ; Portland, Oregon, &c., 5d.; Changsha, 3}d.; Hankow, 1 d.; Dairen, 5d.; Foochów, 3}d.; Harbin, 4]d. Nanking, 4ļd.; Calais, 4d. ; Chingkiang, 4d. ; Malaga, 3d. ; Teng Yueh, £d.; Peru, 4}d. ; Rio Grande, įd. ; New York, 3}d.; Seville, 5d. ; Cyclades, 4d.; Mergtoz, 4d.; Iquique, 3}d.; France, 54d.; Lisbon, 4d.; Réunion, id. ; Rouen, 6 d. .WYMAN, July 13",,,Consular reports-Odessa,WYMAN,,0.0,,"Consular reports-Odessa, 7d.; Chungking, 3d. ; Boston, 4d.; Wuhu, 4d. ; Portland, Oregon, &c., 5d.; Changsha, 3}d.; Hankow, 1 d.; Dairen, 5d.; Foochów, 3}d.; Harbin, 4]d. Nanking, 4ļd.; Calais, 4d. ; Chingkiang, 4d. ; Malaga, 3d. ; Teng Yueh, £d.; Peru, 4}d. ; Rio Grande, įd. ; New York, 3}d.; Seville, 5d. ; Cyclades, 4d.; Mergtoz, 4d.; Iquique, 3}d.; France, 54d.; Lisbon, 4d.; Réunion, id. ; Rouen, 6 d. .WYMAN, July 13",,,,July 13,
"Consular reports-Vladivostock, 6}d.; E. Africa Protectorate, s}d. .WYMAN, Mar. 13",,,Consular reports-Vladivostock,WYMAN,,0.0,,"Consular reports-Vladivostock, 6}d.; E. Africa Protectorate, s}d. .WYMAN, Mar. 13",,,,Mar. 13,
"Contes de Fées ; Perrault, &c., 12mo., pp. 438, rod. net (Classiques Francais) NELSON, Dec. 13",,,"Contes de Fées ; Perrault, &c",NELSON,,0.0,12mo.,"Contes de Fées ; Perrault, &c., 12mo., pp. 438, rod. net (Classiques Francais) NELSON, Dec. 13",,,,Dec. 13,
"Conyers (Dorothea)—The Arrival of Antony. Pop. edit. Cr. 8vo., pp. 348, swd. is. net HUTCHINSON, June 13",Conyers,Dorothea,The Arrival of Antony,HUTCHINSON,,0.0,8vo.,"Conyers (Dorothea)—The Arrival of Antony. Pop. edit. Cr. 8vo., pp. 348, swd. is. net HUTCHINSON, June 13",Dorothea Conyers,['Conyers (Dorothea)'],,June 13,
"Cook (Sir Edward)—The Life of Florence Nightin- gale. 2 vols. 8vo. 9 X55, pp. 540, 526, 3os. net MACMILLAN, Nov. 13",Cook,Sir Edward,The Life of Florence Nightin- gale,MACMILLAN,,0.0,8vo.,"Cook (Sir Edward)—The Life of Florence Nightin- gale. 2 vols. 8vo. 9 X55, pp. 540, 526, 3os. net MACMILLAN, Nov. 13",Sir Edward Cook,['Cook (Sir Edward)'],,Nov. 13,
"Cook (Sir Frederick) : A Catalogue of the paintings at Doughty House, Richmond, and elsewhere in the collection of Sir Frederick Cook, Bt. Ed. by H. Cook. Vol. 1, Italian Schools. By Tancred Borenius. Folio 15 X11), pp. 231 HEINEMANN, Nov. 13",Cook,Sir Frederick,"A Catalogue of the paintings at Doughty House, Richmond, and elsewhere in the collection of Sir Frederick Cook, Bt",HEINEMANN,,0.0,,"Cook (Sir Frederick) : A Catalogue of the paintings at Doughty House, Richmond, and elsewhere in the collection of Sir Frederick Cook, Bt. Ed. by H. Cook. Vol. 1, Italian Schools. By Tancred Borenius. Folio 15 X11), pp. 231 HEINEMANN, Nov. 13",Sir Frederick Cook,['Cook (Sir Frederick)'],,Nov. 13,
"Cooke (G. A.)—The Books of Judges and Ruth in the Revised Version. With intro, and notes. Extra f'cap. 8vo., 2s. 6d. net. (Cambridge Bible for schools and Colleges) CAM. UNIV. PRESS, Mar. 13",Cooke,G. A.,The Books of Judges and Ruth in the Revised Version,CAM. UNIV. PRESS,,0.0,8vo.,"Cooke (G. A.)—The Books of Judges and Ruth in the Revised Version. With intro, and notes. Extra f'cap. 8vo., 25. 6d. net. (Cambridge Bible for schools and Colleges) CAM. UNIV. PRESS, Mar. 13",G. A. Cooke,['Cooke (G. A.)'],,Mar. 13,
"Cooke (G. A.)-The Book of Judges in the Revised Version. With intro. and notes. I map. Extra fcap. 8vo., pp. 246, 28. net. (Cambridge Bible for schools and colleges) CAM. UNIV. PRESS, Mar. 13",Cooke,G. A.,The Book of Judges in the Revised Version,CAM. UNIV. PRESS,,0.0,8vo.,"Cooke (G. A.)-The Book of Judges in the Revised Version. With intro. and notes. I map. Extra fcap. 8vo., pp. 246, 28. net. (Cambridge Bible for schools and colleges) CAM. UNIV. PRESS, Mar. 13",G. A. Cooke,['Cooke (G. A.)'],,Mar. 13,
"Cooke (G. A.)--The Book of Ruth in the Revised Version. With intro. and notes. Extra f'cap. 8vo., pp. 40, 1s. net. (Cambridge Bible for schools and colleges) CAMB. UNIV. PRESS, Mar. 13",Cooke,G. A.,The Book of Ruth in the Revised Version,CAMB. UNIV. PRESS,,0.0,8vo.,"Cooke (G. A.)--The Book of Ruth in the Revised Version. With intro. and notes. Extra f'cap. 8vo., pp. 40, Is. net. (Cambridge Bible for schools and colleges) CAMB. UNIV. PRESS, Mar. 13",G. A. Cooke,['Cooke (G. A.)'],,Mar. 13,
"Cookery annual (The) for 1913, and year book of the Universal Cookery and Food Association Edit. by C. Herman Senn. 8vo. 71X47, pp. 163, swd. is. net Food & COOKERY, Feb. 13",,,Cookery annual (The) for,COOKERY,,0.0,8vo.,"Cookery annual (The) for 1913, and year book of the Universal Cookery and Food Association Edit. by C. Herman Senn. 8vo. 71X47, pp. 163, swd. is. net Food & COOKERY, Feb. 13",,,,Feb. 13,
"Cookery for Irish Workhouses, Handbook of.. 3}d. (post free) . WYMAN, Feb. 13",,,"Cookery for Irish Workhouses, Handbook of",WYMAN,,0.0,,"Cookery for Irish Workhouses, Handbook of.. 3}d. (post free) . WYMAN, Feb. 13",,,,Feb. 13,
"Coo maras wamy (Ananda K.)–Visvakarma : ex- amples of Indian architecture, sculpture, painting, handicraft. Part 4, 4to. 12 plates. 28. od. net ...LTZAC, May 13, Coomaraswamy (Ananda K.) see also Nivedita (Sister) and Coomaraswamy. Cooper (A. B.)-Corky and I. Cr. 8vo., pp. 256 swd. is, net. (Scout library) PEARSON, Jan. 13",Coo maras wamy,Ananda K.,"Visvakarma : ex- amples of Indian architecture, sculpture, painting, handicraft",PEARSON,,0.0,4to.,"Coo maras wamy (Ananda K.)–Visvakarma : ex- amples of Indian architecture, sculpture, painting, handicraft. Part 4, 4to. 12 plates. 28. od. net ...LTZAC, May 13, Coomaraswamy (Ananda K.) see also Nivedita (Sister) and Coomaraswamy. Cooper (A. B.)-Corky and I. Cr. 8vo., pp. 256 swd. is, net. (Scout library) PEARSON, Jan. 13",Ananda K. Coo maras wamy,['Coo maras wamy (Ananda K.)'],,Jan. 13,
"Cooper (C. H. and T.)-Athena Cantabrigiensis 3 vols. Re-issue. 21s. net, ditto, Vol. 3 only 6s. net 8vo. . MACMILLAN, Jan 13",Cooper,C. H.,Athena Cantabrigiensis,MACMILLAN,,0.0,8vo.,"Cooper (C. H. and T.)-Athena Cantabrigiensis 3 vols. Re-issue. 215. net, ditto, Vol. 3 only 6s. net 8vo. . MACMILLAN, Jan 13",C. H. Cooper,"['Cooper (C. H.)', 'Cooper (T.)']",,Jan 13,
"Copley (F. B.)— The Impeachment of President 1sraels. Cr. 8vo. 4s. 6d. net MACA:ILLAN, Mar. 13",Copley,F. B.,The Impeachment of President,ILLAN,,0.0,8vo.,"Copley (F. B.)— The Impeachment of President Israels. Cr. 8vo. 45. 6d. net MACA:ILLAN, Mar. 13",F. B. Copley,['Copley (F. B.)'],,Mar. 13,
"Copping (Arthur E.)-Jolly in Germany. Pop. 3. edit. 12mo., pp. 190, is. net HODDER & S., July 13",Copping,Arthur E.,Jolly in Germany,HODDER & S.,,0.0,12mo.,"Copping (Arthur E.)-Jolly in Germany. Pop. 3. edit. 12mo., pp. 190, is. net HODDER & S., July 13",Arthur E. Copping,['Copping (Arthur E.)'],,July 13,
"Copping (Arthur F.)-Smithers : a true story of private imperialisin. Pop. edit. Cr. 8vo. 73 X 44, pp. 302, is. net.. HODDER & S., Feb. 13",Copping,Arthur F.,Smithers : a true story of private imperialisin,HODDER & S.,,0.0,8vo.,"Copping (Arthur F.)-Smithers : a true story of private imperialisin. Pop. edit. Cr. 8vo. 73 X 44, pp. 302, is. net.. HODDER & S., Feb. 13",Arthur F. Copping,['Copping (Arthur F.)'],,Feb. 13,
"Corelli (Marie)-Boy : sketch. Pop. edit. 12mo., pp. 272, is, net .... METHUEN, July 13",Corelli,Marie,Boy : sketch,METHUEN,,0.0,12mo.,"Corelli (Marie)-Boy : sketch. Pop. edit. I 2mo., pp. 272, is, net .... METHUEN, July 13",Marie Corelli,['Corelli (Marie)'],,July 13,
"Cost of living of the working classes : report of an enquiry into working class rents and retail prices, with rates of wages, 1912. 4s. vid. WYMAX, A 14g. 13",,,"Cost of living of the working classes : report of an enquiry into working class rents and retail prices, with rates of wages",WYMAX,,0.0,,"Cost of living of the working classes : report of an enquiry into working class rents and retail prices, with rates of wages, 1912. 45. vid. WYMAX, A 14g. 13",,,,A 14g. 13,
"Costain (A. J.)-The Daybreak call. Cr. 8vo. 71 X41, pp. 150, is. net UNITED COUNCIL FOR Miss. EDUC., Dec. 13",Costain,A. J.,The Daybreak call,EDUC.,,0.0,8vo.,"Costain (A. J.)-The Daybreak call. Cr. 8vo. 71 X41, pp. 150, is. net UNITED COUNCIL FOR Miss. EDUC., Dec. 13",A. J. Costain,['Costain (A. J.)'],,Dec. 13,
"Cotes (Mrs. Everard)-Cousin Cinderella. 12mo., .W. COLLINS, Aug. 13",Cotes,Mrs. Everard,Cousin Cinderella,W. COLLINS,,0.0,12mo.,"Cotes (Mrs. Everard)-Cousin Cinderella. 12mo., .W. COLLINS, Aug. 13",Mrs. Everard Cotes,['Cotes (Mrs. Everard)'],,Aug. 13,
"Coulthard (H. R.)- The Story of an ancient parish: Breage with Germoe. 8vo. 8} x 5, pp. 154, (Camborne, Cornwall) CAMBORNE PRINTING CO., July 13",Coulthard,H. R.,The Story of an ancient parish: Breage with Germoe,CAMBORNE PRINTING CO.,,0.0,8vo.,"Coulthard (H. R.)- The Story of an ancient parish: Breage with Germoe. 8vo. 8} x 5, pp. 154, (Camborne, Cornwall) CAMBORNE PRINTING CO., July 13",H. R. Coulthard,['Coulthard (H. R.)'],,July 13,
"Coulthart (R.)-Characteristic features and how to develop them. Cr. 8vo., is. net C. W. DANIEL, Nov. 13",Coulthart,R.,Characteristic features and how to develop them,C. W. DANIEL,,0.0,8vo.,"Coulthart (R.)-Characteristic features and how to develop them. Cr. 8vo., is. net C. W. DANIEL, Nov. 13",R. Coulthart,['Coulthart (R.)'],,Nov. 13,
"Cornwall (Duchy of) --Account for 1912. d. WYMAN, A pr. 13",Cornwall,Duchy of,Account for,WYMAN,,0.0,,"Cornwall (Duchy of) --Account for 1912. d. WYMAN, A pr. 13",Duchy of Cornwall,['Cornwall (Duchy of)'],,A pr. 13,
"Cowan (Samuel)—Humorous episodes in the life of a provincial publisher extending over fifty years. 8vo., pp. 68, swd., is. net CORNISH BROS., Jan. 13",Cowan,Samuel,Humorous episodes in the life of a provincial publisher extending over fifty years,CORNISH BROS.,,0.0,8vo.,"Cowan (Samuel)—Humorous episodes in the life of a provincial publisher extending over fifty years. 8vo., pp. 68, swd., is. net CORNISH BROS., Jan. 13",Samuel Cowan,['Cowan (Samuel)'],,Jan. 13,
"Co wan (Samuel K.)–From Ulster's hills. (Verse.] 8vo., pp. 111, 1s. (Belfast) McCaw, STEVENSON, Nov. 13",,,,STEVENSON,,0.0,,"Co wan (Samuel K.)–From Ulster's hills. (Verse.] 8vo., pp. 111, Is. (Belfast) McCaw, STEVENSON, Nov. 13",,"[""Co wan (Samuel K.)–From Ulster's hills. (Verse.] 8vo., pp. 111, 1s. (Belfast)""]",,Nov. 13,
"Cowan (w.)-The Humorous side of the pulpit. 2nd and cheaper edit. Cr. 8vo., pp. 170, is, net GIBBING, Mar. 13",Cowan,w.,The Humorous side of the pulpit,GIBBING,,0.0,8vo.,"Cowan (w.)-The Humorous side of the pulpit. 2nd and cheaper edit. Cr. 8vo., pp. 170, is, net GIBBING, Mar. 13",w. Cowan,['Cowan (w.)'],,Mar. 13,
"Cowper (E. E.)-Enter Patricia : being an account of her strange adventures on a visit to the Cornish coast. 8vo. 81 X54, pp. 312, .CASSELL, Sep. 13",Cowper,E. E.,Enter Patricia : being an account of her strange adventures on a visit to the Cornish coast,CASSELL,,0.0,8vo.,"Cowper (E. E.)-Enter Patricia : being an account of her strange adventures on a visit to the Cornish coast. 8vo. 81 X54, pp. 312, .CASSELL, Sep. 13",E. E. Cowper,['Cowper (E. E.)'],,Sep. 13,
"Cox (J. Charles)—Churchwardens' accounts : from the 14th century to the close of the 17th century Illus. 8vo. 9 *5, pp. 384, 7s. 6d. net. (The Antiquary's books) METHUEN, May 13",Cox,J. Charles,Churchwardens' accounts : from the,METHUEN,,0.0,8vo.,"Cox (J. Charles)—Churchwardens' accounts : from the 14th century to the close of the 17th century Illus. 8vo. 9 *5, pp. 384, 75. 6d. net. (The Antiquary's books) METHUEN, May 13",J. Charles Cox,['Cox (J. Charles)'],,May 13,
"Cox (J. Charles)-Cumberland and Westmorland. Illus. 12mo. 64 x 4, pp. 204, 2s. 64. net. (County churches) ..G. ALLEN, May 13",Cox,J. Charles,Cumberland and Westmorland,G. ALLEN,,0.0,12mo.,"Cox (J. Charles)-Cumberland and Westmorland. Illus. 12mo. 64 x 4, pp. 204, 25. 64. net. (County churches) ..G. ALLEN, May 13",J. Charles Cox,['Cox (J. Charles)'],,May 13,
"Cox (John)-Beyond the atom. Ryl. 16mo., pp. 158, 1s. net; Ithr. 2s. 6d. net. (Cambridge manuals of science and literature) CAMB. UNIV. PRESS, May 13",Cox,John,Beyond the atom,CAMB. UNIV. PRESS,,0.0,16mo.,"Cox (John)-Beyond the atom. Ryl. 16mo., pp. 158, Is. net; Ithr. 25. 6d. net. (Cambridge manuals of science and literature) CAMB. UNIV. PRESS, May 13",John Cox,['Cox (John)'],,May 13,
"Cox (John Harrington)-A Hero of old France : the song of Roland translated and adapted from old French Texts. Cr. 8vo. 78 X5, pp. 160, is. net (All time tales) HARRAP, Feb. 13",Cox,John Harrington,A Hero of old France : the song of Roland translated and adapted from old French Texts,HARRAP,,0.0,8vo.,"Cox (John Harrington)-A Hero of old France : the song of Roland translated and adapted from old French Texts. Cr. 8vo. 78 X5, pp. 160, is. net (All time tales) HARRAP, Feb. 13",John Harrington Cox,['Cox (John Harrington)'],,Feb. 13,
"Cox (John Harrington)- Sir Gawain and the Green Knight. Illus. Cr. 8vo., pp. 120, 1s. net. (All timetales) .HARRAP, Apr. 13",Cox,John Harrington,Sir Gawain and the Green Knight,HARRAP,,0.0,8vo.,"Cox (John Harrington)- Sir Gawain and the Green Knight. Illus. Cr. 8vo., pp. 120, Is. net. (All timetales) .HARRAP, Apr. 13",John Harrington Cox,['Cox (John Harrington)'],,Apr. 13,
"Cox (Sir George W.)-Cox's Greek stories : Selected from  Tales of the gods and heroes. Ryl. 16mo., pp. 144, s....... .NELSON, Sep. 13",Cox,Sir George W.,Cox's Greek stories : Selected from  Tales of the gods and heroes,NELSON,,0.0,16mo.,"Cox (Sir George W.)-Cox's Greek stories : Selected from  Tales of the gods and heroes. Ryl. 16mo., pp. 144, IS....... .NELSON, Sep. 13",Sir George W. Cox,['Cox (Sir George W.)'],,Sep. 13,
"Coyle (John B.)- Our Lady of Perpetual Succour and Ireland. In Irish and English. Illus. 18mo. 6 X 4, pp. 368, is, net; paste grain, 2s, net M. H. GILL, June 31 Crabbe, George : Romance of an elderly poet, Broadley (A. M.) and Jerrold (W.) ios. 6d. net Crace (J. D.)— The Art of colour decoration. Illus. 4to. 121 x91, pp. 104, 305, net BATSPORD, Feb. 13",Coyle,John B.,Our Lady of Perpetual Succour and Ireland,BATSPORD,,0.0,18mo.,"Coyle (John B.)- Our Lady of Perpetual Succour and Ireland. In Irish and English. Illus. 18mo. 6 X 4, pp. 368, is, net; paste grain, 2s, net M. H. GILL, June 31 Crabbe, George : Romance of an elderly poet, Broadley (A. M.) and Jerrold (W.) ios. 6d. net Crace (J. D.)— The Art of colour decoration. Illus. 4to. 121 x91, pp. 104, 305, net BATSPORD, Feb. 13",John B. Coyle,['Coyle (John B.)'],,Feb. 13,
"Craig (Edward Gordon) Towards a new theatre : forty designs for stage scenes, with critical notes by the inventor. 410 13X114, pp. 106, 2S. net .DENT, Mar. 13",Craig,Edward Gordon,"Towards a new theatre : forty designs for stage scenes, with critical notes by the inventor",DENT,,0.0,,"Craig (Edward Gordon) Towards a new theatre : forty designs for stage scenes, with critical notes by the inventor. 410 13X114, pp. 106, 2IS. net .DENT, Mar. 13",Edward Gordon Craig,['Craig (Edward Gordon)'],,Mar. 13,
"Craik (Mrs.)—The Fairy book. By the author of John Halifax, gentleman. Pop. edit. 12mo., pp. 380, is, net ..MACMILLAN, Feb. 13",Craik,Mrs.,The Fairy book,MACMILLAN,,0.0,12mo.,"Craik (Mrs.)—The Fairy book. By the author of John Halifax, gentleman. Pop. edit. 12mo., pp. 380, is, net ..MACMILLAN, Feb. 13",Mrs. Craik,['Craik (Mrs.)'],,Feb. 13,
"Crane (Denis)— The Life-story of Sir Robert W. Perks, Bart. Cr. 8vo. 78 X 5, pp. 240, is. net C. H. KELLY, Sep. 13",Crane,Denis,"The Life-story of Sir Robert W. Perks, Bart",C. H. KELLY,,0.0,8vo.,"Crane (Denis)— The Life-story of Sir Robert W. Perks, Bart. Cr. 8vo. 78 X 5, pp. 240, is. net C. H. KELLY, Sep. 13",Denis Crane,['Crane (Denis)'],,Sep. 13,
"Crawford (F. Marion)-A Roman singer. 8vo., swd., 60. ...NEWNES, May 13",Crawford,F. Marion,A Roman singer,NEWNES,,0.0,8vo.,"Crawford (F. Marion)-A Roman singer. 8vo., swd., 60. ...NEWNES, May 13",F. Marion Crawford,['Crawford (F. Marion)'],,May 13,
"Crew (A.) see Weston (W. J.) and Crew. Crew (Albert) —The Law relating to secret com- missions and bribes; the Prevention of Cor- ruption Act. 1906. With foreword by the Rt. Hon. Sir Edward Fry. 8vo. 8} X5, PP. 200 .PITMAN, Aug. 13",Crew,A.,The Law relating to secret com- missions and bribes; the Prevention of Cor- ruption Act,PITMAN,,0.0,8vo.,"Crew (A.) see Weston (W. J.) and Crew. Crew (Albert) —The Law relating to secret com- missions and bribes; the Prevention of Cor- ruption Act. 1906. With foreword by the Rt. Hon. Sir Edward Fry. 8vo. 8} X5, PP. 200 .PITMAN, Aug. 13",A. Crew,"['Crew (A.)', 'Crew (Albert)']",,Aug. 13,
"Criminal statistics for 1911. s. Iid. (post free) WYMAN, Feb. 13",,,Criminal statistics for,WYMAN,,0.0,,"Criminal statistics for 1911. IS. Iid. (post free) WYMAN, Feb. 13",,,,Feb. 13,
"Crosland (T. W. H.)-Taffy was a Welshman. Cr. 8vo., pp. 180, swd. is, net EWART, SEYMOUR, Apr. 13",Crosland,T. W. H.,Taffy was a Welshman,"EWART, SEYMOUR",,0.0,8vo.,"Crosland (T. W. H.)-Taffy was a Welshman. Cr. 8vo., pp. 180, swd. is, net EWART, SEYMOUR, Apr. 13",T. W. H. Crosland,['Crosland (T. W. H.)'],,Apr. 13,
"Cross (Frederick)— Wireless explained : the book for officers of the mercantile marine. Cr. 8vo., pp. 76, 25, 6d. net · J. BROW'N, Apr. 13",Cross,Frederick,Wireless explained : the book for officers of the mercantile marine,J. BROW'N,,0.0,8vo.,"Cross (Frederick)— Wireless explained : the book for officers of the mercantile marine. Cr. 8vo., pp. 76, 25, 6d. net · J. BROW'N, Apr. 13",Frederick Cross,['Cross (Frederick)'],,Apr. 13,
"Croydon, with its surroundings, Anderson (A. H.) 6d. net Crozier (Gladys Beattie)-Children's indoor games. Cr. 8vo., pp. 128, bds., is. net ROUTLEDGE, Dec. 13",,,"Croydon, with its surroundings, Anderson (A. H.)",ROUTLEDGE,,0.0,8vo.,"Croydon, with its surroundings, Anderson (A. H.) 6d. net Crozier (Gladys Beattie)-Children's indoor games. Cr. 8vo., pp. 128, bds., is. net ROUTLEDGE, Dec. 13",,,,Dec. 13,
"Crozier (Gladys Beattie) Children's parties. Cr. 8vo., pp. 128, bds., is, net ROUTLEDGE, Dec. 13",Crozier,Gladys Beattie,Children's parties,ROUTLEDGE,,0.0,8vo.,"Crozier (Gladys Beattie) Children's parties. Cr. 8vo., pp. 128, bds., is, net ROUTLEDGE, Dec. 13",Gladys Beattie Crozier,['Crozier (Gladys Beattie)'],,Dec. 13,
"Cruelty man (The): actual experiences of an inspector of the N.S.P.C.C., graphically told by himself. 8vo. 7 X48, pp. 160, is. NAT. Soc. FOR PREV. OF CRUELTY TO CHILDREN, Jan. 13",,,"Cruelty man (The): actual experiences of an inspector of the N.S.P.C.C., graphically told by himself",FOR PREV. OF CRUELTY TO CHILDREN,,0.0,8vo.,"Cruelty man (The): actual experiences of an inspector of the N.S.P.C.C., graphically told by himself. 8vo. 7 X48, pp. 160, is. NAT. Soc. FOR PREV. OF CRUELTY TO CHILDREN, Jan. 13",,,,Jan. 13,
"Cruising Club (The Royal) Journal. Season, 1912. 8vo. 81 X 53 (88, Fetter Lane, E.C.) C. F. ROWORTH, Mar. 13",,,Cruising Club (The Royal) Journal,C. F. ROWORTH,,0.0,8vo.,"Cruising Club (The Royal) Journal. Season, 1912. 8vo. 81 X 53 (88, Fetter Lane, E.C.) C. F. ROWORTH, Mar. 13",,,,Mar. 13,
"Cryer (William)--Lays after labour. Port. 2nd edit., with additions. 8vo. 71 X41, pp. 452 ALFRED BLACKSHAW & SONS, Oct. 13",Cryer,William,Lays after labour,ALFRED BLACKSHAW & SONS,,0.0,8vo.,"Cryer (William)--Lays after labour. Port. 2nd edit., with additions. 8vo. 71 X41, pp. 452 ALFRED BLACKSHAW & SONS, Oct. 13",William Cryer,['Cryer (William)'],,Oct. 13,
"Cubitt (Mrs. Neville)—Bob Layton's adventures. New ed. Cr. 8vo., p. 138, s. GARDNER, D., Dec. 13",Cubitt,Mrs. Neville,Bob Layton's adventures,"GARDNER, D.",,0.0,8vo.,"Cubitt (Mrs. Neville)—Bob Layton's adventures. New ed. Cr. 8vo., p. 138, IS. GARDNER, D., Dec. 13",Mrs. Neville Cubitt,['Cubitt (Mrs. Neville)'],,Dec. 13,
"Cule (W. E.)—Mr. Crusoe's island. Cr. 8vo., s. S.S.U., Oct. 13",Cule,W. E.,Mr,S.S.U.,,0.0,8vo.,"Cule (W. E.)—Mr. Crusoe's island. Cr. 8vo., IS. S.S.U., Oct. 13",W. E. Cule,['Cule (W. E.)'],,Oct. 13,
"Cullis (C. E.)—Matrices and determinoids. Large ryl. 8vo., pp. 82, 21s. net. (University of Calcutta readership lectures) CAMB. UNIV. PRESS, Mar. 13",Cullis,C. E.,Matrices and determinoids,CAMB. UNIV. PRESS,,0.0,8vo.,"Cullis (C. E.)—Matrices and determinoids. Large ryl. 8vo., pp. 82, 215. net. (University of Calcutta readership lectures) CAMB. UNIV. PRESS, Mar. 13",C. E. Cullis,['Cullis (C. E.)'],,Mar. 13,
"Cullum (Ridgwell)—- The Brooding wild : mountain trangedy. Re-issue. Cr. 8vo. 71 x 5, pp. 266, 28. net .CHAPMAN & H., Apr. 13",Cullum,Ridgwell,The Brooding wild : mountain trangedy,CHAPMAN & H.,,0.0,8vo.,"Cullum (Ridgwell)—- The Brooding wild : mountain trangedy. Re-issue. Cr. 8vo. 71 x 5, pp. 266, 28. net .CHAPMAN & H., Apr. 13",Ridgwell Cullum,['Cullum (Ridgwell)'],,Apr. 13,
"Culpin (Ewart G.)-The Garden city movement up-to-date. Ryl. 8vo., pp. 64, swd. is. net P. S. KING, Mar. 13",Culpin,Ewart G.,The Garden city movement up-to-date,P. S. KING,,0.0,8vo.,"Culpin (Ewart G.)-The Garden city movement up-to-date. Ryl. 8vo., pp. 64, swd. is. net P. S. KING, Mar. 13",Ewart G. Culpin,['Culpin (Ewart G.)'],,Mar. 13,
"Cuming (E. D.) The Bodley Head natural history. Illus. by J. A. Shepherd. Vol. 2, British birds, Ryl. 15mo. 61 X5, pp. 122, 28. net LANE, Dec. 13",Cuming,E. D.,The Bodley Head natural history,LANE,,0.0,15mo.,"Cuming (E. D.) The Bodley Head natural history. Illus. by J. A. Shepherd. Vol. 2, British birds, Ryl. 15mo. 61 X5, pp. 122, 28. net LANE, Dec. 13",E. D. Cuming,['Cuming (E. D.)'],,Dec. 13,
"Cuneiform texts from Babylon tablets, British Museum, pt. 33, 7s. 6d... Cunliffe (Howard) and Owen (G. A.)—Weights and Measures Act, 1904: Board of Trade notices annotated. Vol. 1. Ryl. 8vo. 10 X 61, pp. 199 (Smethwick, Staffs) CUNLIFFE, Jun. 13",,,"Cuneiform texts from Babylon tablets, British Museum, pt",CUNLIFFE,,0.0,8vo.,"Cuneiform texts from Babylon tablets, British Museum, pt. 33, 75. 6d... Cunliffe (Howard) and Owen (G. A.)—Weights and Measures Act, 1904: Board of Trade notices annotated. Vol. 1. Ryl. 8vo. 10 X 61, pp. 199 (Smethwick, Staffs) CUNLIFFE, Jun. 13",,,,Jun. 13,
"Cunning (Joseph)-Aids to surgery. 3rd edit. 12mo., pp. 424, 4s. net, swd. 3s. 6d. net (Students' aids ser.) · BAILLIÈRE, Mar. 13",Cunning,Joseph,Aids to surgery,BAILLIÈRE,,0.0,12mo.,"Cunning (Joseph)-Aids to surgery. 3rd edit. 12mo., pp. 424, 45. net, swd. 35. 6d. net (Students' aids ser.) · BAILLIÈRE, Mar. 13",Joseph Cunning,['Cunning (Joseph)'],,Mar. 13,
"Cunnington (Susan)—Stories from Dante. C:. 8vo. 74 *5), pp. 256, 2s. 6d. net. (“ Told through the ages) ..HARRAP, Apr. 13",Cunnington,Susan,Stories from Dante,HARRAP,,0.0,8vo.,"Cunnington (Susan)—Stories from Dante. C:. 8vo. 74 *5), pp. 256, 25. 6d. net. (“ Told through the ages) ..HARRAP, Apr. 13",Susan Cunnington,['Cunnington (Susan)'],,Apr. 13,
"Cupid's darts. 8vo. 6 X4, in envelope is. net (Delraine edit., 4.)... SIEGLE, H., Oct. 13",,,Cupid's darts,"SIEGLE, H.",,0.0,8vo.,"Cupid's darts. 8vo. 6 X4, in envelope is. net (Delraine edit., 4.)... SIEGLE, H., Oct. 13",,,,Oct. 13,
"Curnock (N.)-The Comfortable words of the Holy Communion. 12mo. is. net C. H. KELLY, Jan. 13",Curnock,N.,The Comfortable words of the Holy Communion,C. H. KELLY,,0.0,12mo.,"Curnock (N.)-The Comfortable words of the Holy Communion. 12mo. is. net C. H. KELLY, Jan. 13",N. Curnock,['Curnock (N.)'],,Jan. 13,
"Currey (E Hamilton)-Sea-wolves of the Medi- terranean : the grand period of the Moslem Corsairs. 12mo., pp. 368, is. net NELSON, Nov. 13",Currey,E Hamilton,Sea-wolves of the Medi- terranean : the grand period of the Moslem Corsairs,NELSON,,0.0,12mo.,"Currey (E Hamilton)-Sea-wolves of the Medi- terranean : the grand period of the Moslem Corsairs. 12mo., pp. 368, is. net NELSON, Nov. 13",E Hamilton Currey,['Currey (E Hamilton)'],,Nov. 13,
"Curtis (Marguerite)-The Dividing line. Cr. 8vo. 8 X5, pp. 240, 3s. 60 ....C. H. KELLY, Sep. 13",Curtis,Marguerite,The Dividing line,C. H. KELLY,,0.0,8vo.,"Curtis (Marguerite)-The Dividing line. Cr. 8vo. 8 X5, pp. 240, 35. 60 ....C. H. KELLY, Sep. 13",Marguerite Curtis,['Curtis (Marguerite)'],,Sep. 13,
"Cycle repairing and adjusting: with a chapter on building a bicycle from a set of parts. Illus. Cr. 8vo., pp. 160, bds., s. net (“ Work handbooks) .CASSELL, June 13",,,Cycle repairing and adjusting: with a chapter on building a bicycle from a set of parts,CASSELL,,0.0,8vo.,"Cycle repairing and adjusting: with a chapter on building a bicycle from a set of parts. Illus. Cr. 8vo., pp. 160, bds., IS. net (“ Work handbooks) .CASSELL, June 13",,,,June 13,
"Daily Chronicle Football guide, season 1913-14. Rev. and enlarged. 18mo, pp. 96, swd., id. OFFICE, Aug. 13",,,"Daily Chronicle Football guide, season",OFFICE,,0.0,"18mo,","Daily Chronicle Football guide, season 1913-14. Rev. and enlarged. 18mo, pp. 96, swd., id. OFFICE, Aug. 13",,,,Aug. 13,
"Daily Mail Chart of the Panama Canal. Folded, s. net....... ......G. PHILIP, Feb. 13",,,Daily Mail Chart of the Panama Canal,G. PHILIP,,0.0,,"Daily Mail Chart of the Panama Canal. Folded, IS. net....... ......G. PHILIP, Feb. 13",,,,Feb. 13,
"Dainty meals for small households, Ninet (M.). 1s net....... Dairy Farmers' Association (British)—Journal. Vol. 27. 8vo. 8} X5), pp. 244, s. ASSOCIATION, Apr. 13",,,"Dainty meals for small households, Ninet (M.)",ASSOCIATION,,0.0,8vo.,"Dainty meals for small households, Ninet (M.). Is net....... Dairy Farmers' Association (British)—Journal. Vol. 27. 8vo. 8} X5), pp. 244, IS. ASSOCIATION, Apr. 13",,,,Apr. 13,
"Dale (R. W.)--Christ and the future life. 16mo., s. net ..HODDER & S., Oct. 13",Dale,R. W.,Christ and the future life,HODDER & S.,,0.0,16mo.,"Dale (R. W.)--Christ and the future life. 16mo., IS. net ..HODDER & S., Oct. 13",R. W. Dale,['Dale (R. W.)'],,Oct. 13,
