entry,last_name,first_name,title,publisher,price,price_in_pounds,format,original_entry,author_name,creators,is_editor,date,is_net
"Irish Land Commission-Accounts, 1911-12. 2}d. WYMAN, Feb. 13",,,Irish Land Commission-Accounts,WYMAN,,0.0,,"Irish Land Commission-Accounts, 1911-12. 2}d. WYMAN, Feb. 13",,,,Feb. 13,
"Irish Land Commission-Returns of advances. Monthly (various prices)..WYMAN, Jan., &c., 13",,,Irish Land Commission-Returns of advances,WYMAN,,0.0,,"Irish Land Commission-Returns of advances. Monthly (various prices)..WYMAN, Jan., &c., 13",,,,"Jan., &c., 13",
"Irish Universities Act, 1908-Accounts of Univer- sities and Colleges, Ireland, for 1911-12; with report of the Comptroller and Auditor- General 2!d. WYMAN, Jan. 13",,,Irish Universities Act,WYMAN,,0.0,,"Irish Universities Act, 1908-Accounts of Univer- sities and Colleges, Ireland, for 1911-12; with report of the Comptroller and Auditor- General 2!d. WYMAN, Jan. 13",,,,Jan. 13,
"Iron and Steel Institute (The)-Carnegie scholar- ship memoirs, Vol. 5. 8vo., 1os. net SPON, July 13",,,"Iron and Steel Institute (The)-Carnegie scholar- ship memoirs, Vol",SPON,,0.0,8vo.,"Iron and Steel Institute (The)-Carnegie scholar- ship memoirs, Vol. 5. 8vo., 1os. net SPON, July 13",,,,July 13,
"Iron and Steel Institute-Journa.. Vol. 86. 8vo., 168, net .....SPON, Feb. 13",,,Iron and Steel Institute-Journa,SPON,,0.0,8vo.,"Iron and Steel Institute-Journa.. Vol. 86. 8vo., 168, net .....SPON, Feb. 13",,,,Feb. 13,
"Ireland—Emigration statistics, 1912. 2}d. WYMAN, Apr. Ireland --Emigration statistics. (Monthly.) ea. id. WYMAN, Jan., &c., 13",,,Ireland—Emigration statistics,WYMAN,,0.0,,"Ireland—Emigration statistics, 1912. 2}d. WYMAN, Apr. Ireland --Emigration statistics. (Monthly.) ea. id. WYMAN, Jan., &c., 13",,,,"Jan., &c., 13",
"Irving (Eva Bell-) see Bell-Irving. Irwin (Florence)-Auction high-lights. With a full exposition of the Nullo count. 12mo. 64 X 41, pp. 286, 38. 60. net ..PUTNAM, Nov. 13",Irving,Eva Bell-,Auction high-lights,PUTNAM,,0.0,12mo.,"Irving (Eva Bell-) see Bell-Irving. Irwin (Florence)-Auction high-lights. With a full exposition of the Nullo count. 12mo. 64 X 41, pp. 286, 38. 60. net ..PUTNAM, Nov. 13",Eva Bell- Irving,"['Irving (Eva Bell-)', 'Irwin (Florence)']",,Nov. 13,
"1s Christianity a colossal failure ? By one of the Bees. 3rd edit. 8vo., pp. 182, swd. is. net S. PAUL, Nov. 13",,,,S. PAUL,,0.0,8vo.,"Is Christianity a colossal failure ? By one of the Bees. 3rd edit. 8vo., pp. 182, swd. is. net S. PAUL, Nov. 13",,,,Nov. 13,
"1s there a Hell? A symposium by leaders of religious thought. Cr. 8vo., pp. 116, bds. s. net .CASSELL, July 13",,,,CASSELL,,0.0,8vo.,"Is there a Hell? A symposium by leaders of religious thought. Cr. 8vo., pp. 116, bds. IS. net .CASSELL, July 13",,,,July 13,
"Jack and Jill : fairy story, MacDonald (G.) 5s. net Jack and the bean stalk. Illus. by H. M. Brock. 4to. swd. is. net WARNE, Oct. 13",,,"Jack and Jill : fairy story, MacDonald (G.)",WARNE,,0.0,4to.,"Jack and Jill : fairy story, MacDonald (G.) 5s. net Jack and the bean stalk. Illus. by H. M. Brock. 4to. swd. is. net WARNE, Oct. 13",,,,Oct. 13,
"Jacko, and other stories. 4to., is. NELSON, Sep. 13",,,"Jacko, and other stories",NELSON,,0.0,4to.,"Jacko, and other stories. 4to., is. NELSON, Sep. 13",,,,Sep. 13,
"Jacobs (W. W.)-Odd craft. Pop. ., . Jackson (Alice F.)–Oliver Twist, Dickens ici ? Jaepuo es lo metotle HODDER & S., June 13",Jacobs,W. W.,Odd craft,HODDER & S.,,0.0,,"Jacobs (W. W.)-Odd craft. Pop. ., . Jackson (Alice F.)–Oliver Twist, Dickens ici ? Jaepuo es lo metotle HODDER & S., June 13",W. W. Jacobs,['Jacobs (W. W.)'],,June 13,
"Jackson (Alice Sophia)—The Children of Burthorpe Grange. Cr. 8vo., pp. 128, is. S.P.C.K., Oct. 13",Jackson,Alice Sophia,The Children of Burthorpe Grange,S.P.C.K.,,0.0,8vo.,"Jackson (Alice Sophia)—The Children of Burthorpe Grange. Cr. 8vo., pp. 128, is. S.P.C.K., Oct. 13",Alice Sophia Jackson,['Jackson (Alice Sophia)'],,Oct. 13,
"Jackson (11. C.)Tooth of fire : being some account of the ancient Kingdom of Sennar. 8vo. 74 X5}, pp. 106, 3s. 6d. net (Oxford), BLACKWELL, Feb. 13",Jackson,11. C.,Tooth of fire : being some account of the ancient Kingdom of Sennar,BLACKWELL,,0.0,8vo.,"Jackson (11. C.)Tooth of fire : being some account of the ancient Kingdom of Sennar. 8vo. 74 X5}, pp. 106, 35. 6d. net (Oxford), BLACKWELL, Feb. 13",11. C. Jackson,['Jackson (11. C.)'],,Feb. 13,
"Jackson (Thomas Graham)—Byzantine and Romanesque architecture. 2 vols. Illus. 4to. 10 X71, pp. 294, 292, 425, net CAMR. UNIV. PRESS, Jan. 13",Jackson,Thomas Graham,Byzantine and Romanesque architecture,CAMR. UNIV. PRESS,,0.0,4to.,"Jackson (Thomas Graham)—Byzantine and Romanesque architecture. 2 vols. Illus. 4to. 10 X71, pp. 294, 292, 425, net CAMR. UNIV. PRESS, Jan. 13",Thomas Graham Jackson,['Jackson (Thomas Graham)'],,Jan. 13,
"Jacobi (Charles Thomas)—Printing : a practical treatise, &c. 5th edit., rev. Cr. 8vo. 7 X4}, pp. 434, 7s. 60... .BELL, June 13",Jacobi,Charles Thomas,"Printing : a practical treatise, &c",BELL,,0.0,8vo.,"Jacobi (Charles Thomas)—Printing : a practical treatise, &c. 5th edit., rev. Cr. 8vo. 7 X4}, pp. 434, 75. 60... .BELL, June 13",Charles Thomas Jacobi,['Jacobi (Charles Thomas)'],,June 13,
"Jacobs (Joseph)-Geographical discovery. Rev. and enlarged edit. 12mo., pp. 244, s. net (Useful knowledge ser.) HODDER & S., July 13",Jacobs,Joseph,Geographical discovery,HODDER & S.,,0.0,12mo.,"Jacobs (Joseph)-Geographical discovery. Rev. and enlarged edit. 12mo., pp. 244, IS. net (Useful knowledge ser.) HODDER & S., July 13",Joseph Jacobs,['Jacobs (Joseph)'],,July 13,
"Jacobs (W. W.)-Captains all. Svo., swd. 6. HODDER & S., May 13",Jacobs,W. W.,Captains all,HODDER & S.,,0.0,,"Jacobs (W. W.)-Captains all. Svo., swd. 6. HODDER & S., May 13",W. W. Jacobs,['Jacobs (W. W.)'],,May 13,
"Jagger (John F.)-An Elementary text-book on mechanical drawing. 2nd edit. 4to. 10 X71, pp. 262, 7s. 6. net....C. GRIFFIN, May 13",Jagger,John F.,An Elementary text-book on mechanical drawing,C. GRIFFIN,,0.0,4to.,"Jagger (John F.)-An Elementary text-book on mechanical drawing. 2nd edit. 4to. 10 X71, pp. 262, 75. 6. net....C. GRIFFIN, May 13",John F. Jagger,['Jagger (John F.)'],,May 13,
"James (Lionel)—With the conquered Turk: the story of a latter-day adventurer. Cr. 8vo. 74 X5, pp. 370, 28. net .....NELSON, Feb. 13",James,Lionel,With the conquered Turk: the story of a latter-day adventurer,NELSON,,0.0,8vo.,"James (Lionel)—With the conquered Turk: the story of a latter-day adventurer. Cr. 8vo. 74 X5, pp. 370, 28. net .....NELSON, Feb. 13",Lionel James,['James (Lionel)'],,Feb. 13,
"James (Winifred)—Letters to my son. Cheaper edit. 12mo., pp. 182, is. net CHAPMAN & H., Oct. 13",James,Winifred,Letters to my son,CHAPMAN & H.,,0.0,12mo.,"James (Winifred)—Letters to my son. Cheaper edit. 12mo., pp. 182, is. net CHAPMAN & H., Oct. 13",Winifred James,['James (Winifred)'],,Oct. 13,
"Jefferson's Nautical almanac and tide tables, 1914. Cr. 8vo., swd., 6d. and is. SIMPKIN, Oct. 13",,,Jefferson's Nautical almanac and tide tables,SIMPKIN,,0.0,8vo.,"Jefferson's Nautical almanac and tide tables, 1914. Cr. 8vo., swd., 6d. and is. SIMPKIN, Oct. 13",,,,Oct. 13,
"Jameson (Anna)—Shakespeare's heroines. 12mo., pp. 350, is, net. (Bohn's popular lib.) BELL, Oct. 13",Jameson,Anna,Shakespeare's heroines,BELL,,0.0,12mo.,"Jameson (Anna)—Shakespeare's heroines. 12mo., pp. 350, is, net. (Bohn's popular lib.) BELL, Oct. 13",Anna Jameson,['Jameson (Anna)'],,Oct. 13,
"Jamieson (E. B.)—A Companion to manuals of practical anatomy. 12mo., 64 X4, pp. 552, 6s. net. (Oxford medical publications) H. MILFORD, Sep. 13",Jamieson,E. B.,A Companion to manuals of practical anatomy,H. MILFORD,,0.0,12mo.,"Jamieson (E. B.)—A Companion to manuals of practical anatomy. 12mo., 64 X4, pp. 552, 6s. net. (Oxford medical publications) H. MILFORD, Sep. 13",E. B. Jamieson,['Jamieson (E. B.)'],,Sep. 13,
"Jamieson (John)—Rome and St. Peter ; or, The Papal Twins. Cr. 8vo. 7! X41, pp. 168, is. PARTRIDGE, Dec. 13",Jamieson,John,Rome and St,PARTRIDGE,,0.0,8vo.,"Jamieson (John)—Rome and St. Peter ; or, The Papal Twins. Cr. 8vo. 7! X41, pp. 168, is. PARTRIDGE, Dec. 13",John Jamieson,['Jamieson (John)'],,Dec. 13,
"Janson (Gustaf)~Pride of war. Re-issue. Cr. 8vo. pp. 356, is. net ....SIDGWICK & J., July 13",Janson,Gustaf,Pride of war,SIDGWICK & J.,,0.0,8vo.,"Janson (Gustaf)~Pride of war. Re-issue. Cr. 8vo. pp. 356, is. net ....SIDGWICK & J., July 13",Gustaf Janson,['Janson (Gustaf)'],,July 13,
"Japan Gazette Peerage of Japan, ist edit. Ryl. 8vo. 10 X6, pp. 988, 1oos. net (Yokohama) JAPAN GAZETTE, May 13",,,"Japan Gazette Peerage of Japan, ist edit",JAPAN GAZETTE,,0.0,8vo.,"Japan Gazette Peerage of Japan, ist edit. Ryl. 8vo. 10 X6, pp. 988, 1oos. net (Yokohama) JAPAN GAZETTE, May 13",,,,May 13,
"Jataka (The): or, Stories of the Buddha's former births. Trans. from the Pāli by various hands. Index vol. Ryl. 8vo. 103 x6, pp. 63 CAMB. UNIV. PRESS, Apr. 13",,,"Jataka (The): or, Stories of the Buddha's former births",CAMB. UNIV. PRESS,,0.0,8vo.,"Jataka (The): or, Stories of the Buddha's former births. Trans. from the Pāli by various hands. Index vol. Ryl. 8vo. 103 x6, pp. 63 CAMB. UNIV. PRESS, Apr. 13",,,,Apr. 13,
"Jenkins (H. D.)—Behind Turkish lattices. Izmo., W. COLLINS, Apr. 13",Jenkins,H. D.,Behind Turkish lattices,W. COLLINS,,0.0,,"Jenkins (H. D.)—Behind Turkish lattices. Izmo., W. COLLINS, Apr. 13",H. D. Jenkins,['Jenkins (H. D.)'],,Apr. 13,
"Jenkinson (J. W.)—Vertebrate embryology: com- prising the early history of the embryo and its foetal membranes. 8vo. 945, pp. 268, 128. 6d. net .(Clarendon Press) FROWDE, Mar. 13",Jenkinson,J. W.,Vertebrate embryology: com- prising the early history of the embryo and its foetal membranes,FROWDE,,0.0,8vo.,"Jenkinson (J. W.)—Vertebrate embryology: com- prising the early history of the embryo and its foetal membranes. 8vo. 945, pp. 268, 128. 6d. net .(Clarendon Press) FROWDE, Mar. 13",J. W. Jenkinson,['Jenkinson (J. W.)'],,Mar. 13,
"Jennings (Eveline B.) See Lester (H. A.) and Jennings. Jennings (J. G.)-ed.–Select passages on duty to the State, and kindred subjects: for reading, analysis, and translation in schools and colleges. First ser. (Parts I and II), pp. 100, s. 4d. Second ser. (Parts III and IV) pp. 140, is. 8d. Parts I-IV in one vol., pp. 230, 2s. 6d. Cr. 8vo. (Clarendon Press) MILFORD, Nov. 13",Jennings,Eveline B.,See Lester (H. A.) and Jennings,MILFORD,,0.0,8vo.,"Jennings (Eveline B.) See Lester (H. A.) and Jennings. Jennings (J. G.)-ed.–Select passages on duty to the State, and kindred subjects: for reading, analysis, and translation in schools and colleges. First ser. (Parts I and II), pp. 100, IS. 4d. Second ser. (Parts III and IV) pp. 140, is. 8d. Parts I-IV in one vol., pp. 230, 25. 6d. Cr. 8vo. (Clarendon Press) MILFORD, Nov. 13",Eveline B. Jennings,['Jennings (Eveline B.)'],,Nov. 13,
"Jepson (Edgar)—Pollyooly. 2nd edit. Cr. 8vo., pp. 298, swd., is. net ..MILLS & B., Apr. 13",Jepson,Edgar,Pollyooly,MILLS & B.,,0.0,8vo.,"Jepson (Edgar)—Pollyooly. 2nd edit. Cr. 8vo., pp. 298, swd., is. net ..MILLS & B., Apr. 13",Edgar Jepson,['Jepson (Edgar)'],,Apr. 13,
"Jerdan (Charles)-Manna for young pilgrims : sixty-two addresses to young people. Cr. Svo. 8x54, pp. 418, 3s. 60. net .OLIPHANT, Sep. 13",Jerdan,Charles,Manna for young pilgrims : sixty-two addresses to young people,OLIPHANT,,0.0,,"Jerdan (Charles)-Manna for young pilgrims : sixty-two addresses to young people. Cr. Svo. 8x54, pp. 418, 3s. 60. net .OLIPHANT, Sep. 13",Charles Jerdan,['Jerdan (Charles)'],,Sep. 13,
"Jerdan (Charles) - Pastures of tender grass : sixty-six short sermons to young people. Cr. 8vo. 8 X 51, pp. 444, 3s. 64. net OLIPHANT, Sep. 13",Jerdan,Charles,Pastures of tender grass : sixty-six short sermons to young people,OLIPHANT,,0.0,8vo.,"Jerdan (Charles) - Pastures of tender grass : sixty-six short sermons to young people. Cr. 8vo. 8 X 51, pp. 444, 35. 64. net OLIPHANT, Sep. 13",Charles Jerdan,['Jerdan (Charles)'],,Sep. 13,
"Jerrold (Clare)—The Married life of Queen Victoria. 8vo. 9X54, pp. 412, 155, net NASH, Mar. 13",Jerrold,Clare,The Married life of Queen Victoria,NASH,,0.0,8vo.,"Jerrold (Clare)—The Married life of Queen Victoria. 8vo. 9X54, pp. 412, 155, net NASH, Mar. 13",Clare Jerrold,['Jerrold (Clare)'],,Mar. 13,
"Jesse (Louie)---Babyland abroad : being a series of geography stories. Illus. Cr. 8vo., pp. 192. 23. 6d. net. (Supplementary geography readers) PITMAN, May 13",Jesse,Louie,Babyland abroad : being a series of geography stories,PITMAN,,0.0,8vo.,"Jesse (Louie)---Babyland abroad : being a series of geography stories. Illus. Cr. 8vo., pp. 192. 23. 6d. net. (Supplementary geography readers) PITMAN, May 13",Louie Jesse,['Jesse (Louie)'],,May 13,
"Jessep (H. L.)-Notes on pre-Conquest church architecture in Hampshire and Surrey. Illus. Cr. 8vo., pp. 32, swd., is. net SIMPKIN, Sep. 13",Jessep,H. L.,Notes on pre-Conquest church architecture in Hampshire and Surrey,SIMPKIN,,0.0,8vo.,"Jessep (H. L.)-Notes on pre-Conquest church architecture in Hampshire and Surrey. Illus. Cr. 8vo., pp. 32, swd., is. net SIMPKIN, Sep. 13",H. L. Jessep,['Jessep (H. L.)'],,Sep. 13,
"Jessop (George H. Where the shamrock grows: the fortunes and misfortunes of an Irish family. 2nd edit. Cr. 8vo., pp. 214, swd., is. net MURRAY & E., July 13",,,Jessop (George H. Where the shamrock grows: the fortunes and misfortunes of an Irish family,MURRAY & E.,,0.0,8vo.,"Jessop (George H. Where the shamrock grows: the fortunes and misfortunes of an Irish family. 2nd edit. Cr. 8vo., pp. 214, swd., is. net MURRAY & E., July 13",,,,July 13,
"Je wish year book, 1913 (5673-4). 12mo. s. net JEWISH CHRONICLE” OFFICE, Jan. 13",,,Je wish year book,OFFICE,,0.0,12mo.,"Je wish year book, 1913 (5673-4). 12mo. IS. net JEWISH CHRONICLE” OFFICE, Jan. 13",,,,Jan. 13,
"John Willie, and other stories. 4to., bds. is. NELSON, Sep. 13",,,"John Willie, and other stories",NELSON,,0.0,4to.,"John Willie, and other stories. 4to., bds. is. NELSON, Sep. 13",,,,Sep. 13,
"Johnson (A. E.)-W. Heath Robinson. 4to. 84x6, pp. 60, 3s. 6d. net. (Brush, pen and pencil ser.) BLACK, May 13",Johnson,A. E.,W. Heath Robinson,BLACK,,0.0,4to.,"Johnson (A. E.)-W. Heath Robinson. 4to. 84x6, pp. 60, 35. 6d. net. (Brush, pen and pencil ser.) BLACK, May 13",A. E. Johnson,['Johnson (A. E.)'],,May 13,
"Johnson (R.) see Fleming (A. P M.) and Johnson. Johnson (R. Brimley)-Tennyson and his poetry. 12mo., pp. 160, is. net (Poetry and life ser.) HARRAP, May 13",Johnson,R.,Tennyson and his poetry,HARRAP,,0.0,12mo.,"Johnson (R.) see Fleming (A. P M.) and Johnson. Johnson (R. Brimley)-Tennyson and his poetry. 12mo., pp. 160, is. net (Poetry and life ser.) HARRAP, May 13",R. Johnson,"['Johnson (R.)', 'Johnson (R. Brimley)']",,May 13,
"Johnson, Dr., and his circle, Bailey (J.) is, net Johns's (Fred)-Annual for 1913: showing who is who in Australasia. Second year of issue. 8vo., pp. 17s........ (Adelaide) JOHNS, Oct. 13",,,"Johnson, Dr",JOHNS,,0.0,8vo.,"Johnson, Dr., and his circle, Bailey (J.) is, net Johns's (Fred)-Annual for 1913: showing who is who in Australasia. Second year of issue. 8vo., pp. 175........ (Adelaide) JOHNS, Oct. 13",,,,Oct. 13,
"Johnstone (R.)-On principles of evidence in critical inquiry : with special reference to the New Testament. Cr. 8vo., is. net MARSHALL BROS, May 13",Johnstone,R.,On principles of evidence in critical inquiry : with special reference to the New Testament,MARSHALL BROS,,0.0,8vo.,"Johnstone (R.)-On principles of evidence in critical inquiry : with special reference to the New Testament. Cr. 8vo., is. net MARSHALL BROS, May 13",R. Johnstone,['Johnstone (R.)'],,May 13,
"Jones (T. F. T.)-A Boy's Travels in many lands. 4to. bds. 2s. net St. CATHERINE PRESS, Dec. 13",Jones,T. F. T.,A Boy's Travels in many lands,CATHERINE PRESS,,0.0,4to.,"Jones (T. F. T.)-A Boy's Travels in many lands. 4to. bds. 2s. net St. CATHERINE PRESS, Dec. 13",T. F. T. Jones,['Jones (T. F. T.)'],,Dec. 13,
"Jones (W. H. S.) and Appleton (R. B.)-Perse Latin plays. Cr. 8vo. 7° X43, pp. 68, is, net HEFFER, Jan. 13",Jones,W. H. S.,Perse Latin plays,HEFFER,,0.0,8vo.,"Jones (W. H. S.) and Appleton (R. B.)-Perse Latin plays. Cr. 8vo. 7° X43, pp. 68, is, net HEFFER, Jan. 13",W. H. S. Jones,"['Jones (W. H. S.)', 'Appleton (R. B.)']",,Jan. 13,
"Jordan (Herbert W.)—The Debenture : its use and abuse : lecture under the auspices of the Secretaries' Association. 8vo. 81 X 5, pp. 41, s. JORDAN, Nov. 13",Jordan,Herbert W.,The Debenture : its use and abuse : lecture under the auspices of the Secretaries' Association,JORDAN,,0.0,8vo.,"Jordan (Herbert W.)—The Debenture : its use and abuse : lecture under the auspices of the Secretaries' Association. 8vo. 81 X 5, pp. 41, IS. JORDAN, Nov. 13",Herbert W. Jordan,['Jordan (Herbert W.)'],,Nov. 13,
"Jordan (Louis Henry)-Comparative religion : its origin and outlook : a lecture. Ryl. is. net H. MILFORD, May 13",Jordan,Louis Henry,Comparative religion : its origin and outlook : a lecture,H. MILFORD,,0.0,,"Jordan (Louis Henry)-Comparative religion : its origin and outlook : a lecture. Ryl. is. net H. MILFORD, May 13",Louis Henry Jordan,['Jordan (Louis Henry)'],,May 13,
"Joyce (P. W.) The Origin and history of Irish names of places. Vol. 3. Cr. 8vo. 58. LONGMANS, Nov. 13",Joyce,P. W.,The Origin and history of Irish names of places,LONGMANS,,0.0,8vo.,"Joyce (P. W.) The Origin and history of Irish names of places. Vol. 3. Cr. 8vo. 58. LONGMANS, Nov. 13",P. W. Joyce,['Joyce (P. W.)'],,Nov. 13,
"Joyce (Weston St. John)-The Neighbourhood of Dublin ; its topography, antiquities and historical associations. New edit. Illus. Demy [ 8vo. 84 X5], pp. 464, 3s. 6d. net M. 11. GILL, June 13",Joyce,Weston St. John,"The Neighbourhood of Dublin ; its topography, antiquities and historical associations",GILL,,0.0,8vo.,"Joyce (Weston St. John)-The Neighbourhood of Dublin ; its topography, antiquities and historical associations. New edit. Illus. Demy [ 8vo. 84 X5], pp. 464, 35. 6d. net M. 11. GILL, June 13",Weston St. John Joyce,['Joyce (Weston St. John)'],,June 13,
"Julia and I in Canada. By the author of “ Daphne in the Fatherland,” &c. Cr. 8vo. 71 x 4, pp. .A. MELROSE, Nov. 13",,,Julia and I in Canada,A. MELROSE,,0.0,8vo.,"Julia and I in Canada. By the author of “ Daphne in the Fatherland,” &c. Cr. 8vo. 71 x 4, pp. .A. MELROSE, Nov. 13",,,,Nov. 13,
"Julian (Emperor)--Works. Vol. 1. With an English trans, by Wilmer Cave Wright, 12mo. 61 X41, pp. 526, 5s. net ; Ithr., 6s. 6d. net (Loeb classical library), HEINEMANN, A pr. 13",Julian,Emperor,Works,HEINEMANN,,0.0,12mo.,"Julian (Emperor)--Works. Vol. 1. With an English trans, by Wilmer Cave Wright, 12mo. 61 X41, pp. 526, 5s. net ; Ithr., 6s. 6d. net (Loeb classical library), HEINEMANN, A pr. 13",Emperor Julian,['Julian (Emperor)'],,A pr. 13,
"Junior Latin reader (A.). With notes by P. M. Druce and M. D. Manduell. Cr. 8vo., pp. 124, LONGMANS, Dec. 13",Junior Latin reader,A.,With notes by P. M. Druce and M. D. Manduell,LONGMANS,,0.0,8vo.,"Junior Latin reader (A.). With notes by P. M. Druce and M. D. Manduell. Cr. 8vo., pp. 124, LONGMANS, Dec. 13",A. Junior Latin reader,['Junior Latin reader (A.)'],,Dec. 13,
"Jury Law and Practice (Dept. Committee on) — Vol. 1, Report, 6d.; Vol. 2, Evidence, is. yd. WYMAN, May 13",,,Jury Law and Practice (Dept,WYMAN,,0.0,,"Jury Law and Practice (Dept. Committee on) — Vol. 1, Report, 6d.; Vol. 2, Evidence, is. yd. WYMAN, May 13",,,,May 13,
"Justinian.-- Justiniani Institutionum Libri quat. tuor. With intro commentaries, and excursus, by J. B. Moyle. 8vo., pp. 688, 145, net (Clarendon Press) FROWDE, Jan. 13",,,Justinian,FROWDE,,0.0,8vo.,"Justinian.-- Justiniani Institutionum Libri quat. tuor. With intro commentaries, and excursus, by J. B. Moyle. 8vo., pp. 688, 145, net (Clarendon Press) FROWDE, Jan. 13",,,,Jan. 13,
"Kali Krishna Lahiri-Roshinara : a historical romance from the Bengali, by (the late) Nobo Chandra Sen. Sm. 8vo., pp. 282, 28. net LUZAC, J une 13",,,"Kali Krishna Lahiri-Roshinara : a historical romance from the Bengali, by (the late) Nobo Chandra Sen",LUZAC,,0.0,8vo.,"Kali Krishna Lahiri-Roshinara : a historical romance from the Bengali, by (the late) Nobo Chandra Sen. Sm. 8vo., pp. 282, 28. net LUZAC, J une 13",,,,J une 13,
"Kant (Immanuel) - Macht des Gemüts. 18mo. 31 X2), Ithr., is. net (Langham booklets in German, 14).. ...SIEGLE, H., Sep. 13",Kant,Immanuel,Macht des Gemüts,"SIEGLE, H.",,0.0,18mo.,"Kant (Immanuel) - Macht des Gemüts. 18mo. 31 X2), Ithr., is. net (Langham booklets in German, 14).. ...SIEGLE, H., Sep. 13",Immanuel Kant,['Kant (Immanuel)'],,Sep. 13,
"Karr (Alphonse) Voyage autour de mon jardin. 12mo., pp. 480, is. net......NELSON, Sep. 13",Karr,Alphonse,Voyage autour de mon jardin,NELSON,,0.0,12mo.,"Karr (Alphonse) Voyage autour de mon jardin. 12mo., pp. 480, is. net......NELSON, Sep. 13",Alphonse Karr,['Karr (Alphonse)'],,Sep. 13,
"Kauffman (Reginald W.)—Daughters of 1shmael. 9th edit. Cr. 8vo. 71 X41, pp. 412, 2s. net 78*41: W. LAURIE , May 13",Kauffman,Reginald W.,Daughters of,W. LAURIE ,,0.0,8vo.,"Kauffman (Reginald W.)—Daughters of Ishmael. 9th edit. Cr. 8vo. 71 X41, pp. 412, 25. net 78*41: W. LAURIE , May 13",Reginald W. Kauffman,['Kauffman (Reginald W.)'],,May 13,
"Kavanagh (P. F.)-A Popular History of the Insurrection of 1798 derived from every available record and reliable tradition. New and rev. edit. Illus. Cr. 8vo. 7} X5, pp. 332, ..M. H. GILL, June 13",Kavanagh,P. F.,A Popular History of the Insurrection of,M. H. GILL,,0.0,8vo.,"Kavanagh (P. F.)-A Popular History of the Insurrection of 1798 derived from every available record and reliable tradition. New and rev. edit. Illus. Cr. 8vo. 7} X5, pp. 332, ..M. H. GILL, June 13",P. F. Kavanagh,['Kavanagh (P. F.)'],,June 13,
"Keed well (Hester Mary)—The New curate : story. 8vo. 7X41, pp. 46, is, net STOCKWELL, Jan. 13",Keed well,Hester Mary,The New curate : story,STOCKWELL,,0.0,8vo.,"Keed well (Hester Mary)—The New curate : story. 8vo. 7X41, pp. 46, is, net STOCKWELL, Jan. 13",Hester Mary Keed well,['Keed well (Hester Mary)'],,Jan. 13,
"Keesey (Walter M.)-Cambridge: sketch book. Svo, is, net . BLACK, Oct. 13",Keesey,Walter M.,Cambridge: sketch book,BLACK,,0.0,,"Keesey (Walter M.)-Cambridge: sketch book. Svo, is, net . BLACK, Oct. 13",Walter M. Keesey,['Keesey (Walter M.)'],,Oct. 13,
"Keighley (T.)-A Manual of music: for use in training colleges and secondary schools. Cr. 8vo., 1s. 6d., swd. s.....LONGMANS, Oct. 13",Keighley,T.,A Manual of music: for use in training colleges and secondary schools,LONGMANS,,0.0,8vo.,"Keighley (T.)-A Manual of music: for use in training colleges and secondary schools. Cr. 8vo., Is. 6d., swd. IS.....LONGMANS, Oct. 13",T. Keighley,['Keighley (T.)'],,Oct. 13,
"Kelland (Clarence B.)-Thirty pieces of silver. Cr. 8vo. 7 X 4), pp. 38, 23. net HARPER, Nov. 13",Kelland,Clarence B.,Thirty pieces of silver,HARPER,,0.0,8vo.,"Kelland (Clarence B.)-Thirty pieces of silver. Cr. 8vo. 7 X 4), pp. 38, 23. net HARPER, Nov. 13",Clarence B. Kelland,['Kelland (Clarence B.)'],,Nov. 13,
"Kellett (Ernest E.) The French revolution. Cr. 8vo. 7 X4), pp. 128, is, net. (Manuals for Christian thinkers, No. 4) ..W.C.O., July 13",Kellett,Ernest E.,The French revolution,W.C.O.,,0.0,8vo.,"Kellett (Ernest E.) The French revolution. Cr. 8vo. 7 X4), pp. 128, is, net. (Manuals for Christian thinkers, No. 4) ..W.C.O., July 13",Ernest E. Kellett,['Kellett (Ernest E.)'],,July 13,
"Kelly (William Patrick)-Schoolboys three : life at a Jesuit school. Cr. 8vo., pp. 324, swd., .ROUTLEDGE, Nov. 13",Kelly,William Patrick,Schoolboys three : life at a Jesuit school,ROUTLEDGE,,0.0,8vo.,"Kelly (William Patrick)-Schoolboys three : life at a Jesuit school. Cr. 8vo., pp. 324, swd., .ROUTLEDGE, Nov. 13",William Patrick Kelly,['Kelly (William Patrick)'],,Nov. 13,
"Kelly's Customs tariffs of the world, 1913. Imp. 8vo. Ios. ...... KELLY'S DIRECTORIES, Apr. 13",,,Kelly's Customs tariffs of the world,KELLY'S DIRECTORIES,,0.0,8vo.,"Kelly's Customs tariffs of the world, 1913. Imp. 8vo. Ios. ...... KELLY'S DIRECTORIES, Apr. 13",,,,Apr. 13,
"Kelly's Directory of Kent, Surrey and Sussex, 1913. Ryl. 8vo. 368....... KELLY, Aug, 13",,,"Kelly's Directory of Kent, Surrey and Sussex",KELLY,,0.0,8vo.,"Kelly's Directory of Kent, Surrey and Sussex, 1913. Ryl. 8vo. 368....... KELLY, Aug, 13",,,,"Aug, 13",
"Kelly's Directory of the engineers and iron and metal trades and colliery proprietors, 1913. Ryl. 8vo., 308. . . KELLY'S DIRECTORIES, A pr. 13",,,Kelly's Directory of the engineers and iron and metal trades and colliery proprietors,KELLY'S DIRECTORIES,,0.0,8vo.,"Kelly's Directory of the engineers and iron and metal trades and colliery proprietors, 1913. Ryl. 8vo., 308. . . KELLY'S DIRECTORIES, A pr. 13",,,,A pr. 13,
"Kelly's Directory of the watch and clock trades, 1913. Ryl. 8vo., 208. KELLY'S DIRECTORIES, Apr. 13",,,Kelly's Directory of the watch and clock trades,KELLY'S DIRECTORIES,,0.0,8vo.,"Kelly's Directory of the watch and clock trades, 1913. Ryl. 8vo., 208. KELLY'S DIRECTORIES, Apr. 13",,,,Apr. 13,
"Keltie (J. Scott) and Howarth (0. J. R.)-Iristory of geography. Cr. 8vo., pp. 164, is, net WATTS, Kelynack (T. N.) ed.--Youth, Cr. 8vo. 71 X5, pp. 160, is, 6d. net, limp, is. net (National health minuals) .C. H. KELLY, Nov. 13",Keltie,J. Scott,Iristory of geography,C. H. KELLY,,0.0,8vo.,"Keltie (J. Scott) and Howarth (0. J. R.)-Iristory of geography. Cr. 8vo., pp. 164, is, net WATTS, Kelynack (T. N.) ed.--Youth, Cr. 8vo. 71 X5, pp. 160, is, 6d. net, limp, is. net (National health minuals) .C. H. KELLY, Nov. 13",J. Scott Keltie,"['Keltie (J. Scott)', 'Howarth (0. J. R.)']",,Nov. 13,
