entry,last_name,first_name,title,publisher,price,format,original_entry,author_name,creators,is_editor,date,is_net
"New Patience (The). By Joker. 18mo. 61×4, .MCBRIDE NAST, Dec. '19",,,New Patience (The),MCBRIDE NAST,,18mo.,"New Patience (The). By Joker. 18mo. 61×4, .MCBRIDE NAST, Dec. '19",,,,Dec. '19,
"New Zealand Institute-Transactions and pro- ceedings, Vol. 50. Illus. Ryl. 8vo. 9×61, s. net .WESLEY, June '19",,,"New Zealand Institute-Transactions and pro- ceedings, Vol",WESLEY,,8vo.,"New Zealand Institute-Transactions and pro- ceedings, Vol. 50. Illus. Ryl. 8vo. 9×61, IS. net .WESLEY, June '19",,,,June '19,
"Newland (H. Osman)—The Planting, cultivation and expression of coconuts, kernels, cacao and edible vegetable oils and seeds of commerce. 8vo. 81×51, pp. 111, 6s. net. (Technological handbooks) ...GRIFFIN, Aug. '19",Newland,H. Osman,"The Planting, cultivation and expression of coconuts, kernels, cacao and edible vegetable oils and seeds of commerce",GRIFFIN,,8vo.,"Newland (H. Osman)—The Planting, cultivation and expression of coconuts, kernels, cacao and edible vegetable oils and seeds of commerce. 8vo. 81×51, pp. 111, 6s. net. (Technological handbooks) ...GRIFFIN, Aug. '19",H. Osman Newland,['Newland (H. Osman)'],,Aug. '19,
"Newton (A. P.)-An Introduction to the study of Colonial history. Cr. 8vo. 7× 41, pp. 46, swd. 6d. net. (Helps for students of history) S.P.C.K., May '19",Newton,A. P.,An Introduction to the study of Colonial history,S.P.C.K.,,8vo.,"Newton (A. P.)-An Introduction to the study of Colonial history. Cr. 8vo. 7× 41, pp. 46, swd. 6d. net. (Helps for students of history) S.P.C.K., May '19",A. P. Newton,['Newton (A. P.)'],,May '19,
"Newton (A.P.) ed.--The Sea Commonwealth and other papers. Cr. 8vo. 7X5, pp. 136, 3s.6d. net. (Imperial studies ser.)....DENT, May '19",Newton,A.P.,The Sea Commonwealth and other papers,DENT,,8vo.,"Newton (A.P.) ed.--The Sea Commonwealth and other papers. Cr. 8vo. 7X5, pp. 136, 3s.6d. net. (Imperial studies ser.)....DENT, May '19",A.P. Newton,['Newton (A.P.)'],ed.,May '19,
"Newton (Alexander)-The Socialist common- wealth and national reconstruction. 8vo. pp. 153 (Edinburgh) DARIEN PR., Apr. '19",Newton,Alexander,The Socialist common- wealth and national reconstruction,DARIEN PR.,,8vo.,"Newton (Alexander)-The Socialist common- wealth and national reconstruction. 8vo. pp. 153 (Edinburgh) DARIEN PR., Apr. '19",Alexander Newton,['Newton (Alexander)'],,Apr. '19,
"IS. ....... Nichols (Dudley)-Lays of stirring days. Cr. 8vo. pp. 35 (79, Golden Lane, E.C. 1) C. W. FAULKNER, Jan. '19",IS. ....... Nichols,Dudley,Lays of stirring days,C. W. FAULKNER,,8vo.,"IS. ....... Nichols (Dudley)-Lays of stirring days. Cr. 8vo. pp. 35 (79, Golden Lane, E.C. 1) C. W. FAULKNER, Jan. '19",Dudley IS. ....... Nichols,['IS. ....... Nichols (Dudley)'],,Jan. '19,
"Nichols (Robert)-Invocation and Peace Celebra- tion hymn for the British peoples. 9×7, pp. 10, HENDERSONS, Sep. '19",Nichols,Robert,Invocation and Peace Celebra- tion hymn for the British peoples,HENDERSONS,,,"Nichols (Robert)-Invocation and Peace Celebra- tion hymn for the British peoples. 9×7, pp. 10, HENDERSONS, Sep. '19",Robert Nichols,['Nichols (Robert)'],,Sep. '19,
"Norfolk recruiting: Great War, Rye (W.) Dec. '17 Norgate (Edward)-Miniatura; or, The Art of limning. Ed. fr. manuscript in Bodleian Lib. and collated by Martin Hardie. Cr. 8vo. 5s. net. (Tudor and Stuart lib.) (Clarendon Pr.) MILFORD, Aug. '19",,,"Norfolk recruiting: Great War, Rye (W.) Dec",MILFORD,,8vo.,"Norfolk recruiting: Great War, Rye (W.) Dec. '17 Norgate (Edward)-Miniatura; or, The Art of limning. Ed. fr. manuscript in Bodleian Lib. and collated by Martin Hardie. Cr. 8vo. 5s. net. (Tudor and Stuart lib.) (Clarendon Pr.) MILFORD, Aug. '19",,,,Aug. '19,
"Norris (J.) The School gardener. With preface by Henry Parsons. Cr. 8vo. 7×43, pp. 207, .CASSELL, July '19",Norris,J.,The School gardener,CASSELL,,8vo.,"Norris (J.) The School gardener. With preface by Henry Parsons. Cr. 8vo. 7×43, pp. 207, .CASSELL, July '19",J. Norris,['Norris (J.)'],,July '19,
"By auther of Vices 8vo. 7×5, pp. 107, ..LONGMANS, Dec. '19",,,By auther of Vices,LONGMANS,,8vo.,"By auther of Vices 8vo. 7×5, pp. 107, ..LONGMANS, Dec. '19",,,,Dec. '19,
"Noyes (George Rapall)-Tolstoy. Cr. 8vo. 7×51, pp. 395, 7s. 6d. net. (Master spirits of literature ser.) .MURRAY, Dec. '19",Noyes,George Rapall,Tolstoy,MURRAY,,8vo.,"Noyes (George Rapall)-Tolstoy. Cr. 8vo. 7×51, pp. 395, 7s. 6d. net. (Master spirits of literature ser.) .MURRAY, Dec. '19",George Rapall Noyes,['Noyes (George Rapall)'],,Dec. '19,
"O'Byrne (Dermot)-Wrack and other stories. 7×5, pp. 195, 3s. 6d. net ― of TALBOT PR.; UNWIN, Jan. '19",O'Byrne,Dermot,Wrack and other stories,UNWIN,,,"O'Byrne (Dermot)-Wrack and other stories. 7×5, pp. 195, 3s. 6d. net ― of TALBOT PR.; UNWIN, Jan. '19",Dermot O'Byrne,"[""O'Byrne (Dermot)""]",,Jan. '19,
"O'Cathain (S.) Explanatory grammar modern Irish. Demy 8vo., 8×51, pp. 78, s. net ..(Dublin) M. H. GILL, Oct. '19",O'Cathain,S.,Explanatory grammar modern Irish,M. H. GILL,,8vo.,"O'Cathain (S.) Explanatory grammar modern Irish. Demy 8vo., 8×51, pp. 78, IS. net ..(Dublin) M. H. GILL, Oct. '19",S. O'Cathain,"[""O'Cathain (S.)""]",,Oct. '19,
"Odyssey of a torpedoed Tramp (The). Cr. 8vo. 7×51, pp. 284, 6s. net By Y. CONSTABLE, Feb. '19",,,Odyssey of a torpedoed Tramp (The),Y. CONSTABLE,,8vo.,"Odyssey of a torpedoed Tramp (The). Cr. 8vo. 7×51, pp. 284, 6s. net By Y. CONSTABLE, Feb. '19",,,,Feb. '19,
"Oertling (Christine)-The Passing of the shadow. By Christine Oertling (aged 13). 7×5, pp. 176, 3s. 6d. net (Amersham, Bucks) MORLAND; FOYLE, Dec.' 19",Oertling,Christine,The Passing of the shadow,FOYLE,,,"Oertling (Christine)-The Passing of the shadow. By Christine Oertling (aged 13). 7×5, pp. 176, 3s. 6d. net (Amersham, Bucks) MORLAND; FOYLE, Dec.' 19",Christine Oertling,['Oertling (Christine)'],,Dec.' 19,
"O'Grady (Standish)-The Coming of Cuculain. Cr. 8vo. 7×5, pp. 191, 4s. 6d. net verses. TALBOT PR.; UNWIN, Aug. '19",O'Grady,Standish,The Coming of Cuculain,UNWIN,,8vo.,"O'Grady (Standish)-The Coming of Cuculain. Cr. 8vo. 7×5, pp. 191, 4s. 6d. net verses. TALBOT PR.; UNWIN, Aug. '19",Standish O'Grady,"[""O'Grady (Standish)""]",,Aug. '19,
"O'Grady (Standish)-The Triumph and passing of Cuculain. Cr. 8vo. 7× 5, pp. 156, 4s. 6d. net TALBOT PR.; UNWIN, Aug. '19",O'Grady,Standish,The Triumph and passing of Cuculain,UNWIN,,8vo.,"O'Grady (Standish)-The Triumph and passing of Cuculain. Cr. 8vo. 7× 5, pp. 156, 4s. 6d. net TALBOT PR.; UNWIN, Aug. '19",Standish O'Grady,"[""O'Grady (Standish)""]",,Aug. '19,
"O'Kelly (Seumas)-The Golden barque; and, The Weaver's grave. Cr. 8vo. 7×5, pp. 218, 3s. 6d. net.. (Talbot Pr.) T. F. UNWIN, Dec. '19",O'Kelly,Seumas,"The Golden barque; and, The Weaver's grave",T. F. UNWIN,,8vo.,"O'Kelly (Seumas)-The Golden barque; and, The Weaver's grave. Cr. 8vo. 7×5, pp. 218, 3s. 6d. net.. (Talbot Pr.) T. F. UNWIN, Dec. '19",Seumas O'Kelly,"[""O'Kelly (Seumas)""]",,Dec. '19,
"Ollard (S. L.)-Reunion. Cr. 8vo. 7×5, pp. 135, 3s. 6d. net. (Hdbks. of Catholic faith and practice.) .R. SCOTT, May '19",Ollard,S. L.,Reunion,R. SCOTT,,8vo.,"Ollard (S. L.)-Reunion. Cr. 8vo. 7×5, pp. 135, 3s. 6d. net. (Hdbks. of Catholic faith and practice.) .R. SCOTT, May '19",S. L. Ollard,['Ollard (S. L.)'],,May '19,
"Omar Khayyám-Rubáiyát in English and French. Trans. by Charles Grollean. 31×21, 1thr. 2s. net. (Bilingual ser.) L. B. HILL, Dec. '19",,,Omar Khayyám-Rubáiyát in English and French,L. B. HILL,,,"Omar Khayyám-Rubáiyát in English and French. Trans. by Charles Grollean. 31×21, 1thr. 2s. net. (Bilingual ser.) L. B. HILL, Dec. '19",,,,Dec. '19,
"Ordway (Edith B.)-Handbook of the operas. Rev. and enl. Cr. 8vo. 7×5, pp. 339, 69. net ...SIMPKIN, Nov. '19",Ordway,Edith B.,Handbook of the operas,SIMPKIN,,8vo.,"Ordway (Edith B.)-Handbook of the operas. Rev. and enl. Cr. 8vo. 7×5, pp. 339, 69. net ...SIMPKIN, Nov. '19",Edith B. Ordway,['Ordway (Edith B.)'],,Nov. '19,
"Ostrander (1sabel L.)--The 1sland of intrigue. Cr. 8vo., 7×5, pp. 319, 6s. 9d. net net SKEFFINGTON, Aug. '19",Ostrander,1sabel L.,The,SKEFFINGTON,,8vo.,"Ostrander (Isabel L.)--The Island of intrigue. Cr. 8vo., 7×5, pp. 319, 6s. 9d. net net SKEFFINGTON, Aug. '19",1sabel L. Ostrander,['Ostrander (1sabel L.)'],,Aug. '19,
"Our week of history: showing the imminence of the First Resurrection.' By F. W. H. 7 × 4, pp. 43, swd. 1s. net ...... (36, Beulah Hill, S.E.19) AUTHOR, Aug. '19",,,Our week of history: showing the imminence of the First Resurrection,AUTHOR,,,"Our week of history: showing the imminence of the First Resurrection.' By F. W. H. 7 × 4, pp. 43, swd. Is. net ...... (36, Beulah Hill, S.E.19) AUTHOR, Aug. '19",,,,Aug. '19,
"Owen (W. Powell-) see Powell-Owen. Owen (William D.)-Guide to the Study of the ionic valve: showing its development and application to wireless telegraphy and tele- phony. 18mo. 6×4, pp. 68, 2s. 6d. net Owl (The)-Nos. 1-2. net PITMAN, Oct. '19",Owen,W. Powell-,Guide to the Study of the ionic valve: showing its development and application to wireless telegraphy and tele- phony,PITMAN,,18mo.,"Owen (W. Powell-) see Powell-Owen. Owen (William D.)-Guide to the Study of the ionic valve: showing its development and application to wireless telegraphy and tele- phony. 18mo. 6×4, pp. 68, 2s. 6d. net Owl (The)-Nos. 1-2. net PITMAN, Oct. '19",W. Powell- Owen,"['Owen (W. Powell-)', 'Owen (William D.)']",,Oct. '19,
"Oxenham (Elsie Jeanette)-Expelled from school. By Victor Prout. Cr. 8vo. 7 × 5, pp. 319, .COLLINS, Dec. '19",Oxenham,Elsie Jeanette,Expelled from school,COLLINS,,8vo.,"Oxenham (Elsie Jeanette)-Expelled from school. By Victor Prout. Cr. 8vo. 7 × 5, pp. 319, .COLLINS, Dec. '19",Elsie Jeanette Oxenham,['Oxenham (Elsie Jeanette)'],,Dec. '19,
"Oxenham (John)-Victory day: an anticipation written in 1914. 8vo. swd. id. METHUEN, Jan. '19",Oxenham,John,Victory day: an anticipation written in,METHUEN,,8vo.,"Oxenham (John)-Victory day: an anticipation written in 1914. 8vo. swd. id. METHUEN, Jan. '19",John Oxenham,['Oxenham (John)'],,Jan. '19,
"Oxford and Cambridge Schools Examination Bd— Regulations for 1920. 8vo. pp. 78, swd. is. net. Report (forty-fifth) for year ending Oct. 31, 191. 8vo. pp. 48, swd. is. net (Clarendon Pr.) MILFORD; CAMB. U. PR., Jan.'19",,,Oxford and Cambridge Schools Examination Bd— Regulations for,CAMB. U. PR.,,8vo.,"Oxford and Cambridge Schools Examination Bd— Regulations for 1920. 8vo. pp. 78, swd. is. net. Report (forty-fifth) for year ending Oct. 31, 191. 8vo. pp. 48, swd. is. net (Clarendon Pr.) MILFORD; CAMB. U. PR., Jan.'19",,,,Jan.'19,
"Oxford Diocesan Calendar and clergy list, 1919. Sixty-second issue. Ed. by the Rev. H. J. Riddelsdell. Cr. 8vo. 7×5, pp. 212, swd. 2s. net........(Clarendon Pr.) MILFORD, Jan. '19",,,Oxford Diocesan Calendar and clergy list,MILFORD,,8vo.,"Oxford Diocesan Calendar and clergy list, 1919. Sixty-second issue. Ed. by the Rev. H. J. Riddelsdell. Cr. 8vo. 7×5, pp. 212, swd. 2s. net........(Clarendon Pr.) MILFORD, Jan. '19",,,,Jan. '19,
"Oxford (Diocese of)-Syllabus of religious instruc- tion. 5th issue. Ryl. 8vo. 91×61, pp. 3s. swd. is. net .PARKER, Mar. '19",Oxford,Diocese of,Syllabus of religious instruc- tion,PARKER,,8vo.,"Oxford (Diocese of)-Syllabus of religious instruc- tion. 5th issue. Ryl. 8vo. 91×61, pp. 35. swd. is. net .PARKER, Mar. '19",Diocese of Oxford,['Oxford (Diocese of)'],,Mar. '19,
"Oxford University-Local examinations. Division lists, March 1919, senior and junior. 8vo. ea. is. net..(Oxford) PARKER & SON, Apr. '19",,,Oxford University-Local examinations,PARKER & SON,,8vo.,"Oxford University-Local examinations. Division lists, March 1919, senior and junior. 8vo. ea. is. net..(Oxford) PARKER & SON, Apr. '19",,,,Apr. '19,
"Oxford University-Register of Convocation. Rev. to August 9, 1919. 8vo. swd. is. net (Oxford Univ. Pr.) MILFORD, Sep. '19",,,Oxford University-Register of Convocation,MILFORD,,8vo.,"Oxford University-Register of Convocation. Rev. to August 9, 1919. 8vo. swd. is. net (Oxford Univ. Pr.) MILFORD, Sep. '19",,,,Sep. '19,
"Page (C. Max)—A Medical field service handbook. Foreword by Major-General Sir George Makins. Fcp. 8vo. 4 × 61, pp. 173, 6s. net. (Oxford war primers) FROWDE AND HODDER & S., Feb. '19",Page,C. Max,A Medical field service handbook,FROWDE AND HODDER & S.,,8vo.,"Page (C. Max)—A Medical field service handbook. Foreword by Major-General Sir George Makins. Fcp. 8vo. 4 × 61, pp. 173, 65. net. (Oxford war primers) FROWDE AND HODDER & S., Feb. '19",C. Max Page,['Page (C. Max)'],,Feb. '19,
"Page (Victor W.)-Gasoline and kerosene car- burettors: construction, installation, adjust- ment. Cr. 8vo. 71× 54, pp. 206, 8s. 6d. net NORMAN W. HENLEY PUBG. Co.; LOCKWOOD, Mar. '19",Page,Victor W.,"Gasoline and kerosene car- burettors: construction, installation, adjust- ment",LOCKWOOD,,8vo.,"Page (Victor W.)-Gasoline and kerosene car- burettors: construction, installation, adjust- ment. Cr. 8vo. 71× 54, pp. 206, 8s. 6d. net NORMAN W. HENLEY PUBG. Co.; LOCKWOOD, Mar. '19",Victor W. Page,['Page (Victor W.)'],,Mar. '19,
"Page (W. T.)--Foreign birds for beginners. Cr. 8vo. swd. s. 30. net (Cage Birds) POULTRY PR., June '19",Page,W. T.,Foreign birds for beginners,POULTRY PR.,,8vo.,"Page (W. T.)--Foreign birds for beginners. Cr. 8vo. swd. IS. 30. net (Cage Birds) POULTRY PR., June '19",W. T. Page,['Page (W. T.)'],,June '19,
"Victor Horsley: a study Ryl. 8vo. 9×51, pp. 369, .CONSTABLE, Nov. '19",,,Victor Horsley: a study,CONSTABLE,,8vo.,"Victor Horsley: a study Ryl. 8vo. 9×51, pp. 369, .CONSTABLE, Nov. '19",,,,Nov. '19,
"Pain (Barry)-The Problem Club. Illus. by Arthur Garratt. Cr. 8vo. 7×51, pp. 235, ..COLLINS, July 19",Pain,Barry,The Problem Club,COLLINS,,8vo.,"Pain (Barry)-The Problem Club. Illus. by Arthur Garratt. Cr. 8vo. 7×51, pp. 235, ..COLLINS, July 19",Barry Pain,['Pain (Barry)'],,July 19,
"F. H. MORLAND, Feb. '19",,,,F. H. MORLAND,,,"F. H. MORLAND, Feb. '19",,,,Feb. '19,
"Palestine, Mesopotamia and the Jews, Sir) 5s. net Wingate (A., Mar. '19",,,"Palestine, Mesopotamia and the Jews, Sir)",A.,,,"Palestine, Mesopotamia and the Jews, Sir) 5s. net Wingate (A., Mar. '19",,,,Mar. '19,
"Cr. 8vo. HUMPHREYS, Dec. '19",,,,HUMPHREYS,,8vo.,"Cr. 8vo. HUMPHREYS, Dec. '19",,,,Dec. '19,
"Parker (B. and N.)-The Browns: a book of bears. Verses by B.P.; illus. by N.P. Folio. 12×81, pp. 56, 3s. 6d. nèt CHAMBERS, Dec. '19",Parker,B.,The Browns: a book of bears,CHAMBERS,,,"Parker (B. and N.)-The Browns: a book of bears. Verses by B.P.; illus. by N.P. Folio. 12×81, pp. 56, 3s. 6d. nèt CHAMBERS, Dec. '19",B. Parker,"['Parker (B.)', 'Parker (N.)']",,Dec. '19,
"Parker (G. H.)-The Elementary nervous system. Illus. 8vo. 8 x 51, pp. 229, 10s. 6d. net. (Mono- graphs on exper. biology.) LIPPINCOTT, May '19",Parker,G. H.,The Elementary nervous system,LIPPINCOTT,,8vo.,"Parker (G. H.)-The Elementary nervous system. Illus. 8vo. 8 x 51, pp. 229, 10s. 6d. net. (Mono- graphs on exper. biology.) LIPPINCOTT, May '19",G. H. Parker,['Parker (G. H.)'],,May '19,
"Parliament House of Lords-Journals. Session 1918, Vol. 150. IOS. net H.M. STATIONERY OFF., July '19",,,Parliament House of Lords-Journals,H.M. STATIONERY OFF.,,,"Parliament House of Lords-Journals. Session 1918, Vol. 150. IOS. net H.M. STATIONERY OFF., July '19",,,,July '19,
"Parliament: House of Lords-Report from Select Ctte. upon proposals for improvement in procedure. id. Parliament H.M. STATIONERY OFF., Apr. '19",,,Parliament: House of Lords-Report from Select Ctte,H.M. STATIONERY OFF.,,,"Parliament: House of Lords-Report from Select Ctte. upon proposals for improvement in procedure. id. Parliament H.M. STATIONERY OFF., Apr. '19",,,,Apr. '19,
"Parliament-Opposed Private Bill Committees in Session 1918: report from the Ctte. of Selection, id...H.M. STATIONERY OFF., Feb. '19",,,Parliament-Opposed Private Bill Committees in Session,H.M. STATIONERY OFF.,,,"Parliament-Opposed Private Bill Committees in Session 1918: report from the Ctte. of Selection, id...H.M. STATIONERY OFF., Feb. '19",,,,Feb. '19,
"Partridge (Frank, Rev.)-The Soul of wealth: the opportunity of the Church of England. Foreword by the Rt. Hon. Earl Brassey. Cr. 8vo. 74×4, pp. 120, swd. is. net MURRAY, May '19",Partridge,"Frank, Rev.",The Soul of wealth: the opportunity of the Church of England,MURRAY,,8vo.,"Partridge (Frank, Rev.)-The Soul of wealth: the opportunity of the Church of England. Foreword by the Rt. Hon. Earl Brassey. Cr. 8vo. 74×4, pp. 120, swd. is. net MURRAY, May '19","Frank, Rev. Partridge","['Partridge (Frank, Rev.)']",,May '19,
"Pascal (Blaise)– ...... -Thoughts. Selected and trans. by Moritz Kaufmann. 18mo. swd. 1s. net. (Camb. devotional ser.) CAMB. UNIV. PR., Dec. '19",Pascal,Blaise,Thoughts,CAMB. UNIV. PR.,,18mo.,"Pascal (Blaise)– ...... -Thoughts. Selected and trans. by Moritz Kaufmann. 18mo. swd. Is. net. (Camb. devotional ser.) CAMB. UNIV. PR., Dec. '19",Blaise Pascal,['Pascal (Blaise)'],,Dec. '19,
"Passing of trains (The): a social reveille. 6 ×31, pp. 7, swd. rod. (22, Ainger Rd., N.W. 3) F. ALBINO, Feb. '19",,,Passing of trains (The): a social reveille,F. ALBINO,,,"Passing of trains (The): a social reveille. 6 ×31, pp. 7, swd. rod. (22, Ainger Rd., N.W. 3) F. ALBINO, Feb. '19",,,,Feb. '19,
"Paul (Robert B.)-Shipping simplified. 8vo. 8x4, pp. 32, swd. 2s. net LIVERPOOL BOOKSELLERS Co.; SIMPKIN, Jan. '19",Paul,Robert B.,Shipping simplified,SIMPKIN,,8vo.,"Paul (Robert B.)-Shipping simplified. 8vo. 8x4, pp. 32, swd. 2s. net LIVERPOOL BOOKSELLERS Co.; SIMPKIN, Jan. '19",Robert B. Paul,['Paul (Robert B.)'],,Jan. '19,
"Pearse (P. H.)-Poems. Cr. 8vo. 7×5, pp. 342, .MAUNSEL, June '19",Pearse,P. H.,Poems,MAUNSEL,,8vo.,"Pearse (P. H.)-Poems. Cr. 8vo. 7×5, pp. 342, .MAUNSEL, June '19",P. H. Pearse,['Pearse (P. H.)'],,June '19,
"Pearse (Padraic)-Works and plays (in Gaelic). 8vo., Ios. net..MAUNSEL; ALLEN & U., Oct. '19",,,,ALLEN & U.,,,"Pearse (Padraic)-Works and plays (in Gaelic). 8vo., Ios. net..MAUNSEL; ALLEN & U., Oct. '19",,"['Pearse (Padraic)-Works', 'plays (in Gaelic)']",,Oct. '19,
"Pearson (Karl)-A Study of the long bones of the English skeleton. Ryl. 4to. 30s. net. Atlas and text. 59 plates. (Biometric ser.) CAMB. UNIV. PR., Oct. '19",Pearson,Karl,A Study of the long bones of the English skeleton,CAMB. UNIV. PR.,,4to.,"Pearson (Karl)-A Study of the long bones of the English skeleton. Ryl. 4to. 30s. net. Atlas and text. 59 plates. (Biometric ser.) CAMB. UNIV. PR., Oct. '19",Karl Pearson,['Pearson (Karl)'],,Oct. '19,
"Pearson (Karl)-Tables of the Digamma and Trigamma functions. Med. 8vo. pp. 20, 3s. net. (Tracts for computers) CAMB. UNIV. PR., Oct. '19",Pearson,Karl,Tables of the Digamma and Trigamma functions,CAMB. UNIV. PR.,,8vo.,"Pearson (Karl)-Tables of the Digamma and Trigamma functions. Med. 8vo. pp. 20, 3s. net. (Tracts for computers) CAMB. UNIV. PR., Oct. '19",Karl Pearson,['Pearson (Karl)'],,Oct. '19,
"Peat's Farmer's diary and account book, Jan. 1 to Dec. 31: a complete and easy method of keeping farm accounts. 8vo. 9×7, pp. 104, SIMPKIN, Jan. '19",,,"Peat's Farmer's diary and account book, Jan",SIMPKIN,,8vo.,"Peat's Farmer's diary and account book, Jan. 1 to Dec. 31: a complete and easy method of keeping farm accounts. 8vo. 9×7, pp. 104, SIMPKIN, Jan. '19",,,,Jan. '19,
"Penniman (Josiah H.)-A Book about the English Bible. 8vo. 8×51, pp. 453, Ios. net MACMILLAN, Nov. '19",Penniman,Josiah H.,A Book about the English Bible,MACMILLAN,,8vo.,"Penniman (Josiah H.)-A Book about the English Bible. 8vo. 8×51, pp. 453, Ios. net MACMILLAN, Nov. '19",Josiah H. Penniman,['Penniman (Josiah H.)'],,Nov. '19,
"Pensions (Ministry of)-Malaria patients, Sug- gestions for the Care of: for the information of Medical practitioners, id. H.M. STATIONERY OFF., May '19",Pensions,Ministry of,,H.M. STATIONERY OFF.,,,"Pensions (Ministry of)-Malaria patients, Sug- gestions for the Care of: for the information of Medical practitioners, id. H.M. STATIONERY OFF., May '19",Ministry of Pensions,['Pensions (Ministry of)'],,May '19,
"Perera (H. S.) and Jones (Daniel)-Colloquial Sinhalise reader. Cr. 8vo. 4s. 6d. net. (Man- chester Pr.pubns.) ..LONGMANS, Aug.'19",Perera,H. S.,Colloquial Sinhalise reader,LONGMANS,,8vo.,"Perera (H. S.) and Jones (Daniel)-Colloquial Sinhalise reader. Cr. 8vo. 4s. 6d. net. (Man- chester Pr.pubns.) ..LONGMANS, Aug.'19",H. S. Perera,"['Perera (H. S.)', 'Jones (Daniel)']",,Aug.'19,
"Perkins (E. Benson)-The Problem of gambling: including the law relating to gambling by F. G. Neave. Cr. 8vo. 7×5, pp. 114, swd. 2s. net. (Welfare ser.) EPWORTH PR., June '19",Perkins,E. Benson,The Problem of gambling: including the law relating to gambling by F. G. Neave,EPWORTH PR.,,8vo.,"Perkins (E. Benson)-The Problem of gambling: including the law relating to gambling by F. G. Neave. Cr. 8vo. 7×5, pp. 114, swd. 2s. net. (Welfare ser.) EPWORTH PR., June '19",E. Benson Perkins,['Perkins (E. Benson)'],,June '19,
"Perry (J., Prof.)-Spinning tops: the romance of science. Rev. ed. Cr. 8vo, 71 x 4, pp. 155, 4s. 6d. net Perry (Ralph Barton)-The ....... ..S.P.C.K., Dec. '19",Perry,"J., Prof.",Spinning tops: the romance of science,S.P.C.K.,,"8vo,","Perry (J., Prof.)-Spinning tops: the romance of science. Rev. ed. Cr. 8vo, 71 x 4, pp. 155, 4s. 6d. net Perry (Ralph Barton)-The ....... ..S.P.C.K., Dec. '19","J., Prof. Perry","['Perry (J., Prof.)']",,Dec. '19,
"Peterborough Diocesan calendar, clergy list and almanack, 1919. Cr.8vo. 7×5, pp. 385, 2s. net S. BARKER & Co.; SIMPKIN, Mar. '19",,,"Peterborough Diocesan calendar, clergy list and almanack",SIMPKIN,,8vo.,"Peterborough Diocesan calendar, clergy list and almanack, 1919. Cr.8vo. 7×5, pp. 385, 2s. net S. BARKER & Co.; SIMPKIN, Mar. '19",,,,Mar. '19,
"Petersen (Willliam)-The Kiel Canal problem. 9×71, pp. 14, Peter's mother, De la Pasture (Mrs. H.) (80, Portland Pl., W. 1) AUTHOR, Apr. '19",Petersen,Willliam,The Kiel Canal problem,AUTHOR,,,"Petersen (Willliam)-The Kiel Canal problem. 9×71, pp. 14, Peter's mother, De la Pasture (Mrs. H.) (80, Portland Pl., W. 1) AUTHOR, Apr. '19",Willliam Petersen,['Petersen (Willliam)'],,Apr. '19,
"Petitions and thanksgivings for war time and after. (For insertion in prayers.) By Pecten Jacobæa. 3rd ed., rev. and enl. 71× 5, pp. 87, 1s... ·CLARKE, Jan. '19",,,Petitions and thanksgivings for war time and after,CLARKE,,,"Petitions and thanksgivings for war time and after. (For insertion in prayers.) By Pecten Jacobæa. 3rd ed., rev. and enl. 71× 5, pp. 87, Is... ·CLARKE, Jan. '19",,,,Jan. '19,
"Petre (M. D.) see also Walker (J.) and Petre. Petrides (P. J.)-Greek folklore and Greek music. 10 X 7, pp. 42 (138, Portsdown Rd., W. 9) GREEK BUR. OF FOREIGN INF., July '19",Petre,M. D.,Greek folklore and Greek music,GREEK BUR. OF FOREIGN INF.,,,"Petre (M. D.) see also Walker (J.) and Petre. Petrides (P. J.)-Greek folklore and Greek music. 10 X 7, pp. 42 (138, Portsdown Rd., W. 9) GREEK BUR. OF FOREIGN INF., July '19",M. D. Petre,"['Petre (M. D.)', 'Petrides (P. J.)']",,July '19,
"Petrol age (The) painting book. Ryl. 8vo. 9×71, 1s. net. (Shakespeare ser.) ALLDAY, Sep. '19",,,Petrol age (The) painting book,ALLDAY,,8vo.,"Petrol age (The) painting book. Ryl. 8vo. 9×71, Is. net. (Shakespeare ser.) ALLDAY, Sep. '19",,,,Sep. '19,
"Philippine Journal of Science (The). Vol. 14, No. 1, 1919. (1ssued by the Bureau of Science of the Government of the Philippine 1slands.) Illus. Ryl. 8vo. 10×7), annual subs. 22s. 6d. net net Philip's Atlas of modern George Philip. Folio. 3s. 6d.; swd. 1s. 9d,; 1s. 6d. net Philip's Favourite atlas: 40, WESLEY, Oct. '19",,,Philippine Journal of Science (The),WESLEY,,8vo.,"Philippine Journal of Science (The). Vol. 14, No. 1, 1919. (Issued by the Bureau of Science of the Government of the Philippine Islands.) Illus. Ryl. 8vo. 10×7), annual subs. 22s. 6d. net net Philip's Atlas of modern George Philip. Folio. 3s. 6d.; swd. Is. 9d,; Is. 6d. net Philip's Favourite atlas: 40, WESLEY, Oct. '19",,,,Oct. '19,
"Phillimore (J. S.)-The Revival of criticism: a Paper read at the meeting of the Classical Association at Oxford, May. 9×51, pp. 32, swd. 1s. 6d. net . (Oxford) BLACKWELL, Dec. '19",Phillimore,J. S.,"The Revival of criticism: a Paper read at the meeting of the Classical Association at Oxford, May",BLACKWELL,,,"Phillimore (J. S.)-The Revival of criticism: a Paper read at the meeting of the Classical Association at Oxford, May. 9×51, pp. 32, swd. Is. 6d. net . (Oxford) BLACKWELL, Dec. '19",J. S. Phillimore,['Phillimore (J. S.)'],,Dec. '19,
"Plm (Herbert Moore)-Unconquerable Ulster Forew. by Sir E. Carson. 6X4, pp. 98, 1s. 3d. net....(Belfast) R. CARSWELL & SON, Nov. '19",Plm,Herbert Moore,Unconquerable Ulster Forew,R. CARSWELL & SON,,,"Plm (Herbert Moore)-Unconquerable Ulster Forew. by Sir E. Carson. 6X4, pp. 98, Is. 3d. net....(Belfast) R. CARSWELL & SON, Nov. '19",Herbert Moore Plm,['Plm (Herbert Moore)'],,Nov. '19,
"PIRIE-GORDON Pirie-Gordon (H., Lt.-Col.) ed.—A Brief record of the advance of the Egyptian Expeditionary Force, under the command of General Sir Edmund H. H. Allenby, July, 1917, to Oct., 1918. Compiled from official sources. 51 maps, 111×9 PALESTINE NEWS, May '19",PIRIE-GORDON Pirie-Gordon,"H., Lt.-Col.","A Brief record of the advance of the Egyptian Expeditionary Force, under the command of General Sir Edmund H. H. Allenby, July",PALESTINE NEWS,,,"PIRIE-GORDON Pirie-Gordon (H., Lt.-Col.) ed.—A Brief record of the advance of the Egyptian Expeditionary Force, under the command of General Sir Edmund H. H. Allenby, July, 1917, to Oct., 1918. Compiled from official sources. 51 maps, 111×9 PALESTINE NEWS, May '19","H., Lt.-Col. PIRIE-GORDON Pirie-Gordon","['PIRIE-GORDON Pirie-Gordon (H., Lt.-Col.)']",ed.,May '19,
