entry,last_name,first_name,title,publisher,price,format,original_entry,author_name,creators,is_editor,date,catalogue_year,is_net
"Reiset (Vicomte de)-Marie-Caroline, Duchesse de Berry, 1816-1820. Roy. 4to. 13 x 10, pp. 242 and plates, 80s. net; edit. on Japanese paper, 2008. net ......GOUPIL, Nov. 05",Reiset,Vicomte de,"Marie-Caroline, Duchesse de Berry",GOUPIL,,4to.,"Reiset (Vicomte de)-Marie-Caroline, Duchesse de Berry, 1816-1820. Roy. 4to. 13 x 10, pp. 242 and plates, 80s. net; edit. on Japanese paper, 2008. net ......GOUPIL, Nov. 05",Vicomte de Reiset,['Reiset (Vicomte de)'],,Nov. 05,1905,
"Reisner (G. A.)-Hearst Medical Papyrus. Hieratic Text in 17 facsimile plates in collotype, with Introduction and Vocabulary. 4to. (vii., 48 Seiten u. 17 Tafeln. M. 2s. [University of California Publications, Egyptian Archæology, Vol. 1.] …………………………………………….(Leipzig) HINRICHS, Dec. 05",Reisner,G. A.,Hearst Medical Papyrus,HINRICHS,,4to.,"Reisner (G. A.)-Hearst Medical Papyrus. Hieratic Text in 17 facsimile plates in collotype, with Introduction and Vocabulary. 4to. (vii., 48 Seiten u. 17 Tafeln. M. 25. [University of California Publications, Egyptian Archæology, Vol. 1.] …………………………………………….(Leipzig) HINRICHS, Dec. 05",G. A. Reisner,['Reisner (G. A.)'],,Dec. 05,1905,
"Relief Work for Unemployed, London (No. 193), 14d. London Unemployed Fund, Preliminary Statement, 5d. •WYMAN, June 05",,,"Relief Work for Unemployed, London ",WYMAN,,,"Relief Work for Unemployed, London (No. 193), 14d. London Unemployed Fund, Preliminary Statement, 5d. •WYMAN, June 05",,,,June 05,1905,
"Renouf (P. Le Page, Sir)-Life Work. First Series. Egyptological and Philological Essays. Vol. 2. By Edouard Naville and W. Harry Rylands. Roy. 8vo. 10 × 64, pp. 464, 258. net SIMPKIN, June 05",Renouf,"P. Le Page, Sir",Life Work,SIMPKIN,,8vo.,"Renouf (P. Le Page, Sir)-Life Work. First Series. Egyptological and Philological Essays. Vol. 2. By Edouard Naville and W. Harry Rylands. Roy. 8vo. 10 × 64, pp. 464, 258. net SIMPKIN, June 05","P. Le Page, Sir Renouf","['Renouf (P. Le Page, Sir)']",,June 05,1905,
"Report of Commissioners, Woods, Forests and Land Revenues, 2s.; H.M. Customs, 4 d. WYMAN, Oct. 05",,,"Report of Commissioners, Woods, Forests and Land Revenues",WYMAN,,,"Report of Commissioners, Woods, Forests and Land Revenues, 2s.; H.M. Customs, 4 d. WYMAN, Oct. 05",,,,Oct. 05,1905,
"Report of Committee on Leather for Bookbinding. Edit. for Society of Arts and Worshipful Com- pany of Leathersellers, by Viscount Cobham and Sir Henry Trueman Wood. 4to. 10 × 7, pp. 130, 10s. 6d. net ………………………..BELL, Nov. 05",,,Report of Committee on Leather for Bookbinding,BELL,,4to.,"Report of Committee on Leather for Bookbinding. Edit. for Society of Arts and Worshipful Com- pany of Leathersellers, by Viscount Cobham and Sir Henry Trueman Wood. 4to. 10 × 7, pp. 130, 10s. 6d. net ………………………..BELL, Nov. 05",,,,Nov. 05,1905,
"Return of Market Prices. 1d. Return of Number of Questions put to Ministers from 1893 to 1904. d.............ŴYMAN, June 05",,,Return of Market Prices,ŴYMAN,,,"Return of Market Prices. 1d. Return of Number of Questions put to Ministers from 1893 to 1904. d.............ŴYMAN, June 05",,,,June 05,1905,
"Revenue (Collection of Taxes) Return. d. WYMAN, Apr. 05",Revenue,Collection of Taxes,Return,WYMAN,,,"Revenue (Collection of Taxes) Return. d. WYMAN, Apr. 05",Collection of Taxes Revenue,['Revenue (Collection of Taxes)'],,Apr. 05,1905,
"Review of Reviews (The). Vol. 31. January- June 190s. 4to. 5s. …………..OFFICE, July 05",,,Review of Reviews (The),OFFICE,,4to.,"Review of Reviews (The). Vol. 31. January- June 1905. 4to. 5s. …………..OFFICE, July 05",,,,July 05,1905,
"Reynolds (Fred, Mrs.)-A Quaker Wooing. Cr. 8vo. 74 × 43, pp. 314, 68.......HUTCHINSON, Sep. 05",Reynolds,"Fred, Mrs.",A Quaker Wooing,HUTCHINSON,,8vo.,"Reynolds (Fred, Mrs.)-A Quaker Wooing. Cr. 8vo. 74 × 43, pp. 314, 68.......HUTCHINSON, Sep. 05","Fred, Mrs. Reynolds","['Reynolds (Fred, Mrs.)']",,Sep. 05,1905,
"Reynolds (J. B.)-Europe and the Mediterranean Region. Maps, illus., tables. 8vo. pp. 128, 28. (Regional Geography).........BLACK, June 05",Reynolds,J. B.,Europe and the Mediterranean Region,BLACK,,8vo.,"Reynolds (J. B.)-Europe and the Mediterranean Region. Maps, illus., tables. 8vo. pp. 128, 28. (Regional Geography).........BLACK, June 05",J. B. Reynolds,['Reynolds (J. B.)'],,June 05,1905,
"Reynolds (J., Sir)-Discourses delivered to the Students of the Royal Academy. Intro. and Notes by Roger Fry. Cr. 8vo. 8 x 5, pp. 478, ..SEELEY, Nov. 05",Reynolds,"J., Sir",Discourses delivered to the Students of the Royal Academy,SEELEY,,8vo.,"Reynolds (J., Sir)-Discourses delivered to the Students of the Royal Academy. Intro. and Notes by Roger Fry. Cr. 8vo. 8 x 5, pp. 478, ..SEELEY, Nov. 05","J., Sir Reynolds","['Reynolds (J., Sir)']",,Nov. 05,1905,
"Rhodes (J. F.)-Story of the United States from the Compromise of 1850. Vol. 5. 1864-1866. MACMILLAN, Jan. 05",Rhodes,J. F.,Story of the United States from the Compromise of,MACMILLAN,,,"Rhodes (J. F.)-Story of the United States from the Compromise of 1850. Vol. 5. 1864-1866. MACMILLAN, Jan. 05",J. F. Rhodes,['Rhodes (J. F.)'],,Jan. 05,1905,
"Rhys (E.)-Lays of the Round Table; other Lyric Romances. Cr. 8vo. 7×5, pp. 104, 8s. 6d. net......... …………………………………..DENT, Dec. 05",Rhys,E.,Lays of the Round Table; other Lyric Romances,DENT,,8vo.,"Rhys (E.)-Lays of the Round Table; other Lyric Romances. Cr. 8vo. 7×5, pp. 104, 8s. 6d. net......... …………………………………..DENT, Dec. 05",E. Rhys,['Rhys (E.)'],,Dec. 05,1905,
"Rhys (Grace)-Diverted Village: Holiday Book. Ch. edit. cr. 8vo. 74 × 5, pp. 246, 1s. net land and Bavaria. METHUEN, Apr. 05",Rhys,Grace,Diverted Village: Holiday Book,METHUEN,,8vo.,"Rhys (Grace)-Diverted Village: Holiday Book. Ch. edit. cr. 8vo. 74 × 5, pp. 246, 1s. net land and Bavaria. METHUEN, Apr. 05",Grace Rhys,['Rhys (Grace)'],,Apr. 05,1905,
"Morland, Painter, edit. 8vo. 8 × 5, ..E. STOCK, Jan. 05",,,"Morland, Painter, edit",E. STOCK,,8vo.,"Morland, Painter, edit. 8vo. 8 × 5, ..E. STOCK, Jan. 05",,,,Jan. 05,1905,
"Richmond (H. Droop)-Laboratory Book of Dairy Analysis. Illus. Cr. 8vo. limp, pp. 104, 2s. 6d. ………………….GRIFFIN, Nov. 05",Richmond,H. Droop,Laboratory Book of Dairy Analysis,GRIFFIN,,8vo.,"Richmond (H. Droop)-Laboratory Book of Dairy Analysis. Illus. Cr. 8vo. limp, pp. 104, 2s. 6d. ………………….GRIFFIN, Nov. 05",H. Droop Richmond,['Richmond (H. Droop)'],,Nov. 05,1905,
"Ringwalt (R. C.)-Briefs on Public Questions. With Selected Lists of References. Cr. 8vo. 5s. net ……………………..LONGMANS, June 05",Ringwalt,R. C.,Briefs on Public Questions,LONGMANS,,8vo.,"Ringwalt (R. C.)-Briefs on Public Questions. With Selected Lists of References. Cr. 8vo. 5s. net ……………………..LONGMANS, June 05",R. C. Ringwalt,['Ringwalt (R. C.)'],,June 05,1905,
"Rita-Faustine. Cr. 8vo. swd. 6d. Rita-Fragoletta. Cr. 8vo. Rita-Lie Circumspect. Rita Prince Charming. R. E. KING, July 05",,,Rita-Faustine,R. E. KING,,8vo.,"Rita-Faustine. Cr. 8vo. swd. 6d. Rita-Fragoletta. Cr. 8vo. Rita-Lie Circumspect. Rita Prince Charming. R. E. KING, July 05",,,,July 05,1905,
"Judas. Novel. Cr. 8vo. ......HUTCHINSON, Apr. 05",,,Judas,HUTCHINSON,,8vo.,"Judas. Novel. Cr. 8vo. ......HUTCHINSON, Apr. 05",,,,Apr. 05,1905,
"Rita-Vanity! Confessions of a Court Modiste. 12mo. swd. 1s. ……………………..NASH, July 05",,,Rita-Vanity! Confessions of a Court Modiste,NASH,,12mo.,"Rita-Vanity! Confessions of a Court Modiste. 12mo. swd. 1s. ……………………..NASH, July 05",,,,July 05,1905,
"Ritchie (D. G.)-Philosophical Studies. Ed., with memoir, by Robert Latta. 8vo. 9 × 54, pp. 366, 10s. net ..………………………………… .MACMILLAN, June 05",Ritchie,D. G.,Philosophical Studies,MACMILLAN,,8vo.,"Ritchie (D. G.)-Philosophical Studies. Ed., with memoir, by Robert Latta. 8vo. 9 × 54, pp. 366, 10s. net ..………………………………… .MACMILLAN, June 05",D. G. Ritchie,['Ritchie (D. G.)'],,June 05,1905,
"Roberton (Margaret H.)-A Gallant Quaker. New and cheaper issue. Cr. 8vo. 74 × 5, pp. 304, .METHUEN, Aug. 05",Roberton,Margaret H.,A Gallant Quaker,METHUEN,,8vo.,"Roberton (Margaret H.)-A Gallant Quaker. New and cheaper issue. Cr. 8vo. 74 × 5, pp. 304, .METHUEN, Aug. 05",Margaret H. Roberton,['Roberton (Margaret H.)'],,Aug. 05,1905,
"Roberts (C.)-Billiards for Everybody. Illus. New edit. Cr. 8vo. pp. 140, 18. ROUTLEDGE, Nov. 05",Roberts,C.,Billiards for Everybody,ROUTLEDGE,,8vo.,"Roberts (C.)-Billiards for Everybody. Illus. New edit. Cr. 8vo. pp. 140, 18. ROUTLEDGE, Nov. 05",C. Roberts,['Roberts (C.)'],,Nov. 05,1905,
"Roberts (M.)-Keeper of the Waters. 8vo. swd. 6d. Roberts (M.)-Lady Penelope. Extravaganza. PEARSON, Apr. 05",Roberts,M.,Keeper of the Waters,PEARSON,,8vo.,"Roberts (M.)-Keeper of the Waters. 8vo. swd. 6d. Roberts (M.)-Lady Penelope. Extravaganza. PEARSON, Apr. 05",M. Roberts,['Roberts (M.)'],,Apr. 05,1905,
"Roberts (M.)-Promotion of the Admiral. Ch. edit. 12mo. 64 × 4§, pp. 250, swd. 1s. Roberts (M.)-The 1dlers. NASH, Mar. 05",Roberts,M.,Promotion of the Admiral,NASH,,12mo.,"Roberts (M.)-Promotion of the Admiral. Ch. edit. 12mo. 64 × 4§, pp. 250, swd. 1s. Roberts (M.)-The Idlers. NASH, Mar. 05",M. Roberts,['Roberts (M.)'],,Mar. 05,1905,
"Cr. 8vo. Roberts (M.)-Tramp's Note Book. 8vo. swd. 6d. Roberts (M. K.)-John Milton. Appreciative F. V. WHITE, Nov. 05",Cr. 8vo. Roberts,M.,Tramp's Note Book,F. V. WHITE,,8vo.,"Cr. 8vo. Roberts (M.)-Tramp's Note Book. 8vo. swd. 6d. Roberts (M. K.)-John Milton. Appreciative F. V. WHITE, Nov. 05",M. Cr. 8vo. Roberts,['Cr. 8vo. Roberts (M.)'],,Nov. 05,1905,
"Robertson (A.)-Venetian Sermons, Drawn from the History, Art, and Customs of Venice. Illus. Extra cr. 8vo. 8 × 5, pp. 824, 10s. 6d. net Robertson (C. G.), Bartholomew (J. G.)—His- G. ALLEN, Nov. 05",Robertson,A.,"Venetian Sermons, Drawn from the History, Art, and Customs of Venice",G. ALLEN,,8vo.,"Robertson (A.)-Venetian Sermons, Drawn from the History, Art, and Customs of Venice. Illus. Extra cr. 8vo. 8 × 5, pp. 824, 10s. 6d. net Robertson (C. G.), Bartholomew (J. G.)—His- G. ALLEN, Nov. 05",A. Robertson,['Robertson (A.)'],,Nov. 05,1905,
"Trinity Chapel, Brighton. 8vo. swd. 6d. Robertson (F. W.)-Loneliness of Christ. 12mo. ALLENSON, Mar. 05",,,"Trinity Chapel, Brighton",ALLENSON,,8vo.,"Trinity Chapel, Brighton. 8vo. swd. 6d. Robertson (F. W.)-Loneliness of Christ. 12mo. ALLENSON, Mar. 05",,,,Mar. 05,1905,
"Robertson (W. Bell)-Foundations of Political Economy. 8vo. 8 × 5, pp. 264, 5s. Robertson (Wm. Bell) Political Economy, selec- W. SCOTT, Nov. 05",Robertson,W. Bell,Foundations of Political Economy,W. SCOTT,,8vo.,"Robertson (W. Bell)-Foundations of Political Economy. 8vo. 8 × 5, pp. 264, 5s. Robertson (Wm. Bell) Political Economy, selec- W. SCOTT, Nov. 05",W. Bell Robertson,['Robertson (W. Bell)'],,Nov. 05,1905,
"Cr. 8vo. Robinson (C. H.)-Studies in Character of Christ. Rev. edit. Cr. 8vo. 8 x 54, pp. 172, 38. 6d. net Robinson (C. M.)-Modern Civic Art; or, City LONGMANS, Nov. 05",Cr. 8vo. Robinson,C. H.,Studies in Character of Christ,LONGMANS,,8vo.,"Cr. 8vo. Robinson (C. H.)-Studies in Character of Christ. Rev. edit. Cr. 8vo. 8 x 54, pp. 172, 38. 6d. net Robinson (C. M.)-Modern Civic Art; or, City LONGMANS, Nov. 05",C. H. Cr. 8vo. Robinson,['Cr. 8vo. Robinson (C. H.)'],,Nov. 05,1905,
"Made Beautiful. 8vo. 12s. 6d. net Robinson (C. W.)-Wellington's Campaigns, PUTNAM, Apr. 05",,,Made Beautiful,PUTNAM,,8vo.,"Made Beautiful. 8vo. 12s. 6d. net Robinson (C. W.)-Wellington's Campaigns, PUTNAM, Apr. 05",,,,Apr. 05,1905,
"Peninsula to Waterloo, 1808-15; Moore's Cam- paign of Corunna. Sketch maps, plans. Part 1, 1808-9-10, Roleia For Military Students. to Busaco. 8vo. 8 x 5, pp. 150, 8s. 6d. net Robinson (C. W.)- Wellington's Campaigns: REES, Feb. 05",,,Peninsula to Waterloo,REES,,8vo.,"Peninsula to Waterloo, 1808-15; Moore's Cam- paign of Corunna. Sketch maps, plans. Part 1, 1808-9-10, Roleia For Military Students. to Busaco. 8vo. 8 x 5, pp. 150, 8s. 6d. net Robinson (C. W.)- Wellington's Campaigns: REES, Feb. 05",,,,Feb. 05,1905,
"Peninsula-Waterloo, 1808-15; also Moore's Cam- paign of Corunna. For Military Students. Part 2, 1811-12-13, Barrosa to Vittoria and Invasion of France. 8vo. 8 × 5, pp. 206, 3s. 6d. net Robinson (E. F.), Fraser (J. M.)-Trail of the REES, July 05",,,Peninsula-Waterloo,REES,,8vo.,"Peninsula-Waterloo, 1808-15; also Moore's Cam- paign of Corunna. For Military Students. Part 2, 1811-12-13, Barrosa to Vittoria and Invasion of France. 8vo. 8 × 5, pp. 206, 3s. 6d. net Robinson (E. F.), Fraser (J. M.)-Trail of the REES, July 05",,,,July 05,1905,
"Robinson (E. K.)-Country Day by Day. Illus. with photographs. Cr. 8vo. 74 × 43, pp. 392, 68. Robinson (F. S.)-English Furniture. Roy. 8vo. HEINEMANN, Jan. 05",Robinson,E. K.,Country Day by Day,HEINEMANN,,8vo.,"Robinson (E. K.)-Country Day by Day. Illus. with photographs. Cr. 8vo. 74 × 43, pp. 392, 68. Robinson (F. S.)-English Furniture. Roy. 8vo. HEINEMANN, Jan. 05",E. K. Robinson,['Robinson (E. K.)'],,Jan. 05,1905,
"Robinson (H. P.)-Black Bear. pp. 218, 6s. (Animal Autobiographies) 8vo. 8 × 51, Robinson (J. A.)-Some Thoughts on Athanasian BLACK, Oct. 05",Robinson,H. P.,Black Bear,BLACK,,8vo.,"Robinson (H. P.)-Black Bear. pp. 218, 6s. (Animal Autobiographies) 8vo. 8 × 51, Robinson (J. A.)-Some Thoughts on Athanasian BLACK, Oct. 05",H. P. Robinson,['Robinson (H. P.)'],,Oct. 05,1905,
"Robinson (J. A.)-Some Thoughts on Inspira- tion. Cr. 8vo. 73 × 5, pp. 64, 1s. net; swd. 6d. net Robinson (J. A.)-Some Thoughts on the Incar- LONGMANS, Jan. 05",Robinson,J. A.,Some Thoughts on Inspira- tion,LONGMANS,,8vo.,"Robinson (J. A.)-Some Thoughts on Inspira- tion. Cr. 8vo. 73 × 5, pp. 64, 1s. net; swd. 6d. net Robinson (J. A.)-Some Thoughts on the Incar- LONGMANS, Jan. 05",J. A. Robinson,['Robinson (J. A.)'],,Jan. 05,1905,
"Rodonachi (E.)-Tolla the Courtesan. Sketch of Private Life in Rome in the year of the Jubilee, 1700. Transl. from French by Frederick Lawton. Cr. 8vo. 74 × 5, pp. 326, 68. HEINEMANN, May 05",Rodonachi,E.,Tolla the Courtesan,HEINEMANN,,8vo.,"Rodonachi (E.)-Tolla the Courtesan. Sketch of Private Life in Rome in the year of the Jubilee, 1700. Transl. from French by Frederick Lawton. Cr. 8vo. 74 × 5, pp. 326, 68. HEINEMANN, May 05",E. Rodonachi,['Rodonachi (E.)'],,May 05,1905,
"Rosebery (Lord) Appreciations: Wallace, Burns, Stevenson. Illus. Handmade paper, cr. 4to. 10 x 7, pp. 80, 10s. 6d. - (Stirling) E. MACKAY, Sep. 05",Rosebery,Lord,"Appreciations: Wallace, Burns, Stevenson",E. MACKAY,,4to.,"Rosebery (Lord) Appreciations: Wallace, Burns, Stevenson. Illus. Handmade paper, cr. 4to. 10 x 7, pp. 80, 10s. 6d. - (Stirling) E. MACKAY, Sep. 05",Lord Rosebery,['Rosebery (Lord)'],,Sep. 05,1905,
"Rosenblum (J.)-How to Learn and How to Teach Foreign Languages. Cr. 8vo. limp, 18. net HIRSCHFELD, Nov. 05",Rosenblum,J.,How to Learn and How to Teach Foreign Languages,HIRSCHFELD,,8vo.,"Rosenblum (J.)-How to Learn and How to Teach Foreign Languages. Cr. 8vo. limp, 18. net HIRSCHFELD, Nov. 05",J. Rosenblum,['Rosenblum (J.)'],,Nov. 05,1905,
"Rothera (C. L.)-Licensing Act, 1904; Rules Critically Examined and Explained. 8vo. 8 × 5, pp. 204, 3s. 6d. net ………………………………..JORDAN, Jan. 05",Rothera,C. L.,Licensing Act,JORDAN,,8vo.,"Rothera (C. L.)-Licensing Act, 1904; Rules Critically Examined and Explained. 8vo. 8 × 5, pp. 204, 3s. 6d. net ………………………………..JORDAN, Jan. 05",C. L. Rothera,['Rothera (C. L.)'],,Jan. 05,1905,
"Round the World Geographical Readers. Tales of Travel, 1s.; Land and Water, 1s.; Our English Home, 1s. 8d.; British 1sles, 1s. 4d.; Europe, 1s. 6d. ; America, 1s. 6d.; Africa, 1s. 6d.; Austral- asia, 1s. 6d.; Asia, 1s. 6d.; The World, 1s. 8d. Cr. 8vo. …………………………….JACK, Jan. 05",,,Round the World Geographical Readers,JACK,,8vo.,"Round the World Geographical Readers. Tales of Travel, 1s.; Land and Water, 1s.; Our English Home, 1s. 8d.; British Isles, 1s. 4d.; Europe, 1s. 6d. ; America, 1s. 6d.; Africa, 1s. 6d.; Austral- asia, 1s. 6d.; Asia, 1s. 6d.; The World, 1s. 8d. Cr. 8vo. …………………………….JACK, Jan. 05",,,,Jan. 05,1905,
"Round the World: Our Colonial Cousins, or Britain beyond the Seas. By W. Vere Mingard. Cr. 8vo. 1s. 6d. ……………..JACK, July 05",,,"Round the World: Our Colonial Cousins, or Britain beyond the Seas",JACK,,8vo.,"Round the World: Our Colonial Cousins, or Britain beyond the Seas. By W. Vere Mingard. Cr. 8vo. 1s. 6d. ……………..JACK, July 05",,,,July 05,1905,
"Rowles (W. F.)-Greenhouses: How to Make and Manage them. Illus. Cr. 8vo. 7 x 47, 124, 18........... .....PEARSON, Apr. 05",Rowles,W. F.,Greenhouses: How to Make and Manage them,PEARSON,,8vo.,"Rowles (W. F.)-Greenhouses: How to Make and Manage them. Illus. Cr. 8vo. 7 x 47, 124, 18........... .....PEARSON, Apr. 05",W. F. Rowles,['Rowles (W. F.)'],,Apr. 05,1905,
"Rowles (W. F.)-How to Make a Garden. 104 illus. Cr. 8vo. 8 x 5, pp. 204, 2s. 6d. pp. PEARSON, May 05",Rowles,W. F.,How to Make a Garden,PEARSON,,8vo.,"Rowles (W. F.)-How to Make a Garden. 104 illus. Cr. 8vo. 8 x 5, pp. 204, 2s. 6d. pp. PEARSON, May 05",W. F. Rowles,['Rowles (W. F.)'],,May 05,1905,
"Rowsell (Mary C.)-Life Story of Charlotte de la Trémoille, Countess of Derby. 8vo. 9 × 5, pp. 198, 6s. net ……………..K. PAUL, Mar. 05",Rowsell,Mary C.,"Life Story of Charlotte de la Trémoille, Countess of Derby",K. PAUL,,8vo.,"Rowsell (Mary C.)-Life Story of Charlotte de la Trémoille, Countess of Derby. 8vo. 9 × 5, pp. 198, 6s. net ……………..K. PAUL, Mar. 05",Mary C. Rowsell,['Rowsell (Mary C.)'],,Mar. 05,1905,
"Royal Academy of Medicine in Ireland-Trans- actions. Vol. 22, 1904. 8vo. 158. net BAILLIERE, Jan. 05",,,Royal Academy of Medicine in Ireland-Trans- actions,BAILLIERE,,8vo.,"Royal Academy of Medicine in Ireland-Trans- actions. Vol. 22, 1904. 8vo. 158. net BAILLIERE, Jan. 05",,,,Jan. 05,1905,
"Royal Military Academy and College: Report and Papers, June Examination. 18. WYMAN, Nov. 05",,,"Royal Military Academy and College: Report and Papers, June Examination",WYMAN,,,"Royal Military Academy and College: Report and Papers, June Examination. 18. WYMAN, Nov. 05",,,,Nov. 05,1905,
"Royal Observatory, Greenwich: New Reduction of Groombridge's Catalogue of Circumpolar Stars for the Epoch 1810′0. 248.......... WYMAN, Oct. 05",,,"Royal Observatory, Greenwich: New Reduction of Groombridge's Catalogue of Circumpolar Stars for the Epoch",WYMAN,,,"Royal Observatory, Greenwich: New Reduction of Groombridge's Catalogue of Circumpolar Stars for the Epoch 1810′0. 248.......... WYMAN, Oct. 05",,,,Oct. 05,1905,
"Rudge (C.)-William Jeffery, Puritan Apostle of Kent. Message and Appeal to Young Noncon- formists. Intro. by Dr. Clifford. pp. 94, 1s. 6d. net.... Cr. 8vo. 7 × 43, ……………………..J. CLARKE, Mar. 05",Rudge,C.,"William Jeffery, Puritan Apostle of Kent",J. CLARKE,,8vo.,"Rudge (C.)-William Jeffery, Puritan Apostle of Kent. Message and Appeal to Young Noncon- formists. Intro. by Dr. Clifford. pp. 94, 1s. 6d. net.... Cr. 8vo. 7 × 43, ……………………..J. CLARKE, Mar. 05",C. Rudge,['Rudge (C.)'],,Mar. 05,1905,
"Ruff (F.)-Reference Book for Statical Calcula- tions: Rapid Statics. Vol. 1. Cr. 8vo. 58. net By May Byron and SPON, Nov. 05",Ruff,F.,Reference Book for Statical Calcula- tions: Rapid Statics,SPON,,8vo.,"Ruff (F.)-Reference Book for Statical Calcula- tions: Rapid Statics. Vol. 1. Cr. 8vo. 58. net By May Byron and SPON, Nov. 05",F. Ruff,['Ruff (F.)'],,Nov. 05,1905,
"Rules of Supreme Court, Ireland. 10s. Rules and Orders (Statutory, 1904)-Appendix, WYMAN, June 05",,,"Rules of Supreme Court, Ireland",WYMAN,,,"Rules of Supreme Court, Ireland. 10s. Rules and Orders (Statutory, 1904)-Appendix, WYMAN, June 05",,,,June 05,1905,
"Rules and Orders (Statutory)-Factories &c. (Night Work) 1d. Motor Cars (Ireland) 2 at 1d. Rules and Orders (Statutory)-Foreign Jurisdic- WYMAN, Mar. 05",,,,WYMAN,,,"Rules and Orders (Statutory)-Factories &c. (Night Work) 1d. Motor Cars (Ireland) 2 at 1d. Rules and Orders (Statutory)-Foreign Jurisdic- WYMAN, Mar. 05",,"['Rules', 'Orders (Statutory)-Factories &c. (Night Work)']",,Mar. 05,1905,
"Rules and Orders (Statutory)-Local Authorities' Loans, Scotland, 1d.; Local Government, Ireland, 1 d. Rules and Orders (Statutory)-Motor Cars, 7 at .WYMAN, Oct. 05",,,"Local Authorities' Loans, Scotland",WYMAN,,,"Rules and Orders (Statutory)-Local Authorities' Loans, Scotland, 1d.; Local Government, Ireland, 1 d. Rules and Orders (Statutory)-Motor Cars, 7 at .WYMAN, Oct. 05",,"['Rules', 'Orders (Statutory)']",,Oct. 05,1905,
"Administration; Nos. 1120, 1121, Merchant Shipping; No. 1122, Burial, England, ea. 1d. Rules and Orders (Statutory)-No. 623, County WYMAN, Nov. 05",,,Administration; Nos,WYMAN,,,"Administration; Nos. 1120, 1121, Merchant Shipping; No. 1122, Burial, England, ea. 1d. Rules and Orders (Statutory)-No. 623, County WYMAN, Nov. 05",,,,Nov. 05,1905,
"Court (England), 1d.; No. 638, County Court Committals, 1d.... Rules and Orders (Statutory)-Regulations under •WYMAN, June 05",Court,England,1d,WYMAN,,,"Court (England), 1d.; No. 638, County Court Committals, 1d.... Rules and Orders (Statutory)-Regulations under •WYMAN, June 05",England Court,['Court (England)'],,June 05,1905,
"Unemployed Workmen Act, 1d.; do. Scotland, 1d. Rules and Orders (Statutory)-P.O. Savings WYMAN, Nov. 05",,,Unemployed Workmen Act,WYMAN,,,"Unemployed Workmen Act, 1d.; do. Scotland, 1d. Rules and Orders (Statutory)-P.O. Savings WYMAN, Nov. 05",,,,Nov. 05,1905,
"Rules and Orders (Statutory)-Tramways. 2 at 1d. Rules and Orders (Statutory)-Tramways, Motor- WYMAN, Apr. 05",,,Tramways,WYMAN,,,"Rules and Orders (Statutory)-Tramways. 2 at 1d. Rules and Orders (Statutory)-Tramways, Motor- WYMAN, Apr. 05",,"['Rules', 'Orders (Statutory)']",,Apr. 05,1905,
"Merchandise Marks, 1d.; Wild Bird, Scotland, 1d. Rules and Orders (Statutory)-Tramways. 11 at ....WYMAN, May 05",,,Merchandise Marks,WYMAN,,,"Merchandise Marks, 1d.; Wild Bird, Scotland, 1d. Rules and Orders (Statutory)-Tramways. 11 at ....WYMAN, May 05",,,,May 05,1905,
"Rules and Orders (Statutory)-Tramways (8); Light Railways (2); Wild Bird, Carnarvon (1). 1d. each Rules and Orders, Statutory: Tramways, 2 at 1d.; ...WYMAN, Sep. 05",,,"Wild Bird, Carnarvon (1)",WYMAN,,,"Rules and Orders (Statutory)-Tramways (8); Light Railways (2); Wild Bird, Carnarvon (1). 1d. each Rules and Orders, Statutory: Tramways, 2 at 1d.; ...WYMAN, Sep. 05",,"['Rules', 'Orders (Statutory)-Tramways (8); Light Railways (2)']",,Sep. 05,1905,
"Suffragan Bishop; County Court; Industrial School, 1d. each ..WYMAN, Dec. 05",,,Suffragan Bishop; County Court; Industrial School,WYMAN,,,"Suffragan Bishop; County Court; Industrial School, 1d. each ..WYMAN, Dec. 05",,,,Dec. 05,1905,
"Unemployed Rules and Orders (Statutory) - Workmen, 1d.; Factory and Workshop (Dan- gerous and Unhealthy Industries), 1d.; Irish Teachers' Pensions, 1d.; Post Office (Money Orders, Inland) 1d. ・WYMAN, Nov. 05",,,Unemployed Rules and Orders (Statutory) - Workmen,WYMAN,,,"Unemployed Rules and Orders (Statutory) - Workmen, 1d.; Factory and Workshop (Dan- gerous and Unhealthy Industries), 1d.; Irish Teachers' Pensions, 1d.; Post Office (Money Orders, Inland) 1d. ・WYMAN, Nov. 05",,,,Nov. 05,1905,
"Runciman (W.)-Windjammers and Sea Tramps. 2nd edit. Cr. 8vo. 7 × 5, pp. 124, 2s. 6d. Runciman (W. C.)-Gas and Oil Engines simply W. SCOTT, June 05",Runciman,W.,Windjammers and Sea Tramps,W. SCOTT,,8vo.,"Runciman (W.)-Windjammers and Sea Tramps. 2nd edit. Cr. 8vo. 7 × 5, pp. 124, 2s. 6d. Runciman (W. C.)-Gas and Oil Engines simply W. SCOTT, June 05",W. Runciman,['Runciman (W.)'],,June 05,1905,
"Rusbrock (J.)-Reflections from the Mirror of a Mystic. Transl. by Earle Baillie. 12mo. 2s. net Rushe (J. P. O. D. C.)-Second Thebaid of the T. BAKER, May 05",Rusbrock,J.,Reflections from the Mirror of a Mystic,T. BAKER,,12mo.,"Rusbrock (J.)-Reflections from the Mirror of a Mystic. Transl. by Earle Baillie. 12mo. 2s. net Rushe (J. P. O. D. C.)-Second Thebaid of the T. BAKER, May 05",J. Rusbrock,['Rusbrock (J.)'],,May 05,1905,
"Ruskin (J.)—Harbours of England. Pocket edit. 12mo. 64 × 44, pp. 162, 2s. 6d. net; lthr. 3s. 6d. ……………………..G. ALLEN, Feb. 05",Ruskin,J.,Harbours of England,G. ALLEN,,12mo.,"Ruskin (J.)—Harbours of England. Pocket edit. 12mo. 64 × 44, pp. 162, 2s. 6d. net; lthr. 3s. 6d. ……………………..G. ALLEN, Feb. 05",J. Ruskin,['Ruskin (J.)'],,Feb. 05,1905,
"Ruskin (J.)-Lectures on Architecture and Paint- ing. With all the illus. Pocket edit. 12mo. net 6 × 44, pp. 266, 8s. 6d. net; lthr. 4s. 6d. net Ruskin (J.)-Nature of Gothic. Chapter from G. ALLEN, Jan. 05",Ruskin,J.,Lectures on Architecture and Paint- ing,G. ALLEN,,12mo.,"Ruskin (J.)-Lectures on Architecture and Paint- ing. With all the illus. Pocket edit. 12mo. net 6 × 44, pp. 266, 8s. 6d. net; lthr. 4s. 6d. net Ruskin (J.)-Nature of Gothic. Chapter from G. ALLEN, Jan. 05",J. Ruskin,['Ruskin (J.)'],,Jan. 05,1905,
"Stones of Venice. Pref. by William Morris. 5th thou. 12mo. 1s. net; swd. 6d. net ......... Ruskin (J.)-On the Old Road, Vol. 1. G. ALLEN, Mar. 05",,,Stones of Venice,G. ALLEN,,12mo.,"Stones of Venice. Pref. by William Morris. 5th thou. 12mo. 1s. net; swd. 6d. net ......... Ruskin (J.)-On the Old Road, Vol. 1. G. ALLEN, Mar. 05",,,,Mar. 05,1905,
