entry,last_name,first_name,title,publisher,price,format,original_entry,author_name,creators,is_editor,date,catalogue_year,is_net
"Jackson (T.)-Lost Squire of Inglewood. Adven- tures in Caves of Robin Hood. Cr. 8vo. pp. 220, 18. (Royal Lib.) ..NELSON, Nov. 05",Jackson,T.,Lost Squire of Inglewood,NELSON,,8vo.,"Jackson (T.)-Lost Squire of Inglewood. Adven- tures in Caves of Robin Hood. Cr. 8vo. pp. 220, 18. (Royal Lib.) ..NELSON, Nov. 05",T. Jackson,['Jackson (T.)'],,Nov. 05,1905,
"Jacobi (C. T.)-Printers' Handbook of Trade Receipts, Hints, Suggestions, relating to Letter- press and Lithographic Printing, &c. 3rd edit. enl. Cr. 8vo. 7 x 5, pp. 476, 58. net AUTHOR, Sep. 05",Jacobi,C. T.,"Printers' Handbook of Trade Receipts, Hints, Suggestions, relating to Letter- press and Lithographic Printing, &c",AUTHOR,,8vo.,"Jacobi (C. T.)-Printers' Handbook of Trade Receipts, Hints, Suggestions, relating to Letter- press and Lithographic Printing, &c. 3rd edit. enl. Cr. 8vo. 7 x 5, pp. 476, 58. net AUTHOR, Sep. 05",C. T. Jacobi,['Jacobi (C. T.)'],,Sep. 05,1905,
"Jacyntha, Reid (Lizzie C.) 28. 6d. Jade Eye, Hume (Fergus) 6d. .......... Jaffé (E.)-Das Englische Bankwesen. 8vo. pp. 256, 68. ………………………….D. NUTT, Feb. 05","Jacyntha, Reid",Lizzie C.,,D. NUTT,,8vo.,"Jacyntha, Reid (Lizzie C.) 28. 6d. Jade Eye, Hume (Fergus) 6d. .......... Jaffé (E.)-Das Englische Bankwesen. 8vo. pp. 256, 68. ………………………….D. NUTT, Feb. 05","Lizzie C. Jacyntha, Reid","['Jacyntha, Reid (Lizzie C.)']",,Feb. 05,1905,
"Jaggard (W.)-Liverpool Literature: a Descrip- tive Bibliography. With Annotations, Market Values, and a brief Introspect. 8vo. 2s. 6d. net; on Japanese vellum, 5s. net (Liverpool) JAGGARD, Dec. 0s.",,,,,,,"Jaggard (W.)-Liverpool Literature: a Descrip- tive Bibliography. With Annotations, Market Values, and a brief Introspect. 8vo. 2s. 6d. net; on Japanese vellum, 5s. net (Liverpool) JAGGARD, Dec. 05.",,,,,1905,
"James (D. H.)-Siege of Port Arthur. Records of an Eye-Witness. Maps, plans, 17 illus. 8vo. 9 × 5, pp. 320, 10s. 6d..... UNWIN, Oct. 0s.",,,,,,,"James (D. H.)-Siege of Port Arthur. Records of an Eye-Witness. Maps, plans, 17 illus. 8vo. 9 × 5, pp. 320, 10s. 6d..... UNWIN, Oct. 05.",,,,,1905,
"James (L. J.)-Mother Church and her Antago- nists. Pop. edit. Cr. 8vo: 7× 5, pp. 296, sd. 18. net ....SIMPKIN, Jan. 05",James,L. J.,Mother Church and her Antago- nists,SIMPKIN,,8vo,"James (L. J.)-Mother Church and her Antago- nists. Pop. edit. Cr. 8vo: 7× 5, pp. 296, sd. 18. net ....SIMPKIN, Jan. 05",L. J. James,['James (L. J.)'],,Jan. 05,1905,
"James (W. H. N.), Sands (D. L.)-Elementary Electrical Calculations. Book suitable for 1st. and 2nd year students of Electrical Engineering. Cr. 8vo. 7 × 44, pp. 224, 3s. 6d. net LONGMANS, Oct. 0s.",,,,,,,"James (W. H. N.), Sands (D. L.)-Elementary Electrical Calculations. Book suitable for 1st. and 2nd year students of Electrical Engineering. Cr. 8vo. 7 × 44, pp. 224, 3s. 6d. net LONGMANS, Oct. 05.",,,,,1905,
"James I. of England. Counterblast to Tobacco. 18mo. lthr. 18. 6d. net (Ariel Booklets) PUTNAM, Dec.. 0s.",,,,,,,"James I. of England. Counterblast to Tobacco. 18mo. lthr. 18. 6d. net (Ariel Booklets) PUTNAM, Dec.. 05.",,,,,1905,
"Jamieson (A.)-Elementary Manual of Mag- netism and Electricity. 6th edit. Cr. 8vo. 7 × 44, pp. 810, 8s. 6d. …………..GRIFFIN, Sep. 05",Jamieson,A.,Elementary Manual of Mag- netism and Electricity,GRIFFIN,,8vo.,"Jamieson (A.)-Elementary Manual of Mag- netism and Electricity. 6th edit. Cr. 8vo. 7 × 44, pp. 810, 8s. 6d. …………..GRIFFIN, Sep. 05",A. Jamieson,['Jamieson (A.)'],,Sep. 05,1905,
"Janau (E.), Ludwig (A.)-Public School French Grammar. Based upon the Grammaire Fran- çaise of Auguste Brachet. Part 2, Syntax. Cr. 8vo. 7 × 43, pp. 620, 4s. 6d. HACHETTE, May 0s.",,,,,,,"Janau (E.), Ludwig (A.)-Public School French Grammar. Based upon the Grammaire Fran- çaise of Auguste Brachet. Part 2, Syntax. Cr. 8vo. 7 × 43, pp. 620, 4s. 6d. HACHETTE, May 05.",,,,,1905,
"Jane (L. C.)-Coming of Parliament; England from 1350 to 1660. Cr. 8vo. 8 × 51, pp. 422, 58. (Story of the Nations)............... UNWIN, Jan. 05",Jane,L. C.,Coming of Parliament; England from,UNWIN,,8vo.,"Jane (L. C.)-Coming of Parliament; England from 1350 to 1660. Cr. 8vo. 8 × 51, pp. 422, 58. (Story of the Nations)............... UNWIN, Jan. 05",L. C. Jane,['Jane (L. C.)'],,Jan. 05,1905,
"Janton (L.)-Le Roman du Renard modernisé. Cr. 8vo. 17s.....………………………………………………..HOULSTON, Aug. 05",Janton,L.,Le Roman du Renard modernisé,HOULSTON,,8vo.,"Janton (L.)-Le Roman du Renard modernisé. Cr. 8vo. 17s.....………………………………………………..HOULSTON, Aug. 05",L. Janton,['Janton (L.)'],,Aug. 05,1905,
"Japp (A. H.)-Robert Louis Stevenson. Record, estimate, and memorial. With hitherto unpub- lished letters from R. L. Stevenson in facsimile. Cr. 8vo. 7 × 41, pp. 320, 6s. net net T. W. LAURIE, Jan. 05",Japp,A. H.,Robert Louis Stevenson,T. W. LAURIE,,8vo.,"Japp (A. H.)-Robert Louis Stevenson. Record, estimate, and memorial. With hitherto unpub- lished letters from R. L. Stevenson in facsimile. Cr. 8vo. 7 × 41, pp. 320, 6s. net net T. W. LAURIE, Jan. 05",A. H. Japp,['Japp (A. H.)'],,Jan. 05,1905,
"Jebb (R. C., Sir)-British Academy Bacchylides. From Proceedings of British Academy. Vol. 1. Roy. 8vo. swd. 18. net .....FROWDE, Feb. 05",Jebb,"R. C., Sir",British Academy Bacchylides,FROWDE,,8vo.,"Jebb (R. C., Sir)-British Academy Bacchylides. From Proceedings of British Academy. Vol. 1. Roy. 8vo. swd. 18. net .....FROWDE, Feb. 05","R. C., Sir Jebb","['Jebb (R. C., Sir)']",,Feb. 05,1905,
"Jefferies (R.)- After London, or Wild England. New edit. Cr. 8vo. 8 x 5, pp. 818, 68. ........... DUCKWORTH, Oct. 05",Jefferies,R.,"After London, or Wild England",DUCKWORTH,,8vo.,"Jefferies (R.)- After London, or Wild England. New edit. Cr. 8vo. 8 x 5, pp. 818, 68. ........... DUCKWORTH, Oct. 05",R. Jefferies,['Jefferies (R.)'],,Oct. 05,1905,
"Jefferies (R.)-Nature near London. Fine paper edit. 12mo. 6 × 4, pp. 222, 2s. net; lthr. 38. net CHATTO, Mar. 05",Jefferies,R.,Nature near London,CHATTO,,12mo.,"Jefferies (R.)-Nature near London. Fine paper edit. 12mo. 6 × 4, pp. 222, 2s. net; lthr. 38. net CHATTO, Mar. 05",R. Jefferies,['Jefferies (R.)'],,Mar. 05,1905,
"Jellett (H.)-A Manual of Midwifery for Stu- dents and Practitioners. 8vo. 84 × 54, pp. 1184, 218. net (University Series) BAILLIERE, May 05",Jellett,H.,A Manual of Midwifery for Stu- dents and Practitioners,BAILLIERE,,8vo.,"Jellett (H.)-A Manual of Midwifery for Stu- dents and Practitioners. 8vo. 84 × 54, pp. 1184, 218. net (University Series) BAILLIERE, May 05",H. Jellett,['Jellett (H.)'],,May 05,1905,
"Jewish Historical Society of England: Calendar of Plea Rolls of Exchequer of the Jews. Ed. by J. M. Rigg. Vol. 1, Henry III. A.D. 1218–1272. 4to. swd. 168......... .MACMILLAN, July 05",,,Jewish Historical Society of England: Calendar of Plea Rolls of Exchequer of the Jews,MACMILLAN,,4to.,"Jewish Historical Society of England: Calendar of Plea Rolls of Exchequer of the Jews. Ed. by J. M. Rigg. Vol. 1, Henry III. A.D. 1218–1272. 4to. swd. 168......... .MACMILLAN, July 05",,,,July 05,1905,
"Job-The Original Poem translated from restored text by E. J. Dillon. To which is appended the Book of Job according to Authorised Version. Cr. 8vo. 73 × 5, pp. 174, 58...... .UNWIN, July 05",,,Job-The Original Poem translated from restored text by E. J. Dillon,UNWIN,,8vo.,"Job-The Original Poem translated from restored text by E. J. Dillon. To which is appended the Book of Job according to Authorised Version. Cr. 8vo. 73 × 5, pp. 174, 58...... .UNWIN, July 05",,,,July 05,1905,
"John Chinaman on the Rand. By an English Eye-Witness. With Introduction by Dr. John Clifford. Cr. 8vo. pp. 128, swd. 18. EVERETT, Dec. 05",,,John Chinaman on the Rand,EVERETT,,8vo.,"John Chinaman on the Rand. By an English Eye-Witness. With Introduction by Dr. John Clifford. Cr. 8vo. pp. 128, swd. 18. EVERETT, Dec. 05",,,,Dec. 05,1905,
"Johnson (G., Admiral) Autobiography and Memoir. 1809-1903. Intro. by W. H. Hutton. Cr. 8vo. 7 × 43, pp. 112, 2s. 6d. net ....... - - T. BURLEIGH, May 05",Johnson,"G., Admiral",Autobiography and Memoir,T. BURLEIGH,,8vo.,"Johnson (G., Admiral) Autobiography and Memoir. 1809-1903. Intro. by W. H. Hutton. Cr. 8vo. 7 × 43, pp. 112, 2s. 6d. net ....... - - T. BURLEIGH, May 05","G., Admiral Johnson","['Johnson (G., Admiral)']",,May 05,1905,
"Johnson (J.)-George MacDonald. Biographical and Critical Appreciation. Cr. 8vo. 73 x 5, pp. 812, 6s. …………………….I. PITMAN, Nov. 05",Johnson,J.,George MacDonald,I. PITMAN,,8vo.,"Johnson (J.)-George MacDonald. Biographical and Critical Appreciation. Cr. 8vo. 73 x 5, pp. 812, 6s. …………………….I. PITMAN, Nov. 05",J. Johnson,['Johnson (J.)'],,Nov. 05,1905,
"Johnson (S.)-Rasselas. 12mo. 6×33, pp. 802, 1s. net; lthr. 28. net (New Univ. Lib.) www. ROUTLEDGE, Sep. 05",Johnson,S.,Rasselas,ROUTLEDGE,,12mo.,"Johnson (S.)-Rasselas. 12mo. 6×33, pp. 802, 1s. net; lthr. 28. net (New Univ. Lib.) www. ROUTLEDGE, Sep. 05",S. Johnson,['Johnson (S.)'],,Sep. 05,1905,
"Johnson (S.)-Rasselas, Prince of Abyssinia. 12mo. 6d. net; lthr. 18. net; swd. 8d. net (Carlton Classics) ………………………..LONG, Nov. 05",Johnson,S.,"Rasselas, Prince of Abyssinia",LONG,,12mo.,"Johnson (S.)-Rasselas, Prince of Abyssinia. 12mo. 6d. net; lthr. 18. net; swd. 8d. net (Carlton Classics) ………………………..LONG, Nov. 05",S. Johnson,['Johnson (S.)'],,Nov. 05,1905,
"Johnston (A.) · American Political History, 1763-1876. Pt. 1, The Revolution. 8vo. 98. net PUTNAM, Dec. 05",Johnston,A.,American Political History,PUTNAM,,8vo.,"Johnston (A.) · American Political History, 1763-1876. Pt. 1, The Revolution. 8vo. 98. net PUTNAM, Dec. 05",A. Johnston,['Johnston (A.)'],,Dec. 05,1905,
"Johnston (Annie Fellows)-Little Colonel in Arizona. Illus. Cr. 8vo. 77 × 54, pp. 322, 58. SEELEY, Sep. 05",Johnston,Annie Fellows,Little Colonel in Arizona,SEELEY,,8vo.,"Johnston (Annie Fellows)-Little Colonel in Arizona. Illus. Cr. 8vo. 77 × 54, pp. 322, 58. SEELEY, Sep. 05",Annie Fellows Johnston,['Johnston (Annie Fellows)'],,Sep. 05,1905,
"Johnston (J. A.)-Jamaica, the New Riviera. Oblong 4to. 48. net..................CASSELL, Dec. 05",Johnston,J. A.,"Jamaica, the New Riviera",CASSELL,,4to.,"Johnston (J. A.)-Jamaica, the New Riviera. Oblong 4to. 48. net..................CASSELL, Dec. 05",J. A. Johnston,['Johnston (J. A.)'],,Dec. 05,1905,
"Johnston (R. E.)-Eternal King and His King- dom. Lessons on Catechisings for Children of the Church. First Series (52 weeks). Preparation for Coming of the King. Cr. 8vo. 7 x 5, pp. 154, 28. net............. ...SKEFFINGTON, Sep. 05",Johnston,R. E.,Eternal King and His King- dom,SKEFFINGTON,,8vo.,"Johnston (R. E.)-Eternal King and His King- dom. Lessons on Catechisings for Children of the Church. First Series (52 weeks). Preparation for Coming of the King. Cr. 8vo. 7 x 5, pp. 154, 28. net............. ...SKEFFINGTON, Sep. 05",R. E. Johnston,['Johnston (R. E.)'],,Sep. 05,1905,
"Jolliest Holiday ever we had. Illus. by John Hassall. 4to. bds. 18................NELSON, Sep. 05",,,Jolliest Holiday ever we had,NELSON,,4to.,"Jolliest Holiday ever we had. Illus. by John Hassall. 4to. bds. 18................NELSON, Sep. 05",,,,Sep. 05,1905,
"Jones (Constance Evan)-Caprice. Study in Emotions. Cr. 8vo. 71 × 5, pp. 288, 6s. Jones (Burne-, Sir)-Drawings. ......... NISBET, Feb. 05",Jones,Constance Evan,Caprice,NISBET,,8vo.,"Jones (Constance Evan)-Caprice. Study in Emotions. Cr. 8vo. 71 × 5, pp. 288, 6s. Jones (Burne-, Sir)-Drawings. ......... NISBET, Feb. 05",Constance Evan Jones,['Jones (Constance Evan)'],,Feb. 05,1905,
"Jones (Georgiana Burne-)-see J. (G. B.-) Jones (H.)-Immortality of the Soul in the Poems of Tennyson and Browning. Lecture. Cr. 8vo. .P. 7 x 5, pp. 48, 18. GREEN, Sep. 05",,,Jones (H.)-Immortality of the Soul in the Poems of Tennyson and Browning,GREEN,,8vo.,"Jones (Georgiana Burne-)-see J. (G. B.-) Jones (H.)-Immortality of the Soul in the Poems of Tennyson and Browning. Lecture. Cr. 8vo. .P. 7 x 5, pp. 48, 18. GREEN, Sep. 05",,"['Jones (Georgiana Burne-)-', '(G. B.-)']",,Sep. 05,1905,
"Jones (H.)-Philosophy of Martineau. 8vo. limp, pp. 38, 18. net …………………………………………..MACMILLAN, Nov. 05",Jones,H.,Philosophy of Martineau,MACMILLAN,,8vo.,"Jones (H.)-Philosophy of Martineau. 8vo. limp, pp. 38, 18. net …………………………………………..MACMILLAN, Nov. 05",H. Jones,['Jones (H.)'],,Nov. 05,1905,
"Jones (R. M.)-Social Law in Spiritual World. Studies in Human and Divine Inter-Relation- ship. Cr. 8vo. 8 × 5, pp. 272, 5s. net net *******........... ..... HEADLEY, Oct. 05",Jones,R. M.,Social Law in Spiritual World,HEADLEY,,8vo.,"Jones (R. M.)-Social Law in Spiritual World. Studies in Human and Divine Inter-Relation- ship. Cr. 8vo. 8 × 5, pp. 272, 5s. net net *******........... ..... HEADLEY, Oct. 05",R. M. Jones,['Jones (R. M.)'],,Oct. 05,1905,
"Jordan (L H.)-Comparative Religion, its. Genesis and Growth. Intro. by Principal Fair- bairn. 8vo. 9 × 54, pp. 688, 128. net T. & T. CLARK, Oct. 0s.",,,,,,,"Jordan (L H.)-Comparative Religion, its. Genesis and Growth. Intro. by Principal Fair- bairn. 8vo. 9 × 54, pp. 688, 128. net T. & T. CLARK, Oct. 05.",,,,,1905,
"Jordan (W. G.)-Self-Control, its Kingship and Majesty. Cr. 8vo. 74 × 5, pp. 192, Ss. 6d. net REVELL, Sep. 0s.",,,,,,,"Jordan (W. G.)-Self-Control, its Kingship and Majesty. Cr. 8vo. 74 × 5, pp. 192, Ss. 6d. net REVELL, Sep. 05.",,,,,1905,
"Josika (N., Baron)-'Neath the Hoof of the Tartar; or, The Scourge of God. Abridged from the Hungarian by Selina Gaye. 2nd edit. Cr. 8vo. 74 × 5, pp. 822, 68.............JARROLD, Jan. 05",Josika,"N., Baron","Neath the Hoof of the Tartar; or, The Scourge of God",JARROLD,,8vo.,"Josika (N., Baron)-'Neath the Hoof of the Tartar; or, The Scourge of God. Abridged from the Hungarian by Selina Gaye. 2nd edit. Cr. 8vo. 74 × 5, pp. 822, 68.............JARROLD, Jan. 05","N., Baron Josika","['Josika (N., Baron)']",,Jan. 05,1905,
"Joubert (C.)-Fall of Tsardom. 8vo. 9 × 54, pp. 256, 7s. 6d. ……………………..NASH, May 05",Joubert,C.,Fall of Tsardom,NASH,,8vo.,"Joubert (C.)-Fall of Tsardom. 8vo. 9 × 54, pp. 256, 7s. 6d. ……………………..NASH, May 05",C. Joubert,['Joubert (C.)'],,May 05,1905,
"Joubert (C.)-Truth about the Tsar and the Present State of Russia. 8vo. 9×5, pp. 266, 7s. 6d....... ……………..NASH, Jan. 05",Joubert,C.,Truth about the Tsar and the Present State of Russia,NASH,,8vo.,"Joubert (C.)-Truth about the Tsar and the Present State of Russia. 8vo. 9×5, pp. 266, 7s. 6d....... ……………..NASH, Jan. 05",C. Joubert,['Joubert (C.)'],,Jan. 05,1905,
"Junior History Reader. Book 3. Post 8vo. pp. 160, ....CHAMBERS, Mar. 05",,,Junior History Reader,CHAMBERS,,8vo.,"Junior History Reader. Book 3. Post 8vo. pp. 160, ....CHAMBERS, Mar. 05",,,,Mar. 05,1905,
"Keary (A. & E.)-Heroes of Asgard. Edit. by M. R. Earle. 12mo. limp, 1s. ***......... MACMILLAN, Nov. 05",Keary,A. & E.,Heroes of Asgard,MACMILLAN,,12mo.,"Keary (A. & E.)-Heroes of Asgard. Edit. by M. R. Earle. 12mo. limp, 1s. ***......... MACMILLAN, Nov. 05",A. & E. Keary,['Keary (A. & E.)'],,Nov. 05,1905,
"Keays (H. A. M.)-He that eateth Bread with Me. Cr. 8vo. 73 × 43, pp. 354, 68. METHUEN, Jan. 05",Keays,H. A. M.,He that eateth Bread with Me,METHUEN,,8vo.,"Keays (H. A. M.)-He that eateth Bread with Me. Cr. 8vo. 73 × 43, pp. 354, 68. METHUEN, Jan. 05",H. A. M. Keays,['Keays (H. A. M.)'],,Jan. 05,1905,
"Keays (H. A. M.)-It was a Boy. Cr. 8vo. 7 × 4, pp. 288, 3s. 6d……………..ARROWSMITH, Feb. 05",Keays,H. A. M.,It was a Boy,ARROWSMITH,,8vo.,"Keays (H. A. M.)-It was a Boy. Cr. 8vo. 7 × 4, pp. 288, 3s. 6d……………..ARROWSMITH, Feb. 05",H. A. M. Keays,['Keays (H. A. M.)'],,Feb. 05,1905,
"Keble Calendar of Nature (The) 1906. Being Selections appropriate to each month from John Keble's Christian Year. Narrow 18mo. bds. 1s. net ………………………………..ANACKER, Nov. 05",,,Keble Calendar of Nature (The),ANACKER,,18mo.,"Keble Calendar of Nature (The) 1906. Being Selections appropriate to each month from John Keble's Christian Year. Narrow 18mo. bds. 1s. net ………………………………..ANACKER, Nov. 05",,,,Nov. 05,1905,
"Keeble (F.) and Gamble (F. W.)-Colour-Phy- siology of Higher Crustacea. Part 3. 2 plates, 4to. pp. 16, swd. 1s. 6d …………………………….DULAU, May 05",Keeble,F.,Colour-Phy- siology of Higher Crustacea,DULAU,,4to.,"Keeble (F.) and Gamble (F. W.)-Colour-Phy- siology of Higher Crustacea. Part 3. 2 plates, 4to. pp. 16, swd. 1s. 6d …………………………….DULAU, May 05",F. Keeble,"['Keeble (F.)', 'Gamble (F. W.)']",,May 05,1905,
"Keightley (S. R.)-Barnaby's Bridal. Cr. 8vo. 74 × 5, pp. 286, 6s. …………..LONG, Dec. 05",Keightley,S. R.,Barnaby's Bridal,LONG,,8vo.,"Keightley (S. R.)-Barnaby's Bridal. Cr. 8vo. 74 × 5, pp. 286, 6s. …………..LONG, Dec. 05",S. R. Keightley,['Keightley (S. R.)'],,Dec. 05,1905,
"Kellor (F. A.)-Out of Work. Study of Employ- ment Agencies. Cr. 8vo. 58. net PUTNAM, Mar. 05",Kellor,F. A.,Out of Work,PUTNAM,,8vo.,"Kellor (F. A.)-Out of Work. Study of Employ- ment Agencies. Cr. 8vo. 58. net PUTNAM, Mar. 05",F. A. Kellor,['Kellor (F. A.)'],,Mar. 05,1905,
"Kelman (J. Harvey)-Stories from Life of Christ. Selected for Children. Pictures by F. D. Bed- ford. 16mo. 6 × 42, pp. 128, 1s. 6d. net; bds. 18. net (Told to the Children Ser.) ...JACK, Sep. 05",Kelman,J. Harvey,Stories from Life of Christ,JACK,,16mo.,"Kelman (J. Harvey)-Stories from Life of Christ. Selected for Children. Pictures by F. D. Bed- ford. 16mo. 6 × 42, pp. 128, 1s. 6d. net; bds. 18. net (Told to the Children Ser.) ...JACK, Sep. 05",J. Harvey Kelman,['Kelman (J. Harvey)'],,Sep. 05,1905,
"Kelsall (J. E.), Munn (Philip W.)-Birds of Hampshire and the 1sle of Wight. 8vo. 9 × 5, pp. 416, 15s. net …………………. WITHERBY, Nov. 05",,,Birds of Hampshire and the,WITHERBY,,8vo.,"Kelsall (J. E.), Munn (Philip W.)-Birds of Hampshire and the Isle of Wight. 8vo. 9 × 5, pp. 416, 15s. net …………………. WITHERBY, Nov. 05",,"['Kelsall (J. E.), Munn (Philip W.)']",,Nov. 05,1905,
"Keltie (J. S.), Renwick (I. P. A.)-Statesman's Year-book. Statistical and Historical Annual of the States of the World for 190s. Cr. 8vo. 7 × 44, pp. 1,480, 10s. 6d. net.........! ..MACMILLAN, Apr. 05",,,Statesman's Year-book,MACMILLAN,,8vo.,"Keltie (J. S.), Renwick (I. P. A.)-Statesman's Year-book. Statistical and Historical Annual of the States of the World for 1905. Cr. 8vo. 7 × 44, pp. 1,480, 10s. 6d. net.........! ..MACMILLAN, Apr. 05",,"['Keltie (J. S.), Renwick (I. P. A.)']",,Apr. 05,1905,
"Kempis (T. à)-Of the Imitation of Christ. 12mo. 6 x 3, pp. 828, 2s. net; lthr. 2s. 6d. net (Newnes' Pocket Classics)…………………………………………. .NEWNES, July 05",Kempis,T. à,Of the Imitation of Christ,NEWNES,,12mo.,"Kempis (T. à)-Of the Imitation of Christ. 12mo. 6 x 3, pp. 828, 2s. net; lthr. 2s. 6d. net (Newnes' Pocket Classics)…………………………………………. .NEWNES, July 05",T. à Kempis,['Kempis (T. à)'],,July 05,1905,
"Kenny (Louise)-Red-Haired Woman: her Auto- biography. Extra cr. 8vo. 8 x 5, pp. 414, 68. J. MURRAY, Nov. 05",Kenny,Louise,Red-Haired Woman: her Auto- biography,J. MURRAY,,8vo.,"Kenny (Louise)-Red-Haired Woman: her Auto- biography. Extra cr. 8vo. 8 x 5, pp. 414, 68. J. MURRAY, Nov. 05",Louise Kenny,['Kenny (Louise)'],,Nov. 05,1905,
"Key (A. Cooper-)-A Primer of Explosives. For the use of Local Inspectors and Dealers. Edit. by Captain J. H. Thomson. 12mo. 6 × 4, pp. 108, 18. .MACMILLAN, Aug. 05",Key,A. Cooper-,A Primer of Explosives,MACMILLAN,,12mo.,"Key (A. Cooper-)-A Primer of Explosives. For the use of Local Inspectors and Dealers. Edit. by Captain J. H. Thomson. 12mo. 6 × 4, pp. 108, 18. .MACMILLAN, Aug. 05",A. Cooper- Key,['Key (A. Cooper-)'],,Aug. 05,1905,
"Keyser (C. E.)-List of Norman Tympana and Lintels, &c. Plates. 4to. pp. 144, 218. net .... E. STOCK, Jan. 05",Keyser,C. E.,"List of Norman Tympana and Lintels, &c",E. STOCK,,4to.,"Keyser (C. E.)-List of Norman Tympana and Lintels, &c. Plates. 4to. pp. 144, 218. net .... E. STOCK, Jan. 05",C. E. Keyser,['Keyser (C. E.)'],,Jan. 05,1905,
"King (H. C.)-Personal and 1deal Elements in Education. Cr. 8vo. 6s. 6d. nt. MACMILLAN, Jan 05",King,H. C.,Personal and,MACMILLAN,,8vo.,"King (H. C.)-Personal and Ideal Elements in Education. Cr. 8vo. 6s. 6d. nt. MACMILLAN, Jan 05",H. C. King,['King (H. C.)'],,Jan 05,1905,
"King (H. Churchill)-Rational Living. Practical Inferences from Modern Psychology. Cr. 8vo. 7×5, pp. 290, 58. net.........MACMILLAN, Nov. 05",King,H. Churchill,Rational Living,MACMILLAN,,8vo.,"King (H. Churchill)-Rational Living. Practical Inferences from Modern Psychology. Cr. 8vo. 7×5, pp. 290, 58. net.........MACMILLAN, Nov. 05",H. Churchill King,['King (H. Churchill)'],,Nov. 05,1905,
"Kingsley (C.)-Heroes. Told to the children by Mary Macgregor. Pictures by Rose Le Quesne. 16mo. 6 x 4, pp. 128, 1s. net; gilt, 1s. 6d. net (Told to the Children Series) ………………………..JACK, Aug. 05",Kingsley,C.,Heroes,JACK,,16mo.,"Kingsley (C.)-Heroes. Told to the children by Mary Macgregor. Pictures by Rose Le Quesne. 16mo. 6 x 4, pp. 128, 1s. net; gilt, 1s. 6d. net (Told to the Children Series) ………………………..JACK, Aug. 05",C. Kingsley,['Kingsley (C.)'],,Aug. 05,1905,
"Kingsley (C.)-Water-Babies. Fairy Tale for a Land-Baby. Illas. New edit. cr. 8vo. 7 × 43, pp. 286, 1s. 6d………………………….. ....ROUTLEDGE, May 05",Kingsley,C.,Water-Babies,ROUTLEDGE,,8vo.,"Kingsley (C.)-Water-Babies. Fairy Tale for a Land-Baby. Illas. New edit. cr. 8vo. 7 × 43, pp. 286, 1s. 6d………………………….. ....ROUTLEDGE, May 05",C. Kingsley,['Kingsley (C.)'],,May 05,1905,
"Kingsley (C.)-Water-Babies. 18mo. 6d. net. (Cameo Classics) .........LIBRARY PRESS, June 05",Kingsley,C.,Water-Babies,LIBRARY PRESS,,18mo.,"Kingsley (C.)-Water-Babies. 18mo. 6d. net. (Cameo Classics) .........LIBRARY PRESS, June 05",C. Kingsley,['Kingsley (C.)'],,June 05,1905,
"Kingsley (C.)-Westward Ho! New edit. Cr. 8vo. 2s. ………………………………..ROUTLEDGE, Nov. 05",Kingsley,C.,Westward Ho! New edit,ROUTLEDGE,,8vo.,"Kingsley (C.)-Westward Ho! New edit. Cr. 8vo. 2s. ………………………………..ROUTLEDGE, Nov. 05",C. Kingsley,['Kingsley (C.)'],,Nov. 05,1905,
"Kingston (W. H. G.)-Three Midshipmen. 8 coloured illus. 8vo. 8×5, pp. 336, 1s. 6d. ; ditto, cr. 8vo........... W. COLLINS, Jan. 05",Kingston,W. H. G.,Three Midshipmen,W. COLLINS,,8vo.,"Kingston (W. H. G.)-Three Midshipmen. 8 coloured illus. 8vo. 8×5, pp. 336, 1s. 6d. ; ditto, cr. 8vo........... W. COLLINS, Jan. 05",W. H. G. Kingston,['Kingston (W. H. G.)'],,Jan. 05,1905,
"Kipps, Wells (H. G.) 6s. Kirby (M.)-From East to West. Cr. 8vo. 3s. 6d. net........... …………..K. PAUL, Apr. 05","Kipps, Wells",H. G.,,K. PAUL,,8vo.,"Kipps, Wells (H. G.) 6s. Kirby (M.)-From East to West. Cr. 8vo. 3s. 6d. net........... …………..K. PAUL, Apr. 05","H. G. Kipps, Wells","['Kipps, Wells (H. G.)']",,Apr. 05,1905,
"Kirkman (F. B.)-La Première Année de Français. A Day in Paris. 12mo. 7 × 43, pp. 206, …………………………..BLACK, Aug. 05",Kirkman,F. B.,La Première Année de Français,BLACK,,12mo.,"Kirkman (F. B.)-La Première Année de Français. A Day in Paris. 12mo. 7 × 43, pp. 206, …………………………..BLACK, Aug. 05",F. B. Kirkman,['Kirkman (F. B.)'],,Aug. 05,1905,
"Klein (F.)-In the Land of the Strenuous Life. Author's transl. from French. 12 portr. 2 oth. illus. 8vo. 9 × 5, pp. 408, $2 - (Chicago) A. C. MCCLURG, Oct. 05",Klein,F.,In the Land of the Strenuous Life,A. C. MCCLURG,,8vo.,"Klein (F.)-In the Land of the Strenuous Life. Author's transl. from French. 12 portr. 2 oth. illus. 8vo. 9 × 5, pp. 408, $2 - (Chicago) A. C. MCCLURG, Oct. 05",F. Klein,['Klein (F.)'],,Oct. 05,1905,
"Knight (A. M.)-Modern Seamanship. 3rd edit. 8vo. 258. net ....K. PAUL, Sep. 05",Knight,A. M.,Modern Seamanship,K. PAUL,,8vo.,"Knight (A. M.)-Modern Seamanship. 3rd edit. 8vo. 258. net ....K. PAUL, Sep. 05",A. M. Knight,['Knight (A. M.)'],,Sep. 05,1905,
"Knowles (R. E.)-St. Cuthbert's of the West. Novel. Ex. cr. 8vo. 8 × 51, pp. 318, 6s. 8vo. OLIPHANT, Oct. 05",Knowles,R. E.,St,OLIPHANT,,8vo.,"Knowles (R. E.)-St. Cuthbert's of the West. Novel. Ex. cr. 8vo. 8 × 51, pp. 318, 6s. 8vo. OLIPHANT, Oct. 05",R. E. Knowles,['Knowles (R. E.)'],,Oct. 05,1905,
"Knox (A.)-Grace of Sacraments Treatises on Baptism and the Eucharist (1737-1831). Edit. with Preface by William Dalrymple Maclagan. Cr. 8vo. 5s. net …………………………………….. LONGMANS, Feb. 05",Knox,A.,Grace of Sacraments Treatises on Baptism and the Eucharist ,LONGMANS,,8vo.,"Knox (A.)-Grace of Sacraments Treatises on Baptism and the Eucharist (1737-1831). Edit. with Preface by William Dalrymple Maclagan. Cr. 8vo. 5s. net …………………………………….. LONGMANS, Feb. 05",A. Knox,['Knox (A.)'],,Feb. 05,1905,
"Knox (J.)-History of Reformation of Religion in Scotland. Knox's Confession and the Book of Discipline. Twentieth century edit., rev. and edit. by Cuthbert Lennox. 8vo. 8×6, pp. 448, 4s. 6d. net….……………. .A. MELROSE, Mar. 05",Knox,J.,History of Reformation of Religion in Scotland,A. MELROSE,,8vo.,"Knox (J.)-History of Reformation of Religion in Scotland. Knox's Confession and the Book of Discipline. Twentieth century edit., rev. and edit. by Cuthbert Lennox. 8vo. 8×6, pp. 448, 4s. 6d. net….……………. .A. MELROSE, Mar. 05",J. Knox,['Knox (J.)'],,Mar. 05,1905,
