entry,last_name,first_name,title,publisher,price,price_in_pounds,format,original_entry,author_name,creators,is_editor,date,is_net
"Preston (Anna)—The Record of a Silent Life. 8vo. 7* X5, pp. 332, 6s.-M. SECKER, Feb. 13",Preston,Anna,The Record of a Silent Life,M. SECKER,,0.0,8vo.,"Preston (Anna)—The Record of a Silent Life. 8vo. 7* X5, pp. 332, 65.-M. SECKER, Feb. 13",Anna Preston,['Preston (Anna)'],,Feb. 13,
"Preston (Chloë and Tom)—The Peek-a-Boos' holiday: drawn by C. P.; told by T. P. Re-issue. Oblong 4to. bds. 58. net FROWDE, Oct. 13",Preston,Chloë,The Peek-a-Boos' holiday: drawn by C. P.; told by T. P. Re-issue,FROWDE,,0.0,4to.,"Preston (Chloë and Tom)—The Peek-a-Boos' holiday: drawn by C. P.; told by T. P. Re-issue. Oblong 4to. bds. 58. net FROWDE, Oct. 13",Chloë Preston,"['Preston (Chloë)', 'Preston (Tom)']",,Oct. 13,
"Price of possession (The)-By the author of Improper Prue.” Pop. edit. Cr. 8vo., pp. 320, swd., is. net.... ...LONG, June 13",,,Price of possession (The)-By the author of Improper Prue,LONG,,0.0,8vo.,"Price of possession (The)-By the author of Improper Prue.” Pop. edit. Cr. 8vo., pp. 320, swd., is. net.... ...LONG, June 13",,,,June 13,
"Priest in love (A). By A. Wakened. Pop. edit. Cr. 8vo., pp. 256, swd. is, net H. L. ANGOLD, Nov. 13",Priest in love,A,By A. Wakened,H. L. ANGOLD,,0.0,8vo.,"Priest in love (A). By A. Wakened. Pop. edit. Cr. 8vo., pp. 256, swd. is, net H. L. ANGOLD, Nov. 13",A Priest in love,['Priest in love (A)'],,Nov. 13,
"Primrose (James)—Medieval Glasgow. 24 illus. Demy 8vo., pp. 290, 7s. 6d. net; also edit. de luxe, limited to 60 copies, 2iS. net MACLEHOSE, Feb. 13",Primrose,James,Medieval Glasgow,MACLEHOSE,,0.0,8vo.,"Primrose (James)—Medieval Glasgow. 24 illus. Demy 8vo., pp. 290, 75. 6d. net; also edit. de luxe, limited to 60 copies, 2iS. net MACLEHOSE, Feb. 13",James Primrose,['Primrose (James)'],,Feb. 13,
"Principal Drugs and their uses, by a Pharmacist. 16mo., limp, is, net SCIENTIFIC PRESS, Aug. 13",,,"Principal Drugs and their uses, by a Pharmacist",SCIENTIFIC PRESS,,0.0,16mo.,"Principal Drugs and their uses, by a Pharmacist. 16mo., limp, is, net SCIENTIFIC PRESS, Aug. 13",,,,Aug. 13,
"Printers' cost finding system (The) : as approved at the British Cost Congress. 1913. Explanation and specimen forms, &c. 4to., pp. 22, swd. 23. od. net FEDERATION OF MASTER PRINTERS OF U.K., May 13",,,Printers' cost finding system (The) : as approved at the British Cost Congress,FEDERATION OF MASTER PRINTERS OF U.K.,,0.0,4to.,"Printers' cost finding system (The) : as approved at the British Cost Congress. 1913. Explanation and specimen forms, &c. 4to., pp. 22, swd. 23. od. net FEDERATION OF MASTER PRINTERS OF U.K., May 13",,,,May 13,
"Prisons--Report of the Commissioners of Prisons and the Directors of Convict Prisons, with appendices, 1912-13. Part 1, 8d. ; part 2, iod. WYMAN, Oct. 13",,,"Prisons--Report of the Commissioners of Prisons and the Directors of Convict Prisons, with appendices",WYMAN,,0.0,,"Prisons--Report of the Commissioners of Prisons and the Directors of Convict Prisons, with appendices, 1912-13. Part 1, 8d. ; part 2, iod. WYMAN, Oct. 13",,,,Oct. 13,
"Pro Christo et ecclesia. Cr. 8vo., pp. 208, is. net (Macmillan's theological lib.) MACMILLAN, July 13",,,Pro Christo et ecclesia,MACMILLAN,,0.0,8vo.,"Pro Christo et ecclesia. Cr. 8vo., pp. 208, is. net (Macmillan's theological lib.) MACMILLAN, July 13",,,,July 13,
"Procter (C.)-An Innocent Judas. Cr. 8vo., (s. HEATH, CRANTON, Sep. 13",Procter,C.,An Innocent Judas,"HEATH, CRANTON",,0.0,8vo.,"Procter (C.)-An Innocent Judas. Cr. 8vo., (s. HEATH, CRANTON, Sep. 13",C. Procter,['Procter (C.)'],,Sep. 13,
"Production (Census of)-Rules, Dec. 14th, 1912, No. 1912, post free, 1}d.; Dec. 20th, 1912, No. 1913, Ild. (post free). ...WYMAN, Feb. 13",Production,Census of,"Rules, Dec",WYMAN,,0.0,,"Production (Census of)-Rules, Dec. 14th, 1912, No. 1912, post free, 1}d.; Dec. 20th, 1912, No. 1913, Ild. (post free). ...WYMAN, Feb. 13",Census of Production,['Production (Census of)'],,Feb. 13,
"Production (Census of) --Rules, Feb., 1 d. ; Rules, Jan., 1}d. (post free) . WYMAN, Mar. 13",Production,Census of,"Rules, Feb",WYMAN,,0.0,,"Production (Census of) --Rules, Feb., 1 d. ; Rules, Jan., 1}d. (post free) . WYMAN, Mar. 13",Census of Production,['Production (Census of)'],,Mar. 13,
"Property, its duties and rights: historically, philosophically and religiously regarded. Essays by various writers. 8vo. 84 X 51, pp. 218, 55, net MACMILLAN, Nov. 13",,,"Property, its duties and rights: historically, philosophically and religiously regarded",MACMILLAN,,0.0,8vo.,"Property, its duties and rights: historically, philosophically and religiously regarded. Essays by various writers. 8vo. 84 X 51, pp. 218, 55, net MACMILLAN, Nov. 13",,,,Nov. 13,
"Prosser (D. L.)—Thoughts at the preparation for Holy Communion. 12mo..64 x 47, pp. 54, s. net MOWBRAY, Oct. 13",Prosser,D. L.,Thoughts at the preparation for Holy Communion,MOWBRAY,,0.0,12mo.,"Prosser (D. L.)—Thoughts at the preparation for Holy Communion. 12mo..64 x 47, pp. 54, IS. net MOWBRAY, Oct. 13",D. L. Prosser,['Prosser (D. L.)'],,Oct. 13,
"Provincial self-government versus home rule. By an Irish Democrat. Cr. 8vo., pp. 128, swd. s, .PITMAN, Sep. 13",,,Provincial self-government versus home rule,PITMAN,,0.0,8vo.,"Provincial self-government versus home rule. By an Irish Democrat. Cr. 8vo., pp. 128, swd. IS, .PITMAN, Sep. 13",,,,Sep. 13,
"Psychology (The British Journal of) Fa. number ..CAMB. UNIV. PRESS, Mar., &c. 13",,,Psychology (The British Journal of) Fa,CAMB. UNIV. PRESS,,0.0,,"Psychology (The British Journal of) Fa. number ..CAMB. UNIV. PRESS, Mar., &c. 13",,,,"Mar., &c. 13",
"Public speaker's training course, Codling (G. B.) 2s. 6d. net.. Public speaking, Art of, Hughes (S. L.) 2s., is, net Public utility of museums : reprint of letters and leading articles in “ The Times,” &c., and of the official report of the debate in the House of Lords, April 29, 1913. 8vo. (Kingston-on-Thames) T. J. S. GU'ILFORD, July 13",,,"Public speaker's training course, Codling (G. B.)",T. J. S. GU'ILFORD,,0.0,8vo.,"Public speaker's training course, Codling (G. B.) 25. 6d. net.. Public speaking, Art of, Hughes (S. L.) 25., is, net Public utility of museums : reprint of letters and leading articles in “ The Times,” &c., and of the official report of the debate in the House of Lords, April 29, 1913. 8vo. (Kingston-on-Thames) T. J. S. GU'ILFORD, July 13",,,,July 13,
"Public Works Loan Board-38th annual report 1912-13. uid. WYMAN, Aug. 13",,,Public Works Loan Board,WYMAN,,0.0,,"Public Works Loan Board-38th annual report 1912-13. uid. WYMAN, Aug. 13",,,,Aug. 13,
"Punshon (E. R.)—The Wilderness lovers. Cr. 8vo. 73 X4, pp. 308, 68. HODDER & S., June 13",Punshon,E. R.,The Wilderness lovers,HODDER & S.,,0.0,8vo.,"Punshon (E. R.)—The Wilderness lovers. Cr. 8vo. 73 X4, pp. 308, 68. HODDER & S., June 13",E. R. Punshon,['Punshon (E. R.)'],,June 13,
"Puss in Boots. Illus. by H. M. Brock. 4to. swd. s. net WARNE, Oct. 13",,,Puss in Boots,WARNE,,0.0,4to.,"Puss in Boots. Illus. by H. M. Brock. 4to. swd. IS. net WARNE, Oct. 13",,,,Oct. 13,
"Putumayo red book (The). With an intro. an the real scandal of the Putumayo atrocities. Cr. 8vo., pp. 176, swd., is. net N. THOMSON, June 13",,,Putumayo red book (The),N. THOMSON,,0.0,8vo.,"Putumayo red book (The). With an intro. an the real scandal of the Putumayo atrocities. Cr. 8vo., pp. 176, swd., is. net N. THOMSON, June 13",,,,June 13,
"Queen Mary's Psalter: miniatures and drawings by an English artist of the 14th century; with intro. by Sir G. F. Warner. I bound, 455, net QUARITCH, July 13",,,Queen Mary's Psalter: miniatures and drawings by an English artist of the,QUARITCH,,0.0,,"Queen Mary's Psalter: miniatures and drawings by an English artist of the 14th century; with intro. by Sir G. F. Warner. I bound, 455, net QUARITCH, July 13",,,,July 13,
"Queen of the daisies. 4to., bds., is. PARTRIDGE, Sep. 13",,,Queen of the daisies,PARTRIDGE,,0.0,4to.,"Queen of the daisies. 4to., bds., is. PARTRIDGE, Sep. 13",,,,Sep. 13,
"Queer stories from “ Truth 19th ser. Cr. Evo., pp. 232, swd. is, net. ..OFFICE, June 13",,,Queer stories from “ Truth,OFFICE,,0.0,,"Queer stories from “ Truth 19th ser. Cr. Evo., pp. 232, swd. is, net. ..OFFICE, June 13",,,,June 13,
"Quiggin's Nautical almanac and tide tables, 1914. Cr. 8vo. swd. 6d. and is.....SIMPKIN, Oct, 13",,,Quiggin's Nautical almanac and tide tables,SIMPKIN,,0.0,8vo.,"Quiggin's Nautical almanac and tide tables, 1914. Cr. 8vo. swd. 6d. and is.....SIMPKIN, Oct, 13",,,,"Oct, 13",
"Quiller-Couch (Sir Arthur T.)- In powder and crinoline : old fairy tales, retold. Illus. by Kay Nielsen. 4to. Il} X83, pp. 164, and plates. HODDER & S., Oct. 13",Quiller-Couch,Sir Arthur T.,"In powder and crinoline : old fairy tales, retold",HODDER & S.,,0.0,4to.,"Quiller-Couch (Sir Arthur T.)- In powder and crinoline : old fairy tales, retold. Illus. by Kay Nielsen. 4to. Il} X83, pp. 164, and plates. HODDER & S., Oct. 13",Sir Arthur T. Quiller-Couch,['Quiller-Couch (Sir Arthur T.)'],,Oct. 13,
"Quinn (J. Henry)- Library cataloguing. Svo. 8X53, pp. 264, 58. net TRUSLOVE & HANSON, July 13",Quinn,J. Henry,Library cataloguing,TRUSLOVE & HANSON,,0.0,,"Quinn (J. Henry)- Library cataloguing. Svo. 8X53, pp. 264, 58. net TRUSLOVE & HANSON, July 13",J. Henry Quinn,['Quinn (J. Henry)'],,July 13,
"Raahauge (H. M.)-The Briton in Norway. Being pocket-interpreter and guide to Norway and its language, &c. Cr. 8vo., pp. 100, limp, is. net ..SIEGLE, H., May 13",Raahauge,H. M.,The Briton in Norway,"SIEGLE, H.",,0.0,8vo.,"Raahauge (H. M.)-The Briton in Norway. Being pocket-interpreter and guide to Norway and its language, &c. Cr. 8vo., pp. 100, limp, is. net ..SIEGLE, H., May 13",H. M. Raahauge,['Raahauge (H. M.)'],,May 13,
"Rae-Brown (Campbell)—The Great Newmarket mystery. Pop. edit. Cr. 8vo., pp. 288, is. net LONG, July 13",Rae-Brown,Campbell,The Great Newmarket mystery,LONG,,0.0,8vo.,"Rae-Brown (Campbell)—The Great Newmarket mystery. Pop. edit. Cr. 8vo., pp. 288, is. net LONG, July 13",Campbell Rae-Brown,['Rae-Brown (Campbell)'],,July 13,
"Rae-Brown (Campbell)—Kissing-Cup the second. Cr. 8vo., pp. 320, is, net ......LONG, Aug. 13",Rae-Brown,Campbell,Kissing-Cup the second,LONG,,0.0,8vo.,"Rae-Brown (Campbell)—Kissing-Cup the second. Cr. 8vo., pp. 320, is, net ......LONG, Aug. 13",Campbell Rae-Brown,['Rae-Brown (Campbell)'],,Aug. 13,
"Railway accidents and casualties- Summary of, in the United Kingdom (Quarterly) ea. about WYMAN, Ålar., &c. 13",,,"Railway accidents and casualties- Summary of, in the United Kingdom (Quarterly) ea",WYMAN,,0.0,,"Railway accidents and casualties- Summary of, in the United Kingdom (Quarterly) ea. about WYMAN, Ålar., &c. 13",,,,"Ålar., &c. 13",
"Railway accidents-General report upon acci- dents that have occured on Railways of the United Kingdom during 1912. 2}d. WYMAN, July 13",,,Railway accidents-General report upon acci- dents that have occured on Railways of the United Kingdom during,WYMAN,,0.0,,"Railway accidents-General report upon acci- dents that have occured on Railways of the United Kingdom during 1912. 2}d. WYMAN, July 13",,,,July 13,
"Railway and Canal Traffic Acts, 1854, 1873, 1888, and 1894 ; and other statutes. With the general rules of the Railway and Canal Com- mission. . WYMAN, June 13",,,Railway and Canal Traffic Acts,WYMAN,,0.0,,"Railway and Canal Traffic Acts, 1854, 1873, 1888, and 1894 ; and other statutes. With the general rules of the Railway and Canal Com- mission. . WYMAN, June 13",,,,June 13,
"Railway train book. Oblong 4to., 3s. 60. NISTER, Sep. 13",,,Railway train book,NISTER,,0.0,4to.,"Railway train book. Oblong 4to., 3s. 60. NISTER, Sep. 13",,,,Sep. 13,
"Railways in India-Administration report on, 1912. . WYMAN, Sep. 13",,,Railways in India-Administration report on,WYMAN,,0.0,,"Railways in India-Administration report on, 1912. . WYMAN, Sep. 13",,,,Sep. 13,
"Railways (State)—Return relating to railways in foreign countries and British Possessions in whole or part built or acquired by the Govern- ment. 7.d. . WYMAN, Sep. 13",Railways,State,Return relating to railways in foreign countries and British Possessions in whole or part built or acquired by the Govern- ment,WYMAN,,0.0,,"Railways (State)—Return relating to railways in foreign countries and British Possessions in whole or part built or acquired by the Govern- ment. 7.d. . WYMAN, Sep. 13",State Railways,['Railways (State)'],,Sep. 13,
"Ralph Roister Doister. With intro, and notes by C. G. Child. 12mo., s. 6(1. .... HARRAP, May 13",,,Ralph Roister Doister,HARRAP,,0.0,12mo.,"Ralph Roister Doister. With intro, and notes by C. G. Child. 12mo., IS. 6(1. .... HARRAP, May 13",,,,May 13,
"Ranger-Gull (C.)—The Parrot-faced man. 8vo. swd. od. .F. V. WHITE, Aug. 13",Ranger-Gull,C.,The Parrot-faced man,F. V. WHITE,,0.0,8vo.,"Ranger-Gull (C.)—The Parrot-faced man. 8vo. swd. od. .F. V. WHITE, Aug. 13",C. Ranger-Gull,['Ranger-Gull (C.)'],,Aug. 13,
"Ranke (Leopold von)- The History of the popes during the last four centuries. 3 vols, 12mo., pp. 566, 582, 512, ea. is. net (Bohn's popular lib.) BELL, Oct. 13",Ranke,Leopold von,The History of the popes during the last four centuries,BELL,,0.0,12mo.,"Ranke (Leopold von)- The History of the popes during the last four centuries. 3 vols, 12mo., pp. 566, 582, 512, ea. is. net (Bohn's popular lib.) BELL, Oct. 13",Leopold von Ranke,['Ranke (Leopold von)'],,Oct. 13,
"Rankin (H. A.) see Brown (F. H.) and Rankin. Rankin (William)—The Elements of bandaging and the treatment of fractures and dislocations. Cr. 8vo. 71 X41, pp. 126, 58. net (Oxford medical manuals). .FROWDE, Nov. 13",Rankin,H. A.,The Elements of bandaging and the treatment of fractures and dislocations,FROWDE,,0.0,8vo.,"Rankin (H. A.) see Brown (F. H.) and Rankin. Rankin (William)—The Elements of bandaging and the treatment of fractures and dislocations. Cr. 8vo. 71 X41, pp. 126, 58. net (Oxford medical manuals). .FROWDE, Nov. 13",H. A. Rankin,"['Rankin (H. A.)', 'Rankin (William)']",,Nov. 13,
"Rashdall (Canon)--Ethics. 12mo., 6d. net. (People's books) JACK, A pr. 13",Rashdall,Canon,Ethics,JACK,,0.0,12mo.,"Rashdall (Canon)--Ethics. 12mo., 6d. net. (People's books) JACK, A pr. 13",Canon Rashdall,['Rashdall (Canon)'],,A pr. 13,
"Rastall (R. H.) see Hatch (F. H.) and Rastali. Ratan (Devi) ed.---Thirty Indian songs from the Panjab Kashmir. With intro. and trans, by A. K. Coomaraswamy, and a foreword by Rabindranath Tagore. 2 plates. Small 4to. bds. 1 buckram, pp. 84, 1os. 60. LUZAC, Feb. 13",Rastall,R. H.,Thirty Indian songs from the Panjab Kashmir,LUZAC,,0.0,4to.,"Rastall (R. H.) see Hatch (F. H.) and Rastali. Ratan (Devi) ed.---Thirty Indian songs from the Panjab Kashmir. With intro. and trans, by A. K. Coomaraswamy, and a foreword by Rabindranath Tagore. 2 plates. Small 4to. bds. 1 buckram, pp. 84, 1os. 60. LUZAC, Feb. 13",R. H. Rastall,"['Rastall (R. H.)', 'Ratan (Devi)']",ed.,Feb. 13,
"Redwood (Sir B.) see also Thomson (J. H.) and Redwood. Redway (G. W.)-Wellington and Waterloo. 12mo., 6d. net. (People's books] .. JACK, Feb. 13",Redwood,Sir B.,Wellington and Waterloo,JACK,,0.0,12mo.,"Redwood (Sir B.) see also Thomson (J. H.) and Redwood. Redway (G. W.)-Wellington and Waterloo. 12mo., 6d. net. (People's books] .. JACK, Feb. 13",Sir B. Redwood,"['Redwood (Sir B.)', 'Redway (G. W.)']",,Feb. 13,
"Redwood (Ethel Boverton) Wanderings and wooings east of Suez. Cr. 8vo. 71 X5, pp. 224, ...LONG, June 13",Redwood,Ethel Boverton,Wanderings and wooings east of Suez,LONG,,0.0,8vo.,"Redwood (Ethel Boverton) Wanderings and wooings east of Suez. Cr. 8vo. 71 X5, pp. 224, ...LONG, June 13",Ethel Boverton Redwood,['Redwood (Ethel Boverton)'],,June 13,
"Reed (Myrtle)-Happy women. 8vo. 81 X5, pp. 206, ..PUTNAM, Nov. 13",Reed,Myrtle,Happy women,PUTNAM,,0.0,8vo.,"Reed (Myrtle)-Happy women. 8vo. 81 X5, pp. 206, ..PUTNAM, Nov. 13",Myrtle Reed,['Reed (Myrtle)'],,Nov. 13,
"Reed (Talbot Baines)—The Cock-house at Fells- garth. Cheaper re-issue. Cr. 8vo., pp. 312, s. .R.T.S., May 13",Reed,Talbot Baines,The Cock-house at Fells- garth,R.T.S.,,0.0,8vo.,"Reed (Talbot Baines)—The Cock-house at Fells- garth. Cheaper re-issue. Cr. 8vo., pp. 312, IS. .R.T.S., May 13",Talbot Baines Reed,['Reed (Talbot Baines)'],,May 13,
"Reed (Talbot Baines)—The Fifth form at St. Dominic's. Cheaper reissue. Cr. 8vo., pp: 316, s. net ..R.T.S., Apr. 13",Reed,Talbot Baines,The Fifth form at St,R.T.S.,,0.0,8vo.,"Reed (Talbot Baines)—The Fifth form at St. Dominic's. Cheaper reissue. Cr. 8vo., pp: 316, IS. net ..R.T.S., Apr. 13",Talbot Baines Reed,['Reed (Talbot Baines)'],,Apr. 13,
"Reed (Talbot Baines)— The Master of the Shell. Cheaper re-issue. Cr. 8vo., pp. 316, is. net R.T.S., May 13",Reed,Talbot Baines,The Master of the Shell,R.T.S.,,0.0,8vo.,"Reed (Talbot Baines)— The Master of the Shell. Cheaper re-issue. Cr. 8vo., pp. 316, is. net R.T.S., May 13",Talbot Baines Reed,['Reed (Talbot Baines)'],,May 13,
"Reed (Talbot Baines)—Roger Ingleton, minor. Cheaper reissue. Cr. 8vo., pp. 312, is. net R.T.S., Apr. 13",Reed,Talbot Baines,"Roger Ingleton, minor",R.T.S.,,0.0,8vo.,"Reed (Talbot Baines)—Roger Ingleton, minor. Cheaper reissue. Cr. 8vo., pp. 312, is. net R.T.S., Apr. 13",Talbot Baines Reed,['Reed (Talbot Baines)'],,Apr. 13,
"Reed (Talbot Baines)—Sir Ludar : a story of the days of the Great Queen Bess. Cheaper re- issue. Cr. 8vo., pp. 316, is. net R.T.S., Apr. 13",Reed,Talbot Baines,Sir Ludar : a story of the days of the Great Queen Bess,R.T.S.,,0.0,8vo.,"Reed (Talbot Baines)—Sir Ludar : a story of the days of the Great Queen Bess. Cheaper re- issue. Cr. 8vo., pp. 316, is. net R.T.S., Apr. 13",Talbot Baines Reed,['Reed (Talbot Baines)'],,Apr. 13,
"Reed (Talbot Baines)-The Willoughby captains. Cr. 8vo., pp. 446, is. net (Boys' new library) FROWDE, July 13",Reed,Talbot Baines,The Willoughby captains,FROWDE,,0.0,8vo.,"Reed (Talbot Baines)-The Willoughby captains. Cr. 8vo., pp. 446, is. net (Boys' new library) FROWDE, July 13",Talbot Baines Reed,['Reed (Talbot Baines)'],,July 13,
"Reed's Plan and chart work: required for the Board of Trade examinations of masters, first and second mates. 8vo., pp. 104, swd., is, net SIMPKIN, June 13",,,"Reed's Plan and chart work: required for the Board of Trade examinations of masters, first and second mates",SIMPKIN,,0.0,8vo.,"Reed's Plan and chart work: required for the Board of Trade examinations of masters, first and second mates. 8vo., pp. 104, swd., is, net SIMPKIN, June 13",,,,June 13,
"Reflections of a bachelor. 8vo. 6 X 4, in envelope. is. net. (Delraine edit. I) SIEGLE, H., Oct. 13",,,Reflections of a bachelor,"SIEGLE, H.",,0.0,8vo.,"Reflections of a bachelor. 8vo. 6 X 4, in envelope. is. net. (Delraine edit. I) SIEGLE, H., Oct. 13",,,,Oct. 13,
"Reformatory and industrial schools Report. s. WYMAN, June 13",,,Reformatory and industrial schools Report,WYMAN,,0.0,,"Reformatory and industrial schools Report. IS. WYMAN, June 13",,,,June 13,
"Reformatory and Industrial Schools of Ireland - 51st report, 1912. 6 d. WYMAN, Oct. 13",,,Reformatory and Industrial Schools of Ireland -,WYMAN,,0.0,,"Reformatory and Industrial Schools of Ireland - 51st report, 1912. 6 d. WYMAN, Oct. 13",,,,Oct. 13,
"Regents Quadrant Committee-Report, 1ļd. (post free). . WYMAN, Áfar. 13",,,Regents Quadrant Committee-Report,WYMAN,,0.0,,"Regents Quadrant Committee-Report, 1ļd. (post free). . WYMAN, Áfar. 13",,,,Áfar. 13,
"Regesta Regum Anglo-Normannorum, 1066-1154. Vol. 1: Regesta Willelmi Conquestoris et Willelmi Rufi, 1066-1100. Edit., with intro., notes and indexes, by H. W. C. Davies and R. J. Whitwell. Imp. 8vo., pp. 204, 15s. net (Clarendon Press), MILFORD, July 13",,,Regesta Regum Anglo-Normannorum,MILFORD,,0.0,8vo.,"Regesta Regum Anglo-Normannorum, 1066-1154. Vol. 1: Regesta Willelmi Conquestoris et Willelmi Rufi, 1066-1100. Edit., with intro., notes and indexes, by H. W. C. Davies and R. J. Whitwell. Imp. 8vo., pp. 204, 155. net (Clarendon Press), MILFORD, July 13",,,,July 13,
"Reid (Robert)-Letters to my mother. Cr. 8vo, pp. 76, swd. is. net ...G. ALLEN, Feb. 13",Reid,Robert,Letters to my mother,G. ALLEN,,0.0,"8vo,","Reid (Robert)-Letters to my mother. Cr. 8vo, pp. 76, swd. is. net ...G. ALLEN, Feb. 13",Robert Reid,['Reid (Robert)'],,Feb. 13,
"Re-incarnation and Christianity; by a clergyman of the Church of England. 2nd edit. Cr. 8vo. 73 X 44, pp. 96, is. net...... W. RIDER, June 13",,,Re-incarnation and Christianity; by a clergyman of the Church of England,W. RIDER,,0.0,8vo.,"Re-incarnation and Christianity; by a clergyman of the Church of England. 2nd edit. Cr. 8vo. 73 X 44, pp. 96, is. net...... W. RIDER, June 13",,,,June 13,
"Rendall (Gerald 11,)-Ways of consecration. 12m0., pp. 48, s.... .S. P. C. K., Feb. 13",Rendall,"Gerald 11,",Ways of consecration,S. P. C. K.,,0.0,,"Rendall (Gerald 11,)-Ways of consecration. 12m0., pp. 48, IS.... .S. P. C. K., Feb. 13","Gerald 11, Rendall","['Rendall (Gerald 11,)']",,Feb. 13,
"Respective standpoints of psychology and logic (The). Philosophic studies issued under the direction of the Department of Philosophy of the University of Chicago, No. 4. Ryl. 8vo. swd., pp. 80, 28. net CAMB. UNIV. PRESS, July 13",,,Respective standpoints of psychology and logic (The),CAMB. UNIV. PRESS,,0.0,8vo.,"Respective standpoints of psychology and logic (The). Philosophic studies issued under the direction of the Department of Philosophy of the University of Chicago, No. 4. Ryl. 8vo. swd., pp. 80, 28. net CAMB. UNIV. PRESS, July 13",,,,July 13,
"Retour du Flot; by “ Brada. 18mo. 67 41, pp. 278, is. net NELSON, Aug. 13",,,Retour du Flot; by “ Brada,NELSON,,0.0,18mo.,"Retour du Flot; by “ Brada. 18mo. 67 41, pp. 278, is. net NELSON, Aug. 13",,,,Aug. 13,
"Retz (Cardinal de)-Mémoires. 12mo., pp. 174, s. net.. DENT, Mar. 13",Retz,Cardinal de,Mémoires,DENT,,0.0,12mo.,"Retz (Cardinal de)-Mémoires. 12mo., pp. 174, IS. net.. DENT, Mar. 13",Cardinal de Retz,['Retz (Cardinal de)'],,Mar. 13,
"Reveries of a bachelor girl. 8vo. 6 X 4, in enve- lope is. net (Delraine edit., 2) SIEGLE, H., Oct. 13",,,Reveries of a bachelor girl,"SIEGLE, H.",,0.0,8vo.,"Reveries of a bachelor girl. 8vo. 6 X 4, in enve- lope is. net (Delraine edit., 2) SIEGLE, H., Oct. 13",,,,Oct. 13,
"Revised versions : quips and oddities; by V. E. X. 2nd series. 8vo. 64 X5, pp. 56, swd. is. net...... (Edinburgh) HILLSIDE PRESS, Feb. 13",,,Revised versions : quips and oddities; by V. E. X,HILLSIDE PRESS,,0.0,8vo.,"Revised versions : quips and oddities; by V. E. X. 2nd series. 8vo. 64 X5, pp. 56, swd. is. net...... (Edinburgh) HILLSIDE PRESS, Feb. 13",,,,Feb. 13,
"RHODES Revolving star map (The) : with movable declina. tion scale. 4to., is. net ....SIMPKIN, Dec. 13",,,RHODES Revolving star map (The) : with movable declina,SIMPKIN,,0.0,4to.,"RHODES Revolving star map (The) : with movable declina. tion scale. 4to., is. net ....SIMPKIN, Dec. 13",,,,Dec. 13,
"Reynolds (Mrs. Baillie)—Nigel Ferrard. 8vo. 60. swd. ..NEWNES, July 13",Reynolds,Mrs. Baillie,Nigel Ferrard,NEWNES,,0.0,8vo.,"Reynolds (Mrs. Baillie)—Nigel Ferrard. 8vo. 60. swd. ..NEWNES, July 13",Mrs. Baillie Reynolds,['Reynolds (Mrs. Baillie)'],,July 13,
"Reynolds (F. R.) and Waller (H. J.)--Jesus the hero. 12mo., pp. 136, 1s. 6d. net; limp, is. net (Teachers and taught). .HEADLEY, Oct. 13",Reynolds,F. R.,Jesus the hero,HEADLEY,,0.0,12mo.,"Reynolds (F. R.) and Waller (H. J.)--Jesus the hero. 12mo., pp. 136, Is. 6d. net; limp, is. net (Teachers and taught). .HEADLEY, Oct. 13",F. R. Reynolds,"['Reynolds (F. R.)', 'Waller (H. J.)']",,Oct. 13,
"Reynolds (S. L.)-Eric: called to be saint. Čr. 8vo, cloth od. net JEWISH CONVERTS' INST., Jan. 13",Reynolds,S. L.,Eric: called to be saint,JEWISH CONVERTS' INST.,,0.0,"8vo,","Reynolds (S. L.)-Eric: called to be saint. Čr. 8vo, cloth od. net JEWISH CONVERTS' INST., Jan. 13",S. L. Reynolds,['Reynolds (S. L.)'],,Jan. 13,
"Rhoades (H. T.)-A Handbook to Rugby School Chapel. 3rd edit. 8vo. 9 X6), pp. 54 (Rugby) G. E. OVER, Nov. 13",Rhoades,H. T.,A Handbook to Rugby School Chapel,G. E. OVER,,0.0,8vo.,"Rhoades (H. T.)-A Handbook to Rugby School Chapel. 3rd edit. 8vo. 9 X6), pp. 54 (Rugby) G. E. OVER, Nov. 13",H. T. Rhoades,['Rhoades (H. T.)'],,Nov. 13,
"Rhodes (James)-Income tax assessments : practical guide. Rev. edit. 8vo., pp. 64, swd., s. net..... . SIMPKIN, Oct. 13",Rhodes,James,Income tax assessments : practical guide,SIMPKIN,,0.0,8vo.,"Rhodes (James)-Income tax assessments : practical guide. Rev. edit. 8vo., pp. 64, swd., IS. net..... . SIMPKIN, Oct. 13",James Rhodes,['Rhodes (James)'],,Oct. 13,
"Rhodesia, Children of, Baker (H. J.) is, 6d. Rhodesia, Northern-New Customs tariff, 1913, 3fd. (post free) ... . WYMAN, Mar. 13",,,"Rhodesia, Children of, Baker (H. J.) is",WYMAN,,0.0,,"Rhodesia, Children of, Baker (H. J.) is, 6d. Rhodesia, Northern-New Customs tariff, 1913, 3fd. (post free) ... . WYMAN, Mar. 13",,,,Mar. 13,
"Rhys (Ernest)-Lyric poetry. 8vo. 8 X5), pp. 384. 5s. net. (Channels of English literature) DENT, Sep. 13",Rhys,Ernest,Lyric poetry,DENT,,0.0,8vo.,"Rhys (Ernest)-Lyric poetry. 8vo. 8 X5), pp. 384. 55. net. (Channels of English literature) DENT, Sep. 13",Ernest Rhys,['Rhys (Ernest)'],,Sep. 13,
"Rhys (Ernest and Grace) - English fairy tales. Illus. Ryl. 16mo., 71 X 51, pp. 128, is. 6d. net. (Tales for children) .DENT, Oct, 13",Rhys,Ernest,English fairy tales,DENT,,0.0,16mo.,"Rhys (Ernest and Grace) - English fairy tales. Illus. Ryl. 16mo., 71 X 51, pp. 128, is. 6d. net. (Tales for children) .DENT, Oct, 13",Ernest Rhys,"['Rhys (Ernest)', 'Rhys (Grace)']",,"Oct, 13",
