entry,last_name,first_name,title,publisher,price,format,original_entry,author_name,creators,is_editor,date,catalogue_year,is_net
"Coulton (G. G.)-Guelf and Ghibelline. Dante Illustrations from the Autobiography of Brother Salimbene of Parma. 8vo. pp. 16, swd. 18. net (Medieval Studies) ...... ……………………………….SIMPKIN, Aug. 05",Coulton,G. G.,Guelf and Ghibelline,SIMPKIN,,8vo.,"Coulton (G. G.)-Guelf and Ghibelline. Dante Illustrations from the Autobiography of Brother Salimbene of Parma. 8vo. pp. 16, swd. 18. net (Medieval Studies) ...... ……………………………….SIMPKIN, Aug. 05",G. G. Coulton,['Coulton (G. G.)'],,Aug. 05,1905,
"Coulton (G. G.)-Monastic Legend. Criticism of Abbot Gasquet's 'Henry VIII. and the English Monasteries.' 8vo., pp. 20, swd. 18. net (Medieval Studies) ……..SIMPKIN, July 05",Coulton,G. G.,Monastic Legend,SIMPKIN,,8vo.,"Coulton (G. G.)-Monastic Legend. Criticism of Abbot Gasquet's 'Henry VIII. and the English Monasteries.' 8vo., pp. 20, swd. 18. net (Medieval Studies) ……..SIMPKIN, July 05",G. G. Coulton,['Coulton (G. G.)'],,July 05,1905,
"County Cricket Scoring Book, with Revised Rules of the Game. 16 matches, 1s.; 8 matches, 6d. 4to. ..DEAN, Mar. 05",,,"County Cricket Scoring Book, with Revised Rules of the Game",DEAN,,4to.,"County Cricket Scoring Book, with Revised Rules of the Game. 16 matches, 1s.; 8 matches, 6d. 4to. ..DEAN, Mar. 05",,,,Mar. 05,1905,
"Cowan (H.)-John Knox, Hero of the Scottish Reformation. Cr. 8vo. 7×51, pp. 488, 68. (Heroes of the Reformation)...PUTNAM, June 05",Cowan,H.,"John Knox, Hero of the Scottish Reformation",PUTNAM,,8vo.,"Cowan (H.)-John Knox, Hero of the Scottish Reformation. Cr. 8vo. 7×51, pp. 488, 68. (Heroes of the Reformation)...PUTNAM, June 05",H. Cowan,['Cowan (H.)'],,June 05,1905,
"Cows, Walker (John) 18. net........... Cox (E. C., Sir)-John Carruthers: Indian Police- Cr. 8vo. 7 x 5, pp. 288, 3s. 6d. man. CASSELL, Oct. 05","Cows, Walker",John,,CASSELL,,8vo.,"Cows, Walker (John) 18. net........... Cox (E. C., Sir)-John Carruthers: Indian Police- Cr. 8vo. 7 x 5, pp. 288, 3s. 6d. man. CASSELL, Oct. 05","John Cows, Walker","['Cows, Walker (John)']",,Oct. 05,1905,
"Cox (G. W., Sir)-Little Cyclopædia of Common Things. Illus. 12th edit. 8vo. 9 × 5, pp. 664, 28. 6d. net ………………………………………..SONNENSCHEIN, Nov. 05",Cox,"G. W., Sir",Little Cyclopædia of Common Things,SONNENSCHEIN,,8vo.,"Cox (G. W., Sir)-Little Cyclopædia of Common Things. Illus. 12th edit. 8vo. 9 × 5, pp. 664, 28. 6d. net ………………………………………..SONNENSCHEIN, Nov. 05","G. W., Sir Cox","['Cox (G. W., Sir)']",,Nov. 05,1905,
"Craig (E. Gordon)-Art of the Theatre. With Intro. and a Pref. by R. Graham Robertson. 4to. swd. 1s. net....... ……………………..FOULIS, Oct. 05",Craig,E. Gordon,Art of the Theatre,FOULIS,,4to.,"Craig (E. Gordon)-Art of the Theatre. With Intro. and a Pref. by R. Graham Robertson. 4to. swd. 1s. net....... ……………………..FOULIS, Oct. 05",E. Gordon Craig,['Craig (E. Gordon)'],,Oct. 05,1905,
"Crane (S.)-Wounds in the Rain. Collection of Stories relating to Spanish-American War of 1898. Ch. issue. Cr. 8vo. 73 × 4, pp. 856, 18. net METHUEN, Sep. 05",Crane,S.,Wounds in the Rain,METHUEN,,8vo.,"Crane (S.)-Wounds in the Rain. Collection of Stories relating to Spanish-American War of 1898. Ch. issue. Cr. 8vo. 73 × 4, pp. 856, 18. net METHUEN, Sep. 05",S. Crane,['Crane (S.)'],,Sep. 05,1905,
"Cranford (Hope)-1da Llymond and her Hour of Vision. Cr. 8vo. 7 x 4, pp. 804, 68. SKEFFINGTON, Nov. 05",Cranford,Hope,,SKEFFINGTON,,8vo.,"Cranford (Hope)-Ida Llymond and her Hour of Vision. Cr. 8vo. 7 x 4, pp. 804, 68. SKEFFINGTON, Nov. 05",Hope Cranford,['Cranford (Hope)'],,Nov. 05,1905,
"Creed of Christ. Cr. 8vo. 73 × 43, pp. 226, 58. net LANE, Apr. 05",,,Creed of Christ,LANE,,8vo.,"Creed of Christ. Cr. 8vo. 73 × 43, pp. 226, 58. net LANE, Apr. 05",,,,Apr. 05,1905,
"Creevey Papers (The)-Selection from Corre- spondence and Diaries of the late Thomas Creevey, M.P., born 1768, died 1838. Edit. by Rt. Hon. Sir Herbert Maxwell. Ports. 3rd edit. 8vo. 9 × 53, pp. 742, 10s. 6d. net 18. J. MURRAY, Nov. 05",,,"Creevey Papers (The)-Selection from Corre- spondence and Diaries of the late Thomas Creevey, M.P., born",J. MURRAY,,8vo.,"Creevey Papers (The)-Selection from Corre- spondence and Diaries of the late Thomas Creevey, M.P., born 1768, died 1838. Edit. by Rt. Hon. Sir Herbert Maxwell. Ports. 3rd edit. 8vo. 9 × 53, pp. 742, 10s. 6d. net 18. J. MURRAY, Nov. 05",,,,Nov. 05,1905,
"Crockett (S. R.)-Cleg Kelly, Arab of the City. 8vo. swd. 6d. ………………………..PEARSON, July 05",Crockett,S. R.,"Cleg Kelly, Arab of the City",PEARSON,,8vo.,"Crockett (S. R.)-Cleg Kelly, Arab of the City. 8vo. swd. 6d. ………………………..PEARSON, July 05",S. R. Crockett,['Crockett (S. R.)'],,July 05,1905,
"Crockett (S. R.)-Stickit Minister and Some Common Men. 20th edit. Cr. 8vo. 7 x 4, pp. 292, 18. net ....UNWIN, Feb. 05",Crockett,S. R.,Stickit Minister and Some Common Men,UNWIN,,8vo.,"Crockett (S. R.)-Stickit Minister and Some Common Men. 20th edit. Cr. 8vo. 7 x 4, pp. 292, 18. net ....UNWIN, Feb. 05",S. R. Crockett,['Crockett (S. R.)'],,Feb. 05,1905,
"New impr. cr. 8vo. ……………………..CHATTO, May 05",,,New impr,CHATTO,,8vo.,"New impr. cr. 8vo. ……………………..CHATTO, May 05",,,,May 05,1905,
"Croker (B. M.)-Old Cantonment. Other Stories of India and elsewhere. Cr. 8vo. 74 × 5, pp. 302, METHUEN, Mar. 05",Croker,B. M.,Old Cantonment,METHUEN,,8vo.,"Croker (B. M.)-Old Cantonment. Other Stories of India and elsewhere. Cr. 8vo. 74 × 5, pp. 302, METHUEN, Mar. 05",B. M. Croker,['Croker (B. M.)'],,Mar. 05,1905,
"Crosland (T. W. H.)-Suburbans. Cr. 8vo. 7×5, pp. 208, 5s. …………………………………..LONG, July 05",Crosland,T. W. H.,Suburbans,LONG,,8vo.,"Crosland (T. W. H.)-Suburbans. Cr. 8vo. 7×5, pp. 208, 5s. …………………………………..LONG, July 05",T. W. H. Crosland,['Crosland (T. W. H.)'],,July 05,1905,
"Crowley (J. J.)-Parochial School, a Curse to the Church, a Menace to the Nation. Cr. 8vo. pp. ...(Chicago) AUTHOR, Jan. 05",Crowley,J. J.,"Parochial School, a Curse to the Church, a Menace to the Nation",AUTHOR,,8vo.,"Crowley (J. J.)-Parochial School, a Curse to the Church, a Menace to the Nation. Cr. 8vo. pp. ...(Chicago) AUTHOR, Jan. 05",J. J. Crowley,['Crowley (J. J.)'],,Jan. 05,1905,
"Cumberland (Stuart)-People I have Read. Pop. edit. Cr. 8vo. 8 x 5, pp. 192, 2s. 6d. net; swd. 18. ..PEARSON, Nov. 05",Cumberland,Stuart,People I have Read,PEARSON,,8vo.,"Cumberland (Stuart)-People I have Read. Pop. edit. Cr. 8vo. 8 x 5, pp. 192, 2s. 6d. net; swd. 18. ..PEARSON, Nov. 05",Stuart Cumberland,['Cumberland (Stuart)'],,Nov. 05,1905,
"Cunningham (J. F.)-Uganda and its Peoples. Notes on Protectorate of Uganda, especially Anthropology and Ethnology of its Indigenous Races. Pref. by Sir Harry Johnston. Illus. Imp. 8vo. 10 × 74, pp. 400, 24s. net - HUTCHINSON, Feb. 05",Cunningham,J. F.,Uganda and its Peoples,HUTCHINSON,,8vo.,"Cunningham (J. F.)-Uganda and its Peoples. Notes on Protectorate of Uganda, especially Anthropology and Ethnology of its Indigenous Races. Pref. by Sir Harry Johnston. Illus. Imp. 8vo. 10 × 74, pp. 400, 24s. net - HUTCHINSON, Feb. 05",J. F. Cunningham,['Cunningham (J. F.)'],,Feb. 05,1905,
"Cunnington (H. J.)-Account of Charities and Charitable Benefactions of Braintree. 8vo. 58. E. STOCK, Jan. 05",Cunnington,H. J.,Account of Charities and Charitable Benefactions of Braintree,E. STOCK,,8vo.,"Cunnington (H. J.)-Account of Charities and Charitable Benefactions of Braintree. 8vo. 58. E. STOCK, Jan. 05",H. J. Cunnington,['Cunnington (H. J.)'],,Jan. 05,1905,
"Cupples (G.)-Adventures of a Naval Lieutenant, or The Green Hand. New edit. Cr. 8vo. 28. ROUTLEDGE, Nov. 05",Cupples,G.,"Adventures of a Naval Lieutenant, or The Green Hand",ROUTLEDGE,,8vo.,"Cupples (G.)-Adventures of a Naval Lieutenant, or The Green Hand. New edit. Cr. 8vo. 28. ROUTLEDGE, Nov. 05",G. Cupples,['Cupples (G.)'],,Nov. 05,1905,
"Curme (G. O.)-Grammar of the German Lan- guage. 8vo. 15s. net. …………………..MACMILLAN, June 05",Curme,G. O.,Grammar of the German Lan- guage,MACMILLAN,,8vo.,"Curme (G. O.)-Grammar of the German Lan- guage. 8vo. 15s. net. …………………..MACMILLAN, June 05",G. O. Curme,['Curme (G. O.)'],,June 05,1905,
"Curse, Dene (Roma) 3s. 6d. Curties (H.)-1dol of the King. Romance. Cr. 8vo. 73 × 43, pp. 344, 68. HUTCHINSON, Oct. 05","Curse, Dene",Roma,,HUTCHINSON,,8vo.,"Curse, Dene (Roma) 3s. 6d. Curties (H.)-Idol of the King. Romance. Cr. 8vo. 73 × 43, pp. 344, 68. HUTCHINSON, Oct. 05","Roma Curse, Dene","['Curse, Dene (Roma)']",,Oct. 05,1905,
"Cust (L.)-Anthony Van Dyck. Historical Study of his Life and Works. New edit. Folio, 428. net BELL, Oct. 05",Cust,L.,Anthony Van Dyck,BELL,,,"Cust (L.)-Anthony Van Dyck. Historical Study of his Life and Works. New edit. Folio, 428. net BELL, Oct. 05",L. Cust,['Cust (L.)'],,Oct. 05,1905,
"Cuthbertson (C.)-On Refractive Indices of the Elements. 4to. pp. 26, swd. 18. DULAU, Mar. 05",Cuthbertson,C.,On Refractive Indices of the Elements,DULAU,,4to.,"Cuthbertson (C.)-On Refractive Indices of the Elements. 4to. pp. 26, swd. 18. DULAU, Mar. 05",C. Cuthbertson,['Cuthbertson (C.)'],,Mar. 05,1905,
"Cutler (J. E.)-Lynch Law: Investigation into History of Lynching in United States. Cr. 8vo. 69. net.... LONGMANS, June 05",Cutler,J. E.,Lynch Law: Investigation into History of Lynching in United States,LONGMANS,,8vo.,"Cutler (J. E.)-Lynch Law: Investigation into History of Lynching in United States. Cr. 8vo. 69. net.... LONGMANS, June 05",J. E. Cutler,['Cutler (J. E.)'],,June 05,1905,
"Cyprus-Sums Paid, Voted, Surplus, &c., d. WYMAN, Aug. 05",,,"Cyprus-Sums Paid, Voted, Surplus, &c",WYMAN,,,"Cyprus-Sums Paid, Voted, Surplus, &c., d. WYMAN, Aug. 05",,,,Aug. 05,1905,
"D. (M. Le M.)-Communion with God; or, Morn- ing and Evening Prayers for a Month. For private use. Pref. by John Dawson. 3rd edit. 16mo. 54 × 44, pp. 140, 18. net ...THYNNE, Apr. 05",D.,M. Le M.,"Communion with God; or, Morn- ing and Evening Prayers for a Month",THYNNE,,16mo.,"D. (M. Le M.)-Communion with God; or, Morn- ing and Evening Prayers for a Month. For private use. Pref. by John Dawson. 3rd edit. 16mo. 54 × 44, pp. 140, 18. net ...THYNNE, Apr. 05",M. Le M. D.,['D. (M. Le M.)'],,Apr. 05,1905,
"Daily Light on the Daily Path. Devotional Text- book for Every Day, in the very words of Scripture. Morning and Evening Hour. 16mo. 5 × 4, 28. net BAGSTER, July 05",,,Daily Light on the Daily Path,BAGSTER,,16mo.,"Daily Light on the Daily Path. Devotional Text- book for Every Day, in the very words of Scripture. Morning and Evening Hour. 16mo. 5 × 4, 28. net BAGSTER, July 05",,,,July 05,1905,
"Daily Needs. Selected by 11th edit. 16mo. 6 × 41, ...........METHUEN, Apr. 05",,,Daily Needs,METHUEN,,16mo.,"Daily Needs. Selected by 11th edit. 16mo. 6 × 41, ...........METHUEN, Apr. 05",,,,Apr. 05,1905,
"Dale (J. B.)-Logarithmic and Trigonometric Tables (to five places of decimals). 8vo. 28. net E. ARNOLD, Jan. 05",Dale,J. B.,Logarithmic and Trigonometric Tables (to five places of decimals),E. ARNOLD,,8vo.,"Dale (J. B.)-Logarithmic and Trigonometric Tables (to five places of decimals). 8vo. 28. net E. ARNOLD, Jan. 05",J. B. Dale,['Dale (J. B.)'],,Jan. 05,1905,
"Dale (R. W.) Atonement. Congregational Union Lecture for 187s. 24th edit. 12mo. 63 × 4, pp. 556, 2s. 6d. net .........! ..T. LAW, Sep. 05",Dale,R. W.,Atonement,T. LAW,,12mo.,"Dale (R. W.) Atonement. Congregational Union Lecture for 1875. 24th edit. 12mo. 63 × 4, pp. 556, 2s. 6d. net .........! ..T. LAW, Sep. 05",R. W. Dale,['Dale (R. W.)'],,Sep. 05,1905,
"Dale (T. F.)-Polo, Past and Present. 8vo. 9×5, pp. 586, 12s. 6d. net (Country Life' Library of Sport) …………………….NEWNES, May 05",Dale,T. F.,"Polo, Past and Present",NEWNES,,8vo.,"Dale (T. F.)-Polo, Past and Present. 8vo. 9×5, pp. 586, 12s. 6d. net (Country Life' Library of Sport) …………………….NEWNES, May 05",T. F. Dale,['Dale (T. F.)'],,May 05,1905,
"Dalkeith (Lena)-Little Plays. Pictures of Little Actors from Photographs. 16mo. 6 x 4, pp. 124, 1s. 6d. net; bds. 1s. net (Told to the Children Series) …………..JACK, Nov. 05",Dalkeith,Lena,Little Plays,JACK,,16mo.,"Dalkeith (Lena)-Little Plays. Pictures of Little Actors from Photographs. 16mo. 6 x 4, pp. 124, 1s. 6d. net; bds. 1s. net (Told to the Children Series) …………..JACK, Nov. 05",Lena Dalkeith,['Dalkeith (Lena)'],,Nov. 05,1905,
"Daly (H.)-Memoirs of General Sir Henry Dermot Daly. 8vo. 8 × 5, pp. 400, 158. net J. MURRAY, Dec. 05",Daly,H.,Memoirs of General Sir Henry Dermot Daly,J. MURRAY,,8vo.,"Daly (H.)-Memoirs of General Sir Henry Dermot Daly. 8vo. 8 × 5, pp. 400, 158. net J. MURRAY, Dec. 05",H. Daly,['Daly (H.)'],,Dec. 05,1905,
"Darlington's Devon and Cornwall. 12mo. 58. SIMPKIN, Sep. 05",,,Darlington's Devon and Cornwall,SIMPKIN,,12mo.,"Darlington's Devon and Cornwall. 12mo. 58. SIMPKIN, Sep. 05",,,,Sep. 05,1905,
"Darwin (C.)-Variation of Animals and Plants under Domestication. Edit. by Francis Darwin. Pop. edit. 2 vols. Cr. 8vo. 8×5, pp. 582, 618, 5s. net …………………………………..J. MURRAY, Feb. 05",Darwin,C.,Variation of Animals and Plants under Domestication,J. MURRAY,,8vo.,"Darwin (C.)-Variation of Animals and Plants under Domestication. Edit. by Francis Darwin. Pop. edit. 2 vols. Cr. 8vo. 8×5, pp. 582, 618, 5s. net …………………………………..J. MURRAY, Feb. 05",C. Darwin,['Darwin (C.)'],,Feb. 05,1905,
"Davey (J. W.)-Fall of Torngak, or Moravian Mission on the Coast of Labrador. Cr. 8vo. 2s. 6d. net ………..PARTRIDGE, May 05",Davey,J. W.,"Fall of Torngak, or Moravian Mission on the Coast of Labrador",PARTRIDGE,,8vo.,"Davey (J. W.)-Fall of Torngak, or Moravian Mission on the Coast of Labrador. Cr. 8vo. 2s. 6d. net ………..PARTRIDGE, May 05",J. W. Davey,['Davey (J. W.)'],,May 05,1905,
"Davidson (Gladys)-Outline Text Lessons for Junior Classes. 1st Series. 12mo. 6 x 4, pp. 128, 18. …………………………..J. CLARKE, Apr. 05",Davidson,Gladys,Outline Text Lessons for Junior Classes,J. CLARKE,,12mo.,"Davidson (Gladys)-Outline Text Lessons for Junior Classes. 1st Series. 12mo. 6 x 4, pp. 128, 18. …………………………..J. CLARKE, Apr. 05",Gladys Davidson,['Davidson (Gladys)'],,Apr. 05,1905,
"Davidson (J.) — Theatrocrat. Tragic Play of Church and Stage. Cr. 8vo. 74 × 5, pp. 204, 5s. net ………………..RICHARDS, Nov. 05",Davidson,J.,Theatrocrat,RICHARDS,,8vo.,"Davidson (J.) — Theatrocrat. Tragic Play of Church and Stage. Cr. 8vo. 74 × 5, pp. 204, 5s. net ………………..RICHARDS, Nov. 05",J. Davidson,['Davidson (J.)'],,Nov. 05,1905,
"Davis (C. H.)-Address to the Congregational Church at Petworth on Nov. 13, 1904. 8vo. pp. 14.........(Newport, I.W.) J. H. BURGESS, Jan. 05",Davis,C. H.,Address to the Congregational Church at Petworth on Nov,J. H. BURGESS,,8vo.,"Davis (C. H.)-Address to the Congregational Church at Petworth on Nov. 13, 1904. 8vo. pp. 14.........(Newport, I.W.) J. H. BURGESS, Jan. 05",C. H. Davis,['Davis (C. H.)'],,Jan. 05,1905,
"Davis (H. W. C.)-England under the Normans and Angevins, 1066-1272. 8vo. 9 x 5, pp. 600, 10s. 6d. net ………………………………………………….....METHUEN, Nov. 05",Davis,H. W. C.,England under the Normans and Angevins,METHUEN,,8vo.,"Davis (H. W. C.)-England under the Normans and Angevins, 1066-1272. 8vo. 9 x 5, pp. 600, 10s. 6d. net ………………………………………………….....METHUEN, Nov. 05",H. W. C. Davis,['Davis (H. W. C.)'],,Nov. 05,1905,
"Davis (J. D.)-Rev. Joseph Hardy Neesima. A maker of Japan. Illus. Cr. 8vo. 74 × 5, pp. 156, 3s. net........ …..REVELL, Apr. 05",Davis,J. D.,Rev,REVELL,,8vo.,"Davis (J. D.)-Rev. Joseph Hardy Neesima. A maker of Japan. Illus. Cr. 8vo. 74 × 5, pp. 156, 3s. net........ …..REVELL, Apr. 05",J. D. Davis,['Davis (J. D.)'],,Apr. 05,1905,
"Dawson (S. E.)-Saint Lawrence Basin and its Border Lands. Re-issue. 8vo. 9 × 5, pp. 492, 78. 6d. net …………………………………..ALSTON RIVERS, Oct. 05",Dawson,S. E.,Saint Lawrence Basin and its Border Lands,ALSTON RIVERS,,8vo.,"Dawson (S. E.)-Saint Lawrence Basin and its Border Lands. Re-issue. 8vo. 9 × 5, pp. 492, 78. 6d. net …………………………………..ALSTON RIVERS, Oct. 05",S. E. Dawson,['Dawson (S. E.)'],,Oct. 05,1905,
"Day Book of Melisande. From December to December. Cr. 8vo. 7 × 53, pp. 222, 53.00 MURRAY, Oct. 05",,,Day Book of Melisande,MURRAY,,8vo.,"Day Book of Melisande. From December to December. Cr. 8vo. 7 × 53, pp. 222, 53.00 MURRAY, Oct. 05",,,,Oct. 05,1905,
"Deane (A. B.)-Licensed Victuallers' Official Annual, 1904. 8vo. 18. net.........OFFICE, Jan. 05",Deane,A. B.,Licensed Victuallers' Official Annual,OFFICE,,8vo.,"Deane (A. B.)-Licensed Victuallers' Official Annual, 1904. 8vo. 18. net.........OFFICE, Jan. 05",A. B. Deane,['Deane (A. B.)'],,Jan. 05,1905,
"Dearmer (P.)-Sanctuary. Book for Communi- cants. Designed as Companion to Book of Common Prayer, &c. 18mo. 1s. 4d. net; lthr. 2s. net; with Prayer Book, 28. net RIVINGTONS, Oct. 05",Dearmer,P.,Sanctuary,RIVINGTONS,,18mo.,"Dearmer (P.)-Sanctuary. Book for Communi- cants. Designed as Companion to Book of Common Prayer, &c. 18mo. 1s. 4d. net; lthr. 2s. net; with Prayer Book, 28. net RIVINGTONS, Oct. 05",P. Dearmer,['Dearmer (P.)'],,Oct. 05,1905,
"Defoe (D.)-Life and Strange Surprising Adven- tures of Robinson Crusoe of York, Mariner. Illus. by J. A. Symington. Cr. 8vo. 8x 53, pp. 480, 5s. net... ……………………..DENT, Oct. 05",Defoe,D.,"Life and Strange Surprising Adven- tures of Robinson Crusoe of York, Mariner",DENT,,8vo.,"Defoe (D.)-Life and Strange Surprising Adven- tures of Robinson Crusoe of York, Mariner. Illus. by J. A. Symington. Cr. 8vo. 8x 53, pp. 480, 5s. net... ……………………..DENT, Oct. 05",D. Defoe,['Defoe (D.)'],,Oct. 05,1905,
"Defoe (D.) - Robinson Crusoe. Cr. 8vo. 2s. (Standard Lib.)…………………………………………………..BLACKIE, Jan. 05",Defoe,D.,Robinson Crusoe,BLACKIE,,8vo.,"Defoe (D.) - Robinson Crusoe. Cr. 8vo. 2s. (Standard Lib.)…………………………………………………..BLACKIE, Jan. 05",D. Defoe,['Defoe (D.)'],,Jan. 05,1905,
"Defoe (D.)-Robinson Crusoe. 12mo. pp. 518, 1s.. net (Harmsworth Lib.) AMALGAMATED PRESS, Dec. 05",Defoe,D.,Robinson Crusoe,AMALGAMATED PRESS,,12mo.,"Defoe (D.)-Robinson Crusoe. 12mo. pp. 518, 1s.. net (Harmsworth Lib.) AMALGAMATED PRESS, Dec. 05",D. Defoe,['Defoe (D.)'],,Dec. 05,1905,
"Dehérain (H.)-L'Expansion des Boers au XIXe Siècle. 12mo. 74 × 4, pp. 483, 8 fr. 50 (Paris) HACHETTE, June 05",Dehérain,H.,L'Expansion des Boers au XIXe Siècle,HACHETTE,,12mo.,"Dehérain (H.)-L'Expansion des Boers au XIXe Siècle. 12mo. 74 × 4, pp. 483, 8 fr. 50 (Paris) HACHETTE, June 05",H. Dehérain,['Dehérain (H.)'],,June 05,1905,
"Dekker (T.)-Gull's Hornbook and Belman of London. 12mo. 6×3, pp. 292, 1s. 6d. net; 1thr. 28. net (Temple Classics)......DENT, Jan. 05",Dekker,T.,Gull's Hornbook and Belman of London,DENT,,12mo.,"Dekker (T.)-Gull's Hornbook and Belman of London. 12mo. 6×3, pp. 292, 1s. 6d. net; 1thr. 28. net (Temple Classics)......DENT, Jan. 05",T. Dekker,['Dekker (T.)'],,Jan. 05,1905,
"Dene (Roma)-The Curse: and it was so. Cr. 8vo. 7×43, pp. 128, 3s. 6d……….... ..DRANE, Nov. 05",Dene,Roma,The Curse: and it was so,DRANE,,8vo.,"Dene (Roma)-The Curse: and it was so. Cr. 8vo. 7×43, pp. 128, 3s. 6d……….... ..DRANE, Nov. 05",Roma Dene,['Dene (Roma)'],,Nov. 05,1905,
"Denney (E. E.), Roberts (P. Lyddon-)-Key to Common Errors in Language (Written and Spoken). 12mo. swd. 6d. net (Normal Tut. Series) ………………………………….SIMPKIN, May 05",,,Key to Common Errors in Language (Written and Spoken),SIMPKIN,,12mo.,"Denney (E. E.), Roberts (P. Lyddon-)-Key to Common Errors in Language (Written and Spoken). 12mo. swd. 6d. net (Normal Tut. Series) ………………………………….SIMPKIN, May 05",,"['Denney (E. E.), Roberts (P. Lyddon-)']",,May 05,1905,
"Desmond (G. G.)-Stoat Pack. Illus. by 1vor J. Symes. 4to. 8 x 64, pp. 160, 58. ALSTON RIVERS, Oct. 05",Desmond,G. G.,Stoat Pack,ALSTON RIVERS,,4to.,"Desmond (G. G.)-Stoat Pack. Illus. by Ivor J. Symes. 4to. 8 x 64, pp. 160, 58. ALSTON RIVERS, Oct. 05",G. G. Desmond,['Desmond (G. G.)'],,Oct. 05,1905,
"Devenish (E. M.)-Wandering of Joyce. Novel. Cr. 8vo. 73 × 5, pp. 872, 68....DUCKWORTH, Oct. 05",Devenish,E. M.,Wandering of Joyce,DUCKWORTH,,8vo.,"Devenish (E. M.)-Wandering of Joyce. Novel. Cr. 8vo. 73 × 5, pp. 872, 68....DUCKWORTH, Oct. 05",E. M. Devenish,['Devenish (E. M.)'],,Oct. 05,1905,
"Deville (G.)-People's Marx. Popular Epitome of Karl Marx's 'Capital.' Cr. 8vo. 6s. net (Inter- national Lib.)………………………………. ………………………….K. PAUL, Feb. 05",Deville,G.,People's Marx,K. PAUL,,8vo.,"Deville (G.)-People's Marx. Popular Epitome of Karl Marx's 'Capital.' Cr. 8vo. 6s. net (Inter- national Lib.)………………………………. ………………………….K. PAUL, Feb. 05",G. Deville,['Deville (G.)'],,Feb. 05,1905,
"Dhara (Sri Brahma)-' Shower from the Highest,' through favour of Mahatma Sri Agamya Guru Paramahamsa. Cr. 8vo. 3s. 6d. net net LUZAC, Sep. 05",Dhara,Sri Brahma,"Shower from the Highest,' through favour of Mahatma Sri Agamya Guru Paramahamsa",LUZAC,,8vo.,"Dhara (Sri Brahma)-' Shower from the Highest,' through favour of Mahatma Sri Agamya Guru Paramahamsa. Cr. 8vo. 3s. 6d. net net LUZAC, Sep. 05",Sri Brahma Dhara,['Dhara (Sri Brahma)'],,Sep. 05,1905,
"Dick (S.)-Arts and Crafts of Old Japan. Roy. 16mo. 74 × 54, pp. 164, swd. 28. net FOULIS, Oct. 05",Dick,S.,Arts and Crafts of Old Japan,FOULIS,,16mo.,"Dick (S.)-Arts and Crafts of Old Japan. Roy. 16mo. 74 × 54, pp. 164, swd. 28. net FOULIS, Oct. 05",S. Dick,['Dick (S.)'],,Oct. 05,1905,
"Dickens (C.)-Barnaby Rudge. Illus. Pocket Edit. 12mo. 7 x 41, pp. 618, 28. net; lthr. Ss. net MACMILLAN, June 05",Dickens,C.,Barnaby Rudge,MACMILLAN,,12mo.,"Dickens (C.)-Barnaby Rudge. Illus. Pocket Edit. 12mo. 7 x 41, pp. 618, 28. net; lthr. Ss. net MACMILLAN, June 05",C. Dickens,['Dickens (C.)'],,June 05,1905,
"Dickens (C.)-Life and Adventures of Martin Chuzzlewit. Illus. Pocket Edit. 12mo. 7 × 41, pp. 880, 2s. net; lthr. 38. net MACMILLAN, June 05",Dickens,C.,Life and Adventures of Martin Chuzzlewit,MACMILLAN,,12mo.,"Dickens (C.)-Life and Adventures of Martin Chuzzlewit. Illus. Pocket Edit. 12mo. 7 × 41, pp. 880, 2s. net; lthr. 38. net MACMILLAN, June 05",C. Dickens,['Dickens (C.)'],,June 05,1905,
"Dickens (C.)-Sketches by Boz. Illus. Pocket Edit. 12mo. 7 x 44, pp. 488, 28. net; lthr. 88. net MACMILLAN, July 05",Dickens,C.,Sketches by Boz,MACMILLAN,,12mo.,"Dickens (C.)-Sketches by Boz. Illus. Pocket Edit. 12mo. 7 x 44, pp. 488, 28. net; lthr. 88. net MACMILLAN, July 05",C. Dickens,['Dickens (C.)'],,July 05,1905,
"Dickens (C.)-Tale of Two Cities. Illus. Cr. 8vo. 7×5, pp. 382, 2s. net; lthr. 88. net (Lib. of Modern Classics)............LONG, Dec. 05",Dickens,C.,Tale of Two Cities,LONG,,8vo.,"Dickens (C.)-Tale of Two Cities. Illus. Cr. 8vo. 7×5, pp. 382, 2s. net; lthr. 88. net (Lib. of Modern Classics)............LONG, Dec. 05",C. Dickens,['Dickens (C.)'],,Dec. 05,1905,
"Diplomatic and Consular Reports-Corea, 11d.; Persian Gulf, 4 d. WYMAN, June 05",,,Diplomatic and Consular Reports-Corea,WYMAN,,,"Diplomatic and Consular Reports-Corea, 11d.; Persian Gulf, 4 d. WYMAN, June 05",,,,June 05,1905,
"Diplomatic and Consular Reports-Finances of Belgium, 1904-5, No. 8325, 1d.; Trade of Den- mark in 1903, No. 3824, d. ...WYMAN, Feb. 05",,,Diplomatic and Consular Reports-Finances of Belgium,WYMAN,,,"Diplomatic and Consular Reports-Finances of Belgium, 1904-5, No. 8325, 1d.; Trade of Den- mark in 1903, No. 3824, d. ...WYMAN, Feb. 05",,,,Feb. 05,1905,
"Diplomatic and Consular Reports-Lyons, St. Etienne and Grenoble, 1d.; Palestine, 14d. -- WYMAN, June 05",,,"Diplomatic and Consular Reports-Lyons, St",WYMAN,,,"Diplomatic and Consular Reports-Lyons, St. Etienne and Grenoble, 1d.; Palestine, 14d. -- WYMAN, June 05",,,,June 05,1905,
"Diplomatic and Consular Reports-United States Railways, 24d; Tea Cultivation in the Cauca- sus, d. ..WYMAN, Feb. 05",,,Diplomatic and Consular Reports-United States Railways,WYMAN,,,"Diplomatic and Consular Reports-United States Railways, 24d; Tea Cultivation in the Cauca- sus, d. ..WYMAN, Feb. 05",,,,Feb. 05,1905,
"Dishes Easily Cooked: 'Little Mary's' Up-to- date. Cr. 8vo. 7 × 43, pp. 78, 1s. 6d. net net SIMPKIN, Mar. 05",,,Dishes Easily Cooked: 'Little Mary's' Up-to- date,SIMPKIN,,8vo.,"Dishes Easily Cooked: 'Little Mary's' Up-to- date. Cr. 8vo. 7 × 43, pp. 78, 1s. 6d. net net SIMPKIN, Mar. 05",,,,Mar. 05,1905,
"Dixon (H. N.)-Student's Handbook of British Mosses. With Illus. and Keys to the Genera and Species by H. G. Jameson. Rev. edit. 8vo. 65 pl. pp. 560, 18s. 6d. net ......... (Eastbourne) V. T. SUMFIELD, Apr. 05",Dixon,H. N.,Student's Handbook of British Mosses,V. T. SUMFIELD,,8vo.,"Dixon (H. N.)-Student's Handbook of British Mosses. With Illus. and Keys to the Genera and Species by H. G. Jameson. Rev. edit. 8vo. 65 pl. pp. 560, 18s. 6d. net ......... (Eastbourne) V. T. SUMFIELD, Apr. 05",H. N. Dixon,['Dixon (H. N.)'],,Apr. 05,1905,
"Dixon, jun. (T.)-Clansman: Historical Romance of Ku Klux Klan. Illus. Cr. 8vo. 74 × 41, pp. 386, 68. ...HEINEMANN, Feb. 05","Dixon, jun.",T.,Clansman: Historical Romance of Ku Klux Klan,HEINEMANN,,8vo.,"Dixon, jun. (T.)-Clansman: Historical Romance of Ku Klux Klan. Illus. Cr. 8vo. 74 × 41, pp. 386, 68. ...HEINEMANN, Feb. 05","T. Dixon, jun.","['Dixon, jun. (T.)']",,Feb. 05,1905,
